id,created_at,text
1247323113815146497,2020-04-07 00:39:39,Our prayers are with the family of State Sen. Jack Hill. Jack was a good friend and former colleague who tirelessly fought for Georgians. He was the longest-serving member of the State Senate and a 33-year veteran of the Georgia Air National Guard. Jack will be greatly missed. https://t.co/iadCgGDPbK
1246242917242503170,2020-04-04 01:07:20,"What kind of message does this send to other commanding officers, @EsperDoD, @USNavy, @SECNAV?"
1246234644284047364,2020-04-04 00:34:27,"CAPT Crozier has faithfully served the American people and his sailors. As best I can tell, his only intent was to protect his crew. I am thankful for his service. Cc:@USNavy (3/3)"
1246234643319439361,2020-04-04 00:34:27,"According to @SECNAV, “I know that in my heart and in the heart and mind of this particular officer, every single thing that he was doing was [with] the best interests of the crew in mind, for their lives and their safety.” (2/3)"
1246234642413469697,2020-04-04 00:34:27,".@EsperDoD, History will treat CAPT Crozier favorably, not so sure about Acting @SECNAV who chose to remove him. (1/3)"
1246095541735432192,2020-04-03 15:21:43,"Rural hospitals are a lifeline for millions. That’s why I joined over 120 of my colleagues in stressing the importance of supporting our rural hospitals &amp; prioritizing funding &amp; the resources they need to stay afloat, treat patients, &amp; combat the spread of COVID-19. More below: https://t.co/TAoPx8ARXz"
1245824982183264258,2020-04-02 21:26:36,RT @IRSnews: Social Security beneficiaries who are not typically required to file tax returns will not need to file to receive an economic…
1245785970479370240,2020-04-02 18:51:35,"Also, please be sure to sign-up for my email updates by clicking here: https://t.co/rDFQagbD8C"
1245785968487120896,2020-04-02 18:51:35,"Over the last month, Congress has worked to provide resources for small businesses negatively impacted by the COVID-19 outbreak. You can find a list of those resources and how to apply on my website by clicking here: https://t.co/5Z5sYF8hIO https://t.co/TwmNBLFjzO"
1244698310969040912,2020-03-30 18:49:37,"Thank you to our #GA08 doctors, nurses, first responders, &amp; all health care professionals working around the clock to combat the coronavirus &amp; treat patients. America is the greatest country in the world &amp; the best equipped to handle this crisis. We’ll get through this together. https://t.co/TFeOgrtlhV"
1243645161743278082,2020-03-27 21:04:47,"RT @realDonaldTrump: I just signed the CARES Act, the single biggest economic relief package in American History – twice as large as any re…"
1243628356521922561,2020-03-27 19:58:00,"My offices will continue to work with state &amp; local officials to ensure GA has the resources we need. America is the greatest country in the world &amp; the best prepared to handle a crisis like this, &amp; we'll get through this by working together. #GA08 https://t.co/jHBcKJ5JIJ"
1243628355125215233,2020-03-27 19:58:00,"A coronavirus stimulus package is now on its way to @realDonaldTrump's desk to be signed into law. While this certainly isn’t a perfect bill, this package will provide vital resources to health care facilities, businesses, &amp; American families during this public health emergency."
1242505054202073090,2020-03-24 17:34:24,"This year on #NationalAgDay, we are especially thankful for our farmers and their tireless work to keep our country’s food supply chain robust during this time. Please join me today in thanking our Georgia farmers for the critical work they do each and every day. #GA08 https://t.co/MHsbIjrSnw"
1241031125348298752,2020-03-20 15:57:32,"At President Trump’s direction, Treasury Secretary Steven Mnuchin has announced that the tax filing deadline will be extended to July 15. Treasury is still asking those who can file by the typical April 15th deadline to please do so. https://t.co/2rZ4wn8tMy"
1241023411188621314,2020-03-20 15:26:52,"RT @Georgia_AG: Our Consumer Protection Division is warning consumers about ads, promotions &amp; websites that claim their products can treat,…"
1241011034539909129,2020-03-20 14:37:42,"This week, I had the chance to help “Peanut Butter &amp; Jesus” &amp; local teachers deliver bagged lunches to children in our community impacted by school closures. I’m proud to serve a Congressional District where you see this kind of support in every community. #GA08 https://t.co/HMFslZglxe"
1240643423578861573,2020-03-19 14:16:56,"Yesterday, I visited @secondharvest &amp; packed boxes for our South GA neighbors unable to restock essentials. SHSG is also partnering w/ schools to help provide meals to children affected by closures. I’m thankful for our community partners &amp; their unwavering support to Georgians. https://t.co/4gCdNyDX9C"
1240383930336935942,2020-03-18 21:05:48,RT @HouseAgGOP: Thank you to our nation’s everyday heroes! 🇺🇸 https://t.co/3laZ3IRZLd
1240030963721277441,2020-03-17 21:43:15,"RT @RepDougCollins: As we continue the fight against #COVIDー19, we must ensure Americans have access to the food they need.

Read the lette…"
1239993088032026626,2020-03-17 19:12:44,"In addition, @USDA would like to hear from farmers with ag labor concerns by emailing AgLabor@USDA.gov or through https://t.co/WEV6grnvs7. Rest assured that I'll continue to raise this to the highest levels of government to ensure we have the labor we need on our farms. (2/2)"
1239993086341779456,2020-03-17 19:12:44,"Yesterday, the U.S. embassy &amp; consulate in Mexico announced that they would suspend visa services beginning March 18 due to #coronavirus, but today they issued an update that they would continue to process returning H2 worker visas. (1/2) #GA08"
1239983813180239873,2020-03-17 18:35:53,The State of Georgia has set up a new #coronavirus hotline that Georgians can call with questions – (844) 442-2681. #GA08 https://t.co/R2KNVB4nV9
1239907066199891969,2020-03-17 13:30:55,RT @GeorgiaFootball: A Greater Mission | A message from @KirbySmartUGA https://t.co/n62U9xrvz4
1239902664860659712,2020-03-17 13:13:26,RT @GeorgiaEMA: You don't necessarily have to stay in your house to practice social distancing. Check out the graphic for examples of activ…
1239623717422071809,2020-03-16 18:44:59,RT @CDCgov: All healthcare providers &amp; staff play a vital role to protect patients &amp; personnel against #COVID19 &amp; possible wider community…
1238605100010127361,2020-03-13 23:17:22,"RT @realDonaldTrump: It is my great honor to declare Sunday, March 15th as a National Day of Prayer. We are a Country that, throughout our…"
1238595214702514177,2020-03-13 22:38:05,"RT @GovKemp: .@GovKemp: Public Health Emergency in Georgia Effective Tomorrow

Read more: https://t.co/wbm1r88SyW #COVID19 #gapol"
1238548304885166082,2020-03-13 19:31:41,RT @WhiteHouse: LIVE: President @realDonaldTrump holds a news conference https://t.co/D975UkADhj
1238205939565674497,2020-03-12 20:51:15,"RT @HouseGOP: For the latest information from the @WhiteHouse Coronavirus Task Force on how to keep your home, school, business, and commun…"
1237882394532696066,2020-03-11 23:25:36,"Tonight at 9:00 pm ET, President Trump will address the nation from the Oval Office on the coronavirus. You can watch live at the link below. https://t.co/FuwpWtOXJ4"
1237788896055963648,2020-03-11 17:14:04,"On April 9 at 9AM, @USTradeRep will host a field hearing in Valdosta in #GA08 to discuss foreign trade policies that may be harming American growers of seasonal &amp; perishable produce. You can find more info on how to participate &amp; submit comments here: https://t.co/FKXbQ4ud2o"
1237403702777921536,2020-03-10 15:43:27,"RT @American_Hort: Special thanks to @AustinScottGA08, @RepSchrader, and the 31 other members who joined this letter for their tireless wor…"
1237104752439300096,2020-03-09 19:55:31,"RT @usairforce: While supporting other government agencies’ response to the #COVID19 threat, the Department of the Air Force is responding…"
1237001684867592192,2020-03-09 13:05:58,"Mine and Vivien’s thoughts remain with Tom, Julie, &amp; the entire Graves family during this time. Praying for a speedy recovery. https://t.co/Weiv8bKj19"
1236004553788702721,2020-03-06 19:03:44,"March is #NationalPeanutMonth, a time to recognize how it contributes to not only our state’s economy but also our ability to feed those all over the world. When you visit one of my offices, grab a bag or two, &amp; please be sure to thank a GA peanut farmer this month. 🥜🥜🥜 #GA08 https://t.co/jFn414Dc49"
1235945214960902144,2020-03-06 15:07:56,"Next week, staff from our district offices will be holding mobile offices in Moultrie, Sylvester, McRae, Fitzgerald, Nashville &amp; Adel to offer assistance w/ Medicare, Social Security, veterans' benefits &amp; other federal issues. More info here: https://t.co/RT7s0S6VFq #GA08 https://t.co/Lw6AtprIWe"
1235587932922228737,2020-03-05 15:28:13,"Yesterday, @SecretarySonny testified before #HouseAg on the State of the Rural Economy. During the hearing, I stressed the need for reforming crop insurance &amp; disaster assistance programs to enhance the farm safety net. You can watch our exchange here: https://t.co/C0kHrTnzLQ"
1235257426263277568,2020-03-04 17:34:55,That's why @RepLoisFrankel &amp; I have introduced the Consumer Protection and Fuel Transparency Act (H.R.1024) You can read more at the link below. (2/2) https://t.co/ItMoEttVDo
1235257425143508992,2020-03-04 17:34:54,"I welcome the expansion of E15 in the marketplace, but we need to warn consumers that putting E15 into their boats, motorcycles, pre-2001 model year vehicles &amp; outdoor power equipment can cause corrosion &amp; mechanical problems. (1/2) https://t.co/U6xoSUy9cP"
1235244617022533633,2020-03-04 16:44:01,RT @GOPLeader: Congress should've already passed a funding bill to combat coronavirus. Period. But Democrats are hellbent on sneaking in el…
1235235431123386370,2020-03-04 16:07:31,RT @HouseAgGOP: Full committee hearing with @SecretarySonny is now underway https://t.co/fxDLppigGX https://t.co/vtMipeRyYA
1234844816875368448,2020-03-03 14:15:21,My offices are continuing to monitor the #coronavirus illness and will be sure to provide updates as needed. You can find more information on the coronavirus on @CDCgov's website at https://t.co/Zz4tQAh7zP. (4/4) #GA08
1234844815231246336,2020-03-03 14:15:20,"Symptoms of #coronavirus may appear 2-14 days after exposure and can include fever, cough, and shortness of breath. If you have been to China or another impacted country within the last two weeks and develop symptoms, contact your health care provider immediately. (3/4) https://t.co/ZLqsgqoq0A"
1234844813884821504,2020-03-03 14:15:20,"The @CDCgov recommends everyday preventive actions, including thoroughly washing your hands, avoiding close contact with people who are sick, and avoiding touching your eyes, nose and mouth. (2/4) https://t.co/nOo1CpQLrR"
1234844813205426178,2020-03-03 14:15:20,"As coronavirus (also known as COVID-19) continues to spread outside of its area of origin in China, I wanted to share some information that may be helpful on how to detect and prevent the spread of this respiratory illness. (1/4)"
1234568622280003584,2020-03-02 19:57:51,"I appreciate @GovKemp meeting with me this morning. We discussed issues impacting #GA08, including ongoing Hurricane Michael recovery efforts. I appreciate Gov. Kemp’s leadership &amp; friendship, &amp; I look forward to continuing to work with him to tackle big issues impacting GA. https://t.co/kwncHV9etr"
1234489893503541248,2020-03-02 14:45:00,"RT @HouseGOP: House Republicans are working with the @WhiteHouse to aggressively respond to the #COVID19 threat.
 
We must put the health a…"
1233144695125159948,2020-02-27 21:39:40,"RT @GovKemp: It’s been a long, hard road for Southwest Georgia and our state’s farm families. Yesterday, we celebrated one of the final ste…"
1233131045878403072,2020-02-27 20:45:26,"Yesterday during a HASC hearing on the FY21 DoD budget request, I stressed the importance of maintaining existing critical platforms (like A-10s &amp; JSTARS) while new technologies &amp; aircraft are still being developed, implemented &amp; proven effective. WATCH: https://t.co/gP4UPpq1G6"
1232823203468279809,2020-02-27 00:22:11,"I’d like to thank @GovKemp, @SecretarySonny, &amp; GA Ag Commissioner Gary Black for their unwavering commitment to fighting for these block grants.

Enrollment runs from March 18 to April 8, 2020 and is only available online at the link below. #GA08 https://t.co/XdV2WbTs7K"
1232387666953560064,2020-02-25 19:31:31,"Students from Brookwood School in Thomasville are in DC this week, &amp; this morning I was honored to speak with them about the federal government &amp; my role as their Congressman. Very bright young men &amp; women &amp; future leaders of our state. #GA08 https://t.co/RcV5jGH637"
1232014360089972736,2020-02-24 18:48:07,RT @HouseAgGOP: Happy National FFA Week from #HouseAg! https://t.co/LjvztmTzsB
1230160031657623563,2020-02-19 15:59:41,Do you need help with a federal agency and are unable to make it to the Tifton or Warner Robins offices? Staff from my district offices will be traveling around #GA08 to offer constituents assistance with a number of federal issues. You can find info here: https://t.co/RT7s0S6VFq
1229460936148254722,2020-02-17 17:41:44,"Today, we honor our country’s presidents who have preserved our freedoms and made the United States the greatest country in the world. #PresidentsDay 🇺🇸🇺🇸🇺🇸 https://t.co/yca3xgurBo"
1228364766349058048,2020-02-14 17:05:56,"Happy Valentine's Day to everyone in Middle and South Georgia, especially my wonderful wife, Vivien. #ValentinesDay https://t.co/qIlrltODEz"
1227263024307851264,2020-02-11 16:08:01,"RT @ForestandPaper: Thank you, @AustinScottGA08 for your membership in the Paper and Packaging Caucus, and for meeting with members of the…"
1225789902278795266,2020-02-07 14:34:21,"RT @HouseGOP: BREAKING → Last month 225,000 jobs were created, crushing expectations. 

Democrats won’t admit it — or clap for it 👏 —but Pr…"
1225461259425976321,2020-02-06 16:48:26,RT @NWSAtlanta: [11:45 AM Thurs] The threat for severe weather is expected to impact much of middle Georgia this afternoon. Damaging winds…
1225183957253312513,2020-02-05 22:26:32,"The Senate just voted to acquit @realDonaldTrump &amp; proved what we’ve been saying all along – there were no facts nor evidence to support impeachment.

I've asked from the beginning, ""What was the crime?"" The U.S. Senate has just answered that question. There wasn’t one. (2/2) https://t.co/i3i0p1dqNi"
1225183953834926082,2020-02-05 22:26:32,"For months, House Democrats wasted time &amp; taxpayer resources on a partisan impeachment process against @realDonaldTrump fueled by their hatred for him. (1/2)"
1224913167643500544,2020-02-05 04:30:31,"This evening, @realDonaldTrump reiterated that the state of our union is strong 🇺🇸🇺🇸🇺🇸:
✔️Our economy continues to grow
✔️More Americans are back-to-work
✔️U.S. workers, farmers, &amp; businesses have a more level playing field in our global markets

#SOTU https://t.co/53KIxH3mfA"
1224718076463263746,2020-02-04 15:35:18,"This evening, @realDonaldTrump will deliver the #SOTU2020. I look forward to the President addressing our growing economy and continuing to bolster our national defense. You can watch it live on a local news station, a national news station, or at https://t.co/8IuxrUe0EM. https://t.co/dsigiKNk69"
1222567436559536129,2020-01-29 17:09:25,"Great being at the @WhiteHouse for the signing of #USMCA. It is truly a new era for American businesses, &amp; I look forward to continuing to work with @realDonaldTrump &amp; my colleagues in Congress to open new markets &amp; opportunities for our economy to grow and thrive. https://t.co/m5cuVPkV8G"
1222243760999936000,2020-01-28 19:43:15,".@realDonaldTrump was elected to tackle some of the biggest challenges our nation &amp; world face. It’s my hope that this plan will achieve peace, security, &amp; prosperity for Israel &amp; the Palestinian people. Thank you for your commitment to Israel &amp; securing peace in the Middle East. https://t.co/R5ZkbOlBbR"
1221484831323848706,2020-01-26 17:27:32,"On Thursday, I joined local community leaders &amp; reps from @CocaColaUnited at the groundbreaking of a new $60M facility in Tifton, which will create 200 new jobs. For more than 100 yrs, @CocaCola has been a staple brand of our state, &amp; now it will be a staple employer in South GA. https://t.co/qsOr6KyDw4"
1220733964945698816,2020-01-24 15:43:52,"If you’re a #GA08 constituent in town for the #MarchForLife, I hope you’ll stop by my office in the Rayburn Building today to warm up with a Coca-Cola product and some Georgia peanuts.

God Bless."
1220733963821514752,2020-01-24 15:43:51,"Today, President Trump will become the first sitting U.S. president to speak at the #MarchForLife. You can watch his  remarks LIVE at noon ET here: https://t.co/iCdnITdEwN."
1220733962848538625,2020-01-24 15:43:51,"Today, thousands from across our country will come together in DC to participate in the #MarchForLife. I want to say a special thank you to those participating in the march today &amp; to @nrlc &amp; other pro-life groups for your commitment to standing up for the lives of the unborn. https://t.co/jRfBYfLdsa"
1220452204064264192,2020-01-23 21:04:15,We can protect our natural resources without infringing on the rights of millions of Americans. I look forward to seeing the positive economic and conservation impacts of this new #WOTUS rule. https://t.co/1wNgvKL0Uk
1220363957938073601,2020-01-23 15:13:35,"4th graders at JT Reddick Elementary in Tifton are currently learning about the three branches of government. I joined them to talk about the federal government &amp; my role as their Congressman. Our #GA08 students are very sharp, &amp; I know the future of our state is bright. https://t.co/oohJuhbhj1"
1220056915486674945,2020-01-22 18:53:30,"RT @HouseGOP: House Democrats’ hand-picked impeachment managers have 𝗻𝗼 𝗰𝗿𝗲𝗱𝗶𝗯𝗶𝗹𝗶𝘁𝘆.
 
Look no further than their lead impeachment manager…"
1220054125758558208,2020-01-22 18:42:25,"I’m very proud to announce our winners of the 2019 Congressional App Challenge - Somtochukwu Nwagbata, Cheluchi Nwagbata, and Bayabya Joshi of Houston County High School. Their app, HCBE Alerts, is a school safety app for school staff to report and handle emergencies. #GA08 https://t.co/icecUU8gNU"
1220019916922814465,2020-01-22 16:26:29,"This week, I’ve met with the Georgia Corn Growers Association &amp; Wilcox County farmers to discuss Hurricane Michael assistance, ongoing implementation of 2018 Farm Bill programs, &amp; the positive impact @realDonaldTrump’s new trade deals will have on GA’s robust ag sector. #GA08 https://t.co/yzphBAMb43"
1219313190644977666,2020-01-20 17:38:13,"Today, we honor the life and legacy of Georgia native Dr. Martin Luther King, Jr. and his dedication to achieving equality and justice for all Americans. Rev. King remains a giant among men whose spirit and legacy continues to inspire generations. https://t.co/rFanQTTFdl"
1218925247023538176,2020-01-19 15:56:40,"We are very saddened to hear that Bonnie Duvall, wife of American Farm Bureau President Zippy Duvall, has lost her battle with cancer. Please join Vivien and I in praying for the Duvall family during this difficult time."
1217511950835470338,2020-01-15 18:20:44,"Congratulations, @realDonaldTrump, on this huge win for American farmers and businesses! 

China will purchase $200B of U.S. goods, most of which will be agricultural products. https://t.co/xqJAtZZkQP"
1215423342632669187,2020-01-10 00:01:21,"I voted NO on the resolution to strip @realDonaldTrump of a critically necessary power to defend against increasing aggression against us and our partners in the region. He had complete authority to utilize an airstrike against General Soleimani, and he made the right call. (4/4)"
1215423340875218944,2020-01-10 00:01:20,President Obama averaged six kills a week by air strikes according to his own DNI (https://t.co/XoTZDTkjpd). (3/4)
1215423339151396864,2020-01-10 00:01:20,The only reason Iran is singled out in this resolution is to take a political jab at President Trump for utilizing an airstrike to take out General Soleimani – a terrorist who was responsible for killing thousands of American and partner troops. (2/4)
1215423336492281861,2020-01-10 00:01:19,"If we want to have an honest debate about war powers, then we should have an honest debate about war powers. Why, then, did our colleagues on the other side of the aisle single out only Iran in this resolution? Why not Libya? Why not Syria? (1/4)"
1215270458054053889,2020-01-09 13:53:50,"Today is Law Enforcement Appreciation Day, a time to recognize and thank the men and women who bravely protect and serve our communities. To all our Middle and South Georgia law enforcement officers: Thank you for the important work you do each and every day. #GA08 https://t.co/e5lT3Cp7ZO"
1215005367853170688,2020-01-08 20:20:28,"Just spoke w/ @WGXAnews on Soleimani’s death &amp; last night’s attack. Soleimani was the leader of a designated terrorist org. @realDonaldTrump made the right call. If President Obama would have made the same call, @SpeakerPelosi &amp; @HouseDemocrats would be praising him for it. https://t.co/mZMR4sETxu"
1214936472123576320,2020-01-08 15:46:42,"At 11:00 am, President Trump will address the nation. You can watch LIVE here: https://t.co/FYTJPMpsUR"
1214711915953491969,2020-01-08 00:54:23,"Please keep our American and partner forces serving overseas and their families in your prayers tonight. It is 3:50 am in Iraq, and Iran has struck bases that house U.S. and partner forces with missiles."
1214332852621451265,2020-01-06 23:48:07,"I'd like to welcome the newest member of the Georgia Congressional Delegation, Sen. Kelly Loeffler. I look forward to working with @SenatorLoeffler on issues important to Georgians, including our national defense, the economy, our ag sector, and supporting President Trump. https://t.co/n3YZhwL6i5"
1213138153835520002,2020-01-03 16:40:49,"With his death, we must be prepared for any retaliatory actions and continue to work with partners to ensure stability in the region and any areas where Iran’s proxies are currently operating. (2/2)"
1213138153135054851,2020-01-03 16:40:49,"For years, Iran has used proxies to attack and kill American soldiers and our partner forces. Qassem Soleimani was the head of the Islamic Revolutionary Guard Corps- Quds Force, a designated terrorist organization, and was responsible for these attacks. (1/2)"
1212794852779462657,2020-01-02 17:56:40,"Today in 1788, GA became the 4th state admitted to the Union. For over 230 yrs, GA has played a key role in our nation’s economy, defense, culture, &amp; identity &amp; has produced musicians, presidents, astronauts, &amp; Olympians. I'm proud to be from GA &amp; proud to serve Georgians in DC. https://t.co/OoV1ITB4Xn"
