id,created_at,text
1222613269162135552,2020-01-29 20:11:33,School counselors have big responsibilities and even greater opportunities to make a difference in the lives of young people. It was a pleasure to join @ASCAtweets today with @JimLangevin to discuss the Counseling for Career Choice Act. https://t.co/52SFRW4uXo
1222566743903698944,2020-01-29 17:06:40,On Floor to remember yesterday as the anniversary of the #Challengerdisaster “The future does not belong to the faint hearted; it belongs to the brave.”  President Ronald Reagan to the nation 34 years ago as we mourned the loss of the #Challenger crew.
1222556283292864513,2020-01-29 16:25:06,"With the right policies, rural America can be just as strong as the men and women who call it home.

Today, President @realDonaldTrump signs #USMCA into law. #PromisesMadePromisesKept for farmers, ranchers, worker, and manufacturers! https://t.co/PmW1gJH97N"
1222551710524153857,2020-01-29 16:06:56,America is open for business! #USMCA https://t.co/5PqxLxifdy
1222533299257729024,2020-01-29 14:53:46,"On the Floor to discuss the signing of the #USMCA Trade Agreement by President @realDonaldTrump today at the White House.  A 21st century economy requires 21st century #trade policy.  The United States, Mexico, Canada Trade agreement delivers this.
America is open for business!"
1222203254815313920,2020-01-28 17:02:18,On the Floor to mark the 47th anniversary of #RoevWade &amp; the 60 million unborn children who have been denied the first of the basic rights - the #RightToLife                         Thank you @realDonaldTrump for being the first President to speak at the National #MarchForLife!
1222172293947850753,2020-01-28 14:59:16,"On the Floor to highlight my joining #EPA &amp; #ACE last week in #Pittsburgh announcing the #NavigableWatersProtection Rule that replaces the flawed 2015 #WOTUS Rule.
With clearly defined state/federal regulations our farmers can focus providing us the #food, fiber &amp; energy we need!"
1221948520304992256,2020-01-28 00:10:04,On Floor to observe International #HolocaustRemembrance Day commemorating the 75th Anniversary of the liberation of Auschwitz.  #NeverForget #NeverAgain
1220812745152647169,2020-01-24 20:56:54,.@HHSGov has taken a step to strengthen conscience protections for healthcare workers who object to practices like abortion on moral grounds. This is a big #ProLife victory!
1220789418073763844,2020-01-24 19:24:13,"I have great hope that life, liberty, and the pursuit of happiness will extend to all Americans, born and not yet born. The individuals who flooded the streets of DC today are a voice for the voiceless. Thank you for all that you do to support life! #WhyWeMarch https://t.co/8dNaAKGiuM"
1220723436387012608,2020-01-24 15:02:01,Service academy summer programs are a great opportunity to learn and strengthen the resumes of young people interested in a military service career. Interested in attending @WestPoint_USMA? Apply for the Summer Leaders Experience by March 15. https://t.co/2O8jLtMYiy
1220479378129391616,2020-01-23 22:52:13,"Touring #BergadFoam this afternoon in #ArmstrongCounty and then conducted a roundtable meeting with County business leaders.  
Thank you Paul Bergad for being such a great host this afternoon! #manufacturing #SmallBusiness https://t.co/dzmIDU7awx"
1220477603271847936,2020-01-23 22:45:10,"Spoke this AM in #Pittsburgh at a press conference along with #EPA Regional Director Servidio &amp; Army Corp of Engineers Lt. Colonel Jon Klink for announcement of the “Navigable Waters Protecton” rule, which provides certainty &amp; restore the regulatory limits of the #CleanWaterAct"
1220461962536136705,2020-01-23 21:43:01,@realDonaldTrump @EPA @EPAregion3 Thank you to @EPAregion3 Administrator Cosmo Servidio and @ArmyCorpsNAD LTC Jon Klink for a great #NWPR event in Pittsburgh today—and thank you to @POTUS @realDonaldTrump for his leadership on this issue! #PromisesMadePromisesKept https://t.co/tk6jrbBkxt
1220459722005979136,2020-01-23 21:34:07,"@realDonaldTrump Read my statement here on #NWPR, the new @EPA rule clarifying 'navigable waters' and read the @EPAregion3 press release here: https://t.co/B2PkkQF07n https://t.co/ZCLjWAEhKH"
1220457691858067471,2020-01-23 21:26:03,"Promises made, promises kept by @realDonaldTrump! The Navigable Waters Protection Rule will bring long-overdue clarity to the Clean Water Act, alleviating the undue burden on farmers and ranchers nationwide. #WOTUS https://t.co/70UwEVMgdz"
1220420475622510594,2020-01-23 18:58:10,"Visited the #PolkCenter yesterday in #VenangoCounty that does outstanding work serving the needs of individuals with #IntellectualDisabilities.  Met with residents &amp; staff.  Toured vocational rehabilitation programs, recreation &amp; residential areas. Thankyou for doing a great job!"
1220330716615135233,2020-01-23 13:01:30,"#TBT to the @FarmersForTrade event this past September. It's been a week since the Senate voted overwhelmingly to #PassUSMCA. This deal is a big win for rural America, especially our dairy farmers! https://t.co/RFqsRPO28G"
1220047243018997760,2020-01-22 18:15:04,The opioid epidemic has resulted in many grandparents becoming primary caregivers for their grandchildren. The Help Grandfamilies Prevent Child Abuse Act provides grandparents tools to support their grandchildren exposed to substance use disorder. Proud to co-sponsor w/ @RepMGS. https://t.co/HnuOlhWh8h
1219743079235825664,2020-01-21 22:06:26,"In the city of #Bradford #McKeanCounty meeting with the Bradford Water Authority staff, board members &amp; the Mayor to discuss progress &amp; needs.  I appreciate their leadership &amp; including me."
1219720062157889536,2020-01-21 20:34:58,Service academy summer programs are a great opportunity to learn and strengthen the resumes of young people interested in a military service career. Interested in the @USNavy? Applications for the Navy Summer Seminar are open through March 31. https://t.co/P6tNpxRukA
1219706132635189248,2020-01-21 19:39:37,"In #Kane #McKeanCounty with a stop by Bell’s Meat Market after lunch at #table105.
A great #agribusiness!"
1219374738621059080,2020-01-20 21:42:47,Observing #MLKDay this afternoon with Service &amp; Volunteer work at #Goodwill of North Central #Pennsylvania in #FallsCreek #JeffersonCounty https://t.co/A2owTw3wt6
1219344867861630976,2020-01-20 19:44:05,In #Brookville #JeffersonCounty touring Miller Fabrication Solutions.  Hearing how the tax cuts &amp; jobs act provideD opportunities for investment in equipment / #technology.  #welding #CTE
1219298365147688967,2020-01-20 16:39:18,"Toured #PGP PA Grain Processing in #Clearfield this AM.  Participated in a Roundtable with PGP staff, local corn producers, short-line railroad &amp; local chamber of commerce representatives.  A great #agribusiness producing ethanol, distilled grains &amp; #corn oil. #agriculture"
1218706315930939392,2020-01-19 01:26:42,Penny &amp; I are in #Ridgway #ElkCounty tonight attending the Ridgway #FireDepartment  Annual Awards Banquet.  Thank you to all those who serve as #FirstResponders helping neighbors in need!
1218409573704400896,2020-01-18 05:47:33,RT @TroutUnlimited: A bill that will continue funding abandoned mine cleanup is moving through Congress. Thanks to @RepCartwright @Congress…
1218409188721819651,2020-01-18 05:46:02,RT @Gorilla_Jim: @CongressmanGT Thank you GT.  Big Jim is one of our VSP Team Leaders.  Our #SCCTU #VSP Team thanks you for your support of…
1218292699339591681,2020-01-17 22:03:08,"It was an honor to join the Amigh family today. Sgt. Harry Amigh was killed in action at the young age of 20. Though his military career was cut short, his legacy is nothing short of incredible. https://t.co/UUPqpMSxkF"
1217860348977598473,2020-01-16 17:25:08,"It's a big week for trade:
✅Senate passes #USMCA
✅President Trump signs phase one of China trade deal

New market opportunities for our farmers are on the horizon! https://t.co/p259oK7GHo"
1217810553210576896,2020-01-16 14:07:16,On Floor to congratulate Braden Zukowski of Saxonburg who recently accepted a fully qualified appointment to the United States #NavalAcademy.  His hard work &amp; dedication to excellence in &amp; out of the classroom are qualities that will make him a great #midshipman. Congratulations!
1217613371576635392,2020-01-16 01:03:44,"RT @GensUnited: This week, we shout out @RepMGS @CongressmanGT @PB_News @NACAC_Adopt @asburycomm @MPTF @SMARTReadingOR @EisnerFound @Encore…"
1217613034300104709,2020-01-16 01:02:24,RT @AppVoices: Thanks to @RepCartwright and @CongressmanGT for their leadership on passing Abandoned Mine Land legislation through committe…
1217490707373527046,2020-01-15 16:56:19,On Floor to recognize #NationalMentoringMonth &amp; to thank those that volunteer their time to provide support &amp; guidance for our nation’s young people.  I encourage my colleagues to join me &amp; Representative @JimLangevin in cosponsoring our Counseling for #Career Choice Act
1217460978159321088,2020-01-15 14:58:11,"On Floor to recognize/honor Sergeant Harry Amigh, a resident of Ebensburg &amp; a #KoreanWar veteran.  Sergeant Amigh was killed during the Battle of Chosin Reservoir at just 20 years old.  On Friday I have the honor of presenting 7 military awards/medals to his family in his memory"
1217207409728507904,2020-01-14 22:10:35,Thanks for stopping by to discuss career and technical education! A skilled workforce is critical to support a 21st century workforce and economy. #CTE https://t.co/8bygRSJWil
1217140354375389191,2020-01-14 17:44:08,"Proud to co-sponsor @GOPLeader House Republican Leader Kevin McCarthy’s House Resolution 791 supporting the protestors in Iran, which also serves as notice to the Iranian regime that the United States is watching, and the world is watching."
1217136147425566727,2020-01-14 17:27:25,RT @GensUnited: We applaud @RepMGS &amp; @CongressmanGT for introducing the Help Grandfamilies Prevent Child Abuse Act. The bill would help kin…
1217133283932241920,2020-01-14 17:16:02,"On Floor speaking in support of HR 5538, the Help Grandfamilies Prevent Child Abuse Act I am proud to introduce with my colleague @RepMGS.  All children deserve a loving &amp; safe home!"
1217105530294079488,2020-01-14 15:25:45,"#PA15, need an excuse to spend more time outdoors? The Ghost Town Trail was named Pennsylvania’s 2020 Trail of the Year! https://t.co/pa6OnGtrk1"
1217101658150273025,2020-01-14 15:10:22,On Floor to recap the very success #Pennsylvania #2020FarmShow week that showcases the State’s #1 Industry #Agriculture FarmersFeed
1216872823806996481,2020-01-14 00:01:04,On Floor to recognize #BaldEagleArea student Peter Van Cise of Julian #Pennsylvania for his acceptance of a fully qualified appointment to the United States Air Force Academy in Colorado.  Congratulations!
1216755853249929218,2020-01-13 16:16:16,In Marble #ClarionCounty Sunday AM for stop by the site of the previous weekend’s devastating sawmill fire. Hoping for a quick recovery at this Allegheny Wood Products site!  #ForestProducts #Hardwoods https://t.co/IVP7bqtcOZ
1216750186598490112,2020-01-13 15:53:45,Finished Saturday at the #FrenchCreekBSA Custaloga Town Scout Reservation for a visit at their Order of the Arrow weekend event.  Great to see so many #Scouts &amp; #Scouters
1216749282235162625,2020-01-13 15:50:09,In #VenangoCounty Saturday PM for #BoyScout #EagleScout Court of Honor for Gavin Vincent Weber.  Well done! https://t.co/kh44gmmyrx
1216747343783088128,2020-01-13 15:42:27,"Saturday afternoon visit to see #conservation projects authorized under the #Agriculture #FarmBill with #USFWS &amp; Spring Creek Chapter of #TroutUnlimited.
Great to be joined on the stream also by 2 local #boy scout. https://t.co/hEcaHUIJMt"
1216735422275096576,2020-01-13 14:55:05,Spent Saturday AM at the Spring Creek @TroutUnlimited Chapter #Veterans Program at South Hills Business School.  Recognized #VetCenter staffer Scott Winters &amp; Veteran Jim Hibbert for making a difference serving our vets! https://t.co/u1R3Z0ytPU
1216005534031192072,2020-01-11 14:34:46,Back at the #Pennsylvania #2020FarmShow last night to volunteer at the #PennsylvaniaLivestockAssociation Food Court Booth.  The newest sandwich the #FlyingPorker is a huge delicious hit!
1216004688568557571,2020-01-11 14:31:24,"Friday AM I was honored to be in #BucksCounty #Pennsylvania to   remember &amp; celebrate the life of former Congressman Mike Fitzpatrick with his family, friends and constituents. https://t.co/EA1jxlE8Vx"
1215700432628088832,2020-01-10 18:22:24,"Children deserve a loving and safe home. Sadly, due to the nation’s opioid crisis, more and more children are being left without structure, without safety, and in some cases, without parents. Grateful to work with my colleague @RepMGS on such an important bipartisan issue. https://t.co/avMSZsY9Rf"
1215368949233324037,2020-01-09 20:25:12,"The pathway to success looks different for everyone, and that’s okay! It was a pleasure to join The Coalition for Career Development yesterday to talk #CTE and #CareerReadiness. https://t.co/ogTFSO8fFK"
1215292221928431618,2020-01-09 15:20:19,"On Floor to recognize #CentreCounty #Veteran James “Big Jim” Hibbert, SSgt who served 19 years in #USMC &amp; #Army.  After receiving listening skills training with the #SCCTU #StreamsideMentor program he used his skills to identify &amp; support a fellow veteran in crisis saving a life!"
1215288518341275651,2020-01-09 15:05:36,"On Floor to remember &amp; honor my friend/colleague former Congressman Michael Fitzpatrick who passed on January 6th.  Dedicated husband, father, leader, public servant, &amp; #EagleScout.  Michael retired in 2017 &amp; was consistently ranked among the most bipartisan members of Congress"
1214989410753744898,2020-01-08 19:17:03,RT @Gogetterskills: The tide is turning in favor of #CTE and #skilledtrades. 1000s of programs across the countries are now training new wo…
1214989284006076421,2020-01-08 19:16:33,RT @ASA_Impact: “The pathway to success looks different for everyone— and that’s ok. ...when it comes to preparing our youth for the workfo…
1214938551223238656,2020-01-08 15:54:57,On the Floor last night to recognize  #Dubois #VetCenter employee Scott Winters for his work with #veterans.  His listening skills training for the @TroutUnlimited volunteers has already equipped 1 of their #SteamsideMentors to save a veteran in crisis. Thank you Scott!
1214929334030475264,2020-01-08 15:18:20,On Floor to discuss the importance of #RuralHealth &amp; what it means to the nearly 60 million Americans who call rural America home.  Congratulations to the #PA15 #UPMC Northwest campus 1 of 18 #rural #hospitals in the nation recognized for excellence in patient safety &amp; quality
1214598986734198786,2020-01-07 17:25:39,#Pennsylvania #2020FarmShow Sale of Champions at the #FarmShowComplex #agriculture #FarmersFeed https://t.co/9TtORwkdSk
1214598758954082304,2020-01-07 17:24:44,#Pennsylvania #2020FarmShow Sale of Champions kicks off at the #FarmShowComplex #agriculture #FarmersFeed https://t.co/y7DxwNceaA
1214294902022004737,2020-01-06 21:17:19,The 2020 #Pennsylvania #FFA recognizes the State Stars at the PA #2020FarmShow at the #FarmShowComplex https://t.co/8roGxmFo25
1214294243700854784,2020-01-06 21:14:42,Attending the 91st Mid-Winter #FFA Convention at the #Pennsylvania #2020FarmShow at the #FarmShowComplex where #AgricultureEducators are being recognized. #CTE #AgricultureEducation Thank you to our #Ag #Educators for changing lives &amp; building futures! https://t.co/ceIMM4jOCm
1214260414713942016,2020-01-06 19:00:17,"RT @WaysandMeansGOP: How #USMCA helps Americans:
 
💵 $68 billion in new economic activity

✅ 176,000 new jobs

💻 New chapter on digital tra…"
1214001373152448512,2020-01-06 01:50:57,Butter Sculpture at the #FarmShow2020 104th #PAFarmShow at the #FarmShowComplex #GreatestAgricultureShowOnEarth #agriculture #Steelers #Phillies https://t.co/561znPsKWX
1214000937544667137,2020-01-06 01:49:13,Honored to be with the #Pennsylvania State #FFA Leadership officers at the  #FarmShow2020 104th #PAFarmShow at the #FarmShowComplex #GreatestAgricultureShowOnEarth #agriculture https://t.co/aac8Oagx8o
1214000542692847616,2020-01-06 01:47:39,Honored to be with the #Pennsylvania #4H State Leadership Officers at the  #FarmShow2020 at the 104th #PAFarmShow at #FarmShowComplex #GreatestAgricultureShowOnEarth #agriculture https://t.co/zPn5pRemke
1214000084419055616,2020-01-06 01:45:49,Kicking off my 10th annual #Agriculture Congressional Listening Session joined by ⁦@SenatorCasey⁩ ⁦@RepScottPerry⁩ ⁦@RepMeuser⁩ ⁦@RepJohnJoyce⁩ @RepFredKeller⁩ &amp; #Pennsylvania Ag Secretary Redding at #FarmShow2020 at 104th #PAFarmShow #FarmShowComplex https://t.co/EssB5vrZVC
1213998684414914560,2020-01-06 01:40:16,Proud to join colleagues ⁦@RepScottPerry⁩ &amp; ⁦⁦@RepMeuser⁩ at the #FarmShow2020 opening ceremony of the 104th #PAFarmShow at the #FarmShowComplex #GreatestAgricultureShowOnEarth #agriculture https://t.co/h6Y9v5pYrv
1213997931910615040,2020-01-06 01:37:16,Ribbon Cutting opening the #FarmShow2020 104th #PAFarmShow at the #FarmShowComplex #GreatestAgricultureShowOnEarth #agriculture https://t.co/evaC2Jn9Bq
1213997601344897024,2020-01-06 01:35:57,Kicking off #FarmShow2020 at the opening ceremony of the 104th #PAFarmShow at the #FarmShowComplex #GreatestAgricultureShowOnEarth #agriculture https://t.co/6rYsBImHo4
1213993807160713222,2020-01-06 01:20:53,@realDonaldTrump Message received.  Thank you!  @CongressmanGT
1213547353065570309,2020-01-04 19:46:50,Thank you to the producers and agriculture advocates who joined me for today’s listening session at the #PAFarmShow! https://t.co/qA1LsgHuMd
1213526758013710338,2020-01-04 18:25:00,Thrilled to be at the #PAFarmShow today to support our agricultural producers. These men and women are building a strong rural America! @FarmShowComplex
1213151453889646593,2020-01-03 17:33:40,"Attended the #CentreCounty Elected Officials Swearing-In Ceremony this AM.
Congratulations to all the public servants sworn in this morning!"
