id,created_at,text
1233159459947655172,2020-02-27 22:38:20,"Breaking ground at The Yards in Southeast DC today – with Phase I already bringing millions of dollars in housing, amenities, new businesses, and revenue for the District. https://t.co/iJeVfSoAUY"
1233141836644069394,2020-02-27 21:28:19,JUST IN: Historic news as @SpeakerPelosi announced DC will have two statues on display in the Capitol -- just like all the 50 states. More momentum before our #DCstatehood bill is considered on the House floor! https://t.co/o6EbC6IELK
1233123457065508866,2020-02-27 20:15:17,Thank you to the River Terrace Civic Association for a great turnout and excellent discussion last night! https://t.co/k9s7q6pltM
1233060277358297088,2020-02-27 16:04:13,"I am urging DC residents to visit my website for resources that will help them file their taxes. The last day to file is April 15th, but residents should begin the process early. Resources can be found here. https://t.co/1upyytneNg"
1232783387607359489,2020-02-26 21:43:58,"RT @staceyabrams: The founding ideals of this nation demand D.C. statehood. The proud American declaration that our government is of, by an…"
1232782673439068160,2020-02-26 21:41:07,"Today’s @OversightDems hearing on voter suppression hosted two civil rights icons, Diane Nash and Tim Jenkins. We were all members of the Student Nonviolent Coordinating Committee (SNCC). Their wisdom will help inform today’s work on 21st century voter suppression. https://t.co/VUFSBlLn0h"
1232689854955298821,2020-02-26 15:32:18,"Thank you @RepSarbanes for joining me in a @thehill op-ed on #DCstatehood. Rep. Sarbanes is also chair of the Democracy Reform Task Force and sponsored HR 1, which included findings endorsing statehood for DC residents. https://t.co/MVbWMf1ALq"
1232370568957222917,2020-02-25 18:23:34,Thank you ANC 4B for your valuable feedback and a full house last night! https://t.co/Dh8edy6UlM
1232350558071160833,2020-02-25 17:04:03,"Thanks to my bill, passed into law, the National Park Service is now working with DC to refurbish our local parks, most owned by NPS. Great news for Franklin Park! https://t.co/jlf32GLLS5"
1232052719269052417,2020-02-24 21:20:33,"Today’s roundtable on the difficulties federal employees face in getting security clearances was critical to the thousands of federal employees and applicants I represent. Efficiency and security are not incompatible.

(great photo, @JRWalkinshaw!) https://t.co/YvVnqEp0Q6"
1232050978586845184,2020-02-24 21:13:38,CBS recently covered Raya’s fight to establish a national monument honoring the work of women who served this nation but have gone unrecognized. I am proud to have introduced a bill to make this monument a reality!
1232049765019508738,2020-02-24 21:08:49,Congratulations to DC high school student Raya Kenny on the well-deserved national attention for your efforts to honor women who worked on the home front during WWII. Your continuing efforts will help get our bill passed in the House and Senate! https://t.co/k4GARKk4ql
1230953300645830658,2020-02-21 20:31:51,"Thank you Fonteneau Senior Wellness Center for a great turnout and conversation today. 

I host “Norton in Your Neighborhoods” across the city. If your organization is interested in learning the latest DC congressional news, please contact my office. https://t.co/rMzP9JpzHi"
1230213001220907008,2020-02-19 19:30:10,Well-attended nonprofit forum gave valuable advice to D.C. nonprofits on competing for federal grants. https://t.co/G7lAxokOzs
1229905446632333312,2020-02-18 23:08:03,"Last week, the Smithsonian Women’s History Museum Act, which I cosponsored, passed the House. For too long, women’s history has been left out of the telling of our nation’s history. I am proud that this museum is planned in my own district! https://t.co/boTLva47Xj"
1229881622520123396,2020-02-18 21:33:23,@SenatorCarper Thank you @SenatorCarper. I am so grateful to you for getting most of the Senate Democrats as cosponsors. We have 100+ national organizations ready to help move our #DCstatehood bill in the Senate following House passage.
1229880720451133442,2020-02-18 21:29:48,"The Census will determine how billions of dollars in federal funds are allocated. A warning to DC: in years past, the District has suffered from a costly undercount. I recently asked officials what plans they have to ensure an accurate count. https://t.co/iUSamWwNbp"
1229832439033466882,2020-02-18 18:17:57,Congratulations David Gibson Jr. of @SportsMarkit for your recent Evolve Entrepreneurship Award. DC has a thriving small business community and I’m thrilled to see one of our own recognized. https://t.co/o6mNWq5Da8
1229156895300243457,2020-02-16 21:33:35,"Thank you @EricHolder for adding your voice, as one of DC’s most distinguished residents, to our call for #DCstatehood. https://t.co/crCZA394Np"
1228442794945077249,2020-02-14 22:16:00,"This #BlackHistoryMonth, thank you @ABC7Sam and @ABC7News for capturing some of my work in the South during the Civil Rights Movement. Our rights weren’t given to us – we demanded them. The same could be said for #DCstatehood. https://t.co/AI9Wetw2BT"
1228435031804256259,2020-02-14 21:45:09,"Climate change has serious consequences for emergency response – even for animals! From pets to livestock, climate is a threat to our ability to keep communities safe. See my questions from a recent hearing on protecting animals in disaster areas. https://t.co/9JCe5A6RsG"
1228426471384997893,2020-02-14 21:11:08,Thank you to @amprog for your recent endorsement of our #DCstatehood bill. Progressive values mean standing up for a representative democracy. D.C. statehood is a key voting and civil rights issue of our time. Onward to the House floor!
1228407879247564806,2020-02-14 19:57:15,"As momentum for #DCstatehood continues to gain steam, coverage will only increase. I hope that other Americans see the injustice in their nation’s capital. Let them see that we pay the highest per capita taxes of any jurisdiction, without representation. https://t.co/9IQeMa7Gol"
1227695530475692033,2020-02-12 20:46:38,You can read coverage of our historic hearing here. https://t.co/N1ppSIfQ4O
1227695388431388672,2020-02-12 20:46:04,Thank you to the District residents who packed the halls of Congress yesterday. It was thrilling to preside for part of the markup that speeds us to the next historic step – on to the House floor! #DCstatehood https://t.co/Z0sxgd654l
1227647753125343234,2020-02-12 17:36:47,Thank you Chairwoman @RepMaloney for your leadership in helping DC make history with the Committee vote on #DCstatehood. Onward to the House floor! https://t.co/Plsyx7qaBe
1227369369891692545,2020-02-11 23:10:35,"RT @SenSchumer: It’s time for #DCStatehood! DC residents deserve full representation at the local level and in Congress.

This bill moving…"
1227360913960951808,2020-02-11 22:36:59,"HISTORY

The House Committee on Oversight and Reform just passed our #DCstatehood bill.

For the first time since 1993, we are heading to the House floor! 

It's time for #DCstatehood."
1227350895085727744,2020-02-11 21:57:11,"RT @TheBlackCaucus: We stand with @EleanorNorton and the 700,000 DC residents who deserve full representation in Congress. No other democra…"
1227333305172942848,2020-02-11 20:47:17,"RT @SpeakerPelosi: 30,000 veterans
700,000 residents
219 years without a full voice in our government

The people of Washington, DC have be…"
1227332121754324994,2020-02-11 20:42:35,"RT @RepValDemings: Vermont has two senators and a representative.

Wyoming has two senators and a representative.

The District of Columbia…"
1227331802869719041,2020-02-11 20:41:19,"RT @RepTedLieu: 700,000 DC residents have no vote in Congress. They pay the most in federal taxes per capita and their residents serve in e…"
1227320988016291840,2020-02-11 19:58:20,"This afternoon, I presided during the historic mark up and Committee vote on our #DCstatehood bill. It’s time for #DCstatehood! https://t.co/4RNkSKmLp3"
1227312059647483910,2020-02-11 19:22:52,"Thank you @RepRaskin for your leadership and this informative history of admitting new states.

For voting rights, for self-government, and for true equality -- it's time for #DCstatehood. https://t.co/kdEZEuS15U"
1227310459910529024,2020-02-11 19:16:30,RT @RepDonBeyer: It's like the Founders said: no taxation without representation! #DCStatehood now! https://t.co/FBc6rGuilP
1227297991826038791,2020-02-11 18:26:58,"RT @ACLU: DC has 700,000+ residents yet ZERO votes in Congress. It’s time to change that!

Thanks to our champion in the House @EleanorNort…"
1227291321502707712,2020-02-11 18:00:27,I am now presiding at the @OversightDems mark up and vote on our #DCstatehood bill. Follow along here --&gt; https://t.co/bUnrmSOSZL
1227281572845543424,2020-02-11 17:21:43,Fact Check: No other democracy in the world deprives its citizens of equal rights just because they live in the nation’s capital. It’s time for #DCstatehood.
1227269654311251968,2020-02-11 16:34:21,"700,000 DC residents have no vote in Congress. We pay the most in federal taxes per capita and our residents serve in every military branch. It’s time for #DCstatehood."
1227268358976024576,2020-02-11 16:29:12,RT @RepRaskin: The movement for #DCStatehood has gained historic momentum this Congress and we won’t stop pushing for full equality and vot…
1227261532976930816,2020-02-11 16:02:05,RT @RepDebHaaland: Packed house for the #DCStatehood business meeting in the House Oversight Committee today. @OversightDems https://t.co/y…
1227259641555451906,2020-02-11 15:54:34,"Thank you for your leadership, Chairwoman @RepMaloney. It's time for #DCstatehood. https://t.co/FiyKryiXiF"
1227259429973827584,2020-02-11 15:53:44,"Right now, the @OversightDems are marking up our #DCstatehood bill. Watch it live here! --&gt; https://t.co/bUnrmSOSZL"
1226947652639744003,2020-02-10 19:14:50,"Reminder to District residents – tomorrow the House Oversight Committee will hold a markup and VOTE on our #DCstatehood bill.

We expect a large turnout, and will have three overflow rooms, but I suggest getting here early. Details below! 
https://t.co/OHjS4Q6OA1"
1226234976485675009,2020-02-08 20:02:55,@openletterbot Thank you for your own work. I am a cosponsor of these bills.
1225925538700763143,2020-02-07 23:33:19,RT @NMACCommunity: NMAC partnered with Congresswoman @EleanorNorton (D-DC) to take an #HIV test to raise awareness for National Black HIV/A…
1225924199371431937,2020-02-07 23:28:00,"Thank you D.C. veterans for your words on service and sacrifice. The 30,000 veterans in the nation’s capital deserve a vote in the government they fought to defend. This Tuesday, our fight for #DCstatehood will take the next step. https://t.co/qY2xMD5jls"
1225847171502788609,2020-02-07 18:21:55,"RT @OversightDems: #DCSTATEHOOD ANNOUNCEMENT: For the first time since 1993, #DC Statehood will receive a congressional vote!

The bill, in…"
1225827950802673665,2020-02-07 17:05:32,We have just released details for the February 11th mark up and Committee vote on #DCstatehood. https://t.co/OHjS4Q6OA1
1225531499858055170,2020-02-06 21:27:33,"Today I attended my first Environmental Subcommittee hearing after requesting to join as a Member. The Trump administration is undermining protections against mercury in our air, posing an extreme threat to our children’s health. I will hold them accountable &amp; demand answers."
1225167855320227843,2020-02-05 21:22:33,"@LeaderHoyer You can also read @LeaderHoyer’s excellent op-ed in the Washington Post on achieving true equality for DC residents.

Hoyer: I Was Hesitant About #DCstatehood. Now I Believe It’s The Only Path Forward.
https://t.co/Y6VBe2vJen"
1225167669487448064,2020-02-05 21:21:49,"Breaking: You heard it from the Floor Manager himself. Thank you @LeaderHoyer for your incredible leadership on #DCstatehood. 

Next Tuesday, the House Oversight Committee will mark up and VOTE on my bill to make DC the 51st state. Then … on to the House floor! https://t.co/sp6ZnQqIfu"
1224905730064617472,2020-02-05 04:00:58,"“Once again, I ask the Congress to join with me in demonstrating our belief in the right of suffrage.  I renew my request that the principle of self-government be extended and the right of suffrage granted to the citizens of the District of Columbia” -- President Eisenhower, 1956"
1224905654101577729,2020-02-05 04:00:40,"And in 1956, as Eisenhower called on Congress to bring democracy to DC another time. I was in the Capitol tonight to challenge President Trump to do the same."
1224905547046182912,2020-02-05 04:00:14,"In 1955, President Eisenhower led his party again: “I renew my request that the principle of self-government be extended and the right of suffrage granted to the citizens of the District of Columbia.” #DCstatehood"
1224905469577310208,2020-02-05 03:59:56,"In his 1954 #SOTU address, President Eisenhower said: “In the District of Columbia, the time is long overdue for granting national suffrage to its citizens and also applying the principle of local self-government to the Nation's Capital.” #DCstatehood is 219 years overdue."
1224905367290884097,2020-02-05 03:59:31,"President Trump should have followed the example of a well-regarded Republican president. In 1954, President Eisenhower raised the bar for equality for DC. #DCstatehood #SOTU"
1224871531731390464,2020-02-05 01:45:04,@councilofdc Thank you dc council. I have reserved front row seats for you at next week ‘s mark up.
1224443269041405953,2020-02-03 21:23:19,Thank you to DC residents who came to our well attended NPS Quarterly Meeting at the Cleveland Park Library last week. Residents showed a deep understanding of their NPS-owned parks and what they need. We are following up with NPS to get you answers. https://t.co/VqfF3V5Sni
1223344317743489024,2020-01-31 20:36:28,Urgent! Open Enrollment for @DCHealthLink ends at midnight tonight – January 31. Low cost or free health insurance available to those who qualify. Help DC maintain its top rank for coverage! Sign up here and get covered: https://t.co/9RNawsKHKx
1223021384131137538,2020-01-30 23:13:15,"Mark your calendars: On February 11th the House Oversight Committee will mark up and VOTE on my #DCstatehood bill, HR 51. https://t.co/0HWMf6m8WI"
1222997457497468943,2020-01-30 21:38:10,RT @RepMaloney: The fight to give DC residents their full rights has been going on for far too long. Here I am w/ Rep. @EleanorNorton back…
1222971974017802245,2020-01-30 19:56:54,"RT @RepMaloney: The US is a democracy, but our capital is not. DC residents have petitioned for congressional voting rights &amp; statehood for…"
1222967069530116098,2020-01-30 19:37:25,"RT @vanitaguptaCR: This is a huge deal for civil rights and for our democracy. Thank you @EleanorNorton and Chairwoman @RepMaloney.

Time f…"
1222966323245932545,2020-01-30 19:34:27,RT @civilrightsorg: BREAKING: @EleanorNorton just announced that the House Oversight and Reform Committee will vote on #HR51 – her #DCState…
1222962179525222400,2020-01-30 19:17:59,"BIG NEWS FOR #DCSTATEHOOD:

Today, @MayorBowser, @ChmnMendelson, House Oversight Chair @RepMaloney and I announced that the Oversight Committee will hold a markup and VOTE on HR 51 on February 11th, moving the bill to the House floor.

Save the date!"
1222295895066148865,2020-01-28 23:10:25,"Whistleblowing protects the public interest.  Whistleblowers must work without fear of retaliation when they report waste, fraud or abuse, and especially threats to security.  See my Oversight Committee questions: https://t.co/9UPNTWz4Gw"
1222233706179461121,2020-01-28 19:03:18,I am heading to the House floor to speak about the suppression of the Dalai Lama and the Tibetans by China. I have visited the Dalai Lama in India and we have hosted him in D.C.
1221852848939569155,2020-01-27 17:49:54,"75 years ago today, Auschwitz was liberated. This #HolocaustMemorialDay, we must recommit to #NeverAgain and stand up against rising anti-Semitism and bigotry."
1220117065413070856,2020-01-22 22:52:31,"For 47 years, #RoevWade has safeguarded the right of women to make their own choices for an abortion. Today, we recommit to defending this constitutional right, particularly in DC, where low-income women are still denied funding to exercise their right by the Republican Senate."
1219292261244198912,2020-01-20 16:15:03,"The life of Martin Luther King, Jr. continues to inform our times, particularly here in the District, where King marched for home rule. We don’t have to dream to know that King would celebrate our newest milestone – passage of our #DCstatehood bill, expected this year. #MLKDay"
1217930791176544256,2020-01-16 22:05:03,Facial recognition technology is quickly becoming ubiquitous with little consumer understanding of impacts on privacy and security of personal data. Our House Oversight Committee hearing looked at this issue. See my questions below: https://t.co/2hQDZen6TE
1217899146880876548,2020-01-16 19:59:18,"Today’s GAO legal opinion is the last and most authoritative word on Trump’s hold on funds appropriated for Ukraine: Definitively refutes Trump’s “did nothing wrong” mantra, instead finding Trump violated the law. Decisive evidence today for impeachment."
1217125368504688642,2020-01-14 16:44:35,"Republican Senators have begun pressuring Mitch McConnell for a fair trial. By all accounts, Speaker Pelosi’s tactic of delaying sending the Articles of Impeachment has paid off. https://t.co/Jq5BemF5EW"
1216870463638593538,2020-01-13 23:51:41,"Shortly after 7 tonight, I'll speak on the House Floor on how the Speaker's hold on the impeachment articles may be bearing fruit"
1216849975252062208,2020-01-13 22:30:16,"Democrats have gained from the delay in sending Articles of Impeachment to the Senate – some Republican Senators are pushing for a fairer process with witnesses, Speaker Pelosi’s bottom line."
1215715087459266560,2020-01-10 19:20:38,"I spoke on the House floor on the War Powers Resolution as a limit on potential military conflict with Iran without consultation with Congress, as required. The Constitution gives Congress the explicit power to declare war, not the president. https://t.co/elJw9oRHQI"
1215380612896391173,2020-01-09 21:11:33,I’ll soon be on the House floor speaking on the War Powers Resolution. Tune in.
1215376199347843072,2020-01-09 20:54:01,It took the conservative Supreme Court to stop Republicans from engineering a census undercount. The Constitution requires counting all persons – critical for Republican &amp; Democratic districts alike to get the full funding due to them based on population. https://t.co/3ojbAcwSga
1215046891760771084,2020-01-08 23:05:28,"Today, Trump security officials flunked their own briefing on why Soleimani was killed. No precipitating act by Iran, no info on how US is safer, and nothing new on planned attacks by Iran. https://t.co/l5GOoU3789"
1214997882098593795,2020-01-08 19:50:43,"The House cannot sit still and allow President Trump to become an imperial president, answerable to no one. Tit-for-tat with Iran is not a policy. It is a childish and dangerous response. https://t.co/Kpjk4mErvE"
1214691202047598596,2020-01-07 23:32:05,"Tune in shortly to the House floor. I’ll be speaking on Trump’s decision to kill Iranian General Soleimani, possibly leading to another US war in the Middle East."
1214687178137251845,2020-01-07 23:16:05,"I’ll soon speak on the House floor on Trump’s decision to kill Iranian General Soleimani, an action that could involve the US in another war in the Middle East."
1214249546974453760,2020-01-06 18:17:06,"Seeing in real time tit-for-tat that could lead to war: attack kills US contractor in Iraq, US air strikes on Iraq and Syria, US embassy attacked, Trump orders killing of top Iranian General Soleimani."
1213137587902275586,2020-01-03 16:38:34,"RT @civilrightsorg: One year ago, @EleanorNorton introduced her #DCStatehood bill: #HR51.

DC has more than 700K residents (a population la…"
1213136152275955713,2020-01-03 16:32:52,New Census Bureau figures show DC has thousands more residents than Wyoming and Vermont – and nearly as many as Alaska and North Dakota! It’s time for #DCstatehood. https://t.co/WmZHcUXosO
1212170815749459971,2020-01-01 00:36:58,@civilrightsorg Don’t forget our new year’s prediction- the House will pass HR 51 this session in 2020!
