id,created_at,text
1247229127096250374,2020-04-06 18:26:10,"Many residents of DC cannot effectively #quarantine at home because they live closely together in apartments and row houses or are experiencing homelessness. 

We’re caring for people especially vulnerable to #coronavirus by arranging private hotel rooms for isolation. https://t.co/3LZgl1UjBP"
1247207592306368512,2020-04-06 17:00:36,"If you have a fever, cough or shortness of breath, you may qualify for GW's drive-through coronavirus testing.

By appointment only. For more information, call 202-741-2765 or go to https://t.co/FWpRMIXn7V https://t.co/eDe2CwhFzu"
1246956353190494211,2020-04-06 00:22:16,"Troubled by the two deaths at Hope Village in 3 days.

I have asked @USFederalPrison to release as many inmates as possible and appropriate and to conduct a site visit at Hope Village. 

See my letter below: https://t.co/0POoFvugl3"
1246947438012874752,2020-04-05 23:46:51,I will continue to monitor and work with @USMarshalsHQ to ensure they have what is necessary to protect all involved in the D.C. justice system. (2/2)
1246947207431012353,2020-04-05 23:45:56,Appreciate @USMarshalsHQ’s prompt response to my letter to reassure me that inmates are being protected against #coronavirus while making appearances at @DC_Courts. (1/2)
1246931325380186119,2020-04-05 22:42:49,"The Kennedy Center got the money but not the message: Pay people – musicians and staff. 
 
Not your call to pick priorities over people. 
 
https://t.co/IvSz92vNab"
1246178975002624002,2020-04-03 20:53:15,"DC small businesses can now apply to @SBAgov-approved lenders for Paycheck Protection Program loans for payroll, rent, mortgage, and utilities. 

Loans forgivable if payroll and wages maintained. 

Learn more here: https://t.co/CgOLkfMRUa https://t.co/KTSKo43c0R"
1246139833652850688,2020-04-03 18:17:43,"The next #coronavirus bill is the time for Congress to finally permit DC to commercialize recreational marijuana. It is legal to possess two ounces but #DC can’t tax it. 

Commercialization would help DC in this moment of great need for revenue. https://t.co/xhEOyY1mbS https://t.co/3haXv1L8Wf"
1245863004140269574,2020-04-02 23:57:41,"The House is working on a 4th bill now and at today’s press conference,Pelosi mentioned several things she wants in it."
1245830037141704704,2020-04-02 21:46:41,"At her press conference today, @SpeakerPelosi said #DC was “cruelly discriminated against” when the 3rd Republican-initiated #COVIDー19 bill deliberately shorted DC by $750 million.

Her continuing, spontaneous outspoken support will help me retrieve our funds."
1245780793328316418,2020-04-02 18:31:01,"Stop, Look, Listen: 81 years ago today, #MarvinGaye was born at Howard University Hospital. The wisdom in his love songs spans generations.

Mercy mercy me, I heard it through the grapevine that distant lovers are the best kind right now. #socialdistancing https://t.co/bkaktrGlty"
1245724519081431040,2020-04-02 14:47:24,"In her press conference call yesterday, @SpeakerPelosi said ""We need to do more... for the District of Columbia, which was *cruelly* treated in this past bill.""

We are at work with House and Senate leaders to make sure the next #coronavirus bill fully funds #DC. https://t.co/itKcZUNTsN"
1245466794866999296,2020-04-01 21:43:18,"Thank you @ChrisVanHollen, @SenatorCarper + 23 others who wrote to Sen. leadership asking for full DC #coronavirus relief funding.

I'm working to retroactively fund DC in the next coronavirus bill. My constituents and I greatly appreciate the support from so many Senate allies."
1245426987734306817,2020-04-01 19:05:07,"BOP also granted my request to waive the 25% subsistence fee charged to halfway house residents during this crisis. We’re all in this together, wherever we happen to be."
1245426818036805632,2020-04-01 19:04:26,"To protect DC residents in custody , I asked @USFederalPrison to go to Hope Village, a halfway house, to ensure residents there are safe from the #coronavirus.  BOP reports no COVID-19 cases at Hope Village."
1245342024787800066,2020-04-01 13:27:30,"Today is #CensusDay.

Go to https://t.co/gRvWTZvSHt, spend ten minutes and fill out the form today. 

#BeCounted and ensure D.C. gets the funds we're due."
1245134968461971456,2020-03-31 23:44:44,"As the first female chair of @USEEOC and the lawyer in the Newsweek sex discrimination case, I’m going for even more in Congress. (2/2)"
1245134860576010243,2020-03-31 23:44:18,"Today, #EqualPayDay, we remember the House passed my Pay Equity for All Act, barring employers from asking applicants their salary history, to avoid building in widespread intentional or even unintentional race and sex discrimination. (1/2)"
1245123546915000322,2020-03-31 22:59:21,"In recognition of #TransVisibilityDay, we are thinking about our transgender residents. During #coronavirus, it is particularly important that transgender individuals are able to receive equal access to healthcare. https://t.co/J0S9anHx9j"
1245117524016054278,2020-03-31 22:35:25,"Thank you @speakerpelosi for reiterating this week that retroactively fixing the outrageous treatment of DC as a territory in the 3rd coronavirus response bill is a top House priority for the 4th bill.  This unprecedented treatment cost DC $750 million. 
https://t.co/VLIieFVSol"
1245114400471736323,2020-03-31 22:23:00,"Physically distant yet socially connected, we shall overcome.  New stay-at-home order issued by @MayorBowser yesterday—stay inside unless it is essential to go out.  We must do more to flatten the curve. See here for limited exceptions: https://t.co/JP4QoKTkFS https://t.co/Azo97b1kGB"
1245030577335685122,2020-03-31 16:49:55,"While hospital infrastructure throughout the U.S. struggles to meet the surging demand from coronavirus patients, Trump is busy building his wall. Where are his priorities?
https://t.co/Ng4V3yYMEh"
1244714864356069377,2020-03-30 19:55:24,"This is why we must always put workers first -- Senate and House Democrats have expanded unemployment benefits and direct cash assistance for Americans. 

Now, I am fighting to ensure D.C. is NOT left out of full funding in the next package.

#FundDCtoFight coronavirus. https://t.co/IwnmvVKlce"
1244703523176136704,2020-03-30 19:10:20,"Let's pause to celebrate the life of Rev. Joseph Lowery, who was a chief lieutenant of MLK and a mentor to me as a young woman in the civil rights movement.

#RevLowery belonged to the generation that led the way.

https://t.co/98fS8CBmyI"
1244690575921577984,2020-03-30 18:18:53,"Thank you @postopinions for condemning the unprecedented, shameful treatment of DC by Senate Republicans and White House in the 3rd #coronavirus bill costing DC $750 million.

I’m already at work on fixing this unprecedented denial of funds in next bill.

https://t.co/gxiFwYZqkv"
1244051058927833091,2020-03-28 23:57:40,"RT @TransportDems: Over 600,000 cases of #coronavirus have been reported around the world. There's no doubt this global pandemic has brough…"
1244036868217409536,2020-03-28 23:01:17,"RT @ProfJeffries: A lion sleeps tonight.

#JosephLowery
https://t.co/MA7Z2EJWBA"
1243710381782155265,2020-03-28 01:23:56,"DC always receives state funding but the Senate initiated COVID-19 bill signed today lumps DC with the territories, reducing DC's funds. 

This will not stand. 

Thank you House leaders @SpeakerPelosi and @LeaderHoyer for helping me fix this in the next bill."
1243347304557445120,2020-03-27 01:21:12,"I urge you to take three minutes to listen to Senator @ChrisVanHollen’s extraordinary advocacy for DC after we got shortchanged in the 3rd COVID-19 bill with no representation in the Senate. 

This crisis makes the case for #DCstatehood. https://t.co/a10UQNbj1H"
1243343718565937162,2020-03-27 01:06:57,"We always have to fight to preserve DC home rule, but we always get the same per capita federal funding as states. The Senate reversed that, shortchanging DC in the 3rd COVID-19 bill. This will not stand.
 
See my full statement here: https://t.co/pQmTLgd1Jk"
1243309903088943106,2020-03-26 22:52:35,"RT @rollcall: ""It’s unprecedented"" — D.C. Del. @EleanorNorton on coronavirus funding snub https://t.co/vTNs75RwrF https://t.co/0S45ltuzw3"
1243291955548819461,2020-03-26 21:41:16,"Senator @ChrisVanHollen, thank you for your floor speech last night and for fighting with us to fix the provision in the Senate #coronavirus bill that departs from the usual per capita funding for DC, costing DC hundreds of millions of dollars. https://t.co/a10UQNbj1H"
1242976622069846024,2020-03-26 00:48:14,"Now is not the time to rest. My office is open for business through telework. Keep your emails and calls coming for the actions you want from Congress.

In the last week alone, I’ve taken more than 50 actions. 

See the full list here: https://t.co/8JS9GGMogR"
1242973173060075521,2020-03-26 00:34:32,"State stabilization fund in Senate coronavirus bill treats DC as a territory, not as a state. Yet DC pays full federal taxes, pays #1 per capita in fed taxes, &amp; is treated as a state in the rest of bill.

Taking immediate action to get 100s of millions of dollars due to DC."
1242853832075497474,2020-03-25 16:40:19,RT @RepYvetteClarke: Grocery shelves across America are empty – and people fear prices will go up. That’s why I led a letter to the largest…
1242505666784366592,2020-03-24 17:36:50,"Please stay home to #flattenthecurve. While home, now is a good time to fill out the #2020Census online at the link below and #becounted. 

With #coronavirus, it will be harder to have door-to-door canvassing. Keep us from losing the funds D.C. is due.

https://t.co/6G6OzeQ4xs"
1242495017899483141,2020-03-24 16:54:31,"Under the House version of the 3rd coronavirus bill, D.C. would get $11 million in new security funding. 

In these unprecedented times, we appreciate that our security needs are being addressed.

This gives us a head start in getting these funds into the final bill."
1242190936639184896,2020-03-23 20:46:12,"@FAMMFoundation @AGWilliamBarr @TheJusticeDept @dclinenews Barr has no jurisdiction over state prisons. I wrote him because dc felons are the only local inmates in BOP. These are hard core felons who have committed murder, rape, robber and the like."
1241855660985397250,2020-03-22 22:33:56,"After receiving concerning reports last night, I wrote to @DC_Courts and @USMarshalsHQ encouraging them to take additional steps to protect detainees, court personnel, marshals and the public from the coronavirus.  Read my letter below: https://t.co/S4sGefo6Cw"
1241844499883712522,2020-03-22 21:49:35,"I requested today @TheJusticeDept to apply the #FirstStepAct to D.C. Code felons in @officialfbop, as Congress intended. I worked to make sure D.C. residents were eligible under the Act. Some may be eligible for compassionate release from #coronavirus. See my letter. https://t.co/M7jzAve00u"
1241128057882247174,2020-03-20 22:22:42,"Today, I urged the U.S. Parole Commission to release D.C. residents and others who pose no risk to public safety in order to protect inmates, staff and the public from the #coronavirus.

Read my letter here: https://t.co/mLEcgUtoRW"
1241100109334618118,2020-03-20 20:31:39,"I sent a letter today to House leaders to move my bill giving @NatChildrens space in the Reagan Building rent-free, like other museums.

NCM opened in Feb. but closed because of #COVID19.

DC must not be the only major city without a children’s museum. See my letter below: https://t.co/c85Gucex23"
1241015012166193152,2020-03-20 14:53:30,"I asked @DeptVetAffairs to suspend all filing deadlines for veterans and surviving family members. 30,000 DC veterans shouldn’t risk losing access to critical disability and pension payments after the sacrifices they’ve made. Read my letter below: https://t.co/43vbbgdUMo"
1240795332788858880,2020-03-20 00:20:34,"Today, I wrote House appropriators to request that they instruct Capitol Police to develop rules and regulations for the safe operation of e-scooters on Capitol grounds.  If strictly regulated, scooters can help DC win the fight against pollution and congestion. https://t.co/LDqm9XGxJB"
1240688186218541057,2020-03-19 17:14:49,"Today, I wrote to OMB and OPM asking them to give extra leave time to federal workers who have to take care of their families, including children home from closed schools.  Read my letter below. https://t.co/iitoBhGbcH"
1240648375445401600,2020-03-19 14:36:37,"DC small businesses suffering economic hardship during this pandemic can now apply for @SBAgov Disaster Relief Loans.

Apply online via this link: https://t.co/VS30lW1mct"
1240423738308538370,2020-03-18 23:43:59,I sent a letter today to @PeaceCorps Director Jody Olsen requesting much-needed assistance for all our evacuated Peace Corps volunteers as they transition home. They helped others. Now they need our help. See my full press release and letter here. https://t.co/tIO8Gyee4O
1240414147071954948,2020-03-18 23:05:53,"Until coronavirus testing is widely available, the National Capital Region, which houses the seat of the federal government, should be one of the priority areas for federally supported testing. https://t.co/An3UjqZO9A"
1240335513392951297,2020-03-18 17:53:25,The federal government should lead by example and mandate telework for federal employees and contractors.  Telework will protect these workers and flatten the curve. https://t.co/XsCrckScDA
1240024914058493958,2020-03-17 21:19:12,"This article takes me back to when the women of Newsweek chose to fight back.  As assistant legal director at the American Civil Liberties Union, I represented them and we won. They changed journalism itself. 
https://t.co/UUA4Wihnw3"
1239990755105689601,2020-03-17 19:03:28,The @DC_Courts are now using authority that my bill – enacted into law in 2012 – gave our courts to delay judicial proceedings in case of emergencies. This authority eases concerns of residents who use our courts and assures both criminal and civil justice stability. https://t.co/5ZtKPTx7yd
1239924181527146499,2020-03-17 14:38:56,My DC National Guard Home Rule Act would give the DC mayor control of the DC National Guard - without the delays we encounter today - just as the governors of the states and territories have control of theirs. https://t.co/TICCLggYkl
1239904311066460160,2020-03-17 13:19:58,"Major General Wherley, who was killed in the 2009 Metro crash, was Commanding General of the D.C. National Guard. The bill I introduced last week, named for him, makes the D.C. Guard competitive with other National Guards by providing education benefits for its members."
1239714821404319744,2020-03-17 00:47:00,"My staff and I are teleworking, serving D.C. residents at home as if we were in the House, yet the single biggest drop in the market today is another sign that the nation’s response is not enough."
1238616755066605568,2020-03-14 00:03:41,"I joined a just-formed Congressional Coronavirus Task Force today to focus quickly on what to do about this new virus. Congress is on recess next week but our offices will keep regular hours using telework. 
https://t.co/Dse9MDYvRR https://t.co/vWHjq5Ngb5"
1238463859859562498,2020-03-13 13:56:08,@SenDuckworth @SenatorBraun @SenMcSallyAZ introduced a companion bill to my Women Who Worked on the Home Front WW2 Memorial Act honoring the 18million American women who performed essential tasks during the war. Thank you for this bipartisan bicameral effort!
1238231537583259649,2020-03-12 22:32:58,"Working to ensure medical providers and first responders, especially in D.C.–with 10 reported coronavirus cases–are kept safe so they can keep us safe. They need priority for protective gear, such as masks. Watch my hearing questions here: https://t.co/f0u4E39FhR"
1238100865619279872,2020-03-12 13:53:43,"Remembering my friend, Jim McGrath today.  Jim made a lasting impact on the District of Columbia and its residents as our city’s leading activist for tenants’ rights. See my full statement in the congressional record here:  
https://t.co/Wf2dqjroN0 https://t.co/CxzgnknBnN"
1237837204770238467,2020-03-11 20:26:02,Natural Resources Committee passed my Women Who Worked on the Home Front WW2 Memorial Act by unanimous consent! 18 million American women did important work in WW2 &amp; are overdue for this great honor.  Thank you @RepRaulGrijalva and Raya Kenney. Happy #WomensHistoryMonth!
1237806149598052358,2020-03-11 18:22:38,"The House is voting today on a War Powers Resolution to ensure no war with Iran without congressional approval.  Yet, despite serving in every war and paying the highest federal taxes per capita, DC residents will have no vote on this resolution.  It’s time for #DCStatehood."
1237735919018553346,2020-03-11 13:43:33,"As we celebrate #WomensHistoryMonth, the Natural Resources Committee is marking up my Women Who Worked on the Home Front WW2 Memorial Act. Our country is overdue in honoring the 18 million American women who did indispensable work during WW2.  Thank you @RepRaulGrijalva!"
1237729387904151553,2020-03-11 13:17:36,(3 of 3): We are already working in the Senate with more than 100 organizations with a record of getting difficult bills passed.  We are ready for the next hurdle and are on our way to making D.C. the 51st state!
1237729329905389568,2020-03-11 13:17:22,"(2 of 3): The #DCstatehood bill is expected to be on the House floor before this summer.  Because we have enough cosponsors to pass the bill with the votes of cosponsors alone, we expect to make history: House passage of the D.C. statehood bill!"
1237729237613887493,2020-03-11 13:17:00,"(1 of 3): One month ago, the House Oversight Committee voted to send the #DCstatehood bill to the House floor for the first time since 1993, when I got the first-ever floor vote on the bill in the House."
1237507873824845824,2020-03-10 22:37:23,"Tomorrow, I will be participating in the @OversightDems’s first hearing on the coronavirus since the District's first case was confirmed on March 7, 2020."
1237504460764692480,2020-03-10 22:23:49,We honor those who died one year ago today in the second Boeing 737 MAX crash by demanding answers from Boeing and the FAA and holding agency officials accountable. https://t.co/aZhARhQIsC
1237501870907719682,2020-03-10 22:13:32,"Fortunately, my bill to give D.C. authority to set the pay level for its own local CFO using its own local money does not require D.C. statehood —Only common sense! https://t.co/gx6CCEXqCW"
1237472002266599430,2020-03-10 20:14:51,"Today I met with Members of @ACOG to discuss maternal mortality rates in DC.  As a member of the Black Maternal Health Caucus, I am a cosponsor of several bills to discover why Black maternal mortality rates are so high. https://t.co/x5mTu4DVwN"
1237445787883356161,2020-03-10 18:30:41,"@RepAnthonyBrown Thank you, @RepAnthonyBrown for being a proud original cosponsor of our #DCStatehood bill.  The House is expected to pass our bill this year for the first time in American history."
1237395796900876290,2020-03-10 15:12:02,"While the Administration seems narrowly focused on the stock market, House Democrats are fighting to ensure free coronavirus testing and paid sick leave.  Making sure Americans are healthy and safe is the best medicine for a drooping Dow Jones"
1237387447001989121,2020-03-10 14:38:51,"Even @HighPlainsJrnl, an agricultural journal, covered the announcement that DC’s 2nd statue will be placed in the US Capitol this year. DC will now have 2 statues in the Capitol, just like the 50 states. Nationalize the #DCStatehood fight! 

https://t.co/NQlfzWH42A"
1237122885531172867,2020-03-09 21:07:35,"One year ago this week, we celebrated as H.R. 1 passed the House, marking the first time in U.S. history that either chamber of Congress voted in support of #DCstatehood.  We are now preparing for the House to pass our D.C. statehood bill before this summer!"
1237093531858145280,2020-03-09 19:10:56,"(2 of 2): It’s absurd that D.C. can’t set the salary of its own CFO using local funds.  My bill puts D.C. in a competitive position to attract and retain high-quality CFOs, while maintaining the independence of this important office."
1237093456910131200,2020-03-09 19:10:38,"(1 of 2): To get Congress out of D.C.’s business, we are working on 2 tracks.  Even before statehood, our Free &amp; Equal D.C. bills expand home rule and equality.  I just introduced the D.C. Chief Financial Officer Salary Home Rule Act to give D.C. authority over the CFO’s pay."
1236063570032553986,2020-03-06 22:58:14,Tonight I’m hosting a panel discussion for Women's History Month celebrating the professional accomplishments of queer women. All are welcome! 6:00 PM at the Adams Morgan Community Center. Starting soon!
1236023060114878465,2020-03-06 20:17:16,I warned that sabotaging this vital federal agency would lead to brain drain. Agencies have always kept some staff at the headquarters to keep Congress and agency heads well informed.
1236022986551025664,2020-03-06 20:16:58,This loss to DC is a loss to the American people: The Bureau of Land Management has lost more than half its Washington area employees who were needlessly slated to move out West to enforce a controversial plan to relocate staff. https://t.co/RccQhtebLm
1235986097118695425,2020-03-06 17:50:23,"#DCstatehood is now recognized as a defining civil rights issue of our time. Denying representation and self-government to DC residents, who continue to pay the highest per capita federal taxes, and serve in the military, is wrong. It’s time for #DCstatehood."
1235986034535608322,2020-03-06 17:50:08,Thank you to the Clean Budget Coalition – 100 national organizations – for supporting #DCstatehood in your letter to Congress! @goodregs #nopoisonpills #cleanbudget
1235690273780494339,2020-03-05 22:14:53,Great news that the Senate may pass the Restore Our Parks Act. This would be a big win for DC because NPS owns nearly all of our local DC parks. I will work to get it passed in the full House as soon as possible.
1235674298364424200,2020-03-05 21:11:25,"A train derailment in the District a few years ago spilled sodium hydroxide, a highly corrosive substance, in a DC neighborhood. At our subcommittee meeting on railroads, I questioned experts about mitigating such risks to District residents. Watch here: https://t.co/pAgCeEhR73"
1235649924756312070,2020-03-05 19:34:33,"In our Aviation subcommittee hearing, I asked experts about sexual assaults on airplanes. My bill, the AWARE Act, would require the DOJ to report data of sexual assaults on flights. See my questions here: https://t.co/lkG6gRHH9i"
1235626908886487042,2020-03-05 18:03:06,Great to meet with National Treasury Employees Union members yesterday. Our public employees serve with great distinction despite hostile practices by the Trump administration. I’m fighting to increase pay and improve recruitment practices for all our federal workforce. https://t.co/SBLCPrcBMn
1235314340267466753,2020-03-04 21:21:04,"RT @MFOLDC: We’re here at the Capitol with @EleanorNorton, @51for51, @CJACTIONFUND, @MikvaDC and more calling for action to project DC! htt…"
1235304095789051906,2020-03-04 20:40:21,"Today the Supreme Court heard oral arguments from Louisiana lawmakers who want to block women from accessing abortion clinics, depriving them of essential health care. Abortion must be safe and legal for everyone. #MyRightMyDecision"
1235290381945798656,2020-03-04 19:45:52,"#Coronavirus remains a serious health concern. I urge everyone to practice good hygiene to help stop the spread. Wash your hands (20 seconds!), cover your mouth when you cough, and stay home when sick. Stay well! https://t.co/lk4TXgc7Rt"
1235288549232082954,2020-03-04 19:38:35,Today my office hosted the @Nationals’ World Series trophy. We are so proud of our Nats. Congratulations on the historic victory! https://t.co/q6qIONjEu5
1234976428422303744,2020-03-03 22:58:19,"Paying the price for #coronavirus: Trump and the Republican Congress eliminated the office for pandemic preparedness that Obama created. With more than 100 cases nationwide, the Democratic House is making up for lost time, proposing emergency spending of close to $8 billion. https://t.co/ZWy70aNFey"
1234908378566189056,2020-03-03 18:27:55,"I introduced a bill to provide federal tax incentives for businesses to locate and invest in underserved areas of DC, particularly Wards 5, 7 and 8.  Includes a wage credit for hiring workers from neighborhood where business located. https://t.co/uN1IZuZE7P"
1234879745789251588,2020-03-03 16:34:09,"In 2018, Trump and the Republican Congress abolished the office and the emergency funding Obama created to address outbreaks like the #coronavirus.  Catch up won’t work with Trump’s request for $2.5 billion when experts say much more is needed. https://t.co/5KfawFRJC6"
1234626528954241024,2020-03-02 23:47:57,I’ll be on the House floor around 6:55 pm to speak on the coronavirus.  This week the House must make up for the 2018 elimination of the office and the funding for new threats like the coronavirus by Trump and the Republican Congress.
1234598079845818368,2020-03-02 21:54:54,"In 2018, Trump and the Republican Congress abolished the office and the emergency funding Obama created to address outbreaks like the coronavirus.  Catch up won’t work with Trump’s request for $2.5 billion when experts say much more is needed. https://t.co/ZXhRtwx3zi"
1233434722635743233,2020-02-28 16:52:08,"RT @wamu885: Pierre L’Enfant will join a bronze statue of Frederick Douglass representing D.C. in the National Statuary Hall.

https://t.co…"
1233433785234075650,2020-02-28 16:48:25,"RT @postlocal: Congress accepts statue of Pierre Charles L’Enfant, ending 12-year standoff with the District https://t.co/iRjIP4hBvn"
