id,created_at,text
1237377815122763776,2020-03-10 14:00:35,"@johnnydiaz__ Yes, I’ll have someone reach out to you!"
1237114643178496004,2020-03-09 20:34:50,"1.5 million people have now been sent to re-education and internment camps in China.

And it appears U.S. companies are benefiting from their forced labor. 

No company should profit off mass detention and human rights violations! https://t.co/dO1OUfxThS"
1237097611229790209,2020-03-09 19:27:09,"The folks who suffer most in a market crash are not the traders on Wall Street.

It is ordinary people losing their jobs, getting their pay cut, or losing their pensions. 

Our focus should be on helping working people."
1237097190406983685,2020-03-09 19:25:29,RT @RubenGallego: If members of Congress can go on self imposed quarantine and still get paid. It only makes sense that Congress should pas…
1237068080502710274,2020-03-09 17:29:48,"1 year. 

That's how long it has been since the House passed #HR1 to put power back in the hands of the people and restore our democracy.

The Senate still has not lifted a finger. 

@senatemajldr, do your job."
1237058494760660992,2020-03-09 16:51:43,RT @TheoKeith: The Minnesota Senate will hold an afternoon vote on $21 million in emergency funding that state health officials need to dea…
1237043011462270979,2020-03-09 15:50:11,Every worker in America should have guaranteed paid sick leave.
1237015391647514624,2020-03-09 14:00:26,RT @BrennanCenter: Rep. Ilhan Omar introduced the Congressional Oversight of Sanctions Act which will begin guarding against presidential o…
1236707857082482688,2020-03-08 17:38:24,"RT @Ilhan: The lives of women in the US are tied to women the world.  

Whether it’s missing Indigenous women, attacks on our reproductive…"
1236336274719547400,2020-03-07 17:01:52,"The lives of women in the US are tied to women the world.  

Whether it’s missing Indigenous women, attacks on our reproductive healthcare, or sexual violence faced by migrant women, we must unite against hate and bigotry in all its forms. #InternationalWomensDay2020"
1236334773175554048,2020-03-07 16:55:54,Congratulations to @SEIU26 and the bargaining team! https://t.co/NWx3JQH2V2
1236064332129144832,2020-03-06 23:01:16,"I know this is a difficult time for Minnesotans.

My office is in close contact with the Governor’s office and I have confidence in @GovTimWalz and @mnhealth.

Stay up to date on the latest information here:
https://t.co/If7rn4hrCs https://t.co/HcHztffWsI"
1236059581303881730,2020-03-06 22:42:23,"RT @keithellison: This is the mosque I attend. This behavior is intended to intimidate. Well, we aren’t intimidated. The bullies who are tr…"
1236042357663023105,2020-03-06 21:33:57,"No one should take the life of another.

That includes the government. https://t.co/sPxWl0QPc5"
1235934584921042944,2020-03-06 14:25:42,There is power in a union! https://t.co/BEP18OZKqX
1235732878538899456,2020-03-06 01:04:11,It’s easy to mock Medicare for All until there’s a pandemic
1235625754387505152,2020-03-05 17:58:31,So proud of my constituent @EurekaMN's Lynn Hoffman for testifying at @EnergyCommerce this week on the importance of Zero Waste! https://t.co/8TEbnxJBiZ
1235618606001475584,2020-03-05 17:30:07,"🗣ONE JOB SHOULD BE ENOUGH!

Join us for a town hall next Friday on economic justice, unions, and the right to organize. https://t.co/TE7AyS0MdF"
1235577234334846976,2020-03-05 14:45:43,"I am carefully monitoring this situation and am in close contact with local officials. 

In the meantime, we have set up a page where you can get more information about how to protect yourself from Coronavirus:
https://t.co/ASeP6UA8kV https://t.co/GOmBCvuOpc"
1235568643590828032,2020-03-05 14:11:35,"RT @HDPinUSA: Our MP @hisyarozsoy met Rep. @IlhanMN today to discuss the struggle for peace, democracy, and human rights in Turkey and Kurd…"
1235320363061370880,2020-03-04 21:45:00,"In the past year, 44% of Americans have gone without medication they need due to cost.

This should not be the case in the richest country in the world.

We need  #MedicareForAll and we need it now."
1235287011369590785,2020-03-04 19:32:28,"Proud of our state for taking action to address the epidemic of hate. 

Looking forward to leading these efforts at the federal level! https://t.co/SHXnm4KmYw"
1235257934449344519,2020-03-04 17:36:56,"The President:

Cut CDC efforts to prevent global disease outbreaks by 80%.

Shut down the entire global-health-security unit of the National Security Council.

Cut national health spending by $15 billion.

It’s easy to attack America’s government—until there’s a pandemic."
1235243539979743233,2020-03-04 16:39:44,RT @RepPressley: A part of successful reentry is maintaining relationships w/ ppl on the outside. Prison erases a person's humanity. This i…
1235231997766889473,2020-03-04 15:53:52,Two accused sexual predators should not be deciding whether or not women have access to healthcare in this country. https://t.co/okJE85pwoN
1235230558084567047,2020-03-04 15:48:09,Abortion is a Constitutional right
1235225207683657729,2020-03-04 15:26:53,Abortion is healthcare
1234969865099722757,2020-03-03 22:32:15,"Many @Starbucks workers are paid poverty wages. 

Some are homeless, others are forced to sleep at the airport. 

And black baristas are paid $1.85 less on average.

Solidarity with @Starbucks workers in MN and across the country demanding respect and fair wages. ✊🏽 https://t.co/jIUVYLZiIy"
1234909235214942208,2020-03-03 18:31:19,"The life of a child who lives in poverty is just as valuable as a billionaire. 

The life of a refugee fleeing war is just as valuable as the person profiting off that war.

These should not be radical ideas."
1234877146126004225,2020-03-03 16:23:49,"My destiny, your destiny, and the destiny of workers around the world are linked. 

We cannot fight climate change unless we are fighting for a more just future for our workers. 

Proud of Minnesota for leading this fight!
https://t.co/uaxPqxzWVR"
1234578687888121858,2020-03-02 20:37:51,"The coronavirus is real and dangerous. 

Minnesotans should remember to:
— Wash your hands thoroughly.
— Cover your cough.
— Stay home when sick. 

Find more resources here: https://t.co/If7rn4hrCs https://t.co/UDNjOGhWJZ https://t.co/YTs90loiV6"
1234563974567473154,2020-03-02 19:39:23,"RT @SSWorks: ""True justice does not discriminate against someone because of their race, ability, or social status. 

#MedicareForAll is wha…"
1234539181059330048,2020-03-02 18:00:52,"We are fighting for an America where women are paid more than 80 cents for every dollar a man earns.

Where black women are paid more than 62 cents.

Where Latinx women are paid more than 54 cents. #WomensHistoryMonth https://t.co/11HXBAwiuy"
1234530143156285440,2020-03-02 17:24:57,"15 million children— 1 in 5—live in poverty in our country.

The fact that is not a treated as a national crisis says everything about how backwards our priorities are."
1234529431873605632,2020-03-02 17:22:07,RT @RepRashida: The #humanrights of every person MUST be respected by every country. Period. The thousands being jailed in #Egypt should be…
1234490355170643970,2020-03-02 14:46:51,RT @RepDebHaaland: We hosted a historic delegation of congresswomen from Brazil last week to create a network of women working in solidarit…
1233754835318693889,2020-02-29 14:04:09,Believing in a Green New Deal should not be a controversial idea in the halls of American power.
1233526429838725121,2020-02-28 22:56:33,"In America, immigrants still have rights.

In America, the rule of law still matters. https://t.co/nw2AMvG78T"
1233518310865719299,2020-02-28 22:24:17,"The Trump Administration is reportedly trying to deport thousands of Hmong-Americans to a country where they don't speak the language or have family

Policies that rip American communities and families apart have no place in America. https://t.co/GFpB0eRj1A"
1233481601167843328,2020-02-28 19:58:25,TFW ⁦@SecPompeo⁩ lies to your face. https://t.co/KyFdoeJj84
1233450720436871169,2020-02-28 17:55:42,"One of the great joys of being home is meeting with our local city councils in the 5th.

Thank you to the St. Louis Park and Brooklyn Center  Councils for the great meetings! 

I was especially touched for the award for our fight on behalf of the Liberian-American community. ✊🏽 https://t.co/dq5VaHOe4Q"
1233408535142289410,2020-02-28 15:08:05,The Secretary of State cannot answer basic questions about the reports from his own department that the Administration put American lives at risk with their actions in Iran. https://t.co/xXQRMrKFhq
1233397697857622017,2020-02-28 14:25:01,"RT @repmarkpocan: Flight attendants trapped in poverty wages are being ignored by executives @United &amp; @airwisconsin.

Four years of negoti…"
1233395575074230273,2020-02-28 14:16:35,"Today, we hold this Administration accountable for their war crimes.

Tune in: https://t.co/D9RTXaqTOV"
1233159121441918976,2020-02-27 22:37:00,"[whispers] If he cared about public health, he wouldn't have tried to gut the Centers for Disease Control."
1233125396272623617,2020-02-27 20:22:59,"RT @TheBlackCaucus: Not only is it imperative that the #2020Census be accurate, it also needs to be fair. 

When entire communities are und…"
1233090501244485635,2020-02-27 18:04:19,🥳 https://t.co/Qqf8rarEq7
1233080986461667328,2020-02-27 17:26:31,"44% of Minnesota’s uninsured are minorities. 

Our needs as members of marginalized communities should not be invisible.

The solution to this problem isn’t to create more means-tested programs. 

It’s to guarantee healthcare as a human right through #MedicareforAll. https://t.co/cCIT43mcNe"
1233069136202342400,2020-02-27 16:39:26,"Often the term ""division"" is used when the real issue is power and oppression. 

Working class people, communities, of color, LGBT Americans, and religious minorities are fighting decades of oppression. 

Fighting for our rights upsets those who have wielded power over us."
1233034434682740739,2020-02-27 14:21:32,RT @RepJayapal: About to join @JacksonLeeTX18 @SSWorks + more to talk about why #MedicareForAll is necessary in the fight for racial justic…
1232818870546829313,2020-02-27 00:04:58,"RT @JamilSmith: Being February 26th, I always think first of Trayvon Martin and his loved ones on this day."
1232816365775486976,2020-02-26 23:55:00,"RT @repmarkpocan: Meet our new coronavirus czar. 

I feel safer already. https://t.co/Ib1oyMNswB"
1232796985364799488,2020-02-26 22:38:00,"All our destinies are linked.  

Just as I fight against dirty pipelines and the destruction of indigenous land in Minnesota, indigenous activists in Brazil are fighting against the destruction of the Amazon. 

So grateful to meet with our Brazilian counterparts this afternoon! https://t.co/ri5Q4Ikpzr"
1232775051566600195,2020-02-26 21:10:50,"After over a century of failure, today we finally passed the #EmmettTill Anti-Lynching Act. 

But the legacy of racist violence is not a thing of the past. 

Philando Castile.
Sandra Bland.
Trayvon Martin.
Eric Garner.
Too many others to list.

The fight for justice continues. ✊🏽 https://t.co/q879OYGnBq"
1232732817097986049,2020-02-26 18:23:01,"RT @seiumn: RT to support the 4,000 @SEIU26 janitors in Minnesota going on ULP strike Thursday fighting for a contract that wins a #BetterT…"
1232732385990578181,2020-02-26 18:21:18,"We have a president who celebrates anti-Muslim hate, who is parading with an anti-Muslim nationalist as mobs loot and attack Muslims. 

Shame! https://t.co/YmfjcI9Uum"
1232730597363257346,2020-02-26 18:14:12,"RT @AmazonWatch: Happening now: @RepDebHaaland  and @Ilhan welcome Congressswomen @JoeniaWapichana, @erikakokay and @fernandapsol Watch the…"
1232706658893271047,2020-02-26 16:39:04,".@RepDebHaaland and I are welcoming a delegation of progressive Brazilian lawmakers to the Hill today.

Progressives around the world must build alliances and share strategies to fight the rise of far-right nationalism! https://t.co/SatK0nq9Qd"
1232448715274645506,2020-02-25 23:34:06,🗣CONTINUING TO SHOWER THE FOSSIL FUEL INDUSTRY WITH $20 BILLION IN CORPORATE WELFARE EVERY YEAR IS CLIMATE DENIAL
1232393577201688577,2020-02-25 19:55:00,"Instead of selling weapons to dictators who murder their own people, we could choose to invest in the communities ravaged by war and oppression. 

A Pathway to Peace is possible. https://t.co/BT751KNedk"
1232321118083649540,2020-02-25 15:07:04,RT @extra630: @Ilhan came to our informational picket!! Support your local support staff and support @MFT59ESP in our fight for a living wa…
1232312990755704832,2020-02-25 14:34:46,"This is why they attack immigrants, refugees and Muslims.

They want to distract from the fact that they're making it easier for bosses to abuse their workers. https://t.co/SOIidDLROs"
1232306139079024640,2020-02-25 14:07:33,What if we as a society decided it wasn't okay for three billionaires to have more wealth than half the country?
1232102408483786753,2020-02-25 00:38:00,"This president continues to let corrupt military contractors sell weapons to human rights abusers.

This should be illegal.
https://t.co/ZaTLEBt7KV"
1232069799108317189,2020-02-24 22:28:25,"As a proud graduate of MPS, I know I wouldn't be here today if it wasn't for the support staff  invested in my education.

They should not have to work two jobs to make ends meet. 

Solidarity with @MFT59ESP and their fight for fair wages! #ESPmakeschoolhappen https://t.co/i0SKCUVckf"
1232065415729291264,2020-02-24 22:11:00,"No child should starve in school in order to fund a tax break for corporations. 
https://t.co/DJdvOrahUx"
1232044193670889473,2020-02-24 20:46:40,"We cannot allow those who seek to divide and intimidate us to succeed. 

We must fight all forms of hate as if they were attacks on ourselves. 

Grateful to all who participated in our town hall on the rise in hate last week. https://t.co/yL0xc3Ar7y"
1232013015349944323,2020-02-24 18:42:47,RT @HouseBudgetDems: The #TrumpBudget makes the wrong kind of news. https://t.co/G1aGlnuqET https://t.co/Z8eIiiwZyP
1232011334717517826,2020-02-24 18:36:06,"Katherine Johnson showed millions of women and girls of color in this country that they could reach for the stars.

May she rest in Power. ✊🏽 https://t.co/EOts35xItl"
1231991593017729024,2020-02-24 17:17:39,"┳┻|
┻┳|
┳┻|
┻┳|
┳┻|
┻┳|
┳┻|
┻┳|
┳┻|
┻┳|
┳┻|
┻┳|
┳┻| _
┻┳| •.•) Donald Trump wants to
┳┻|⊂ﾉ   cut Social Security
┻┳|"
1231983913171591168,2020-02-24 16:47:08,"RT @Hopkins270: Yesterday, Rep. @Ilhan Omar visited @Ike_XinXing270 to serve lunch and talk to the Nutrition Department about how we combat…"
1230994431366574082,2020-02-21 23:15:17,"RT @Ilhan: Here in Minnesota, we may have some of the coldest weather, but we welcome people from hot climates with the warmest hearts.

He…"
1230972528685875201,2020-02-21 21:48:15,"This is why the rich and corporations are so afraid of unions:

They bring people together across superficial barriers to fight for a better life. https://t.co/LplE9nrdlK"
1230959288958554115,2020-02-21 20:55:39,"Happy birthday to a fierce champion of justice, @repjohnlewis!

https://t.co/MsjJOdVUEr"
1230877819258966016,2020-02-21 15:31:55,"There should be nothing controversial about fighting to make sure our children are fed.

There should be nothing controversial about fighting to make sure people have a roof over their head.

In Washington, somehow these are controversial."
1230863243607977986,2020-02-21 14:34:00,"This week, 20 years after I became a citizen, I had the honor of welcoming new Americans at a naturalization ceremony in MN.

As I said:

The beauty of this country is not that we are perfect. It’s that embedded in our constitution and democracy are the tools to make it better. https://t.co/C6XJQNri6G"
1230676308155338753,2020-02-21 02:11:11,"Here in Minnesota, we may have some of the coldest weather, but we welcome people from hot climates with the warmest hearts.

Here in Minnesota, you can barely walk a block without seeing a sign that says “refugees are welcome here” or “Black Lives Matter.” https://t.co/ZJZFwnsPwU"
1230670075499368448,2020-02-21 01:46:25,"“Everything projected against Muslims has been projected against other people... history is repeating itself.” 

- @Jaylanihussein https://t.co/PrIRuId8co"
1230669526410432513,2020-02-21 01:44:14,"“Hollywood is the greatest purveyor of Islamophobia EVER.”

- @Jaylanihussein https://t.co/eKSMCnoA5s"
1230668798254034944,2020-02-21 01:41:20,“2019 was the worst year” for attacks on mosques - @Jaylanihussein
1230668579625930753,2020-02-21 01:40:28,“Our Congresswoman and Rashida Tlaib we’re targets of a campaign...that pushed out information through bots.” - @Jaylanihussein https://t.co/huDdYJ62rJ
1230666543366909952,2020-02-21 01:32:23,Continue watching our event on combating hate in Minnesota: https://t.co/B2x1gTTFcl
1230665798462603272,2020-02-21 01:29:25,“This hate is...rising. And it’s because the white nationalist movement is rising.” - @MonicaMeyerMN https://t.co/OdRBU7PZJf
1230664930099159040,2020-02-21 01:25:58,"“The majority of the hate that we see is against people of color, and predominantly trans people of color” - @MonicaMeyerMN of @outfrontmn"
1230662669046370304,2020-02-21 01:16:59,"Throughout our history, racism and bigotry have been used to stoke fear in order to distract and benefit those in power.

But we know Minnesotans are greater than fear.

WATCH our event on combating hate in MN. https://t.co/aqm3L8759D"
1230639271331143682,2020-02-20 23:44:01,"This fire is polluting the air in the Twin Cities, which will  undoubtedly cause more asthma attacks, school absences &amp; avoidable deaths.

Northern Metals has repeatedly &amp; willfully violated the law –  they should be held criminally liable for their negligence. https://t.co/YFZyXpRRK0"
1230618357248020480,2020-02-20 22:20:54,"When I visit schools in Minnesota, I am often asked what motivates me. 

The answer is I am motivated by you.

I am motivated by creating a better future for my children.

I am motivated by challenging the narrative that we are not capable of change. 
#Fightingforthe5th https://t.co/TZ2QdBDL0u"
1230601278289567747,2020-02-20 21:13:02,"""Why are you being so divisive by proposing overwhelmingly popular policies to eliminate the billions of tons of waste we produce?"" https://t.co/0zzJv5bf1Q"
1230575618972143618,2020-02-20 19:31:05,RT @TheRealNews: Ilhan Omar introduced 7 bills that would steer US foreign policy towards international norms and remove support for human…
1230522499672223750,2020-02-20 16:00:00,No one should be blocked for seeking refuge in this country—or any country—because of their religion or nationality.
1230315857995292674,2020-02-20 02:18:53,"78 years ago today, the U.S. began the shameful process of Japanese-American internment. Decades later, the same law was used to justify the Muslim ban. 

I have introduced legislation to end the targeting of an entire group based only on their nationality. #NeighborsnotEnemies https://t.co/7RZAwAWkrK"
1230307648714743809,2020-02-20 01:46:16,"If my bill to stop arming human rights abuses was in place, we would not be arming Saudi Arabia as they bomb school buses and kill children in Yemen.

It’s time to make the #PathwaytoPeace the law of the land. https://t.co/WV6reO4tOB"
1230177516209475585,2020-02-19 17:09:10,"This is a major victory for @SEIUHCMN!

When workers come together to organize for their wages and benefits, we win. 💪🏽 https://t.co/lz0C4Dy1oz https://t.co/94dwHQh4zr"
1230175461772230664,2020-02-19 17:01:00,"There is no reason why millionaires pay just a fraction of their income into Social Security, while teachers, firefighters and working people pay into Social Security all year.

We need to scrap the cap and *expand* not cut Social Security. https://t.co/h8lfvCUEkg"
1230162390211289090,2020-02-19 16:09:03,"We cannot allow those who seek to divide and intimidate us to succeed. 

Tomorrow evening, I am holding an important conversation on the rise in hate in our community. 

I hope you'll join us! https://t.co/XNJWQM73cX"
1230152163009191936,2020-02-19 15:28:25,"RT @WCCO: ""We Have To Come Together"": Ilhan Omar Outlines Her 'Pathway To Peace' https://t.co/Uf2cmRzGPL https://t.co/5o2GaOKBYr"
1229911583226302464,2020-02-18 23:32:26,"There is nothing like being with the community you love talking about issues that affect all of us.

Thank you to everyone who joined us at the University of Minnesota today to discuss the #PathwaytoPeace https://t.co/zsPzdY7yTC"
1229852477912211457,2020-02-18 19:37:34,"If there is no one to lobby for foreign dicactors, those dictators will not have the power they have.

We can slowly move the world in a direction that is about diplomacy and peace and standing up for human rights. https://t.co/ESwxPeYsdL"
1229846983894065152,2020-02-18 19:15:45,"RT @Jacob_Frey: Cities need more support &amp; resources - not unfunded mandates and misinformation - from GOP legislators. 

Curbing violent c…"
1229846153778388992,2020-02-18 19:12:27,"“The United States has invested heavily in international norms... If human rights aren’t central, it’s simply not possible to engage with adversaries or allies in trying to raise those standards throughout the world.” - @PeterDross11 https://t.co/8POwwmf4TO"
1229844805733273600,2020-02-18 19:07:05,"@UMNews @cvt_staff @HHHSchool When we say we are the champions of human rights and democracy on the international stage, we should mean it.

 We have an indispensable role to play in the world – this gives us the opportunity to dramatically improve people’s lives. https://t.co/ZMEf8yVGwW"
1229842317969895426,2020-02-18 18:57:12,@UMNews @cvt_staff “We can have a say in what are the values that we want promoted. We’re agreeing to come to the table and play on the same playing field as everyone else...treaties make states better actors on human rights” - Barbara Frey of @HHHSchool
1229841533886779393,2020-02-18 18:54:05,"@UMNews @cvt_staff “It’s important to remember  from a small few, all of us are newcomers in this neighborhood and this community.” - @HHHSchool Dean Laura Bloomberg on the immigrant legacy in Minnesota"
1229841216675700736,2020-02-18 18:52:50,@UMNews @cvt_staff “Much is the violence  that we see in Colombia and Honduras has ties to U.S. military aid.” - Maria Mendez with the University of Minnesota https://t.co/JKF65vECyl
1229840786180788226,2020-02-18 18:51:07,Continue watching our town hall on a #PathwaytoPeace here!  https://t.co/VH6SaiPHNY
1229839061441007622,2020-02-18 18:44:16,@UMNews “The current administration has been engaged in an all out assault on people seeking asylum and the refugee program in the United States” - Peter Dross of @cvt_staff https://t.co/9wzpOYYaSW
1229830747411927040,2020-02-18 18:11:13,"I believe in a world where there are no young girls living through war, and no nations that are being destroyed.

Today, I am discussing that vision at the @UMNews! #PathwaytoPeace

TUNE IN: https://t.co/Fvj0RcYHmu"
1229794557145092106,2020-02-18 15:47:25,"Hate is on the rise.

Across our state and country, religious, racial minorities and other marginalized communities are being targeted.

This week, we'll hold a conversation on the rise in hate and how we confront it.
https://t.co/XNJWQM73cX"
1229469693095878657,2020-02-17 18:16:31,Join us tomorrow at the University of Minnesota for a conversation about a foreign policy based on peace! #PathwayToPeace https://t.co/PFLLGkMRE9
1229154987155943425,2020-02-16 21:26:00,"The American people are fed up with endless war. 

The American people don’t want more than half of our discretionary spending going to a bloated Pentagon budget.

Now more than ever, there is room for a new consensus that rejects militarism and embraces peace. #PathwaytoPeace"
1228685896301436935,2020-02-15 14:22:00,"This is a microcosm of everything that is wrong with our immigration system:

Blocking a grieving mother and father from being with their daughter because of their ethnicity and religion. https://t.co/pdjjfI7qGv"
1228442468171079680,2020-02-14 22:14:42,"RT @unitehere: Rep. @Ilhan Omar stopped by to show her support for UNITE HERE Local 17 catering workers at @mspairport!

On this @Delta pro…"
1228430463292731392,2020-02-14 21:27:00,"Excited to hold two community conversations in Minnesota next week!

Community Conversation on my Pathway to PEACE https://t.co/PFLLGkvgfz

Greater Than Fear: Community Conversation on Combating Hate https://t.co/XNJWQMoE4v"
1228425849826836480,2020-02-14 21:08:40,@AnasSarwar ♥️
1228408761913630720,2020-02-14 20:00:46,RT @RStatecraft: We sat down with Rep. @Ilhan Omar this week to discuss her new “Pathway to Peace” proposal and how it can counter the wors…
1228350938932502529,2020-02-14 16:11:00,"🤔The right loves to lecture us about spending when it comes to making sure people's basic healthcare needs are met.

But when it's time to give tax breaks to their campaign donors, or bail out Wall Street, or start another endless war, they're silent. https://t.co/7om4QKHWeb"
1228329499005214720,2020-02-14 14:45:48,"RT @Salon: Ilhan Omar unveils bold proposal for U.S. foreign policy ""deeply rooted in justice"" https://t.co/7j6Rw3BLLT"
1228328711759572993,2020-02-14 14:42:40,No one should have a billion dollars while another goes hungry in the streets.
