id,created_at,text
1247280835360886784,2020-04-06 21:51:39,We need free testing and treatment for all. Period.
1247249556435275777,2020-04-06 19:47:21,"Holding people in prison for hundreds of dollars in cash bail is always immoral. 

During a global pandemic, it can be a death sentence."
1247218711976648705,2020-04-06 17:44:47,"COVID-19 shows that we are all connected.
 
Today at 2pm CT/3pm ET I will be joining the Racial Justice Has No Borders virtual town hall to talk about militarization during this pandemic.
 
You can watch and register here: https://t.co/Ak2Q4tE1oM"
1247199749737938946,2020-04-06 16:29:26,"Today I led letters to @Apple, @Amazon, @Google, and others condemning their use of forced Uyghur labor in China. 

American companies represent this country in business abroad. 

It is essential their values are in line with basic human rights. https://t.co/Kix5glDT3D"
1247141189150703616,2020-04-06 12:36:44,Cancel it all right now. https://t.co/oPHnbznYcz
1246984386341470209,2020-04-06 02:13:40,"RT @US2SOMALIA: @harunmaruf is a respected, professional @VOANews journalist &amp; one of the most influential #Somali journalists.  @HSNQ_NISA…"
1246814853186162690,2020-04-05 15:00:00,"Millions of people are waiting for money from the $2.2 trillion spending bill.

It shouldn’t be this hard to hand out money in a time of crisis. 

The President is failing once again. #WhereIsTheMoney"
1246527963606192128,2020-04-04 20:00:00,"Refugees saving the world 💗💪🏽

https://t.co/y4QHGWeSM5"
1246467567759364096,2020-04-04 16:00:01,"Abortion is healthcare. 

Stripping this essential right is unconstitutional. 

We have our eyes on all states trying to rollback reproductive rights.

https://t.co/5zbmxoGDW4"
1246151630342565889,2020-04-03 19:04:35,"We need to publicly guarantee healthcare now.

How is this even controversial during a pandemic? https://t.co/SB5uyeN72F"
1246132949583609858,2020-04-03 17:50:21,Proud of our city for going above and beyond and not discriminating against our neighbors based on their immigration status! https://t.co/727a7AvKVd
1246112984767909890,2020-04-03 16:31:01,"We need to cancel school meal debt. 

Today, @RepDebHaaland and I introduced legislation to stop collecting unpaid meal fees during this pandemic. 

No child should go hungry due to ongoing meal debt."
1246096742245941251,2020-04-03 15:26:29,Good thing he has his mind on the pandemic. https://t.co/6kc2enrhLn
1246075745400532992,2020-04-03 14:03:03,"RT @SXMProgress: ""The level of incompetency and narcissism... Is completely appalling. We want [Trump] to pay attention, lead, be honest, n…"
1246059879107788801,2020-04-03 13:00:00,"10 million people have lost their jobs in the last two weeks.

We need to put an end to the immoral system that ties healthcare coverage to employment.

We need Medicare for All."
1245828133036519430,2020-04-02 21:39:07,Grateful the Minnesotans on board will be able to get home and get the care they need. ❤️ https://t.co/agLY7bF1Lj
1245811974954463239,2020-04-02 20:34:55,RT @DeanObeidallah: Tonight Rep @Ilhan (D-MN) joins me on my @SXMProgress show to discuss the coronavirus outbreak situation in her state a…
1245801282180460544,2020-04-02 19:52:26,"I stand with @GoIUPAT and ALL workers across the country demanding guaranteed healthcare, expanded family leave, and pension relief. 
 
We need to put #WorkersFirst.✊🏽 https://t.co/w6CerKppCc"
1245780800563556354,2020-04-02 18:31:02,.@realDonaldTrump where are the tests and supplies? https://t.co/FDjXgElMUA
1245750640158138370,2020-04-02 16:31:12,"RT @RepRaulGrijalva: Republicans wanted to scale back relief for Native Americans. The White House wanted to give $0 to tribes.

Democrats…"
1245744631914147846,2020-04-02 16:07:19,"Jan 22:
Reporter: Are there worries about a pandemic? 

Trump: No, not at all. We have it totally under control. 

Now:
Trump: I’ve always known this is a real pandemic.                               

🤔
https://t.co/qpjdKsi7W2"
1245719232014360577,2020-04-02 14:26:23,"6.6 million Americans filed for unemployment this week.

We can't just put a band-aid on this crisis. We need:

-Universal and monthly cash assistance
-Rent and mortgage moratorium
-Student debt cancellation
-Free testing AND treatment for all"
1245501793846648839,2020-04-02 00:02:22,"Trump’s COVID-19 response then vs. now. 
 
His gross negligence will forever be remembered. https://t.co/qpjdKsi7W2"
1245471330243416064,2020-04-01 22:01:19,"At 5:30pm CT I will be hosting a digital small business roundtable with @MayorFrey and @Mohamudnoor to discuss available resources to small business owners. 

Make sure you tune in at: https://t.co/HPYO1d9cuF"
1245452916447739908,2020-04-01 20:48:09,"Trump’s failed leadership led to this dismal projection. 
https://t.co/aXOgHxgRWo"
1245433471725711360,2020-04-01 19:30:53,THE TRUMP ADMINISTRATION IS DISTRIBUTING OUR NATIONAL STOCKPILE OF FACE MASKS TO ICE AGENTS INSTEAD OF HOSPITALS. HOW DEPRAVED CAN THEY GET? https://t.co/jIoMI2fMz5
1245430738343911426,2020-04-01 19:20:01,"RT @RepBarragan: Talk about wrong priorities!

Nat'l stockpile of protective equipment for doctors &amp; nurses is nearly empty, but Trump Admi…"
1245422086342029314,2020-04-01 18:45:38,"TONIGHT: I’ll be hosting a digital small business roundtable at 5:30pm CT. 

Make sure you tune in to learn about federal, state and local resources for small business owners. 

Watch at: https://t.co/bJ5twV5Ej8 https://t.co/df5werbqlj"
1245388418542120963,2020-04-01 16:31:51,"It’s April 1st and millions won’t be able to pay rent. 

|￣￣￣￣￣￣| 
| HALT             | 
| ALL                | 
| EVICTIONS   | 
| ＿＿＿＿＿__| 
(\__/) || 
(•ㅅ•) || 
/ 　 づ"
1245337416623435776,2020-04-01 13:09:12,"Today is Census Day.
 
Now more than ever, it’s crucial you participate to get the funding our communities deserve.
 
You can fill it out online at https://t.co/Ks1lomlpor. Let’s get counted! https://t.co/oZz1hLTqI8"
1245131259325476864,2020-03-31 23:30:00,"Women. Deserve. Equal. Pay. For. Equal. Work. 

https://t.co/4AJhofha9R"
1245107595695861760,2020-03-31 21:55:58,"Retaliating against an employee for labor organizing is a federal crime. 

This is at best cruel and at worst criminal. https://t.co/hKjEJqKltD"
1245094768847224838,2020-03-31 21:05:00,"Happy #TransDayofVisibillity to all non-binary and trans people.  

You are seen, supported, and valued."
1245075397504573440,2020-03-31 19:48:01,"I led a letter with @RepAOC and @SenSanders demanding this Administration end sanctions against Iran during the COVID-19 pandemic. 

These sanctions aren’t changing the behavior of the Iranian government, but directly punishing innocent civilians. 
https://t.co/odymQAN3cn"
1245002002808991744,2020-03-31 14:56:23,"Too many small businesses in Minnesota are hurting. 
 
I’ll be hosting a digital roundtable this Wednesday at 5:30pm CT to answer your questions and discuss available resources to small business owners during this difficult time. https://t.co/1HseskWVeA"
1244986865985499138,2020-03-31 13:56:14,We need to cancel all economic sanctions during this crisis
1244745456648945664,2020-03-30 21:56:57,RT @GovTimWalz: Our front-line health care professionals deserve our complete support - that starts with giving them the tools they need to…
1244728507810414594,2020-03-30 20:49:36,"Release all migrant children from ICE custody. 

It will save lives.
https://t.co/em4oPyXaGp"
1244694170293415936,2020-03-30 18:33:10,"🗣️@Amazon stop neglecting the safety of your employees. 

Solidarity with all Amazon workers.✊🏽 https://t.co/SWhwsWyFM9"
1244655711935758343,2020-03-30 16:00:20,"This crisis has shown why we need to pass Medicare for All. 

We needed it before and we need it now more than ever."
1244362916964466690,2020-03-29 20:36:53,"🇩🇰 75% of people’s salaries funded.

🇬🇧 80% of workers’ wages paid for.

🇨🇦 Everyone out of work gets $2,000 a month.

🇺🇸 One-time $1200 check for some.

$1200 is not enough to address this crisis. We need universal and monthly financial relief for all Americans!"
1244323437897637890,2020-03-29 18:00:00,"Fear is never an excuse for racism. 

This Administration has repeatedly injected an ethnic qualifier to COVID-19. This is not only xenophobic, but extremely dangerous to Asian Americans.  

Hate has no place here. 

https://t.co/sdZMociByO"
1243945949363179526,2020-03-28 17:00:00,"46 million Americans are shackled by student debt. 

During this uncertain time, the last thing people need to think about is making a loan payment. 

It’s time to cancel student debt. All of it. 

https://t.co/Yl1OxGBAj7"
1243611873297215489,2020-03-27 18:52:30,"Today I voted yes on the COVID-19 relief package. 

It gives immediate cash assistance to Americans, direct money to small businesses, and provides badly needed help to hospitals. 

This is just the beginning. I'm going to continue to work to provide more help to all Americans. https://t.co/TIQCC6ibNF"
1243602578803494912,2020-03-27 18:15:34,"The same industries who are asking for bailouts are putting American lives at risk.

It’s shameful."
1243600611628679168,2020-03-27 18:07:45,I’ve requested a call with @HALcruises CEO &amp; am waiting for their response.
1243600442732527618,2020-03-27 18:07:05,"4 people have now died on this ship. Many are sick, including 4 Minnesotans.
 
@HALcruises *knew* they were putting lives at risk.
 
@HALcruises needs to get people medical care urgently.
 
And we need full accountability for the decision to embark without a contingency plan. https://t.co/bdwl98I8f4"
1243584911304425474,2020-03-27 17:05:22,"Amazon is putting the lives of workers at risk by exposing them to COVID-19.
 
That's why I led a letter with @SenSanders demanding a response plan to protect Amazon workers during this pandemic. https://t.co/yyuOaAmem9"
1243569722563715074,2020-03-27 16:05:00,Heading to the House Floor to speak on our coronavirus response. Tune in! https://t.co/96x7eUPVrc
1243565008568619013,2020-03-27 15:46:17,"All deportations need to stop. 
 
All immigration court proceedings need to stop. 
 
ICE can't continue to terrorize people during this pandemic. https://t.co/pFBj0gRpvO"
1243293832583798788,2020-03-26 21:48:43,"We need to do everything in our power to get much needed assistance to the American people.
 
Here's what is included in the final coronavirus package.👇🏽 #FamiliesFirst https://t.co/tWJwj4nq4P"
1243261697885954049,2020-03-26 19:41:02,"If this crisis has taught us anything, I hope it is this: that we are all connected by our common humanity.

This week I hosted a digital town hall to talk about COVID-19 and provide an update on the relief package. https://t.co/J8Tsc108TQ"
1243209241856487427,2020-03-26 16:12:35,"When we organize, we win! ✊🏽 https://t.co/0AXu6EuwIr"
1243204719994159104,2020-03-26 15:54:37,"Everyone counts in the #2020Census. It will determine the amount of representation and funding our communities receive. 
 
You can complete it by: 
✔️Mail 
✔️Over the phone: 1-844-330-2020
✔️Online: https://t.co/Ks1lomlpor"
1242921913476952065,2020-03-25 21:10:51,"We’re in this together. 
 
I know this is a difficult time. Remember to check in with your loved ones. We will get through this.💪🏽"
1242903278922477568,2020-03-25 19:56:48,"All non-essential employees will need to stay at home unless it’s necessary to leave. 
 
Essential employees include workers in healthcare, childcare, news media, critical manufacturing, agriculture, energy, water and waste management."
1242903277882298374,2020-03-25 19:56:48,"Minnesotans can still go to the grocery store, pharmacy, get take-out from restaurants, go outside, and help pick up essentials for neighbors in need. Remember to keep practicing social distancing."
1242903276863053824,2020-03-25 19:56:47,"This order will last 2 weeks and will start on Friday at midnight. The goals are to build hospital capacity, increase # of ventilators, increase testing, get more equipment for healthcare workers, and plan for how to take care of vulnerable populations."
1242903275181137920,2020-03-25 19:56:47,"Governor Walz just announced a stay at home order for Minnesota. 
 
This order is needed to slow the spread of the virus and keep each other safe. I wanted to explain @GovTimWalz’s order. Read this thread to learn more: https://t.co/nCJ3XgiHIR"
1242896632921960449,2020-03-25 19:30:23,"RT @GovTimWalz: We must take bold action to save the lives of Minnesotans. As a former Command Sergeant Major in the Army National Guard, I…"
1242881108712308736,2020-03-25 18:28:42,"ICE now has a confirmed person in custody with COVID-19. 
 
Keeping people locked in immigration detention facilities with no access to essential healthcare services is unconscionable. 
 
This situation will only get worse until @DHSgov takes immediate action to save lives. https://t.co/aFdZTfvUfC"
1242868996954865664,2020-03-25 17:40:34,"Blood banks are in dire need of donations. I encourage those who can give to do so!
 
In the meantime, we must lift the ban on gay men &amp; bi/trans people barred from donating.
 
This outdated policy needs to be overturned immediately.  
 
https://t.co/XjJk4ED8hA"
1242851590828064771,2020-03-25 16:31:24,RT @patricktcondon: Phillips is not only MN rep who's had legislation folded into coronavirus bills. Rep. Ilhan Omar's office flags that a…
1242611891274424320,2020-03-25 00:38:56,👇🏽 https://t.co/six9xd3IPL
1242588982157938690,2020-03-24 23:07:54,"RT @GovTimWalz: Thank you, Minnesota. You’re clearly making sacrifices and doing your part to make sure our hospitals have the supplies nec…"
1242579934612271106,2020-03-24 22:31:57,"I will not support a bill that prioritizes a $500 billion corporate slush fund over financial relief to workers, families, and communities.
 
Let’s get our priorities straight. https://t.co/52ZYbteJMW"
1242561805744046081,2020-03-24 21:19:54,"We can’t turn our backs on refugees, asylees, or immigrants.
 
That’s why I led a letter to House leadership to protect our neighbors during the COVID-19 pandemic. https://t.co/mZDgPWP1ja"
1242532643671023616,2020-03-24 19:24:02,"Evictions should be halted. 
 
Healthcare should be universal. 
 
Student debt should be canceled. 
 
Bill payments should be suspended. 
 
We need to #PutPeopleFirst."
1242512627789631490,2020-03-24 18:04:29,"We need to cancel student loan debt NOW.

Yesterday, @RepPressley and I introduced legislation to cancel student debt as part of the COVID-19 emergency stimulus package.

No one should be shackled by debt during this crisis. https://t.co/COrfznhA1X"
1242471323722551297,2020-03-24 15:20:22,"I’m proud of the way Minnesotans continue to show up for one another. 
 
We have to take care of each other through this crisis.  
 
https://t.co/4KSUOw9IDL"
1242210499061788677,2020-03-23 22:03:56,"We're live on Facebook answering your questions about the coronavirus crisis.

Join us 🎥: https://t.co/DOGExjFhJ7 https://t.co/oU8ztQg7T4"
1242194481060950017,2020-03-23 21:00:17,"Tune in tonight at 6:00 ET/5:00 CT to my Facebook town hall. I’ll be answering your questions and discussing the federal response to the coronavirus crisis. 
 
Watch here: https://t.co/hgj1lnOi78"
1242182367843934211,2020-03-23 20:12:09,"We need to protect people, not corporations. 
 
Since the beginning of this crisis, I’ve worked to get money in the hands of the American people, protect small businesses, and slow job losses. Read my op-ed 👇🏽
https://t.co/LjQwfvHtH8"
1242172791438422017,2020-03-23 19:34:06,"As we get more COVID-19 test supplies, we will continue to see confirmed cases rise.
 
Don’t panic. This will allow resources to go to areas that need them the most."
1242164462456627208,2020-03-23 19:01:00,"He is trying to reduce access to healthcare in the middle of pandemic.

Insanity. https://t.co/rrONamjKag"
1242158164491018242,2020-03-23 18:35:59,"RT @DebtCrisisOrg: #COVID19 UPDATE: After Senators failed to approve an economic stimulus, @RepPressley and Rep. @Ilhan proposed legislatio…"
1242120001613635588,2020-03-23 16:04:20,"I am devastated to hear about the loss of Ron Flanagan. 

Peggy is one of the best public servants we have. She has led our state with courage and conviction during this crisis—and I know how much her brother meant to her. https://t.co/xF8fjWF6UR"
1242119564831477761,2020-03-23 16:02:36,My heart goes out to Amy and her entire family during this difficult time. Wishing John a speedy recovery! https://t.co/L8Pp6pDVbG
1241779298245246977,2020-03-22 17:30:30,"Tomorrow I’m holding a Facebook town hall to discuss steps we’re taking at the federal level to confront the coronavirus crisis.

Tune in and share your questions! 🎥: https://t.co/hgj1lnOi78 https://t.co/EzNtonNUcS"
1241422500401164288,2020-03-21 17:52:43,"My heart goes out to the family and all those impacted.

We must all do everything we can to confront this crisis. https://t.co/uAe345p1cd"
1241421445420507138,2020-03-21 17:48:31,RT @RepPressley: Simply pausing #studentloan payments during this crisis is not enough. We MUST #CancelStudentDebt as part of any #COVID_19…
1241096639160483840,2020-03-20 20:17:51,"RT @WCCO: Rep. Omar led a letter calling for a suspension of interior immigration enforcement, a deportation freeze and a comprehensive pla…"
1241090168054046723,2020-03-20 19:52:09,"Monday at 5:00 CT I will be holding a digital town hall to give an update on our coronavirus response and answer your questions.

Join us! 🎥: https://t.co/hgj1lnOi78 https://t.co/YlfrjWtgiE"
1241062796697182208,2020-03-20 18:03:23,"ICE continues to deport people who may have the COVID-19—risking the spread of the virus around the world.

My colleagues and I are calling for a deportation freeze and a comprehensive plan to prevent an outbreak in immigration detention facilities https://t.co/ldr474dLfi"
1241026450037395460,2020-03-20 15:38:57,"Yes. We must do everything we can to bring home Americans trapped abroad right now.

And we should not be spending billions of taxpayer dollars to bail out an industry that is leaving Americans stranded during a global pandemic. https://t.co/zJkPJ07BU0"
1241018297157632001,2020-03-20 15:06:33,"RT @seiumn: A huge THANK YOU to the janitors, security officers &amp; other @SEIU26 property service mbrs who are still on the job making sure…"
1240746865538277376,2020-03-19 21:07:59,"We've updated our coronavirus microsite, which has resources for Minnesotans on everything from travel to unemployment, small business, mental health, and immigration. 

https://t.co/PwJosT63vy"
1240663580334329857,2020-03-19 15:37:02,"🚨 I am introducing a major package today based on 3 principles:

1. We need to put money in the hands of the American people now.
2. We need to protect small businesses and slow job loss now.
3. We cannot fund giveaways to corporations.

Details: https://t.co/qyprikjfQi https://t.co/HQntKY7NwN"
1240344966267834368,2020-03-18 18:30:59,"I'm proud to be one of them. 

It is unconscionable to evict and foreclose on Americans in the midst of a pandemic and economic crisis. https://t.co/ejrIpYgXtd"
1240297566971072512,2020-03-18 15:22:38,"We *must* do more to get immediate assistance to Americans struggling in this crisis. 

For Minnesotans disconnected from a job through no fault of their own, you can apply for unemployment insurance here. 
https://t.co/r1LfPzej6Y"
1240041828851879937,2020-03-17 22:26:25,RT @GovTimWalz: We must do everything we can to support workers who are negatively impacted by #COVIDー19. That is why I signed an Executive…
1239991119485820928,2020-03-17 19:04:55,"RT @grove: To the hundreds of thousands of Minnesota workers affected by today's business closures, we know how incredibly difficult this i…"
1239954793617141762,2020-03-17 16:40:34,"RT @repmarkpocan: This is inhumane. 

We should be protecting all people from this pandemic.

ICE is putting people's lives at stake and th…"
1239896343872770050,2020-03-17 12:48:19,Waxaan dhawaan meel mariyay sharci dhamaan ardayda u ogolaanaya cunto bilaash ah. 💪🏽
1239896152000139264,2020-03-17 12:47:33,"Dugsiyada Dadweynaha ee Minneapolis ayaa waxay siin doona ardayda cunno inta ay iskuulada u xiran yihiin cudurka fayraska ee loo yaqaano COVID-19. 

Cunno bilaash ah dhamaan ardayda!

Fadlan riix lifaaqa hoose meesha kuugu dhaw.
https://t.co/tpXCDgmuSH"
1239672429754175488,2020-03-16 21:58:33,RT @MayorFrey: The ability to act decisively will be key in responding to the evolving threat posed by COVID-19. We will remain in contact…
1239668486839980033,2020-03-16 21:42:53,"❤️Minneapolis Public Schools are continuing to provide students with school meals during school closures.

Free to any student!

I recently passed legislation to make this possible across the country.

Head here to find the closest location:
https://t.co/RPs4olAp9d"
1239616287354933250,2020-03-16 18:15:28,"RT @timnelson_mpr: Minnesota Department of Health: State has opened a new hotline to take questions on COVID19 and schools. 800-201-3920, a…"
1239562637211578368,2020-03-16 14:42:17,"Everyone in Minnesota who needs a coronavirus test must be able to access one.

This is a matter of life and death. 

That's why every Democrat in the MN Congressional Delegation sent a letter to @VP to ensure our state has the necessary supplies. https://t.co/xSQV7stoBx"
1239282730149597184,2020-03-15 20:10:02,Here’s an idea: vote on our bill. https://t.co/ceZBciaU0P
1239250171906662401,2020-03-15 18:00:39,RT @StarTribune: BREAKING: Schools across Minnesota will close for eight school days starting Wednesday to try to slow the spread of COVID-…
1238964925319520257,2020-03-14 23:07:11,Now would be a good time to cancel all student debt.
1238808715307950082,2020-03-14 12:46:28,"My bill to make sure 22 million kids continue to get school meals passed as part of the #FamiliesFirst Coronavirus Response Act!

As a former nutrition educator, it is an honor to be able to address hunger for kids across Minnesota and this country. 💪🏽 https://t.co/wP3MP1HEM6"
1238548493305892864,2020-03-13 19:32:26,"I held a call today with @GovTimWalz and the Minnesota Congressional delegation on our state's coronavirus response.

Our top priority right now is testing, testing, testing. Please head to the @mnhealth site for all the latest updates:
https://t.co/CEweDBmQxZ https://t.co/IDxuGfzfHy"
1238454463284875264,2020-03-13 13:18:48,We need to suspend these sanctions before more lives are lost https://t.co/G9ow3GgsHr
1238232221389148165,2020-03-12 22:35:41,We should be immediately suspending evictions and foreclosures and dedicating significant resources to housing our homeless population.
1238167560694235136,2020-03-12 18:18:45,"The proclamation DOES NOT apply to US citizens &amp; permanent residents or their immediate family members. 

 Please reach out to my office if you or a family member will be impacted.

(612) 333-1272"
1238167410684973057,2020-03-12 18:18:09,"I also want to share an update on the President’s latest travel ban. Like the other travel bans, we expect confusion and chaos at airports when this goes into effect tomorrow."
1238167337129390080,2020-03-12 18:17:51,"Responding to Coronavirus is the top priority of my office. For public safety reasons, we have put any large public gatherings on hold, including this Friday’s labor town hall. https://t.co/BBS3ppS4k6"
1238115872646074369,2020-03-12 14:53:21,RT @ANCA_DC: Armenian Americans in Minnesota and across America thank @IlhanMN for signing the #Armenian Caucus letter in support of FY21 #…
1238109864494276609,2020-03-12 14:29:29,"What exactly do they oppose?

Is it the free testing for coronavirus?
The paid emergency medical leave?
Unemployment insurance?
Meals for hungry kids?
https://t.co/xeVA2Zm1AR"
1238092625955217408,2020-03-12 13:20:59,"UPDATE: My bill is included in the the Families First Coronavirus Response Act headed to the House Floor today!

I am thrilled that we will be able to provide kids with healthy meals during this time. https://t.co/lM6bd7hVQl"
1237889175354998784,2020-03-11 23:52:32,"RT @MuslimAdvocates: ""As the only member of Congress born in one of those banned countries and has relatives in another, I know firsthand h…"
1237825746858577923,2020-03-11 19:40:30,"As schools close due to the coronavirus threat, we cannot forget the children who face hardship as a result. 

22 million children rely on federally subsidized school meals.

Today, I introduced a bill to ensure they continue to get the meals they need.💪🏽https://t.co/UtW45oTfP0 https://t.co/hkUEEQzLhH"
1237768682631245825,2020-03-11 15:53:45,"At noon, I will be presiding over the House Floor ahead of a historic rule to consider the #NoBanAct.

This is a moving victory for all those who came together in Minnesota and around the country to organize against this hateful ban.

Tune in:
https://t.co/EKdyCHw8uV"
1237590331526242304,2020-03-11 04:05:03,RT @SpeakerPelosi: Bigoted statements which spread misinformation and blame Asians and the Asian American community for #coronavirus make u…
1237482371005534214,2020-03-10 20:56:03,"RT @CAPAC: As the CDC said, ""Stigma is the enemy of public health."" It's time to put public health first, and that's why @CAPAC, @TheBlackC…"
1237437480137302022,2020-03-10 17:57:40,Solidarity with all the educators in Minnesota marching today! ✊🏽✊🏽 https://t.co/iK0iaWp2eJ
1237423735524732929,2020-03-10 17:03:03,RT @GovTimWalz: Preparing our state for #COVIDー19 has become our top priority. This pressing public health crisis transcends partisanship.…
1237421702805622785,2020-03-10 16:54:58,"Viruses don't have nationalities. 

This is racist. https://t.co/edNDoe1LI9"
