id,created_at,text
1217152274931298305,2020-01-14 18:31:30,"Holding people in suspense about what could be a matter of life and death is unconscionably cruel. 

Today I am joining advocates and those directly impacted to call for an extension of Temporary Protected Status for Somali-Americans.
https://t.co/8Qpn2AqV8m"
1217134165356941313,2020-01-14 17:19:32,"The Secretary of State is skipping today's hearing, but @HouseForeign is will not let that deter us from conducting oversight of this Administration. 

Tune into today's hearing here. 
https://t.co/U252bbqHZm"
1217077745500524544,2020-01-14 13:35:21,"Because if we don’t stand for human rights, women’s rights, and democracy in every corner of the globe, we don’t stand for them at all."
1217077384870006785,2020-01-14 13:33:55,"Do we stand with the black, indigenous, immigrant, LGBTQ+, Muslim and Jewish communities protesting oppression by your administration here in our country?"
1217077228200218625,2020-01-14 13:33:18,"Do we stand with the Egyptians who face oppression?
 
Do we stand with Indian Muslims who face oppression?

Do we stand with Hondurans, Afro-Brazilians and Brazilian indigenous people, Filipinos, and Cameroonians?"
1217077030535204865,2020-01-14 13:32:30,"I presume you say we stand with the Iranian people because we oppose the regime’s crackdown on human rights, women’s rights, and democracy. I agree.
 
Do we stand with the Saudi people who face similar oppression from their government?"
1217076745322496000,2020-01-14 13:31:22,"In what way is preventing the import of foreign medicine to cancer patients in Iran standing with them?
 
In what way is threatening to bomb Persian cultural heritage sites standing with Iranians?"
1217076648404799490,2020-01-14 13:30:59,"The President has been tweeting in Farsi all weekend, repeating a message you have often given, which is that we are standing with the Iranian people.
 
In what way is banning Iranians from entering the United States standing with them?"
1217076506964434945,2020-01-14 13:30:26,"The President has repeatedly said he is looking for a deal with Iran after he tore up the JCPOA.
 
Why, after leaving the JCPOA, after maximum pressure, after killing Soleimani, after threatening to bomb cultural sites, would the Iranians be more likely to agree to a new deal?"
1217076231683919872,2020-01-14 13:29:20,".@SecPompeo is *refusing* to testify before @HouseForeign, the committee that oversees the State Department, about the escalation with Iran.

Since the administration is not allowing us to do our constitutional oversight, I will share what I would have asked him."
1216839762327285762,2020-01-13 21:49:41,"Thank you for helping to lead this effort, Chairman! https://t.co/lJZizOVKYc"
1216806689128820736,2020-01-13 19:38:16,"This is explicit anti-Muslim bigotry and it is being virtually ignored.

Every day, Islamophobia is normalized in our politics. https://t.co/Io6f5yjzwj"
1216804513891475456,2020-01-13 19:29:37,"10 years after the earthquake that devastated Haiti, the people of Haiti need us now more than ever. 

I will continue to stand with the Haitian people who are fighting to have their voices heard,  end corruption, and to have a government that functions on behalf of its citizens"
1216790008167849985,2020-01-13 18:31:59,"Wall Street financing of corporate polluters since 2016:

JPMorgan Chase: $196 billion 
Wells Fargo: $151 billion
Bank of America: $106 billion

Wall Street is funding the destruction of our planet. https://t.co/MrjFuxPXRM"
1216393717420118021,2020-01-12 16:17:16,RT @rolandsmartin: ICYMI: @AyannaPressley @IlhanMN talk Black economic opportunity in Boston https://t.co/1p6yrL2sFw
1216393636042235906,2020-01-12 16:16:56,RT @lisakashinsky: @RepPressley @Ilhan @RepJahanaHayes @RepBonnie @RepGwenMoore @RepKarenBass @titojackson @malialazu @itsheatherwhite @rev…
1216058307066179585,2020-01-11 18:04:28,Congratulations to President Tsai @iingwen and the Taiwanese people on your election! I will always stand with those standing for democracy and human rights.
1216036146888749058,2020-01-11 16:36:24,"RT @RepPressley: This morning, we went behind the wall at MCI Norfolk to discuss the needs of inmates and center their humanity as we reima…"
1216025224187195392,2020-01-11 15:53:00,"RT @quincyjwalters: The Congressional Black Caucus is visiting Boston for the first time.  Congresswoman Ayanna Pressley says this weekend,…"
1215889411398938629,2020-01-11 06:53:20,"RT @RepPressley: When America gets a cold, Black people get pneumonia. More below ⬇️ #CBCStateOfBlackAmerica #MA7 https://t.co/0ufolZswaf"
1215771147922477056,2020-01-10 23:03:24,RT @RepPressley: Countdown to the historic 1st visit by @TheBlackCaucus to #MA7! Excited to welcome the #BlackGirlMagic #squad - @RepKarenB…
1215682374526259200,2020-01-10 17:10:39,RT @BettyMcCollum04: The Minnesota delegation is united in rooting on the @Vikings against San Francisco tomorrow! #SKOL! https://t.co/dYxj…
1215682366485803008,2020-01-10 17:10:37,"RT @RepDeanPhillips: After no deliberation whatsoever, the Minnesota congressional delegation is pleased to announce bipartisan support for…"
1215676077311434752,2020-01-10 16:45:37,"We may not agree on everything, but we come together to root for the @Vikings!

#Skol #GoGetIt https://t.co/JZgGnAyXay"
1215637503861981185,2020-01-10 14:12:21,"RT @MPRsLauraMc: Next hour on Morning Edition, @Ilhan  joins @CathyWurzer to talk about #Iran and the War Powers resolution"
1215412816812937217,2020-01-09 23:19:31,"The rocket attacks this week against bases that house our soldiers in Iraq have given us all a painful warning of what this escalation can look like. 

For the sake of the American people and people around the world, we must speak out against another war. #NoWarwithIran https://t.co/PXxjXYTsNZ"
1215396437388865540,2020-01-09 22:14:26,"RT @WinWithoutWar: .@ilhan reminding us of war's true costs: War only steals futures. It doesn't create prosperity.

That's why today we ar…"
1215346373043814406,2020-01-09 18:55:30,They want the planet to burn. https://t.co/pe83lSvrZK
1215330626024415232,2020-01-09 17:52:55,"Thank you @GovTimWalz and @LtGovFlanagan for investing in public housing!

Every Minnesotan deserves a safe, reliable, and affordable place to call home. https://t.co/1ijXuBCO7r"
1215325571800010760,2020-01-09 17:32:50,"It is because of the grave risks of war that our founders made it so difficult to engage in armed conflict. 

Only Congress has the power to declare war.

And today, the House will exercise our Constitutionally-guaranteed power to say loudly and clearly:

#NoWarWithlran https://t.co/VrBPycMhFa"
1215112170033336320,2020-01-09 03:24:51,"RT @RepJayapal: Racist tropes are beneath members of Congress. It shouldn’t have to be said, but here we are.

BTW: You should talk to Sens…"
1215034573228298241,2020-01-08 22:16:31,"War destroys lives.

It takes away futures and it destroys generations. 

I learned that lesson at the young age of 8.

The world and the American people asking us to act differently this time. 

#NoWarwithIran https://t.co/Vey5H3xgxh"
1215020766401564675,2020-01-08 21:21:39,RT @AlexLimonNews: .@IlhanMN says President Trump is both an arsonist and a fireman. He creates a crisis and then wants to create the appea…
1215003059576807426,2020-01-08 20:11:17,"RT @EmNewsDC: Now @IlhanMN says there are still many questions revolving around the Iranian situation.

She questions if precaution was tak…"
1214995194233442305,2020-01-08 19:40:02,"I am joining my @USProgressives colleagues for a press conference to call for deescalation—not war with Iran. #NoWarWithlran 

WATCH:
https://t.co/d7qyazOOJO"
1214978068848271362,2020-01-08 18:31:59,"RT @RepPressley: Excited to announce that this weekend I'll be hosting the 1st ever @TheBlackCaucus visit to #MA7! 

Join us &amp; @BlackMarket…"
1214923199240196096,2020-01-08 14:53:57,"This is deeply disheartening. Minnesotans have a history of welcoming refugees with open arms. Now, Beltrami is giving them a clenched fist.

I'm proud that my home county—Hennepin—voted overwhelmingly to continue being a home for those fleeing oppression. https://t.co/wr4EUhJ0hD"
1214917280775180289,2020-01-08 14:30:26,"""You cannot simultaneously prevent and prepare for war.""

-Albert Einstein"
1214748091930365952,2020-01-08 03:18:08,"Solidarity with @JCA_MN and the entire Minnesota Jewish community. 

Together we will confront the rise in hate and violence.
#NoHateNoFear
https://t.co/TI3w7J5D8n"
1214662080877465600,2020-01-07 21:36:22,Donald Trump wants to take away your Social Security. https://t.co/15HpunHpgF
1214602879908143106,2020-01-07 17:41:07,"The blackout in Kashmir is now the longest internet shutdown ever imposed in a democracy.

It is part of a terrifying trend under the Modi government--including an anti-Muslim citizenship law and a purge of Muslim citizens in Assam.

All who value democracy should be speaking up. https://t.co/5dw9OO4khc"
1214563585772228610,2020-01-07 15:04:59,"It is not the wealthy who suffer most in war. 
It is the working class soldier who volunteers for his country. 
It is the mother who loses her child.
It is the refugee who loses her home. 

Warfare is also class warfare. 

#NoWarWithIran"
1214544978275381248,2020-01-07 13:51:02,"I enter the new year joyful represent Minnesotans in Congress, and hopeful that we can continue to build a better world. https://t.co/9ZLZKOl0tn"
1214356011479425024,2020-01-07 01:20:09,🤔 https://t.co/BCdcIUEQMi
1214346007351304193,2020-01-07 00:40:24,"Not on our watch. This is a backdoor way to delegitimize and instill fear into immigrants and communities of color.

I will fight it with everything I have. https://t.co/9hIukWimdD"
1214320748396974085,2020-01-06 23:00:02,"A phenomenal moment, indeed!

Overjoyed for our Minnesota Liberian community. 
https://t.co/0vg760HsbF"
1214295517179600903,2020-01-06 21:19:46,RT @StarTribune: U.S. Rep. Ilhan Omar introduced a resolution to block the use of U.S. military force against Iran without congressional au…
1214284507819458560,2020-01-06 20:36:01,"The top recipients:

@GOPLeader 
@senatemajldr 
@JohnCornyn 
@ThomTillis 

This is what corruption looks like. https://t.co/MZrvqAEEzH"
1214253532175572992,2020-01-06 18:32:56,"When people face a tragedy, what they need is help, not red tape.

We must make sure those affected by the Drake Hotel fire are getting the support they need.
https://t.co/zWJHLixDKG"
1214234692846858241,2020-01-06 17:18:04,"When we talk about cancelling student debt, ending childhood hunger, Medicare for All, or a Green New Deal, the first question pundits ask is, ""How are you gonna pay for that?""

No one is asking how we're going to pay for another catastrophic war. #NoWarWithIran"
1214203245154975744,2020-01-06 15:13:07,RT @wccoradio: Minnesota Politicians including @IlhanMN will be looking at limiting Presidential powers when it comes to War says @bloisols…
1213898307535327233,2020-01-05 19:01:24,".@RepBarbaraLee and I are introducing a War Powers Resolution in the House to prevent a disastrous war with Iran.

We in Congress must reassert our Constitutional authority and stop a disastrous war.

The stakes could not be higher.
 #NoWarWithIran https://t.co/UXpKdbfk4R"
1213200432077688832,2020-01-03 20:48:17,"#NoWarWithIran 

Pass it on."
