id,created_at,text
1235626521198563330,2020-03-05 18:01:34,"RT @RepFrenchHill: Domestic &amp; international health officials are working to limit the spread &amp; impact of #COVID19. 

Congress is committed…"
1235603479764312065,2020-03-05 16:30:00,"It is incredibly important to stay up to date on the status of Coronavirus COVID-19, and it is great to see our community being proactive.

https://t.co/8YNzZeNwcU"
1235585106992967681,2020-03-05 15:17:00,"Yesterday, the @ProbSolveCaucus held a local energy utility roundtable with regional energy companies. It was great to see Mike Innocenzo, the CEO of @PECOconnect, to discuss the state of American energy. https://t.co/eREqTbIypA"
1235565735579021316,2020-03-05 14:00:01,It was a pleasure to recognize and thank the committed volunteers of Falls Township Fire Company #1 at their annual banquet this past Saturday. Thank you for playing such a vital role in keeping our communities safe. https://t.co/C9tvXTd9ZW
1235365766649843712,2020-03-05 00:45:25,"RT @WhipClyburn: Help prevent the spread of the coronavirus.

✅ Avoid close contact with people who are sick
✅ Avoid touching your eyes, no…"
1235339238075441154,2020-03-04 23:00:00,I was able to meet with @FeedingPA to discuss the important role that food banks play in our communities. Thank you for stopping by! https://t.co/HZTVJl4CU8
1235320589591678983,2020-03-04 21:45:54,"The House just passed a bill to provide $8.3 billion in emergency funding to combat Coronavirus COVID-19. As Co-Chair of the Bipartisan Coronavirus Task Force, I am urging all of my colleagues to direct all necessary resources to this urgent need. https://t.co/5iItscxMSG"
1235283312920403974,2020-03-04 19:17:46,"Today I testified at @HouseAppropsGOP with @RepGolden to stress to the committee that Members of Congress should not receive a pay raise in the FY2021 appropriations package. With so many problems in our country, we must proactively reject a pay raise for ourselves. https://t.co/LOrQMuu47o"
1235244195625000961,2020-03-04 16:42:20,"Last night, I was fortunate to spend time with the @BGCA_Clubs and receive their Congressional Champion of Youth award. The Boys and Girls Club is a phenomenal organization doing great work in our communities, and I am proud to support them in any way that I can. https://t.co/wAmWOZ007F"
1235220413778718722,2020-03-04 15:07:50,"RT @RepSteveChabot: ICYMI, here’s an op-ed @GerryConnolly and I wrote for @thehill on the #coronavirus &amp; our pandemic preparedness legislat…"
1235203344123285504,2020-03-04 14:00:00,Over the weekend I joined the White Tiger Taekwondo during their grand opening ceremony in Langhorne. Martial Arts is an excellent way to improve physical conditioning and mental discipline. Best of luck with your new studio! https://t.co/NixxrAxN7a
1234961749436067840,2020-03-03 22:00:00,"Over the weekend, I had the opportunity to join Yardley Makefield Soccer for their 2nd annual collection drive which consisted of assembling care packages and writing greeting cards to  our armed forces. Thank you to all who contributed to this inspirational service project! https://t.co/mPD6HqL3UW"
1234940205104271363,2020-03-03 20:34:23,"RT @RepEspaillat: Want to help prevent the spread of #COVID19? Here’s what the CDC suggests:
-Avoid close contact w/people who are sick
-Av…"
1234915894213652485,2020-03-03 18:57:47,"RT @RepTipton: Some helpful tips on preventing the spread of respiratory illnesses: 

🚫 🤝 if 🤒 
🚫 👉👀, 👃 or 👄 
✅ 🧼 🖐🤚 

Stay up to date with…"
1234893802751451136,2020-03-03 17:30:00,Thanks to @VFWPA for stopping by this morning. They are tireless advocates for our veterans and deserve any support we can provide them. https://t.co/KQaQFaF7rH
1234863602860990469,2020-03-03 15:30:00,It is incredibly important that Congress and the American public stay up to date on all facts relating to Coronavirus COVID-19. Proud to join my co-chairs @JacksonLeeTX18 and @RepRaulRuizMD to lead this effort. https://t.co/zQlvpvZMAR
1234840953598377985,2020-03-03 14:00:00,"Proud to speak on the House floor to recognize @Bucks_edu. Apprentice programs provide skills and education for high-paying and vital careers, and we need to make sure we promote them to our emerging workforce. https://t.co/LtNH73HigU"
1234637261439938560,2020-03-03 00:30:36,"RT @RepJohnJoyce: By working together and taking simple precautions, all of us can help to protect our community from COVID-19. https://t.c…"
1234633174820511744,2020-03-03 00:14:21,"Last weekend, I had the honor of attending @Stormtheheavenz 3rd annual Bean’s Ball, which is held to benefit Diffuse Intrinsic Pontine Glioma research. Our children are our nation’s greatest asset, which is why I am proud to have introduced the Fairness to Kids with Cancer Act. https://t.co/kirX18nVDi"
1234534235798691841,2020-03-02 17:41:13,"RT @WHO: The most commonly reported #COVID19 symptoms incl. fever, dry cough, and shortness of
breath. Most patients (80%) experienced mild…"
1234512539486023680,2020-03-02 16:15:00,"Sergeant Torrente’s success sets a great example for current and future officers in Middletown. She is a great role model for our community, and I look forward to seeing more promotions in the future, as she works her way towards her dream job of chief of police. https://t.co/VrFY4kRdpL"
1234478567817433089,2020-03-02 14:00:00,"By promoting the collaboration between higher education and apprentice programs, my bill will help to prepare the next generation for good-paying jobs, while simultaneously addressing our nation's current shortage of trained workers.

https://t.co/HYekEXFIPk"
1234231960379285508,2020-03-01 21:40:04,"Congratulations to Travis Fazio of Troop 79 for earning the rank of Eagle Scout. For his project, Travis worked to improve one of our local parks, the William H. Markey Park in Perkasie. Congratulations Travis and best of luck on all future endeavors! https://t.co/BEOJiMM8ng"
1234205319032659968,2020-03-01 19:54:13,"RT @repgregwalden: As our country responds to the coronavirus, it's important that we avoid misinformation and look to leadership from our…"
1234161478040576000,2020-03-01 17:00:00,"This week, I joined my colleagues @JacksonLeeTX18 and @RepRaulRuizMD to launch the Bipartisan Congressional Coronavirus Taskforce. to keep Members of Congress and the American public apprised of facts and updates related to Coronavirus COVID-19. https://t.co/qfmFAg5VhC"
1234136055449899010,2020-03-01 15:18:59,"@SenToomey and I toured the Philadelphia Wholesale Produce Market and held a press conference to discuss a new bipartisan bill that will address liability concerns impacting our local food banks. Together, we can come together and get this done for the those in need. https://t.co/XIh01FBjxQ"
1233889686516453376,2020-02-29 23:00:00,"Happy 100th birthday to WWII veteran and Langhorne resident Eugene Edwards! Eugene is a member of our greatest generation, he is a hero and an inspiration to our entire community. Thank you for inviting me to be a part of your celebration. https://t.co/nOrGqeUKJU"
1233772259111821313,2020-02-29 15:13:23,"The situation at Rockhill Quarry is a public safety issue. Everyone deserves full government transparency, clean air, clean water, and safe roads.

https://t.co/7i3dJStYIY"
1233497100391862272,2020-02-28 21:00:00,Great to see the folks from the American Public Power Association to discuss their legislative priorities. https://t.co/HiuWkhuxZF
1233459349701324800,2020-02-28 18:30:00,"Today, I was proud to vote in support of H.R. 2339, to protect our children from the harmful effects of vaping and tobacco usage. The youth vaping epidemic is a health crisis, and we need to make sure our young people are healthy and safe. https://t.co/mpSzTM8llp"
1233402727058886657,2020-02-28 14:45:00,I had the pleasure of joining my Student Task Force Committee on Monday to review projects they have been working on over the last few months. Thank you for your continued dedication and efforts in making our community a better place. https://t.co/3Shj7w3rr0
1233190198365827072,2020-02-28 00:40:29,"RT @HSLegFund: A huge TY to @RepBrianFitz, @RepCharlieCrist, @GReschenthaler, @RepMcGovern, &amp; @CongressmanGT for asking the @WhiteHouse to…"
1233164912874184704,2020-02-27 23:00:00,"Today, as Co-Chair of the Bipartisan Opioid Taskforce, I joined my colleagues in stressing the importance of addressing the opioid crisis. Opioid abuse and addiction is a national health emergency, and we need to give Americans the tools to recover. https://t.co/JVQ7zmUErx"
1233054522349629440,2020-02-27 15:41:21,RT @SenatorBennet: Glad to have @RepRoKhanna &amp; @RepBrianFitz leading the charge on our Student Apprenticeship Act in the House. Our bill wi…
1233029017369894914,2020-02-27 14:00:00,Thanks to @brainmappingfnd for stopping by to discuss the recent progress in researching and diagnosing Traumatic Brain Injury. https://t.co/zYSIPVUA5o
1232794972585218049,2020-02-26 22:30:00,Great to sit down with @ForgingIndustry today to discuss the importance of workforce development and job training programs. https://t.co/ckBsiAQQOP
1232772669306740743,2020-02-26 21:01:22,Proud to partner with my good friend and fellow Bucks County native on this bill https://t.co/FBuaiMTxIq
1232749674945138690,2020-02-26 19:30:00,"Thank you to @HabitatBucks for being a tireless advocate for affordable housing in our district. They brought the Neighborhood Homes Investment Act to my attention, and I was proud to sign on as a co-sponsor to support the building and rehabilitation of homes in our district."
1232670401333006337,2020-02-26 14:15:00,"It was an honor to participate in a panel discussion on education policy at @DelVal​ this past Saturday. Thank you to the University for having this important discussion, and thank you for allowing me to be a part of the conversation. https://t.co/IwtLYP7wAa"
1232452960954675205,2020-02-25 23:50:58,"RT @ProbSolveCaucus: Today @ProbSolveCaucus
endorsed the Seeding Rural Resilience Act! This bipartisan bill will help eliminate the stigma…"
1232413709940772865,2020-02-25 21:15:00,This past Saturday I attended the Grand Opening for the Cherry Blow Dry Bar-Newtown that recently opened. Our small business community is flourishing and it's great to see so many new businesses opening their doors and contributing to our local economy! https://t.co/nzdzGCZT5B
1232406355903905793,2020-02-25 20:45:46,"Proud to partner with fellow Bucks County native @RepRoKhanna to introduce the Student Apprenticeship Act. Investing in our workforce is key to economic growth, this bill is a great step towards sustained growth. 

https://t.co/On60YpdZAj"
1232336391041900544,2020-02-25 16:07:45,"It was a pleasure to meet the rising business stars in Newtown during the @NBAnewtown Emerging Leaders meeting. Thanks to the Newtown Business Association for investing in our small businesses, and thank you for all you do for our local business community. https://t.co/RpUn1kLwJC"
1232092589542825985,2020-02-24 23:58:59,"I am saddened to hear about the passing of Katherine Johnson, who’s work with NASA allowed us to reach new heights. This is another reason for us to create a Women’s History Museum, so that we can teach future generations this amazing story. 

https://t.co/jSilnSf6V0"
1230991301472116739,2020-02-21 23:02:51,"We stand with the families and children in Rockhill. Clean air, clean water, and public safety is their right, not a privilege. Profits at the expense of safety cannot and will not stand.

https://t.co/ScsOeKUa5H"
1230944580855631872,2020-02-21 19:57:12,RT @MachinistsUnion: 📢📢📢 U.S. House Reps. @RepBrianFitz and @RepBrendanBoyle will join @TCUnionHQ members in Philadelphia on Friday to prot…
1230910995075301378,2020-02-21 17:43:45,RT @TheIntellNews: @RepBrianFitz calls for the shutdown of a quarry in East Rockhill following asbestos concerns prior to Friday morning pr…
1230870272519131139,2020-02-21 15:01:56,https://t.co/NbJsnSQtCv
1230167660186324993,2020-02-19 16:30:00,"Last week my bill, the Smithsonian Women's History Museum Act, passed the House. I am proud to support this bill, making sure that all women get the recognition they deserve. 

https://t.co/ljvXOZlMT4"
1229528072296312835,2020-02-17 22:08:30,"Happy #PresidentsDay! I was at Washington Crossing State Park yesterday to celebrate the 288th birthday of our first President, George Washington. Today we remember those who helped make this the greatest country in the world. https://t.co/TuN2akcx8k"
1228453869752991745,2020-02-14 23:00:00,"I recently attended a meeting of the Levittown Fairless Hill Rotary, a shining example of service, goodwill, and fellowship. I had the opportunity to discuss humanitarian challenges we face at home &amp; around the globe. Thank you for inspiring service and altruism in our community. https://t.co/UjczRZYN0z"
1228363271423414274,2020-02-14 17:00:00,Great meeting with Tony Montalto and @StandWParkland. This organization is committed to ensuring that our kids are safe in school We must continue to come together to find solutions to stop gun violence https://t.co/NgJjWco2tm
1228101126450565121,2020-02-13 23:38:20,@HabitatBucks @CostOfHome Done!
1228063015188271104,2020-02-13 21:06:53,"ICYMI: @ChrisCoons and I have partnered to generate bipartisan solutions to combat climate change and rebuild our crumbling infrastructure. 

https://t.co/D1piVjhhhz"
1228011941144285186,2020-02-13 17:43:56,"Thank you to @CleanAirMoms_PA for stopping by the office. Climate change is one of the most important issues facing our country, and I will continue to work with my colleagues towards sustainable solutions. https://t.co/dcXiWEgrqx"
1227746833038004224,2020-02-13 00:10:30,Thank you @ChrisCoons for working with me to promote bipartisan solutions to combat climate change and improve our infrastructure. https://t.co/Qa96UyKw77
1227680911749193729,2020-02-12 19:48:33,"I met with students from New Hope Solebury Cares, to discuss their concerns with opioid, alcohol, and vape abuse in their schools. It is incredibly important that we listen to our students, work with them, and learn from their experiences. https://t.co/lUK5teF9Su"
1227599179800817673,2020-02-12 14:23:46,"Great to join the @ProbSolveCaucus yesterday to discuss the importance of maintaining civility in Congress, as well as to provide an update to bipartisan solutions to everyday issues effecting all Americans. Thank you to @RepTomReed and @RepJoshG for their steadfast leadership. https://t.co/RVet7QwfrJ"
1227390303184785408,2020-02-12 00:33:46,So honored to speak at the @SpecialOlympics Annual Convention and pay a visit to our advocates from Bucks and Montgomery Counties! These kids and volunteers are my heroes. https://t.co/3nRdnTPvy5
1227366917108838400,2020-02-11 23:00:51,RT @ProbSolveCaucus: Today @probsolvecaucus held a press conference to highlight our bipartisan accomplishments &amp; goals for 2020 - such as…
1227366704919056384,2020-02-11 23:00:00,"I was proud to speak on the floor this week in support of the Bucks Coalition Against Trafficking, and to support them in their fight against human trafficking. We must continue to support the victims of this terrible crime. https://t.co/4XPOVmu6up"
1227315469557915649,2020-02-11 19:36:25,"I am thrilled to see the culmination of our work get us one step closer to making this a reality for all women across America, and I thank my co-lead @RepMaloney for her leadership and her friendship."
1227315432987774982,2020-02-11 19:36:16,"HERstory!!! Today I took to the House Floor in support of my bill, the Smithsonian Women’s History Museum Act, before it passed the House. https://t.co/ePnogx7ej5"
1227276526703562752,2020-02-11 17:01:40,Great seeing the Association of United States Postal Lessors! Proud to stand in solidarity with our postal workers as we passed the USPS Fairness Act last week. https://t.co/HjEggfyz5L
1227245912411402241,2020-02-11 15:00:01,"Proud to stand with Parkland families and help them advance their legislation to make our schools safer.

https://t.co/PoB1lNprWa"
1227037145182982144,2020-02-11 01:10:27,"For too long, the contributions women have made to our country have been overlooked and under appreciated. Proud to join @RepMaloney and @EleanorNorton in supporting the Smithsonian Women’s History Museum Act, to make sure all women get the recognition they deserve. https://t.co/6o1nGAQegy"
1227004316118114308,2020-02-10 23:00:00,"I had the opportunity this week to recognize the great work being done by Dr. Julia Szarko, who was named the 2019 PA School Psychologist of the Year. Dr. Szarko has been a great advocate for expanding school based mental health services, and I applaud her for her great work. https://t.co/nWRPlphVKa"
1227000388089450503,2020-02-10 22:44:23,"I stand 100% behind the families who lost their loved ones in Parkland and similar tragedies across the nation. We must ensure that no child, and no family, will ever endure such a tragedy again. 

https://t.co/kOdvwPXQ2r"
1226959079387672576,2020-02-10 20:00:14,Proud to stand in solidarity with @3Afge and @AFGENational chapters everywhere. Government employees are dedicated patriots who deserve good pay and good benefits. I will continue to fight for your rights. https://t.co/iu0flAoXTU
1226913721030791168,2020-02-10 17:00:00,"My good friend @RepDwightEvans recently hosted a Pennsylvania Healthcare Roundtable with healthcare groups from around the Commonwealth. It is important that we work to make sure that everyone in Pennsylvania, rural or urban, can access quality healthcare. https://t.co/DaQaRydXgy"
1226551335190794245,2020-02-09 17:00:01,"Prescription drug costs have skyrocketed in recent years, and the American people need our help. I was proud to support this legislation to lower drug costs and empower Medicare. https://t.co/L5r1AUUEDg"
1226279540621623296,2020-02-08 23:00:00,"For too many, student loan debt is a crippling burden that impacts their involvement in our economy and achieving personal goals. My bill with @RepGaramendi is a step toward addressing this crisis.

https://t.co/F3lV98epGi"
1225917155792900096,2020-02-07 23:00:01,I was able to speak on the floor yesterday to recognize the great work being done at Ivy Hill Therapeutic Equestrian Center in Hilltown. Programs like Ivy Hill provide excellent services for our special needs population and deserve our support. https://t.co/Gc7bXkrhGH
1225215940440317954,2020-02-06 00:33:38,"RT @Pacep4Em: Each year, PACEP offers awards that recognize a member’s significant professional contribution to emergency medicine. Today w…"
1225192379050647552,2020-02-05 23:00:00,"Today I spoke in support of H.R. 2382, the USPS Fairness Act. I am proud to join my colleagues in advancing this legislation to the Senate. This bill will allow the postal service to devote resources to critical services its employees deliver to our community. https://t.co/5xGrww7gUQ"
1225152073156694016,2020-02-05 20:19:51,"I joined the @ProbSolveCaucus last night for a pre-SOTU reception with members and guests. It was great to meet people from around the country and hear their stories, and to introduce my colleagues to the Mignogna family. https://t.co/rdTkfrG2m1"
1225087215367344128,2020-02-05 16:02:07,"Thank you to Michael and Joey Mignogna of #Buckingham for making the trip down to be my guests for the #SOTU! It was a tremendous experience for these two young boys. Our entire community stands with the Mignogna family during their time of need.

https://t.co/wri3LmcDkE"
1224784690206265344,2020-02-04 20:00:00,"What happened to the Mignogna family can only be described as tragic. I am incredibly proud of the way that our community has rallied around the Mignogna family, and seeing the amount of support they have received does not surprise me one bit. 

https://t.co/6UxDFudY4H"
1224377006122524672,2020-02-03 17:00:00,"Proud to partner with @RepBera to introduce the HERO Act in the House. Our first responders risk their lives every day, and we must do everything we can to support them. 

https://t.co/bBcxbZFC51"
1224029793940901889,2020-02-02 18:00:18,"ICYMI: Last week, I was proud to announce this year's service academy nominations from Bucks and Montgomery counties. Congratulations to these amazing students!

https://t.co/CWz2m8CdY9"
1223700736074289152,2020-02-01 20:12:45,"RT @RepDwightEvans: @PAHealthDept @SecretaryLevine 3/ I was also joined by @RepBrianFitz, @MikeKellyPA &amp; @RepMGS and staff from @SenBobCase…"
1223622046401384448,2020-02-01 15:00:04,"My bipartisan and commonsense resolution will work to raise awareness regarding the serious dangers of stalking, emphasize the protection of victims, and help victims recover and heal. Thank you @RepStephMurphy for partnering with me on this legislation."
1223622045088526337,2020-02-01 15:00:04,"Too many Americans have become victims of stalking, and the crimes that come after. Congress must continue to raise awareness about the dangers of stalking.

https://t.co/NHTQVxiXEe"
1223342983006838785,2020-01-31 20:31:10,Happy birthday @marthamaccallum!!! 🎂 Thanks for all you do for journalism and our nation.
1223258064498974720,2020-01-31 14:53:44,"RT @jgohringer: Because we all could use a dais pup on this legislative Friday, here is Chairwoman Sage. 

She’s with with team @RepBrianFi…"
1223244543543345152,2020-01-31 14:00:00,"ICYMI: The Keeping Girls in School Act passed this week. This bipartisan bill will help reduce barriers that girls around the world face when trying to remain in school and access more opportunities. This bill gives them the tools they need to succeed. 

https://t.co/DMJf46o9Y8"
1222927522675003393,2020-01-30 17:00:16,"One of my greatest honors is getting to meet and nominate qualified young men and women from Bucks and Montgomery counties to our service academies. Congratulations to this year's nominees!

https://t.co/WMpozAeDEx"
1222258277284810753,2020-01-28 20:40:56,"Today I was proud to speak on the House floor in support of H.R. 2153. In a world where millions of girls still do not have equal access to education, this bill provides funding, opportunities, and most importantly empowerment to future generations of female leaders. https://t.co/W10XD5LYIx"
1222196527185190913,2020-01-28 16:35:34,"Thank you @GOPLeader, @LeaderHoyer, @SpeakerPelosi, and all of my colleagues in the House for honoring my brother Mike on the floor last night. I am eternally grateful for all of the support my family and I have received. 

https://t.co/NMSXFezSJC"
1221802832795521024,2020-01-27 14:31:09,"On #HolocaustRemembranceDay, #WeRemember the millions who were killed during the Holocaust. I am proud to be an original sponsor of @RepMaloney's Never Again Education Act. We have a moral obligation to teach about and learn from the Holocaust so that it never happens again."
1221552749755686913,2020-01-26 21:57:25,"Unbelievably saddened to hear about the tragic death of Lower Merion native, Kobe Bryant and his daughter Gianna. He changed basketball forever and made the world around him a better place. The greater Philadelphia community stands 100% with his family during this difficult time."
1220779748642693121,2020-01-24 18:45:47,"Deeply saddened by the passing of Levittown’s Leslie Kolifrath. A lifelong resident of Bucks County, Leslie always put the needs of others ahead of her own. Her friends and family are in my prayers during this difficult time. https://t.co/oDnpiA56gN"
1220405839619678209,2020-01-23 18:00:00,"Our prayers are with the family and friends of these brave firefighters, and all those who have lost their lives combating the Australian bushfires. We must continue to show support for the heroes still fighting these fires.

https://t.co/1rHP6Wlb5p"
1220005272489512966,2020-01-22 15:28:18,"Happy Birthday to the amazing Diane Lane!!🎂 Diane is a tireless advocate in protecting our oceans and our environment and, more importantly, she is an amazing human being. https://t.co/s0PK3NOpdT"
1219243218744856581,2020-01-20 13:00:10,"As we reflect on Dr. King's legacy, we celebrate a man and a movement that transformed our country, and we remember that our freedom is inextricably bound to the freedom of others. https://t.co/s9Hw8neLYx"
1219243211144777728,2020-01-20 13:00:08,"but where they stand in times of challenge and controversy."" The fierce urgency of now -- and the need for persistence, determination, and constant vigilance -- is still required for us to defeat injustice. https://t.co/9PnOpWpnGw"
1219243205478232065,2020-01-20 13:00:07,"Yesterday, I joined our multi-faith community on a Unity Walk to honor the life and memory of Dr. Martin Luther King, Jr. Dr. King taught us that ""The ultimate measure of a person is not where they stand in moments of convenience and comfort,... https://t.co/XL2ChYsbsQ"
1217189644783226882,2020-01-14 21:00:00,"To @GovernorTomWolf, @SenBobCasey, @SenToomey, @PAAttorneyGen, and everyone who reached out, from the bottom of my heart, thank you for the kind words and gestures for my brother Mike and our family. We are eternally grateful."
1214261229549686791,2020-01-06 19:03:31,https://t.co/MKk9TnozaR
1213242461415510017,2020-01-03 23:35:18,RT @RepMcCaul: “Qasem #Soleimani made his living wreaking havoc on the freedom-loving people of the Middle East. His resume included nurtur…
1213130782232985601,2020-01-03 16:11:32,"My statement on the death of Qasem Soleimani:

https://t.co/yzqTJi2bKD"
1213104230459990017,2020-01-03 14:26:01,"RT @HouseForeignGOP: LR @RepMcCaul on death of #Soleimani: “According to the Pentagon, Soleimani was actively plotting more attacks on Amer…"
