id,created_at,text
1247316189929525255,2020-04-07 00:12:08,"We are in need of massive public infrastructure investments now more than ever, especially in our medical facilities. We have the opportunity to put hundreds of thousands of workers like the @GoIUPAT back to help our nation."
1247306237466853380,2020-04-06 23:32:35,"During this #COVID crisis, we must not forget our children and the educators who are teaching them. Distance learning must be prioritized as part of our response to make sure our children are taken care of. #AloneTogether https://t.co/S7YiN2ZtRd"
1247177229618106369,2020-04-06 14:59:57,"To all small businesses in our community, please use this form to apply to your local bank to participate in the Paycheck Protection Program Loans. Please contact our local office at 215-579-8102 if you need any assistance. https://t.co/lRNUzUjv5g"
1246875529422176256,2020-04-05 19:01:06,"If you are in need of any type of assistance at any time, please contact our team at 215-579-8102. There IS a light at the end of this tunnel. This will end and will get through this, together. #AloneTogether."
1246875528415580161,2020-04-05 19:01:06,"PLEASE continue to isolate yourselves and your family, practice social distancing, wash hands thoroughly and frequently, wash all surfaces and countertops, and continue stand in solidarity with everyone in our community."
1246875527371051009,2020-04-05 19:01:06,"Task Force medical experts believe that the next few weeks will be a very challenging and a very critical period, as they anticipate a spike in the number of people impacted and hospitalized by #COVIDー19."
1246875525181833216,2020-04-05 19:01:05,"Please continue to pray for all of our healthcare workers, our first responders, our elderly, and all those who are vulnerable and on the front lines of this fight. https://t.co/nRM2iDcHYq"
1246522555051192320,2020-04-04 19:38:31,"RT @SBAgov: 4️⃣ #CARESAct funding options to help your #smallbusiness during #COVID19:  
▶️Paycheck Protection Program 
▶️$10K Economic Inj…"
1246479024261681154,2020-04-04 16:45:32,"I am saddened to hear of the passing of Tullytown Assistant Fire Chief Rick Johnson, who put his life on the line every day to keep our community safe. Our community stands behind Rick's family and the entire Tullytown Fire Company. https://t.co/Uk2c7b31ld"
1246438435969253379,2020-04-04 14:04:15,"We simply cannot outsource our public safety and national security to foreign nations. We must reconstitute our healthcare and public safety supply chain back to the United States. This landmark, bipartisan legislation does just that. https://t.co/yxEozJbLNZ"
1246197031988649984,2020-04-03 22:05:00,Congrats to Telford's Emma Farrell on reaching the Jeopardy College Championship! Be sure to tune in on Monday night! https://t.co/DyO3GzKcQ9
1246184197145927680,2020-04-03 21:14:00,Our charitable nonprofits need our support during these uncertain times. https://t.co/rhWnabDyri
1246173627629875201,2020-04-03 20:32:00,PFAS cleanup provisions MUST be included in this year's NDAA. Thank you to my Co-Chair @RepDanKildee for his partnership and advocacy on this issue. https://t.co/G6oD6UPqXL
1246149377657364485,2020-04-03 18:55:38,"Today is the first day to apply for the Paycheck Protection Program through @SBAgov. If you have any issues or questions while applying, please contact my office! https://t.co/j94ilbEaKl"
1245795573006991362,2020-04-02 19:29:45,"Great to join @lancebachman on The Lion's Den yesterday to discuss how our community has been dealing with #COVID19 and how the government has been responding. #AloneTogether

https://t.co/J2BZJB9FZC"
1245762741324984323,2020-04-02 17:19:17,"We need to support charitable organizations during these uncertain times. Proud to partner with Congressman @sethmoulton to support groups that exist to help others.

https://t.co/lipELGxVSI"
1245450646565896193,2020-04-01 20:39:08,Today is #CensusDay! It is very important that everyone participates and is counted in the #2020Census. Please take a few minutes and check out the @uscensusbureau website and fill out their online form! https://t.co/sYLaR2ycrI
1245123146040180736,2020-03-31 22:57:45,"If you or a loved one are a U.S. citizen seeking assistance returning to the United States, please contact our office so that our team can bring you home safely to your family. #AloneTogether https://t.co/ZcdLvaE8Z0"
1245123144668643328,2020-03-31 22:57:45,"Earlier today I received a notification that all of our constituents who were stranded in Peru that contacted our office have returned home safely. Our work is not over - to date, 26,000 – 27,000 Americans have returned since the outbreak with thousands more stranded overseas."
1245123142227505152,2020-03-31 22:57:45,"Since the outbreak of #COVID19, my office has been working around the clock with embassies across the globe to get U.S. citizens from our community home safely."
1244996008372850688,2020-03-31 14:32:33,"Our seniors need our help, now more than ever. By expanding the network of senior assistance hotlines, we can help protect them from scams and misinformation. Proud to partner with @RepCartwright on this legislation.

https://t.co/fRQkoEFTb4"
1244765036838518787,2020-03-30 23:14:46,"God Bless our Nation as we get through this, together. https://t.co/TAKDVZ9oCJ"
1244702259793006593,2020-03-30 19:05:18,"ICYMI: I recently worked with @sethmoulton to introduce the SOS America Act. Our efforts to save America’s small businesses must include all of our nonprofit organizations. Our community and our nation, and those most in need, cannot survive without them. https://t.co/90UdifTqtF"
1244459663883751424,2020-03-30 03:01:19,Happy 4th Birthday Camille!! Our community loves you!! https://t.co/rT88FNreLh
1243951521932476417,2020-03-28 17:22:08,"Thinking of my friend, @MikeKellyPA, who recently tested positive for coronavirus. Mike has always been a fighter and I have no doubt that he will get through this. #InItTogether"
1243644594878906368,2020-03-27 21:02:31,"Proud to work with @sethmoulton to introduce the Save Organizations that Serve America Act. Efforts to save our small businesses must include our nonprofit organizations. Our community and our nation, and those most in need, cannot survive without them. https://t.co/hQOeyhYqnD"
1243596486463705088,2020-03-27 17:51:21,"Minutes ago, the House passed Phase 3 of our #COVID19 response, the Coronavirus Aid, Relief, and Economic Security Act. This bill will provide much needed relief to our healthcare workers, small businesses, workers, and families.
 #InItTogether https://t.co/vHdZdhVL9L"
1243326595093483526,2020-03-26 23:58:54,Former FBI Special Agent Robert Levinson was an American hero who was illegally held captive by Iran for no reason. Special Agent Levinson's body must be returned to his family. We as a Nation must never stop the pursuit for Robert Levinson and his family. https://t.co/LRkL8BjL7g
1242886197757784068,2020-03-25 18:48:55,"To all Senior Citizens in our community, a message from @SocialSecurity. Please share to help everyone stay alert! https://t.co/f08BFxIgLF"
1242792948305100800,2020-03-25 12:38:23,RT @RepBrianFitz: ICYMI: Please see my website for updates on everything related to the #Covid_19. As the situation develops this will be u…
1242081337982451712,2020-03-23 13:30:42,"Kenny Rogers was a legend who brought so much joy into our lives. He will live in each of us forever through his legendary music. Thank you, Kenny, for bringing smiles to an entire nation and an entire world. We know you’re now bringing those same smiles to God. https://t.co/UkQ3ZiUCPM"
1241824185040674817,2020-03-22 20:28:52,"Please remember to wash your hands, stay home, and call your healthcare provider if you are feeling sick. #CODVID19 #InItTogether https://t.co/AtMWElFhQi"
1241761534138814466,2020-03-22 16:19:55,Please spread the word to help everyone stay up to day on the FACTS regarding #COVIDー19. #InItTogether https://t.co/29iuhSxl0i
1241495751437561862,2020-03-21 22:43:47,"The @USTreasury and the @IRSnews announced that tax day has been pushed back from April 15 to July 15 due to #COVIDー19. 

https://t.co/Qw8hvaFeD9"
1241462500429881344,2020-03-21 20:31:40,https://t.co/0hw6OlN1B0
1241447285277560834,2020-03-21 19:31:12,"RT @RepDwightEvans: Proud to lead this bipartisan letter with @RepBrianFitz seeking emergency relief for @SEPTA, which provides an essentia…"
1241425372173959168,2020-03-21 18:04:07,"Speaking to small businesses in our community, this provision, coupled with bolstering unemployment insurance with immediate direct payments to furloughed employees, and a 30 day grace period on monthly expenses, will be a big step to solving the economic side of this crisis."
1241425367845478400,2020-03-21 18:04:06,"I am urging my Senate colleagues to include a provision requiring insurers to cover #COVID19 losses under Business Interruption Insurance, provided that businesses do not terminate their employees’ employment status or their healthcare coverage."
1241398975980281858,2020-03-21 16:19:14,ICYMI: #Pennsylvania small businesses can apply for a #COVID19 disaster loan from the @SBAgov. #InItTogether https://t.co/CVrCaqQl0Q
1241077168903512064,2020-03-20 19:00:29,"Our workers, families, and small businesses need help now. They need commonsense solutions to help get through this crisis, and I’m proud to join the @ProbSolveCaucus in crafting this bipartisan legislation. https://t.co/WjXaKQYv6R"
1241025598430089216,2020-03-20 15:35:34,RT @AP: BREAKING: Treasury Secretary Steven Mnuchin announces that the deadline for filing U.S. income taxes has been moved from April 15 t…
1240994237505626112,2020-03-20 13:30:57,"For our Montgomery County residents, a new #COVID19 drive-thru testing site will open at @TempleUniv Ambler on March 22 under specific conditions mentioned on the page below. #InItTogether #StopTheSpread https://t.co/B2qLpdCpbm"
1240753160928538626,2020-03-19 21:33:00,"Today is #CertifiedNursesDay, and now more than ever we need to thank our healthcare professionals for their excellent working during this global pandemic. #StopTheSpread #InItTogether https://t.co/CyITBwGsZ4"
1240736830951174153,2020-03-19 20:28:06,"I will continue to work closely with the @PADeptofEd and @GovernorTomWolf regarding the funding, regulatory, and remote learning issues raised by our educators and school administrators.  #inittogether #StopTheSpread https://t.co/PJtuEKeC95"
1240736829579689987,2020-03-19 20:28:06,"Today, I was briefed by the Bucks County School Superintendents and the Executive Directors of the Bucks County Career Technical Centers where I was able to provide a COVID-19 update and learn how the virus has impacted our community's school districts. https://t.co/5aEoHL3vCn"
1240736828447174663,2020-03-19 20:28:06,Throughout the week I have been in constant communication with all levels of government and various groups impacted by #COVID19. https://t.co/ZtPpR0QxyD
1240690246162907137,2020-03-19 17:23:00,"Because of #COVIDー19, @USTreasury and @IRSnews announced that all individual and other non-corporate tax filers can defer up to $1 million of federal income tax payments due on April 15, until July 15, without penalties or interest. #InItTogether https://t.co/W6RUbqAEcy"
1240674586569715712,2020-03-19 16:20:46,RT @IAFFNewsDesk: The #IAFF has developed a resource for first responders on treating patients who may have been exposed to the #Coronaviru…
1240665583814934530,2020-03-19 15:45:00,"St. Mary's Medical Center in Langhorne has opened drive-thru #COVIDー19 testing as of March 18 under specific conditions mentioned on the page below. #InItTogether #StopTheSpread

https://t.co/rjcQ2gKEWr"
1240635405172707328,2020-03-19 13:45:05,RT @SBAgov: What's the process for applying for an SBA disaster loan and what documentation is required? This fact sheet breaks it down: ht…
1240435911231451136,2020-03-19 00:32:22,RT @RepAndyKimNJ: We can do things now to help them. I've joined @NydiaVelazquez @RepBrianFitz @gracenapolitano to ask insurance companies…
1240392124480323585,2020-03-18 21:38:22,"Kudos to all jurisdictions that are creating special shopping hours to protect our most vulnerable citizens. I urge all jurisdictions, including all jurisdictions in PA, to adopt similar rules to protect our most vulnerable citizens. https://t.co/tGFDSeGbee"
1240332136537714690,2020-03-18 17:40:00,"PLEASE watch and share this interview with Dr. David Damsker, the Director of the Bucks County Department of Health. #COVIDー19  #InThisTogether #StopTheSpread 

https://t.co/vhCVAv5eXP"
1240322073500823553,2020-03-18 17:00:01,"Doylestown Hospital has opened drive-thru #COVIDー19 testing as of March 17 under specific conditions mentioned on the page below. #StopTheSpread #inittogether

https://t.co/ThNnZ1NO3u"
1240314521492824064,2020-03-18 16:30:00,"Medicare telehealth has been expanded.

https://t.co/IYyKWCZopr"
1240276773293572099,2020-03-18 14:00:00,"More tips for small businesses in the face of #COVIDー19:

https://t.co/Krt8ZiTkF1"
1240035181106348032,2020-03-17 22:00:00,"#COVIDー19, what small businesses need to know. https://t.co/XzGRAAhDij"
1240007619487633416,2020-03-17 20:10:29,"Please share this link with your family and friends for real time updates. It contains all relevant information regarding the health &amp; medical side of #COVID19. We are working with relevant agencies to build a tool for business, employee &amp; economic side. https://t.co/JndTHx0UpD"
1239570436771414016,2020-03-16 15:13:16,The @IRSnews has set up a resource page on its website to help those affected by the Coronavirus #COVIDー19. We need to focus on staying safe and healthy during this crisis. My office will provide updates regarding potential tax filing extensions. https://t.co/yrXQdjk2al
1239180267660533766,2020-03-15 13:22:53,"Please see the attached report from @SBAgov for details. Our office stands ready to assist and answer any questions you have.

https://t.co/h4qIj7VZ4p"
1239180266532409345,2020-03-15 13:22:53,"Upon a request received from a state’s or territory’s Governor, @SBAgov will issue under its own authority, as provided by the Coronavirus Preparedness and Response Supplemental Appropriations Act that was recently signed in to law, an Economic Injury Disaster Loan declaration."
1239180264724746241,2020-03-15 13:22:52,"To all small businesses in our community, @SBAgov is offering designated states and territories low-interest federal disaster loans for working capital to small businesses suffering substantial economic injury as a result of the Coronavirus #COVIDー19."
1239013594135695360,2020-03-15 02:20:35,"Please share this with your friends and family to ensure the safety of all in our community.

https://t.co/xeovpeadKN"
1238925367139635200,2020-03-14 20:30:00,"The FREED Vets Act will assist disabled veterans by requiring the Department of Education to erase their student loans, freeing them from crippling debt. I was proud to co-introduce this legislation with @RepConorLamb to serve those who have served us.
https://t.co/73jFmpADFL"
1238884603827494912,2020-03-14 17:48:01,Tune in to see @GovernorTomWolf &amp; @SecretaryLevine update on the Coronavirus #COVIDー19 and the mitigation efforts taken by the state relating to Bucks and Montgomery Counties. https://t.co/zjX4aDFfau
1238827222326284289,2020-03-14 14:00:00,"The opioid crisis has affected every corner of our community, and we need to encourage those suffering to get the help that they need. #EndTheSilence #EndTheStigma https://t.co/zFN5p6jInC"
1238800580006592512,2020-03-14 12:14:08,"Last night, the House passed the Families First Coronavirus Response Act, to provide emergency assistance to respond to Coronavirus #COVIDー19. I was proud to vote for this bipartisan package that prioritizes the health and safety of every American. https://t.co/rkt2u1nEML"
1238564937519128576,2020-03-13 20:37:47,"This week, the @ProbSolveCaucus hosted David Solomon, the CEO of Goldman Sachs. It was great to hear his thoughts on our financial sector and the impact of Coronavirus #COVIDー19 on our economy. https://t.co/QsegFRqx6G"
1238522985985777667,2020-03-13 17:51:05,RT @CongBoyle: You and your family can take everyday actions to stop the spread of the #Coronavirus. With proper precautions and by working…
1238487481449951234,2020-03-13 15:30:00,I met students from Roosevelt Middle School in Bristol while they were in D.C. this week. It was great to show them around the Capitol and teach them about the history of our great nation. https://t.co/4xaniaUxXs
1238464834955546625,2020-03-13 14:00:00,"Sending our love to the family of SWAT Cpl. James O'Connor and the entire Philadelphia Police Department.

https://t.co/XxMEbYJsZt"
1238449734945144832,2020-03-13 13:00:00,I recently joined Richland Township Fire &amp; Rescue for their annual banquet. Richland Fire &amp; Rescue not only responds to emergencies but is also an active participant in the community at large. Congratulations on a successful 2019 and best wishes in 2020. https://t.co/erhtPICrMF
1238245551055015938,2020-03-12 23:28:39,"ICYMI: Please see my website for updates on everything related to the #Covid_19. As the situation develops this will be updated with more information, tips, and facts. We are working with federal, state, and local officials to ensure everyone’s safety. https://t.co/GNqR4XXdh8"
1238226205264039941,2020-03-12 22:11:47,RT @RepRaulRuizMD: How do you prevent from getting COVID-19? Educating yourself about the coronavirus reduces anxiety and empowers you to p…
1238215690462662657,2020-03-12 21:30:00,"Ukraine is a key strategic ally in Eastern Europe, and we need to ensure the safety and security of our partner in the face of Russian aggression. @HouseForeignGOP @HouseForeign https://t.co/MxrJHRFHVt"
1238183155154268166,2020-03-12 19:20:43,RT @GovernorTomWolf: I’m at @PEMAHQ with @PAHealthDept to announce that we now have 22 known coronavirus cases and 180 people under investi…
1238170392776208385,2020-03-12 18:30:00,"Teaching our children the basics of coding can spark an interest in computer science, which, as our society becomes more automated, is a valuable skillset. I applaud Bristol Township Schools for participating in this program and hope that other school districts follow their lead. https://t.co/GPkOIhWe1J"
1238154012270231553,2020-03-12 17:24:54,"RT @SBAgov: #Coronavirus tips for small businesses: 
✔️Encourage sick employees to stay home. 
✔️Instruct employees to wash their hands oft…"
1238125094997647361,2020-03-12 15:30:00,@IAFFNewsDesk were in Washington this week to advocate for their members. I am proud to support our firefighters and thank them for keeping our community safe. https://t.co/QELv3TLq7s
1238087346609946629,2020-03-12 13:00:00,"Last weekend, I attended Perkasie FD's banquet to honor the brave volunteers of this company. Perkasie FD responded to 350 calls for assistance in 2019. Thank you to President Roger Jones, Chief Tim Metzler, and to all volunteers of Perkasie Fire for always answering the call. https://t.co/7B0khd518u"
1237838204645961728,2020-03-11 20:30:00,Let’s show our best friends the love they deserve by combating the inhumane practices at puppy mills. https://t.co/mYm4VzbWhx
1237792905487581184,2020-03-11 17:30:00,"I had the opportunity to speak at the @acog annual conference, to stress the importance of maternal health. https://t.co/qTbxvT5VZV"
1237762706284912647,2020-03-11 15:30:00,"I had the opportunity to speak with the @NNEDV, to discuss what the House is doing to combat domestic violence, and which programs need more funding in this fiscal year. I am proud to work with an organization that works so hard to support the victims of domestic violence. https://t.co/5V8jp6vQMv"
1237724960983941120,2020-03-11 13:00:01,"Congratulations to both Rajan Patel and Daniel Forsythe of troop 380 for achieving the prestigious rank of Eagle Scout. Thank you for inviting me to share in this special occasion with you, and for your work in making our community a better place. https://t.co/ERgSr3rIcr"
1237521941629677568,2020-03-10 23:33:17,"ICYMI: Please share this with your family and friends. It is a comprehensive and up to date resource on the Coronavirus #COVIDー19, with everything you need on how to keep your families safe and healthy.
https://t.co/3O6Uw34rBE"
1237485881767776258,2020-03-10 21:10:00,"Today, the FREED Vets Act, a bill I introduced with @RepConorLamb, passed the House. This legislation would require @usedgov to automatically discharge federal student loan debt for eligible permanently disabled veterans. https://t.co/pVmpcpo5qC"
1237369442557988870,2020-03-10 13:27:18,I was extremely grateful to participate in the inaugural Brad Fox Dinner to raise funds for the Officer Brad Fox Foundation. It's been nearly 8 years since Officer Fox gave his life in the line of duty. Thank you to Brad’s family and friends for ensuring that his legacy endures. https://t.co/UKA0tvGl6c
1237000186444070917,2020-03-09 13:00:01,"Happy #Holi to everyone celebrating! With the arrival of spring let us take the time to make new friends, laugh, and repair broken relationships. #festivalofcolors https://t.co/asOa6GENkC"
1236758589349302272,2020-03-08 21:00:00,"ICYMI: @JacksonLeeTX18, @RepRaulRuizMD, and I formed the bipartisan Coronavirus Task Force to keep Members and the public up to date on developments and health and safety tips regarding Coronavirus COVID-19. Please stay tuned for more updates and tips. https://t.co/AmheeZ2kUh"
1236743491742556160,2020-03-08 20:00:00,"Today we honor the sacrifices, accomplishments, and stories of women that often go untold. A world with full and total gender equality is a better world for everyone. #IWD2020 https://t.co/Y01AhuSpxE"
1236713294003671042,2020-03-08 18:00:00,"Some helpful information on the Coronavirus #COVIDー19

https://t.co/s6n2zmOa1A"
1236699910831030275,2020-03-08 17:06:50,"Please utilize this website for updated information on #COVIDー19 Coronavirus regionally, nationally and globally. Use these health and safety tips while going about your day. https://t.co/9U8rIlg62m"
1236675542721560577,2020-03-08 15:30:00,Great to have @GovLarryHogan​ meet with the @ProbSolveCaucus​ this week to discuss bipartisan solutions to some of the biggest challenges facing our country. Thanks for stopping by Governor! https://t.co/z2TTmBsX6r
1236637797861261312,2020-03-08 13:00:01,"Last weekend, I had the pleasure of attending Newportville Fire Company’s annual installation banquet. Newportville Fire has been staffed exclusively by volunteers since its inception in 1927. Thank you all for putting your lives on the line to keep our residents safe. https://t.co/YuX6b7iqdu"
1236366005628293120,2020-03-07 19:00:00,"March is Women's History Month! There are great programs in our area to check out this month, especially at the Michener Art Museum in Doylestown.

https://t.co/XhX4JgCyZd"
1236328253876469760,2020-03-07 16:30:00,Check out these great tips from @SocialSecurity to protect yourself from fraud: https://t.co/8gQOYemvpk
1236290508667969541,2020-03-07 14:00:01,"This week, I met the Miller family and their daughter Ellie to discuss Tuberous Sclerosis, a disease that affects only 1/6000 and causes tumors and growths on organs. They have an incredible story, and it was great to learn more about TS to help raise awareness. https://t.co/UjOXVAcx7G"
1236041364913209344,2020-03-06 21:30:00,"From education to public safety, there are plenty of ideas to generate jobs and strengthen our economy.

https://t.co/t0c9v49KnT"
1236022488934559744,2020-03-06 20:15:00,"This is a great #JobsReport from February! 
✔️273k jobs added 
✔️3.5% unemployment
✔️Hourly wages up 3%

https://t.co/jJboRY5KNO"
1236003616793583616,2020-03-06 19:00:00,"It was great seeing the @WeRRestaurants this week for their annual fly-in. They are incredible advocates for their industry, and it is always great to talk to them. https://t.co/eUhdlcWnmq"
1235983734870020101,2020-03-06 17:41:00,"RT @RepBeatty: Prevent the spread of #COVID19. @CDCgov recommends:

🤒 Avoid contact w/people who are sick
😑 Avoid touching eyes, nose, &amp; mo…"
1235965867411812352,2020-03-06 16:30:00,Check out this updated fact sheet from the @CDCgov on the Coronavirus COVD-19. https://t.co/KuPjiICWGD
1235950356540030977,2020-03-06 15:28:22,"RT @RepAlexMooney: While the #COVIDー19  situation develops, here are some basic things to keep in mind to protect yourself.

Quick Tip: A g…"
1235928120286261251,2020-03-06 14:00:00,"Congrats to the Bandits &amp; Peewee football teams of the Bensalem Ramblers for their NESAC championship and to the Cuties cheer team, for winning the Spirit Brands Nationals! It was wonderful celebrating these remarkable achievements with you all, and best of luck next season! https://t.co/B86TuMhWZL"
1235700033632206849,2020-03-05 22:53:40,RT @repdelgado: Want to help prevent the spread of #COVID19? Information is available from @CDCgov here: https://t.co/XARWtFs69L https://t.…
1235678976095514625,2020-03-05 21:30:00,"Thanks to the @ymca of Pennsylvania for sitting down with me this week. We need to make investing in our nation's youth a priority, and the YMCA is a great organization to support. 

https://t.co/QZeiUs0Duj"
1235641232145158148,2020-03-05 19:00:01,"Yesterday, I got to meet with Jimmy and the @biaamerica of Pennsylvania to discuss the challenges facing individuals with brain injury throughout our Commonwealth. Thank you for being such great champions for your cause! https://t.co/NtBLUgBLuM"
