id,created_at,text
1238869888296460289,2020-03-14 16:49:33,"While I supported last week’s $8.3 billion coronavirus funding bill,  I could not vote for a 100+ page, multi-billion dollar bill given I only had 23 minutes to review it. As I said during my campaign, ""never again should we have to pass the bill to find out what’s in it.” https://t.co/XAg9XNpXkv"
1238569114068758531,2020-03-13 20:54:22,"Congress recently took action to combat the coronavirus by allocating $8.3 billion to expedite vaccine development, make tests more readily available, and assist state health departments. Working together, we will ""flatten the transmission curve"" and get through this crisis. https://t.co/rw1QcK5dGb"
1238177243194687488,2020-03-12 18:57:13,"It was a pleasure to meet with Pastors from Shenandoah Baptist Church in Verona, Grace Baptist Church in Woodstock, and @ValleyBapChurch in Stuarts Draft. The congregations are a wonderful example of the faithfulness of our District and its people. https://t.co/dsmQ4PkOrm"
1237836679676903424,2020-03-11 20:23:56,"Today, the CDC awarded $560 million to state &amp; local governments to combat the coronavirus – of which $13.5 million will be directed toward Virginia. 
https://t.co/OBileOkodh"
1237466666809917440,2020-03-10 19:53:39,"Today, I met with students from @LibertyU’s Automobile Dealership Management Program. We chatted about the legislative initiatives impacting the industry they plan to enter. Their thoughtful and engaging questions highlighted their enthusiasm for their future careers. https://t.co/G4R14D3Emt"
1237138443676901377,2020-03-09 22:09:24,"My office is currently accepting internship applications for the summer sessions. The deadline to apply for a summer internship is March 31st. If you or someone you know is interested, please follow the link below for more details: 
https://t.co/36JD4w5HjV"
1236638166255353856,2020-03-08 13:01:29,https://t.co/bb71Edl4Ui
1236367899641761792,2020-03-07 19:07:32,"Today, I hosted a Service Academy Day at @FMS_Caissons. These events allow students interested in attending one of our nation’s service academies the opportunity to learn about the nomination process and how they can receive a world class education while serving our country. https://t.co/Llpn6jOE1u"
1235952951946031104,2020-03-06 15:38:41,"I took to the House Floor yesterday to recognize @VMI1839 for their continued academic success. In the 2019/2020 academic year, Virginia Military Institute produced one of the highest numbers of Fulbright Scholars in the country. Congratulations on this noteworthy accomplishment. https://t.co/HHyIvUcMSz"
1235737613295853568,2020-03-06 01:23:00,@LOFTReborn @BobGoodlatte6 Send us a resume!
1235631801504354304,2020-03-05 18:22:33,"Thank you to everyone who participated in my first telephone town hall last night. While I always enjoy meeting folks in person at forums across the District, this is just one more way of being even more accessible to constituents when I’m in Washington. https://t.co/kS5zkHWUSv"
1235341982236626945,2020-03-04 23:10:54,"Tonight, the House put partisan politics aside and passed $8.3 billion in emergency #coronavirus funding for our public health agencies. In rapidly developing situations like these, Congress must work together to ensure the safety and security of the people we represent. https://t.co/d08dhaOBmW"
1235327145804787718,2020-03-04 22:11:57,".@myVRLTA represents countless businesses throughout VA-06. Today, I was pleased to meet with association members, including Matt Simmons who owns Capital Ale House in Harrisonburg. We discussed several legislative initiatives that could help small businesses in our area. https://t.co/loC6smoyV4"
1235246222065180678,2020-03-04 16:50:23,I invite students interested in attending one of our nation’s Service Academies to join me this Saturday at Fishburne Military School. Representatives from various academies will be on hand to discuss the application process. https://t.co/pefd0R7vXy https://t.co/x8GCR0wnZ2
1234973481906782208,2020-03-03 22:46:37,The Veterans of Foreign Wars (VFW) is the largest and oldest service organization dedicated to assisting Veterans of overseas conflicts. I appreciated the opportunity to meet with representatives from our area to discuss how I can continue to support our Veterans. https://t.co/jA6XWYEaqO
1234924744056745985,2020-03-03 19:32:57,"In an effort to be even more accessible to Sixth District constituents, I will be hosting my first telephone town hall tomorrow evening between 7pm and 8pm. To sign up for this event, please follow the link below: https://t.co/PoW0CqSiji"
1234554028459220992,2020-03-02 18:59:51,I enjoyed participating in Read Across America Day at W. W. Robinson Elementary School in Woodstock. This initiative celebrates Dr. Seuss’ birthday and is intended to promote literacy among our Nation’s youth. https://t.co/IadcTd52Vg
1234117858336137218,2020-03-01 14:06:40,https://t.co/fR9mawayxM
1233755542423834625,2020-02-29 14:06:58,"Congratulations to Sixth District native, Bette Brand, on being named @USDA’s Deputy Under Secretary for Rural Development. Bette’s years of service with @FarmCreditVAs  have been an asset during her tenure at USDA’s Rural Business Cooperative. Best of luck in this new role. https://t.co/hhrHCFZrzA"
1233482457510535170,2020-02-28 20:01:49,"This week, I voted to condemn Bernie Sanders for expressing his support for Communist Cuba and the Castro regime. We must support free societies and free people. https://t.co/GZwyNF51mc"
1233454334429552642,2020-02-28 18:10:04,"I was proud to author the Small Business Reorganization Act, which went into effect last week. Small businesses are the backbone of the American economy, and this bill will help struggling businesses keep their doors open and employees on payroll. https://t.co/7YeSEwb8PJ"
1233100821753221122,2020-02-27 18:45:20,I testified before the Budget Committee today to convey the outrage of my constituents at Congress’ failure to do its job and pass a budget resolution. Congress needs to get its fiscal house in order and stop its addiction to irresponsible deficit spending. https://t.co/2KoXvFWGHL
1232796427019046915,2020-02-26 22:35:47,It was a pleasure to meet today with the owners of Harmony Harvest Farm located in Weyers Cave. We discussed enforcement of labeling requirements for imported flowers and other legislative issues affecting the floriculture industry. https://t.co/P5kk3dTttL
1232773708550459392,2020-02-26 21:05:30,"I was sad to see Senate Democrats filibuster and block two bills of which I am a cosponsor, the Born-Alive Abortion Survivors Protection Act and the Pain-Capable Unborn Child Protection Act. As your Congressman, I will continue to fight for the lives of the unborn. https://t.co/AExcbTTGjB"
1232319450105483266,2020-02-25 15:00:26,"Since its founding in 1928, the @NationalFFA has worked to mold students into tomorrow’s agricultural leaders. As we celebrate #FFAWeek, we recognize the organization &amp; its 700,000+ members who embody the motto, ""Learning to Do, Doing to Learn, Earning to Live, Living to Serve."" https://t.co/08jMFEOdGT"
1232050608137474053,2020-02-24 21:12:10,"Today, the world lost longtime Virginia resident and @NASA trailblazer, Katherine Johnson. Her contribution was vital to the success of the United States’ first crewed mission to space. She inspired a generation, &amp; her life should serve as a shining example for others to follow. https://t.co/sy6JyfaVC9"
1231580176775073792,2020-02-23 14:02:50,https://t.co/rL5VVouLpb
1231354830167445504,2020-02-22 23:07:23,"Yesterday, I joined Lawrence Equipment as they opened their new CASE dealership in Botetourt County. This endeavor highlights the opportunity for growth that is possible when Washington gets out of the way of businesses and does not tie their hands with burdensome regulations. https://t.co/dWej2Nd7RY"
1230865638039707652,2020-02-21 14:43:31,"This week, I joined Connect to Congress with @ABC13News to discuss the important issues affecting our local communities.
https://t.co/grxrnwOTH5"
1230150401430822912,2020-02-19 15:21:25,"Today, on its 75th anniversary, we remember the 70,000 Marines who landed on Iwo Jima. After five-weeks of fighting there were an estimated 25,000 American casualties, including 7,000 deaths. Their courage, dedication, and service to our nation will never be forgotten. https://t.co/HrEQG8C5Dn"
1229888483013091328,2020-02-18 22:00:39,"Today, I held my 25th town hall since being elected. Regardless of whether I’m in Washington or home in the Sixth District, I am committed to being as accessible to folks as possible. Thank you to everyone who attended today’s forum in Lexington. https://t.co/xdnQ0haZSS"
1229418038249869313,2020-02-17 14:51:16,"Today, we honor the birth of Virginia native and hero of the American Revolution, President George Washington. His leadership and commitment to building a strong and independent nation laid the foundation for our Republic, which other countries strive to emulate today. https://t.co/mvkFchMwPF"
1229042764416987136,2020-02-16 14:00:04,https://t.co/ctQBQqpM6Z
1228711113631682560,2020-02-15 16:02:12,"Last November, Weyers Cave native, Quin Houff, signed with @StarcomRacing as a full-time @NASCAR driver. Tomorrow, @P1_Houff will race in his first #DAYTONA500. I join your neighbors in wishing you the best of luck in the big race and for the remainder of the season. https://t.co/C8Wl4pboqk"
1227985024210870272,2020-02-13 15:56:59,"I spoke today on our continued efforts to “drain the swamp” and the great reforms that have been proposed by the Republican Study Committee. Congress must do its part to promote transparency, rein in a bloated bureaucracy, and reduce the size and scope of the Federal government. https://t.co/2lo2BoyZrd"
1227621406072025089,2020-02-12 15:52:05,"Today, Carilion Clinic IRONMAN 70.3 Virginia's Blue Ridge announced they have obtained all necessary permits to hold their inaugural triathlon in the Roanoke Valley. This venture is an exciting opportunity for our community and will showcase all that our region has to offer. https://t.co/654T0z7Gjl"
1227359691405172737,2020-02-11 22:32:08,".@JMU continues on its path toward excellence today. Not only was JMU recently named the best school in the nation for veterans, but it was also announced that the Dukes have more students participating in the Fulbright program than any other university in the country. https://t.co/zTTyibBebK"
1226507529523515393,2020-02-09 14:05:57,https://t.co/L8VJEFh2W4
1226163296828563456,2020-02-08 15:18:05,"H.R. 2474, the PRO Act, which passed the House this week, would inappropriately preempt and prohibit right-to-work laws in 27 states that value and protect this right. This is unacceptable, and I opposed this business-crushing legislation. https://t.co/Gif38PXe9n"
1225905543614803969,2020-02-07 22:13:52,"Lynchburg native and Medal of Honor recipient, Desmond Doss, heroically saved 75 of his fellow soldiers during the World War II Battle of Okinawa. Today, we remember his actions and honor his life and legacy. https://t.co/6BYjOJ1bEM"
1225852086665056256,2020-02-07 18:41:27,"The economy continues to thrive under the policies of @realDonaldTrump. Today’s jobs report shows that 225,000 jobs were added last month and wages rose 3.1% from this time last year – both numbers surpassing expert predictions. https://t.co/ewqItI4n92"
1225539988995047427,2020-02-06 22:01:17,"Yesterday, I took to the House Floor to recognize Sheriff Ronnie Sprinkle on his 20 years of service to Botetourt County. Thank you for everything you have done for our community over the past two decades, and I wish you all the best in retirement. https://t.co/4uSB0kBzhu"
1225447749782528008,2020-02-06 15:54:45,"Ronald Reagan would be 109 years old today. His hope and optimism in America inspired a generation. Happy Birthday, Mr. President. https://t.co/XhucRx0SjX"
1225171599466336256,2020-02-05 21:37:26,My thoughts on the U.S. Senate’s acquittal of President Trump and the impeachment process as a whole: https://t.co/t2aUceUJK1
1224909399472443394,2020-02-05 04:15:33,"The state of our union is strong. @realDonaldTrump and his administration have accomplished a great deal in the past year, and I am excited by the President’s forward-looking message and optimistic vision for what Americans can accomplish in the future. #SOTU https://t.co/1DCv7QYfge"
1224819648350294016,2020-02-04 22:18:54,The title of President Trump’s #SOTU speech tonight is ‘The Great American Comeback’. I look forward to hearing from @realDonaldTrump about the strong state of our union and his vision for the future. https://t.co/etEd5EpWun
1224784902954070019,2020-02-04 20:00:50,"This morning, I had the opportunity to tour @nibcoinc in Stuarts Draft. This brand leader of valves, fittings, &amp; flow-control products has expanded rapidly over the past 3 years &amp; is a great example of how businesses can thrive when Washington works to cut bureaucratic red-tape. https://t.co/MyVSDjc361"
1223969359854493700,2020-02-02 14:00:10,https://t.co/4rjS0EqFBR
1223659832491855872,2020-02-01 17:30:13,"Both my Washington and District offices are seeking hardworking, dedicated interns for the spring session. For more information and application details, please visit my website. https://t.co/mxKpO2xfS7"
1223301113270734849,2020-01-31 17:44:47,"Opioids are ravaging communities across the United States. However, through commonsense solutions and support for first responders and treatment programs, I am confident we can help our fellow Americans struggling with opioid abuse and end this insidious epidemic. https://t.co/FNsJopU7Fh"
1222940920246566913,2020-01-30 17:53:31,"Today, @MackTrucks announced the launch of a new manufacturing facility in the Roanoke Valley. This $13 million investment will produce the all-new Mack MD Series of medium-duty trucks and result in the creation of 250 new high-quality jobs. Welcome to Virginia! https://t.co/YGOdcXoLYD"
1222914482760036352,2020-01-30 16:08:27,"I took to the House Floor this week to recognize the 250th anniversary of Botetourt County. Not only is our region filled with beautiful landscapes, but is rich in history and culture. I am proud to call Botetourt County home. https://t.co/c630aIBCse"
1222677798046851073,2020-01-30 00:27:57,Fentanyl Kills. The small dose pictured below is enough to be fatal. Today I voted to save lives by renewing the classification of fentanyl as a Schedule I narcotic. https://t.co/4Q2jVWKqTT
1222618351098388482,2020-01-29 20:31:44,"The FFA prepares members for leadership, personal growth, and career success through agricultural education. Today, I met with Botetourt native and @JMU student, Tess Seibel, who serves as the @NationalFFA Eastern Region VP, to discuss their goals for the coming year. https://t.co/imAJ3AWHEJ"
1222575660436197376,2020-01-29 17:42:06,"After more than a year waiting in limbo, the USMCA was signed today by the President. USMCA is a big win for the American people creating a more level playing field for workers, strengthening agricultural trade, and modernizing intellectual property protections. https://t.co/obXCwFLjX7"
1221827517461475330,2020-01-27 16:09:15,"Today, #WeRemember the six million innocent men, women, and children who were murdered in the Holocaust. Never again can we let such a tragedy occur, and we must work to combat the growing evil that is anti-Semitism around the world. https://t.co/JLSAsBzvb4"
1221521297739583492,2020-01-26 19:52:26,https://t.co/sUXhmCxxjr
1220829227441905664,2020-01-24 22:02:24,It was a great opportunity to speak with the students. They are an informed and inspiring group! https://t.co/Hy3D5y6n7E
1220710278213533696,2020-01-24 14:09:44,"To any constituents in DC today, please feel free to use my office, 1009 Longworth House Office Building, as home base and bring a bit of the Sixth District with you! https://t.co/ipAQeScf1j"
1220508491464482817,2020-01-24 00:47:54,A back and forth discussion on the issues is vital to civil debate. Thank you to all of the Roanoke City residents who attended tonight’s town hall. I look forward to holding more forums like this throughout the 6th District &amp; continuing to make myself available to constituents. https://t.co/1PbB5nQ5lN
1220376096262279168,2020-01-23 16:01:49,Great to see a packed house at this morning’s town hall in Lynchburg. Thank you to everyone who took the time to attend. I always enjoy the opportunity to hear from constituents and engage in a dialogue about the important issues facing Virginia’s Sixth District and our nation. https://t.co/VkP2zbtwis
1220045171032821760,2020-01-22 18:06:50,"Today marks 47 years since Roe v. Wade was decided by the US Supreme Court. Since 1973, over 50 million preborn children in America have had their lives cut short. The right to life is our most basic human right, and I will continue fighting to protect the most innocent among us. https://t.co/DcC77mKYrd"
1219793092737425417,2020-01-22 01:25:10,I appeared on @MorningsMaria today to discuss attacks on our Constitution by Democrats in both Washington &amp; Richmond. Impeaching the President for political advantage &amp; restricting the Second Amendment rights of Virginians undermine the Constitution &amp; the intent of our founders. https://t.co/unF7JEaOBa
1219606440786243584,2020-01-21 13:03:29,I’ll be joining @MorningsMaria shortly on @FoxBusiness. Tune in to get my take on the Senate impeachment trial and yesterday’s Second Amendment rally in Richmond.
1219271521149112321,2020-01-20 14:52:38,Today we honor the life and legacy of Dr. Martin Luther King Jr. His selfless devotion to fighting injustice and inequality forever shaped the future of America. https://t.co/gjQYkpSgSy
1218896223454793728,2020-01-19 14:01:20,https://t.co/vd9nsuB1I9
1218601416685707265,2020-01-18 18:29:52,"A bet is a bet, and I’m a man of my word. This week @RepArmstrongND dropped off Thundar and Dakota, our new office goldfish. I look forward to gifting my friend from North Dakota a pet named Duke next year. Congrats to @JMUFootball &amp; NDSU on hard-fought seasons. #FCSChampionship https://t.co/ElBZvCFqGc"
1218538629276078082,2020-01-18 14:20:23,It was an honor to attend yesterday’s naturalization ceremony in Roanoke. I congratulate the 38 new Americans who took the Oath of Citizenship and wish them the very best on their journey toward achieving the American Dream. https://t.co/EKUWXfYSR9
1218171594364899328,2020-01-17 14:01:55,"With the Senate's approval of the United States-Mexico-Canada Trade Agreement, the deal is heading to @realDonaldTrump’s desk. USMCA is a big win for American workers, manufacturers, and farmers and is expected to create 176K new jobs and add nearly $68B to the U.S. Economy. https://t.co/o9F6LCMZlR"
1217843345755688960,2020-01-16 16:17:34,"On this day in 1786, the Virginia legislature adopted Thomas Jefferson’s Statute for Religious Freedom, inspiring the framers of the U.S. Constitution. Today, we celebrate the right of all Americans to freely exercise their faiths. #NationalReligiousFreedomDay https://t.co/LE7D1uG1a2"
1217533379186434048,2020-01-15 19:45:52,"The “Phase One” Trade Agreement signed with China today will serve as a tremendous boost to American businesses, farmers, manufacturers, and innovators. China’s pledge to increase American imports by $200 billion is a victory for @realDonaldTrump and the American people. https://t.co/DstvzCrv72"
1217188558349459459,2020-01-14 20:55:41,Pablo Cuevas has been a leader in Rockingham County for the past 30 years. I thank him for his unwavering commitment to our community and wish him well in his retirement from the Board of Supervisors. https://t.co/JrS8YHqG3j
1217093468054605826,2020-01-14 14:37:49,"For months, Democrats called impeaching the President urgent - yet 27 days have gone by and the Speaker still has not sent the Articles to the Senate. This attempt to grab headlines exposed what Americans already knew, that impeachment was nothing more than political theater. https://t.co/jgmtHcR1Og"
1216860013630836736,2020-01-13 23:10:10,Tune in shortly to The @EveningEdit on @FoxBusiness. I’ll be discussing the Speaker’s delay in sending the Articles of Impeachment to the Senate.
1216841828374405128,2020-01-13 21:57:54,"I was pleased to meet with Dr. Rita Bishop this morning to present her with a copy of the Congressional Record honoring her years of service as Superintendent of @RoanokeSchools. Thank you for your commitment to our students, and I wish you all the best in retirement. https://t.co/ASNAqrCRVR"
1216415119384698882,2020-01-12 17:42:19,https://t.co/8Q8V9cYVMV
1216150028940726272,2020-01-12 00:08:56,RT @SGhasseminejad: This tweet by @realDonaldTrump with more than 100k likes is already the most liked Persian tweet in the history of Twit…
1215706396198625280,2020-01-10 18:46:06,"I am honored to announce today the names of the students I have nominated to join the Class of 2024 at our U.S. Service Academies. Congratulations on your nominations and best of luck in the selection process.

https://t.co/GZZXE28odw"
1215409319719497728,2020-01-09 23:05:37,My thoughts on the War Powers Resolution passed in the House this evening: https://t.co/OwFlMPFwYc
1215385891868479491,2020-01-09 21:32:32,"It has been a busy week in DC, but my thoughts are always with VA-06. On Saturday, @JMUFootball will take on @NDSUfootball in the FCS Championship. @RepArmstrongND and I made a wager on the game, so the loser must buy an office goldfish to be named by the winning team. Go Dukes! https://t.co/ymhsFxf6hl"
1215349804416622594,2020-01-09 19:09:08,"Today, we honor the brave men and women in blue who put their lives on the line each day to protect and serve our communities. Thank you for all you do. #LawEnforcementAppreciationDay #BackTheBlue https://t.co/VvRqh0hN8I"
1215129721274544128,2020-01-09 04:34:36,@AJFriedenberger @RTDSchapiro Yikes. Hope they get back on track tomorrow. But it's still better than the scene we've got up here in DC. Ridiculous.
1215126311095750657,2020-01-09 04:21:03,@RTDSchapiro @AJFriedenberger Wait...the House didn't adopt rules today? Has that ever happened before?
1214962511835017217,2020-01-08 17:30:10,Our prayers are with my friends in the @VaHouse &amp; @VaSenate as the 2020 session convenes today. May God grant them the wisdom and vision to make the best decisions for our Commonwealth and its citizens. Special congrats to @EFillerCorn on her election as the first female Speaker.
1214577368209264640,2020-01-07 15:59:44,"This morning, I held my third town hall of the new year in Staunton. I appreciate everyone who took the time to attend today’s event. I value opportunities like this to listen to and engage directly with those who call VA-06 home. https://t.co/yAdjY2repR"
1214347588952088576,2020-01-07 00:46:41,It was a pleasure talking with those who attended tonight’s town hall in Harrisonburg. Thank you to everyone who came out to this forum. I look forward to holding more events like this across the District in the near future. https://t.co/fVdNKiTFqG
1214279784320163841,2020-01-06 20:17:15,Thank you to those who attended this afternoon’s town hall in Botetourt County. I always appreciate hearing from constituents and having an opportunity to discuss the important issues facing the Sixth District and our nation. https://t.co/5NhcWnnXrv
1213822480311296003,2020-01-05 14:00:05,https://t.co/5UoueKL86l
1213115376474742785,2020-01-03 15:10:19,"Gen. Soleimani was the leading architect of Iran’s global terror strategy, including the recent planning of imminent attacks against US interests. I commend President @realDonaldTrump for taking strong and decisive action to protect our troops and defend America. https://t.co/jrXiND59TP"
1212369640158093314,2020-01-01 13:47:01,Wishing everyone in the Sixth District of Virginia and across our great Nation a joyful and prosperous New Year! https://t.co/1SeFBWhtjW
