id,created_at,text
1247269720975462400,2020-04-06 21:07:29,"From direct cash assistance to small business disaster loans, navigating these unprecedented times can be difficult for all of us. That is why we compiled a list of resources for you. If you need further assistance, please contact my office at 603-285-4300 https://t.co/1OJoqTBSo1"
1247246851499311104,2020-04-06 19:36:36,Today I spoke with advocates from @NHCADSV about the increasing risk of domestic violence during the COVID-19 pandemic. We must continue to support survivors and ensure our state’s frontline organizations and crisis centers have adequate funding. https://t.co/YuG61yrjEh
1246823865629712385,2020-04-05 15:35:49,"New Hampshire's Main Street economy and workers have been hit incredibly hard by coronavirus. That's why I've made it a priority to advocate for direct support and relief to help small businesses weather this unprecedented challenge.

https://t.co/1lis59YvQp"
1246180364642586627,2020-04-03 20:58:46,"I am glad the administration heeded calls made by myself, our federal delegation, and Governor to approve New Hampshire's disaster declaration request. This will further expedite support to families and communities as we work to conduct a comprehensive response to COVID-19. https://t.co/ntYXXDggvU"
1246136707705167875,2020-04-03 18:05:17,"New Hampshire is receiving $11.7 million to give much needed help to our vulnerable homeless population and provide assistance to communities in need with a variety of flexible applications including community heath, child care, and senior services.

https://t.co/Odiu93etoc"
1246106137495318528,2020-04-03 16:03:49,"This former Editor-in-Chief of The Little Green is glad to see that even in these unprecedented, challenging times, student journalists are still on the beat. 

Looking forward to reading online!

https://t.co/5Tgr4ckGyd"
1246078753207390240,2020-04-03 14:15:00,"This is not your average marathon!  Dover Middle School teacher Matt LeBlanc ran *623* laps in his backyard to raise money for the Community Food Pantry in Somersworth. 

Nice run, Matt!

https://t.co/43nHinJjFo"
1246065428088176640,2020-04-03 13:22:03,RT @wkxlnhchris: . @RepChrisPappas is.on with us right now! #nhpolitics https://t.co/DT5aRL4980
1246062257664077825,2020-04-03 13:09:27,"I'll be joining @MikePompNH on @981WTSN and @wkxlnhchris on @wkxlnh this morning to discuss coronavirus and the federal response.  

Listen in:

WTSN: https://t.co/1uhEHPX4P6
WKXL:  https://t.co/4vW3fgfdys https://t.co/0Yfi67BwkX"
1245806886521274368,2020-04-02 20:14:42,"Less than an hour away from tonight's telephone town hall with @RepAnnieKuster to take your questions and provide information on the coronavirus response. 

We will be joined by a medical specialist and @sbagov NH.

Dial 866-478-3366 at 5PM or go to https://t.co/H6GOzunVAP https://t.co/6OHc7a0vO0"
1245758109013991425,2020-04-02 17:00:52,"In February, I wrote to @US_FDA calling for a change to its outdated, discriminatory blood donor policy. This announcement is a step forward, but more must be done to follow science and allow healthy individuals to give blood—especially during a crisis where donations are needed. https://t.co/kiEHMfR7hq"
1245688098752774145,2020-04-02 12:22:41,"📻 I'll be live on @NHTodayShow this morning in a few minutes to discuss the coronavirus and the federal and state response. 

Tune in: https://t.co/S5X3JezD0L https://t.co/MRmyEMvHMe"
1245474794579152898,2020-04-01 22:15:05,"Tomorrow afternoon at 5:00 PM I will be holding a telephone town hall with @RepAnnieKuster and NH medical and small business officials to discuss the response to coronavirus and answer your questions.

🗓Thursday, April 2
⏱5:00 PM
☎️ 866-478-3366
💻 https://t.co/H6GOzunVAP https://t.co/kDZizhTOje"
1245452530034884611,2020-04-01 20:46:37,".@AARPNH is compiling a lot of helpful local, state, and federal resources for older Granite Staters looking for assistance and information at this time. 

Take a look and please share with those in need ⬇️ 

https://t.co/BA4t3RUZVK"
1245406833000566785,2020-04-01 17:45:02,"It has never been easier to complete the census. It just takes a few minutes and you can complete it online, on the phone, or by mail. 

Go to https://t.co/0ADrYQnkgK to make sure you are counted and to help shape the direction of your community in the decade ahead. #CensusDay"
1245342418993647620,2020-04-01 13:29:04,"Great job, Joey! Thank you for pitching in to help our first responders and health care workers.

https://t.co/HmWFRz1Uf7"
1245143129621135362,2020-04-01 00:17:10,"This is incredibly disappointing. We should be making it easier to get care during a pandemic, not throwing up roadblocks. There is precedent for @HHSGov opening federal enrollment periods during emergencies and we should do so now.

https://t.co/DRqHGcOcUj"
1245072906473922566,2020-03-31 19:38:07,"On average, women in 2019 made just 81% what their male counterparts earned. And for women of color, that gap is even wider.

This remains unacceptable - women deserve #equalpay for equal work. #EqualPayDay https://t.co/8MaFv22gMc"
1245064890819252226,2020-03-31 19:06:16,"I led a bipartisan group of lawmakers today calling on @CMSGov to expand access to care during the coronavirus pandemic by helping states like New Hampshire cut red tape and fast track Medicaid enrollment.

Learn more: https://t.co/tY6i8x4yVm https://t.co/ygqCk1YcvC"
1245026043863367680,2020-03-31 16:31:54,"Today and every day I'm proud to support and stand with trans people in New Hampshire and across the nation. 

Now more than ever, we must make it a priority to stand up for the rights of the #trans community.

#TransVisibilityDay
#TransDayOfVisibility https://t.co/pUP3QfJuZb"
1244982273461620736,2020-03-31 13:37:59,"There isn't a corner of our state or part of our daily lives that has not been affected by this pandemic, and it is crucial that federal funds allocated to New Hampshire get to those who need them as quickly as possible.

https://t.co/zxa9b9Jyys"
1244764672001220608,2020-03-30 23:13:19,"The Granite State said farewell to a true original today. Thank you, Tomie dePaola, for entertaining and sparking the imaginations of children in New Hampshire and throughout the world for years. https://t.co/GSexPSR9Z0"
1244676546184589314,2020-03-30 17:23:08,Thank you to the doctors and medical professionals on the front lines of our coronavirus response. Thank you for all you are doing to keep us safe. #NationalDoctorsDay https://t.co/6dLN6EyIQ7
1244329195624370176,2020-03-29 18:22:53,"On March 29, 1973, the last U.S. combat troops left Vietnam. Now, National Vietnam War Veterans Day is a chance to honor those who served and sacrificed in Vietnam, and remember the legacy of all who did not return. 

Thank you for your service. #NationalVietnamWarVeteransDay https://t.co/PnqzvXtZM3"
1243613290980401154,2020-03-27 18:58:08,"The House just took a key vote and passed a bipartisan coronavirus response package. It now to goes to the President's desk. 

This help cannot come soon enough - our communities,  families, small businesses, front line health care providers, and our workers are counting on it. https://t.co/aGV1L241MD"
1243566923503337479,2020-03-27 15:53:53,"Our office is working with Jared and his family to get him home safely, as well as many other Granite Staters across the globe.

If you or a friend or family member are trying to get home, please contact my office at (603) 935-6710 for assistance.

https://t.co/mwEeMU3s4z"
1243307944516730882,2020-03-26 22:44:48,"📲 Be sure to tune in to 
 @SenatorShaheen and @SenatorHassan's telephone town hall - happening now - with @SBA_NH and the NH Department of Safety. https://t.co/ar0joDgARE"
1243265666871898120,2020-03-26 19:56:48,"This is the right decision to protect public health and I’m glad @GovChrisSununu has made this call. It won’t be easy, but we must take extraordinary steps to stop the spread of coronavirus and keep New Hampshire safe.

Find information about the new Stay-At-Home order below ⬇️ https://t.co/FEJjHkTUX8"
1243221833098432512,2020-03-26 17:02:37,"This package reflects the scale and urgency this moment requires, and it shows we can come together in a bipartisan fashion and deliver meaningful relief."
1243221745311637504,2020-03-26 17:02:16,"@SenatorShaheen @SenatorHassan It is essential that we not let up in our efforts to support families, small businesses, and our workers who are suffering through this pandemic and the resulting economic crisis."
1243221663061356546,2020-03-26 17:01:57,".@SenatorShaheen and @SenatorHassan deserve our thanks for their work and advocacy to move this bill through the Senate and onto the House, and I look forward to supporting this legislation and sending it to the President’s desk for his signature."
1243221318021120008,2020-03-26 17:00:34,I’m pleased to see the bipartisan deal pass unanimously in the Senate. It is critical that we work together to provide immediate funding for the most essential elements of our fight against coronavirus in New Hampshire and across the country. https://t.co/jRWhNf2pGD
1243189545010692096,2020-03-26 14:54:19,"Thank you to everyone who joined our town hall last night and asked so many great questions. 

We'll keep doing town halls and providing the most current information we have in the coming weeks.

Sign up at https://t.co/xz29ujMerm for our next event.

https://t.co/9exm4dR3MF"
1242859008349949952,2020-03-25 17:00:53,"Today at 5:15 PM I'll be holding a telephone town hall with @RepAnnieKuster and state health officials to take your questions and share up-to-date #coronavirus information.

Join at 5:15 PM by calling 866-478-3366 or listen and ask question online at https://t.co/H6GOzunVAP https://t.co/oztffGwbq9"
1242834894289502208,2020-03-25 15:25:04,"This is not a time for politics. It’s essential that legislation focuses directly on the pandemic and the economic crisis, and it’s clear this compromise reflects the scale and urgency this moment requires. 

The American people need our help – let’s deliver. 3/3"
1242834727649849344,2020-03-25 15:24:24,It is critical that we work together to provide immediate funding for the most essential elements of our fight against coronavirus as well as support for workers and small businesses. 2/3
1242834596699537414,2020-03-25 15:23:53,"I’m pleased to see a bipartisan deal has been reached between the Senate and White House. 1/3

https://t.co/gHxcJrBadF"
1242587019383050241,2020-03-24 23:00:06,"RT @MayorJoyceCraig: THREAD: While no one could have foreseen the impact COVID-19 has on our community, the City of Manchester has continua…"
1242583472801226754,2020-03-24 22:46:00,"New Hampshire is a state that pulls together to help our friends, family, and neighbors in need. When times are tough, we roll up sleeves (wash our hands) and get to work.

@GovChrisSununu has shared a number of great ways to serve, and I encourage you to pitch in if you can. https://t.co/Gp1WTDZgSY"
1242547269116846088,2020-03-24 20:22:09,"I'll be holding another telephone town hall tomorrow at 5:15 PM with @RepAnnieKuster and state health officials to take questions on #coronavirus and give an update on the latest response efforts. 

RSVP to join and ask questions here: https://t.co/H6GOzunVAP https://t.co/TqPO0E3fFD"
1242480673899896832,2020-03-24 15:57:31,"Employers want to do right by their workers, but they need our help.

I'm leading Republicans &amp; Democrats to fight for targeted tax credits to help prevent layoffs and support businesses. Let's get this done for small businesses and workers - right now.

https://t.co/KMGr9QZlDB"
1242181990809567232,2020-03-23 20:10:39,"I join all Granite Staters in sharing my condolences with the family of this individual.

It is critical that we all do our part to stay home, follow CDC guidelines, and stop the spread of coronavirus. https://t.co/u3YKNTiWae"
1242177347723431937,2020-03-23 19:52:12,RT @chelliepingree: Maine small businesses already operate on thin margins &amp; #COVID19 is making it more difficult to stay afloat. I’m proud…
1242154530323775491,2020-03-23 18:21:32,RT @RepKendraHorn: Our small businesses are job creators and engines of opportunity. When they suffer so do our workers and families. I'm p…
1242125289460846593,2020-03-23 16:25:21,"And it would waive the so-called “credit elsewhere” requirement for affected small businesses, which currently limits @SBAgov loan eligibility to businesses that would not otherwise have access to credit.

All while ensuring funds to cover the administrative cost of this effort."
1242124978230870016,2020-03-23 16:24:07,The legislation would provide debt repayment relief for small businesses by giving the @SBAgov Administrator broad authority to defer payments on existing SBA loans for affected businesses.
1242124750899548161,2020-03-23 16:23:12,"It would authorize @SBAgov to provide up to $15,000 in grant funding for each small business or nonprofit that applies for an EIDL loan, to be distributed within three days so that they can receive immediate relief"
1242124489779032064,2020-03-23 16:22:10,"This bill would expand the availability of zero-interest, zero-fee EIDL loans to affected small businesses and provide at least $350 billion in loan authority to help businesses affected by the COVID-19 outbreak."
1242122598093389824,2020-03-23 16:14:39,"New Hampshire's small businesses and workers are the backbone of our economy and they need our help now.

I just introduced legislation - the Too Small To Fail Act - which provides direct support and relief. We cannot leave them behind.

https://t.co/m65Xhi5szf"
1242107704770023424,2020-03-23 15:15:28,"In these unprecedented times, the Affordable Care Act - signed into law 10 years ago today - is needed more than ever. 

I called on @SecAzar to establish a Special Enrollment Period for patients to get ACA marketplace coverage during this pandemic #ACA10

https://t.co/uky6n7J4JT"
1242059033722355713,2020-03-23 12:02:04,"RT @WMUR9: Tonight: @RepChrisPappas outlines additional steps he believes should be taken to ""prioritize the urgent needs"" of small busines…"
1241835564544012295,2020-03-22 21:14:05,"Main Street small businesses and workers are being hit incredibly hard and need immediate help to withstand this outbreak. 

My letter to House leadership urges a small business and worker focus and outlines measures we can take to help now.

Read it here: https://t.co/bGZ3jHHNi3 https://t.co/XnkDvj4Ljn"
1241453224453976069,2020-03-21 19:54:48,"If you didn't get a chance to ask a question, don't worry - we will be holding more telephone town halls in the coming weeks.

Sign up to be notified by email when our next town hall is happening ➡️https://t.co/H6GOzunVAP

https://t.co/n89T3oCv6o"
1241412153220968449,2020-03-21 17:11:36,"Sharing a quick update on #coronavirus and the work I'm doing to meet (remotely) with constituents - including local leaders, health care providers, small business owners, and our workers.

I’ll be with you every step of the way working to get New Hampshire the resources we need. https://t.co/SDBsgCkYYh"
1241144591769915398,2020-03-20 23:28:24,"Now more than ever we must support those who are struggling and need help the most. These federal funds will allow the Granite State to keep up the fight and save lives.

https://t.co/rCHULRiXB0"
1241094305864994816,2020-03-20 20:08:35,"This is great news for New Hampshire. Having @SenatorShaheen advocating for the Granite State as a Senate negotiator will help ensure we get local businesses the help they need. 

I'm continuing to push for the House to deliver relief and support for our small businesses as well. https://t.co/sXYVuvw1St"
1241058066575081472,2020-03-20 17:44:35,"Just wrapped up a telephone town hall with thousands of Granite Staters. We're holding more remote events to get information out to the public and update you on the work we're doing to respond to #Coronavirus.

Visit https://t.co/H6GOzunVAP to sign up for the next town hall. https://t.co/z2augQt4L7"
1241034566468599816,2020-03-20 16:11:12,"Join me NOW for a live telephone town hall with @RepAnnieKuster and health and economic officials to discuss our response to #coronavirus and answer your questions.  

Dial 866-478-3366 to join now.

Listen and ask questions online at https://t.co/H6GOzunVAP https://t.co/o66PE6NdhT"
1240994353629270021,2020-03-20 13:31:25,"I'll be hosting another telephone town hall with @RepAnnieKuster
at 12:00 PM today to take your questions and give an update on the latest information on #coronavirus. 

Dial 866-478-3366 at 12PM to join.

You can also listen and ask questions online at https://t.co/xz29ujMerm https://t.co/kqvDSjRrTM"
1240815791509045250,2020-03-20 01:41:52,"Thank you, Dick - this is how Granite Staters come together to help one another. https://t.co/76T9guSDqU"
1240808865031229441,2020-03-20 01:14:21,"Thank you, @snhuprez! https://t.co/SLgg3ciB5j"
1240762960521441280,2020-03-19 22:11:56,New Hampshire's small businesses are being hit incredibly hard by #Coronavirus. This afternoon I met with a group Granite State small business owners and employees on a video conference to hear their concerns and discuss plans to support them. https://t.co/74snMg5J7p
1240706477410512897,2020-03-19 18:27:30,"REMINDER: my offices remain open for essential constituent services and support. 

Most of our staff is teleworking and I urge constituents to call or email and limit in-office visits if you are seeking federal assistance.

Learn more: https://t.co/azHRz3Quza https://t.co/W7OJsGG706"
1240681782283993088,2020-03-19 16:49:22,"Maintaining social distance and checking in with Strafford County Public Health Network partners via video conference. 

Now more than ever they are a critical resource for Strafford County residents. https://t.co/HZOQZS6Xca"
1240674665808437249,2020-03-19 16:21:05,"RT @BeAUNHWildcat: As our campus transitions to remote classes for the rest of the semester, we'll continue to be a resource for info about…"
1240673129049006081,2020-03-19 16:14:59,RT @RepAnnieKuster: @RepChrisPappas and I are urging @SpeakerPelosi to increase funding for the @SBAgov's Disaster Loan Program to ensure i…
1240645424542867456,2020-03-19 14:24:53,General Protzmann served her country with honor and distinction and made history here in New Hampshire. Granite Staters mourn her loss and remember her legacy. https://t.co/Kf3iN0V1LH
1240446630295408641,2020-03-19 01:14:57,"This package provides immediate relief to the families, communities, and local economies that have been hit hard by Coronavirus. 

Now more than ever we must work together to address this unprecedented challenge with swift, meaningful action. https://t.co/gKK88leydj"
1240399178553065473,2020-03-18 22:06:24,Business as usual has been obliterated on Main Street in the Granite State and across the country due to #coronavirus. That's why I urged @SBAgov to make this declaration and I applaud @SBAJovita's announcement today to help our small businesses weather this unprecedented crisis. https://t.co/CwIcyA06Yq
1240370895425687552,2020-03-18 20:14:01,"RT @RepKClark: Students have been left with mounting bills and without housing. @RepChrisPappas, @RepRubenGallego and I are calling on @Bet…"
1240362594348806144,2020-03-18 19:41:01,"Across the country, colleges and universities have taken action to protect students from #COVID2019 &amp; now it’s our time to act. @RepKClark, @RepRubenGallego, and I led a bipartisan group of members calling on @BetsyDeVosED to protect students from the financial impacts of this. https://t.co/pQy9Keg3eq"
1240316130083962880,2020-03-18 16:36:24,"RT @WMUR9: Manchester puts out call for cleaning products for fire, police officers https://t.co/OqELjzTK04"
1240274556889284608,2020-03-18 13:51:12,"RT @WMUR9: Pappas asks SBA to provide zero-interest loans for hardest hit small businesses, nonprofits https://t.co/IQQiC6KZX8"
1240265407690350594,2020-03-18 13:14:50,"I'm live with Jack Heath on @NHTodayShow 📻talking about #coronavirus, the impact in New Hampshire, and the federal response.

Listen here: https://t.co/yERP8Meiso https://t.co/TsQ4y9ahuv"
1240251243966205952,2020-03-18 12:18:33,"📻I'm live now on 'Good Morning New Hampshire' with Peter St. James on @1077ThePulse to give an update on the federal response to #coronavirus. 

Tune in: https://t.co/yRYyhUhPT4 https://t.co/JjErlbjYLx"
1239997977558765576,2020-03-17 19:32:10,Calling all veterans! The @DeptVetAffairs has resources for you to learn more about #coronavirus and what you can do to ensure you and your families remain safe. https://t.co/a5cFxw68Nv
1239967244345475072,2020-03-17 17:30:03,"To protect those they serve, Social Security offices will be closed to the public but will continue to provide critical services online at https://t.co/E2k6phRaJg. If you can't  conduct your business online, you can contact 1-800-772-1213 or contact my office for assistance. https://t.co/fUzYzzKFZ4"
1239950861914255361,2020-03-17 16:24:57,"New Hampshire hospitals have said loud and clear: they need access medical supplies and equipment. 

I'm urging @HHSGov to get Granite State hospitals the respirators, masks, and other supplies that are needed to support our coordinated response.
https://t.co/6KhCdba1IA"
1239562238723330049,2020-03-16 14:40:42,"RT @MayorJoyceCraig: Due to Manchester's public health incident regarding COVID-19, @Manchester_NH Water Works, @EversourceNH and @LibertyU…"
1239561852704698369,2020-03-16 14:39:10,"We're here for you - my offices will remain open for essential constituent services and support. 

Most of our staff is teleworking and I urge constituents to call or email and limit in-office visits if you are seeking federal assistance.

Learn more: https://t.co/azHRz3yTHC https://t.co/WfhSFLnsEV"
1239302628863074306,2020-03-15 21:29:06,It is my top priority to be accessible and available to Granite Staters and to assist constituents in every way possible while ensuring that we follow the best guidance from experts and officials to safeguard public health. Visit https://t.co/FvsbYkg7HO for more information.
1239302627801927680,2020-03-15 21:29:06,"To ensure consistent constituent service, support, and the flow of information to the First District, we will conduct additional communication via Virtual Town Halls, Telephone Town Halls, email newsletters, and other remote and digital outreach efforts in the coming weeks."
1239302626170359809,2020-03-15 21:29:05,My offices will remain open for essential constituent services. Most staff will telework and continue duties without interruption. We are transitioning meetings &amp; public events to phone calls and video conferences. Constituents are urged to contact the offices by phone or email. https://t.co/gz5zglynyz
1239266635195846658,2020-03-15 19:06:04,"These are unprecedented times and they call for extraordinary measures to safeguard the health and well-being of all our communities.

I am immensely grateful for our teachers and school professionals who will continue educating our young people under challenging circumstances. https://t.co/jgJ4Amxw1E"
1239234804522070019,2020-03-15 16:59:35,"RT @GovChrisSununu: WATCH LIVE: I’m holding a press conference with Dept. of Health and Human Services Commissioner Lori Shibinette, @NHEdC…"
1238838894097043457,2020-03-14 14:46:23,RT @RepChrisPappas: I urge the Senate to pass this bill as the House begins work on an additional emergency response package to further pro…
1238838884978606086,2020-03-14 14:46:21,"RT @RepChrisPappas: This legislation includes: 

✅ Free Coronavirus testing. 
✅ Paid emergency leave and enhanced Unemployment Insurance.
✅…"
1238838874761302016,2020-03-14 14:46:18,RT @RepChrisPappas: Tonight we will pass bipartisan legislation to protect public health and support our families. Now more than ever we mu…
1238828952191471618,2020-03-14 14:06:53,Now more than ever we must work together and put the health and economic priorities of this nation first - that is why I voted to pass the bipartisan Families First Coronavirus Response Act and urge the Senate to do the same when they return to Washington. https://t.co/1kcrTbrrpC
1238666119730401280,2020-03-14 03:19:50,"I urge the Senate to pass this bill as the House begins work on an additional emergency response package to further protect the health, well-being, and economic security of our communities."
1238666118576963585,2020-03-14 03:19:50,"This legislation includes: 

✅ Free Coronavirus testing. 
✅ Paid emergency leave and enhanced Unemployment Insurance.
✅ Strengthened nutrition security initiatives, including SNAP, student meals, seniors’ nutrition and food banks. 
✅ Increased federal funds for Medicaid."
1238666116714594304,2020-03-14 03:19:50,Tonight we will pass bipartisan legislation to protect public health and support our families. Now more than ever we must work together and put the health and economic priorities of this nation first.
1238576263276699648,2020-03-13 21:22:47,"I support the President’s decision to declare a national emergency to combat the ongoing spread of coronavirus. We need to bring to bear every possible resource to combat this public health threat, and this declaration is an important step.

https://t.co/Mt1w4zE86r"
1238553466789941251,2020-03-13 19:52:12,A key part of the effort to mitigate the impacts of coronavirus is ensuring that Granite Staters have access to affordable care. Today I led 100 of my colleagues in calling on HHS to establish a special open enrollment period so everyone can receive the treatment they need. https://t.co/wCxCEI7EPB
