id,created_at,text
1247238474949890058,2020-04-06 19:03:19,"If you haven’t had a chance to sign up online for my Tele Town Hall on the #COVID19 public health crisis, you can call in directly at 855-962-1081 TODAY AT 4PM. #PA17"
1247153173468413957,2020-04-06 13:24:22,REMINDER: Today at 4pm I’m hosting a Tele Town Hall for #PA17 &amp; will be joined by @ACE_Fitzgerald &amp; @HealthAllegheny Director Dr. Debra Bogen to answer your questions about the #COVID19 public health crisis. Click here to sign up: https://t.co/9MgFzCQmWf
1246853624547774466,2020-04-05 17:34:04,"Tomorrow (Monday, 4/6) at 4pm, I’m hosting a Tele Town Hall for #PA17 &amp; will be joined by @ACE_Fitzgerald &amp; @HealthAllegheny Director Dr. Debra Bogen to provide updates &amp; answer your questions about the #COVID19 public health crisis. Click here to sign up: https://t.co/9MgFzCyLxF"
1245748362453934082,2020-04-02 16:22:09,Important update for seniors in #PA17. Social Security recipients do NOT need to file anything to receive your $1200 direct cash payment from the government. Click for more info: https://t.co/CHNt2djJR8
1245429839974281225,2020-04-01 19:16:27,"The #Census2020 is critical to determining how resources get allocated to communities across #PA17.  It’s safe, simple and important. Learn more at https://t.co/6vP1MaXxHU &amp; fill out your questionnaire today."
1244736712343015430,2020-03-30 21:22:12,"Congress has taken action to help workers, small biz, hospitals &amp; first responders confronting the #COVID19 crisis. Visit my website for info &amp; answers to FAQ to help understand what it all means for you. #PA17 https://t.co/Px7ZO0Aw4f"
1243658409716649988,2020-03-27 21:57:25,"Today Congress passed the bipartisan #CARESAct to provide $2 trillion to working families, small businesses &amp; frontline workers to address the #COVID19 pandemic #PA17 https://t.co/yuPeDbcGrc"
1243587560506564609,2020-03-27 17:15:53,Today I spoke on the House Floor to support the bipartisan CARES Act which provides emergency relief to all Americans during this public health crisis. #PA17 https://t.co/K4Wkt9j4wo
1241806601021018113,2020-03-22 19:18:59,"Congress must act to get protective equipment for our healthcare workers &amp; first responders on the frontlines of this pandemic. There is no time to waste, they need our help now. #PA17 https://t.co/V3lEUaeGgo"
1241120945294782464,2020-03-20 21:54:26,"Important info from federal, state &amp; local agencies &amp; organizations on the #COVID19 response &amp; resources available on my website, we will update regularly as the situation evolves. Read my latest newsletter for information &amp; links: https://t.co/rbaY9iU0kV #PA17"
1240711966085144577,2020-03-19 18:49:18,"The President has signed bipartisan legislation to help families w/ sick leave, provide tax credits for employers, increase funding for Medicaid &amp; ensure free #COVID19 tests. We have more to do, especially for workers &amp; small businesses during this public health emergency. #PA17"
1239268424087490560,2020-03-15 19:13:11,"We all need to do our part to limit the spread of #COVID19.  Starting tomorrow my #PA17 office locations are indefinitely closed to the public. My staff will telework &amp; serve constituents virtually, answering calls &amp; voicemails, emails &amp; online requests. https://t.co/mhkLpTZW2o"
1238909969166147586,2020-03-14 19:28:49,The bipartisan legislation I voted to pass last night was an important step in our national response to this health emergency but we still have a lot of work to do to ease the burden of this pandemic on families. Read my full statement here: https://t.co/rBrL6U4QtH #PA17
1238206707878240256,2020-03-12 20:54:18,Closely monitoring the #COVID19 situation &amp; following all guidance recommended by @CDCgov. Click here for updates including Capitol &amp; White House Tour closure info: https://t.co/faOVRfgUmd #PA17
1237476371582070784,2020-03-10 20:32:12,I urge my colleagues in the Senate to join @SenJackReed &amp; give this bill swift passage so not a single  eligible disabled veteran in America should be forced to live under the weight of student loan debt. #PA17 https://t.co/RWukgDcYXj
1237476097924780038,2020-03-10 20:31:07,I introduced the FREED Vets Act (H.R. 3598) which passed the House today with bipartisan support &amp; will give many disabled veterans automatic student loan debt relief. No veteran should be denied the relief they earned through sacrifice &amp; service. #PA17 https://t.co/ILBA2MPUqL
1237154427741577217,2020-03-09 23:12:55,Western PA has been a leader providing clean electricity through nuclear power at places like Beaver Valley &amp; Westinghouse. The bipartisan Nuclear Energy Research And Development Act will help us save today’s jobs &amp; create more for tomorrow. #PA17 https://t.co/hs1pDSEiy3
1237050511582531585,2020-03-09 16:19:59,Visited with the residents &amp; caregivers at @VincentianPGH today to hear about how they are dealing with #COVID19 &amp; how we can work together to reduce the risk of spread among the senior community. For more resources &amp; information click here: https://t.co/lk3tNe4Hja #PA17 https://t.co/BPMiDPBUsf
1235568368461246464,2020-03-05 14:10:29,Full house this AM for the Bipartisan Steel Caucus “State of Steel” Hearing to discuss the importance of the steel industry &amp; steel jobs to our economy.  #PA17 https://t.co/EfSZQJmdaM
1235362121178898435,2020-03-05 00:30:56,Today the House passed a bipartisan coronavirus measure to provide $8.3 billion in funding for research &amp; development of a vaccine &amp; support for the local &amp; state public health agencies protecting our communities. #PA17 https://t.co/N7ApR1SN3k
1235261198972710913,2020-03-04 17:49:54,It is important to have accurate information as we learn more about #COVID19 and steps we can all take to reduce our risk. My latest newsletter has resources &amp; information to help you stay informed: https://t.co/OCZtCzT1Lm #PA17
1234902874531991552,2020-03-03 18:06:03,The US-Israel relationship has strong bipartisan support in Congress. Great to see so many Pittsburgh friends in Washington for @AIPAC #AIPAC2020 #PA17 https://t.co/n0DhMglKSM
1234583631571628038,2020-03-02 20:57:29,"If you’re looking for up-to-date information on #COVID19, including preparedness measures, take a look at this resource from @CDCgov: https://t.co/WP4KWMiSKo #PA17 https://t.co/aEM2yxWQA1"
1234533865877835777,2020-03-02 17:39:44,"In #PA17 we know how important it is to care for our seniors, that means protecting Social Security &amp; Medicare. As a cosponsor of the Older Americans Bill of Rights, I will work to ensure Congress always addresses the challenges older Americans face. https://t.co/MCQh0ePEeU"
1233433717428936705,2020-02-28 16:48:08,"This week I urged @SecWilkie to ensure that the health of our Vietnam era veterans exposed to #AgentOrange is a top @DeptVetAffairs priority.  We owe these veterans that much, and time is running out. #PA17 https://t.co/66RuwM0KR7"
1233405357801852928,2020-02-28 14:55:27,The bipartisan POWER Act I introduced has been included in the Bipartisan Opioid Task Force 2020 Legislative Agenda. This legislation provides law enforcement officers on the front lines of the opioid crisis with on-the-scene drug screening devices. #PA17 https://t.co/eiNntwW58X https://t.co/YYFpBxzBb2
1232796520128417792,2020-02-26 22:36:09,We have great public schools across #PA17!  I’m working in Washington to make sure our teachers &amp; schools have the funding &amp; support they need to create learning environments where all kids can succeed.  #PublicSchoolsWeek https://t.co/7hyv9FV5gq
1232056788931039232,2020-02-24 21:36:43,This week we’re hosting mobile office hours in Aliquippa (2/27 at B.F. Jones Memorial Library) &amp; in the North Hills (2/28 at @northlandlib) from 10a-3pm. My Penn Hills office is now open as well (11 Duff Road). We offer assistance on issues related to federal agencies in #PA17. https://t.co/7hhkgOMLqM
1231297918012882945,2020-02-22 19:21:14,Thanks to everyone who stopped by my new Penn Hills District Office open house today. We look forward to serving you. #PA17 https://t.co/7diPo5wb7g
1230961914844524544,2020-02-21 21:06:05,"Getting my new Penn Hills District Office ready for the open house tomorrow. Looking forward to seeing you from 11a-1p at 11 Duff Road, Pittsburgh 15235. #PA17 https://t.co/f8hmO3AzNX"
1230600693356154883,2020-02-20 21:10:43,Thanks to Phyllis and her crew of volunteers who held a great lunch for local veterans today at the @PennHillsMuni Senior Service Center. #PA17 https://t.co/901PwJdMoA
1230534487173451776,2020-02-20 16:47:38,"The @fema #Firefighter grant program is now open &amp; accepting applications for multiple programs through Friday, 3/13 at 5pm. These grants can provide critical tools &amp; assistance to #PA17 emergency responders. Click here to learn more: https://t.co/LGg6G3Lf91"
1230245658415783938,2020-02-19 21:39:56,Thanks to @jkleinfc &amp; the AP Government students @FCASD High School for a great conversation today. #PA17 https://t.co/QLFyphE3Vc
1230232038105591815,2020-02-19 20:45:49,"Thanks to the #PA17 winners of the 2019 @CongressionalAC today for the demo of their “Mathias” app, &amp; to the Robotics class @shady_side for the tour of your new Glimcher Tech &amp; Design Hub. https://t.co/N9Buo7H35C"
1230136815790755840,2020-02-19 14:27:26,"REMINDER. Hope you can join me for an open house to check out our new Penn Hills District Office at 11 Duff Road, Pittsburgh 15235 this Saturday, 2/22 from 11a-1p. #PA17 https://t.co/vjUh1BUhmz https://t.co/3DW0szE1qh"
1229907952074711040,2020-02-18 23:18:01,"Met Mr. Russell Hamler today to learn about the harrowing journey he encountered as part of an all-volunteer force to fight in the jungles of Burma during WWII. As a cosponsor of H.R. 906, I want to ensure “Merrill’s Marauders” get the recognition they earned &amp; deserve. #PA17 https://t.co/Kty1Gbp7sO"
1228326673541685249,2020-02-14 14:34:34,"We’re getting ready to open our new Penn Hills District Office at 11 Duff Road, Pittsburgh 15235.  Join me on Saturday, 2/22 from 11a-1p for our open house.  Hope to see you! #PA17 https://t.co/98nvpnICM9 https://t.co/1cFnm3oEsn"
1228096060591157250,2020-02-13 23:18:12,"We have a responsibility to every Vietnam era veteran who faced Agent Orange exposure. The President must take action now to ensure these veterans get the VA care they need, there is no time to waste. #PA17 @VetAffairsDems https://t.co/raDr527Rh1"
1227688375999762432,2020-02-12 20:18:12,"The Grid Modernization Act, a bipartisan bill I introduced with @HerreraBeutler, passed out of @HouseScience  today. One step closer to expanding vital research programs at @ENERGY to modernize &amp; secure our nation’s electric grid. #PA17 https://t.co/sMRDfKqEhb https://t.co/D1ktYkASY5"
1227653661574270979,2020-02-12 18:00:16,The bipartisan Supporting Veterans in STEM Careers Act that I led with @DrNealDunnFL2 was signed into law by the president &amp; will provide critical training for veterans to work in high demand STEM careers. #PA17 https://t.co/u7IVaRnaql
1227350218112413697,2020-02-11 21:54:29,With bipartisan support we have been able to prioritize rebuilding the Upper Ohio Navigation system including the Montgomery Lock to create &amp; retain thousands of good jobs in #PA17. https://t.co/fQqsMJSD2D
1225872482898522120,2020-02-07 20:02:30,Read my latest newsletter to get information about the upcoming 2020 Census &amp; my new Penn Hills office opening soon. Make sure to visit my website to sign up to receive my newsletters via email in the future. #PA17 https://t.co/cAxS823HZI
1225604559780950018,2020-02-07 02:17:52,"Today we passed the first bipartisan bill in generations to reform our labor laws and protect and expand workers’ rights to organize, bargain collectively, and ensure they’re treated with the respect and dignity they deserve. #PROAct #PA17 https://t.co/9IwLHQoxYp"
1225569317594574848,2020-02-06 23:57:49,"Met some Arizona copper miners yesterday, @steelworkers members who’ve been on strike for 100+ days — &amp; still came all the way to DC to help pass the #PROAct.

Told me USW in Pittsburgh has been really supportive throughout, &amp; said they’re all Steelers fans.

Solidarity. #PA17 https://t.co/rk84fHW8zZ"
1225526113088221203,2020-02-06 21:06:09,Great to see my friends Herb &amp; Angel Bailey in Washington today to learn more about the work they are doing in Aliquippa @UCGcafe. #PA17 https://t.co/skclaq02Kb
1224830166570020866,2020-02-04 23:00:42,"My #SOTU guest is @WillAttig of @unionveterans @AFLCIO who support the 1.2 million veteran workers across America, including those in #PA17. https://t.co/KAOxPd45Cp"
1222269404832043010,2020-01-28 21:25:09,"Congress passed the “Supporting Veterans in STEM Careers Act"" which now heads to the President. Veterans are some of the best workers &amp; can help meet the growing demand for technical jobs many employers struggle to fill. #PA17 https://t.co/jwno9dOx7u"
1221901548911058946,2020-01-27 21:03:25,On the 75th anniversary of the liberation of Auschwitz we remember the millions of innocent lives lost during the Holocaust &amp; know there is still work to do to fight anti-Semitism around the world.
1221152045371215873,2020-01-25 19:25:10,Thanks to everyone who came out to my Town Hall today &amp; to @MTLSD for hosting. #PA17 https://t.co/nsexEQdPh2
1220488229578846209,2020-01-23 23:27:24,REMINDER  that  my next Town Hall is coming up this Saturday (1/25) at 12pm in the Auditorium at @MTLSD High School. Enter through doors A-2 located off of Cochran Road. #PA17 https://t.co/WFUKnY44gS https://t.co/6szZgLeaXi
1219707041016614912,2020-01-21 19:43:14,"My office is hosting mobile office hours this week in Aliquippa (1/23 at the B.F. Jones Memorial Library) &amp; in the North Hills (@northlandlib on Friday, 1/24) from 10a-3pm. We can assist with issues related to federal agencies such as @IRSnews, @DeptVetAffairs &amp; @USPS. #PA17 https://t.co/KIt3KsfaQq"
1219304364604645378,2020-01-20 17:03:08,The spirit of Dr. King is alive in all who remain committed to his dream of peace &amp; justice. #MLKDay #PA17 https://t.co/RK4WPYWLkn
1217935016354832384,2020-01-16 22:21:50,"Check out my latest newsletter for information on my office’s upcoming events, including my next Town Hall on Saturday, January 25 from 12-1pm at @MTLSD High School Auditorium. #PA17 https://t.co/m11KD8eubz"
1216844173149642757,2020-01-13 22:07:13,"REMINDER: If you have an issue related to a federal agency, my office can help. In addition to visiting or calling one of my District Offices, we host mobile office hours each month &amp; will be at Penn Hills Library on Wednesday, 1/15 from 10a-3p. #PA17 https://t.co/JFYbdw00VD https://t.co/KcfQTU9xZA"
1215341093769879553,2020-01-09 18:34:31,"Join me for my next Town Hall on Saturday, January 25 at 12pm in the Auditorium at @MTLSD High School. Enter through doors A-2 located off of Cochran Road. #PA17 https://t.co/xHNSlpXCd6 https://t.co/spHP3X8lNJ"
1215060340230193153,2020-01-08 23:58:54,"Today, top national security officials briefed members of Congress on the killing of Qasem Soleimani &amp; rising tensions with Iran. The administration owes us an explanation of why things in the Middle East are getting worse. Read my full statement below: https://t.co/n2d9pAPKxV"
1213129365124526086,2020-01-03 16:05:54,Congratulations to the #PA17 winners of the 2019 @CongressionalAC from @shady_side. I look forward to seeing your app “Mathias” displayed in the U.S. Capitol this year. https://t.co/QfzctZ0nYA
