id,created_at,text
1238504889665323011,2020-03-13 16:39:10,"All Granite Staters with questions or concerns about the coronavirus, please call our state’s 24/7 hotline by dialing 2-1-1. https://t.co/g1RnDzn4tU"
1238179230074232833,2020-03-12 19:05:07,"Welcome home, Tahoma! And job well done. 

Cutters like Tahoma are on the frontlines of our efforts to keep America safe and I’m grateful to the crew for their work on this mission. https://t.co/0xdqquWkNe"
1237864132772122631,2020-03-11 22:13:02,"I will continue to work with our partners on the federal, state, and local levels to ensure we deliver a whole-of-government response that keeps Granite Staters safe."
1237864131278987264,2020-03-11 22:13:01,"After fighting to ensure the federal funding package to combat the coronavirus would reimburse our state for its ongoing containment efforts, I was glad to welcome more than $4.9 million in federal support. https://t.co/vZOUdLmZDD"
1237483706782277638,2020-03-10 21:01:21,You can tune in to our coronavirus telephone town hall right now by calling (866) 478-3366!
1237410687904878593,2020-03-10 16:11:12,"Yesterday I convened a group of Manchester health and public safety officials to discuss the Queen City’s coronavirus preparedness efforts.

A coordinated, proactive, and complete response is needed to ensure our communities remain safe. 

https://t.co/Xk1sCgdX5v"
1237105014516125696,2020-03-09 19:56:34,"Tomorrow at 5:00 PM EST I will be hosting a telephone town hall with @RepAnnieKuster and state health officials to give an update on New Hampshire's coronavirus preparedness. 

RSVP here: https://t.co/xz29ujMerm https://t.co/zLa6X7ITxF"
1237046928325705734,2020-03-09 16:05:45,"I have the utmost confidence in our leaders, and we will continue to work closely to ensure we have a coordinated response that keeps Granite Staters safe."
1237046925976899584,2020-03-09 16:05:45,"This morning I met with Mayor Joyce Craig, MFD Chief Daniel Goonan, school district officials, and public health officials, along with other leaders across our community to ensure Manchester is ready to address a potential outbreak of the coronavirus. https://t.co/6lgSVWx0L3"
1237019317381869568,2020-03-09 14:16:02,LIVE now with Manchester health and public safety officials to discuss readiness in the Queen City for Coronavirus. https://t.co/dwkFSEavc2
1236785953584353281,2020-03-08 22:48:44,"Thanks to everyone who came out for another ‘Coffee with Chris’ ☕️ this weekend in Campton. 

Had a great time catching up with constitutents, answering questions, and listening to what’s on the minds of Granite Staters. https://t.co/rBvF4beNCI"
1236683785464434689,2020-03-08 16:02:45,"Today we celebrate International Women's Day and affirm our commitment to collectively working to empower women and girls throughout the world.

#IWD2020 #EachforEqual"
1236442266706862080,2020-03-08 00:03:03,"Maple tree 🍁= tapped 🔨! 

Thank you to Chris Hicks, owner of Morningstar Farm, for welcoming me to your farm and sugar house this afternoon to kick off #MapleMonth. https://t.co/vR7aUV9qaX"
1236361653765263360,2020-03-07 18:42:43,"Good luck, spellers! 

It was great to help kick off the 2020 New Hampshire State Spelling Bee today. Spellers from over 200 Granite State schools are competing to represent New Hampshire at the @ScrippsBee in Washington, DC. https://t.co/wxdmuKVlLp"
1236049588324306945,2020-03-06 22:02:41,I am so grateful for the work they do and I am proud to be an ally in this fight.
1236049586088816641,2020-03-06 22:02:40,"This afternoon I spoke with representatives of UNH’s Sexual Harassment &amp; Rape Prevention
Program, campus leaders, &amp; advocates about the importance of domestic violence prevention efforts ahead of the Violence Against Women Act
Anniversary. https://t.co/wFrY1qpTeR"
1236026320603222016,2020-03-06 20:30:13,"What better way to start off women’s history month than by celebrating the contributions of women in uniform with the UNH community &amp; members of the military. With more than 200,000 women currently serving in the military it’s key we recognize their strength, service &amp; sacrifice. https://t.co/9l0gN0KHPD"
1235953448123801601,2020-03-06 15:40:39,"I'm pleased President Trump has signed this funding package that we passed through the House earlier this week.

We must work together with our partners at the federal, state, and local levels to ensure we deliver a complete, whole-of-government response.

https://t.co/2X43Zb3Aq0"
1235657883121078273,2020-03-05 20:06:11,However additional relief from this cap is still needed to support New Hampshire’s economy and I remain committed to working in a bipartisan fashion to do just that.
1235657882252857344,2020-03-05 20:06:11,"After working for months with Members from both parties, Administration officials, and Granite State small businesses to address the urgent needs of seasonal employers I’m glad to see we are making progress with these additional worker visas. 
https://t.co/BgMtAmU49L"
1235321985049260033,2020-03-04 21:51:27,"I voted in favor of a strong bipartisan supplemental funding package that helps protect Granite Staters by providing $8.3 billion to address the coronavirus outbreak. 

It will also ensure that our state is reimbursed for its ongoing containment and mitigation efforts."
1235321581653692416,2020-03-04 21:49:50,"We must continue to work together with our partners in federal, state, and local government to ensure we deliver a complete, whole-of-government response to #COVID19 that contains and treats this outbreak in the weeks and months ahead.

https://t.co/0gp9j87zOt"
1235271395451510785,2020-03-04 18:30:25,Thank you to my friends from @AIPAC for stopping by to discuss our continued bipartisan work to strengthen the U.S.-Israel relationship. https://t.co/f8VgXaQz0w
1235253568661327873,2020-03-04 17:19:35,"Pleased to welcome @VFWHQ to Washington at today's @VetAffairsDems joint hearing - including many members from New Hampshire!

It's important that your voices are heard loud and clear as we continue our shared mission of ensuring that veterans get the support they have earned. https://t.co/ejUHwD9GqA"
1235242528049373185,2020-03-04 16:35:43,"RT @VetAffairsDems: Thank you to all the @VFWHQ members for packing the room at today’s joint hearing and making their voices heard.

The C…"
1235204740469977093,2020-03-04 14:05:33,"No one should lose out on the ability to gain skills to provide a better life for their family due to a lack of childcare.

That's why I introduced a bill to create grants to provide childcare for those seeking career services at American Job Centers ➡️ https://t.co/7p45g86L7a https://t.co/Zb8IXwtgvS"
1234842338251493382,2020-03-03 14:05:30,"My colleagues and I remain committed to securing the federal support necessary for a complete response to #COVID19 to protect public health. It is important we remain calm and collected in our response, listen to health officials, and get the resources we need in a timely manner. https://t.co/hOhF3lq6XC"
1234833222711881728,2020-03-03 13:29:17,"RT @RepChrisPappas: Today I'm joining @SenatorShaheen, @SenatorHassan, and @RepAnnieKuster to call on House &amp; Senate leaders to ensure that…"
1234633389480775681,2020-03-03 00:15:13,"Today I'm joining @SenatorShaheen, @SenatorHassan, and @RepAnnieKuster to call on House &amp; Senate leaders to ensure that the emergency supplemental spending bill includes language to reimburse states for the cost of combating #coronavirus. 

Learn more: https://t.co/Dc80zUqmcs https://t.co/BdHbFeolkm"
1234622273828589568,2020-03-02 23:31:02,"Happy #ReadAcrossAmericaDay! 

(If you're looking for a new book, these students I read with this summer at @manchlibrary really enjoyed ""Duck for President"") https://t.co/LNSaIVpFJA"
1234513221391978498,2020-03-02 16:17:42,"LIVE NOW on @WMUR9: https://t.co/vUVXu0YRXK

I'm joining state health officials, @GovChrisSununu, @SenatorShaheen, @SenatorHassan, @RepAnnieKuster to give an update on #COVID19 planning and response in New Hampshire and ensuring that we have the resources we need from Washington."
1234510972464910336,2020-03-02 16:08:46,"Meeting in Concord this morning with state health officials and leaders to recieve a briefing on New Hampshire’s plan to prepare for #COVID19.

Updating the public on @WMUR9 shortly about our efforts in Washington to ensure that the Granite Stare has all the resources we need. https://t.co/JEFeSe5XFV"
1234496998344183808,2020-03-02 15:13:14,"At 11:00AM, I will join state health officials, @GovChrisSununu, @SenatorShaheen, @SenatorHassan, @RepAnnieKuster, and @NHHospitals to discuss how NH is preparing for #COVID19 and give an update on the work Congress is doing to provide additional resources.

Watch on @WMUR9. https://t.co/EOR54timex"
1234250531687759878,2020-03-01 22:53:52,"It is important that all Granite Staters understand the risks posed by the Coronavirus and learn what precautions to take. 

Learn more from the CDC ⬇️

https://t.co/UPZ91FhG57"
1233756137989820417,2020-02-29 14:09:20,"Manchester Fire Department District Chief Al Poulin dedicated over 37 years to the @ManchesterFD - thank you for your service and commitment to our city, District Chief. Enjoy your retirement! 

https://t.co/HPEWFjFMgd"
1233526494783254529,2020-02-28 22:56:48,"You should have seen the one that got away! 

https://t.co/NabnqqTQug"
1233223788705255426,2020-02-28 02:53:58,"The Merrimack Town Council, town officials, and community members should be credited for leading this thoughtful process and advocating for what is best for their families and neighbors. I am committed to continuing to work with them to address this issue."
1233223787782529026,2020-02-28 02:53:57,We need stronger federal regulations to protect communities from these 'forever chemicals.' Legislation I've authored would empower EPA to create these standards and also help towns clean up contamination they had no role in creating.
1233223786931146752,2020-02-28 02:53:57,"In Merrimack tonight, Saint-Gobain maneuvered to shirk responsibility for the PFAS contamination that they have caused in that community. It is disappointing that this company would use tactics like these rather than working together with the town to do the right thing."
1233160442132008960,2020-02-27 22:42:15,"I appreciate VA's dedication and work on behalf of our veterans and for answering our questions today. I remain committed to working together to bring VA, community care providers, and third party administrators to the table to resolve this issue.

https://t.co/SZ5ej7LhVo"
1233160440248664064,2020-02-27 22:42:14,"I also asked @USHVHA about VA staffing levels and the budget necessary to address the current claims backlog. 

This is a concern I have heard from providers and hospitals in my district - ensuring that VA is prepared to handle and fix this problem once and for all is critical. https://t.co/0seKvALzf7"
1233160436549406720,2020-02-27 22:42:13,"At today's @VetAffairsDems hearing, I directly questioned 
@SecWilkie and received his commitment that @DeptVetAffairs will address the ongoing payment issues for community providers who are caring for our veterans in my state and across the country. https://t.co/HrhlUnsH1N"
1232712212080361480,2020-02-26 17:01:08,".@beardfoundation rightly recognizing what us Granite Staters have know for a while: there's no shortage of great dining options in the Seacoast!

Glad to see so many local folks named as semifinalists including Jay McSharry, David Vargas, and Evan Mallet

https://t.co/Uw0B7uooDD"
1232699647677870080,2020-02-26 16:11:13,"@SenatorShaheen H-2B visas are a vital tool for so many NH small businesses, and I'll keep working to get DHS to release the full allotment to meet their needs."
1232699487505784832,2020-02-26 16:10:34,"Couldn't agree with you more, @SenatorShaheen. This is an urgent economic issue that the Administration must address.

That's why I met with employers in Conway last month to hear concerns about this issue directly. https://t.co/iWST7hnpfx"
1232695283399700481,2020-02-26 15:53:52,"Another Constituent Coffee ☕️in the books! 

This morning I joined @RepAnnieKuster to meet with constituents and other visitors in Washington. Great way to start off the day. https://t.co/FI9lpC6eUX"
1232483709091057664,2020-02-26 01:53:09,"I remain concerned about the President’s budget proposal, which deeply cuts funding for many agencies and programs that are essential to protecting public health. We need an adequate response to this threat and I will keep working in a bipartisan fashion to ensure that is done."
1232483624143945729,2020-02-26 01:52:49,I urge the administration to work swiftly and smartly to address this life-threatening public health issue using the best science and research available. It is also crucial that all necessary information is communicated with the American people in a timely and thoughtful manner.
1232483297181106177,2020-02-26 01:51:31,"The threat of coronavirus is real. Health officials indicate it is not a question of if but when we start to see serious impacts here. It’s critical that resources be made available at once to accelerate vaccine research and support preparedness efforts.

https://t.co/z3zfsN25Hw"
1232116247061508102,2020-02-25 01:32:59,"@AIPAC If you're looking for a Monday panel, come join us for a discussion with members of the Congressional LGBT Equality Caucus."
1232116102286671876,2020-02-25 01:32:25,"I'm looking forward to talking with Americans from all backgrounds next week at @AIPAC Policy Conference about the historic, bipartisan U.S.-Israel relationship and why it is so important to our national security."
1232001751735316481,2020-02-24 17:58:01,"Madison's passion for service is inspiring and I was pleased offer her appointments to our nation's service academies. 

It's clear that New Hampshire is continuing to play an important role in fostering the next generation of American leadership.

https://t.co/ss3zkhQ0yd"
1231981335574720512,2020-02-24 16:36:54,"Let's make sure everyone counts. 

The #2020Census 
is fast approaching and the @uscensusbureau is still looking for help to make sure all Granite Staters are counted - especially in Strafford and Carroll counties.

Visit https://t.co/MZ114VDJ2l to apply today. https://t.co/rpNOrNxtU8"
1231925099676262400,2020-02-24 12:53:26,"These VA provider payment issues date back years - without resolution. That's why since taking office last year, I've made it a personal priority to bring everyone to the table to fix the system - and while there's more to do, we're already seeing results.
https://t.co/291aOqfZjS"
1230950557961072641,2020-02-21 20:20:57,"Thank you @SeabrookPolice for looking out for a hero among us! A great example of Granite Staters coming together to care for a veteran in need.

https://t.co/xfOqMXFMOQ"
1230893160605405185,2020-02-21 16:32:53,RT @stevemac44: Great to hear from @RepChrisPappas today at the @NECouncil breakfast. Thank you for your vote on #USMCA and your work on #i…
1230857243400318987,2020-02-21 14:10:09,"RT @NECouncil: At our Congressional Roundtable this morning, @RepChrisPappas commends the passage of #USMCA, noting the New England Council…"
1230657915926831104,2020-02-21 00:58:06,"These young engineers know their stuff! 🔧

Had a great time celebrating #IntroduceAGirlToEngineeringDay at @GirlsatWorkInc in Manchester today along with @ASCE_NH and @NHWomensFndn. https://t.co/vhXAsMD7R1"
1230493763673436160,2020-02-20 14:05:49,"❌ Rationing prescriptions

❌$90,000 for one pill a day

❌ Postponing retirement to afford medication

The stories I've heard from Granite Staters underscore the need to lower drug costs - now. H.R. 3 will do that. We just can't afford this any longer.

https://t.co/P3V8CnAwOK"
1230251860960870400,2020-02-19 22:04:35,".@BlackHeritageNH is doing such important work uncovering and sharing parts of New Hampshire's history that have for far too long gone unseen.

Thank you JerriAnne Boggis for
joining me at the Portsmouth African Burying Ground today and for sharing these important stories. https://t.co/hnaDSs04X9"
1230202745791156226,2020-02-19 18:49:25,"Just wrapped up a conversation in Rye hearing stories about the need to lower prescription drug costs and increase access to quality, affordable health care. These are deeply personal issues for Granite Staters and I remain committed to making progress on them in Congress. https://t.co/lCRPjRhbbA"
1230132794996776960,2020-02-19 14:11:27,"Durham is moving forward with investments in their infrastructure, so should the rest of New Hampshire and America. 

That's what I'm pushing for every day in the House.

https://t.co/oJsITGonU5"
1229812555557883905,2020-02-18 16:58:56,"Thank you to NH JAG and community partners for all the work you do ensuring that New Hampshire's young people can meet their full potential! As a 2019 NH JAG honoree, I was grateful to be back again this morning to see so many friends and congratulate the 2020 award winners. https://t.co/PUCzA3PGWV"
1229458011313360902,2020-02-17 17:30:06,"When we talk about infrastructure, we don't just mean roads and bridges! I'm touring Durham's wastewater treatment facility, which is undergoing upgrades, with @tselig, local officials, @ACEC_NH and project engineers to discuss the need for continued infrastructure investment. https://t.co/D1x7QnkPjw"
1228446511031373825,2020-02-14 22:30:46,"The @NHFarmandForest Expo is the place to be! 

New Hampshire's farms and agriculture industries are vital to our state's economy and well-being. I'm grateful @AgricultureNH Commissioner Jasper could join me to meet exhibitors and attendees. https://t.co/WHlmYd1mP1"
1228409322230681600,2020-02-14 20:02:59,"RT @RepLoriTrahan: Access to clean, safe drinking water is a right every American should enjoy. Yesterday, I was joined by @sethmoulton, @R…"
1228382807011086336,2020-02-14 18:17:38,"Thanks for lunch, Principal (and Mayor) Dana Hilliard! 

We made a surprise stop in the cafeteria at Somersworth Middle School to chat with students before the weekend. https://t.co/HnG06fJ4xn"
1228370472846471170,2020-02-14 17:28:37,"Well this was a pretty great way to start a Friday: making #ValentinesForVets with Idlehurst Elementary School students here in Somersworth. 

We'll be delivering these cards to local veterans and thanking them for their service later today. https://t.co/nQTlwktCXZ"
1228340069704065026,2020-02-14 15:27:48,"After two years the memory of 17 lives lost at #Parkland remains as strong as ever - we cannot and will not forget. 

The common sense measures we have passed in the House can help end this gun violence crisis and save lives - we cannot stop until they become law. #EnoughIsEnough"
1228023494358786052,2020-02-13 18:29:51,There shouldn’t be a deadline on equality. That is why today I voted to remove the deadline for the ratification of the equal rights amendment to ensure all Americans can live with equal protection under the law. #ERANow https://t.co/in5nBE2xZl
1227988255439826949,2020-02-13 16:09:49,"Last month I met with veterans and a community provider in Laconia to hear from them about these challenges. In my role as Chair of the Oversight and Investigations Subcommittee of @VetAffairsDems, I'm committed to working together to fix these problems. 

https://t.co/5DsySHTW7R"
1227988254491893760,2020-02-13 16:09:49,"This follows a bipartisan effort I led earlier this month calling on the VHA to address the concerns that we have been hearing in my district and across the country.

https://t.co/I3Els3vknz"
1227988252826664961,2020-02-13 16:09:49,"Veterans shouldn't have to fight to receive care and community providers shouldn't have to deal with a bureaucracy that hurts their business.

I chaired a hearing yesterday with testimony from local providers to get answers on how we can move forward and resolve these issues. https://t.co/790VdAPQ8p"
1227674799071203328,2020-02-12 19:24:15,RT @VetAffairsDems: Tune in today at 2:00 pm EST to watch our Joint Oversight Hearing: Provider Relations During the Transition to VA's New…
1227646066612457473,2020-02-12 17:30:05,"Thank you for the work you're doing, Eric. I'm glad we will have your input on this issue. It is critical that we resolve the challenges facing community providers so that you and other providers can keep helping veterans without disrupting care or burdening your business. https://t.co/ykDzuy7GUl"
1227374505275752448,2020-02-11 23:31:00,"New Hampshire’s harbors are vital to our communities and economy, and this funding to move forward with dredging in Rye is an important step to address safety concerns and ensure the harbor's functionality.

https://t.co/p1wqUyy9t3"
1227350934252118016,2020-02-11 21:57:20,"The President's cuts would hurt those who need help the most including seniors and those struggling with substance abuse. We should work together to defend critical services and put together a responsible budget that invests in our people and our future.

https://t.co/hale8J1WFE"
1227245668248489984,2020-02-11 14:59:03,"Dunkin' and Democracy - a winning combination, Chief! https://t.co/ls1KQaVTO8"
1227230678791708673,2020-02-11 13:59:29,"It's time for the Granite State to vote! Make sure to get out and vote today if you are eligible and make your voice heard.

Find your polling place and other voting information here: https://t.co/bc7Y6dOP5A https://t.co/dPWhzgLSQK"
1227017150507782145,2020-02-10 23:51:00,"The Pease Study, which is examining health outcomes related to #PFAS exposure in Seacoast drinking water, is in need of additional participants to enroll, especially children. 

I encourage you to participate if you qualify: https://t.co/665BtzDxeb

https://t.co/fDC56Ebv1G"
1226988659641081863,2020-02-10 21:57:47,"As my friend Dean Kamen says: ""the difference between science and science fiction is just timing."" 

This Manchester-based initiative will pioneer life-changing scientific advancements that could change the face of medicine as we know it. 

https://t.co/kteCiPSfVm"
1226623069281759232,2020-02-09 21:45:03,"With all the extra foot traffic in Manchester, plenty of people are getting to see our office's windows - decorated for the month by Webster Elementary School students.

Teachers and students can sign their class up to create art for our windows here: https://t.co/qJkARmqODY https://t.co/vnfuP57NPc"
1225426547298971648,2020-02-06 14:30:30,"Well, this is great news. These communities have been working for years with state and federal partners to make this happen. As an Executive Councilor, I worked to keep the project funded and I'm pleased to see progress being made. https://t.co/wioAYglIbp"
1225118077668360193,2020-02-05 18:04:45,"States like New Hampshire need additional resources to address the global health emergency of coronavirus, including the expansion of testing sites in more communities to enable a faster response to potential cases. https://t.co/ODmpDSfwi7"
1224908744435339264,2020-02-05 04:12:57,"While the state of our union is strong, we still have much more work to do to ensure that every American can share in our country’s success. We need more than words; we need action.

Read my full statement below.  
https://t.co/9Q8KqYQvvH"
1224780353858146304,2020-02-04 19:42:46,"Thrilled to welcome my State of the Union guest, Lara Quiroga, to Washington! Lara was instrumental in launching the ACERT program to address childhood trauma in Manchester and I’m proud to have sponsored House legislation to nationalize that effort. #SOTU2020 https://t.co/gIdxths6Ae"
1224412562000838659,2020-02-03 19:21:17,"Next week, I will chair a hearing of the Oversight and Investigations Subcommittee of @VetAffairsDems to continue to look into this issue, hear from veterans and providers who have been impacted, and seek the answers we need from the VA to solve this problem."
1224412560465846273,2020-02-03 19:21:17,"I have led a bipartisan effort calling on the VA to resolve provider payment issues that are hindering care for veterans. They must take action to ensure that veterans who need care receive it, and that providers are paid in a timely manner. https://t.co/21AbD3pMh1"
1224412551527772163,2020-02-03 19:21:15,"Across New Hampshire, veterans and community care providers that have been left waiting far too long for services and reimbursements. 

This is unacceptable, and we must continue to demand better from the the VA. 

https://t.co/I3Els3vknz"
1224329603868712961,2020-02-03 13:51:39,"At tomorrow's State of the Union, advocates on the front lines of the Granite State's efforts to address mental health and substance use disorders will join us to call attention to these challenges - which we all must be a part of overcoming together.

https://t.co/uxpzMbzRQG"
1223342793319428097,2020-01-31 20:30:25,"It’s a great day for a walk in Londonderry!

I introduced legislation this week to invest in creating a nationwide network of safe walking and biking paths. It’s good for our health, wellness, and our environment - and it makes good economic sense ➡️ https://t.co/iMIi0qy3z5 https://t.co/RyrLUQMDFV"
1223292347691282434,2020-01-31 17:09:58,"The work first responders &amp; care providers are doing through Manchester's ACERT program is so important. Quickly providing care and services after children experience trauma helps stop lasting impacts.

My House bill would create a national ACERT grant ➡️ https://t.co/dnLAkGZlTK https://t.co/AAIiXlACBy"
