id,created_at,text
1222935199673200640,2020-01-30 17:30:47,"Medicaid covers 180,000 Granite Staters and we all benefit from its impacts across our health care system. I worked to expand Medicaid, which has helped in the fight against addiction. These misguided cuts would have serious consequences for our state’s health &amp; quality of life. https://t.co/qdEbyRT5FK"
1222685377548443648,2020-01-30 00:58:05,"Fentanyl analogues are dangerous substances that pose a serious threat to public health and safety. That is why I voted to extend their classification as schedule 1 narcotic today.

https://t.co/Sgj8G9STd5"
1222657063685427204,2020-01-29 23:05:34,"I am saddened to learn of the death of Capt. Ryan Phaneuf in Afghanistan earlier this week. My thoughts are with Capt. Phaneuf’s family at this time, along with the family of Lt. Col. Voss. May we never forget their sacrifice, and may their memory be eternal. https://t.co/lebjoFKoDL"
1222641908645875712,2020-01-29 22:05:21,"Excited to have Lara Quiroga join me at the State of the Union next week. Lara was instrumental in launching ACERT in Manchester to address childhood trauma. 

I have introduced legislation in the House to create a national program based on that pilot.

https://t.co/WqiMSFPjdg"
1222630185289293828,2020-01-29 21:18:46,11 years ago today we signed the Lilly Ledbetter Fair Pay Act into law taking a critical step towards #EqualPay- but our work remains unfinished. It’s time for the Senate to pass the #PaycheckFairnessAct and ensure all Granite Staters are receiving #EqualPayForEqualWork.
1222593654906376198,2020-01-29 18:53:36,"The USMCA represents a major step forward for our workers, farmers, businesses, &amp; economy. I am pleased this bipartisan agreement was signed into law. https://t.co/nQb2Fj2LYx"
1222245943912861697,2020-01-28 19:51:55,"Smart infrastructure connects Americans with the people and places most important to them. 

This legislation expands active transportation networks, providing additional ways to knit communities together, support recreation, and respect our environment.

https://t.co/vy1rdYElRx"
1222231809628495878,2020-01-28 18:55:46,Welcome to the force! I'm sure this pup will make a dogged police officer. https://t.co/zuGiYdTLyE
1222210226474176514,2020-01-28 17:30:00,"Wishing a very happy birthday to my friend, colleague, and champion for the people of the Granite State, @SenatorShaheen.

New Hampshire is lucky to have you as a leader and advocate. https://t.co/FRF3drCXar"
1222160776930168832,2020-01-28 14:13:30,"In the words of Christa McAuliffe, who we lost 34 years ago today along with six other Challenger crew members: ""I touch the future. I teach.""

I'm proud of the effort we led to honor her memory and inspire the next generation of teachers &amp; explorers.

https://t.co/yKwAxC2xeN"
1221888570031575041,2020-01-27 20:11:51,"Natalie and Virginia stopped by my Manchester office this afternoon looking for help booking a White House tour. Glad we could help! If you’re ever planning a trip to Washington, please get in touch and see how we can help - https://t.co/RjJATQpbeh https://t.co/BVXiSHoNpA"
1221865705827717123,2020-01-27 18:41:00,On #HolocaustRemembranceDay - the 75th Anniversary of the liberation of Auschwitz - we reflect on this unthinkably dark chapter in human history &amp; recommit ourselves to remembering those who were senselessly killed and the countless lives altered forever. #NeverAgain #WeRemember
1221491742844817409,2020-01-26 17:55:00,"Once our men and women in uniform conclude their service to our nation, we must make sure they have the support and resources needed to succeed in the next chapter of their lives - including starting and growing a small business here in New Hampshire.

https://t.co/qSjY0SxkmC"
1220836385076236288,2020-01-24 22:30:50,@TimCaravella Thanks for having me! Really enjoyed learning about your business story and the work you do.
1220824870310817793,2020-01-24 21:45:05,"Wrapped up a great two-day trip through the Mount Washington Valley with a  focus on small business and jobs.

I joined the Mount Washington Valley Economic Council for a roundtable discussion and then visited Technicoil in Ossipee - a small business doing really innovative work. https://t.co/Uy5SaKijlw"
1220793745521676288,2020-01-24 19:41:24,"Today I visited White Mountain Community Health Center, which provides critical care in Conway with the support of the Affordable Care Act. Granite Staters and their providers rely on the ACA, which is why I’ve been committed to protecting and strengthening it from day one. https://t.co/0eYqNhX5Vi"
1220734996140478466,2020-01-24 15:47:57,Started today off in Conway with a visit to the Saco Valley Land Trust to discuss the importance of fully funding New Hampshire’s land trusts to preserve our natural environments for future generations. https://t.co/ozOyqc5dbv
1220491641687105537,2020-01-23 23:40:57,"In North Conway I met with local business owners to discuss the importance of the H-2B visa program for getting seasonal businesses extra help.

I've joined a number of my House colleagues in calling on @DHSgov to release additional H-2B visas to address seasonal labor shortages. https://t.co/bRi1MGCw3b"
1220464617241174016,2020-01-23 21:53:34,"Whether it’s defending existing policies or implementing new protections, I remain committed to safeguarding our water, environment, and climate for future generations."
1220464616553230336,2020-01-23 21:53:34,That is why last week I introduced the Clean Water Act Resolution with @RepDebDingell which sends a clear message to this administration and the American people that we are committed to ensuring everyone has access to clean water.
1220464615668224004,2020-01-23 21:53:34,There is nothing more foundational to the health and safety of our communities than access to clean water. https://t.co/myMwId33xt
1220454702137204739,2020-01-23 21:14:10,"Three years ago the Administration reinstated the #GlobalGagRule, undermining the health of women across the globe. It’s time to pass the #GlobalHERAct – which I’m proud to co-sponsor – to put an end to this dangerous policy. https://t.co/RkH9HBEVoz"
1220445996930478083,2020-01-23 20:39:35,RT @RepDebDingell: Rulings like this from the Trump Admin is why @RepChrisPappas and I introduced the #CleanWaterAct Resolution to protect…
1220157809213440001,2020-01-23 01:34:25,"On the 47th anniversary of this historic decision, we must recommit ourselves to affirming the fundamental right to chose. Thank you to the people and organizations in New Hampshire doing the important work to protect that right.  #RoeVsWade https://t.co/PEWQpyYsJB"
1220110633485639680,2020-01-22 22:26:58,Great to be back at On Target Fitness in Portsmouth to highlight resources for veteran entrepreneurs. One resource we discussed today was a new partnership between Facebook and SCORE that pairs service members and veterans with business mentors and other support. https://t.co/LeX1yq3ctU
1220049250928730112,2020-01-22 18:23:03,"On the 47th anniversary of #RoevWade, I met with Planned Parenthood providers and advocates in Exeter to reaffirm the importance of access to comprehensive reproductive health care and the need to continue to protect against efforts to limit the fundamental right to choose. https://t.co/3dqbgCEvYy"
1219766162961195009,2020-01-21 23:38:10,"Our towns shouldn’t be left with the costs of cleaning up PFAS. We must protect public health while going after those who are responsible for the pollution.

My legislation provides resources to towns like Merrimack to make the necessary upgrades to their water infrastructure. https://t.co/jaOYGHTgNG"
1219717010562613249,2020-01-21 20:22:51,"Merrimack has been at the forefront of our fight against PFAS for years. Today I toured wells being fitted with filtration systems. 

My legislation, which passed the House this month, would provide communities with additional resources they need to fix impacted water systems. https://t.co/VjBSWfzlPF"
1219673953213583360,2020-01-21 17:31:45,"It has been 10 years since the #CitizensUnited decision, a ruling that flooded our democracy with dark money that drowns out the voices of everyday Americans.

I remain committed to fighting for a  level playing field and restoring a government of, by, and for the people. #HR1 https://t.co/xIOzHexhGV"
1219369017217032192,2020-01-20 21:20:03,"This afternoon I joined the community celebration at Temple Adath Yeshurun to honor Dr. King. 

His legacy is not simply for the history books. It should live in all of us. And we must continue to answer the call, because we have more work to do and we are all in this together. https://t.co/wNqSBB4ZOb"
1219258913394233344,2020-01-20 14:02:32,"Starting today off at the @YWCANH in Manchester for their celebration of Dr. Martin Luther King Jr. 

Let's follow Dr. King's legacy by standing shoulder to shoulder, in service to others, to improve people’s lives and perfect this union. https://t.co/MBCweg7JUN"
1219073218138509312,2020-01-20 01:44:39,"Dr. King demonstrated for a nation and the world the ways in which we can stand up for our values; call out injustice; and bring about lasting, transformational change.

I was honored to join events in Laconia and Portsmouth today to celebrate his life and legacy. https://t.co/YIWKsBTK2p"
1218268609505648640,2020-01-17 20:27:25,"My district team and I visited @GatherNH in Portsmouth today and were happy to be put to work. 

Gather provides such critical support for Granite Staters throughout the Seacoast area and I'm committed to supporting their efforts any way I can. Thank you for all the work you do! https://t.co/VgMi6vQZNS"
1218184543783522304,2020-01-17 14:53:22,"Congratulations to Alice in Exeter! She is one of 155 students out of 28,000 nationwide selected by @K12FutureE as a finalist to name the #Mars2020 rover.

Her name idea, L.E.A.D. (Love, Exploration And Discovery), is a great name for our next Mars rover.

https://t.co/k6amxjkoGi"
1217875141117595650,2020-01-16 18:23:55,"For too long, we have not had an expedited process to declassify and make public information that could bring peace to the families of those missing in action.

The bill I introduced with @RepRussFulcher affirms our commitment to bringing our heroes home.

https://t.co/tdVCPYCOgG"
1217564656690245632,2020-01-15 21:50:10,"There is nothing more foundational than the Clean Water Act to ensure the health and safety of our nation’s waterways. We can't turn back from the progress we've made. 

I remain committed to safeguarding our water, environment, and climate for the future.
https://t.co/VWwopl2zav"
1217515787000348674,2020-01-15 18:35:58,"There is nothing more important than the health and safety of our communities, which is why I
introduced a resolution with @RepDebDingell to defend existing policies and implement new protections to safeguard our water."
1217515783753957377,2020-01-15 18:35:57,"As the administration continues to undermine the Clean Water Act and the progress we have made, it was inspiring to meet with clean water advocates who refuse to stand by and allow this to happen. https://t.co/BjYjwjwvEQ"
1217471630181634049,2020-01-15 15:40:30,"The @uscensusbureau is recruiting workers in NH to assist with the 2020 Census.

The City of Rochester will host informational meetings at the Public Library on Jan. 22 (9 AM-5:30 PM) and Jan. 24 (1 PM-4:30 PM) to learn about available opportunities.

https://t.co/LVf9xobqV8"
1217154640380334082,2020-01-14 18:40:54,"H.R. 1 aims to end the influence of big money in our politics and restore the ability of everyday Americans to have equal standing in their government. 

As a member of our historic freshman class, I went to Washington to fix this broken system and bring power back to the people. https://t.co/PsfbR4oKRk"
1217110515924766722,2020-01-14 15:45:34,"A recent @CDCgov report showed suicide as the second leading cause of death for young Americans in 2017.

We are in the throes of a mental health emergency and we must ensure that our young people here in New Hampshire get the help and support they need.

https://t.co/mRpyu6TzLX"
1215681911999344640,2020-01-10 17:08:48,@EPA I represent so many tireless advocates and concerned constituents in New Hampshire who have identified this threat in their communities and raised our collective consciousness about the dangers of PFAS. This amendment is a critical step to get Granite Staters the help they need.
1215679744613736448,2020-01-10 17:00:12,"Big news: the House just passed the PFAS Action Act, including my bipartisan amendment calling on the @EPA to set proactive limits for PFAS discharge, hold polluters accountable, and provide impacted communities with resources to address contamination. 

https://t.co/sB1THsposz https://t.co/QyEixo4yDM"
1215411312324415489,2020-01-09 23:13:32,"The U.S. must be a leader on the world stage, drawing on our values and ability to be a force for peace, democracy, and human rights.

I support the resolution and call on the President to consult with Congress on any further application of force.

https://t.co/1Qdi3eRqYF"
1215364505842126848,2020-01-09 20:07:33,We owe a debt of gratitude to law enforcement officials in New Hampshire and across the country who put their safety on the line to protect us. Thank you all for what you do every day. #LawEnforcementAppreciationDay https://t.co/eiwrRF4XVO
1215346438487625728,2020-01-09 18:55:45,"With more than 1.3 million veterans reliant on SNAP, it's critical we ensure the @USDA’s decision to cut benefits does not leave them food insecure. No veteran should go hungry &amp; I will continue to work on @VetAffairsDems to fight for the health &amp; wellbeing of our veterans. https://t.co/DdWFl7dVaQ"
1215044855254130690,2020-01-08 22:57:22,"Congratulations, Matt! 

Thank you for the work you do serving our community. I'm glad to see that New Hampshire and Manchester will be well-represented at @Voices4Service. https://t.co/XcJW881Nje"
1214318039614861317,2020-01-06 22:49:16,"Our office has resolved hundreds of cases for residents dealing with the federal government. I sat down to call some of those constituents to check-in and thank them for reaching out. 

Please contact my office at https://t.co/Y770ISR3ci if you are in need of federal assistance. https://t.co/t1AqZeuC7V"
1213631607078293506,2020-01-05 01:21:37,"RT @Patriots: What he said.

@TomBrady | #EarnedNotGiven https://t.co/Fl1rXaxQwi"
1213519689172897792,2020-01-04 17:56:54,"Had a great time helping kick-off the 2020 @FIRSTweets season! Good luck to all the @FRCTeams competing in this year's challenge: #InfiniteRecharge.

May the Force be with you! https://t.co/dM4iqBtSXO"
1213196269373538306,2020-01-03 20:31:45,"A year after taking my oath of office, I'm as committed as ever to working on behalf of all the constituents of New Hampshire's First District. 

While I'm proud of what we've accomplished, I'm always more interested in what is left to do. Let’s keep moving forward. https://t.co/S6Gxphy7Dt"
1213133500624330752,2020-01-03 16:22:20,"With this escalation, I urge the administration to move forward responsibly and consult with Congress. 2/2"
1213133498288156672,2020-01-03 16:22:19,"Soleimani was a purveyor of terrorism and extremism and is responsible for the death of hundreds of American service members. As Iran vows revenge against us and our interests, we must safeguard our soldiers and diplomats and work with our allies to stop their aggression. 1/2"
