id,created_at,text
1240392079148277762,2020-03-18 21:38:11,"From my tele-work location, I spoke with Mayors and Township Supervisors in #MI11 this morning, and the availability of protective gear was a major concern. This is a necessary step in the battle to stop COVID-19. And I am taking the necessary actions to address it. https://t.co/ys67SAnVUj"
1240386999271534595,2020-03-18 21:18:00,"COVID-19 resources, including FAQs, hotlines, housing/utility assistance, food resources, business aid, school information &amp; more can be found on my website at https://t.co/2LKyXJMjmp. Please stay safe &amp; informed, &amp; make sure you are checking on loved ones who may need help."
1240350479395233797,2020-03-18 18:52:53,RT @RepLawrence: Our healthcare workers are essential in fighting the #COVID19 battle. They MUST be able to commute. I proudly stand with m…
1240344354759344128,2020-03-18 18:28:33,"Any closure of the US-Canada border should exempt healthcare workers. Thousands of Canadian nurses and care providers work in the U.S., and we cannot have a shortage of frontline health workers during this crisis. https://t.co/NUnWaNJccs"
1240333658684260352,2020-03-18 17:46:03,"During this time of COVID-19 response &amp; mitigation, our healthcare professionals are on the front lines of this battle. Thank you to the hardworking men &amp; women who are doing everything they can to keep us safe &amp; healthy under these conditions. You have our backs, &amp; we have yours https://t.co/ACOZEgltVq"
1240322977868242945,2020-03-18 17:03:36,"I spoke with Mayors and Township Supervisors in #MI11 this morning, and the availability of protective gear was a major concern. This is a necessary step in the battle to stop COVID-19. And I am taking the steps to address it. https://t.co/4INAWhYfoZ"
1240109230763499521,2020-03-18 02:54:15,"We all need to make immediate changes if we are going to stop the spread of the coronavirus. 

This agreement will ensure worker safety during a difficult time for our auto industry. @UAW https://t.co/kUzvE86IMF"
1240023055839174657,2020-03-17 21:11:49,"This pandemic is wreaking hardship on our lives. As your Congresswoman, I will not leave anyone behind, &amp; I am pushing to get immediate federal triage to this situation on the healthcare &amp; economic front. What's on your mind &amp; what are you experiencing? ➡️
https://t.co/SGYxR8M9Dr"
1239988082117693441,2020-03-17 18:52:51,"First and foremost, we’ve got to ensure the financial security of every American in this period of time. That is what I’m advocating for in Congress and that is my commitment to Michigan. https://t.co/I6EhBw3DKv"
1239929375790903299,2020-03-17 14:59:34,"Sign up today by 5pm to participate in our Tele-Town Hall focused on the Coronavirus! It’s happening tonight, Tuesday, March 17th at 6pm. We will discuss mitigation strategies, what Congress is doing to help, &amp; what we can all do to keep each other safe. ➡️https://t.co/cgl9AHM8Bq https://t.co/bxUaraJFRi"
1239904125250306060,2020-03-17 13:19:14,"WE MUST SECURE SMALL BUSINESSES IN AMERICA!

They are limitless to name but are not faceless in our communities. 

We can act now to save jobs and secure the incredible small businesses of America in the face of this pandemic.

cc: @WhiteHouse @USTreasury https://t.co/YYGUNVwHj5"
1239618783465136130,2020-03-16 18:25:23,"Additionally, they may reach-out to the SBA Michigan District Office by calling 313-226-6075 or by visiting: https://t.co/WL9KphLdFk."
1239618781594497028,2020-03-16 18:25:23,"More information regarding the Economic Injury Disaster Loan program can be found here: https://t.co/DATIIzJ3HJ For further guidance, businesses may contact the SBA disaster customer service center at 1-800-659-2955 or e-mail them at disastercustomerservice@sba.gov."
1239618777496662018,2020-03-16 18:25:22,Small businesses that could benefit from this program are advised to start collecting the information they would need to complete their application which can be found here: https://t.co/jf0k41lDvV.
1239618775479209987,2020-03-16 18:25:21,This program would provide small businesses with working capital loans of up to $2 million that can provide vital economic support to help overcome the temporary loss of revenue they are experiencing.
1239618773369454600,2020-03-16 18:25:21,(THREAD) Governor Whitmer has begun the process to receive a U.S. Small Business Administration (SBA) declaration to enable small businesses in Michigan to be eligible for the SBA’s Economic Injury Disaster Loan program.
1239569139657834496,2020-03-16 15:08:07,"Tomorrow (Tues, March 17th) at 6pm I will be hosting a tele-town hall, focused on the coronavirus pandemic. If you have any questions or concerns, please bring them and we can discuss together! Sign up at https://t.co/cgl9AHM8Bq https://t.co/2h4NKfCVQp"
1239544766309810179,2020-03-16 13:31:16,"I am available to take your questions and concerns, particularly as we work to address the economic and health impacts of COVID-19, which are uniquely intertwined. Your voice and needs are important to me. And my line is always open to listen: (734) 853-3040 https://t.co/zkT1wndrfu"
1239254032637624320,2020-03-15 18:16:00,"This breaks my heart. We have to get the emergency federal funding for the coronavirus to our communities fast, so that our hospitals can accommodate increased demand, and so we can keep our most vulnerable populations safe.
https://t.co/wWhVujiUPo"
1239220903872999424,2020-03-15 16:04:21,"If you haven’t signed up yet, sign up now to receive a call and participate in our Tele-Town Hall focused on the Coronavirus on Tuesday, March 17th at 6pm. Sign up at https://t.co/cgl9AHM8Bq to participate in our discussion! https://t.co/WSG7hTajrw"
1238888515062190081,2020-03-14 18:03:34,"Sign up at https://t.co/cgl9AHM8Bq

More info at https://t.co/IViYXhK4gC"
1238888513220808709,2020-03-14 18:03:33,"With many changes happening locally and nationally, I have decided to host a tele-town hall on Tuesday, March 17th at 6pm to address the Coronavirus. Bring any questions you have, and let’s learn how we can help support each other and keep everyone safe during this crisis. https://t.co/9sIQ7uqNC3"
1238871819773509632,2020-03-14 16:57:13,"Late last night, we reached a bipartisan deal on the #FamiliesFirst Coronavirus Response Act. This legislation will:
 
💉 Guarantee free testing
👪 Provide paid leave
💵 Support strong unemployment benefits
🍲 Expand food assistance
 
More details ⤵️ https://t.co/brJezd369Y"
1238823165222096896,2020-03-14 13:43:53,"The State of Michigan now has a hotline for all #COVID19 health-related questions. Starting tomorrow, Michiganders can call 888-535-6136 for assistance. https://t.co/RtU7KiihS8"
1238564926161063943,2020-03-13 20:37:44,"RT @USDOL: New COVID-19 resources, expanding apprenticeships, assisting workers affected by coronavirus, reentry grants available, and more…"
1238532780973273088,2020-03-13 18:30:00,Are you wondering if you should be wearing a mask? Want to know if you should consider postponing an event? Looking for tips for small business owners? This FAQ sheet from MDHHS is full of good information. I recommend taking a look. https://t.co/qUFp60rYa2
1238505669692657665,2020-03-13 16:42:16,"I know this is a difficult time for a lot of people in #MI11. My staff and I are available to answer questions, connect you with the proper resources, or help with issues involving a federal agency. Please reach out at 734-853-3040 if we can be of assistance."
1238473871499689985,2020-03-13 14:35:55,"6.Access services online and by phone as much as possible. 

It is important to follow these strategies. Visit https://t.co/VNMA0ZD3Ir to stay up to date as the situation evolves."
1238473868798459906,2020-03-13 14:35:54,"4.Reinforce best practices for washing hands and covering coughs and sneezes. 
5.Prepare for a disruption of daily activities. Maintain a supply of medications, food, and other essentials. Consider alternative shopping options like curbside pickup or online delivery."
1238473866558799873,2020-03-13 14:35:54,"2.Stay home if you are sick, and call your health care provider BEFORE your visit. 
3.Regularly clean and disinfect frequently touched surfaces, like doorknobs, keyboards, cell phones, and light switches."
1238473864163799041,2020-03-13 14:35:53,"Community mitigation strategies are crucial to slowing the transmission of COVID-19 in Michigan. MDHHS recommends these six strategies: 

1.Learn about the signs and symptoms of COVID-19: Fever, cough, and difficulty breathing."
1238460611492749312,2020-03-13 13:43:13,"If you would like to receive email updates related to the coronavirus from the Michigan Department of Health and Human Services, visit this link to subscribe: https://t.co/ssZj29LmUZ"
1238435099592589312,2020-03-13 12:01:51,"RT @RepHaleyStevens: Starting on March 13th, my staff will be working remotely to protect constituents and help prevent the spread of COVID…"
1238318797511147520,2020-03-13 04:19:42,"Starting on March 13th, my staff will be working remotely to protect constituents and help prevent the spread of COVID-19. 

We will be maintaining all constituent services during this time, so please call 734-853-3040 for assistance."
1238305766177636353,2020-03-13 03:27:55,"This is the right call by @GovWhitmer, who has done an outstanding job over the last 24 hours. https://t.co/j5xlGk8TWI"
1238275025276473345,2020-03-13 01:25:46,"RT @OakGov: #OaklandCounty, @publichealthOC shares how to help prevent the spread of #COVID19:

👐Wash your hands for at least 20 seconds
🦠C…"
1238268429611732993,2020-03-13 00:59:34,I have been in touch with the Mayor and we are monitoring this closely. https://t.co/wPewi6JW4n
1238166526420750339,2020-03-12 18:14:38,"This is not the time to win a political agenda, it is a time for level-headed collaboration and sound policymaking to stave off a public health and economic disaster."
1238166523816087554,2020-03-12 18:14:37,"We need to pass a real stimulus package this week to stabilize the markets and address our immediate and long-term economic needs. American workers and families are worried about the spread of the coronavirus, and millions will be harmed financially in the weeks to come."
1238124940081139713,2020-03-12 15:29:23,More information is available from @CDCgov here: https://t.co/74UQcE2U40
1238124938403422214,2020-03-12 15:29:23,"-Use a regular household cleaning spray/wipe to clean &amp; disinfect frequently touched objects &amp; surfaces
-Wash your hands often with soap &amp; water for at least 20 seconds, especially after going to the bathroom, before eating, and after blowing your nose, coughing or sneezing"
1238124936415371265,2020-03-12 15:29:22,"Want to help prevent the spread of #COVID19? Here’s what the CDC suggests:
-Avoid close contact w/people who are sick
-Avoid touching your eyes, nose, &amp; mouth
-Stay home when you are sick
-Cover your cough or sneeze w/ a tissue, then throw tissue in the trash"
1237861909983940608,2020-03-11 22:04:12,"RT @MichiganPTA1: Thanks, .@RepHaleyStevens for meeting with .@MichiganPTA1 today to discuss our #PTALegCon asks and also share what Congre…"
1237855627881222150,2020-03-11 21:39:14,"RT @GovWhitmer: [THREAD] To slow the spread of COVID-19 in Michigan, the following are some of the mitigation strategies being recommended:"
1237801070602194944,2020-03-11 18:02:27,Will students be compensated for unexpected expenses related to school closures? Travel/moving expenses are a huge burden for students already struggling with loan debt and the exorbitant cost of higher ed. I’m working to get answers for Michigan students. https://t.co/FBeXNZvaZs
1237754432785395712,2020-03-11 14:57:07,"There are two confirmed cases of COVID-19 in Michigan. One in Oakland County, and one in Wayne County.

Visit https://t.co/VNMA0ZD3Ir to stay up to date as this situation develops.
https://t.co/d5VEmC4T1K"
1237465580669714433,2020-03-10 19:49:20,"Deepfakes are coming, and we need to be ready for a flood of convincing disinformation this election season. 

My bipartisan bill, which passed the House last year, would accelerate research on technology to identify doctored videos. 
https://t.co/gGoGnoqsEw"
1237432369906421761,2020-03-10 17:37:22,"Love to see our community stepping up to support workers in need of a new opportunity. Education is the key to a brighter future!
https://t.co/12DQ5aZTvP"
1237384441980387328,2020-03-10 14:26:55,"It’s Election Day in Michigan! Time to make your voice heard. 

Head to https://t.co/74CRr24z7v to check your registration, view your sample ballot, or find your polling place."
1237122266577743875,2020-03-09 21:05:07,Wishing a Happy Holi to all those celebrating in Michigan.
1237108302082957313,2020-03-09 20:09:38,"In Livonia today for a #MfgMonday at @AlphaUSAco! Loved seeing all the stamping and manufacturing they do with an incredible, BEST IN CLASS workforce. With uncertainty on the horizon due to pending trade agreements and Coronavirus fears it was important to touch base. Thank you! https://t.co/jPOka3gumD"
1237071458691661824,2020-03-09 17:43:14,"What a good girl Olive is! I hope she is a comfort to her new classmates in South Lyon ❤️🐶
https://t.co/3U6mVA3rVT"
1237070334865661953,2020-03-09 17:38:46,"This weekend, I celebrated International Women’s Day at a Women of Wisdom event hosted by @miindia and the Detroit Indian Women’s Association. Thank you for putting together such a wonderful event to recognize the achievements of amazing women across Michigan. https://t.co/64wEKGliMk"
1237048427911004166,2020-03-09 16:11:43,"Calling all high school artists!! 🎨👩‍🎨📸 Send us your artwork for a chance to have it displayed in the U.S. Capitol for one year, and two plane tickets to D.C. for a special winner’s reception. (Submissions due April 27)
Learn more here ➡️ https://t.co/6QHXSD6F0n https://t.co/v5IKX1PLlf"
1237001451341336577,2020-03-09 13:05:03,"RT @novipolice: This #InternationalWomensDay, we are celebrating all the women who serve @cityofnovi as police and civilian personnel, ensu…"
1236659630710960129,2020-03-08 14:26:46,"On this International Women’s Day, I’m thinking of all the amazing young women and girls from #MI11 I’ve had the pleasure of meeting. You are all so bright, and I know you will make our future even brighter. https://t.co/EUoyxgswqv"
1236409428557074432,2020-03-07 21:52:33,"I hold regular town halls in Michigan because I know how important transparency and accountability are to my constituents. 

Thank you @TownHallProject for stopping by my office to talk about the value of town halls and the record-setting freshman class of the 116th Congress. https://t.co/PFvBeAhjHx"
1236332169594834945,2020-03-07 16:45:33,"Want to know what the House accomplished this week to combat COVID-19? 

Watch here ⤵️ https://t.co/9zF6huWMV3"
1236045879003541506,2020-03-06 21:47:56,"Bursting with pride for all of the #MI11 teams competing in this morning’s FIRST Robotics Tournament. 🤖🎉
 
The next generation of innovators is ready to build our future!! https://t.co/b6zZX0OiaE"
1235984811438809092,2020-03-06 17:45:17,"Your congressional office is not your private home. It is a public space.

This behavior is threatening and unacceptable. I feel unsafe with this in my place of work.

I have been in contact with the Sergeant at Arms to express my concerns. https://t.co/UTbNBXLziW"
1235965419208482818,2020-03-06 16:28:13,"Congratulations, Aspen Snyder! 😊 
 
Oakland County is looking forward to seeing your beautiful artwork!
https://t.co/MSBQTWfmVE"
1235684055632556033,2020-03-05 21:50:11,"Have you received an unwanted spam call this week? 

I have. More than once. 

On this National Consumer Protection Week, I’m focused on finding bipartisan solutions like the Pallone-Thune TRACED Act, which was signed into law last year to crack down on illegal robocallers."
1235666817932120064,2020-03-05 20:41:41,"“Part of why we’re having this dialogue on mental health &amp; the reason why I’m leading this as your Congresswoman is I want to take the comments, the ideas, the points that we discuss today and bring them back to Washington.” 

Read more on our town hall 👇
https://t.co/7nvXghpptY"
1235662454815850502,2020-03-05 20:24:21,"RT @RepFinkenauer: I'm so proud to announce the first-ever Endometriosis Caucus. To the women dealing with this disease every day, you're n…"
1235635243945779200,2020-03-05 18:36:13,"Today is Paul Whelan’s 50th birthday. He isn't celebrating with friends and family. 

Paul is spending his birthday in the Russian prison where he has been wrongfully imprisoned for the last 14 months. 

Enough is enough. Let’s bring Paul home. 
https://t.co/SNk39zssUY"
1235617768499625984,2020-03-05 17:26:47,"Today, I am joining my colleague @RepFinkenauer and more than two dozen others to launch the Endometriosis Caucus. 

We support all women struggling with this condition, and will push for solutions so they no longer have to struggle alone."
1235617767170113536,2020-03-05 17:26:47,"Millions of women struggle with endometriosis, but we have not made the necessary investments to research this devastating condition.

Women who suffer from #Endo often do so silently, in extreme pain."
1235611736633487360,2020-03-05 17:02:49,"UPDATE: Yesterday, the House passed an emergency funding bill to address the coronavirus outbreak and protect Americans. 

The funding will be used for things like vaccine development, medical supplies, support for local health providers, and small business assistance. https://t.co/rUjBrdDnkw"
1235590128787009537,2020-03-05 15:36:57,"Today in @HouseScience: Understanding the spread of infectious diseases and mobilizing innovative solutions. Tune in to our discussion with public health experts here:
https://t.co/OiDWgjDqCq"
1235297768564043777,2020-03-04 20:15:13,"Congratulations to the Class of 2019!! And thank you to all the teachers and education support professionals across Michigan who helped these students reach their potential. 🎓🎉
https://t.co/mgq9qTDYTa"
1235280625554411523,2020-03-04 19:07:06,"RT @RepPaulTonko: Trump Admin is back again with an EPA rule that will let them pick studies they like and throw away ones they don’t, unde…"
1235252544194195457,2020-03-04 17:15:31,"Great to see Farmington honoring our local veterans. 🇺🇸❤️
 
If you are a veteran in #MI11 and need help navigating the federal government, please contact my Livonia office at (734) 853-3040 for assistance.
https://t.co/nu1sejyLyC"
1234965923045478403,2020-03-03 22:16:35,"RT @RepKClark: Surprise, @repjohnlewis! The pride of our lives is calling you a friend. Happy 80th! #GoodTrouble https://t.co/K99Su3Lk9h"
1234913112245047310,2020-03-03 18:46:44,Looking for up-to-date information on the coronavirus epidemic? Take a look at this resource from @CDCgov: https://t.co/74UQcE2U40
1234895895294087169,2020-03-03 17:38:19,Congratulations to the 2020 STEP Ahead Award Honorees &amp; Emerging Leaders. @TheMfgInstitute recognized this impressive group of women for their leadership in the manufacturing industry. Their accomplishments will inspire future generations of #WomenInStem. https://t.co/1EiJ2YoCro
1234867222352449538,2020-03-03 15:44:23,"I have also called for investigations into secret 'consumer scores' that corporations create using our personal data. These scores determine how customers are treated, which advertisements they see, and even how much they pay for certain products. 
https://t.co/nTiPsEMg6f"
1234867220829831169,2020-03-03 15:44:22,"March 1-7 is National Consumer Protection Week! 

In Congress, I have fought for consumers by introducing bipartisan legislation to crack down on scammers who target people with student loan debt. https://t.co/y5BdO8G2sX"
1234849771225042945,2020-03-03 14:35:02,We know tornadoes and the havoc they wreak. But the feelings of fear &amp; loss in their aftermath are the hardest to rebuild. I’m heartbroken for the lives lost and families torn apart today. The people of Michigan stand with you during this terrible time. https://t.co/e27RIvm6or
1234598243285307393,2020-03-02 21:55:33,"Reading is the foundation for a lifetime of learning! 📚 Enjoy Read Across America Day today by reading a book to a child from one of these great lists of recommended books.
https://t.co/k1ipNjffde"
1234567039584493571,2020-03-02 19:51:34,It was great to have a tour of their space and learn that they are among the few companies in North America that has the ability to test the emissions of Marine emissions - right here in #MI11!
1234567037088866309,2020-03-02 19:51:33,Thank you so much to Ilmor Engineering for a fantastic #MfgMonday! This Plymouth manufacturing company specializes in high-performance racing (IndyCar &amp; NASCAR) and recreational marine engines. https://t.co/Q9frfzC851
1234566289672278016,2020-03-02 19:48:35,"RT @NASA: Today’s the day.
 
Have you ever wondered what it would be like to #BeAnAstronaut? Applications to join the newest class of #Arte…"
1234536965695037440,2020-03-02 17:52:03,"Older Americans have the fundamental right to:
 
💊High-quality, affordable health care
🛡️Protection against neglect, abandonment and domestic abuse
👵Support for their families and caregivers
⚕️Access to essential vision, dental and hearing services
 
#ProtectOlderAmericans"
1234534823055810561,2020-03-02 17:43:33,RT @CDCgov: Current understanding is #COVID19 spreads mostly from person to person through respiratory droplets produced when a person coug…
1234241339677650946,2020-03-01 22:17:21,March is Women’s History Month! I am proud to serve alongside so many amazing women who have made history as the most diverse Freshman Class to ever serve in Congress. 🇺🇸 https://t.co/543NoW91AA
1233811847633084418,2020-02-29 17:50:42,I have been sounding alarm bells in Congress for weeks. The supply chain impacts from Coronavirus could devastate our manufacturers. I am fighting to make sure the federal government steps up to help the manufacturing community navigate this crisis. https://t.co/t7d38olwqG
1233493324096573441,2020-02-28 20:45:00,"We must prepare for a significant supply chain disruption related to the coronavirus outbreak, &amp; manufacturers in the US could be impacted. I call for the Dept of Commerce to form an interagency task force to address the economic fallout from this crisis. https://t.co/HhDFWOTG03"
1233471590001774592,2020-02-28 19:18:38,"Millions of middle &amp; high school students are hooked on e-cigarettes with flavors like cotton candy and gummy bear that are designed to appeal to children. 

Today, I voted to combat the youth tobacco epidemic by blocking the sale and manufacture of flavored tobacco products. https://t.co/D8PERJ7pT2"
1233428638269308928,2020-02-28 16:27:58,"Listening to you is my most important job. Please take my survey to share your thoughts and to join my email updates.
https://t.co/YoXilnj3Se"
1233405947093114880,2020-02-28 14:57:48,"Wayne and Oakland Counties are both at risk of being undercounted in the 2020 census. An undercount in Michigan will lead to a decrease in federal funding for our communities. 

Go to https://t.co/az6pv03sk7 today to get involved! #BeCounted
https://t.co/ZPFubATUHT"
1233390718992945154,2020-02-28 13:57:17,"Very unfortunate. In these critical times, the world needs American leadership. https://t.co/wMhCDQpgqM"
1233132748283502592,2020-02-27 20:52:12,"The Unified League in SE Michigan is absolutely remarkable because of the student players and their camaraderie. Seeing these players in action inspires me, and I encourage all to go and see the best of our community! https://t.co/TIeyqcdCvb"
1233083795215208449,2020-02-27 17:37:41,"Yesterday, I voted to authorize the first outdoor monument honoring the women’s suffrage movement. 
 
For decades, fearless suffragettes fought to secure their voting rights and paved the way for future generations.
 
It's time to honor these trailblazers. #CelebrateWomen"
1233066348361736192,2020-02-27 16:28:21,"It's been one full year since the House #GunSenseMajority passed #HR8, a bipartisan bill requiring background checks on all gun sales. 

In the year this bill has sat on Senator McConnell's desk, over 38,000 Americans have died from gun violence &amp; twice as many have been wounded."
1232820580254179328,2020-02-27 00:11:45,"Following the reports out of Milwaukee. More violence, more families devastated, and more inaction from the Senate. 

It’s time for the Senate to pass our bipartisan bill to expand background checks. Do it tomorrow."
1232762717179727873,2020-02-26 20:21:50,"The spread of coronavirus is a serious threat, both to our public health and our economy. We need to be prepared to effectively handle a coronavirus outbreak in the United States.
https://t.co/CetKRpXHJJ"
1232734110910681088,2020-02-26 18:28:09,"The facts are clear. Obamacare helped hundreds of thousands of Michiganders get healthcare they can afford.
 
Let’s protect the gains we’ve made, and further expand the ACA to get more families covered. #ProtectOurCare  
https://t.co/h3ryusmHTk"
1232715707965681666,2020-02-26 17:15:02,"Nearly 65 yrs ago, Chicago native Emmett Till, was murdered for allegedly whistling at a white woman—we now know that was a total fabrication. Lynching should never happen in our country. Today, the House corrects this historical injustice. #OutlawLynching
https://t.co/NXrLh229Bb"
1232686536182968324,2020-02-26 15:19:07,"Yesterday, I had the opportunity to meet with Consul General @SudhakarDalela to discuss the strong economic partnership between India and Michigan.
https://t.co/1CueVKk3fc"
1232675943594024967,2020-02-26 14:37:01,"Stay safe, everyone! ❄️
https://t.co/cSN0GJydDD"
