id,created_at,text
1222182745910251527,2020-01-28 15:40:48,"Valentine's Day is another opportunity to show appreciation for our veterans and connect Coloradans with those who have served. To say thanks, our office is sending cards to our veterans in partnership with @USODenver. You can send unsealed cards to or drop them off at our office https://t.co/K4AoCPviB6"
1222165717996515333,2020-01-28 14:33:08,"My staff will be at the Highlands Ranch Library for mobile office hours to help with any issues with federal agencies. We can assist you with processes for veterans benefits, Social Security, immigration issues and visas, Medicare, Medicaid, and more. Come by in the afternoon! https://t.co/M82Wwm9mSf"
1221856744659398656,2020-01-27 18:05:23,"Great to hear that former Thornton Mayor Heidi Williams will be leading Colorado’s Opioid Abuse Impact Team. As a member of Congress’s Freshmen Working Group on Addiction, I’m looking forward to working with Heidi to engage more Coloradans on an issue affecting so many families https://t.co/CK03Et6oML"
1221614917805117442,2020-01-27 02:04:27,"President Trump’s cover-up must come to an end.

Americans know that a fair trial must include both the documents and witnesses blocked by the President — that starts with Mr. Bolton. https://t.co/mODdXInSyC"
1221544376477933568,2020-01-26 21:24:09,"You deserve to know who your Representative is meeting with. That’s why I’m one of the few members of Congress to post my congressional daily meeting schedule right on my website, updated weekly. You can always see who I’m meeting with here --

https://t.co/VTYpLheE0A"
1221455448362160128,2020-01-26 15:30:47,"This week, we made our opening presentation in the impeachment trial.

I’ll be joining @FaceTheNation this morning to discuss what we’ve heard so far. https://t.co/zTlZXlLKFI"
1221227298072006656,2020-01-26 00:24:11,"Happy Lunar New Year! Team Crow had a great time celebrating with the Great Wall Chinese Academy and the Highlands Ranch Community Association today! I hope the Year of the Rat brings you peace, good health, and prosperity! https://t.co/BwA7pytyrp"
1221171225323589640,2020-01-25 20:41:23,"The Village Exchange Center helps build bridges between people of all cultures, faiths, and nationalities that call Colorado home. For their third anniversary, I spoke on the House floor congratulating the Aurora non-profit on their successful first few years. https://t.co/TVrblQpsOA"
1220889619828482048,2020-01-25 02:02:23,"This trial isn’t politically expedient; it’s hard and it’s uncomfortable, but that’s public service.

Those who have given so much for our country deserve nothing less from us than to try to honor their sacrifices.

I have tried to do that this week. Now, it’s your turn. https://t.co/PlXdWVWorB"
1220813450751901696,2020-01-24 20:59:42,"The question is whether it’s ok for the President to withhold aid for an ally at war and sacrifice our national security for his own political benefit.
 
It’s not ok to me.
 
It’s not ok with the American people.
 
It should not be ok with any of you. https://t.co/Ku3ry2H8Fv"
1220811404929835008,2020-01-24 20:51:35,"When President Trump for his own political gain asked for “a favor” from President Zelensky, he did exactly what our Framers feared most -- 

He invited the influence of a foreign power into our elections.

He used the power of his office to secure an advantage. https://t.co/sHPzQ5xO6F"
1220801487300894720,2020-01-24 20:12:10,"RT @RepAdamSchiff: Donald Trump must be convicted and removed from office.

Because he will always choose his own personal interest over ou…"
1220757789313769472,2020-01-24 17:18:32,"Climate change is affecting extreme weather events, public health, and our national security.

It’s time for America to be a global leader and work to address climate change and reduce our carbon footprint.

We need #ClimateActionNow. https://t.co/YRec6PJs9q"
1220750551731884033,2020-01-24 16:49:46,"The Village Exchange Center has been a phenomenal addition to Colorado. It is proof that building a new community is possible and a rewarding experience. I was sad to miss VEC’s 3rd anniversary celebration on Wednesday, but Deserai was there to congratulate VEC for both of us. https://t.co/6hFyMiwAu7"
1220725616967913484,2020-01-24 15:10:41,"Supporting growth at @Buckley_AFB helps ensure our national security, protect Coloradans, and boost our community. Serving on the House Armed Services Committee, I’m working to bring more military assets to Buckley, growing the base and Colorado’s economy.
https://t.co/9TI2ySvmti"
1220560036583419904,2020-01-24 04:12:44,"As Ambassador Sondland said, the President was a businessman, who saw congressionally approved, taxpayer-funded military aid for Ukraine as just another business deal. Military aid in exchange for dirt on his political opponent.

Dirt for dollars.

This for that.

A quid pro quo. https://t.co/YHdlIOQ0U7"
1220385391259389953,2020-01-23 16:38:45,"Wesley has volunteered at a community theater, where he helped with a children’s production and mentored young actors. Proud to present Wesley with a #CongressionalAward, recognizing him for achieving public service, personal development, physical fitness, and exploration goals! https://t.co/epmH1GB8VL"
1220359287870017536,2020-01-23 14:55:02,"Too many lives in our community have been touched by gun violence the last few weeks. No kid should have to go to school scared and I’m working to make that a reality. I’ve been fighting for universal background checks, to close loopholes, and to hold the gun industry accountable https://t.co/SaqlSsW4iG"
1220129396176179203,2020-01-22 23:41:31,"President Trump betrayed US national security when he corruptly withheld aid. He did so because he wanted to help his own political campaign

Our men &amp; women in uniform deserve better

Our friends &amp; allies deserve better

The American people deserve better
https://t.co/PYoHAbJZ7f"
1220030477110738944,2020-01-22 17:08:27,"Coloradans shouldn’t have to choose between paying their rent &amp; filling a prescription. It’s time to rein in skyrocketing prescription drug costs, so I’m helping to lead the Freedom From Price Gouging Act because we need to stand up to Big Pharma -- it passed the House this Fall! https://t.co/BZuEY4uoPz"
1220022685847248897,2020-01-22 16:37:29,"Women’s health care decisions must be left to a patient, her family, and her doctor. Not by politicians in Washington. In the 47 years since #RoevWade was decided, reproductive rights have continually been under attack. I’ll keep fighting to protect a woman's right to choose."
1220008202940702725,2020-01-22 15:39:56,"Only 8% of veterans in the VA health system can access VA dental services. Let's fix that. Visited the CU Heroes Clinic, where @CUDentalMed is giving dental care to vets in the @CUSystem. It’s a national model- we just voted allowing the VA to run a pilot program to close the gap https://t.co/3Lii1yUk6x"
1219786622734077952,2020-01-22 00:59:28,"Witnesses testified extensively about OMB’s involvement in carrying out the hold. It was OMB that relayed the President’s instructions and implemented the hold. And it was OMB that scrambled to justify the freeze.

It's time to subpoena those documents
https://t.co/fJ7tjvqL8t"
1219781329270857728,2020-01-22 00:38:25,"Before I was a member of Congress, I was an American soldier serving in Iraq and Afghanistan.

When we talk about troops not getting the equipment that they need when they need it, it's personal to me.

https://t.co/lmnro5RuBC"
1219676125565214720,2020-01-21 17:40:23,"Since the Citizens United decision 10 years ago, anonymous donors spent a BILLION dollars in our elections through “Dark Money”. My first bill was the End Dark Money Act because megadonors shouldn’t be able to hide their identity when they’re spending money on political campaigns https://t.co/nxes6Y3WXl"
1219650839536599040,2020-01-21 15:59:54,"McConnell is planning to run an impeachment trial:
 - Without witnesses
 - Without evidence
 - In the middle of the night

That’s not a fair trial. It’s hardly a trial at all -- that’s a cover up."
1219387972098895873,2020-01-20 22:35:22,"Earlier this month, I sent a letter urging the @DeptofDefense to rethink the proposal and maintain our national security by recommitting to our mission in Africa. Proud to work with @RepAnthonyBrown, @RepJimmyPanetta, @AustinScottGA08, and @RepRichHudson on this letter."
1219387970618318848,2020-01-20 22:35:21,"The Administration’s proposal to cut our troops in Africa would diminish American leadership and weaken our national security by giving an opening to terrorist organizations, such as ISIS. It’s also essential that we work with our allies to counter Chinese and Russian influence. https://t.co/PVdfuOq5v0"
1219352608923537408,2020-01-20 20:14:51,RT @RepJasonCrow: Martin Luther King Jr. has been an inspiration and hero to generations of Americans. As we honor his legacy and find insp…
1219327082792128514,2020-01-20 18:33:25,"Martin Luther King Jr. has been an inspiration and hero to generations of Americans. As we honor his legacy and find inspiration in his example, we continue the fight for justice and equality for every American. #MLKDay https://t.co/2yZUjF3wby"
1219073071165976576,2020-01-20 01:44:04,"The arts bring people together and foster communities. That’s one of the reasons I fight to fully fund the @NEArts. Proud to announce that 26 organizations in Colorado were just awarded NEA grants!

https://t.co/ORYiuaMTDk"
1218985245573353472,2020-01-19 19:55:04,"Trump released a new memo where he continued to deflect from his behavior. With the Senate trial set to begin, Americans want to hear the facts.

The American people deserve a fair trial in the Senate with witnesses and evidence. https://t.co/ZZn4g6p8Vh"
1218967444603265025,2020-01-19 18:44:20,"RT @RepJoeNeguse: In honor of #MLKDay national parks across Colorado will offer FREE admission tomorrow. 

#FindYourPark"
1218620045150105600,2020-01-18 19:43:54,RT @CUFederal: Thank you @RepJasonCrow for visiting the CU Heroes Clinic at the @CUDentalMed  at @CUAnschutz today. The clinic provides fre…
1217953115720376327,2020-01-16 23:33:45,"Our office has helped constituents secure veterans benefits and receive social security checks. Tomorrow, my staff will be in Greenwood Village from 3 pm - 5 pm to assist you with processes for Medicare, Medicaid, passports, federal student loans &amp; more. Come by in the afternoon! https://t.co/H8HeJAI75t"
1217552325436416000,2020-01-15 21:01:10,"While there is no map for the challenges we face, my oath to support and defend the Constitution has guided me, and will continue to guide me during this trial. It is the duty of Congress to protect the rule-of-law and hold the President accountable. Our democracy depends on it."
1217552324484378632,2020-01-15 21:01:09,I love our country and what it represents both at home and around the world. My time in military service taught me that our democracy exists because men &amp; women stand up to fight for it. It’s a belief that drove me to serve my country in combat and led me to the halls of Congress
1217552323800653824,2020-01-15 21:01:09,"As an impeachment manager, I will approach the process with the dignity and seriousness that it deserves, and advocate for a full and fair trial. It’s my solemn responsibility to lay out the facts and give the Senate - and the American people - confidence in the process."
1217209896317390849,2020-01-14 22:20:28,"Over the past few months, I’ve been talking with @KaseyCordell about my first year in Congress and how I approached this historic time in Washington. You can read the full profile here → 

https://t.co/UmVYVIUizB"
1217166251262402561,2020-01-14 19:27:02,"In Colorado, we understand the importance of protecting our environment and are making policies that reflect our values. This year, I’m bringing one of Colorado’s commonsense programs national with the SAVE Energy Act to promote energy efficiency and save taxpayer’s money! https://t.co/RUIDEPmMJE"
1216827060141903872,2020-01-13 20:59:13,"With the first full week of 2020 behind us, we’re taking a look back at our work last year. With over 250 community events and 17 bills, amendments, and resolutions, it was a busy year! Here’s a wrap up of some of our work in 2019: https://t.co/fwCtnus4mr"
1216746210062630912,2020-01-13 15:37:57,"Passing the War Powers Resolution will help ensure that we have the necessary conversation before sending our troops into harm’s way. I refused to let the executive branch circumvent Congress’s solemn constitutional duty to authorize military force. 

https://t.co/RgbG04cO9l"
1216421842606612481,2020-01-12 18:09:01,"Heartbroken for the victims injured in last night's shooting in Aurora and praying for their full recovery. While we're still learning all the details, we know the fear of gun violence all too well and we must stand together to build a safer community.

https://t.co/kvho7hp0b2"
1215729068643180547,2020-01-10 20:16:11,"The PFAS Action Act helps -- 
✅ Limit human exposure to PFAS, the harmful man-made chemical
✅ Keep Coloradans at Buckley Air Force Base safe
✅ Stem the flow of PFAS contamination into the environment
✅ Identify health risk associated with PFAS https://t.co/Vj2YvJJ5hX"
1215420612077854722,2020-01-09 23:50:29,"“A bevy of federal lawmakers, being led by Aurora Congressman Jason Crow, are requesting answers from the Trump Administration about the decision to strike and kill Iranian Revolutionary Guard Gen. Qassem Soleimani.”

https://t.co/ulTVSFw9t1"
1215410518028095488,2020-01-09 23:10:23,"I’ve often heard it’s not the time to discuss America's use of force -- in 2003, as I was carrying a rifle in Iraq. In 2005, when I was leading my unit in Afghanistan. And today, in Congress. The War Powers Resolution ensures Congress debates before sending troops into harm’s way https://t.co/eOZTtIu2Y2"
1215316188697452550,2020-01-09 16:55:33,"RT @NewsHour: “The time is now to have that discussion about, what is the future of security for America?” says @RepJasonCrow about the nee…"
1215298150921121792,2020-01-09 15:43:52,RT @LeaderHoyer: Rural communities around the country can benefit from agriculture technology that increases production efficiency and prom…
1215285440762302464,2020-01-09 14:53:22,"RT @HouseSmallBiz: Starting soon!

Chaired by @RepJasonCrow 

Stream here: https://t.co/wLW6BRdGDZ"
1215119756296179712,2020-01-09 03:55:00,RT @CBSDenver: ‘Good For The Environment’: Rep. Jason Crow Extends Energy Saving Tax Credit https://t.co/VOcnctIk5R https://t.co/jpTVcSUdu2
1215119640843767808,2020-01-09 03:54:32,RT @SentinelColo: Rep. Jason Crow leads congressional letter to White House demanding Iran answers | Sentinel Colorado https://t.co/s0pSRzJ…
1215101102741491712,2020-01-09 02:40:53,".@GabbyGiffords and 18 others were shot 9 years ago today. Since, she’s led the charge for gun violence prevention measures and universal background checks, so no one else has to live through tragedy. Every day, I’m proud to be fighting alongside her. https://t.co/BR5qWY6dOd"
1215036630232375296,2020-01-08 22:24:41,I’ve been at the receiving end of rocket attacks. The President saying “all is well” while Americans are being threatened shows that he doesn’t understand the impact of his actions on our troops in the region. https://t.co/MqLn9u4lJz
1215029406273560578,2020-01-08 21:55:59,RT @RepGilCisneros: Joined my colleagues in demanding answers from the President on Iran. It's only right the Administration provides Congr…
1215029381980213249,2020-01-08 21:55:53,RT @RepRickLarsen: .@RepJasonCrow thank you for leading on keeping Trump accountable and for your service to the country as a combat vetera…
1215029322064502785,2020-01-08 21:55:39,RT @alsassociation: Thank you @RepJasonCrow for cosponsoring the ALS Disability Insurance Access Act. Your support has brought our country…
1214919015392587776,2020-01-08 14:37:20,"The American people deserve answers to the tough questions. Ahead of today’s congressional briefing on Iran, I led a letter with 37 of my colleagues demanding answers about the President's plan to de-escalate the situation and keep Americans safe. https://t.co/xKCcueLJlp"
1214913243564691458,2020-01-08 14:14:23,RT @SierraClubCO: The #SaveEnergyAct will allow Colorado homeowners to deduct up to $500 on their taxes when they purchase energy efficient…
1214892542510215171,2020-01-08 12:52:08,"RT @TheLastWord: .@RepJasonCrow, who has served in combat in Afghanistan and Iraq, says President Trump's tweet that ""all is well"" shows he…"
1214306649902632971,2020-01-06 22:04:00,"Our team is kicking off the first mobile office hours of the year at Aurora Central Public Library tomorrow from 3-5pm. If you need help dealing with federal agencies, swing by and our team will be there to help!"
1214272077575991298,2020-01-06 19:46:38,"¡Feliz Día de los Reyes! Para muchas familias en nuestra comunidad, hoy es una querida día festivo para pasar tiempo con familia y celebrar tradiciones y patrimonio latino."
1214271948265574400,2020-01-06 19:46:07,"Happy Three Kings Day! For many families in our community, today is a cherished holiday to spend time with family and celebrate Latinx traditions and heritage."
1213482914379423744,2020-01-04 15:30:46,Starting off the weekend with the first Crow on Your Corner of 2020. I'll be Endless Grind Coffee at 9am - Hope to see you there! https://t.co/sCwFKWgjRd
1213191209667178502,2020-01-03 20:11:39,"RT @JustinWingerter: Iraq War vet @RepJasonCrow, who unsuccessfully pushed for an amendment blocking attacks on Iran without congressional…"
1213154122461040642,2020-01-03 17:44:16,"As a member of the Armed Services Committee, I’ll be asking the hard questions of this Administration to make sure we are supporting our diplomats and servicemembers, ensuring a strong national defense, and using force as the last resort."
1213154053745790976,2020-01-03 17:44:00,"The President must explain his policy towards Iran and give the American people confidence that we have a coherent strategy for protecting our embassies, our troops, and our national security."
1213153940948312064,2020-01-03 17:43:33,"In July, I was proud to stand with colleagues, on both sides of the aisle, to prohibit the Administration from entering into a conflict with Iran without proper congressional authorization."
1213153458938949632,2020-01-03 17:41:38,"My time serving as a paratrooper in Iraq taught me that using force without a strategy &amp; clearly defined goals rarely ends well. While we are still learning details, one thing is clear: only Congress can declare war and the President has not sought any such authorization."
1213153393268658177,2020-01-03 17:41:22,"The question is not whether Qasem Soleimani was a threat to the United States, the question is whether President Trump has a strategy in place to deal with the potentially seismic events that he has unleashed."
1212827166901190656,2020-01-02 20:05:04,"Looking forward to hosting our first Crow on Your Corner of the new year! I'll be at Endless Grind in Aurora on Saturday at 9 am. Come by, say hi, and let me know what's your mind as we head into 2020. https://t.co/GzbWz6C7Ol"
1212495607123922945,2020-01-01 22:07:34,I’m fighting every day to increase transparency &amp; accountability in our government. Proud to be one of the first members of Congress to release a congressional meeting calendar. You can check out 2019's congressional meeting schedule right on my website at https://t.co/VTYpLheE0A
