id,created_at,text
1214303103861874688,2020-01-06 21:49:55,From Pasadena to Antarctica to...Europa? Another incredible advancement from the brilliant minds at our very own @NASAJPL and @caltech could soon be on its way to a frozen moon of Jupiter to help us better understand our universe &amp; even search for life. https://t.co/afdeFEew7K
1214271578424430595,2020-01-06 19:44:39,Start your week with a smile and join me in congratulating @awkwafina on her well deserved Golden Globe - making her the first #AAPI woman to win for best actress in a musical or comedy! Representation matters. So do hilarious and talented women! https://t.co/120AiCV1mB
1214255661531435013,2020-01-06 18:41:24,"It's happened before. I was on the ground at LAX the last time CBP detained Iranian-Americans because of their country of origin. When I called w/ questions, they hung up on me. Any reports of Americans detained must be investigated and taken seriously. https://t.co/MMZtWl88Do"
1214202281924669440,2020-01-06 15:09:17,"Trump justifies his attacks on Iran with the 2002 AUMF, which means the 18 year olds he will send would fight a war on grounds created before they were born. That's outrageous &amp; clearly unjustified. We must repeal the AUMF and reclaim Congress's authority immediately. https://t.co/VEYZBAhzjW"
1213232608664002566,2020-01-03 22:56:09,This is not at all what the 2002 AUMF was intended for and it is as clear an example as any of why we must repeal the AUMF immediately before it is further abused for endless war. https://t.co/OFIL35UkiK
1213203627193634816,2020-01-03 21:00:59,"Let's end this week the way I started the New Year: with some positivity and love. @RepBarbaraLee made the most beautiful bride at her wonderful New Year's eve wedding, and I was so honored to be there to celebrate with her. Congratulations Barbara &amp; Clyde! https://t.co/s8UCjYOuh1"
1213120721901301763,2020-01-03 15:31:33,Republicans used this same line in 2003 to claim the Iraq war would be quick. We are still paying for the consequences of that. We cannot allow it to be used again. https://t.co/qMpc0jo5qy
1213110216310607874,2020-01-03 14:49:48,"We need a strategy, not provocation. The President must immediately consult Congress before taking further action in Iran. And to calm tensions, we need a return to the diplomacy and multilateral cooperation that produced the Iran Nuclear Deal."
1212862829210095616,2020-01-02 22:26:47,"This is why Obstruction of Congress was one of the articles of impeachment against President Trump. His administration hid and blocked access to documents corroborating witness testimony that Trump directed Ukraine aid be withheld, even if it violated the law. https://t.co/toE5frVEqg"
1212852839543955462,2020-01-02 21:47:05,"I was honored to ring in the New Year on the American Heroes float at the #RoseParade, which won Most Extraordinary Float for celebrating all veterans, but especially the Chinese American Veterans of WWII - a first ever for the Rose Parade! https://t.co/AH3zLVWvel"
