id,created_at,text
1237483263498883072,2020-03-10 20:59:36,RT @LeaderHoyer: I stand with my colleagues and agree with their request. We must avoid stoking xenophobia in light of this public health e…
1237464611126902785,2020-03-10 19:45:28,"RT @CAPAC: As the CDC said, ""Stigma is the enemy of public health."" It's time to put public health first, and that's why @CAPAC, @TheBlackC…"
1237442125106724865,2020-03-10 18:16:07,"*Everything you need to know*, like this: ""Stigma is discrimination against an identifiable group of people, a place, or a nation. Stigma is associated with a lack of knowledge about how COVID-19 spreads, a need to blame someone..."" Take your own advice @GOPLeader &amp; listen to CDC https://t.co/tckRbLh7nk"
1237432212699652097,2020-03-10 17:36:44,"Racist and wrong. Your own medical experts in your own government say that a wall would not stop #covid-19. They also say that calling it the ""china virus"", as below, puts people in danger. Listen to your experts. Keep people safe - don't stoke xenophobia. https://t.co/y6UuBzy1aH"
1237425607920758786,2020-03-10 17:10:29,"Either Rep. Scalise has not read my bill, or he has and is being dishonest to you about it. Repealing the Muslim Bans would in no way impact our #Covid-19 response. My bill just requires that any bans be based on evidence (an actual pandemic), not prejudice (""ban all Muslims""). https://t.co/sQCFWgkH5l"
1237401953912659968,2020-03-10 15:36:30,"RT @AaronBlake: CDC Director Redfield is asked whether it's wrong and inappropriate to call it the ""Chinese coronavirus.""

Redfield: ""Yes.""…"
1237370549824884738,2020-03-10 13:31:42,"This is reckless. Why do you insist on disagreeing with HHS and CDC - both of which have said to not do this. “Stigma is the enemy of public health” – CDC. Your words do not help us understand this threat, they only serve to spread xenophobia and make all of us less safe. https://t.co/tckRbLh7nk"
1237135886808211461,2020-03-09 21:59:14,"RT @CAPAC: Mr. Gosar, why did you tweet this picture? What were your search terms? Taken with your earlier tweet insisting on calling #covi…"
1237133381269442560,2020-03-09 21:49:17,"Stop! You are putting people's lives in danger. The Chief Medical Officer of the CDC said ""stigma is the enemy of public health"" and @SecAzar committed to not using this term because it puts people at risk of prejudice. You need to consider your words before you get someone hurt. https://t.co/wcFFsqMLi4"
1236051910769152001,2020-03-06 22:11:54,"RT @DanMartinTalks: ""CBP needs to be doing more than just handing out masks,"" @RepJudyChu told me about efforts to protect migrants at dete…"
1236019523892977666,2020-03-06 20:03:13,"Federal &amp; local cooperation is especially important on issues like water supply, conservation, &amp; flood protection. Today, I'm joining with @gracenapolitano, @MayorOfLA, @HildaSolis and others to discuss upcoming legislation intended to ensure we can meet our area's water needs. https://t.co/j8OkX9Upr9"
1236006147817078785,2020-03-06 19:10:04,6 years old - that’s how old the average #DACA recipient was when they arrived in the US. #HomeIsHere for #Dreamers. It always has been and always will be. We must #ProtectTheDream at #SCOTUS https://t.co/lKpFSC4z4h
1235998363511926785,2020-03-06 18:39:08,"Even after members of both parties have been victims of gun violence, the @HouseGOP is silent on this threat to shoot politicians he disagrees with. These kinds of threats are dangerous and unacceptable. We should know better. We promised to be better https://t.co/UpHThoORCW"
1235953052051480577,2020-03-06 15:39:05,"Clearly Pompeo is ignoring his own colleague, @SecAzar, who told me last week that ""ethnicity is not what causes the novel coronavirus."" So no, calling it the ""Wuhan virus"" is not an accurate description of anything other than a desire to spread racism &amp; fear. https://t.co/wsDD5BHxWN"
1235772021117763585,2020-03-06 03:39:44,"Leave it to the guy who found “good people” at a neo-Nazi rally, to find something to like about #coronavirus. https://t.co/dZ46u8xoSD"
1235712012149194752,2020-03-05 23:41:16,"Health experts: If you're sick, go see a doctor.

Trump Admin: If you're an immigrant who goes to the doctor, you may be punished.

These two ideas are not compatible. For the sake of public health amid #coronavirus outbreak, Trump should end his #PublicCharge rule immediately. https://t.co/Gz0RshETR9"
1235693848602566662,2020-03-05 22:29:06,"I'm thrilled to introduce my newest constituent, @NASAPersevere, the new #Mars2020 rover built right here in SoCal by the brilliant minds at @NASAJPL. But Perseverance will be leaving us soon for a mission to Mars. Congratulations to all involved for helping advance science! https://t.co/GyOhMcVFxS"
1235676981578129415,2020-03-05 21:22:04,RT @RepGraceMeng: House &amp; Senate have passed a provision – based on a bill I intro’d w/ @NydiaVelazquez &amp; @RepJudyChu – that would allow $7…
1235655783385194496,2020-03-05 19:57:50,"ICE wants to ""flood the streets"" not in search of criminals and not in search of threats, but in search of immigrants. This is not about law enforcement, it's about terrorizing immigrant communities, which will leave us all less secure. Shame! https://t.co/ypqXzhQCgT"
1235637320725884928,2020-03-05 18:44:28,"""In reality, the ban undermines U.S. national security.""

I am so proud to have the support of over 50 former military &amp; national security leaders from both parties for my #NoBanAct to repeal the #MuslimBan, which is unnecessary &amp; hurts America.  https://t.co/V0nP9OdaxA"
1235614763247448066,2020-03-05 17:14:50,"RT @RepKClark: DYK: While the #Census count for adults has been getting more accurate over time, the undercount for children 5 and below ha…"
1235589407379316736,2020-03-05 15:34:05,"The #2020Census starts in 1 week, and we are urging everyone to participate – especially communities of color who have historically been undercounted. https://t.co/SV8T5AIyka"
1235340236860854272,2020-03-04 23:03:58,"Abortion is healthcare. We know our rights, and we won’t back down!

#SCOTUS #JuneMedicalServices #MyRightMyDecision #RoeVWade https://t.co/Ot5aFp0C9q"
1235224886584451074,2020-03-04 15:25:36,"RT @ReproRights: ""That's why I introduced the Women’s Health Protection Act. If Roe v Wade is struck down, it will make sure that reproduct…"
1235205214644441089,2020-03-04 14:07:26,"Our message at the Supreme Court today: Hands off our bodies. 

#MyRightMyDecision 
#JuneMedicalServices
#RoeVWade https://t.co/neLLkPd5ZS"
1234953482542686208,2020-03-03 21:27:09,"10 years ago, almost 1/3 of IRS audits were of the top earners. Today? Just 7%. Meanwhile, the poorest now make up 39% of audits! That's why today, I pressed @stevenmnuchin1 to ensure new auditors focus on the wealthy https://t.co/YUqtveaeM9 https://t.co/Br2Opmvnzu"
1234883282132721665,2020-03-03 16:48:12,"“Ethnicity is not what causes the novel coronavirus.” – HHS @SecAzar

Jesse Watters' bigotry is in contradiction with even the Administration’s response. @FoxNews, do not let AAPIs be put in danger by allowing such xenophobic misinformation. https://t.co/VbxKqF5Z4v"
1234879138055557121,2020-03-03 16:31:44,"RT @CAPAC: This racism is vile. What Watters said is not only untrue, it puts AAPIs at risk of xenophobic violence. As @CDCgov Chief Medica…"
1234624140423958528,2020-03-02 23:38:27,"RT @NydiaVelazquez: Asian-owned small businesses have suffered due to stigma associated with the #coronavirus. 

I've joined w/ @RepJudyChu…"
1233472967981617152,2020-02-28 19:24:07,"RT @CAPAC: ""Stigma is the enemy of public health."" That was the message today from @CDCgov, @OCANational, and @ADL who joined us outside th…"
1233461143059996673,2020-02-28 18:37:07,"RT @usatodayDC: Rep. Judy Chu said business was down 50% in restaurants in her district, which has a large Asian American population. https…"
1233458634669031424,2020-02-28 18:27:09,"RT @HispanicCaucus: 🚨HUGE NEWS🚨

The 9th Circuit Court affirmed the illegality of Trump’s dangerous #RemainInMexico policy &amp; #AsylumBan 1.…"
1233448533568753665,2020-02-28 17:47:01,"RT @nicholaswu12: At presser, @CAPAC chair @RepJudyChu denounces “fake news meant to create fear” and “rumors directed at Chinese Americans…"
1233081792363728902,2020-02-27 17:29:43,"Yesterday's tragic shooting in #Milwaukee came just one day before the anniversary of the House vote on #HR8 to require background checks on every single gun purchase. As the gun violence plague continues, there is no excuse for not voting on necessary and common sense reforms!"
1233078067981115393,2020-02-27 17:14:55,"“Ethnicity is not what causes the novel coronavirus.” Today, I pressured HHS @SecAzar to stop referring to #COVID-19 as the Chinese #Coronavirus, and I thank him for recognizing that ethnicity is not a factor. Spreading xenophobia will not stop the spread of COVID-19. https://t.co/mgDoQDCkSD"
1233048711766429697,2020-02-27 15:18:16,"I'm horrified by these attacks in Delhi this week. Nationalism, bigotry, and discrimination are not compatible with democracy. India must work to unite all citizens, regardless of faith. https://t.co/VgmfpddnnU"
1232815679641997313,2020-02-26 23:52:17,"As governor of Indiana, Mike Pence's war on healthcare literally created an HIV epidemic where there was none. That is not a strong qualification for a #Coronavirus Czar. https://t.co/d6Bfju8oUz"
1232779782699573248,2020-02-26 21:29:38,"RT @thehill: JUST IN: Asian caucus calls on fellow lawmakers not to ""perpetuate racist stereotypes"" amid coronavirus fears https://t.co/PLi…"
1232779049480654856,2020-02-26 21:26:43,"RT @CAPAC: During a public health crisis, like #coronavirus, it's more important than ever that Members of Congress only share accurate inf…"
1232745667359014918,2020-02-26 19:14:05,"#Census2020 will ask a few questions and will keep ALL responses confidential. It will ask your name, phone #, gender, age, date of birth, &amp; race, as well as how many other members live in your household. Be ready, because #WeCount and we must be counted!
https://t.co/j5ddrJbkM9"
1232703434480062465,2020-02-26 16:26:15,"As misinformation &amp; xenophobia around #coronavirus spread, and as gov't officials like @HomelandKen tweet about their lack of information, it's clear a coronavirus czar is overdue and sorely needed. I welcome this move. We need someone in gov't to coordinate our response https://t.co/cgVVPK0t4c"
1232680408317399045,2020-02-26 14:54:46,"If you're the reporter who asked @SecAzar not to call #COVID19 the ""Chinese"" #Coronavirus, please call my office so I can thank you for helping to stop the spread of xenophobia that has put anyone who even looks Asian at risk of prejudice and violence. https://t.co/JwZ2Z6bfqj"
1232441438492717056,2020-02-25 23:05:11,RT @NBCAsianAmerica: “Racial profiling does not protect U.S. interests. It promotes hysteria and has led to arrests of innocent individuals…
1232079265568579585,2020-02-24 23:06:02,"Activists fear ""records of alleged abuses of undocumented immigrants could be destroyed.""

Looks like Republicans were more concerned about the Speaker tearing a copy of a speech than the Trump administration covering up deaths or abuse
https://t.co/NTWZDtNWma"
1231972248422146049,2020-02-24 16:00:47,"Past immigrants succeeded despite obstacles like ""Irish need not apply"" or the Chinese Exclusion Act. This is just the latest xenophobic barrier to the American Dream. That's why I introduced HR 3222 to stop this #PublicCharge rule completely."
1231972078137618432,2020-02-24 16:00:07,"Today, Donald Trump &amp; Stephen Miller are starting a wealth test for immigrants that would have kept the grandparents of Donald Trump &amp; Stephen Miller from coming here. When they came, immigrants were mostly European. Today? Asian &amp; Central American. Double standard or bigotry? https://t.co/O26RMdFO6a"
1230623460008878080,2020-02-20 22:41:11,This raises a dangerous and terrifying prospect that Trump named a loyalist like Grenell to DNI because Trump could count on him to hide this kind of intelligence from Congress. https://t.co/WItAdZiTih
1230579982453420032,2020-02-20 19:48:25,"RT @OversightDems: Because of concerns that innocent Chinese-American scientists are being disproportionately charged as potential spies, @…"
1230579961616109568,2020-02-20 19:48:20,RT @CAPAC: Over half those charged under the Economic Espionage Act have been of Chinese heritage. That same group was twice as likely to b…
1230547233386487814,2020-02-20 17:38:17,"If you're an immigrant or person of color, then Trump says you're a hardened criminal. But a rich white man with the right connections to the President? Then you're a pardoned criminal. https://t.co/JSSzOHC5jt"
1230263483599552513,2020-02-19 22:50:46,"February 19, 1942, the dark day when FDR signed #EO9066 to imprison innocent Japanese Americans simply based on their ethnicity. Today we remember that shameful policy &amp; recommit ourselves to safeguarding the civil rights of all Americans #DayOfRemembrance https://t.co/5fpeRnwEcb"
1230153746161774598,2020-02-19 15:34:42,"RT @CAPAC: We commend the State of California for taking this important step to apologize for the unjust exclusion, removal, and incarcerat…"
1229899083113992193,2020-02-18 22:42:46,"Mr. Trump, I know that you need to create fear of immigrants for your campaign, but while here in LA, I strongly encourage you to speak to our local police about this. They'll tell you that your policy of turning local police into ICE agents actually makes their jobs harder. https://t.co/1vSJSo3Gvu"
1229845064521789440,2020-02-18 19:08:07,"In announcing this, Trump said he felt bad that Blagojevich had to be away from his children as they enter high school. Mr. Trump, I'm glad you care about keeping families together. Let me tell you about what's happening at our border with children far younger than high school... https://t.co/iE32qolOzn"
1228409842915774471,2020-02-14 20:05:03,"""Am I at risk of #coronavirus from a package or shipment from China?"" 

No. https://t.co/63NYyI6DWO"
1228405356407201792,2020-02-14 19:47:14,Being Chinese- or Asian-American does not make you more likely to carry the #coronavirus. Recent and prolonged travel to impacted areas does. The risk of spread in our community is low - and prejudice does not help. https://t.co/63NYyI6DWO
1228404254165131266,2020-02-14 19:42:51,"Do you know how to do the ""Dracula Cape""? This simple move can help you stop the spread of disease. Join me now for a demonstration. https://t.co/63NYyI6DWO"
1228402988085059584,2020-02-14 19:37:49,RT @CAPAC: HAPPENING NOW: #CAPAC Chair @RepJudyChu is hosting a Facebook Live to answer your questions about the #coronavirus and discuss c…
1228401728829239298,2020-02-14 19:32:49,"Happening now: I'm taking your questions on the #coronavirus. Join me on Facebook Live, along with local health experts, to discuss local and federal efforts to keep you and your family safe. https://t.co/Q8SWtDVVjk https://t.co/4qAZRpicuF"
1228035044524150784,2020-02-13 19:15:45,"Roses are red
Chimps are hirsute
If Trump meant what he said
He'd oppose the lawsuit

#HealthPolicyValentines https://t.co/5bk4EdFche"
1228020516893679616,2020-02-13 18:18:01,Do you have questions about coronavirus? I'm here to help. Join me FRIDAY at 11:30 am PT for a Facebook Live conversation w/ local public health officials to ask your questions about the coronavirus and receive updates on government response efforts. https://t.co/k0qpDAagZg
1227991839636103169,2020-02-13 16:24:04,"Women have gained the right to vote, serve on juries, inherit property, and even open our own credit cards. But those victories did not come easy. And true equality is still just a goal, not a reality. The people are speaking. It's clear, if we want equality, we need the #ERANow! https://t.co/vLK6NbUBA9"
1227982231198732290,2020-02-13 15:45:53,RT @CAPAC: Leaked e-mails have shown Stephen Miller to be a white-supremacist who is more than happy to spread neo-Nazi propaganda in his c…
1227979790906425346,2020-02-13 15:36:11,An independent judiciary is the single biggest threat to somebody looking to abuse power. So it's no surprise Donald has tried to undermine ours since the day they began investigating his &amp; his allies' corrupt solicitation of foreign interference in our elections. https://t.co/kjbNcrqFmg
1227970766412681217,2020-02-13 15:00:19,"I still remember the shocking murder of Matthew Shepard &amp; how it awoke us all to the need to confront hate crimes. Today, I was honored to meet his parents, Judy and Dennis, who have made compassion their mission, working on behalf of all marginalized communities https://t.co/V6jegvhb2F"
1227697641804484610,2020-02-12 20:55:01,"National monument status has meant more $ for rangers, trail improvements, signs &amp; more. Today, we voted to build on that success by passing my bill to expand protections in the San Gabriels, improve access, increase connectivity w/ communities, &amp; preserve recreational use https://t.co/c1dmNe74ls"
1227689162800803842,2020-02-12 20:21:20,"RT @RepBarbaraLee: Actually, it’s very important for our national security – and the security of our brave servicemembers – that we not eng…"
1227679848040161282,2020-02-12 19:44:19,RT @HispanicCaucus: Trump's #RemainInMexico - now in effect for over 1 yr - has caused human &amp; civil rights violations &amp; suffering of nearl…
1227664839755149312,2020-02-12 18:44:41,"RT @RepChuyGarcia: In 2016, we resettled 12,587 Syrian refugees.

In 2018, only 60.

We should be welcoming refugees who need our help, not…"
1227652436229312514,2020-02-12 17:55:24,"RT @lanatureforall: Tune in now! @RepJudyChu on @cspan discussing #SanGabrielMountains, Foothills and Rivers Protection Act https://t.co/9N…"
1227649881763962883,2020-02-12 17:45:15,"RT @AmerIndependent: Read @RepJudyChu, @RepJayapal, and @RepMaxRose explain why it's time to repeal Trump's Muslim ban: https://t.co/FzW3hZ…"
1227619898165121025,2020-02-12 15:46:06,"RT @RepJerryNadler: Today, @EnergyCommerce holds the first hearing EVER on the Women’s Health Protection Act. My friend @RepJudyChu, introd…"
1227615595589488642,2020-02-12 15:29:00,"My #NOBANAct: 
 
-Stops the #MuslimBan in all forms
-Requires reports on how many visa waivers have been issued and to whom
-Prevents any future bans like this unless the President provides actual evidence of why it's needed. 
 
History is being made today. Watch live: https://t.co/jjhohHYy09"
1227609331719340032,2020-02-12 15:04:07,"For the first time in over 20 years, the House is holding a hearing on protecting access to abortion! My bill - the Women's Health Protection Act - will stop state attacks on women, enshrine Roe into law &amp; ensure that our rights do not depend on our zip code. #ActForWomen #WHPA https://t.co/Hn2jqUup2X"
1227378800712876032,2020-02-11 23:48:04,We are watching corruption happen in real time. This is what happens when there are no consequences. https://t.co/fk0X88EVPp
1227373052595523585,2020-02-11 23:25:13,"After the the #GOPTaxScam passed, corporations spent over $1 trillion buying back stocks, over 50% of which are owned by the top 1%. That's not trickle down, it's a loop. Today in @WaysMeansCmte, we discussed real options for growth, like raising the minimum wage. https://t.co/uNQFDuSYKd"
1227340349359742977,2020-02-11 21:15:16,"Injured on the job? Trump wants to cut your Social Security Disability Insurance.

Can't work but still need to eat? Trump is taking ~$200b from SNAP.

Need help affording healthcare? Medicaid could lose ~$1T.

The best way to support American families is to reject Trump's Budget"
1227328469157191681,2020-02-11 20:28:04,"Asian American women earn as little as $.50 for every $1 a white man makes doing the same job. That pay gap means it's harder to afford healthcare and groceries, hurting families &amp; communities. The House already passed #PacycheckFairness. It's time the Senate acts! #AAPIEqualPay"
1227018430768918529,2020-02-10 23:56:05,"The #TrumpBudget cuts over $4 trillion in spending. How? By slashing your Social Security, healthcare, and education funding. And yet, thanks to his tax cuts for the rich &amp; by not investing in America, this budget somehow still increases the deficit by $5.6 trillion over 10 years"
1227015946910523394,2020-02-10 23:46:13,"There's a waterfall just outside Los Angeles I want you to see. It's down a trail past mountains, trees, wilderness, eagles, and artifacts. And now, with the House voting on my San Gabriels protection bill, those hidden gems are set to be more accessible &amp; safer than ever! https://t.co/Jl1lonaIUZ"
1226913162307526656,2020-02-10 16:57:47,"For the first time ever, a foreign-language film won Best Picture at the #AcademyAwards! Congratulations to @ParasiteMovie and everyone involved. We are better off when we embrace and encourage the contributions from creators of diverse backgrounds. https://t.co/lDRcGHVn2N"
1226905855641165824,2020-02-10 16:28:45,"RT @SierraClub: ""It’s an awesome sight in the backyard of millions of Angelenos, who have no idea that it exists. With federal protection &amp;…"
1225905433031958530,2020-02-07 22:13:26,"Millions of children are about to go hungry because the President wants them to. It's that simple. The Administration needs to be condemned for this cruelty, but it won't make a difference. The cruelty is the point. https://t.co/GfFzWyZfv4"
1225902298016231426,2020-02-07 22:00:58,"Cooperate with Congress to tell the truth and expose corruption, and you will lose your job. This is the President's message to government employees as he seeks to turn our democracy into something less about the people, and more about himself. https://t.co/dFCJVxP11b"
1225816348913274881,2020-02-07 16:19:26,Treasury broke the law by refusing to provide Trump's tax returns to our committee. But the same Treasury that claimed they were protecting individuals from political attacks is caving to a partisan ask and handing private info to Senate Republicans. https://t.co/N0LmrUmng4
1225571278121324544,2020-02-07 00:05:37,"Immigrants are dying in their care. Laws are being imperfectly and unevenly applied. Rights are being denied. CBP needs MORE transparency, not less. https://t.co/jxPdD2PktM"
1225541014770810881,2020-02-06 22:05:22,"The #MeToo movement has brought new attention to sexual harassment and assault in the workplace. But it was only possible because courageous women spoke out. Today, I was honored to hear from some of these women directly. Their stories were moving and demand action &amp; justice. https://t.co/dS7QX2Q7v1"
1225526297759297536,2020-02-06 21:06:53,"When workers have the power to stand together and form a union, they have:
-Bigger paychecks 
-Better benefits
-Safer working conditions
Today, House Democrats are passing the #PROAct to help create an economy where everyone can succeed. https://t.co/l2mbsBjsIZ"
1225493683778342913,2020-02-06 18:57:17,"Republicans make excuses for President Trump undermining democracy, endangering national security, spreading lies, promoting bigotry, and viciously attacking opponents. But they're upset that a photocopy got ripped. What hypocrites. https://t.co/Lk9v2xhoyu"
1225451325154000896,2020-02-06 16:08:58,"Mental health is as essential as physical health. And that has to include addiction. It was a privilege to address the @kennedyforum on my work to improve addiction recovery, end stigma around mental healthcare, and increase access to comprehensive mental health services. https://t.co/ceHyoPX3YR"
1225435986135523335,2020-02-06 15:08:01,"RT @USProgressives: This week, we will pass the #ProAct to strengthen organizing protections in the workplace.

The PRO Act empowers worker…"
1225170174170619905,2020-02-05 21:31:46,"Democrats, Republicans, &amp; Independents agree: the President abused his power. But impeachment was doomed from the start. Not because they disagree with our case. But because we wanted Republicans to convict President Trump for election interference and they wanted to cover it up"
1225167540927848449,2020-02-05 21:21:18,"Asylum is legal immigration. Our laws protect refugees who come here asking for safety. But Trump has ignored our laws, instead sentencing these immigrants to death. This is the immigration policy under Trump. It is about first dehumanizing immigrants in order to justify cruelty. https://t.co/9jX59o0Lhq"
1225091736659210242,2020-02-05 16:20:05,"“If any race of people should not have guilt about slavery, it’s Caucasians.” https://t.co/WcPzfBuHbF"
1225091676299055105,2020-02-05 16:19:51,"“Holocaust 90 million Indians? Only four million left? They all have casinos, what’s to complain about?” https://t.co/WcPzfBuHbF"
1225091609391501312,2020-02-05 16:19:35,“He is exaggerating the effects of the disease. He’s moving all around and shaking and it’s purely an act. … This is really shameless of Michael J. Fox. Either he didn’t take his medication or he’s acting.” https://t.co/Nwh1LgO793
1225091554890612736,2020-02-05 16:19:22,”Women should not be allowed on juries where the accused is a stud.” https://t.co/RKztZxOL33
1225091500977065985,2020-02-05 16:19:09,"Advice for poor kids, unable to get meals at school during summer break: ""Where to find food?...Try your house. It's a thing called the refrigerator."" https://t.co/FXP8NQj8QX"
1225091422774333440,2020-02-05 16:18:50,"“If the left ever senses and smells that there's no consent in part of the equation then here come the rape police.” [ed. note: ""Consent in part of the equation"" is not optional. You do not have a right to women's bodies. Not getting consent is rape.] 
 https://t.co/NRm9y7rX0H"
