id,created_at,text
1247230731685957632,2020-04-06 18:32:33,"To survive this crisis we need to 1) contain the coronavirus and 2) make sure all workers get support they deserve. For this to work, we can't discriminate against immigrants. My bill, HR 6437 will ensure access to healthcare w/out punishment &amp; food/cash benefits to all taxpayers"
1247206123402407937,2020-04-06 16:54:46,"Treating coronavirus can cost from $30,000-$75,000 w/out insurance. So far, 13k Californians have gotten sick, w/ peak still weeks away. Not having insurance is not an option. That's why, in addition to covering #COVID19 costs, we must protect ACA from GOP attacks #protectourcare"
1246217371716550656,2020-04-03 23:25:49,The coronavirus doesn't discriminate and neither should Congress. The $2 trillion recovery bill we passed is meant to help the whole country get through this. That doesn't work if we exclude whole communities. We must include immigrants in the recovery https://t.co/HnKsXb659m
1246092771150180352,2020-04-03 15:10:42,10 million Americans are filing for unemployment in just the last month alone. And millions are frustrated by the process. I understand. That's why I set up a resource page at https://t.co/C6DlonFIL8 to help you navigate applying for UI and more.
1245768358848536578,2020-04-02 17:41:36,"More than 6 million people filed for unemployment last week alone. If you're one of them, it's not your fault and there is help for you. I've set up a resource page at https://t.co/xvQAvSxPwe with information on how &amp; where to apply for benefits."
1245421823430443010,2020-04-01 18:44:36,"If you want to help us prepare for a future pandemic, there's a simple action you can take today: go to https://t.co/1ASxiOLFin and #BeCounted! 
 
It's not just about Congressional seats. We need to know who lives where so we can get aid where it's needed. #Census2020 https://t.co/FOxVB6nWii"
1245411301310038017,2020-04-01 18:02:47,"You can't go to school, a restaurant, or church because of coronavirus social distancing, but gun stores are still open. Even during a pandemic, Donald Trump will find a way to value profits for the gun industry over people's lives. https://t.co/49V4ZwXezB"
1245385420596273160,2020-04-01 16:19:57,Do you have questions about what resources are available for your family or small business? Want to know about the checks that are coming your way? I set up a page to help. Visit https://t.co/NtBFpgJpVg for information and resources.
1245364381384429569,2020-04-01 14:56:20,Nobody needs to go without health insurance. Especially not during a pandemic. The Administration should reverse this decision. https://t.co/1hO2ooOeaD
1245356894434267137,2020-04-01 14:26:35,"The next 10 years in our country will be determined by the results of the next few months. We must make sure everyone is counted. Over $1 trillion of federal aid is at stake! 

And you can do it safely from home. Go online to https://t.co/1ASxiOLFin to be counted! #CensusDay"
1245340145492115456,2020-04-01 13:20:02,"RT @hansilowang: IT'S CENSUS DAY!
IT'S CENSUS DAY!
IT'S CENSUS DAY!
IT'S CENSUS DAY!
IT'S CENSUS DAY!
IT'S CENSUS DAY!
IT'S CENSUS DAY!
IT'…"
1245320204265173000,2020-04-01 12:00:48,"RT @MSNBC: Rep. Judy Chu on the increase of anti-Asian incidents in the US:

""These are very, very alarming and they're not helped by Presi…"
1245099816381792256,2020-03-31 21:25:03,"Confused by this tweet without context? Well, today, the President rolled back clean emissions standards for vehicles - against even the wishes of car makers. But polluting the air is unpopular so he's doing what he does and is lying to you, claiming to have done the opposite https://t.co/Pe8onXn1L1"
1245079020653477890,2020-03-31 20:02:25,"RT @CAPAC: This #EqualPayDay, remember that AAPI women are not a homogeneous group. If you disaggregate AAPI data, it shows that Southeast…"
1245049161684340737,2020-03-31 18:03:46,"The #wagegap cannot be explained away. It persists across industry and occupation, regardless of experience or education and has devastating effects of women's ability to care for themselves and their families. #EqualPayDay https://t.co/9oPbQzKInH"
1245010051062005761,2020-03-31 15:28:21,"Every time President Trump refers to the ""Chinese virus,"" he is stoking anger and fear, which puts AAPI's at risk. My @MSNBC interview today on xenophobia and what more Congress can do to help us through this crisis. https://t.co/myKROvZBQT"
1245005790945173504,2020-03-31 15:11:26,"RT @aaldef: .@RepJudyChu tells @AymanM @MSNBC that at least 1,000 incidents of anti-Asian violence due to #coronavirus were reported in las…"
1244994136782123009,2020-03-31 14:25:07,"Going live on @MSNBC with @AymanM at ~10:30 am ET today to talk about coronavirus, anti-Asian xenophobia, and what else Congress needs to do to help our country get through this. Join me!"
1244741307182047233,2020-03-30 21:40:28,So grateful for friends and allies like you. Trump has tried to pit immigrant and communities of color against each other - but we have never been more united in standing up to xenophobia and bigotry. https://t.co/LoNglG1ftc
1244738649746538496,2020-03-30 21:29:54,"RT @RepBarbaraLee: Powerful words from my friends @RepGraceMeng, @RepJudyChu, and @RepMarkTakano. Calling coronavirus the “China Virus” isn…"
1244710372675911705,2020-03-30 19:37:33,"RT @CAgovernor: If you have a background in health care, your state needs you!
 
Medical providers, behavioral health professionals &amp; healt…"
1244697884529999872,2020-03-30 18:47:55,The President admitted on national TV today that part of his reelection strategy is by disenfranchising Democrats. In a democracy we should not fear letting the people – all the people – vote. https://t.co/6uXIwXrzGy
1244686021599641601,2020-03-30 18:00:47,FACT: Legal protections ensure that data collected during the Census is kept confidential and cannot be traced back to any individual. Census data CANNOT be shared with other government agencies or outside groups. Fill yours out today at https://t.co/jkiXym5hXB. #Census2020
1244665328895959042,2020-03-30 16:38:33,"RT @IAmAmnaNawaz: I asked about what #AsianAmericans in smaller, more rural communities - who don't feel empowered to report hate incidents…"
1244664231502450689,2020-03-30 16:34:12,"RT @IAmAmnaNawaz: .@RepJudyChu says their reporting tool has received 100+ reports a day of anti-Asian American incidents. That, she believ…"
1244627844506030080,2020-03-30 14:09:36,"Here's to all the women - especially women of color - who have been told their strength is anger or their determination is threatening, and who have been strong enough not to quit https://t.co/m6JQxfE8W6"
1244396483107082242,2020-03-29 22:50:15,"RT @nytpolitics: “These stereotypes have been here for decades,” Representative Judy Chu, Democrat of California, said. “They’re always kin…"
1243615916027531264,2020-03-27 19:08:34,"This bill isn't perfect and it isn't sufficient - we still must do more to support families during this crisis. But it's bipartisan, timely, and targeted and I'm proud that we are getting support and $$ to healthcare workers and families across the US https://t.co/sT7aR2lmKm"
1243605956094763009,2020-03-27 18:28:59,Our healthcare workers are putting themselves at risk to fight #coronavirus &amp; they deserve our help. That is why President Trump must use the Defense Production Act to immediately begin production on masks and ventilators. We cannot wait. #DefenseProductionActNOW #MasksNow https://t.co/gqa1V4uiSi
1243553719217795072,2020-03-27 15:01:25,"EPA's regulations are meant to keep people safe and healthy, particularly from respiratory illnesses. It's irresponsible &amp; unforgivable to use a pandemic as an excuse to make more people sick so oil companies can profit. https://t.co/xHrETMM6CM"
1243539784318046212,2020-03-27 14:06:03,"RT @CAPAC: It's not hard. Here are some concrete measures to take:
- Stop calling it the ""Chinese"" or ""Wuhan virus""
- Translate federal #CO…"
1243280008614940674,2020-03-26 20:53:47,Thank you @sethmoulton for taking the time to talk to me about this resolution and the Asian Americans who it impacted. I look forward to continuing our work together. https://t.co/bN3bLPQlah
1243253251853729794,2020-03-26 19:07:28,"Happy birthday to @SpeakerPelosi, a true leader! https://t.co/KE8DKtFHsG"
1243204466494619652,2020-03-26 15:53:37,"President Trump has refused to fill many high level gov't positions, because, in his words, ""We don't need all of the people. You know, it's called cost-saving."" He's also said, ""I'm the only one that matters."" But he's not, and we're all paying the price. https://t.co/gQOXFZFTNS"
1243173594458357760,2020-03-26 13:50:56,"3.3 million Americans filed for unemployment insurance (UI) last month. This is a crisis &amp; we are ready to respond. This week, the House will vote to send $1200 to every adult &amp; $500 to every child, extend UI for 13 weeks, &amp; provide an additional $600 in UI so nobody misses wages"
1243161846187687937,2020-03-26 13:04:15,"RT @CAPAC: #ICYMI: Earlier today, #CAPAC First Vice Chair @RepGraceMeng introduced a congressional resolution to denounce anti-Asian sentim…"
1242868817262514176,2020-03-25 17:39:52,"Global &amp; US health experts say labeling a disease by geography is harmful. But it's clear this administration is willing to endanger Asian Americans, hamper the global response, and hold back the economy just to direct anger and blame away from Trump. https://t.co/2aY7yYL6Yz"
1242800594437451778,2020-03-25 13:08:46,"RT @jbendery: “This resolution puts American lives in danger,"" said Rep. Judy Chu (D-Calif.), who chairs the Congressional Asian Pacific Am…"
1242574010019450881,2020-03-24 22:08:24,"RT @RepDavidTrone: The rise of racism &amp; violence towards the Asian American community must end. Now is the time to come together, not place…"
1242542673426370561,2020-03-24 20:03:53,"Thank you, Brad! https://t.co/chMmmOlup9"
1242537377861718017,2020-03-24 19:42:50,"As Chair of @CAPAC, I am fighting to stop the racist attacks on AAPIs - that must include fighting rhetoric that directs anger and fear at Chinese people, per @CDC's guidance. https://t.co/DYmmFdkVIS"
1242530357343379457,2020-03-24 19:14:56,This isn't North Korea - our lives shouldn't depend on having to praise the President. That's why I voted for emergency funding for supplies &amp; why I'm urging Trump to use the Defense Production Act immediately https://t.co/Bl6zTjsF9h
1242438690019905536,2020-03-24 13:10:41,"RT @kimmythepooh: I spoke to @RepJudyChu , chair of the AAPI caucus, who said his comments wouldn't ""be necessary if he &amp; his supporters ha…"
1242208212599869442,2020-03-23 21:54:51,"Thank you President Trump for this important reminder.

But it wouldn't be necessary if you hadn't repeatedly rejected the advice of experts who said your use of ""Chinese virus"" was inciting violence &amp; prejudice. If you want to protect Asian Americans, stop using the term https://t.co/pz55fiqB60"
1242141100573372417,2020-03-23 17:28:10,"That's GREAT! If that's the case, you'll apologize for defending calling it the ""Chinese virus"" - something Dr. Fauci said he would ""never"" do, as have all healthcare professionals. Arguing otherwise is ""political punditry"" https://t.co/Q0XY9ChAv0 https://t.co/IW57ozWXL3"
1242138011002966024,2020-03-23 17:15:54,"RT @weijia: “But unlike 2001, when President George W. Bush urged tolerance of Muslim-Americans, this time President Trump is using languag…"
1242135152907649028,2020-03-23 17:04:32,The President needs to act now and use the Defense Production Act to ensure our medical providers have the equipment they need to save lives. https://t.co/nGwW8L8Rif
1242116545578504194,2020-03-23 15:50:36,"Every public health official, including Dr. Fauci, agrees. Calling it the ""Chinese virus"" is bad for public health. 

https://t.co/eQTNrvWiws https://t.co/5AFGg7Yl64"
1242109774931640320,2020-03-23 15:23:42,"Every time Trump insists on using the term ""Chinese virus,"" he is encouraging these exact types of attacks. He is inciting violence to avoid blame for his own failures. We warned that this is what follows when you reject expert advice &amp; blame whole groups: https://t.co/0PJW52LgaV"
1242083547327934467,2020-03-23 13:39:29,"Happy 10th birthday to the ACA! W/out this law, 20 million+ Americans would be without health insurance right now. Guaranteeing that everyone can access and afford healthcare has never been more important. That's why I'm committed to #protectourcare &amp; expanding the ACA."
1241853993543962624,2020-03-22 22:27:19,RT @SenKamalaHarris: .@RepJudyChu is absolutely right. The rhetoric coming out of the White House is fanning the flames for racist and xeno…
1241411681370148864,2020-03-21 17:09:43,"My heart goes out to the family and friends of Jeffrey Ghazarian, a 34 year-old man whose life was taken away much too soon by #COVID19

https://t.co/9xCVROBdgo"
1241410128743718913,2020-03-21 17:03:33,"RT @CNNPolitics: Rep. Judy Chu, the first Chinese-American woman elected to Congress, says President Trump’s use of the term “Chinese virus…"
1241037685030035457,2020-03-20 16:23:36,"Calling it “Chinese Virus”:
❌ gets more people tested
❌ provides hospitals with ventilators 
❌ prepares communities to respond 
❌ is a more accurate name
✅ endangers Asian Americans by stoking fear and anger (according to the CDC) https://t.co/q96f4F5UXY"
1241034604632563714,2020-03-20 16:11:21,"This order is for the health and safety of everyone. It will take a true joint effort to stop the spread of #coronavirus and save lives. 

You can still go out for essentials like groceries and medicine, but please practice social distancing, and stay home if you can. https://t.co/1p5zQJ8sXb"
1240977305641586689,2020-03-20 12:23:40,"Our whole economy is being impacted by #coronavirus, &amp; so we need a response just as big. When Democrats next discuss our stimulus plans, I plan to bring up the need to support gig &amp; freelance workers too - like artists &amp; technicians who've lost work in the entertainment industry"
1240756960640806912,2020-03-19 21:48:06,"RT @CAPAC: Here it is in black and white. This is a choice Trump intentionally makes to divide us because he needs you to be mad at China,…"
1240732918332481537,2020-03-19 20:12:34,Do you have questions on #coronavirus? Join me for a Facebook live conversation with local health experts HAPPENING NOW.  https://t.co/9Nhwj2RZOG
1240722893199335431,2020-03-19 19:32:43,To all the healthcare workers showing up throughout this crisis. And to the parents who are suddenly now teachers &amp; day care staff in addition to their regular work https://t.co/tx9WHQN7Zz
1240667505011630086,2020-03-19 15:52:38,"No matter how much he calls it the ""Chinese virus,"" no matter how many hate crimes he incites, Donald Trump cannot hide from his own failure to address this crisis from the beginning. Bigotry will not produce more tests. Racism does not provide ventilators to hospitals."
1240628713903046658,2020-03-19 13:18:29,"Hey @JohnCornyn, you are using the same words as Katherine's high school bully. Your words - racist and childish as they are - have an impact, and people will be hurt. 

https://t.co/T6GhpHYEtC"
1240618133733376001,2020-03-19 12:36:27,"RT @nicholaswu12: ""At this point, Republicans have made a calculation that it is in their best interest to use people of Chinese ethnicity…"
1240618037692305408,2020-03-19 12:36:04,"RT @Eugene_Scott: Trump “seems to not be very concerned that there are these acts of xenophobia and scapegoating against Asian Americans,”…"
1240409310359891968,2020-03-18 22:46:39,You are the only ones trying to divide us. The WHO said don’t do this. The CDC said don’t do this. Your own HHS Secretary said don’t do this. You’re choosing something that experts say is wrong and dangerous because you WANT division &amp; bigotry. https://t.co/R2XN9Pp1WG
1240367777061449734,2020-03-18 20:01:37,"A reminder that before things got really bad and he had to shift blame, Trump knew the name of the virus and had a different line on China. https://t.co/OoFe8OZqlF"
1240346192715939841,2020-03-18 18:35:51,"RT @CAPAC: No, @realDonaldTrump, we don't agree. This language puts us in danger. Already, we have seen violence, hate speech, prejudice, a…"
1240318463073300485,2020-03-18 16:45:40,"Thank you @CeciliaVega for asking the President why he disagrees with his own administration by insisting on using the racist and inaccurate term ""Chinese virus."" The experts have weighed in. He is choosing racism."
1240317655745204231,2020-03-18 16:42:27,"The virus has a name. Trump is choosing racism. AGAIN. 

https://t.co/X93R1mJlAE https://t.co/4p0qfiA24o"
1240316302465683456,2020-03-18 16:37:05,RT @WaysMeansCmte: The House's #coronavirus legislation would provide funds to help states process Unemployment Insurance claims and applic…
1240310405160976386,2020-03-18 16:13:39,"RT @CAPAC: ""By telling people who to blame, they are telling people who to fear and who to hate. Unfortunately, we have already seen how th…"
1240289340116385792,2020-03-18 14:49:56,"ICE officers could be helping people get food and supplies at a time like this instead of spreading more fear. If this is the one thing the Trump Administration can keep up, it shows where their priorities really are: prejudice, not safety https://t.co/7o6CBGCgc6"
1240260003392622592,2020-03-18 12:53:22,"They know it has a name. They're intentionally changing it now to a racist and xenophobic name because people are understandably concerned, so Republicans are trying to direct fear &amp; anger at Chinese people, not Donald Trump. https://t.co/UMeMRWNO1x"
1240259802225192961,2020-03-18 12:52:34,"It's not about China, it's about the Chinese people here - or even those who just look Chinese - who will be subjected to violence and prejudice. 
 
Pointing to something from 100 years ago doesn't matter b/c naming conventions changed to avoid xenophobia &amp; improve public health https://t.co/QU8oOpEd93"
1240026239852838915,2020-03-17 21:24:28,"I'm noticing that it's mostly white men who are so quick to tell us that ""Chinese virus"" isn't a racist term. Maybe because they're not on the receiving end of the violence and prejudice it incites."
1240018128689659906,2020-03-17 20:52:14,"The next time Republicans push a corporate tax cut for its ""trickle down"" effects, remember there was a bipartisan consensus that giving that money directly to consumers is faster and guaranteed to help. Tax cuts for corporations just enrich corporations. https://t.co/1aFFrceuGU"
1240015347719245825,2020-03-17 20:41:11,"RT @CAPAC: By calling it the ""Chinese Virus"", the president is putting people in danger. Today, @CAPAC joined with @HispanicCaucus, @TheBla…"
1239951654235111426,2020-03-17 16:28:06,"REMINDER: USCIS announced that immigrants who get medical attention for COVID19 symptoms (cough, aches, fever) will NOT be penalized under the Public Charge rule. This is important. Please help spread the word that if you are sick, you should see a doctor, regardless of status."
1239728092123410444,2020-03-17 01:39:44,"RT @jersiegel: “The Chinese Virus.” 

This is the kind of language that @RepJudyChu told me is dangerous, xenophobic, and reinforces stereo…"
1239707140698378240,2020-03-17 00:16:29,"Stop calling it Chinese Virus! By ignoring your own experts, you are putting people in danger from racism and violence. https://t.co/RU7JmHwFxk"
1239672738756923402,2020-03-16 21:59:47,Theses loans should be available to everyone. That is why I reached out to SBA to urge that they make all COVID-19 materials and loans available in Asian languages. https://t.co/ToR5pTYqCu
1239672484858925056,2020-03-16 21:58:47,"The emergency funding for #smallbiz we approved in our 1st coronavirus supplemental is now available in CA! If #coronavirus is hurting your small business, you may qualify for an Economic Injury Disaster Loan. Find out more and start your application here: https://t.co/ngxU1VCudT"
1239588978212380681,2020-03-16 16:26:57,"RT @lapublichealth: Together, we can “flatten the curve” by practicing social distancing, staying home when sick, and washing hands often.…"
1239037329836322817,2020-03-15 03:54:54,RT @HispanicCaucus: The CDC’s materials regarding coronavirus are still not accessible in all languages used in the US. #TriCaucus is calli…
1239037113905098752,2020-03-15 03:54:02,RT @PasadenaGov: We're committed to disseminating #COVID19 information and preventative measures based on science and what public health of…
1238902577514905600,2020-03-14 18:59:26,"To do otherwise promotes stigma
and encourages hateful acts like this.  Times like these require our communities to work together to stop the spread of racism that is putting lives at risk."
1238901666969255936,2020-03-14 18:55:49,This is right across from my office. Racism and xenophobia of this kind have absolutely no place in my district or our country. It’s exactly why I have demanded that our elected officials act responsibly and immediately stop calling COVID-19  the “Chinese” or “Wuhan” Coronavirus. https://t.co/y7LJU1XzKS
1238606418212794371,2020-03-13 23:22:36,"Keeping everyone safe from #coronavirus is a team effort and I’m proud to be doing my part by voting for the bill today that will let workers stay home without losing their paycheck or their job, which can mean missing meals or rent payments. So please, stay home if you are sick!"
1238533238722826243,2020-03-13 18:31:49,When you're more focused on justifying your racist agenda than you are in addressing a pandemic... https://t.co/El7HPMO0Rx
1238492623230455808,2020-03-13 15:50:26,Fox News is a threat to public health. https://t.co/NFySFY9nlw
1238466210955747329,2020-03-13 14:05:28,"A virus's name should be descriptive &amp; helpful to epidemiologists and the public. That includes symptoms or cause. It does not include region or nationality. In @Newsweek, I explain why calling it the ""Chinese coronavirus"" is putting people in harm's way.  https://t.co/unDZbh8jTh"
1238230297243791360,2020-03-12 22:28:02,"RT @GavinNewsom: BREAKING: CA has waived the 1 week waiting period for those unemployed or disabled as a result of COVID-19.

If a medical…"
1238229366858973186,2020-03-12 22:24:20,"China didn't ""unleash"" anything. A virus spread, as viruses do. Blaming China &amp; insisting on calling this the ""wuhan"" virus even though every medical expert said not to, is putting people's lives in danger. Stop politicizing this &amp; put people first! https://t.co/RLM8SXJhdq"
1238123833799909377,2020-03-12 15:24:59,"At this point, there's just no other way to say it. 
Republicans are promoting racism. 
They are putting people's lives in danger.
They have been warned by health experts not to. 
And they do not seem to care. 
They are being reckless with people's lives. https://t.co/vxzE3Kaft2"
1238123524046405633,2020-03-12 15:23:46,"Due to #COVID19, the US Capitol has been closed to the public until April 1. If you had a tour scheduled with us, my office will be in touch with you about updates. Please feel free to call with any questions. And remember to wash your hands!"
1237779506439557120,2020-03-11 16:36:45,"The House right now is debating my #NOBANAct to repeal President Trump's cruel #MuslimBans. But, true to form, Republicans are being dishonest about it. My bill in NO WAY hampers our #coronavirus response. In fact, there's explicit language about protecting public health."
1237776459697135618,2020-03-11 16:24:39,RT @UFWupdates: .@UFWupdates stands with @RepJudyChu in demanding an apology from @GOPLeader McCarthy for his xenophobic nationality based…
1237775817826074624,2020-03-11 16:22:06,RT @BillPascrell: Yesterday my @WaysMeansCmte colleagues and I called on the IRS to extend tax filing season and the Treasury Dept is today…
1237774724173832193,2020-03-11 16:17:45,"HHS @SecAzar said don't do it. 
The @CDCgov said don't do it.
The World Health Organization said don't do it all the way back in 2015. 
Labeling a virus by country/ethnicity puts people at risk. So my question to the Republicans is: Why are you choosing to ignore the experts?"
1237521802684964865,2020-03-10 23:32:44,"We can even go back to 2015, when the World Health Organization put out this document on how to name a new disease, specifically saying it MAY NOT include a geographic location. https://t.co/HKyUejLTOG

So what's the justification for insisting on the opposite?"
1237518510349139968,2020-03-10 23:19:39,RT @SpeakerPelosi: Bigoted statements which spread misinformation and blame Asians and the Asian American community for #coronavirus make u…
1237517539271270401,2020-03-10 23:15:47,"@CDCgov @HHSGov @GOPLeader @SecAzar And if that's not enough, @GOPLeader, this is the CDC's Chief Medical Officer on 2/28 saying that ""Stigma is the enemy of public health."" https://t.co/UV0PMXvcoj

There's nothing new about this. Please listen and apologize."
1237516447661744129,2020-03-10 23:11:27,"@CDCgov @HHSGov @GOPLeader For your records, @GOPleader, here's the letter you received on February 26 asking you not to spread xenophobia &amp; misinformation: https://t.co/jk3BAQXdS2

And here is @HHSGov @SecAzar that same week testifying that he won't use the term: https://t.co/YHXisY8NsY"
1237515908001587202,2020-03-10 23:09:19,"This is a poor way to respond when told your words are putting people's lives in danger. @CDCgov and @HHSGov agree. And it's also not true. I sent @GOPLeader &amp; all members a letter urging them not to do this in February. But instead, he doubles down. https://t.co/hLMnh2EUY4"
