id,created_at,text
1225091296756453376,2020-02-05 16:18:20,"“I think it's time to get rid of this whole National Basketball Association. Call it the TBA, the Thug Basketball Association, and stop calling them teams. Call 'em gangs.” https://t.co/EyN2HQggO1"
1225091230004019215,2020-02-05 16:18:04,He called Sandra Fluke a “slut” and a “prostitute” for using birth control and advocating for it to be free under the ACA https://t.co/bdHUV6IAGJ
1225091134512422913,2020-02-05 16:17:42,"And now, a thread of racist, sexist, homophobic, ableist, and otherwise hateful quotes from Presidential Medal of Freedom winner Rush Limbaugh. You tell me if you think this represents the best of America:"
1225076042655838208,2020-02-05 15:17:44,You should be more upset by the President tearing apart families than the Speaker tearing apart a piece of paper.  #SOTU
1224895320687108102,2020-02-05 03:19:36,"Missing from Trump's speech about guns were the daily victims of gun violence. But @fred_guttenberg won't let us forget those like his daughter, Jaime. Thank you for speaking out! #SOTU"
1224893329214791680,2020-02-05 03:11:41,Trump said he wants to pass paid family leave but does America know that the Republicans want to do it by taking from their future social security earnings? #SOTU
1224891646745227265,2020-02-05 03:05:00,"Immigrants make our country safer and our economy stronger. California, which is majority minority and thriving, is a proud example of that. Isolating individual incidents as a way to build resentment of a whole group is bigotry and it is dangerous. #SOTU"
1224888427637886977,2020-02-05 02:52:13,"President Trump says he wants to lower drug prices, but #HR3 - a bipartisan bill to lower costs of healthcare - is sitting in the Senate waiting for action."
1224886418926919681,2020-02-05 02:44:14,"If the President really wanted to protect pre-existing conditions, he'd drop his lawsuit to end the #ACA. #SOTU"
1224885768717524997,2020-02-05 02:41:39,Putting children in cages puts limits on their future. #SOTU
1224880378818781191,2020-02-05 02:20:14,"Kicking people off of food stamps is not lifting people out of poverty. More hungry families is not an accomplishment. 

And because #SNAP works, the average time on it is only 9 months. #SOTU"
1224879179222650881,2020-02-05 02:15:28,The trade agreement Donald Trump negotiated was anything but fair. Not until the Democrats spent months negotiating stronger and enforceable labor and environmental provisions. #SOTU
1224877245401047040,2020-02-05 02:07:47,"Immigrants commit fewer crimes, the #MuslimBan has made us less safe, a tax cut for the rich only helps the rich, and suing to repeal the ACA is not protecting the ACA. Follow along for necessary #SOTU fact checks and corrections like these."
1224789747689717766,2020-02-04 20:20:05,"For tonight’s #SOTU, I’m calling on President Trump to drop his lawsuit to repeal the Affordable Care Act &amp; instead work with us to pass the Lower Drug Costs Now Act. #StateOfHealthCare https://t.co/3BYYPluJA7"
1224736561444638721,2020-02-04 16:48:45,RT @MuslimAdvocates: CONGRATULATIONS! Our client Ismail will be @RepJudyChu's #SOTU guest! His family was torn apart by the #MuslimBan. Ton…
1224726757183500288,2020-02-04 16:09:47,"RT @WaysMeansCmte: Whatever President Trump says about health care during tonight’s #SOTU, remember, he supports dismantling our current sy…"
1224459914006945795,2020-02-03 22:29:27,"If you're worried about the spread of #coronavirus....

DO: wash your hands regularly and thoroughly.

DO NOT: spread fear of Asian people. 

Only one of these is proven to reduce the spread of disease. https://t.co/ozGqQrg4gM"
1224413717569462274,2020-02-03 19:25:53,"Exactly. Trump and Stephen Miller lack any justification for this policy. And that's why my #NOBANAct is so necessary: it requires actual evidence in order to implement a ban like this. Also, Nigeria happens to be the world's fifth largest Muslim population. Coincidence? https://t.co/Puwevfv5Ly"
1224406599940345856,2020-02-03 18:57:36,"This year, #BlackHistoryMonth came just 1 day after Trump extended his #MuslimBan to 4 African countries, making it more important than ever to remember and celebrate the contributions that Black Americans have made throughout our history &amp; despite the worst prejudice &amp; injustice"
1224406454251278338,2020-02-03 18:57:01,"Despite the worst prejudices, black Americans have responded with faith and hope. Faith in democracy and American values. Hope that equality will win out. As we mark the beginning of #BlackHistoryMonth, we have to continue our work of ensuring equality and opportunity for all https://t.co/3aNbGmwR9z"
1224403036610727936,2020-02-03 18:43:26,President Trump should have to face the families he has inflicted this pain on. That's why I'm proud to announce that Ismail will be my guest to tomorrow's State of the Union. https://t.co/HiA9bkRgsZ
1223786601043591168,2020-02-02 01:53:57,RT @RepCarbajal: The president continues to vilify Muslims and people of color. This ban is more of that same hate and more failed policy.…
1223786411280695296,2020-02-02 01:53:11,"RT @SXMProgress: “To me, it is still a Muslim ban... There is no policy basis.”

California congresswoman @RepJudyChu tells @DeanObeidallah…"
1223387288253751296,2020-01-31 23:27:13,"By specifically targeting families, &amp; not impacting short-term visitor visas, this ban shows it was never about security and always about keeping Muslims and people of color from having a chance at the American Dream. My statement on the new #MuslimBan: https://t.co/VTcoYroJgE"
1223386747461079040,2020-01-31 23:25:04,RT @LeaderHoyer: The expansion of President Trump’s illegal Muslim ban will continue to harm America and put our people and economy at risk…
1223360775374458882,2020-01-31 21:41:52,"Despite claiming the #MuslimBan was about national security, this ban specifically targets visas for permanent residents - meaning the intention is to separate families. That's why we need my #NoBanAct which requires actual evidence of a threat - exactly what this ban is lacking https://t.co/Ta5qQJGUeZ"
1223309178095185920,2020-01-31 18:16:50,"My thoughts are with my friend and colleague @RepJerryNadler right now. He has done a remarkable job in this impeachment trial, but now is the time to be with family and we are all hoping for a full and speedy recovery for his wife. https://t.co/Ace4LqGMiu"
1223289706894503938,2020-01-31 16:59:28,RT @RepSpeier: .@HouseDemWomen just sent a letter to @POTUS condemning his denigration of women. It's as if he relishes the opportunity to…
1223279736941686785,2020-01-31 16:19:51,"For anyone needing to understand how Trump's immigration policy is not about safety but about arbitrary cruelty, you must read this incredible investigation by @DLind about a family torn apart at the border. We cannot keep our eyes closed to these horrors. https://t.co/YRjQZZorYu"
1223265903401488387,2020-01-31 15:24:53,Let me make it clearer: Members of Congress cannot use public funds to promote our election or even mention an opponent. That's good &amp; right. But the Senate is giving Trump permission to use foreign aid to demand election interference. And choosing not to punish. https://t.co/hxTr9V0ENY
1223260928852086785,2020-01-31 15:05:07,"Confirming the House made our case that the President is guilty of interfering in an election and ""undermining the principle of equal justice"" but choosing not to convict is granting permission to this and future presidents to interfere in elections as much as they want https://t.co/uCBtIzI3Cl"
1223013431688728577,2020-01-30 22:41:39,There's no better metaphor for Trump being all show and no substance than his pointless border wall being knocked down by a strong wind. He's wasting taxpayer money to stir up xenophobia and look tough. Watch the video to see where it's gotten us. https://t.co/gvUY2DDh20
1222993394894614536,2020-01-30 21:22:02,"Iran is a threat to American interests, but as the Iran Nuclear Deal showed us, conflict is not inevitable. We do not need a war with Iran. That is why today, I voted to reclaim Congress's power, repeal the 2002 #AUMF, and prohibit any funding for an unauthorized war. https://t.co/rwMcpUePkg"
1222924962316673024,2020-01-30 16:50:06,"This disconnected patchwork of enclaves, divided and surrounded by Israeli settlements is not a viable Palestinian state. Today, I joined my colleagues in a letter to President Trump rejecting this sham plan and opposing unilateral annexations &amp; urging a true two-state solution. https://t.co/CuYtAgmR6p"
1222666564664688641,2020-01-29 23:43:19,"With news of #coronavirus cases in LA County, I want to share some ways to keep you and your family safe: 
- Wash your hands thoroughly 
- Avoid close contact with people who are sick
- Avoid travel to China
- Stay up to date w/ information from @CDCgov &amp; @lapublichealth https://t.co/uezB2sPqUv"
1222624311615414272,2020-01-29 20:55:25,"Over 5 years of reporting in Syria, @waadalkateab documented the destruction of Aleppo and the intentional targeting of hospitals, like the one she ran with her husband. Now, her incredible documentary, @forsamafilm has been nominated for an Oscar. It was an honor to meet  her. https://t.co/h52N8OPdQw"
1222615443892064256,2020-01-29 20:20:11,This is an incredibly troubling argument that a President can do anything they want in order to keep themselves in power. It's a recipe for tyranny. President Trump had corrupt intention in asking Ukraine to interfere in our election. https://t.co/oKjxjab9mn
1222566304361656320,2020-01-29 17:04:55,"The trade deal the President signed is not the trade deal he originally got. That's because Democrats spent months working w/ the administration to make the new NAFTA a deal that actually helps workers and protects the environment. I'm proud of our work, even if Trump ignores it. https://t.co/kVYnc0DO9C"
1222544693432672256,2020-01-29 15:39:03,@HouseDemWomen Democratic women...Assemble! https://t.co/vUKufLjwrE
1222531535204683777,2020-01-29 14:46:46,"America's debt is on track to hit $1 trillion - 98% of our economy - by 2030. This is the direct outcome of the #GOPTaxScam. Despite what they claimed, tax cuts for the rich don't pay for themselves, they're paid for by you and your children. https://t.co/zLoIsEkk4S"
1222292701145595904,2020-01-28 22:57:43,"Who wore it best?

So great to have @ChrisEvans back on the Hill today to talk about how we can help more Americans understand and engage in politics, not by fighting, but by hearing each other out. https://t.co/2oedHrBCML"
1222188116309618689,2020-01-28 16:02:08,"Paid Family and Medical Leave is as essential for strong families as it is for a strong economy. Nobody understands that better than @JoanLunden, who shared her experiences today with @WaysMeansCmte https://t.co/cQuMEPDhHS"
1221971849640316928,2020-01-28 01:42:46,"RT @AmerIndependent: ""It is time to end the arbitrary punishment of the Muslim American community,"" write @RepJudyChu, @RepJayapal, and @Re…"
1221859835500691457,2020-01-27 18:17:40,"As part of #HolocaustMemorialDay commemorations, I joined an event to read the names of the 6 million Jews who were killed. Reading their names ensures they are not forgotten. Standing up to anti-semitism and bigotry is our responsibility. #NeverAgain is our promise. https://t.co/AYa6EcBUKm"
1221844077177704450,2020-01-27 17:15:03,"There's a time tested way of proving this: You and your associates testify under oath to tell the truth, the whole truth, and nothing but the truth. Hiding and blocking witnesses is a cover up. https://t.co/5N3ACCwbOL"
1221835434868772864,2020-01-27 16:40:42,"White nationalists like Stephen Miller think America belongs only to white people. Clearly they are wrong. And so is the cruel Muslim Ban. On the 3rd anniversary of this hateful policy, I'm proud to stand with Sen. @ChrisCoons to announce a markup of our #NoBanAct! https://t.co/zpRWHTmpdd"
1221834458510307328,2020-01-27 16:36:50,"RT @AmerIndependent: Trump's Muslim ban is keeping us divided. It's time to repeal it.

by @RepJudyChu @RepJayapal @RepMaxRose https://t.co…"
1220771708044546048,2020-01-24 18:13:50,"Donald Trump would rather nobody have healthcare than allow women to have complete healthcare. Abortion care is safe, legal, healthcare. And Trump should not hold all Californians hostages in his war on women. We will fight this. https://t.co/QH1ITtPXkg"
1220770069468405760,2020-01-24 18:07:20,"RT @RepAdamSchiff: Donald Trump must be convicted and removed from office.

Because he will always choose his own personal interest over ou…"
1220381052574801921,2020-01-23 16:21:31,RT @RepValDemings: The second article of impeachment was for obstruction of Congress: covering up witnesses and documents from the American…
1220047399843921922,2020-01-22 18:15:42,Today’s the anniversary of #RoevWade &amp; it’s never been more important. Our right to make choices about our own bodies is under attack &amp; even the future of Roe is uncertain. That’s why we need the Women’s Health Protection Act to finally enshrine Roe in law for all of us! #RoeIRL
1219747979957088257,2020-01-21 22:25:54,"Now that SCOTUS has upheld Trump's #MuslimBan, he wants to go further. We know this has nothing to do w/ security &amp; everything to do w/ bigotry. That's why we need the #NoBanAct to repeal this ban and require actual evidence of a threat, not just prejudice https://t.co/H8OgmkwUJr"
1219647392489799682,2020-01-21 15:46:12,The Senate is engaged in a cover up. No evidence. No witnesses. Forcing testimony into midnight hours when nobody is watching. These are not the actions of people who believe the President is innocent. This is the behavior of accomplices. #DefendOurDemocracy https://t.co/F21Yj0sV8u
1219367834846932995,2020-01-20 21:15:21,"RT @RepJeffries: Never give up.

Never give in.

Keep the faith.

Keep our eyes on the prize.

America is a much better place today because…"
1218992874727133184,2020-01-19 20:25:23,"I’m so proud to serve with such an incredibly courageous woman! @RepPressley, your strength is an inspiration. https://t.co/hRs7VZFjyU"
1218295727610322944,2020-01-17 22:15:10,"RT @CAPAC: 🚨 There is no citizenship question on the #2020census and all information is strictly confidential! 🚨

@CAPAC has been working t…"
1218286654819110912,2020-01-17 21:39:07,"If the Trump administration wins this suit, a student or employee at a university could be denied birth control because of somebody else's religious beliefs. That is not religious freedom. Instead, the Trump administration is using religion as an excuse to deny women healthcare https://t.co/2CxFbqqXdE"
1218262692831645696,2020-01-17 20:03:54,"RT @Haleaziz: Over 30 Dems. are calling for a vote on @RepJudyChu's bill  to repeal the travel ban, called the ""NO BAN Act."" 

This comes j…"
1218255119587913728,2020-01-17 19:33:49,Corrupt people trying to make corruption easier. https://t.co/U3z8UxE0aR
1217920048624492544,2020-01-16 21:22:22,"I had a perfect phone call once. It happened on July 15, 2009. It wasn't long. Just President Barack Obama calling to congratulate me on becoming the first Chinese American woman ever elected to Congress. #tbt"
1217843450885832704,2020-01-16 16:17:59,"I don't think you know what ""witness"" means. Typically, they're a witness to the matter - like Bolton or Mulvaney who saw &amp; carried out Trump's abuse of power. Somebody unrelated to the charges is called a distraction or waste of time and would not be allowed in a court of law https://t.co/APm8IT2Rnd"
1217826990960627712,2020-01-16 15:12:35,You don't have to break a federal law to be impeached. Abusing your power for corrupt purposes &amp; obstructing Congress are impeachable high crimes. But for the President's defenders wanting to know which law he violated.... https://t.co/ATuLyAvM0u
1217585663748513793,2020-01-15 23:13:38,Isn't it funny how the Republicans' deadline for considering new evidence is always right before new evidence is discovered? It's almost as though they didn’t want documents and testimony that expose the truth. #DefendOurDemocracy https://t.co/3y2C1GOepF
1217557319678070785,2020-01-15 21:21:00,My favorite bagel is a doughnut. @TODAYshow gets it. #NationalBagelDay https://t.co/nc2UeVNwvM
1217546400868831235,2020-01-15 20:37:37,"Whether blocking witnesses or blocking the media, Senate Republicans are trying to keep the American people from seeing the truth about Trump's abuse of power. This is dangerous and undemocratic. I join the calls to let the media do their constitutionally protected jobs. https://t.co/fNjZRd8EuJ"
1217524918495141888,2020-01-15 19:12:15,"Whether fighting facts by saying ""don't believe your lying eyes"" or advocating trains full of immigrants as a scare tactic, Stephen Miller has made bigotry, fear, cruelty and lies a centerpiece of the Trump presidency. Stephen Miller has to go. https://t.co/lb5UUjbDSx"
1217468075500544000,2020-01-15 15:26:23,The President has been impeached. This is fact for the rest of time. Now it's up to the Senate to decide if a President impeached for abusing his power for political gain &amp; obstructing Congress's investigation should remain in office. #DefendOurDemocracy https://t.co/VxTEQOj87s
1217213410481491968,2020-01-14 22:34:26,"We already know the outcome of Trump's proposed food stamp rule because it's been tried before. In each state, more people went hungry and the same number of people went to work.  Applying this rule nationally will only hurt families &amp; the economy. https://t.co/9iOyMmuWjC"
1217197867418488833,2020-01-14 21:32:40,"Thanks to @Caltech &amp; @NASAJPL, SoCal has truly left our mark in space (literally. The tracks of the Mars Rover spell JPL in Morse code). But now we will be represented by an Astronaut too! I'm honored to congratulate one of NASA’s newest Astronauts, SGV's own Dr. Jessica Watkins. https://t.co/klwoXyFOU7"
1217171366706847744,2020-01-14 19:47:22,"Trump is right that Iranians deserve  better freedoms. But despite calling the Iranian people ""great"", his #MuslimBan prevents any from coming to the US to claim asylum, visit loved ones, or even just take advantage of open internet. We need the #NoBanAct now! https://t.co/GiwnK9JRiV"
1217151454349352962,2020-01-14 18:28:14,"From lying about celebrations on 9/11 to a ""total and complete shutdown of Muslims entering the US"", Donald Trump has preached bigotry by portraying all Muslims as terrorists. Now his administration is stating it clearly. This is disgusting, unacceptable, &amp; puts people in danger https://t.co/7mNIFZRSCu"
1217147826418933760,2020-01-14 18:13:49,"I am heartbroken by this hatred and bigotry directed at the Sikh community - which so values peace and openness. These white supremacists want us divided &amp; isolated. Instead, I urge us all to visit a Gurdwara for a Langar - a communal meal open to all.  https://t.co/L1BEjqIbF7"
1217103425122590721,2020-01-14 15:17:23,"Since the vast majority of drugs into America come through regular ports of entry, a wall won't do anything to stop them. Know what does? The DOD's counternarcotics programs. The same ones the President is stealing from for his racist vanity project. https://t.co/NeCB6sDGD4"
1216816350703820801,2020-01-13 20:16:40,"Happy #KoreanAmericanDay - the anniversary of the first Korean immigrants to the US in 1903! In the past 117 years, Korean Americans have contributed everything from food and culture to opening new businesses to serving in the military. And we are better off for it!"
1216795947763752962,2020-01-13 18:55:35,Does that mean you will also support my #NoBanAct to lift the #MuslimBan that prevents Iranians from travelling or even being able to visit family here? https://t.co/AQEgOqba5G
1216789244171247616,2020-01-13 18:28:57,RT @CAPAC: Have you ever been the only #AAPI woman in the room? Did you feel like it was on you to represent EVERY #AAPI woman? You're not…
1216782535717539840,2020-01-13 18:02:17,"On issues big and small, the President doesn't tell the truth. The President personally interfered to block key witnesses from testifying. And it's why he was impeached for Obstruction of Congress. https://t.co/4OhuqBbr5N"
1216761045357907968,2020-01-13 16:36:54,"Last year, most workers saw a raise of ~3-4%. But the cost of drugs is set to increase an average of 5%, meaning healthcare is becoming less affordable under Trump. That's why we need the Senate to pass HR 3 to empower Medicare to negotiate lower prices! 
 https://t.co/l9tfsqsQUr"
1216740468568084480,2020-01-13 15:15:08,"Incredible to see a Korean director nominated. Congratulations to Bong Joon Ho and all the other nominees. But also, congratulations to the other amazing AAPI stories, like The Farewell, and the many women who weren't nominated - including for an adaptation of my favorite book https://t.co/elV67vFBjQ"
1216728183967571974,2020-01-13 14:26:19,"The ACA is so popular that now Trump wants to claim credit it - even as he is actively supporting a lawsuit that would destroy it. 

The truth is, Trump spent his first year in office trying to dismantle the ACA. And his admin continues to work behind the scenes to sabotage it. https://t.co/sPP0tpFnvu"
1215743842319765506,2020-01-10 21:14:54,The Muslim Ban is built on prejudice and xenophobia. What it is lacking is actual evidence. And that's how we stop it. My #NoBanAct with Senator @ChrisCoons requires any President to demonstrate an ACTUAL threat before implementing any kind of broad ban like this. #NoBanActNow! https://t.co/CVoOhOIKUD
1215670904610574336,2020-01-10 16:25:04,"Every new revelation from this administration reveals that there was no imminent threat, and that Donald Trump chose to bring us to the brink of war for personal reasons. Not surprising from a President who was just impeached for using military aid to help his political campaign. https://t.co/5TwMpXy2NT"
1215650953476689927,2020-01-10 15:05:47,"That is not what ""imminent"" means. It's this kind of obfuscation, lying to Congress, and unchecked provocation that dragged us into the Iraq War. We will not allow that to happen again. Yesterday's War Powers vote will ensure that. https://t.co/BhY0XfUlkj"
1215387882002796545,2020-01-09 21:40:26,"#TBT: ""Trump revealed highly classified information to Russian foreign minister and ambassador."" https://t.co/ZzmQqo6xGh

So the President can share US Intelligence with Russia, but not with Congress? https://t.co/XKR4I3MYdD"
1215341047859027968,2020-01-09 18:34:20,"America does not need or want a war with Iran. And we will not let the President fabricate a pretext to drag us into one. Today, I’m voting to reclaim Congress’s authority to declare war. #NoWarWithlran https://t.co/nDlKAW8ufw"
1215307527916871680,2020-01-09 16:21:08,More like in spite of your administration. Your last budget proposed cutting $900 million from the National Cancer Institute - money we fought to protect. You have increased the number of uninsured. And rolled back environmental regulations that protect against cancer. https://t.co/8HJbo6dL4v
1215045368313982976,2020-01-08 22:59:24,"@GabbyGiffords 1 year ago today, we acted, in Gabby's honor, by passing #HR8 - the Bipartisan Background Checks Act. But for 1 year, this bipartisan &amp; commonsense reform supported by over 90% of Americans to require background checks on ALL gun sales has been sitting on Mitch McConnell's desk"
1215045035827302400,2020-01-08 22:58:05,"I'm so inspired by @GabbyGiffords. Since the shooting at her public event 9 years ago today, Gabby has made it her mission to #EndGunViolence w/ smart laws that actually keep Americans safe from the completely avoidable epidemic of gun violence. It's an honor to fight by her side https://t.co/P9E8zAaHqg"
1214979991072624640,2020-01-08 18:39:37,"This is what hiding from the truth looks like. Hearing from witnesses matters! The White House knows that, which is why they blocked those with information directly relevant to the impeachment from testifying. They're afraid of you knowing what they know. https://t.co/tqzEX7zeOY"
1214937424796815361,2020-01-08 15:50:29,Straight from a former Trump adviser: provoking Iran is an excuse to justify a war. We cannot allow GOP hawks to drag us into a war we do not want and with no clearly achievable goals. https://t.co/d9yUzHMDBt
1214625760192937984,2020-01-07 19:12:02,"I don't think blocking witnesses, blocking evidence, and spinning completely unfounded conspiracy theories straight off of Putin's desk is ""getting to the bottom of the facts."" https://t.co/URvBYzzkwK"
1214610142672695298,2020-01-07 18:09:59,This financial burden just to give birth is an infuriating reality. But we don't have to accept it. Solutions like Medicare for All will finally make healthcare - including pregnancy - affordable for all. https://t.co/MbeawG1uTm
1214594536921538560,2020-01-07 17:07:58,"Just once, I wish the Trump administration &amp; their allies would make a case for their actions based on fact, not lies and domestic division. Especially when it comes to something as serious as war.

Thinking that provocations make war likely &amp; peace harder =/= mourning Suleimani https://t.co/zIOcRKtCk2"
1214583596670951425,2020-01-07 16:24:29,"Despite Trump’s best efforts to serve the fossil fuel industry, US greenhouse gas emissions dropped in 2019. But it’s still not enough to meet the Paris Agreement targets. That is why the Senate must follow the House &amp; pass HR 9, the Climate Action Now Act https://t.co/CbZdhYYBob"
