id,created_at,text
1247345989863845890,2020-04-07 02:10:33,March wasn’t easy and April won’t be either. The @GovofCO spoke tonight on how we’ll overcome this— with the innovation and resiliency that has driven Coloradans for decades. We‘ll get through this together and I’ll be working with Governor Polis every step of the way.
1247232880281075713,2020-04-06 18:41:05,"The only person who should be relieved of command is Acting @SECNAV Modly. Real leaders know respect is earned, not demanded. Secretary Modly's address to the crew of USS Roosevelt is a failure of leadership. https://t.co/WykHDP7wCx"
1247195291813646336,2020-04-06 16:11:43,"Seeing Coloradans serve our community right now in hospitals and supermarkets, one thing is clear -- not all heroes wear capes. 

To show our gratitude, we’re collecting digital notes with our new initiative, Thank You Notes for Local Heroes. 

Details: https://t.co/WN3BOVGwSx https://t.co/p2Tkf9DH7U"
1246840893996503040,2020-04-05 16:43:28,"The CARES Act is the first step to getting our local governments the resources to respond to the coronavirus and its impact. CD-6 is getting $4.7 million for our counties and cities, along with $327 million for state transportation programs. https://t.co/cviM23QDzb"
1246561057075757057,2020-04-04 22:11:30,"On @HouseSmallBiz, I’m working to get Colorado businessowners the support they need. We just launched a resource guide for small businesses, so you can easily find information on local and national services.
https://t.co/Rvw8gQbLjJ"
1246464222495727622,2020-04-04 15:46:43,"The President should be using every hour of his day working to contain COVID-19, instead he’s seeking revenge on members of our intelligence community who dared to perform their duty. 

This is more than a dismissal, it’s another assault on the rule-of-law. https://t.co/Up0HwsRJJI"
1246204351309365250,2020-04-03 22:34:05,"I helped pass the Paycheck Protection Program as part of the CARES Act to help small businesses stay afloat and support their employees as we address the coronavirus crisis. The application opened today! 

Details &amp; how to apply: https://t.co/7A2IyczJtO https://t.co/6p6UCSNgW5"
1246146970206515202,2020-04-03 18:46:04,"ICE detention centers are hotbeds for COVID-19's spread, posing a threat to detainees, staff, &amp; communities. Last week, I called on @ICEgov to grant humanitarian parole to vulnerable individuals with non-violent immigration charges during this crisis

https://t.co/Gdp2p61U92"
1246124718484344832,2020-04-03 17:17:39,"Amid this health crisis, we must ensure that our servicemembers get the support they need. I talked with senior leaders at @Buckley_AFB this week about how they’re working to conduct coronavirus tests &amp; protect servicemembers while continuing critical national security operations"
1245854195804037120,2020-04-02 23:22:41,"Last month, I joined Abbay Media to discuss Congress’ response to the coronavirus and my work to support small businesses during this difficult time. Thank you to Yofta for having me and Neb on. 

To find COVID-19 resources in Amharic visit: https://t.co/itGxmmcJoF https://t.co/vorCv9IkIu"
1245842184525545473,2020-04-02 22:34:58,"Leadership means taking responsibility.

CAPT Crozier knows that, he spoke up to protect his sailors. And it may have cost him his job.

We don’t play politics with the military, especially when lives are on the line.

The Navy owes our sailors, country, &amp; Congress an explanation https://t.co/VltTL6lERR"
1245805601835409410,2020-04-02 20:09:36,"Earlier this week, we held a small business webinar bringing over 150 small business owners and advocates together to answer their questions about the federal response to the COVID-19 crisis and highlight available resources. Check out the recording here: 
https://t.co/yv0qQ5cMsL"
1245774936037351425,2020-04-02 18:07:44,"As this public health crisis continues to unfold in Colorado, I want to make sure you have the information and assistance you need. We just launched a resource guide, so you can easily find helpful information. 

https://t.co/AzfKRtitSL"
1245738414340743168,2020-04-02 15:42:37,"This is the spirit of Colorado -- when Cherry Creek teachers and students were asked to help, they were ready. 

Thankful for their work to help keep our front line health care staff safe. 

https://t.co/XuFU1VWV7x"
1245536810748514304,2020-04-02 02:21:31,"It’s #CensusDay! Have you filled out the census yet? 

Over 1/3 of Coloradans have completed it &amp; in Colorado, our district has the highest rate -- 43%! The census will be vital to determining federal funding for our schools &amp; roads

Join your neighbors-- https://t.co/qEUAF75vYG"
1245462619944890371,2020-04-01 21:26:42,"Colorado’s small businesses need help. Not next week, not tomorrow, but right now. 

As a member of @HouseSmallBiz, I called on @SBAgov to immediately share any guidance businesses need for loans that we passed in the CARES Act.

https://t.co/WfcQFqZTbe"
1245442587043004417,2020-04-01 20:07:06,"Need a productive activity while you’re staying home? Complete your census at https://t.co/qEUAF75vYG!

The census is essential to ensuring that Colorado gets the funding for our schools and infrastructure projects that we need.

#CensusDay https://t.co/sPAyHRHPsR"
1245164337666424833,2020-04-01 01:41:26,"Spoke on the phone today with @GovofCO and Colorado’s congressional delegation. We’ve been flattening the curve, but our front line health care workers need more personal protective equipment. We’re working together to secure more test kits, masks, and ventilators for Colorado."
1245148678660198401,2020-04-01 00:39:13,No person should be denied health care because of who they are. We need to support every member of our community. #TransVisibilityDay https://t.co/vxy0mdTIlP
1245126082195578885,2020-03-31 23:09:25,"Let me be unequivocal here: Leave no man or woman behind. 

This is a crisis within the crisis. The administration needs to act. Lives are at stake. https://t.co/q7dg7LcGPX"
1245096879991459840,2020-03-31 21:13:23,"With libraries closed, Libby in Centennial took it into her own hands to share her love of books with neighbors. Staying at home isn’t easy, but this is how we’re going to get through it -- as a community.

https://t.co/YLEQ8QAccQ"
1245057816328654849,2020-03-31 18:38:10,"Do you run a small business that’s been affected by coronavirus?

I’ll be hosting a webinar to discuss available resources and answer your questions about getting the support you need. We’ll be on Facebook Live at 1 pm!

🔗: https://t.co/bhjyb4PsNS https://t.co/HvP23iYSLF"
1245056748425293840,2020-03-31 18:33:55,"To the Coloradans working every day to keep our streets clean, supermarket shelves stocked, and patients safe, thank you! Through May 17th, essential workers across Colorado are eligible for free childcare. You can find details here --

https://t.co/aTGIFn55MS"
1245019629879255044,2020-03-31 16:06:25,"Last week, Congress passed the CARES Act, which expands unemployment benefits to more Coloradans who need them. Here are some of the updates. 

For more information: https://t.co/qXJu4Xm7wr https://t.co/5uuiUIGw7K"
1245015428528775168,2020-03-31 15:49:44,"RT @codepted: CDE has compiled resources and guidance to help teachers, families and students as they learn from home. Visit our website to…"
1245013007299743747,2020-03-31 15:40:06,"RT @NydiaVelazquez: A good Q&amp;A piece on how small businesses can apply for help from @SBAgov. 

Thanks @washingtonpost for covering. 

http…"
1245008413886685185,2020-03-31 15:21:51,"RT @HouseSmallBiz: Are you a small business impacted by #COVID19 looking for more info following the passage of the #CARESAct?

Here's a fl…"
1244809411136237570,2020-03-31 02:11:05,"Tomorrow, I’m hosting a webinar on resources for small businesses affected by coronavirus with Angela Atkinson from the @NorthMetroSBDC. Small business owners are invited to join via Facebook to learn more about resources &amp; get your questions answered

🔗: https://t.co/bhjyb4PsNS https://t.co/2ZnZsxjsiA"
1244765310743429120,2020-03-30 23:15:51,"This #NationalDoctorsDay, I’m thankful for every doctor and the health care workers fighting on the front line of this pandemic to keep Coloradans safe. https://t.co/Yau6RR4DEL"
1244752406715523074,2020-03-30 22:24:34,"The coronavirus is keeping many of us at home, but that doesn’t mean our work in Congress stops. Every day, I’ve been talking to Coloradans over the phone or Zoom to hear about the challenges they’re facing. Looking forward to more video calls and phone calls this week."
1244683058953031683,2020-03-30 17:49:01,"While many of the 600,000 small businesses in Colorado are forced to temporarily close during this public health crisis, they need all the support they can get. That’s why I introduced new legislation to expedite loans for more small businesses. https://t.co/nKOPJ6UB8y"
1244657660219310083,2020-03-30 16:08:05,"One way to stay at home? Order delivery from one of our amazing local restaurants --

https://t.co/SVC3qh7g2V"
1244372433219522560,2020-03-29 21:14:42,"To the doctors, nurses, firefighters, police officers, supermarket workers, and other essential employees keeping Colorado running right now, thank you! 

We’re here to support you. 

You may be eligible for free childcare: 
https://t.co/UDYJF3aznv"
1244348661473120261,2020-03-29 19:40:14,"We need to get more masks, gowns, and ventilators for our hospitals. With a request from @GovofCO &amp; bipartisan support in our congressional delegation, Colorado was just declared a major disaster area, opening up more resources for our health care workers

https://t.co/4VKQHDJeW4"
1244015100564066304,2020-03-28 21:34:47,"This week, STRIDE Community Health Center opened up a drive-thru testing location so folks can easily be tested in Aurora without leaving their car. Details: 
https://t.co/54yz5WHJ1B"
1243726725193904128,2020-03-28 02:28:53,"This is what legislating in the era of COVID-19 looks like. Hosting a telephone town hall from the airport with a medical expert and nearly 4,000 Coloradans to discuss how to keep families safe, what to expect from the new stimulus bill, and your concerns. https://t.co/zA0K05xhPT"
1243709302424158209,2020-03-28 01:19:39,"LIVE: I’m doing a telephone town hall to answer your questions on the coronavirus and the CARES Act we passed today. Join here:
https://t.co/3Ow7a6M1PF"
1243652191056998401,2020-03-27 21:32:42,"TONIGHT: I’ll be hosting my second telephone town hall to answer your questions on coronavirus and the CARES Act that Congress just passed to provide funding for our health care workers and small businesses. Join me at 7:20 pm. 

RSVP: https://t.co/RnA4ZKSBns https://t.co/TYiZZHrctw"
1243633979007385600,2020-03-27 20:20:20,"I just voted for the #CARESAct to help Coloradans. Here’s what’s in it: 
• Over $2 billion in aid for CO
• $375+ billion in small business relief
• $200 billion for hospitals and health care workers
• Cash payments to many Americans
• $260 billion for unemployment benefits https://t.co/tF1lN0ZzdT"
1243577533532168192,2020-03-27 16:36:03,"Our country is dealing with a crisis. I know that we’ll get through this together as a country because that is what we do. Today’s bipartisan stimulus package is an urgently needed step for health care workers, small businesses, and families across Colorado. https://t.co/hMXQ0Q4mWB"
1243305737201295360,2020-03-26 22:36:01,"We’ve all seen photos of nurses using school supplies as protective shields &amp; doctors wearing halloween masks for N95s.

Today, I introduced a bill to force the President to use the Defense Protection Act-- not as “leverage,” but to get healthcare workers the equipment they need. https://t.co/rSlhFg3EF7"
1243238520765976577,2020-03-26 18:08:56,RT @NatSecMulligan: This is exactly what the federal government should be doing right now.  @RepJasonCrow and @RepKatiePorter are showing r…
1243238327765143553,2020-03-26 18:08:10,"RT @RepJohnLarson: Our health care workers need more resources NOW! Today @RepJasonCrow, @RepKatiePorter and I introduced legislation to fo…"
1243227066126012416,2020-03-26 17:23:25,"RT @RepDerekKilmer: Leveraging the Defense Production Act can increase supply of masks, respirators, and other personal protective equipmen…"
1243227046228213762,2020-03-26 17:23:20,RT @RepJerryNadler: Proud to join my friends @RepJasonCrow and @RepKatiePorter in forcing the President to use the Defense Production Act t…
1243211122246914048,2020-03-26 16:20:03,"@RepKatiePorter @RepRoKhanna @RepTjCox @gracenapolitano @RepRoybalAllard @RepBarragan @RepHarley @RepJoeNeguse @RepJohnLarson @RepJahanaHayes @RepLoisFrankel @RepMcGovern @RepPressley .@RepRaskin, @RepAnnieKuster, @RepMalinowski, @RepTomSuozzi, @RepJerryNadler, @RepSeanMaloney, @CongBoyle, @RepFletcher, @JoaquinCastrotx, @RepDerekKilmer, and @RepMarkPocan"
1243210941594034179,2020-03-26 16:19:20,"Proud to be leading this with @RepKatiePorter and my colleagues co-sponsoring the bill: @RepRoKhanna, @RepTjCox, @gracenapolitano, @RepRoybalAllard, @RepBarragan, @RepHarley, @RepJoeNeguse, @RepJohnLarson, @RepJahanaHayes, @RepLoisFrankel, @RepMcGovern, @RepPressley"
1243210123604037632,2020-03-26 16:16:05,"In this crisis, masks and ventilators will save lives. 

The President can direct factories to start producing this medical equipment. 

But he hasn’t done it yet. 

We can’t wait another day. 

I just introduced legislation forcing him to use the Defense Powers Act. https://t.co/TCBrHrCLVt"
1242946655344906240,2020-03-25 22:49:10,Important update to statewide safety measures in Colorado: https://t.co/IZPj0SKARu
1242884180129845255,2020-03-25 18:40:54,"I'm working with members of Congress from both sides of the aisle to ensure that the President begins using the Defense Production Act, so our medical professionals get the resources they need."
1242884178120761352,2020-03-25 18:40:54,"Our hospitals need more ventilators. 

Our front line health care workers need more masks. 

It’s time for the President to use the Defense Production Act. 

Our patients can’t wait."
1242855995929497600,2020-03-25 16:48:55,"NEW: @TCHDHealth just issued a stay-at-home order starting tomorrow for residents of Arapahoe, Douglas, and Adams Counties. This is an important step and it’s vital that our entire community follow these directions so we can keep our families and neighbors safe and healthy. https://t.co/vLr0WQZMyp"
1242571322259095554,2020-03-24 21:57:43,One of my favorite social distancing activities? Completing my #2020Census! The census is vital to determining funding for schools &amp; roads over the next decade. I’ll be hosting a Facebook Live chat on my page at 6 pm with census officials to answer your questions. #DoingMyPartCO https://t.co/w1vpSI7Sau
1242548003950530560,2020-03-24 20:25:04,"We need to get small businesses the relief they need, and get it to them now. That’s why I wrote a bill to increase access to @SBAgov loans &amp; pushed to include it in the stimulus package. It’s time to pass this bill and put small businesses &amp; workers first
https://t.co/uqPQJdC668"
1242528188288380929,2020-03-24 19:06:19,"This is a scary time, but it makes it even more important to come together as a community. Recent discrimination against Asian-Americans is despicable. 

Fear is never an excuse for racism."
1242502345306648576,2020-03-24 17:23:38,"If you need help getting meals, the National Hunger Hotline can help you connect with community resources. https://t.co/JY0bgLh8uO"
1242206594546503682,2020-03-23 21:48:25,"Happy birthday to the Affordable Care Act! In 10 years, it has -- 
• Ensured almost 800,000 Coloradans can’t be denied coverage because of a pre-existing conditions
• Lowered premiums by 14% for Coloradans
• Protected nearly 1,000,000 Coloradans with a mental health illness"
1242185773476126725,2020-03-23 20:25:41,"With the 2020 Census underway, I’m here to answer your questions. Join me for a Facebook Live conversation tomorrow evening to talk about the importance of the #2020Census and how to get counted.  

🔗: https://t.co/JN2LkFR6lm https://t.co/DXNn2yHVOu"
1241896887977947136,2020-03-23 01:17:46,"For our healthcare workers, protective gear is a necessity. Earlier this week, I sent a letter with Colorado’s congressional delegation to the Secretary of Health and Human Services to request quick delivery of additional personal protective equipment. https://t.co/jPMxLlOz4h"
1241749376416075777,2020-03-22 15:31:36,"Our team is working around the clock to help bring Coloradans home from South America, Europe, and Africa. As we work to get them access to the embassy personnel and resources they need, I’m calling on @SecPompeo to do his job too. https://t.co/c9djpC5FoZ"
1241402433923883015,2020-03-21 16:32:59,"There are vital steps you can take to help keep our community safe and healthy: 
🧼 Wash your hands
👨 Practice social distancing
🏡 Stay home if you’re sick"
1241179139706687488,2020-03-21 01:45:41,"On Wednesday, I hosted my first telephone town hall and, with close to 5,000 attendees, there were a lot of questions about coronavirus and our response. I’ll be hosting more virtual town halls soon and announce upcoming ones on this page."
1241124250871902213,2020-03-20 22:07:35,"To the doctors, nurses, first responders, supermarket employees, and other essential workers serving Coloradans right now, thank you -- you’re on the front lines as we work to keep our community safe and healthy."
1241101971559456775,2020-03-20 20:39:03,"This year’s Tax Day just got moved to July 15. This will give you more time to file and pay your taxes without any penalties or interest --

https://t.co/yNktCwSBiq"
1241069438805385216,2020-03-20 18:29:46,"We need to support Colorado’s small businesses as we take action to contain the coronavirus’s spread. Yesterday, I introduced a bill to waive fees for small business loans and expand access to express loans, which allow businesses to get approved in days, not weeks. https://t.co/svl6CzOLOu"
1241043152003313666,2020-03-20 16:45:19,"Health care is a right, and during a public health crisis, we need to make sure that everyone has the opportunity to be covered. Colorado just opened up a special health care enrollment period for uninsured Coloradans. Here’s how to sign up → 

https://t.co/ByYVgsGuuS"
1241025523343638529,2020-03-20 15:35:16,RT @GovofCO: I’m so proud to be a Coloradan. We support each other when things get tough. Thank you to these businesses for making sure our…
1240769963155128320,2020-03-19 22:39:46,"In this public health crisis, families shouldn’t be scared about being forced out of their house. This week, @RepMaloney &amp; I called on @HUDgov to halt foreclosures on federal properties. Yesterday, they announced the suspension in a win for homeowners

https://t.co/BTmHNCK5oI"
1240765184022654976,2020-03-19 22:20:46,"After urging by @GovofCO and our state’s whole congressional delegation, @SBAgov just categorized Colorado as a disaster zone. This will open up new loans for small businesses and help businessowners get the support they need. Here’s how you can apply -- https://t.co/uD6kKruR0O"
1240440806030356482,2020-03-19 00:51:49,"We’re LIVE, I just started my telephone town hall on coronavirus. Join us here --&gt; 
https://t.co/3Ow7a6M1PF"
1240439297230200833,2020-03-19 00:45:49,"In a few minutes, I’m hosting a telephone town hall to answer your questions on coronavirus, including ways to stay healthy and how Congress is taking action. Join Dr. John Douglas from Tri-County Health Department and me at 6:45 pm.
 
https://t.co/3Ow7a6M1PF"
1240326434553507843,2020-03-18 17:17:20,"Have questions on coronavirus? I’ll be hosting a telephone town hall tonight, joined by Dr. Douglas from @TCHDHealth. We’ll talk about coronavirus, including tips to stay safe and what Congress is doing.

Call to join, or listen in here: 
https://t.co/wJq1mPni94 https://t.co/120GQtaRmi"
1240091874859376642,2020-03-18 01:45:17,"Today, I learned that I came into contact with a constituent on March 11th who later tested positive for coronavirus. Taking the upmost caution, I will self-quarantine. My full statement: https://t.co/ZK152l9Nse"
1240045525019353088,2020-03-17 22:41:06,"As businesses across Colorado experience losses due to #coronavirus, we must work together to support them. Today, I was proud to co-led a letter with @RepJoeNeguse to @SBAgov urging them to quickly approve Colorado’s request for a disaster declaration to help businesses recover https://t.co/cpigVnvXBN"
1240030836910624771,2020-03-17 21:42:44,RT @HouseSmallBiz: Have questions on how SBA's economic injury loan program can help small businesses affected by #COVIDー19 ? The Committee…
1240003173475065858,2020-03-17 19:52:49,"Fellow veterans -- the VA has a webpage dedicated to resources on how to stay healthy and information for how to get in touch with your doctor. 
https://t.co/IFrcdGk6K0"
1239953664669777922,2020-03-17 16:36:05,"RT @HouseSmallBiz: Last week, households began receiving their #2020Census questionnaires. The census is a vital source of data for small b…"
1239740816849076225,2020-03-17 02:30:18,RT @GovofCO: Details on today’s public health order in Colorado. https://t.co/S3C7b4RuwJ
1239715339245621248,2020-03-17 00:49:04,"Proud to be joined by @RepDonBacon, @RepGilCisneros, @RepElaineLuria, @RepRubenGallego, @RepRickLarsen, @RepAnthonyBrown,@RepFilemonVela, @RepSlotkin, @USRepKeating, @DonaldNorcross, @RepSherrill, @RepSusanDavis, @TulsiPress, @teammoulton, @RepDebHaaland"
1239715274103947265,2020-03-17 00:48:48,The @DeptofDefense has critical resources &amp; world-class specialists that we will need to provide medical and humanitarian relief as the scope of the coronavirus grows. Now is the time to come together as Americans and ensure that our caregivers have the resources they need.
1239715105358708736,2020-03-17 00:48:08,"As our nation responds to COVID-19, we can’t let politics get in the way. Today I led a bipartisan letter to the @EsperDoD w/ my HASC colleagues to offer our full support &amp; resources. We must ensure our personnel &amp; families are protected, &amp; the DOD is prepared to #flattenthecurve https://t.co/tDHD2noiVa"
1239663020919468033,2020-03-16 21:21:10,"School districts across Colorado are finding ways to distribute meals to kids, even if school is closed. As they announce plans, here’s a useful map to find the nearest location to you. 

https://t.co/rWQQ1XZjKX"
1239623631522664456,2020-03-16 18:44:39,RT @CDCgov: Social distancing can help slow the spread of #COVID19 in affected communities. This means avoiding crowded places and maintain…
1239600416947605504,2020-03-16 17:12:24,"RT @CDPHE: Social distancing is an effective public health tool for preventing the spread of disease, but it's still important to connect w…"
1239596003927392257,2020-03-16 16:54:52,RT @ChalkbeatCO: MAP: Here’s where children can get meals while Colorado schools are closed due to #coronavirus #edcolo https://t.co/Qp7qal…
1239345087508873227,2020-03-16 00:17:49,RT @washingtonpost: CDC recommends halting gatherings of 50 people or more throughout the U.S. for next eight weeks https://t.co/1FEa60W5yP
1239300353012703233,2020-03-15 21:20:03,"With the most diverse district in Colorado, it’s vital our community has information on coronavirus in multiple languages. On my site you can find coronavirus resources in 13 different languages, including Amharic, Spanish, and Korean --
https://t.co/itGxmlV8x7"
1239259972598468610,2020-03-15 18:39:36,"As a community, together we can help protect our public health. I am finding alternative means for in-person public events &amp; will not be accepting walk-in meetings at this time. Our office looks forward to serving Coloradans &amp; encourages constituents to call anytime: 720-748-7514"
1238936670180868096,2020-03-14 21:14:55,"Addressing the coronavirus public health crisis requires that we just not find a cure, but that we come together. Last night, I voted to provide free testing, paid sick leave, and food assistance, showing our commitment to American's health and safety.

https://t.co/7btutInRcz"
1238239067030118412,2020-03-12 23:02:53,"For many Dreamers, home is here. It always has been and always will be. 1 year ago today, the Dream and Promise Act was introduced and later the House passed this vital legislation to protect Dreamers and TPS and DED holders. #HomeIsHere https://t.co/UbrD5G814o"
1238157943075418112,2020-03-12 17:40:32,"RT @morethanmySLE: 1 in 4 Americans SKIP a prescription, because they can't afford it.

I met w/@RepJasonCrow during #CoronavirusPandemic b…"
1238108238765268992,2020-03-12 14:23:01,"Across the district, I’ve talked to Coloradans struggling to fill a prescription and make ends meet. Peter Morley (@morethanmySLE) knows the importance of affordable health care first hand and has been fighting to improve the system. I sat down with Peter to discuss the my work: https://t.co/Iu6wQSL67V"
1237861644287348745,2020-03-11 22:03:09,"As long as you have a doctor’s note, you can get a coronavirus test in Denver, without getting out of your car. More on local, easy coronavirus testing → https://t.co/eXypEV9UdT"
1237860506251046912,2020-03-11 21:58:37,"Tonight: @TCHDHealth will be holding a virtual town hall for Arapahoe, Douglas, &amp; Adams county residents so you can hear from local experts on coronavirus and ask questions about how you help prevent it from spreading. From 7 pm - 8:30 pm at 1-855-436-3656
https://t.co/PPqhzy2kLI"
