id,created_at,text
1237770663890497536,2020-03-11 16:01:37,"My staff will be holding mobile office hours if you need assistance navigating federal processes. Remember, if you’re sick or been around someone who has been - stay home! Public health is a community effort and we’re here to answer your questions over the phone: (720) 748-7514. https://t.co/oaecFj1WUn"
1237501781434929154,2020-03-10 22:13:11,"Some of the world’s best scientists call Colorado home. This month, I’m especially proud of the researchers at @ColoradoStateU working to develop a coronavirus vaccine. We’re all rooting for you. 

https://t.co/eOlaBle1Yd"
1237464117520338944,2020-03-10 19:43:31,"This year, my office has helped veterans secure benefits, seniors get Social Security checks, and Coloradans receive immigration visas. My staff will be at the Martin Luther King Jr. Library if you need assistance with federal agencies. Come by between 10:30 am and 12:30 pm! https://t.co/oLYVuncd9c"
1237459781650186241,2020-03-10 19:26:17,This will help ensure that Colorado has the resources it needs to effectively combat the spread of coronavirus. My team has been working with the @GovofCO’s office and local health officials and will keep supporting their work to keep Coloradans healthy. https://t.co/wWGN3G0Qbp
1237142690778800129,2020-03-09 22:26:17,"One year ago this week, the House passed watershed legislation to curb the power of special interests in Washington, including my own bill to prevent dark money from corrupting our elections. It’s time for the Senate to vote on #HR1 and pass this transformative bill. https://t.co/zDEIYHoedK"
1236811849972224001,2020-03-09 00:31:38,"Today and every day, we remember the women whose perseverance and sacrifice made our country and the world fairer and more just. We honor their work with action, following in their footsteps as we commit ourselves to the fight for equality. #IWD2020 https://t.co/5lAf1YDUq2"
1236787956742008832,2020-03-08 22:56:41,"My End Dark Money Act would get dark money out of politics because anonymous mega donors shouldn’t be able to buy elections. One year ago the House passed it in #HR1 — since, it’s been gathering dust on @senatemajldr desk. 

https://t.co/Jk6bYgKHXt"
1236746917184524288,2020-03-08 20:13:37,"Corporate special interests like Big Pharma shouldn’t have veto power over policies simply because they can spend the most on lobbyists. It’s time to make sure our democracy is working for the people it represents. More from my oped in @DenverWestword --

https://t.co/oUawMtHtiz"
1236682911388221447,2020-03-08 15:59:17,"Coronavirus Resources: My office is in direct contact with the state government, hospitals, and local health agencies to ensure that they are getting the support they need. As we work together to protect public health, here are useful resources. 

Link: https://t.co/gKbVICSU8P https://t.co/eGHrFPw5gW"
1236440406772068353,2020-03-07 23:55:39,Good governance involves working together at all levels of government to find solutions for the people you serve. Great to speak at the Colorado Counties Conference and with commissioners from Arapahoe and Adams counties this week! https://t.co/fWSlF9Nek1
1236375559430705153,2020-03-07 19:37:58,"The Ethiopian Renaissance Dam could be a game changer for Ethiopia &amp; the region. I’ve heard CO’s Ethiopian-American community’s concerns: if the US is to be an honest broker, we can’t play favorites. I urge Sec Mnuchin to consult w/ all 3 countries to reach an impartial solution."
1236051762622205953,2020-03-06 22:11:19,"Colorado isn’t just a mile closer to space, we’re also leading the industry with the workforce, resources, &amp; infrastructure needed to make US Space Command a success. This week, I continued to make the case to our military leaders for @Buckley_AFB &amp; Colorado to host Space Command https://t.co/8rpKEQfaMf"
1236023565583110144,2020-03-06 20:19:16,"America’s future engineers, doctors, and elected officials are growing up in Colorado. Had a great time talking with students from Arapahoe High School who are exploring the nation’s capital this week! https://t.co/A4XDyHZcuh"
1235969120430157826,2020-03-06 16:42:56,"Colorado is fortunate to be home to some of the best hospitals and public health experts in the country and we must continue to heed their advice when dealing with the virus. 

I’m hosting information from the CDC on my sit, here:
https://t.co/itGxmlV8x7"
1235969119771660291,2020-03-06 16:42:56,Our office remains in close contact with Governor Polis and state &amp; federal officials and we will ensure that health officials are providing timely information. I will continue working with my colleagues to secure the federal resources that Colorado needs to respond effectively.
1235969118978916357,2020-03-06 16:42:55,"The news of coronavirus cases in Colorado, including one in Douglas County, is concerning. As we continue to learn more information, it’s important to seek information from reliable sources and follow the health guidelines provided by medical and public health professionals."
1235727721881382915,2020-03-06 00:43:42,"RT @GovofCO: #BREAKING: We have learned of the first presumptive positive case of COVID-19 (coronavirus) in Colorado. 

We are diligently m…"
1235689101111762944,2020-03-05 22:10:14,"This year’s census will help determine funding levels and new investments in our roads, schools, and social services. Whether it’s by mail, online, or over the phone, make sure you’re counted in the 2020 Census! https://t.co/rdwPOagdqv"
1235343286635765765,2020-03-04 23:16:05,"It’s our responsibility to ensure that @CDCgov and other agencies have the funding they need to respond to coronavirus. I just voted to allocate $8.3 billion to prevent the virus's spread, find a cure, and support small businesses coping with financial losses. https://t.co/LGbKDH5XUY"
1234953072629178368,2020-03-03 21:25:31,"This lawsuit would gut coverage for Coloradans w/ pre-existing conditions &amp; jeopardize care for many CO families. 

Our country can’t afford a broken health care system any longer. I will continue to fight in Congress to defend + strengthen the ACA. 

https://t.co/4KcDGNlh2N"
1234712450701889543,2020-03-03 05:29:22,RT @EnvironmentCO: Last night @TimlinEric @rider_josephine &amp; our volunteers caught up w/ @RepJasonCrow in Aurora. We said thank you for his…
1234599134134403074,2020-03-02 21:59:05,"During #WomensHistoryMonth, let’s honor the trailblazing women whose shoulders we stand on as we continue fighting against systemic inequalities. Proud to be working alongside a record-breaking 126 women currently serving in Congress to make the country a fairer place! https://t.co/YKQ7Dcz2Ay"
1234581684458225666,2020-03-02 20:49:45,RT @ConservationCO: Thank you @RepJasonCrow for joining our community this past weekend to discuss important topics including the intersect…
1234514829504864256,2020-03-02 16:24:06,"After the impeachment trial, I sat down with Rolling Stone to share my thoughts about where our country goes from here and the importance of building individual connections. 

🔗: https://t.co/U6i0ehetKS https://t.co/aAUmPkmnB1"
1234241416102137856,2020-03-01 22:17:39,"This week, Aurora welcomed 50 servicemembers home after serving our country in Afghanistan. Thank you to the Colorado Army National Guard Aviation Unit for their work to keep us safe. 

https://t.co/bXoymGNipK"
1233850023051513856,2020-02-29 20:22:23,"At my town hall earlier this week, over 150 Coloradans came out from across the district to talk about how we’re going to come together and find solutions to the issues facing our community, including making housing more affordable and supporting our veterans. https://t.co/nGWwcQSAyx"
1233508602524160002,2020-02-28 21:45:42,"Public schools helped me become the person I am. Recently, I met with the Coloradans with the @AFTunion and @NEAToday to discuss how we can best support our community’s schools and teachers. Every kid in Colorado deserves a high-quality education. #PublicSchoolsWeek https://t.co/Hwr0YvU0DM"
1233503032836534273,2020-02-28 21:23:35,"As we learn more about the coronavirus, it is important to remain aware about how to best protect yourself. You can find recommendations from the CDC here:

https://t.co/SAO58WVDDY"
1233430029163487234,2020-02-28 16:33:29,Servant leadership means being accessible to the people you represent. Great joining folks in Highlands Ranch over the weekend for a Crow on Your Corner to talk about how we can support local small businesses and reduce the cost of prescription drugs. https://t.co/1siycU6zEQ
1233125277078892548,2020-02-27 20:22:31,General Milley recognizes that we must do more to ensure our military bases are resilient to climate change. I introduced the Military Installation Resiliency Act to ensure that our military bases are studying their vulnerabilities to climate change &amp; have a plan to address them
1233119157966835712,2020-02-27 19:58:12,"One year ago, we passed universal background checks. The bill is still sitting on @senatemajldr’s desk. Since-

46 people were killed or injured in a shooting in El Paso
36 in Dayton
32 in Odessa &amp; Midland
16 in Virginia Beach
9 in Highlands Ranch
5 in Milwaukee

Enough is enough https://t.co/2zNT2pBNaa"
1233100613405335552,2020-02-27 18:44:30,"Climate change is one of the greatest threats to our national security. In a @HASCDemocrats hearing, I pressed the Defense Secretary &amp; Chairman of the Joint Chiefs of Staff on their plan to prepare. I started with a simple question -- ""Do you believe that climate change is real?"" https://t.co/WC1Axz398C"
1233051962725273602,2020-02-27 15:31:11,RT @SacconeSpeaks: Great to see @RepJasonCrow sign on as the 175th co-sponsor of the #bipartisan Recovering America's Wildlife Act — the mo…
1233051925425332225,2020-02-27 15:31:02,"RT @RepSylviaGarcia: Con el #Censo2020 a punto de empezar, todos tenemos que estar listos para participar! Puede llenar su cuestionario:

💻…"
1232786020699123717,2020-02-26 21:54:26,"My team will be in Centennial on Friday for mobile office hours to help with any issues with federal agencies. My team has helped Coloradans secure their veterans benefits, social security checks, and tax refunds. We’d love to help you too. Come by in the afternoon! https://t.co/lQJUoi4MJe"
1232729586158505984,2020-02-26 18:10:11,RT @DucksUnlimited: Thanks to @RepJasonCrow for meeting with DU volunteers to talk about the important role #NAWCA plays in conserving wetl…
1232723815513370624,2020-02-26 17:47:15,"Charlottesville showed we are confronting the same violent racism that caused decades of lynching in America. After 100 years of failed attempts, Congress is poised to pass legislation to make lynching a federal crime. We must hold perpetrators of violent racism accountable. https://t.co/8eGZcvEDSU"
1232392307896455174,2020-02-25 19:49:57,"A new report released yesterday found that “climate change is a pressing risk to national and global security.” As we work to reduce our carbon emissions, I’m leading the charge in Congress to ensure our military prepares for the impacts of climate change.
https://t.co/gYL5WfbW26"
1232083115880873984,2020-02-24 23:21:20,"Supporting veterans is our responsibility and to me, it’s personal -- all of our veterans deserve top-tier health care. Aurora’s new VA hospital helps make that possible in Colorado. Last week, I toured the medical center, learning how it’s a model in women’s veteran healthcare. https://t.co/C2CA5hEp5p"
1231748239755489280,2020-02-24 01:10:39,"I’ll be holding my next town hall tomorrow. It’ll be a chance to update you on how I’m working for you at home and in Washington, from helping secure infrastructure grants for our community to passing historic gun violence prevention legislation.

🔗: https://t.co/oQEk3VRNTq https://t.co/aMZG5qxuLb"
1231360050066788352,2020-02-22 23:28:08,"The first step in supporting communities is listening. This week, the Aurora Community Connection Family Resource Center’s leadership class students pitched me on their proposals for community projects, from mental health programs to increasing access to nutritious food! https://t.co/Ek8Q5gjama"
1230972506967769088,2020-02-21 21:48:10,"We need to strengthen STEM education because Colorado’s engineering students are going to help build the future. Right in Centennial, @CCIC_CCSD is leading the way! I hosted a congressional field hearing there to discuss Colorado’s innovative education approach #EngineersWeek https://t.co/Th5RvFJtng"
1230654759352307712,2020-02-21 00:45:33,"Last year, I met with leaders from 9 towns in the district to discuss local needs through my Lead Locally initiative. This year, I’m going back to have more conversations. We’ve made great progress, but there’s more work to do. Today, we kicked off Lead Locally 2020 in Aurora! https://t.co/xDUQgOoaBU"
1230249520447066112,2020-02-19 21:55:17,"Crow on Your Corners are conversations with constituents I host in cafes around the district. They're a chance to talk directly with you about challenges facing our communities and how I can help address them. I’ll be holding my next one on Saturday!

🔗: https://t.co/qzHLxetdth https://t.co/SDsGxONQmK"
1230206256922742784,2020-02-19 19:03:22,"The leadership of generations of black Coloradans to make our country more equal has strengthened our state &amp; continues to inspire us. My office was happy to join @GovofCO’s Black History Month Celebration last week -- in Colorado, we know that our diversity should be celebrated! https://t.co/Q9viWx5mGc"
1230186933436981248,2020-02-19 17:46:35,"Proud that the House was able to remove one barrier to the Equal Rights Amendment last week. Men and women should never be treated differently under the law. 

https://t.co/njS6npwUCD"
1229890446324834305,2020-02-18 22:08:27,"We all deserve the opportunity to talk with the leaders we elect -- that’s why I’ve held consistent town halls since I was sworn into Congress. On Monday evening, I’ll be holding my next town hall in Aurora!

RSVP here: https://t.co/oQEk3VRNTq https://t.co/1Kl6XEEu5l"
1228739002360045570,2020-02-15 17:53:01,"Unions have protected middle class Americans for generations. It’s important that we have their backs, too. Last week, the House passed an important bill to protect workers’ right to collectively bargain. 

https://t.co/qQslmWfZVk"
1228457267072241664,2020-02-14 23:13:30,"Whether it’s in a classroom in Colorado or with my kids, reading brings people together. Today’s International Book Giving Day! My office can help get free books for your school or non-profit. Learn more: 
https://t.co/oQR9b56hsX https://t.co/8jyJuflsb9"
1228430107120934912,2020-02-14 21:25:35,"It’s been two years since we lost 17 students and educators at Parkland. 

That’s 34 missed birthdays and 730 days a parent couldn’t say good morning to their kid. 

It’s time for the Senate to take up our background check bill.

#NeverAgain"
1228380645212262401,2020-02-14 18:09:02,"I take my commitment to protecting public health and the environment in Colorado seriously. For homeowners in the vicinity of Buckley AF Base, please take a few moments to read the latest update on well water testing by the Air Force for PFAS chemicals. 

https://t.co/zbMEV2ZNML"
1228076885822857217,2020-02-13 22:02:00,"My team will be at the Brighton Recreation Center tomorrow to help folks who need a hand navigating federal processes! If you’re having issues with Medicare, Social Security, or other federal benefits, we might be able to help. Our office will be there in the afternoon. https://t.co/x326nPoL27"
1228067633343455234,2020-02-13 21:25:14,"Our kids should grow up in a world without the stain of systemic discrimination. Standing on the shoulders of generations of activists, the House just voted to pave the way to ratify the Equal Rights Amendment. Equality has no deadline. #ERANow"
1227661495535886336,2020-02-12 18:31:24,"Valentine’s Day is another chance to say thank you to our veterans. Thanks to everyone who dropped off Valentine’s Day cards at our office, we’re looking forward to working with the USO to help deliver them to Colorado’s veterans! https://t.co/DbygScEVpi"
1227370155526819841,2020-02-11 23:13:43,"My team has helped Coloradans secure veterans benefits, receive Social Security checks, and get health care. If you need help with a federal process, we can help! This Friday, my team will be at the Brighton Recreation Center for mobile offices. https://t.co/AlmhrqufcP"
1227365303010635776,2020-02-11 22:54:26,"The reality is that AAPI women in this country aren’t paid an equal wage for equal work. It means less money for them and their families to afford necessities, including groceries and health care. Equal pay can’t wait. #AAPIEqualPay"
1227364031905878022,2020-02-11 22:49:23,"From Marie Curie to Sally Ride, women have always pushed the frontiers of medicine and engineering. The next generation of scientists and inventors will be from Colorado -- like these award-winning app developers from the STEM School in Highlands Ranch! #WomenInScienceDay https://t.co/KjDf5sayjc"
1227331807085023233,2020-02-11 20:41:20,"This weekend, I had the pleasure of joining Colorado’s Ethiopian community to welcome Father Girma to Colorado. Father Girma’s message of hope and unity is inspiring. I will continue to fight alongside the community for peace and prosperity in Ethiopia and here in Colorado. https://t.co/ZSGrYWJvUA"
1227265742770450432,2020-02-11 16:18:49,RT @adeaweb: Sixty-thousand veterans make up the region where @CUDentalMed resides. U.S. Rep. Jason Crow (D-Colo.) is one of those veterans…
1226652271599128576,2020-02-09 23:41:06,"In August, I visited @freedomsvcdogs in Englewood to talk about how dogs aren’t just people’s best friends -- they also offer vital support. We discussed how the PAWS for Veterans Therapy Act would help connect vets with service dogs. It passed the House last week! https://t.co/3zIRZwYXM2"
1226275860384272385,2020-02-08 22:45:22,"Every week, hundreds of people call our office to share their support for legislation or ask for help navigating a federal process. Whether emails, letters, or calls, we always get back to the people we serve. Loved returning some phone calls this week! https://t.co/KIBExFv165"
1226249972070395904,2020-02-08 21:02:30,"During National Gun Violence Survivors' Week, I shared the story of Julie from Highlands Ranch. She was shot at 13, leaving her paralyzed and requiring her to walk with braces. For Julie, and all victims of gun violence, we must act now. https://t.co/qRBJX6qsmS"
1225874952664027136,2020-02-07 20:12:19,"Over the last few months, countless members of Congress and staff have worked late nights and long weekends to defend our democracy. Thank you for that vital work -- I know your commitments to our Constitution will never falter. https://t.co/YhBDMItkSy"
1225860765791522816,2020-02-07 19:15:56,"Due to the snow, our office is closed today. We’re extending the deadline so you can drop off Valentines for Veterans on Monday. We’ll be delivering them to veterans in Colorado to show our appreciation for their service. Thank you to folks who already dropped some off! https://t.co/o3b4LpLPQo"
1225812220921208834,2020-02-07 16:03:02,"Unions helped build America’s middle class and continue to protect it. This week, the House passed the #PROAct to protect unions and the workers they represent. https://t.co/RGqQWNUZ3K"
1225531167694303239,2020-02-06 21:26:14,"Every month &amp; #BlackHistoryMonth we celebrate the achievement of Black Americans who furthered the fight for justice for all. This past year, we lost a legendary teacher, Marie Greenwood -- she was the first black educator to earn tenure with DPS &amp; fought segregation for decades https://t.co/lINYFbRyLB"
1225481329598517250,2020-02-06 18:08:11,"THIS AFTERNOON: My team will be at Bemis Library in Littleton for mobile office hours to help with any issues with federal agencies! We can assist you with processes for veterans benefits, Social Security, immigration issue and visas, Medicare, Medicaid, and more. https://t.co/gtmGn823mu"
1224854508330725376,2020-02-05 00:37:26,"I’ll be going to the #StateOfTheUnion with Sue, a retired nurse &amp; Type 1 diabetic. As drug prices skyrocket, the price of her insulin has gone up 500% forcing her to ration her medicine. This is unacceptable. The House passed the Lower Drug Costs Now Act because it’s time to act. https://t.co/aNHuA9qXuz"
1224740462726144002,2020-02-04 17:04:15,"The cost of Sue Way’s insulin increased by over 500% last year. As rising drug prices continue to hurt Coloradans, I invited her to the #StateOfTheUnion because the conversations in DC must focus on real people. It is time we stood up to Big Pharma and put people like Sue first."
1224725575627169792,2020-02-04 16:05:06,"RT @deseraicrow: Today is #WorldCancerDay. Like so many, our family has been touched by cancer too often. As a member of the #Congressional…"
1224424694100701185,2020-02-03 20:09:30,"In my final remarks in the impeachment trial, I read a note I wrote to my kids -- “Our system only works if people stand up and fight for it -- and fighting for something important always comes with a cost.” 

https://t.co/UFqEIA28QB"
1224358667094495237,2020-02-03 15:47:08,"Zuma agrees -- every animal deserves protections! This year, I voted to crack down on animal cruelty and wildlife trafficking. Proud that the Humane Society gave me an A+ on their 2019 Scorecard! https://t.co/kMOCC5JK1m"
1224108320157569024,2020-02-02 23:12:21,"Colorado’s beauty is worth protecting. A year ago, @SenatorBennet &amp; @RepJoeNeguse introduced the CORE Act to ensure public lands across the state are preserved for future generations. This week, Deserai, @GovofCO, and my office celebrate the bill and its passage in the House! https://t.co/Mu0kEFaKYa"
1223761769073709056,2020-02-02 00:15:16,"One of my priorities in Congress is taking action to prevent gun violence. Last year, the House passed universal background checks and allocated $25 million to research gun violence. I wanted to give you an update on my work to keep our schools and streets safer. https://t.co/lfsQNxTLNw"
1223667606839840769,2020-02-01 18:01:06,"In Congress, I’m working to increase access to healthcare, keep our communities safe from gun violence, and take action to reduce the impacts of climate change. Want to keep up with my work? Sign up for my newsletter here → 
https://t.co/5idTtTvrAx"
1223383641692299266,2020-01-31 23:12:44,This travel ban has done nothing to make us safer. America stands as a beacon of hope &amp; freedom throughout the world and this short-sighted policy is a stain on our values. The community I represent is made stronger by our diversity. We must oppose this ban in the strongest terms
1223336066087866369,2020-01-31 20:03:41,"The truth continues to come out.

The question here, before this body, is — What do you want your place in history to be?

Do you want it to be, let's hear the truth? Or that you don't want to hear it?

https://t.co/czJPTlBjRV"
1223303270007017472,2020-01-31 17:53:22,The House has passed some vital legislation this week to ensure that we’re promoting access to education and preventing deadly drug overdoses. Here’s a quick recap on one of the bills we passed to help prevent suicides -- https://t.co/Y66DI1UXaF
1223296911303749633,2020-01-31 17:28:06,"Earlier this month, I meet with the Colorado Refugee Services Program and resettlement agencies to give them an update on my work. Since we last met, my Public Oversight of Detention Centers Act was enacted and is increasing transparency at ICE detention centers across Colorado. https://t.co/r3bNiiokt8"
1222942236452757504,2020-01-30 17:58:44,"It’s a busy week and more important than ever to make sure we are communicating back home. Yesterday, I spoke with Jaden, a student reporter for Arapahoe High School’s Arapahoe Herald News Magazine, to give an update on the impeachment trial and what it means to uphold my oath https://t.co/agftEZJWzO"
1222923774770720769,2020-01-30 16:45:23,"The American people deserve to go to bed every night knowing that the Commander in Chief has the best interest of them, their families, and our country in mind, not the interest of his own political campaign.

That is why we are here.

https://t.co/tcfiz7eTLv"
1222916047340261384,2020-01-30 16:14:41,"Valentine's Day is another opportunity to show our appreciation to those who have served our country. My office is collecting &amp; sending vets cards next month to say thanks. If you’d like to participate, you can drop off or send unsealed cards to my office

https://t.co/oXVSZVUS19"
1222580825037864966,2020-01-29 18:02:37,"Coloradans know the importance of protecting our state’s beauty and public lands. That’s why I support bringing full and permanent funding for the Land Water Conservation Fund up for a vote as soon as possible. The LWCF needs full, permanent funding to protect our parks! https://t.co/frLUO5DOZL"
1222580059153883138,2020-01-29 17:59:35,"On @HouseSmallBiz, we’re working together -- with members from both sides of the aisle -- to help reduce barriers for small businesses owners and build a workforce ready for a 21st century economy. Here’s a behind the scenes shot of our official portrait being taken this week! https://t.co/PrL9Om8D9f"
1222199497704472576,2020-01-28 16:47:22,The transition back to civilian life is hard for many veterans. Proud to support the bipartisan Supporting Veterans in STEM Careers Act so we can get more veterans jobs in the ever expanding STEM field
