id,created_at,text
1246819811168071681,2020-04-05 15:19:42,"During this coronavirus outbreak, our rural communities face unique challenges and require a different response than urban and suburban centers around the country. Unfortunately, these needs are not often understood in Washington.

MORE ⬇️ https://t.co/UWwP3FcJbR"
1246199680712802304,2020-04-03 22:15:31,"Thankfully, we have an ally in the White House. His Administration issued updated guidance this week that will make it easier to provide telehealth services in rural communities. 

MORE ⬇️
https://t.co/ihCiZWS6es"
1246199679966208001,2020-04-03 22:15:31,I immediately began urging the Trump Administration to change these rules so we could expand care to our seniors in rural America without requiring them to come to a doctors office.
1246199679244734465,2020-04-03 22:15:31,"When I spoke with 50 of our area’s doctors and medical providers about the ongoing Covid-19 crisis, one of the issues they highlighted was the restrictions for telehealth services, making phone only services impossible."
1245432175715065856,2020-04-01 19:25:44,"If you are a small business looking for the resources available to you during the #coronavirus outbreak, you can find more information from the @USTreasury here. ⬇️
https://t.co/FhKwOC5Whj"
1244720495502798856,2020-03-30 20:17:46,"This #NationalDoctorsDay, I hope you will join me in praying for their continued health and strength. https://t.co/whFNQ23vHk"
1244720487428694016,2020-03-30 20:17:44,This is especially true of our #rural doctors and health care workers. I’ve spoke with many of them in the past two weeks to express my personal appreciation and to hear how to best help them.
1244720486770266119,2020-03-30 20:17:44,"During the #coronavirus outbreak, we've been constantly reminded about the extraordinary doctors and medical professionals we have in this country working to keep us safe."
1243963345230802944,2020-03-28 18:09:07,"- #GreenNewDeal
- solar energy tax credits
- federalizing local elections
- corporate board diversity requirements
- emission standards for airlines

👆have nothing to do with the #coronavirus, yet they were the top priorities for Nancy Pelosi this week.
https://t.co/P5VNv2NEUK"
1243218218933727232,2020-03-26 16:48:15,"We must ensure the needs of our farmers are responded to during the #coronavirus outbreak. 

That's why I outlined what steps the Trump administration can take and what policies they can support to ease the burden on our famers during this difficult time. https://t.co/6OL5gHhsvA"
1242893080459698177,2020-03-25 19:16:16,"It’s unfortunate that some see a national crisis as a chance to take advantage of their fellow citizens. Thankfully, @realdonaldtrump took the first steps this week to implement my bill to protect American consumers from price gouging.

MORE ⬇️https://t.co/8V6Nb1hBOF"
1242541820632084483,2020-03-24 20:00:30,"While Nancy Pelosi wants to pass her partisan agenda, I’ve been on the phones with the people I represent in southern Missouri, listening to their concerns and hearing how the federal government can help. 

Those are the ideas we should be including! https://t.co/TYFBd7UNEF"
1242476996736831489,2020-03-24 15:42:54,"Leave it to Nancy Pelosi to leverage a national emergency to try and pass her partisan agenda, like the Green New Deal. 

It’s a disgrace. The farmers and families I represent in southern Missouri need help NOW!"
1242201096480862212,2020-03-23 21:26:35,Proud to see our local communities coming together to help those in need. https://t.co/KLuITRgysx
1241518670653898760,2020-03-22 00:14:52,"While a large federal response is helpful, Americans do not require a strong centralized government to control their lives in order to survive this pandemic. 

We need to solve this problem the #AmericanWay. 

MORE ⬇️ https://t.co/mZnhJTUmFr"
1241511089956847616,2020-03-21 23:44:44,"Incredibly sad to hear about the passing of Kenny Rogers. He was not only a legendary singer, but had a strong connection to our community. The @KRCCkids in Sikeston was named after him to honor his commitment to children with special needs. #RIP, Gambler."
1241142514905755650,2020-03-20 23:20:09,Here are some of the incredible teachers in Potosi who are going above &amp; beyond to serve their students &amp; the community. It’s been special to see local communities coming together to hold each other up. I know that we will get through this &amp; be stronger &amp; more united than before. https://t.co/hFPqI2IZ2N
1241140110957187077,2020-03-20 23:10:36,"As I’ve expressed on all of my calls with people across southern Missouri, there is no doubt in my mind that we will get through this stronger and more united than ever before.

Right now, it is important that we listen to local authorities and work together to #StopTheSpread."
1241140109711478792,2020-03-20 23:10:36,"This afternoon, I spoke with 30 of our area’s veterans to hear the issues their facing from #coronavirus, how I can be helpful to them, and to make sure our nation’s heroes are still able to receive the care they’ve earned in service to our country."
1241029889882497034,2020-03-20 15:52:37,"I’m sharing their feedback with the @WhiteHouse and my colleagues in both the House and Senate to ensure we get them the relief they need NOW.

We must keep working together to #StopTheSpread. I know we will recover stronger &amp; more united than before!"
1241029888871665664,2020-03-20 15:52:37,I held another call this morning with over 85 of our small businesses in southern MO. I wanted to hear their concerns and ideas about how we can provide relief to our rural businesses during the #coronavirus outbreak.
1240785534940741632,2020-03-19 23:41:38,"We are all in this together, but rural America including our farmers, small businesses and healthcare providers are struggling just like everyone else. They need our help now more than ever. 

MORE: https://t.co/TY9tFdJ3av"
1240785531971174402,2020-03-19 23:41:38,Today I outline for Congressional Leaders and the @WhiteHouse numerous policy proposals to provide relief to rural America right now. https://t.co/R4eGexD2tw
1240736987805560841,2020-03-19 20:28:44,It is going to take all of us working together to #stopthespread now and come back stronger!
1240736986828279808,2020-03-19 20:28:44,"Just got off the phone with 42 of our farmers in southern MO.

I wanted to hear from them about the challenges they’re facing from #coronavirus, and hear their ideas for what is most helpful in getting relief to America’s farmers right now."
1240705798495277057,2020-03-19 18:24:48,"I have asked them to let me know what they are seeing, what resources they need and how I can help. It will take all of us working together to get out of this, but we will. I am so proud of the team we have back home and in the @WhiteHouse working on this."
1240705796377202688,2020-03-19 18:24:47,"Holding a call with 50 of our southern Missouri health care providers, doctors &amp; stakeholders right now. These are the heroes of the #coronavirus fight we are now in."
1240328745468203009,2020-03-18 17:26:31,Not feeling well? Here are the symptoms of the #coronavirus (COVID-19) compared to other seasonal illnesses. For more information visit the @CDCgov at https://t.co/xiBhtjMOhU. https://t.co/pwCRv6mCHE
1240301706770030594,2020-03-18 15:39:05,"RT @WhiteHouse: We are in this together!

15 Days to Slow the Spread: https://t.co/E8k5IdXQ03"
1240058332632711169,2020-03-17 23:32:00,"RT @WhiteHouse: What is social distancing—and why are we doing it?

Dr. Anthony Fauci, Dr. Deborah Birx, and @Surgeon_General Jerome Adams…"
1240013173207511040,2020-03-17 20:32:33,"The Missouri Department of Higher Education &amp; Workforce Development (@MODHEWD) launched a webpage this afternoon that includes links to COVID update pages for colleges and universities across the state.

You can find that information here: https://t.co/dAiwkVGSnM"
1239654751228264448,2020-03-16 20:48:19,"All Americans have a civic responsibility to #StopTheSpread.

Today, at the @WhiteHouse, @POTUS Trump released these new guidelines below &amp; stressed the importance of following the direction of state &amp; local authorities.

Missourians, more info at @CDCgov &amp; @HealthyLivingMo. https://t.co/YKVmczggoS"
1239555765087678471,2020-03-16 14:14:58,"Terrible news out of Springfield. My heart goes out to the victims &amp; their families, including Officer Christopher Walsh, who was killed responding to the threat.

To the injured, I’m praying for your speedy recovery. Thank you to all law enforcement for your service &amp; sacrifice. https://t.co/DkESBV0Gqh"
1239265111774240769,2020-03-15 19:00:01,"In the wake of the coronavirus outbreak, @POTUS Trump has called for a #NationalDayOfPrayer.

Americans have always turned to prayer in times of uncertainty.

I hope you will join me in praying for all those affected and asking God for His wisdom, comfort and strength."
1238893104167620609,2020-03-14 18:21:48,"I’m grateful that @POTUS @realDonaldTrump declared a national emergency in response to the #coronavirus. 

This means additional federal resources will be available to treat those affected, including $42 billion in @FEMA funding for states and drive-thru testing services."
1238866275780243456,2020-03-14 16:35:11,Thank you Governor Parson for your leadership and commitment to keeping Missourians safe. https://t.co/nSVUOCXw2J
1237859619172569090,2020-03-11 21:55:06,"Today’s #FISA bill doesn’t do enough to reign in recent abuses or protect Americans from targeting based on their political beliefs. 

It could have. 

My amendment added additional layers of due process protections from this kind of abuse. 

Sadly, it was BLOCKED by House Dems. https://t.co/pPX5la9gDQ"
1237799137753645057,2020-03-11 17:54:46,"It’s clear: both Republicans AND Democrats want Nancy Pelosi and her Budget Committee to do their job and pass a budget.

Last week, 17 Democrats sent a letter to @HouseBudgetDems asking the Budget Committee to do one thing: its job.

MORE ⬇️ https://t.co/8lB0DCqQuU"
1237362505493680128,2020-03-10 12:59:45,"China has exploited our farmers and workers again and again and again. 

Decades have gone by with no change. And now, when President Trump decides to fight back?

Just bickering and politics from Democrats. Disgraceful.

MORE ⬇️ https://t.co/zMoFVUyRLR"
1236429784844054529,2020-03-07 23:13:27,"This week, the courts said that @POTUS can withhold funding from #SanctuaryCities.

It’s common sense. 

No taxpayer should subsidize these liberal policies that incentivize illegal immigration by offering criminals asylum from law enforcement

MORE ⬇️
https://t.co/5VBWLrJis4"
1235956920814579712,2020-03-06 15:54:27,"America.

This is the Democratic party in the age of President Trump: a mob of petty narcissists who are fine with disrespecting our Constitution and our institutions due to a burning hatred of Donald Trump and anyone associated with him. https://t.co/AntpfjwZGP"
1235631183746101248,2020-03-05 18:20:05,I had a great meeting with @MissouriSandT Chancellor Mo Dehghani and other Missouri college leaders. We talked about supporting the stellar higher education institutions in southern Missouri and the great research they’re working on. https://t.co/g1g8GecPMZ
1235329807573012482,2020-03-04 22:22:32,"Even when the health and safety of the American people is at stake, Democrats in Washington can’t get over their personal hatred of the President.

A writer at the New York Times recently called it the “TrumpVirus.”

It’s unbelievable! https://t.co/ACaOSS37Ip"
1234124458220228608,2020-03-01 14:32:54,Opening day of trout season is TODAY! Hope to see you on the river! https://t.co/eMVZkYNItc
1233948465673261058,2020-03-01 02:53:34,"Whenever the President does ANYTHING, Democrats in Washington still find a way to complain.

They need to get over their issues and start working with the President on behalf of the American people - just like Republicans are doing. 

MORE ⬇️ https://t.co/HWkJUGsHfP"
1233567530888892416,2020-02-29 01:39:52,It's not an exaggeration to say that FFA changed my life. It reinforced the essential character traits like leadership and hard work which my family first taught me. Happy National FFA Week! https://t.co/4qApREWR09
1233148174967230464,2020-02-27 21:53:30,"BREAKING - The courts affirmed what we all know: “sanctuary cities” that harbor illegal immigrants shouldn’t receive federal dollars.

In 2017, I offered legislation that prevented cities like San Francisco from receiving any $ for infrastructure projects. https://t.co/QLdNYxpoS7"
1233102650176155649,2020-02-27 18:52:36,"After decades of politicians and presidents talking about farmers’ 
problems but getting nothing done, we finally have a champion in President 
Trump who is fighting for our interests.

Democrats’ response? Just more and more complaining like always.

WATCH ⬇️ https://t.co/OkpXTVvYHk"
1232794559182262275,2020-02-26 22:28:21,"Congratulations to @MissouriSandT for 150 years of success! S&amp;T has grown into a world-class engineering school that produces Miners who make our community, state, and country a better place. Here’s to (at least) another 150 years! https://t.co/DqugCOOgI0"
1232410006701641728,2020-02-25 21:00:17,"Chuck Berry, nicknamed the “Father of Rock and Roll” was born in St. Louis and lived in the area his entire life. He helped develop rhythm and blues into the distinctive sound of rock and roll with classic songs like “Johnny B. Goode” and “Maybellene.” #BlackHistoryMonth https://t.co/0xjKPP50hL"
1231969348627181569,2020-02-24 15:49:16,"For our community, access to care isn’t just a talking point - it’s a matter of life or death. Last week, I continued my fight for rural healthcare and met with Director Carroll of the @ONDCP and @GovParsonMO for a roundtable in Cape Girardeau.

https://t.co/K4tDlGhdA1"
1231587087276761088,2020-02-23 14:30:18,"75 years ago today, Joe Rosenthal captured this photo of six Marines raising the U.S. Flag atop Mount Suribachi during the Battle of Iwo Jima. 

The @USMC War Memorial honors this photo &amp; includes an inscription of Adm. Nimitz's famous words: ""uncommon valor was a common virtue."" https://t.co/hGjOqbrQ46"
1231210254345654277,2020-02-22 13:32:54,"George Washington, a military general, extraordinary American citizen, and the first President of the United States was born #OTD in 1732. 

Perhaps nobody summarized Washington better than Henry Lee: “First in war, first in peace, and first in the hearts of his countrymen.” https://t.co/HisqPpvBbQ"
1230622859753639936,2020-02-20 22:38:48,"Scott Joplin - ""the King of Ragtime"" - was a famous composer and pianist. As a young man, he moved to Missouri to teach piano and write music, producing notable hits such as ""The Entertainer"" and the ""Maple Leaf Rag."" #BlackHistoryMonth https://t.co/ZMVrCUNR50"
1230494692682407941,2020-02-20 14:09:30,"Thank you @GovParsonMO, @POTUS, and @ONDCP Director Carroll for your leadership. Together we can improve access to care in rural communities and continue to combat opioid abuse. https://t.co/105F4dQGnr"
1230283333969555456,2020-02-20 00:09:39,"Missouri-born George Washington Carver was a chemist whose research on crops helped poor southern farmers improve their diets.

During #BlackHistoryMonth we highlight important black Missourians who have contributed to the advancement of our society. https://t.co/vgjjlRS0iP"
1229932713068630017,2020-02-19 00:56:24,February is Earthquake Awareness Month in Missouri. It's important to make sure you and your family have a plan. #BeReady https://t.co/XLmyyfg9ej
1229502243344437248,2020-02-17 20:25:52,"Presidents Washington and Lincoln steered our country through tough times, comforted us in misery, and inspired us to always keep faith. Today we honor and celebrate their Presidencies while looking to the present and future including honoring the current @POTUS, Donald Trump! https://t.co/eXatTFNv2I"
1229243150872567809,2020-02-17 03:16:20,"GREAT NEWS: the @FCC announced over $175 million for investments in broadband  infrastructure for Missouri. 

Expanding rural broadband access in southern Missouri has long been a priority of mine and I’m proud to fight for this critical funding. https://t.co/roTumR4n5Y"
1228753937001598976,2020-02-15 18:52:22,"Nancy Pelosi and House Ds won't propose a budget. 

Is that because they have no policies to propose?

Or is it because they don't want to show America those policies and the soul-crushing taxes they'd levee on middle class families to pay for it? ⬇️ https://t.co/xaDdh1C9HL"
1228510122013491200,2020-02-15 02:43:32,Congratulations to Keith Steelman of the Salem PD on his retirement after 33 years of service. He has been a steward of the police force and a leader in our community for decades. It is an honor to congratulate him on his retirement. https://t.co/WOZhuOATtz
1227737383862493185,2020-02-12 23:32:57,"The irony of Speaker Pelosi criticizing @POTUS’s budget proposal this week is that her party didn’t even propose a budget last year. 

It’s because they don’t want the American people to know how much they plan to spend on the Green New Deal or their government run health care. https://t.co/xPtdQQrUFy"
1227726043861135366,2020-02-12 22:47:53,"The @UN’s list is shameful and sickening. 

It’s not only horribly anti-Semitic, but it undermines @POTUS’s recently proposed peace plan by attempting to force concessions from Israel. 

It’s clear the UN has been corrupted by the disgusting #BDS movement. https://t.co/soP45r7kD9"
1227616915310424066,2020-02-12 15:34:15,"#OTD in 1809, Abraham Lincoln was born. He was a self-taught lawyer who went on to serve as our 16th President and did so during perhaps the most difficult time in our nation’s history. He has always been, and remains, one of my favorite historical figures. https://t.co/rfPAczLDY9"
1227427938494222336,2020-02-12 03:03:19,My message to Washington Democrats: The President did his job by releasing a budget. Now it's your turn to step up to the plate. Watch below ⬇️ https://t.co/yzkFdfnkOC
1226896200768593920,2020-02-10 15:50:23,"Last year, you and the #DoNothingDemocrats didn't even attempt to produce a budget. What does that say about your values? Nonexistent? Or does it mean you're too ashamed to put them on paper. https://t.co/8h69CeTsxm"
1226647637744504834,2020-02-09 23:22:41,"Now, with this latest impeachment attempt over after an astonishing 134 days wasted, I hope we can finally end the chaos, and restore order and sanity so Congress can get back to work. https://t.co/WCD6B0Y3QA"
1226235040121659394,2020-02-08 20:03:10,"Honestly, the best part of the Senate's acquittal is not having to listen to Adam Schiff anymore."
1225827955949088774,2020-02-07 17:05:34,"Our farmers truly feed and clothe the world. Missouri farms are where American families reign supreme and communities thrive.

Thank you to our incredible farmers for all you do! https://t.co/P07Eejta66"
1225607355079020544,2020-02-07 02:28:58,"Pastor Andy Lambel of First United Methodist Church in West Plains joined me today at the #NationalPrayerBreakfast. 

Even though he's new to our community, he's already done incredible work and is a recognized leader.
https://t.co/DFFj81nF4P"
1225218800750071809,2020-02-06 00:45:00,"Last night, when Nancy Pelosi ripped up the official State of the Union Speech, she also profaned the memory of the Tuskegee Airmen, young girl Ellie Schneider, and victims Rocky Jones and Kayla Mueller. https://t.co/NojKpA0gEY"
1225171491144323072,2020-02-05 21:37:00,PRESIDENT DONALD TRUMP IS ACQUITTED FOR LIFE!
1225170585094934528,2020-02-05 21:33:24,"Finally—after months of wild accusations, public testimony from 17 witnesses, and unconstitutional tactics by Washington Democrats—President Donald Trump was fully and completely acquitted of all charges stemming from this sham investigation. https://t.co/6mFiKOhn7Y"
1224907902433091584,2020-02-05 04:09:36,The irony of Speaker Pelosi ripping up @POTUS’s speech is that’s exactly what the U.S. Senate is going to do to her articles of impeachment tomorrow.
1224902436479021056,2020-02-05 03:47:53,"Tonight’s #SOTU was a celebration of American strength. The President’s speech laid out opportunities where Americans can work together and put our political bitterness behind us for the sake of a shared American future.

The President is right – America has made a comeback! ⬇ https://t.co/1gh968Qb3s"
1224894127910924289,2020-02-05 03:14:52,"@POTUS: “I am also committed to ensuring that every citizen can have access to high-speed internet, including rural America.”

Thank you for your support of infrastructure investments in our rural communities. #SOTU"
1224889841512480768,2020-02-05 02:57:50,".@POTUS: “As we speak, a long, tall, and very powerful wall is being built. We have now completed over 100 miles and will have over 500 miles fully completed by early next year.” #SOTU"
1224888495392673792,2020-02-05 02:52:29,"Like the rest of the nation, I was saddened to learn about his cancer diagnosis. Thankfully, I got the chance to speak with him before tonight’s #SOTU to let him know that I’m praying for him and his family."
1224888494520262656,2020-02-05 02:52:29,A special night for Cape Girardeau in the United States Capitol as President Trump recognized radio legend Rush Limbaugh with the Presidential Medal of Freedom. The highest civilian honor for one of our nation’s greatest voices and a son of Missouri! #SOTU
1224887655189696512,2020-02-05 02:49:08,Washington Democrats apparently don’t support pre-existing conditions or protecting social security for seniors. They couldn’t be bothered to stand for that or investing in our children’s education. #SOTU
1224882226355146753,2020-02-05 02:27:34,Unbelievable that Democrats in Washington won’t stand for historic low unemployment or more jobs for women. Instead Nancy just shakes her head. #SOTU
1224876092936409088,2020-02-05 02:03:12,Great catching up with President Trump before his #SOTU address tonight. We are about to walk into the U.S. House Chamber. https://t.co/Cq3RH9aUy0
1224443243053514756,2020-02-03 21:23:12,"At tomorrow's #SOTU we will hear about what our country has been able to achieve these past three years, even in the face of historic opposition from the Left, and what more we can accomplish in the years to come. https://t.co/tYLMUcLaui"
1224175748837191683,2020-02-03 03:40:17,Champions at last!! #ChiefsKingdom #SuperBowlLIV https://t.co/maOgzB8Uey
1223769467349585923,2020-02-02 00:45:52,"Dear Nancy,

Thanks for wasting five months of our lives.

Very insincerely,
Literally everyone"
1223257628408573955,2020-01-31 14:52:00,"When southern Missourians can't get reliable broadband and some families in our area can't even call 9-1-1, we shouldn't be using taxpayer dollars to help the wealthy purchase luxury electric cars. Watch below: https://t.co/LHfzRYCslH"
1222635234593857537,2020-01-29 21:38:50,"There is a human cost from government overregulation. While its goals are laudable, the Endangered Species Act is an outdated law that rarely helps species recover and can lead to tragedy. Watch my remarks below:
#ModernizeESA https://t.co/EErCvb6ixb"
1222586571616129027,2020-01-29 18:25:27,USMCA is a huge win for Missouri farmers and will add $65 billion in new economic growth to the US economy. It was great to join the President at the White House today as he signed this historic trade deal. https://t.co/ktLrLZm5LR
1222274868475060224,2020-01-28 21:46:52,"Thanks to Dr. Don James, Dr. Casey Burton, and Matt Doellman from Phelps Health in Rolla for meeting with me today. We talked about the importance of funding research for our men and women in uniform. https://t.co/HkHVRejIa0"
1221904930618904582,2020-01-27 21:16:52,"Today, #WeRemember the nearly six million Jewish people who were systematically murdered by pure evil. We also promise to #NeverAgain let such horrific acts of hatred take place by standing against genocide and all forms of anti-Semitism. https://t.co/2j5ns1IJya"
1221480255367630848,2020-01-26 17:09:21,"President Trump understands how precious all lives are, including those of the unborn. His administration issued a rule to prevent taxpayer-funded abortions and cut funding from the UN because of its support for coercive abortions. #3YearsofTrump"
1221146155893055488,2020-01-25 19:01:46,"America is stronger today than it was three years ago because of President Trump. 

And he's achieved all of this success while facing historic obstruction from the Left. https://t.co/Xongh0bHMy"
1221085341597171713,2020-01-25 15:00:06,"Speaker Pelosi and her liberal lieutenants have shredded the Constitution in their desperate attempt to get rid of President Trump. And Democrat Senators Bernie Sanders, Elizabeth Warren, and others are complicit. Watch my full remarks here: https://t.co/T1TaMCBtjR"
1220838185799946240,2020-01-24 22:38:00,"Washington County Memorial Hospital in Potosi provides incredible, high-quality care to the community.

I look forward to continuing to work together on ways we can expand healthcare access to our rural communities. https://t.co/u0AhFqDRt8"
1220801915254190086,2020-01-24 20:13:52,"MOCAP manufactures plastic and rubber products––pipes, screws, and “anything with threads”—in Park Hills.

Thanks to historic tax cuts by @POTUS Trump, MOCAP had more resources to expand, invest, and grow here in Missouri. https://t.co/2M1HSCP8ih"
