id,created_at,text
1220137569364709376,2020-01-23 00:14:00,"I am very proud of the progress my office has made on postal issues in the district, but our work is not done. I continue to be engaged on this topic &amp; my team stands ready to help any constituents still experiencing postal problems. https://t.co/h53rnbzqUN"
1220079863668801538,2020-01-22 20:24:42,This is great news for Surry County and Charles City County! Broadband access is one of my top priorities in Congress and I am thrilled to see two localities in my district receive funding for broadband infrastructure. https://t.co/29c7gadllx
1219752997049315330,2020-01-21 22:45:51,"In November @RepRaulGrijalva and I unveiled our draft Environmental Justice for All Act.  It’s not too late for you to offer feedback on our bill in order to help us craft the most inclusive legislation possible! Submit your comment today! 
https://t.co/f9Rt6FbM5d https://t.co/aYuvYx1i2v"
1219683980330635264,2020-01-21 18:11:36,"Thank you to Roxie, Kristin, and Rabbi Knopf from J Street for meeting with me today in my Richmond office. I enjoyed our thoughtful discussion and look forward to continuing to work together. https://t.co/mQAsllnlYs"
1219338985773895681,2020-01-20 19:20:43,"I pray everyone stays safe out there and I commend the delegates, senators and the staff for continuing to do their jobs in these daunting circumstances. 3/3"
1219338984679264256,2020-01-20 19:20:42,"But in the face of these images intended to sow discouragement and despair, we must in the words of Dr. King, “build dikes of courage to hold back the flood of fear.” 2/3"
1219338982825349122,2020-01-20 19:20:42,"THREAD: Today as people across the nation acknowledge the non-violent legacy of Dr. King, photos of angry people with guns intent on overwhelming a city and a Capitol that I love are circulating in the media/online. 1/3 https://t.co/D0GvrV1jXR"
1219329079629041666,2020-01-20 18:41:21,"Today we celebrate the work and legacy of civil rights leader Dr. Martin Luther King, Jr. Across the district, we have paused to recognize his sacrifices, remember his uplifting words of acceptance and peace, and honor him with service to our community. https://t.co/HSesc8PJ9x"
1219328982476361736,2020-01-20 18:40:58,"""The time is always right to do what is right"" - Dr. Martin Luther King, Jr."
1218922498093461510,2020-01-19 15:45:44,Of course extra Congratulations go to @VAUnion1865 for the win! 🏆
1218919543533228034,2020-01-19 15:34:00,"Congratulations to @VSUTrojans  &amp; my alma mater, @VAUnion1865 on another successful @FreedomClassic Festival! It is an honor to have attended an HBCU and I was delighted to speak about how that experience has shaped my public service. https://t.co/udIblSK6i1"
1218902850006396928,2020-01-19 14:27:40,"RT @8NEWS: HOW COOL! @RepMcEachin was named an #honorary Tuskegee Airman by the Howard Baugh Chapter of #Tuskegee Airmen, Inc. https://t.co…"
1218644793154244611,2020-01-18 21:22:14,I am humbled to have been named an honorary Tuskegee Airman by the Howard Baugh Chapter of Tuskegee Airmen. I know that it is truly a singular honor. This jacket symbolizes those who were willing to fight for their country &amp; whose incredible contributions created a lasting legacy https://t.co/F83kFd7EU8
1217904241592938520,2020-01-16 20:19:33,Thanks to everyone who stopped by my Mobile McEachin this morning with the Virginia Taxpayer Advocate. I am glad we could help and I encourage anyone else with an IRS issue to reach out to my office at 804-486-1840. https://t.co/wyiMnBxPlA
1217850247562637312,2020-01-16 16:45:00,Middle and high school students still have three weeks left to submit essays for my Black History Month Essay Contest. I cannot wait to read about what Black History Month means to our young folks! https://t.co/EC3Gnf67Dh
1217613766151561216,2020-01-16 01:05:18,"Happy to stand w. @AARP &amp; older Americans across the nation by voting to pass H.R. 1230, a bill that restores to older workers alleging age discrimination in the workplace the same standard of proof used for claims of discrimination based on race, sex, national origin or religion https://t.co/h8Dzouuw2i"
1217599344398032898,2020-01-16 00:08:00,REMINDER: Tomorrow morning my office is hosting a Mobile McEachin with a Virginia Taxpayer Advocate. This is a great opportunity to get help with your IRS questions. https://t.co/yWHwkR18dz
1217584184144932865,2020-01-15 23:07:45,"Today, we remember Dr. Martin Luther King, Jr., born 91 years ago in Atlanta. Challenging a divided nation to believe in an estimation of one another beyond skin-deep, Dr. King’s vision of an America that would dare to live out its creed remains a guiding light to us all. https://t.co/1F3zwcu8zZ"
1217549993722228742,2020-01-15 20:51:54,"Today, I voted in favor of sending articles of impeachment to the Senate to hold @realDonaldTrump accountable for his ongoing abuse of power and the undermining the integrity of our electoral process. 

Full statement: https://t.co/Zp7Wks9cnR https://t.co/UFVWJ2gu3X"
1217481229819416577,2020-01-15 16:18:39,"Right now, the full National Resources Committee is considering H.R. 3068, the Offshore Wind Jobs and Opportunity Act, my legislation which would invest in offshore wind, creating tens of thousands of well-paying, green-collar American jobs. Watch live @NRDems below: https://t.co/8DpgifoRsh"
1217444425003040769,2020-01-15 13:52:24,"RT @USRepKCastor: We call them #TrumpsToxicTeam!
⚠ Andrew Wheeler: went from coal lobbyist to @EPA administrator (!)
⚠ David Bernhardt: wen…"
1217194169762045952,2020-01-14 21:17:59,"She also wrote me an eight page letter explaining the ways she is going to change her habits to become more eco-friendly in her daily life. Her passion for the environment is so inspiring, and I hope you will take a moment to read this excerpt from her letter. https://t.co/C7slUqOCcO"
1217194005521489921,2020-01-14 21:17:19,"Check out these photos from an #EcoHero from Chesapeake. Isabella took the challenge to heart, riding her bike instead of driving to practice, picking up litter, collecting pumpkins from her neighborhood to compost, &amp; even saved up her allowance to buy a tree to plant outside. https://t.co/JTA9UUg1W9"
1217106290037661696,2020-01-14 15:28:46,RT @EnergyCommerce: WATCH LIVE: Environment &amp; Climate Change Subcommittee legislative hearing on the American Innovation and Manufacturing…
1217102770739859457,2020-01-14 15:14:47,"Nearly all of these advanced materials are made/manufactured by factories right here at home. The legislation will accelerate the transition, supporting the creation of 33,000 new manufacturing jobs &amp; adding $125 B over the next decade to the U.S. economy.
https://t.co/fKDITfirNl"
1217102769624092681,2020-01-14 15:14:47,"Today, @EnergyCommerce will hear testimony on H.R. 5544, the  bipartisan AIM Leadership Act of 2020, which would give American companies &amp; workers a competitive edge during the global transition away from today’s cooling chemicals to next generation tech.
https://t.co/fKDITfirNl"
1217088299866738688,2020-01-14 14:17:17,"People's Choice, Caleb Thompson of Richmond https://t.co/0rAvgN12kI"
1217088189736857601,2020-01-14 14:16:51,"3rd Place, Roan Tierney of Richmond https://t.co/xUjmQHd28m"
1217088105360035840,2020-01-14 14:16:31,"2nd Place, Steven White of Suffolk https://t.co/4OtIZ9s3dh"
1217088022476398593,2020-01-14 14:16:11,"1st place, Ann Jacobson of Chesapeake https://t.co/CsjrGNECF5"
1217087951156412417,2020-01-14 14:15:54,"I am very excited to announce the winners of the VA04 Photo Contest! My office received many wonderful submissions, and I truly appreciate everyone who shared their talents and these amazing photos. I cannot wait to see these in my offices every day!"
1216891922960343046,2020-01-14 01:16:57,"As we grapple w. mass extinction of species, destruction of cities &amp; displacement of millions due to natural disasters, the stakes have never been higher to demand #ClimateAction. Join us on April 22, #EarthDay2020 as we come together to defend the environment &amp; our future. https://t.co/Kp44cpIY6B"
1216778495776501761,2020-01-13 17:46:14,THIS THURSDAY: My office is hosting a Mobile McEachin with a Taxpayer Advocate from 9:30AM - 12PM. Staff are available to help answer your IRS questions. I hope you can make it! https://t.co/JKoSnOf8re
1215714231678636032,2020-01-10 19:17:14,"Thrilled that the city of Richmond was named one of the top 52 places to visit in 2020. I may be biased, but I would have to agree that it’s a “dynamic cultural center on the cutting edge.”
https://t.co/EZh6iRoiKV"
1215656476771069954,2020-01-10 15:27:44,"As a co-sponsor of this important legislation, I am proud to support fellow Virginians, Kevin and his son, Kannon, in fighting to ensure insurance companies provide children living with birth defects the health coverage they deserve. #TeethAreNotCosmetic https://t.co/eH57A6defI"
1215421676755791874,2020-01-09 23:54:43,RT @RepDebHaaland: The American people don’t want war with Iran. Our fragile climate cannot bear another war. #WarPowersResolution @NRDems…
1215411381517848576,2020-01-09 23:13:49,"The War Powers Resolution my colleagues and I passed today, in keeping with Congress’ long-established oversight responsibilities, mandates that if the president wants take us to war, he must get authorization from Congress. Read my full statement: https://t.co/h2ysLiDs9d https://t.co/I5THTJ4ymM"
1215352526335348743,2020-01-09 19:19:57,"From helping municipalities transition to cleaner vehicles to installing electric vehicle charging stations, Clean Cities coalitions play an important role in green infrastructure development. Today’s markup reinforces our support for a clean transportation future #forthepeople. https://t.co/SDkufTC46l"
1215314370600886272,2020-01-09 16:48:20,"We cannot allow the Trump admin to gut #NEPA and exclude climate change in infrastructure planning. As the climate crisis worsens, we must work to ensure that we are well-equipped to contend with the threat of rising sea levels on new roads &amp; bridges in our coastal communities. https://t.co/3gPG0RSr2o"
1215054677945004039,2020-01-08 23:36:24,"Kevin Koser, fellow Virginian &amp; father to a son with a rare genetic condition spoke today before the @EnergyandCommerce Subcommittee on Health in support of the #EnsuringLastingSmiles Act. https://t.co/vq9YcOBh7O"
1215050449260294154,2020-01-08 23:19:36,RT @FrankPallone: The scientific consensus is clear - we must achieve net-zero carbon pollution no later than 2050 to avoid the most catast…
1215031962999631872,2020-01-08 22:06:08,"We must ##ActonClimate and transition to #100x50. As the sponsor of the 100% Clean Economy Act of 2019, I am pleased to see the @EnergyCommerce #CLEANFuture proposal and will fight with them to achieve a clean economy now! https://t.co/BVvolMqxze"
1214979470668500993,2020-01-08 18:37:33,"I am eager to be helpful as you build our economy and support our workers, protect Virginians from gun violence, improve our public schools, make voting easier &amp; move to protect our planet for future generations."
1214979241256869889,2020-01-08 18:36:38,Congratulations to the new General Assembly starting today. I am thrilled to see our first female Speaker of the House and the most diverse membership yet! https://t.co/VXHJSaBdlH
1214675578831421447,2020-01-07 22:30:00,"Next week my office is hosting a Mobile McEachin with Virginia Taxpayer Advocate Service to answer your IRS questions. I hope you can make it! 

If you are not able to attend and still have an IRS issue, please call my office at 804-486-1840. https://t.co/Ir0ImpBArU"
1214614212615581697,2020-01-07 18:26:09,Thanks to the Veterans Service officers and many community organizations who are hosting this valuable workshop!
1214614161021440003,2020-01-07 18:25:57,Tri-Cities Veterans - Check out this opportunity to get more information about navigating your Department of Veterans Affairs claims. You can bring your DD-214 and relevant medical documents to the Bishop Ireton Center from 9AM -3PM on January 13 &amp; 14th. https://t.co/IOygBrBXmX
1214302818452029440,2020-01-06 21:48:47,"Black History Month honors the historic &amp; present contributions that African Americans have made in our country. I want to encourage our students to think about what these contributions and this month mean to them personally, &amp; I look forward to seeing their responses. https://t.co/lKoFHcbUcF"
