id,created_at,text
1247256215345926144,2020-04-06 20:13:49,"Text ""MCEACHIN"" to 833-898-5483 today to RSVP for our tele-town hall this Thursday!

Get the answers you need from the experts about the coronavirus and steps federal, state and local officials are taking to keep our community safe and provide relief during this difficult time. https://t.co/nRCcRY3j66"
1247192264205578240,2020-04-06 15:59:42,"Now more than ever, we must persist in our fight to support environmental justice communities most affected by #COVID19. I was pleased to share with @Grist more on our plans to continue the charge to bring Environmental Justice for All to communities across the nation. https://t.co/sxjpJiPYV4"
1246106180075864065,2020-04-03 16:03:59,ICYMI - Here is some good news: @VCUHealth &amp; several other sites have begun a clinical trial to test the antiviral drug remdesivir for treating patients with #COVID19 https://t.co/zIGQwRMGmg
1245810891792232448,2020-04-02 20:30:37,"To nominate someone who you think deserves celebrating, send me an email at VA04.Projects@mail.house.gov and tell me what they are doing to help others affected by the COVID-19 pandemic."
1245810691178663936,2020-04-02 20:29:49,"I want to celebrate the good news stories, the helpers &amp; the frontline fighters during #COVID19. That's why I am launching #ThankANeighbor to highlight the helpers in #VA04 

Today I want to thank Shockoe Atelier for sewing 20K masks for the VCU hospital! Give them a round of 👏! https://t.co/BSMsVOZlHM"
1245781775009361929,2020-04-02 18:34:55,"RT @boblatta: .@HouseCommerce members @USRepMikeDoyle, Rep. Gianforte, @RepMcEachin &amp; I urge @TheJusticeDept &amp; @fcc to go after robocallers…"
1245760541890674688,2020-04-02 17:10:32,"As communities across the nation battle COVID19, @realDonaldTrump's decision to bar uninsured Americans from purchasing healthcare is more than negligent — it is intentionally cruel. 

We deserve better leadership in this crisis. 
The president should reopen #ACA enrollment NOW. https://t.co/jJ5XjrUSka"
1245743749872922625,2020-04-02 16:03:49,"Americans cannot afford to ""wait a few weeks"" for Congress to act, @senatemajldr. Families are suffering, our communities need relief and they need it now.

@HouseDemocrats #MovingForward addresses the infrastructure needed to fight this crisis. The Senate must not drag its feet. https://t.co/1oBfvtjDer"
1245742477279191041,2020-04-02 15:58:46,"SAVE THE DATE: Join me Thursday, April 9 for a tele-town hall and get answers to your questions about the coronavirus and the steps federal, state and local officials are taking to keep our community safe and provide relief during this difficult time. https://t.co/2DQ9Ioncxh"
1245485384433360898,2020-04-01 22:57:10,Have you filled out your #2020Census yet? A full and accurate count will make a difference in the way billions of dollars are allocated to communities across Virginia over the next decade. Let’s work to make sure Virginia counts! Visit https://t.co/6JHqjUEZmJ to get started. https://t.co/gGLb0EZ2P2
1245402773736300545,2020-04-01 17:28:54,"Today is #CensusDay! It only takes a moment to answer nine questions but their impact will be felt for the next decade in funding for clinics, schools, hospitals and programs that make a difference in our communities every day. Visit https://t.co/6JHqjUEZmJ to get started today! https://t.co/lxKONySdl6"
1245103055969845249,2020-03-31 21:37:56,"The #COVID19 pandemic has made this much clear: the #wagegap cannot be explained away. Women's labor has been critical to powering America during this crisis and the wage gap across industry and occupation, regardless of experience or education is unacceptable. #EqualPayDay https://t.co/jZOWzksGYW"
1245054396452536320,2020-03-31 18:24:34,"RT @NRDems: Due to continued crowding, high visitation and recent reported #Coronavirus cases, we’re encouraging @SecBernhardt to close @Gr…"
1245020095090434054,2020-03-31 16:08:16,"Every American deserves to be seen, known and celebrated for who they are. 

Today, on #TransDayOfVisibility, I am honored to show my support for trans people across the nation and join in celebrating the kaleidoscopic beauty of human difference revealed in gender diversity. https://t.co/cFpeCRYkB4"
1244993657482215425,2020-03-31 14:23:13,"As we work together to curb the spread of #COVID19 by staying home, no child in Virginia who depends on school lunch should go hungry. 

VA families can text ""food"" to 877-877 to find the closest approved meal sites from @VDOE_News @VDOESNP. https://t.co/W90i7Cc0Ss"
1244718832960372737,2020-03-30 20:11:10,"RT @GovernorVA: Today I'm issuing a Stay at Home order, effective immediately.

Our message to Virginians is clear—stay home. These actions…"
1244706417233334272,2020-03-30 19:21:50,"Today, @GovernorVA issued a stay in place order for VA effective until 6/10. Staying home to curb the spread of #COVID19 in our communities is hard, but we all must continue to do our part to help flatten the curve &amp; save lives. Stay strong, VA. We will get through this together. https://t.co/FldGroBRj8"
1243631762737172483,2020-03-27 20:11:32,"RT @RepSpanberger: YOU can make this happen.

Not by tweeting, but by invoking the Defense Production Act (DPA).

It's beyond time for real…"
1243612093921853446,2020-03-27 18:53:23,"These are the tools our healthcare workers need to take on the coronavirus.

Even as they risk their lives to save ours, many healthcare workers are facing shortages of the resources they need. 

Today’s passage of the #CARESAct will help them access #PPEnow. https://t.co/uQb5xbeYLz"
1243526786312540160,2020-03-27 13:14:24,Q: How will a person who has recently moved access direct assistance rebates? ⬇️ https://t.co/GFMvRaR22D
1243526784391536643,2020-03-27 13:14:23,Q: What identification requirements apply to receive direct assistance rebates? ⬇️ https://t.co/oqd67efQgb
1243526781996601349,2020-03-27 13:14:23,Q: Will the direct assistance rebates affect my eligibility for federal income-targeted programs? ⬇️ https://t.co/ewxQXxI2SK
1243526777944846337,2020-03-27 13:14:22,Q: Are tax return non-filers eligible for direct assistance rebates? ⬇️ https://t.co/CjrdHYp0Vx
1243526775734493188,2020-03-27 13:14:21,Q: Do the direct assistance rebates need to be repaid? ⬇️ https://t.co/94VtJ5cJGY
1243526773368852481,2020-03-27 13:14:21,Q: How will direct assistance rebates be delivered? ⬇️ https://t.co/dTAhT6y9qY
1243526771242414082,2020-03-27 13:14:20,Q: How large are the direct assistance rebates? (2/2) ⬇️ https://t.co/hp7g8Vyk2T
1243526769036210183,2020-03-27 13:14:20,Q: How large are the direct assistance rebates? (1/2) ⬇️ https://t.co/BczYX7aOp4
1243526766884524033,2020-03-27 13:14:19,Q: Why is Congress proposing to pay rebates directly to individuals? ⬇️ https://t.co/Mdhmd4plaK
1243526764380540929,2020-03-27 13:14:18,"Today, @HouseDemocrats will vote to pass a $2 trillion  stimulus bill to put small businesses, workers and families first in the #COVID19 crisis, including provisions for direct assistance to provide quick economic relief #ForthePeople. Here's what you need to know. #CARESActFAQ https://t.co/YONF4KSbLc"
1243519227644063748,2020-03-27 12:44:21,"RT @RepDMP: Let's remember that even under the most difficult circumstances, we find ways to rise up. 

To lift one another's spirits. 

An…"
1243376520137256960,2020-03-27 03:17:17,RT @GovernorVA: Tonight I spoke with Virginia's congressional delegation—I thanked them for their ongoing partnership in mitigating the spr…
1243376322547789825,2020-03-27 03:16:30,"RT @HouseDemocrats: .@SpeakerPelosi's role in our nation’s history can never be adequately described through words.

Our leader has dedicat…"
1242975770164813824,2020-03-26 00:44:51,We are putting assistance for working Americans first - not big corporations - and I look forward to hearing more from #VA04 small businesses &amp; their staff. Don't miss this opportunity for Q&amp;A and to hear more on our 3rd #COVID19 package &amp; other resources for small businesses. https://t.co/Nc7m3nor8x
1242897443680903168,2020-03-25 19:33:37,"Today, I joined @RepRashida &amp; @RepDebDingell in urging leadership to include water shutoff preventions missing in the Senate's #COVID19 response bill. 

Our top defense in this pandemic is hand-washing. No American should be w/o safe &amp; clean water access.
https://t.co/M5S8ApvYbX"
1242880236439691271,2020-03-25 18:25:14,"Join me tomorrow for a #VA04 Virtual Fireside Chat featuring the @SBAgov and local small business/hospitality  stakeholders to discuss federal solutions to help w. the economic disruptions caused by the #COVID19 crisis.

Register at the link below! ⬇️
https://t.co/lUv8VwXxvk https://t.co/i7X8hGIPaz"
1242824523302436864,2020-03-25 14:43:51,"Restaurants &amp; small businesses across #VA04 have made it clear: they need help, &amp; they need it now. 

Our 3rd #COVID19 aid package takes responsibility first for workers &amp; small businesses - not CEOs, stock buybacks or layoffs. We hear you &amp; we are determined to get this right. https://t.co/lOywtqC5BA"
1242558974286794752,2020-03-24 21:08:39,"RT @RepSpanberger: To everyone who is treating the sick, caring for the elderly, stocking shelves, collecting trash, responding to emergenc…"
1242519648396087296,2020-03-24 18:32:23,"RT @MelLeonor_: Starting tomorrow, Virginia's COVID-19 briefings will no longer happen daily. They'll move to Mondays, Wednesdays and Frida…"
1242489142552002560,2020-03-24 16:31:10,"As we engage in distance learning &amp; tele-working in the #COVID19 crisis, the need to bridge our digital divide is clear. Now signed into law, my #MAPSAct stops ISPs from using inaccurate coverage maps, moving us closer to connectivity for all Americans.
https://t.co/PYvKjvk1T9"
1242271849536540674,2020-03-24 02:07:43,"RT @GovernorVA: As we continue responding to the #COVID19 outbreak, my highest priority is protecting the health and safety of all Virginia…"
1242143510066860032,2020-03-23 17:37:45,"RT @EJinAction: Our indigenous brothers &amp; sisters have shared with us for a millennium that, “Water Is Life.” These important words take on…"
1242143392299089923,2020-03-23 17:37:17,"Our coronavirus response must prioritize the needs of  working families and small businesses over corporations. Today, I am joining @NewDemCoalition in calling for direct economic assistance and robust #UI  for individuals w/ hours &amp; wages most impacted by the #COVID19 crisis. https://t.co/Ys9iZnz42I"
1242107828720078851,2020-03-23 15:15:58,"No American should go bankrupt just because they get sick. 

Ten years ago, President Obama's #AffordableCareAct transformed American healthcare and today, we continue the fight to #ProtectOurCare for over 133 million Americans with pre-existing conditions covered by ACA. https://t.co/iFiYdgzyxO"
1241572841885220864,2020-03-22 03:50:07,"RT @HouseDemocrats: Thank you for doing your part to #FlattenTheCurve. 

Things to do at home:
📚Read to your children
📱Call your loved ones…"
1241169811796787200,2020-03-21 01:08:37,"I hear you and help is on the way. As we craft our third #COVID19 response package, you and your staff are at the top of our minds. 

Now more than ever, your voices are crucial. In the coming days, I will be reaching out directly to hear more. We will not leave you behind. https://t.co/PTJcZH9ElF"
1240721467261816833,2020-03-19 19:27:03,"RT @GovernorVA: I'll be giving a #COVID19 update with the Virginia Emergency Support Team shortly.

Watch live at https://t.co/SNdePsaKTG o…"
1240693342192545792,2020-03-19 17:35:18,"In these trying times, American vets should never worry how we will keep our promise to them. That's why today, the House passed S.5303 to help student vets as schools close or move online by giving @DeptVetAffairs the authority to continue GI Bill payments &amp; housing allowances. https://t.co/V5CruZlOwc"
1240664270246944768,2020-03-19 15:39:47,"Consider visiting a restaurant or small business in your community to support them if you can with a curbside pickup order. @CBS6 has compiled this list of eateries in the greater Richmond area that are still serving the community!

https://t.co/AULpnHLuiW"
1240370513932947458,2020-03-18 20:12:30,"During the #COVID19 crisis, @HenricoSchools is taking action to ensure their students w/o internet at home are not left behind. 

Students who have previously notified the district that they lack internet can pick up wi-fi hotspots today! More info ⬇️
https://t.co/Mdo7hMpv3X"
1240271958115266560,2020-03-18 13:40:52,"Pleased to announce the 100% Clean Economy Act, my legislation to achieve economy-wide net-zero greenhouse gas emissions by 2050, was endorsed by the @NewDemCoalition. It is crucial we take the steps necessary to address climate change &amp; develop solutions to the crisis. https://t.co/BfYREknqhL"
1239980977860104200,2020-03-17 18:24:37,"#COVID19 has shaken all of our communities, and we all must prepare for further impacts. Last week, I joined my colleagues in sending a letter to share our concern re. the pandemic’s impact on the #2020Census and ask for the Bureau’s plan to ensure a full, fair &amp; accurate count. https://t.co/jRpwxqZxrJ"
1239964702517551106,2020-03-17 17:19:57,"While all schools in VA are closed for the next two weeks, #VA04 school districts are developing meal distribution plans to make sure that no students go hungry. Find #COVID19 updates &amp; info about meal distribution sites below! 

https://t.co/KvAs2DElrx https://t.co/FWJUa6Lj7L"
1239929213139943424,2020-03-17 14:58:55,#ICYMI I joined @8News yesterday to provide updates on the federal response to the coronavirus pandemic. Tune in to watch the full special at the link: https://t.co/o7XdLAOqRN https://t.co/muho8Z3OLB
1239593564046266370,2020-03-16 16:45:10,"""Thank you for your patience and flexibility in the days ahead. We are standing by to assist with any federal #COVID19 concerns you may have. And I assure you, we will get through this crisis the way Americans best face our biggest challenges – together.""

https://t.co/YeyASOjJZy"
1239267373334626308,2020-03-15 19:09:00,"Tune in as Congressman McEachin joins Governor Northam live to discuss updates to the novel coronavirus (COVID-19) response.

https://t.co/ftprHNB8SC"
1239250294518829058,2020-03-15 18:01:09,Please visit my Facebook page to find more information about #VA04 school meal distribution as Virginia schools are closed for the next two weeks. https://t.co/yv6lAdjMFy
1238956007633481728,2020-03-14 22:31:45,"From all of us here in Cannon 314, #HappyPiDay! 🥧🥳 https://t.co/i9J4EFdne0"
1238840781311533056,2020-03-14 14:53:53,"As schools close &amp; health experts urge preventative measures to fight the spread of #COVID19 in VA &amp; across the country, we cannot gamble on the livelihoods of children &amp; working families. That's why late last night, I joined @HouseDemocrats in passing the #FamiliesFirst Act. https://t.co/6QqfAdHOWM"
1238557118183157767,2020-03-13 20:06:42,"Deeply honored to have received a rating of 100% from 
@LCVoters on their 2019 #LCVScorecard. Last year, we took great strides in the House to champion a sustainable future for all and I look forward to continuing to fight for bold, inclusive climate change solutions. https://t.co/ob5Wbf2YC0"
1237866392306593792,2020-03-11 22:22:01,"Sacrifices made by American service members and their families are too costly to act without the highest level of safety, security, and consideration. If the president wants take us to war, he must get authorization from Congress.
https://t.co/qDm7M9wzty"
1237843035515281410,2020-03-11 20:49:12,"This funding will enable RRHA to hire or retain service coordinators who work to connect public housing residents with employment training, financial literacy services, educational opportunities, and health and wellness programs."
1237842978141384707,2020-03-11 20:48:58,This afternoon at the Armstrong Renaissance Community Center @VibrantRRHA received $717K grant from HUD as part of their Resident Opportunities and Self-Sufficiency - Service Coordinators program (ROSS-SC). https://t.co/JtvZSCxYWf
1237832786028957696,2020-03-11 20:08:28,"RT @HouseDemocrats: Help prevent the spread of #COVID19:

🧼Wash your hands often for at least 20 seconds
🌡️Stay home if you’re sick
✨Disinf…"
1237808466623959040,2020-03-11 18:31:50,"RT @scotq: ""Too often Environmental Justice communities have been left out of the process. Our bill strengthens the civil rights, robust su…"
1237806461587263489,2020-03-11 18:23:52,"VP of National Wildlife Federation @EJinAction cites 23 M, mostly African and Latino Americans, with asthma as proof of the ways that systematic racism affect communities of color disproportionately. Says, ""We HAVE to get engaged."" to  applause.
LIVE at: https://t.co/vrWJq60hoB… https://t.co/3Ky1577HBV"
1237804985687171072,2020-03-11 18:18:00,"Dr. Astrid Caldas w. @UCSUSA noted the science explaining the direct correlation between higher temperatures and increases in flooding in communities, says, ""Our government must stop perpetuating inequities.

Follow along with us: https://t.co/vrWJq60hoB https://t.co/l6c6kiOXZa"
1237803425745772546,2020-03-11 18:11:48,".@SierraClub's Pedro Cruz challenges attendees to support a just transition, saying, ""We need to change our mentality moving forward to improve policies that affect people directly impacted by environmental justice.""

Follow along at the link: https://t.co/nElFJPesVV https://t.co/M3CpXINffE"
1237801810326368257,2020-03-11 18:05:23,"“People who are most vulnerable are the ones who are going to suffer” - Keya Chaterjee, Exec Dir of the US Climate Action Network connects environmental concerns directly to social justice; says she changed careers in 2002 when she realized the climate crisis was coming. https://t.co/ArpBXPLJVW"
1237800452231749632,2020-03-11 17:59:59,RT @scotq: Excited for this Congressional briefing which will include @dannadogwood @EJinAction @KingdomLiving4u and a whole host of great…
1237800281800392704,2020-03-11 17:59:19,Streaming LIVE at the link: https://t.co/nElFJPesVV https://t.co/BcP5MAHHe5
1237778638940114946,2020-03-11 16:33:18,"Join us soon via live-stream as we convene with leaders representing frontline climate communities for a congressional briefing titled, Climate Crisis or Climate Emergency: Where Do We Go From Here. 

Live-stream will begin at 1:15 p.m.! https://t.co/nOUKBxatvA"
1237778348669120512,2020-03-11 16:32:09,"RT @RepValDemings: Wash your hands. Don't fear your fellow Americans.

Let’s be one America and beat this together.

The virus doesn’t disc…"
1237496616602472448,2020-03-10 21:52:39,"Last year, Virginia became the first state to bar insurers from excluding co-pay assistance from a patient's out-of-pocket limit. I was pleased to lead over 70 colleagues in urging @HHS to ensure these protections are available to those struggling w/ Rx prices across the country. https://t.co/0AFpUFNPVD"
1237476016676917253,2020-03-10 20:30:48,"As a father to two young women, the black maternal health crisis is a deeply personal matter. To #SaveMoms, Congress must prioritize centering the voices of the women affected and commit to supporting evidence-based solutions. The @BMHCaucus' #Momnibus does just that. https://t.co/Jy1vkhP2i7"
1237452220112801793,2020-03-10 18:56:14,"Virginia has a crisis on its hands. No moms should lose their lives bringing life into this world, but Black moms are 3x more likely to die from pregnancy-related complications.  Today, we introduced the Black Maternal Health #Momnibus to address this crisis and #SaveMoms. https://t.co/679T3ks9OF"
1237376814781206533,2020-03-10 13:56:36,"RT @RepHorsford: THIS WEEK: You'll begin receiving invitations to participate in the #Census2020. 

There is too much at stake to not parti…"
1237053281446264834,2020-03-09 16:31:00,"We are quickly approaching the April 15th tax filing deadline, but there is still time to get help if you need it.

A member of my team will be in McKenney next Thursday, March 19th with a Virginia Taxpayer Advocate to help answer your IRS questions. https://t.co/ZYaEgXyJod"
1237007716763172866,2020-03-09 13:29:56,"RT @BMHCaucus: Tomorrow, the @BMHCaucus is making an important announcement! To keep up to date with the Caucus, sign up for updates on our…"
1236017300882538496,2020-03-06 19:54:23,"RT @ClimateReality: Rising ocean temperatures and acidification are taking a toll on precious marine life and corals, including the Great B…"
1235990403750465536,2020-03-06 18:07:30,"RT @NRDC_AF: Thank you for leading to address environmental justice, @RepRaulGrijalva and @RepMcEachin. https://t.co/UWAHiGFqFV"
1235329589435674629,2020-03-04 22:21:40,"We must act now to protect the American people from the coronavirus. Today @HouseDemocrats are moving quickly to ensure our federal, state, and local health officials can address the scale and seriousness of this global health threat.
https://t.co/CT8vkqDt5G"
1235292371371413514,2020-03-04 19:53:46,"RT @HouseDemocrats: House Democrats negotiated a bipartisan $8.3 billion #coronavirus supplemental—including $3 billion for research, $7 bi…"
1235273417772933122,2020-03-04 18:38:27,"As the coronavirus threat in the U.S. evolves,  @HouseDemocrats are prioritizing funding neccessary to ensure the federal agencies and public health officials working diligently to keep our communities healthy can effectively do their jobs. 
https://t.co/KL1GpIlyzl"
1235256961110769670,2020-03-04 17:33:04,"RT @NRDems: It’s no coincidence that the drivers of environmental policy right now are big gas &amp; big oil.
 
Chair @RepRaulGrijalva and @Rep…"
1234975086479699971,2020-03-03 22:53:00,"RT @salaam: Alyssa was all ears to hear about our work to solve hunger. @JSalehWilliams noted, ""We can't pantry ourselves out of this."" Gla…"
1234944487522213888,2020-03-03 20:51:24,"I am pleased to see VA take action to protect our children from conversion therapy. Few practices hurt LGBTQ youth more than attempts to change their sexual orientation or gender identity. To all of those young people, know that you are celebrated exactly as you are. 🏳️‍🌈 https://t.co/GPIbnWX5gt"
1234923645253902336,2020-03-03 19:28:35,RT @EnergyCommerce: Good news! The House just passed a bipartisan broadband mapping bill that included @daveloebsack’s Broadband DATA Act a…
1234597827390713856,2020-03-02 21:53:54,"RT @EHPonline: “For far too long, communities of color, low-income communities and tribal and indigenous communities have not been a meanin…"
1233505982929653760,2020-02-28 21:35:18,"“This is great news! I am so glad to see more good, green jobs coming to Chesapeake. Congratulations to @AboutChesapeake, @VEDPVirginia and @PortofVirginia  on securing this win for Hampton Roads and for the Commonwealth. 
https://t.co/8IxbZRZXpp"
1233504089490755586,2020-02-28 21:27:46,"""We cannot solve the greatest environmental challenges facing us today while ignoring broader concerns of civil rights, because environmental impacts do not exist in a vacuum...""

Thank you, @DefendOurFuture for standing with us as we push for intersectional #EnviroJusticeNOW. https://t.co/jJQx8IEf2F"
1233459972979273730,2020-02-28 18:32:28,"""We stand on the shoulders of giants who held firm to daring resolve, fighting for &amp; following these truths to define through their struggle &amp; shared determination a more complete American story that included them and their loved ones."" #BlackHistoryMonth https://t.co/pihk5IqtHu"
1233451242636095488,2020-02-28 17:57:47,Thank you @EJinAction for supporting our landmark #EnviroJusticeNOW legislation. It's time to be purposeful about environmental policy that protects ALL of our communities from the effects of pollution and climate change. Happy to have you alongside us in the fight. https://t.co/NrRRiuffJQ
1233135638440030216,2020-02-27 21:03:41,"RT @ClimateCrisis: As we work on climate solutions, we must address the injustices of the past &amp; make America more equitable.
 
Thank you @…"
1233134866570653701,2020-02-27 21:00:37,"#ICYMI @Earthjustice called today's #EnviroJusticeNOW bill a ""bold/necessary shift in the way we create federal enviro policy,"" citing it as the result of a yrs-long effort to put expertise/concerns of people experiencing the worst of pollution first. https://t.co/U2vJSVH3k9"
1233132223651557376,2020-02-27 20:50:07,"Critical programs that rely on an accurate #2020Census count: 
🏥 #Medicaid
🍴 #SNAP
🏗️ Infrastructure grants
🏫 Education funding
💰 and more than $800 billion of other federal funding"
1233132131758616586,2020-02-27 20:49:45,"#DidYouKnow Undercounting in the #2020Census could cause an inaccurate allocation of more than $800 BILLION dollars of taxpayer funds for critical programs like #Medicaid, #SNAP, infrastructure projects, and education grants. #BeCounted #BlackCensus2020"
1233070578413821954,2020-02-27 16:45:09,"RT @RepDonBeyer: Exemplary leadership from @RepMcEachin and @RepRaulGrijalva, who worked on environmental justice for years and today put f…"
1233053930285867010,2020-02-27 15:39:00,RT @seemonicamarie: Packed house for the rollout of Chair @RepRaulGrijalva &amp; @RepMcEachin’s landmark environmental justice bill! This is th…
1233050084272746497,2020-02-27 15:23:43,RT @DefendOurFuture: .@NRDems Chair @RepRaulGrijalva and @RepMcEachin are dropping their #EnviroJusticeNow bill today to tackle environment…
1233049987518361600,2020-02-27 15:23:20,"RT @RepHuffman: Communities of color bear an unequal burden of pollution &amp; #ClimateChange impacts in the U.S.
 
@RepRaulGrijalva &amp; @RepMcEa…"
