id,created_at,text
1233049892274233345,2020-02-27 15:22:57,"RT @NRDems: Chair @RepRaulGrijalva &amp; @RepMcEachin are standing with people across the country demanding #EnviroJusticeNow.
 
They will be i…"
1233049763634958338,2020-02-27 15:22:27,"RT @USRepKCastor: From extreme heat to air pollution, the #ClimateCrisis hits communities of color &amp; low-income families the hardest.

Thx…"
1233044954177556480,2020-02-27 15:03:20,"Join us LIVE as we introduce the Environmental Justice for All Act #EnviroJusticeNow
https://t.co/GzcvWzO8Y6 https://t.co/TswyYRONtu"
1233044491499646978,2020-02-27 15:01:30,"RT @NRDems: After over a year of working with environmental justice advocates and listening to the public, Chair @RepRaulGrijalva &amp; @RepMcE…"
1232778681027874817,2020-02-26 21:25:16,"After hundreds of hours of input, months of open comment and a historical Congressional Convening, I am thrilled to join @NRDems Chair @RepRaulGrijalva tomorrow in introducing our landmark Enviro Justice for All Act. 
Join us by livestream tomorrow @ 10 a.m. #EnviroJusticeNow https://t.co/Twk4sDxrwQ"
1232778679283048448,2020-02-26 21:25:15,"Addressing the long-standing environmental inequities that disproportionately harm communities of color, low-income communities and the Tribal and indigenous communities across the country cannot wait. #EnviroJusticeNow https://t.co/rFdjYMJmwx"
1232698115414724612,2020-02-26 16:05:07,RT @RepRaulGrijalva: This morning Trump is blowing up a Native American sacred site for his border wall. His administration put out a press…
1232398071172096000,2020-02-25 20:12:51,"🚨Calling all high school artists🚨 

My office is now accepting entries for the 2020 #CongressionalArtCompetition. Please see below or check out my website at https://t.co/9kjcVdHnKo for more information. #CAC2020

I cannot wait to see what you all create! 🎨 https://t.co/RZFmFGXyFs"
1232025907688288257,2020-02-24 19:34:00,"Shattering barriers of race &amp; gender at @NASA, Katherine Johnson's extraordinary life reflected the best in American determination &amp; ingenuity, redefining possibilities for blk women in STEM &amp; challenging our nation to reach to the stars. May she rest in peace. #BlackHistoryMonth https://t.co/pTW1AKgHIk"
1232017497307611136,2020-02-24 19:00:35,Thank you @EnvDefenseFund for highlighting this important work. We owe it to all Americans to enact policies that move us towards the more sustainable world we must build. https://t.co/pHW09gOmwk
1231285367283818496,2020-02-22 18:31:22,"RT @DonaldNorcross: The 4 Donald’s in Congress, trying to make our namesake great again. 
@RepDonaldPayne @RepMcEachin @RepDonBeyer https:/…"
1230999452636368896,2020-02-21 23:35:15,"Born in 1940 to sharecroppers in Alabama, @repjohnlewis dedicated his life first to activism as a Civil Rights Movement Leader and later to public service, representing the people of #GA05 which encompasses Atlanta in the U.S. House since 1987. Happy Birthday! #BlackHistoryMonth https://t.co/SVwsm5x1Fj"
1230970541697372163,2020-02-21 21:40:22,RT @PreservationAct: Legislation was introduced in the House by @RepMcEachin  to study designating the Great Dismal Swamp in Virginia and N…
1230970479219019777,2020-02-21 21:40:07,RT @Honor_The_Gift: Highlighting the 6 Immuno Bill Champions in the House of Representatives who took the lead on introducing H.R. 5534 in…
1230596529527939080,2020-02-20 20:54:10,"RT @KellyWismer: Great to see @RepMcEachin, @RepSpanberger hosting a #RuralBroadbandNow discussion today! Glad @PGEC_coops's @Ruralband1 is…"
1230596474339282944,2020-02-20 20:53:57,"Thank you for joining us today, Commissioner @GeoffreyStarks! https://t.co/tgNCDcNjZl"
1230580547300339713,2020-02-20 19:50:40,"RT @PrinceGeorgeVa: Rural Broadband Roundtable discussion underway at this hour at the Central Wellness Center, hosted by Congress members…"
1230546360128155650,2020-02-20 17:34:49,"RT @EDFaction: Thank you, @RepMcEachin, for your commitment to clean air, a stable climate and a just world. #BlackHistoryMonth https://t.c…"
1230194314921283584,2020-02-19 18:15:55,"RT @BMHCaucus: Last week, @Essence profiled efforts from Congressional leaders like @SenKamalaHarris, @SenBooker, @RepRobinKelly, @RepPress…"
1230174047918530560,2020-02-19 16:55:23,"This Thursday, @RepSpanberger, @FCC Commissioner @GeoffreyStarks and other stakeholders will join me in #VA04 to discuss the future of broadband access in rural communities across the country and what we can do to help in Congress. Don't miss it! RSVP⬇️
https://t.co/oVYjPorqDa https://t.co/7SePFfYBau"
1230155428107034625,2020-02-19 15:41:23,"I had the pleasure of attending the Dinwiddie Hometown Heroes Awards presentation last night, where Sharon Bonner Yates &amp; George Rivers were recognized for their lifetime contributions to the @DinwiddieInfo community. https://t.co/sdWXIFhFAK"
1229934679077335040,2020-02-19 01:04:13,I am praying for everyone’s safety as crews respond to this terrible fire in Richmond this evening https://t.co/SvD5FiS3ze
1229906001119399937,2020-02-18 23:10:15,"Today in #BlackHistoryMonth, I’m honoring Arthur Ashe, a Richmond native who made history as the first &amp; only Afr. Am. male to win a Wimbledon singles title. An exemplary athlete and activist, Ashe worked to break down racial barriers in athletics and public health education. https://t.co/bDVhnNCO77"
1229877538232655872,2020-02-18 21:17:09,"RT @DefendOurFuture: .@RepMcEachin, thank you for your leadership on climate action and for advancing solutions that will protect vulnerabl…"
1229877417709391882,2020-02-18 21:16:41,"RT @RepSpanberger: In the 21st century, no mother should worry about dying in childbirth. Rising maternal death rates, particularly among w…"
1229840429014798338,2020-02-18 18:49:42,"This Thursday, @RepSpanberger, @FCC Commissioner @GeoffreyStarks and other stakeholders will join me in #VA04 to discuss the future of broadband access in rural communities across the country and what we can do to help in Congress. RSVP to join us:⬇️
https://t.co/oVYjPorqDa https://t.co/fJXilmHZ1A"
1228388127963799554,2020-02-14 18:38:46,"Today, my @EnergyCommerce colleagues and I sent a letter urging @FCC to reconsider the Rural Digital Opportunity fund. We must ensure it does not undermine the abilities of states to help close the digital divide, leaving Americans behind. https://t.co/i6CXYy2lU8"
1228385584084848640,2020-02-14 18:28:40,"RT @BMHCaucus: This week, @RepMcEachin introduced a resolution to recognize America's maternal mortality crisis &amp; call for urgent action to…"
1228073487237099520,2020-02-13 21:48:30,"As we look to the future with the passage of the #ERA, we must reflect on those who came before us. Maggie Walker's story serves to highlight often-unsung Af. Am. female entrepreneurs and the accomplishments they achieved in the face of great hardships. #BlackHistoryMonth https://t.co/qL3lTykMdB"
1228069984871616512,2020-02-13 21:34:35,RT @SavingPlaces: .@RepMcEachin Introduces Bipartisan Legislation To Protect The Great Dismal Swamp https://t.co/qU4IFBUbeX #DismalSwampAct
1228067237589901312,2020-02-13 21:23:40,"RT @RepAdams: Our health system is failing Black mothers &amp; their children.

Yesterday, I was proud to join my colleague @RepMcEachin in int…"
1228001446177669121,2020-02-13 17:02:14,"Today I was pleased to cast my vote to pass the #ERA. Women across the country still earn $0.80 for every dollar that men do, with women of color earning even less. We will not rest until the ERA is ratified and women are equal under the law.

@SenateMajLdr it is time for ACTION. https://t.co/WKUgjux24O"
1227720276890279937,2020-02-12 22:24:58,"Today in #BlackHistoryMonth, I am celebrating the political legacy of John Mercer Langston. Elected in 1890, Langston was the first Af. Am. Congressman from Virginia, representing our very own #VA04. It is an honor to highlight his accomplishments &amp; follow in his footsteps. https://t.co/8m5nk8C0OJ"
1227611967931768835,2020-02-12 15:14:35,RT @audubonsociety: Thank you @RepDebDingell @RepDianaDeGette @RepRaulGrijalva @RepPeterDeFazio @RepMcEachin for your work to prevent the g…
1227395733432696832,2020-02-12 00:55:21,"RT @AyannaPressley: This #BlackHistoryMonth I’m uplifting the critical history making role of staffers

Today I’m lifting up Keenan, a phen…"
1227369931194404864,2020-02-11 23:12:49,"The only known water-based stop on the Underground Railroad, the Great Dismal Swamp was a place of refuge for Af. Am. escaping the evils of slavery. The Dismal illuminates a more complete American story, reflecting the deep resolve of those who endured its hardships for freedom. https://t.co/9T8myDpb0y"
1227365975189807104,2020-02-11 22:57:06,"RT @PreservationNC: The Great Dismal Swamp has immense cultural, historic, and environmental significance for Virginia, North Carolina, and…"
1227365637586071552,2020-02-11 22:55:46,RT @SOlympicsVA: We just had a great meeting with the office of @RepMcEachin. Thanks for allowing us to share the impact of our programs wi…
1227334946391457792,2020-02-11 20:53:48,"RT @trailcrews: Great news! Additional protections tell the full story of this landscape! Thank you, @RepMcEachin! 👏 👏 👏 #DismalSwampAct ht…"
1227326948667424769,2020-02-11 20:22:01,"RT @Wilderness: The Great Dismal Swamp has immense cultural, historic, and environmental significance for Virginia, North Carolina, and our…"
1227319633088217089,2020-02-11 19:52:57,"RT @BobbyScott: For Native Americans fleeing colonial expansion &amp; enslaved people escaping bondage, the Great Dismal Swamp offered refuge.…"
1227307920431484929,2020-02-11 19:06:25,RT @aesutz: I'm honored to be working on this bill -- and excited to help preserve the history and ecology of the #GreatDismalSwamp! https:…
1227303909091352577,2020-02-11 18:50:28,"RT @SouthWings: The Great Dismal Swamp has immense cultural, historic, and environmental significance for Virginia, North Carolina, and our…"
1227302373388947456,2020-02-11 18:44:22,"Adding billions of dollars to our economy and support thousands of jobs, National Heritage Areas like the one the #DismalSwampAct calls for considering generate $5.50 to local economies for every dollar invested by Congress. https://t.co/lhacZ18pZW"
1227298550545100800,2020-02-11 18:29:11,"National Heritage Areas are public-private collaborations that direct federal resources to assist local communities in education, conservation and tourism efforts; The #DismalSwampAct would not affect private property rights. https://t.co/loTTcnVFOs"
1227295432419704832,2020-02-11 18:16:47,"More than a wildlife refuge, the Dismal was once a human sanctuary as the ancestral lands of Native people &amp; a home to 1000's of enslaved blacks who came to the swamps seeking freedom. The #DismalSwampAct would ensure the preservation of these quintessentially American stories. https://t.co/TjEQDdWFKi"
1227293055335747590,2020-02-11 18:07:21,"Today, I will be introducing the #DismalSwampAct, a first step in directing federal resources and protections towards ensuring the Swamp's cultural and natural history is preserved for future generations because #HeritageMatters. https://t.co/psG1lrwA9U"
1227290996842618882,2020-02-11 17:59:10,"RT @RepRaulGrijalva: Communities of color have fought environmental racism for decades.

#OTD in 1994, President Clinton signed an EO to ad…"
1226169056190967813,2020-02-08 15:40:58,"I look forward to introducing  the Great Dismal Swamp National Heritage Area Act to provide local and regional communities with the resources needed to ensure future generations can share in its quintessentially American story.
https://t.co/jvYe7PGDLX"
1226169055171825669,2020-02-08 15:40:58,"In addition to safeguarding wildlife populations and their habitats, the Great Dismal Swamp is also an American storyteller — preserving and commemorating people, cultures, and events that are key to our nation’s history.
https://t.co/jvYe7PGDLX"
1225838306275078145,2020-02-07 17:46:41,RT @DefendOurFuture: “Transitioning to a 100% clean energy economy will protect public health and our environment; create well-paying clean…
1225792776903720960,2020-02-07 14:45:46,"New historical highway marker signs were unveiled for both Hill and Robinson so that generations to come may learn from, remember, and celebrate their legacies. https://t.co/PXTSAf1DtG"
1225792724462379010,2020-02-07 14:45:34,"Yesterday afternoon in Richmond, civil rights attorneys Oliver Hill and Spottswood Robinson were honored for their lifelong commitment to fighting inequities in education, public transportation, and the criminal justice system."
1225595033899937792,2020-02-07 01:40:01,Today I will be voting for H.Res. 826 to #ProtectOurCare. Trump's Medicaid block grant proposal threatens access to care for our most vulnerable citizens just for a cheap shot at the Affordable Care Act. That is more than illegal -- it is unacceptable. https://t.co/VizT1ghIOj
1225528428289503250,2020-02-06 21:15:21,"I'm supporting the #PROAct today because in America if you're willing to work hard, you should be able to get ahead. Our history shows working families can get a fair shot in this country, but only if they have the power to stand together and fight for the rights they deserve. https://t.co/s0gNWXI1LN"
1225486430627074050,2020-02-06 18:28:28,"Today, in celebration of #BlackHistoryMonth I honor Oliver Hill and Spottswood Robinson. Both natives of Richmond, Hill and Robinson worked tirelessly taking on school segregation, taking their case all the way to the Supreme Court case, Brown v. the Board of Education. https://t.co/oCkDQIInDF"
1225477618352492544,2020-02-06 17:53:27,"RT @BMHCaucus: “Listen to Black women. Trust Black women. Stand with Black women when it comes to their health.” – Erica McAfee, @RepMcEach…"
1225473548413591552,2020-02-06 17:37:16,"To tackle climate change, it's all hands on deck in Virginia.
Over 150 of my colleagues including six from VA support my plan to eliminate climate pollution &amp; move to an energy economy comprised of clean solutions by 2050. Lets get this done. @UtilityDive
https://t.co/qKm3R8Nm5i"
1225189659392774146,2020-02-05 22:49:12,"In a dark day for our democracy, @SenateGOP has refused to defend the Constitution in favor of turning a blind eye to the President's cover-up. 

Thank you, @SenatorRomney for voting your conscience and showing true courage on a day when such courage was in short supply. https://t.co/0Wu8LgJVot"
1225142376676712453,2020-02-05 19:41:19,"Let me be clear: the need to act on #ClimateCrisis has never been greater. We owe it to all Americans to enact policies like my 100% Clean Economy Act to move us towards the more sustainable world we must build. Read my full op-ed  for @virginianpilot⬇️
https://t.co/j7Le463WvX https://t.co/Fdfo9fAgWj"
1225114325653905408,2020-02-05 17:49:51,"As the nation celebrates contributions of African-Americans to the vibrant patchwork of America, I am pleased to highlight figures right here in VA whose impact is still felt in our communities.

We must tell a more complete, inclusive American story reflecting our full potential https://t.co/o25Cu80jJb"
1225027037326270465,2020-02-05 12:03:00,My team is ready to help you resolve federal agency issues you may be facing. Give us a call at 804-486-1840 or visit my website at https://t.co/Nx4qICCKnB https://t.co/1uY71wBkDd
1224895425112674304,2020-02-05 03:20:01,"The President claims his administration is, ""defending religious freedom."" But just four days ago, he expanded his international travel ban targeting Muslim countries. #SOTU https://t.co/7lPXus8bpw"
1224891515710906369,2020-02-05 03:04:29,"The President called on Congress to send him a bill to lower prescription costs. @HouseDemocrats did, but Senate Republicans have refused to consider the #LowerDrugCosts Act. #SOTU #StateofHealthCare https://t.co/o9yS58awnr"
1224888177888038912,2020-02-05 02:51:13,"RT @TeamPelosi: REMINDER: House Democrats *already* took action to lower the skyrocketing cost of prescription drugs.

It's time for the Re…"
1224888116982493185,2020-02-05 02:50:59,FACT: The President has never fought to protect patients with pre-existing conditions. He's in court right now to strip them of their healthcare. #SOTU #StateofHealthCare https://t.co/W1uJuUj6KC
1224886062591479811,2020-02-05 02:42:49,"The President claims he is restoring American leadership across the globe, but a Pew Research poll of over 25 countries would suggest differently. The damage his administration has done to our relationships with our allies will take years to recover from. #SOTU https://t.co/qIa3qfySKL"
1224879808917778432,2020-02-05 02:17:58,"President Trump says that the economy is stronger than it has ever been, but most Americans agree, the only people winning in his economy are big corporations. #SOTU https://t.co/qj7iesyslT"
1224872952019279872,2020-02-05 01:50:43,"RT @DefendOurFuture: During tonight’s #StateOfTheUnion, House and Senate supporters of climate action are wearing “warming stripes” pin dur…"
1224872696439361537,2020-02-05 01:49:42,Are you watching the #SOTU tonight? Follow along with Team McEachin at 9 p.m. as they highlight healthcare facts and respond in real-time to other important issues during the address. https://t.co/oW0SkU6Jpr
1224856932785278976,2020-02-05 00:47:04,"Studies show that social status, income and education do nothing to insulate black women from the stark disparity in VA maternal health outcomes.

Earlier today, in a candid conversation, I asked Erica about her thoughts on how to close the gap in Virginia. 

Enough said. https://t.co/pFGO5ClD0Z"
1224845954521747456,2020-02-05 00:03:26,"Thank you, Erica for joining me as my guest to the #SOTU and your work to close the disparity gap in black maternal health.

As a father of two young women, this is personal. Today, I stand not just w/ the black women leading this work in VA and in Congress but with my daughters. https://t.co/ALwtAlWBLJ"
1224735503054000132,2020-02-04 16:44:33,"RT @khafner15: .@RepMcEachin's office also told me the congressman is bringing as a guest Erica McAfee of Chesapeake, who I interviewed a f…"
1224469535476023297,2020-02-03 23:07:41,"My #SOTU2020 guest tomorrow will be Erica McAfee.

After nearly dying while giving birth, she founded @SistersInLoss to advocate for women impacted by race-based disparities in maternal health.

Excited to hear Erica's story and shine a light on VA's black maternal health crisis. https://t.co/9YJqyHHdaH"
1224416934785056768,2020-02-03 19:38:40,"RT @BMHCaucus: Tomorrow, @RepMcEachin is hosting Erica McAfee as his State of the Union guest. Ms. McAfee nearly died giving birth. Now, sh…"
1224371041788669952,2020-02-03 16:36:18,"RT @TheBlackCaucus: What's at stake this year for the Black community?
Civil Rights.
Voting Rights.
Health Care.
Education.
Black Wealth.
C…"
1223315151564300288,2020-01-31 18:40:34,RT @HSLegFund: TY @RepMcEachin for being an amazing advocate for animals -- your score is well-deserved 🐶🐱🐾
1223295798303215617,2020-01-31 17:23:40,"I am honored to have received a rating of 100% from the @HSLegFund in their final scorecard for 2019. Reflecting on my record in 2019, I am pleased knowing we did so much to protect animals from cruelty/abuse. I look forward to continuing to champion animal protections this year! https://t.co/yeXFq6Rj53"
1222973775735599116,2020-01-30 20:04:04,"If you are having an issue with a federal agency and need help, please call my office at 804-486-1840 or visit my website at https://t.co/Nx4qICUlMb"
1222972751826255872,2020-01-30 20:00:00,Anne contacted my office when she could not resolve her aunt's insurance issue on her own. I am so glad my team was able to help her aunt get the care she needs. https://t.co/hCO3bCMA2h
1222953370635440131,2020-01-30 18:42:59,"RT @BMHCaucus: “We have an emergency going on in America right now…For every woman that has lost her life, for every family bearing that bu…"
1222953184144056320,2020-01-30 18:42:15,"RT @RepAdams: Congress has a responsibility AND the power to address our country’s maternal health crisis and, in 2020, I’ll continue to wo…"
1222661452319936513,2020-01-29 23:23:00,"One out of 20 Americans today has a credit report error serious enough to cause them difficulties obtaining fair rates on credit cards, auto loans or insurance policies. My vote today in support of #HR3621, the Comprehensive CREDIT Act will help fix that, putting #ConsumersFirst. https://t.co/8N9DDqi62B"
1222659676577452032,2020-01-29 23:15:57,RT @nkf: Thank you @RepMcEachin for co-sponsoring HR 5534 to extend #Medicare coverage of life-saving immunosuppressive drugs for kidney #t…
1222559986821357568,2020-01-29 16:39:49,Too many rural Virginians are missing out on access to high-speed internet service. @HouseDemocrats #MovingForward Framework invests $80B in broadband infrastructure to ensure communities right here at home and nationwide will not be left behind in the Internet Age. #ForThePeople https://t.co/r6u3nVD50F
1222294202983251968,2020-01-28 23:03:41,"RT @OurOcean: .@RepMcEachin, thank you for your leadership on offshore oil and gas safety. Statement from our CEO @InVeritas_Jones here: ht…"
1222292607486889984,2020-01-28 22:57:21,"RT @RepCarbajal: I'm an original co-sponsor of the Offshore Accountability Act, which will improve transparency and oversight of existing d…"
1222261126622326789,2020-01-28 20:52:15,"All Americans, especially those in coastal communities dependent on critical ecosystems, deserve #OffshoreAccountability from oil/gas industries operating in our oceans, esp. when their equipment failures can cause devastation for coastal economies, wildlife &amp; the environment. https://t.co/Dhll69DFTC"
1222261118992887808,2020-01-28 20:52:13,"On today's anniversary of the devastating 1969 Santa Barbara oil spill, I introduced the #OffshoreAccountability Act, my bipartisan bill requiring operators of offshore drilling facilities to publicly disclose critical safety system failures. Full release: https://t.co/AVFdWi9Lt2 https://t.co/fkaVIReuOw"
1222240486435573761,2020-01-28 19:30:14,#DidYouKnow the black community is facing a public health crisis? Black women have the highest mortality rate during childbirth. We must #ProtectBlackWomen and their children. https://t.co/WkXVxDJ48v
1222218978233323523,2020-01-28 18:04:46,It makes me so happy to see young people #ActOnClimate. Thank you so much for engaging your peers and lawmakers in the dangers of the #ClimateCrisis. #ClimateActionNow https://t.co/O6WgFwvHAQ
1222198343411077128,2020-01-28 16:42:47,"""The struggle over the physical record of slavery and uprising in Richmond is part of a larger, long-overdue national movement to preserve African-American history."" https://t.co/7GurqOqmIM"
1222166366670794752,2020-01-28 14:35:43,"RT @VAHouseDems: Check out this op-ed from @EFillerCorn, @C_Herring, @JeionWard, @DeloresLMcQuinn, Vivian Watts, @JCarrollFoy, @KayeKory an…"
1221922045526712321,2020-01-27 22:24:52,"#WeRemember the millions of lives lost and honor those who survived the horrors of the Holocaust. On #HolocaustRemembranceDay and every day, we vow to ensure acts of anti-Semitism and unspeakable hate never happen again. https://t.co/CZlVkECHfO"
1221897602708508673,2020-01-27 20:47:44,"Students and teachers - Please do not forget that submissions for my Black History Month Essay Contest are due next Thursday, February 6th. I am looking forward to reviewing the responses! https://t.co/Nc86hrHBXM"
1221801952436269067,2020-01-27 14:27:40,"Not only are our teachers paid almost $9,000 under the national average but in the last ten years, Virginia schools have gained an additional 55,000 students and lost almost 400 staff positions. For the sake of all of our children, this has to change."
1221801916621082625,2020-01-27 14:27:31,"Although I am in DC today, I stand in solidarity with the thousands of educators at the State Capitol asking for additional, desperately-needed funding for public schools."
1221451769676476416,2020-01-26 15:16:10,"🚨ATTENTION: Hopewell and Prince George Residents🚨 

The City is giving out cases of bottled water to residents until 5pm today and from 9am-5pm tomorrow at Hopewell High School. 

Hopewell High School
400 S. Mesa Drive
Hopewell, VA 23860
 
https://t.co/84RliiKoxQ"
1220811605740572673,2020-01-24 20:52:23,"ICYMI, today is the last day to submit a comment on the Environmental Justice for All Act. Don't miss this opportunity to make your voice heard as we draft this comprehensive environmental justice legislation informed by input from people like you! https://t.co/I1pK6Tj52k"
1220468115663966208,2020-01-23 22:07:28,RT @DefendOurFuture: .@RepMcEachin and @KingdomLiving4u on why we must protect the planet and our most vulnerable communities. #ClimateJust…
1220460023714930690,2020-01-23 21:35:19,It was wonderful to spend some time talking to these Patrick Copeland Elementary students today about the importance of protecting &amp; preserving our planet for future generations. I am very grateful that they have taken an interest in forming eco-friendly habits. @HopewellSchools https://t.co/TAteNirQSu
1220411456409292800,2020-01-23 18:22:20,RT @NRDems: Chair @RepRaulGrijalva &amp; @RepMcEachin are drafting an Environmental Justice bill because all people deserve #EnviroJusticeNow t…
1220355400891015169,2020-01-23 14:39:35,"Yesterday, we remembered the monumental #RoevWade case on the 47th anniversary, but with the Trump Administration restricting abortion access and women’s healthcare, we must continue to fight to ensure abortion is always safe and legal throughout the United States."
