id,created_at,text
1241788996323287044,2020-03-22 18:09:02,"If you believe in our constitutional power over matters of war &amp; peace, in ending endless wars, and in forging a progressive foreign policy that prioritizes human rights I urge you to call for an end to the US support of this horrific war. https://t.co/Ky89oRTLNF"
1241777661397082112,2020-03-22 17:24:00,"In the wealthiest country in the world, we continue to bankrupt thousands of Americans every year over outstanding medical bills #MedicareForAll"
1241777657035010048,2020-03-22 17:23:59,"RT @SenSanders: Community health centers are at the frontlines of this pandemic, providing health care to nearly 30 million low-income peop…"
1241741674486751236,2020-03-22 15:01:00,This crisis isn’t going away - @RepTimRyan and I are calling for checks for American families every month. That must be part of the stimulus we pass. https://t.co/eRLEmd5tiT
1241413260500500480,2020-03-21 17:16:00,"Stay home. Even if you feel fine, even if you’re young, the best thing you can do for your community right now is to stay home. #DearRepKhanna https://t.co/z5YstOTVpm"
1241116806653210624,2020-03-20 21:38:00,"The urgency here is unparalleled.
 
Hospitals are rationing masks and ventilators. 

Parents are trying to keep their businesses afloat while homeschooling their kids. 

Let’s get a plan together for the American people. 
https://t.co/whG3F603Fd"
1241060499984449536,2020-03-20 17:54:15,"Even if you have insurance and no complications, getting treated for COVID-19 will still cost you around **$10,000**
 
No one should be worrying about the cost of seeking treatment and testing right now. https://t.co/B9B1nT7fRy"
1241023785890918403,2020-03-20 15:28:22,The only industry that hasn’t been slowed down by the virus is the lobbying industry. https://t.co/GOplbU9W3N
1241014649673461761,2020-03-20 14:52:04,"Direct cash payments for every American.

No bailouts for corporations without promises of paid sick leave for their employees. 

Stop evictions + foreclosures 

Loan forgiveness

Any solution must prioritize workers, not CEOs + insiders. https://t.co/vuDjibLEg0"
1240780843188023296,2020-03-19 23:23:00,"┳┻|
┻┳|
┳┻|
┻┳|
┳┻|
┻┳|
┳┻|
┻┳|
┳┻|
┻┳|
┳┻|
┻┳|
┳┻| _
┻┳| •.•) Health care is
┳┻|⊂ﾉ   a human right,
┻┳|.      especially during
                a pandemic."
1240685716817842178,2020-03-19 17:05:00,"Now that baseball is paused for the year and everyone could use a laugh, #TBT to the last opening day before I went pro. https://t.co/WokN8j8sro"
1240654431928176641,2020-03-19 15:00:41,"South Korea, China, and even France have all mobilized their resources to meet the new demand for ventilators, masks, and sanitizers. 

We’ve done it before, we can do it again. The US gov should enlist American manufacturers in the fight against COVID-19. https://t.co/oEDMi6JaLz"
1240320400699129856,2020-03-18 16:53:22,"If the government is going to be sending $1 trillion anywhere, it should be direct cash grants to every American, increasing unemployment insurance, &amp; relieving student debt. 

Working class Americans need that money to make rent, buy groceries, and take care of their kids. https://t.co/hpox6G8IPe"
1240311732209319937,2020-03-18 16:18:55,"Again, this is a good step by the Trump admin but needs to be followed by real action. 

We are weeks behind where we should have been right now - health care providers need ventilators + masks, Americans need hand sanitizer, and companies need federal guidance NOW. https://t.co/e98EDo0Rnr"
1240301434114998272,2020-03-18 15:38:00,"Federal law prohibits the government from sharing your Census responses with anyone, including immigration and law enforcement agencies. Your responses also cannot be used to deny or determine your eligibility for government benefits #Census2020 https://t.co/hNwAlsWZow"
1240056822217596928,2020-03-17 23:26:00,"If we want to stay competitive in the 21st century, we have to invest in STEM education across the country. Every public school student should have access to a computer."
1240016064865611776,2020-03-17 20:44:02,"Americans need emergency cash, now, and our economy needs the stimulus from immediate spending. 

Glad to see the Trump Admin now supports our approach, but we can’t wait. 

Let's adopt @RepTimRyan’s + my proposal and get this country on the road to recovery. https://t.co/xvFvVP00Za"
1239974695564275715,2020-03-17 17:59:39,"After 2008, all the experts told us to learn the same lesson: increase consumer buying power. 
Rep. Ryan and I are proposing an immediate + repeated cash infusion to every American making less than $100K. Lets get money back into people’s hands and turn this economy around. https://t.co/Sat4heh7KJ"
1239927011558281222,2020-03-17 14:50:10,"Hi everyone - an update below following the shelter in place order.

Please follow all directives from local, state, and national health officials. Our community and our nation will make it through this, but it will require a collective effort from all of us. https://t.co/b6Fqap1w82"
1239763388592463875,2020-03-17 04:00:00,"American industries could be producing the products we need right now.

Medical workers, grocery clerks, and postal workers could get major bonuses.

Instead of mass layoffs, we could allow people to work part time. https://t.co/0LGqDlNFL6"
1239716336047214602,2020-03-17 00:53:01,"Let’s get cash out to Americans immediately.

If it’s Sen. Romney’s plan, if it’s my and @RepTimRyan’s plan, whatever we can pass right now we need to get behind. 

2008 taught us that we have to give consumers cash assistance to keep the economy afloat. https://t.co/vt6McBZbFt"
1239641086429143049,2020-03-16 19:54:01,"The best thing you can do right now is stay home. We’re going to get through this together, #CA17 https://t.co/2FZDAw3yxf"
1239637721934635008,2020-03-16 19:40:38,"Even in Silicon Valley, students don't have reliable access to the internet. Public school shouldn’t be a privilege to only those who can afford to participate online. 

Every home in every community across the US needs the technology to participate in the 21st century economy. https://t.co/RDRDUQNS1I"
1239621357371088898,2020-03-16 18:35:37,The brightest minds in our country are all coming together on the idea of a cash infusion. Let’s pass my and @RepTimRyan’s bill and get Americans the help we all need. https://t.co/2qo0MZ4Xge
1239619059299356672,2020-03-16 18:26:29,RT @jstreetdotorg: The letter -- led by @RepRoKhanna @RepAnnaEshoo &amp; @RepCohen -- says the US should be working to prevent demolitions in t…
1239606680612110343,2020-03-16 17:37:18,"The doctors, nurses, EMTs and first responders working right now are heroes. 

We need to provide them with the protective gear they need + set up a national tele-health center to make sure our facilities are not overrun. https://t.co/BQwnnIHTFN"
1239601841081593857,2020-03-16 17:18:04,"We cannot forget about the most vulnerable populations all around the world.

I'm leading a letter w/ @RepAnnaEshoo + @RepCohen opposing home demolitions in the West Bank. https://t.co/UcLjZ8aZv6"
1239588209245466624,2020-03-16 16:23:54,More info here -&gt; https://t.co/OG0KDe02jv
1239588056732184578,2020-03-16 16:23:17,"Encouraged to see you propose something similar to what @RepTimRyan’s and I advocated to ensure every working-class American gets a paycheck right now. 

We’d love to work together to make this happen, @SenatorRomney. https://t.co/TTmOvspGCT"
1239580341180010499,2020-03-16 15:52:38,We have the power to mobilize American industry in an all-out effort to save lives. This will help us produce n95 masks and other key equipment to keep health care providers safe. https://t.co/AkWaAQITDZ
1239557532303032326,2020-03-16 14:22:00,"A truly progressive policy is built by and for the working class. We have to emphasize a message of compassion and solidarity as we fight for equal pay, healthcare, climate justice, and so many other critical measures #ForThePeople."
1239331291432136704,2020-03-15 23:23:00,"Medicaid. 
Head Start. 
SNAP. 
Fire departments. 
Hospitals. 

All of these services in #CA17 depend on an accurate census count. #Census2020"
1239285741395509249,2020-03-15 20:22:00,"100 years after the 19th amendment and women are still fighting for a seat at the table.
 
All women, no matter their race, religion, ethnicity, sexuality or socioeconomic status, must have the right to exercise the freedoms the suffrage movement championed. #WomensHistoryMonth"
1239212508893700096,2020-03-15 15:31:00,"Investing in our public transit system will:

✅ Create more jobs
✅ Stimulate and strengthen our economy
✅ Improve our air quality
✅ Provide cleaner and more affordable transportation options for commuters
✅ Increase access to more employment opportunities"
1238887869889966080,2020-03-14 18:01:00,"In China, high speed rail connects the country at speeds over 185 mph. 

In the US, we have dilapidated railroads, crumbling interstates, and are shackled to dirty fossil fuels.
 
We need massive, green infrastructure updates if we want to compete in the 21st century."
1238834014875783170,2020-03-14 14:27:00,"Calling all South Bay Artists! Interested in a free trip to DC and having your art hung in the Capitol Building? Apply by April 20 for our 2020 Congressional Art Competition. Find the full application on my website. 
https://t.co/ulC98RF60G"
1238653215463350273,2020-03-14 02:28:34,"The American health care system was not prepared for COVID-19. 

This Administration cut the Pandemic Prevention Office in 2018. They should have started widespread testing weeks ago. https://t.co/g5d0keVdKQ"
1238592793494392843,2020-03-13 22:28:28,"ICYMI, today @RepTimRyan &amp; I announced an emergency earned-income tax credit that would give between $1,000 and $6,000 to 200 million Americans. 

Families making up to $100K would qualify.  https://t.co/a8SLW7wrHR"
1238542160703770625,2020-03-13 19:07:16,"Closing schools isn’t an easy decision, but at this moment it’s the right one. Please look out for each other, #CA17. https://t.co/PJVr1mj1YE"
1238520339581341701,2020-03-13 17:40:34,"RT @aseitzwald: Inbox: Reps. Ro Khanna and Rep. Tim Ryan have a new bill to respond to the coronavirus that would give $1,000 and $6,000 to…"
1238519183316582401,2020-03-13 17:35:58,"A payroll tax can't put enough money into the pockets of the working class, the unemployed, or  the gig economy.

If we can afford to pump $1.5 trillion into the stock market, we can afford the immediate $1k-$6 cash infusion that @RepTimRyan &amp; I are proposing during COVID-19. https://t.co/hqAc5Yqi7y"
1238486475026595842,2020-03-13 15:26:00,"Universal access to broadband is crucial during a pandemic. The internet is the quickest way to receive updated information regarding COVID-19. Universities + workplaces around the nation are moving their meetings online, yet 19 million Americans don’t have high-speed internet."
1238274326983520256,2020-03-13 01:23:00,"A bright spot in the news for #CA17!
https://t.co/DrdXypPZXH"
1238259730692239360,2020-03-13 00:25:00,"The Capitol Building and my DC office building will be closed until April  - if you were planning on visiting during your trip to DC, please tune into our Facebook live town hall on March 23rd, and send any questions my way.
https://t.co/W8441fesLh"
1238237698906783745,2020-03-12 22:57:27,"The American government should be mobilizing treatment options and testing centers, not risking a war with Iran.

If McConnell passed my and @SenSanders bill (which the House already passed) this wouldn’t even be possible. https://t.co/1Xz8l4soyF"
1237888406601887744,2020-03-11 23:49:29,RT @RepZoeLofgren: Calling on @TSA to give the public more info. Recent @FlySJC travelers should know their potential risk of #COVID19 expo…
1237851452988485634,2020-03-11 21:22:39,"This version of FISA...

1. Allows the gvmt to take your search history without a warrant

2. Lacks discrimination protection based on race/national origin

3. Fails to prevent surveillance on activities protected by the 1st amendment

We need real reform. I voted NO. https://t.co/fkEvHXsuFT"
1237837452225794049,2020-03-11 20:27:01,"We shouldn’t be penalizing Americans who do the responsible thing and stay home.

Let’s pass paid sick leave, let’s expand Medicare to cover all COVID-19 testing, and let’s give every American the care they deserve. https://t.co/5WYK9PxmoF"
1237821470417522688,2020-03-11 19:23:30,"Native Americans serve in the military at a higher rate than any other population, and this commonsense, bipartisan bill will allow them to get culturally competent care in their own communities. https://t.co/LdmrXqElF3"
1237787486346149889,2020-03-11 17:08:28,@HallieJackson @frankthorp Congrats to you both! I happen to believe Ro is an excellent nickname.
1237780321895976961,2020-03-11 16:40:00,"The CDC’s budget is 1.5% of the defense budget. We should double it. 

We have underfunded our public health system for decades, directly leading to the mismanagement of the COVID-19 crisis. We need to step up and support our doctors + scientists so they can save lives. https://t.co/3DSkyHrFAH"
1237759685815439360,2020-03-11 15:18:00,"If you feel sick, we (the world) need you to stay home. 

I’m calling for an extension of Medicare coverage to anyone who needs treatment. 

Our failure to provide comprehensive health care is putting us all at risk."
1237738565364260865,2020-03-11 13:54:04,"Transparency should be our chief priority. 

There’s no excuse for the Trump Administration’s overwhelming reluctance to share testing and infection statistics with the general public. 
https://t.co/LlQjZMt0Ya"
1237489656523968512,2020-03-10 21:25:00,"The freedom to call out corruption is one of the hallmarks of American society. My Espionage Reform Act is an urgent solution to protect the journalists and whistleblowers under attack in the Trump Administration. 
https://t.co/xqcideBtU7"
1237445087770148869,2020-03-10 18:27:54,"The US has *the worst* maternal death rates in the developed world. 

Worse? Black women are over 4x as likely to die from preventable causes in pregnancy as white women. 

Proud to join @RepUnderwood, @RepAdams, + @RepPressley &amp; push for better maternal health for black mothers. https://t.co/XAiB63WEm4"
1237440125254197251,2020-03-10 18:08:11,"The Iraq war was the biggest foreign policy blunder of the 21st century. 

@RepSlotkin got a critical admission this AM: ’01 + ’02 AUMFs do NOT authorize an offensive war with Iran. 

We can’t start another endless war. https://t.co/CWJP4SApSo"
1237393474653016065,2020-03-10 15:02:48,"South Korea is testing 10,000 people every *day*

The U.S. still hasn’t tested even 8,000 people. 

We need to prioritize free, comprehensive testing for anyone who believes they need it. https://t.co/XXsg8PjnMX"
1237106632909139969,2020-03-09 20:03:00,"Working parents spend $2 billion on childcare and early child education.
 
That’s outrageous - a wealth tax on the wealthiest 1% of Americans would pay for every child in this country to learn and grow in a safe program while their parents are at work."
1237099877257134082,2020-03-09 19:36:09,"My heart goes out to the victim’s family, and all those impacted across our community. 

Wash your hands, avoid public gatherings, and stay vigilant. We’re working as hard as we can here in DC to get the funding and resources needed to beat this virus. https://t.co/1ySZBnnxTJ"
1237089883996463106,2020-03-09 18:56:27,@syedsalmanqadri Apologies for the confusion! I've replaced the in-person town hall with the Facebook Live event on March 23. Hope you'll join.
1237066115680894980,2020-03-09 17:22:00,"Out of an abundance of caution, I will be hosting this month’s town hall on Facebook Live on March 23rd at 6:30pm PT. All you have to do is go to my page, join the livestream, &amp; post your question in the comments section. Questions? Please call my office.
https://t.co/VU7dpxfIF2"
1237015961359847424,2020-03-09 14:02:42,"One year ago today, @HouseDemocrats passed #HR1 to secure American elections + get big money out of our political system. 

There’s no excuse for @senatemajldr to hold this critical bill hostage in the Senate."
1236756827980943366,2020-03-08 20:53:00,"Every American should have the power to correctly identify themselves on official documents. 
https://t.co/3RIAV5RPR0"
1236681078989033473,2020-03-08 15:52:00,Visiting DC over Spring Break from #CA17? Stop by my office on Capitol Hill for a behind-the-scenes tour of the Capitol building. We’d love to show you around. https://t.co/cwgJ8lMu2d
1236396705077178374,2020-03-07 21:02:00,"Wetlands critically reduce the impacts of floods, mitigate soil erosion, absorb toxic pollutants in our water, and contribute to our environment's diversity. That's why we must ensure next year's budget continues to allocate funds for the North American Wetlands Conservation Act."
1236347883378507776,2020-03-07 17:48:00,"The 2020 census will decide how much money our public schools get, where to build new jobs, and how much funding to put toward improving our neighborhoods. 

We only get this chance every 10 years, so lets make it count. https://t.co/aeIVrHnzHK"
1236321207558877184,2020-03-07 16:02:00,"Employees in the gig economy deserve the same benefits and treatment as anyone else at their companies. We can’t afford not to provide complete medical coverage to every single American.
https://t.co/1K1U1iaADh"
1236041848109568002,2020-03-06 21:31:55,Being elected to public office shouldn’t be a lifetime appointment
1236041774780555264,2020-03-06 21:31:38,"Today in 1951, the 22nd Amendment officially became law, limiting the president to 2 terms. 

Members of Congress should be held to our own term limits. That’s how we create more opportunities to serve and fewer chances for corruption to take over."
1236005161639821314,2020-03-06 19:06:09,"Under #HR4, any state with a history of voter suppression that wants to change voting procedures would have to receive pre-approval from the federal government. 

Every American should have the right to vote. https://t.co/RNpzGhPWYK"
1235980067752366082,2020-03-06 17:26:26,End the Patriot Act. https://t.co/tVcjBwCB9f
1235725532249104384,2020-03-06 00:35:00,"Three years ago, these women interned in my DC office (look at the picture!)

Today, Swapanthi is my Director of Constituent Services and Emma just introduced our gender passport bill. Proud to support women both in my office and across this country #WomensHistoryMonth https://t.co/Xp0lrkTlVh"
1235722477130702848,2020-03-06 00:22:51,"I asked Trump's HHS why CDC stopped reporting the number of Coronavirus tests when we had only run 472 vs 100k+ in Korea.
 
They couldn't give me a straight answer. 

Now @VP is confirming that there aren't enough tests. We need answers and transparency. https://t.co/fWHs6HEFDe"
1235685435801825281,2020-03-05 21:55:40,RT @torproject: New legislation from @RonWyden and @RepRoKhanna aims to amend the Espionage Act to protect press freedom and expand legal c…
1235679982346579968,2020-03-05 21:34:00,".@drsanjaygupta raised an important point this weekend - we have less than 100,000 ventilators in this country. 

The federal government has to make sure we are getting more units in hospitals and elderly care facilities across the country. https://t.co/sSYApmlASU"
1235651436769431555,2020-03-05 19:40:34,"RT @AlexEmmons: New from me: Senator @RonWyden and @RepRoKhanna introduce legislation that would amend the Espionage Act, aimed at protecti…"
1235648393097236481,2020-03-05 19:28:28,"Our bill also makes it easier for members of Congress and agencies to conduct proper oversight over privacy abuses and makes it easier for whistleblowers who come forward with valuable information. This nation rests on the freedom of the press, transparency,  &amp; checks + balances."
1235648154806124546,2020-03-05 19:27:31,"The Espionage Act was written over 100 years ago to protect our country against spies, not journalists. 

Today, @RonWyden and I are introducing a bill to the Espionage Act to protect the reporters + whistleblowers under attack from the Trump admin. https://t.co/MfFvfUx9hC"
1235581811775823873,2020-03-05 15:03:54,"RT @dustingardiner: Progressives say Congress has failed to act on key remedy to #coronavirus: mandatory paid sick leave.

About 27% of Ame…"
1235573280028884994,2020-03-05 14:30:00,"45 million Americans have been exposed to contaminated water in the past four decades.

Clean drinking water should be a basic human right."
1235260469423886336,2020-03-04 17:47:00,"When workers don't have paid medical leave, they go into work while they're sick. It's that simple. These are your waiters, your cashiers, your line cooks. 

If this Coronavirus outbreak is not the right time for universal paid medical leave, when is? https://t.co/UbqRmhUj35"
1235249102901960706,2020-03-04 17:01:50,"Access to reproductive health care providers is an essential human right in this country. 

Today I’m standing with the millions of Americans urging the Supreme Court to protect that right and stand up for clinics. https://t.co/rUylpyA94v"
1234978107473514496,2020-03-03 23:05:00,"Testing, treatment, and - when developed - the vaccine for Coronavirus must be free for patients. If we're serious about stopping this outbreak in its tracks, we have to remove all barriers to prevention and care.
https://t.co/HFwYo5waIk"
1234971029845368832,2020-03-03 22:36:52,"RT @BarackObama: Michelle and I are sending our prayers to those affected by the severe storms in Tennessee, especially to those who lost l…"
1234944133459894272,2020-03-03 20:50:00,"We need to create tech hubs across the Midwest, the South, and the rest of the country. Good jobs shouldn’t be reserved for the people who can afford to live in big cities. https://t.co/a67vYjfay9"
1234903268653924352,2020-03-03 18:07:37,"Tech should invest in authentication tools, both for users + content, to ensure that the news Americans are seeing online is honest/real. 

Congress should lay out rules so social media companies remove blatant disinformation + hate speech before it goes viral. https://t.co/kYC9gU4T7e"
1234883505370411008,2020-03-03 16:49:05,Sex workers are entitled to the same legal protection and health care access as every other American #ISWRD https://t.co/XFc7WYagfi
1234852276365398016,2020-03-03 14:44:59,"Politicians need to get out of the way, provide the funding, and let the scientists do their job. https://t.co/th1Bbu8N8u"
1234613454457036805,2020-03-02 22:56:00,"Over 8 million metric tons of plastic still end up in our oceans. 

That water produces over half of the air we breathe, regulates our climate, and ensures our planet is habitable for all living things. We must protect our oceans."
1234593128344100866,2020-03-02 21:35:14,"We spent $738 billion on the defense budget this year. 

We are also the wealthiest country on earth. 

Federal funding to combat coronavirus should be our top priority. https://t.co/VyABDnsQmI"
1234565720614240262,2020-03-02 19:46:19,"The federal government is absolutely responsible for subsidizing the testing for every single American. 

We are each only as safe as the least-insured, sickest person in this country. https://t.co/l6bZ3lgPsc"
1234536897847885824,2020-03-02 17:51:47,"If the coronavirus is really a national security issue, then we can afford a $15 billion investment - that’s 2% of the defense budget - toward testing and treatment. https://t.co/PK9FUatIfA"
1234229927550996480,2020-03-01 21:32:00,"Thankful for my colleague (and Bay Area neighbor) @RepBarbaraLee’s tireless commitment to uplifting and empowering women around the country. Her bill, HR 1923, will permanently commemorate the contributions of women by sharing their stories on our currency #WomensHistoryMonth"
1233890440467767297,2020-02-29 23:03:00,"The House has passed hundreds of bills in 2019, but Mitch McConnell refuses to put them on the Senate Floor. This should not be the norm. The American people deserve an engaged and active legislature, in both bodies."
1233865022989721600,2020-02-29 21:22:00,"Honored to have @PPFA endorse my bill to add the gender marker “X” onto US passports. We need to support the safety of every American abroad. 
https://t.co/2Y6aUyuy4f"
1233841115427672065,2020-02-29 19:47:00,"We are only as safe as the least-insured, sickest person in this country.

America first doesn’t work when it comes to pandemic diseases. https://t.co/4SR380RAv2"
1233789525572366337,2020-02-29 16:22:00,"The 2020 Census is so important to our community in #CA17 - make sure you check your mail in the coming weeks and fill yours out!
https://t.co/LictGP9knJ"
1233776537469669376,2020-02-29 15:30:23,"We have to understand the interconnectedness of the world in tackling a pandemic. 

It may not be politically popular to say, but there are humanitarian, health, and economic reasons for helping Iran deal with this crisis. https://t.co/gxycIRL8DW"
1233544617678733312,2020-02-29 00:08:49,My full plan here👇🏾https://t.co/oeoFEP2xwA https://t.co/GIgXQCTriP
1233544431632109570,2020-02-29 00:08:05,"We need to mobilize $15 billion to push for widespread, free testing available to all Americans + research for a vaccine and anti-viral treatments. Politicians need to listen to the scientists and doctors."
1233544220218138625,2020-02-29 00:07:14,"My office is in contact with local health officials and monitoring the situation closely. Nothing is more important than the health and safety of the entire Bay Area community. 

Our country has the minds and talent to beat this epidemic before it gets any worse. https://t.co/GGXCmVjoan"
