id,created_at,text
1233504649472348160,2020-02-28 21:30:00,"The median home price in Santa Clara County is $1.2 million.
Our community should be doing everything it can to support the employees that keep us healthy and safe. Proud to stand with these courageous workers.
https://t.co/gplbsjbuiU"
1233472436055625729,2020-02-28 19:22:00,"Any new health care partnership for the UC has to offer equal care, equal access, and equal treatment to every member of the UC community. I join @PPFA in urging the UC to ensure harmful policies like the Ethical + Religious Directives aren't imposed on UC providers and patients."
1233470939209379840,2020-02-28 19:16:03,@JonahGottlieb Apply for my internship program! https://t.co/oCSYU7wpjo
1233425389135048707,2020-02-28 16:15:03,https://t.co/matwqafZBN https://t.co/Bv6F7YuTwT
1233420594474971136,2020-02-28 15:56:00,Solving California’s homelessness crisis requires us to extend our compassion to our neighbors who are struggling. We cannot arrest our way out of the problem – we need to expand community mental health services and build affordable housing.
1233198631961976832,2020-02-28 01:14:00,The best way to honor the sacrifice of our service members in Afghanistan? Ensure no more American lives are sacrificed for an unwinnable war. We all want a peaceful end to this costly conflict. The US can be a leader without resorting to endless military intervention.
1233178499134840832,2020-02-27 23:54:00,"A trade war with China would be disastrous for this country, much less the global economy. We’ve already seen the market drop to near-record lows because of a disruption in global supply chains. This should be a cautionary tale against reflexive protectionism. https://t.co/6ISKl0MOOI"
1233155404571533318,2020-02-27 22:22:14,"It's unfathomable to me that we're still debating whether same-gender couples are entitled to equal rights. It's 2020. Thank you, @RepSeanMaloney. https://t.co/SOlFWKUi4M"
1233146276377702401,2020-02-27 21:45:57,"Every Dem is willing to work w/ Trump to get a plan in action against the coronavirus. But right now, we don’t even have a readily available affordable vaccine. 

The question is whether Trump is willing to work with experts, fully fund their efforts, and let them do their jobs. https://t.co/0DYCSwZUMK"
1233103546016567299,2020-02-27 18:56:09,My bill is about creating an opportunity for identity where there currently isn’t one. Every American should have the option to mark the gender that’s safest for them.
1233103230483288066,2020-02-27 18:54:54,"Gender wasn’t even listed on passports until 1977 in this country. 

Why did we choose that year to put it on our passports? Not national security, but the rising trend of unisex fashion. 

No, really.
https://t.co/NmAZcUIrad"
1233092917658636291,2020-02-27 18:13:55,https://t.co/wO6jE2gHKp https://t.co/umJASmxnbb
1233071846536466435,2020-02-27 16:50:12,"@NIH Sixth: 
The bottom line: we shouldn't panic about Coronavirus, but we must be prepared. Our country has the resources necessary to keep us all safe. It's only matter of strategically and effectively deploying those resources."
1233071600225878016,2020-02-27 16:49:13,"@NIH Fifth: 
It's vital that we take all necessary precautions to protect health care workers on the front lines of this fight. 

Doctors, nurses, and other health providers are heroes and must be kept safe."
1233071434144059392,2020-02-27 16:48:33,"@NIH Fourth: 
We have to increase treatment capacity to prepare for a potential influx of Coronavirus patients. The Public Health/Social Services Emergency Fund directly funds the Hospital Preparedness Program, the Strategic National Stockpile, and the National Disaster Medical System"
1233071180728426496,2020-02-27 16:47:33,"@NIH Third: 
We must invest in rapid and scalable testing methods and put those tests in the hands of health care workers on the front lines. 

The four-day delay for a test that occurred in CA due to a slow, centralized process is unacceptable."
1233070922543833092,2020-02-27 16:46:31,"Second:
Next week, we convene the top scientists in the public + private sectors from around the world in DC to develop a plan for a vaccine and possible antiviral treatments as quickly as possible. 

@NIH *must* serve as the hub of this effort to avoid the siloing of information"
1233070538291056641,2020-02-27 16:45:00,"First: 
-$15 billion in top-line investment at the state and federal level
-$4.5B for the CDC
-$2B for NIH
-$4B for the Public Health + Social Services/Emergency Fund
-$2.5B for state and local response
-$2B for USAID to address the crisis internationally"
1233070315393232896,2020-02-27 16:44:07,"THREAD -- This is the time to mobilize science and tackle the Coronavirus. 

If the President won't offer a comprehensive plan, the House must lead. 

Here's what we have to do ⬇️ https://t.co/1D8bjnTISD"
1232805793382035456,2020-02-26 23:13:00,"No one should have to leave their hometown to get a good paying job. My 21st century jobs plan will create federal tech institutes across the country, incentivizing private companies to hire rural workers. 

America should be leading in the technology revolution. https://t.co/gvgmrZ7buJ"
1232781885790515200,2020-02-26 21:38:00,"Great conversation this morning at @postlive even on what the federal government can do to support working families. To start? We can pass Medicare for All, provide universal childcare options, and guarantee paid family + sick leave to every employee in this country. https://t.co/wZz2mFbKIM"
1232761792935473155,2020-02-26 20:18:09,"RT @DonChen47: ""I don't want the first things other countries think of the US to be our military or bombs"" - @RepRoKhanna @QuincyInst #FPQI…"
1232756824522264576,2020-02-26 19:58:25,"RT @SpeakerPelosi: Racially-motivated acts of terror have long been a part of American history. Today, we confront that violent reality by…"
1232718340168331264,2020-02-26 17:25:29,RT @SenatorBennet: Glad to have @RepRoKhanna &amp; @RepBrianFitz leading the charge on our Student Apprenticeship Act in the House. Our bill wi…
1232716310326468613,2020-02-26 17:17:25,"In many states, non-binary Americans have no way to accurately reflect their gender on identifying documents. My bill will create much-needed opportunities for personal freedom where there often isn’t any. https://t.co/zNJpcheC2I"
1232669974113767426,2020-02-26 14:13:18,"RT @Openly: U.S. congressman @RepRoKhanna has proposed allowing ""X"" as a third gender option on passports | #LGBT+ https://t.co/SqLksxeeEU"
1232431620289773569,2020-02-25 22:26:10,RT @RepBrianFitz: Proud to partner with fellow Bucks County native @RepRoKhanna to introduce the Student Apprenticeship Act. Investing in o…
1232420504813830146,2020-02-25 21:42:00,"On-the-job training and higher education should go hand in hand. Proud to introduce the Student Apprenticeship Act with @RepBrianFitz so that more workers can train for the high-paying, high-demand jobs that employers are having so much trouble filling.
https://t.co/xflBlmhOob"
1232392822201843712,2020-02-25 19:52:00,"11 states offer X on drivers licenses.
7 states offer X on birth certificates. 
10 countries offer X on passports.
 
Respect and recognition for our non-binary friends is long overdue https://t.co/Fu9dV6OpPU"
1232371515426889730,2020-02-25 18:27:20,RT @abbyvesoulis: A little TIME exclusive: @RepRoKhanna is about to introduce a bill that would create a national apprenticeship program. I…
1232312310997356544,2020-02-25 14:32:04,"A huge thank you to @GerriCannon for laying the groundwork in NH, as well as the numerous groups and activists who have molded this bill into the most accessible, least cumbersome option for gender non-conforming Americans. 

Everyone should have the freedom of gender expression."
1232312181271793664,2020-02-25 14:31:33,"For those who already have a driver’s license or birth certificate with an “X” marker, the bill *does not* require them to list a corresponding “X” on their passport. Americans should be able to make the decision that is safest for themselves when traveling."
1232311693960732674,2020-02-25 14:29:37,"I’m introducing a bill to add a third gender option onto US passports. 

Respecting every American’s gender must extend to travel abroad. The freedom to move and express yourself no matter what should be guaranteed in this country. 
https://t.co/MULBx5Jum7"
1232103918454181890,2020-02-25 00:44:00,"Being elected to public office in this country isn’t a birthright. 

It’s a choice voters should get the chance to make every year. We need term limits in Congress and in the Supreme Court."
1232029408334163970,2020-02-24 19:47:55,Every employee is entitled to a safe workplace. Standing with the @McDonalds workers in SC today as they continue the campaign for equal treatment and fair wages. https://t.co/1ITGqDEUpl
1232017599992516608,2020-02-24 19:01:00,"Happy Public Schools Week! Public school teachers are heroes for so many students and families across this country. We need to invest in our schools, our students, and our future leaders."
1231987189317296130,2020-02-24 17:00:09,"This kind of justice is far too rare in our country. My hope is that verdicts like this will encourage more survivors to come forward. 

We believe you, we support you, and we will stand by you. https://t.co/jSUpQ1QDOW"
1231977586177138688,2020-02-24 16:22:00,"It’s going to take thoughtful, deliberate efforts to include more Black students in the technology revolution. My hope is this weekend’s event at @SJSU is just the start in a lasting partnership between tech and underrepresented communities. 
https://t.co/ZYMjazBdzN"
1231751093643857920,2020-02-24 01:22:00,"A huge thank you to the Billy DeFrank LGBTQ+ Community Center for the warm welcome this afternoon. Queer Americans are some of the most targeted members of our community, and we all have to step up and speak out against the kind of intolerance the Trump admin is perpetuating. https://t.co/nv6y0OWoX8"
1231693715497836544,2020-02-23 21:34:00,"America is nearly the only major nation on earth that doesn’t guarantee paid family leave. 

Every employee in this country should be able to pursue both a career and a family."
1231673331138457601,2020-02-23 20:13:00,"Everyone must get counted in the #Census2020. 

That’s why we held a town hall  with the US Census Bureau, local community organizations, and my district staff to organize ahead of the count. https://t.co/KlOlhq0Rks"
1231402546800889856,2020-02-23 02:17:00,"Proud to support the Vietnamese community here in #CA17. I have spoken out against the communist government on the House floor, and continue to work with activists here to free family and friends abroad. https://t.co/O6qhZmrhKL"
1231380511475433474,2020-02-23 00:49:26,The technology revolution has to be accessible to every American. That means building pipelines for historically underrepresented voices into the technology companies that hold the jobs of the future. Honored to host a job fair in #CA17 to make that dream a reality. https://t.co/M4y2dZFlN5
1231098931993403392,2020-02-22 06:10:32,"Thank you Santa Clara, for an incredible town hall tonight. 

That’s our 37th consecutive town hall - once a month, every city in the district. https://t.co/sOZCzZZgiU"
1231021033420881920,2020-02-22 01:01:00,Students shouldn’t need to go into debt to get an education. The jobs of the future should be open to every American.
1231005012328734720,2020-02-21 23:57:20,"Over 5 million people are living with Alzheimer’s in the U.S. Too often, the share of costs burden the caregivers and isn’t fully covered under Medicare/Medicaid. We must continue to invest and fight to find a cure. https://t.co/PGzA4icTvk"
1230905522116755457,2020-02-21 17:22:00,"My dad worked at the same company for 30 years. 

Today, most people in my generation will work a dozen jobs over their lives. 

Work in America has changed. Congress should reflect that and implement term limits."
1230881706564976645,2020-02-21 15:47:22,"The technology revolution can’t leave anyone behind. 

Proud to bring opportunities to some of the brightest minds in #CA17. https://t.co/AY2Muqa8AW"
1230636499420557312,2020-02-20 23:33:00,"Mental health care IS health care. 
When we talk about universal health care, that includes comprehensive mental health services for every American."
1230557730756124673,2020-02-20 18:20:00,"Homelessness and housing insecurity are becoming all-too familiar for kids growing up in the Bay Area.

We must tackle the rising housing costs, commit to building affordable options, and direct job training services across Silicon Valley. #DearRepKhanna https://t.co/7VXXAByL7Y"
1230208329902891009,2020-02-19 19:11:36,"I invited President von der Leyen, whose husband taught at Stanford, to visit the university where we could have a broad ranging dialogue on AI, data policy, and privacy. I very much hope she will visit us."
1230208230728486912,2020-02-19 19:11:13,"On my recent trip to Munich with @SpeakerPelosi, I had a constructive conversation with European Commission President von der Leyen about developing transatlantic norms for regulating the internet that both protects privacy and also promotes innovation. https://t.co/89fv4BgTOt"
1230183766255001600,2020-02-19 17:34:00,"American workers are bearing too much of the weight of this country. 
We need better labor protections, higher wages, and equal access to the training and opportunities for jobs of the future."
1230165646786224133,2020-02-19 16:22:00,"The American economy should work for every American. 
It’s that simple."
1229845537723224064,2020-02-18 19:10:00,"My town hall is this Friday night at @SantaClaraUniv! 7:30pm, we’ll be talking about how to end our endless wars, why Medicare for All is the way forward, and much more. https://t.co/5UXYvlaFnL"
1229534488016773121,2020-02-17 22:34:00,"The Census decides how 800 billion dollars in federal funding is distributed—money for our schools, hospitals, and other important resources.  

Join me on Saturday morning for my Census Town Hall in San Jose so we can get everyone counted this year. 
https://t.co/0YRRlwEf21"
1229452447585906691,2020-02-17 17:08:00,"For over 9 decades, @LULAC has organized for economic, racial, and social justice for Latinx communities across America. Thank you to everyone who has made that organizing work possible."
1229425771934109696,2020-02-17 15:22:00,"If we can afford to spend $6 trillion on endless wars, we can afford to send every child to college."
1229195504136810496,2020-02-17 00:07:00,"Every student in this country should have the resources, courses, and support to pursue a technology job without having to leave their hometown."
1229074456808738816,2020-02-16 16:06:00,"Interested in joining my DC office team? We are hiring interns to start March 23, 2020. 

Find out more here👇🏾
https://t.co/oCSYU7wpjo"
1228787314949750785,2020-02-15 21:05:00,"Nearly 1/4 of America’s public schools are in ‘fair’ or ‘poor’ conditions. We need to invest in the next generation of innovators, leaders, and activists. 

No public school student should have to study in a crumbling school."
1228741764871262208,2020-02-15 18:04:00,"The 400 wealthiest Americans have a total wealth of $2.96 trillion. 

That’s the same as the bottom 60% of all Americans.
 
We need to fix the inequality in this country.
https://t.co/zlvdhEspMr"
1228447094345785344,2020-02-14 22:33:05,"All major stakeholders, especially women, must be included in any final deal. We need a responsible withdrawal from Afghanistan. https://t.co/LQvf1F3LE8"
1228422661723656192,2020-02-14 20:56:00,Two inspiring students from Foothill and De Anza colleges stopped by to speak about the high cost of attending school in Silicon Valley. 18% of De Anza students experience homelessness in any given year. We need to support these students so they don't sleep in their cars. https://t.co/mYwavxS6Jr
1228383906472157185,2020-02-14 18:22:00,"68% of SNAP participants are families with children. By cutting #SNAP, Trump is cutting off a critical lifeline for kids across this country. You can’t focus in school or at work if you’re hungry. 

We need to prioritize the safety and well-being of every child in this country."
1228338608203059202,2020-02-14 15:22:00,"A day when many celebrate love, today is a harsh anniversary for this country.

Communities across the US have been ripped apart by gun violence. We've spoken up, written, and marched, but the Senate still failed to pass meaningful legislation to tackle the gun violence epidemic."
1228097016217116672,2020-02-13 23:22:00,"Have questions about the 2020 Census? Concerned about being counted? Join us for our Census Town Hall on Saturday, February 22nd and we’ll work through them together to make sure everyone gets counted. 
https://t.co/0YRRlwVQqB"
1228056281497427968,2020-02-13 20:40:08,"For every 100 households in the San Jose-Sunnyvale-Santa Clara metro area, we’ve only built 30 units. That means we have a deficit of thousands of homes, as working families face sky-rocketing rents + the constant risk of eviction. 

Proud to join @WhipClyburn in this initiative. https://t.co/wgYtJHwViJ"
1228053934985613312,2020-02-13 20:30:48,"Great to meet with @HRC today. Happy to cosponsor Rep. Sanchez's Safe Schools Improvement Act to help stop bullying, which disproportionately impacts LGBTQ+ youth. No child should ever have to fear for their physical safety in the classroom or on the playground. https://t.co/aUySe8Nt9A"
1228023439736426496,2020-02-13 18:29:38,Every American should be equal in the eyes of the law. #ERANow https://t.co/1hkOmN4Rqa
1228016233913577472,2020-02-13 18:01:00,"Friends of the President shouldn’t get a separate justice system. When the Senate Republicans decided not to remove Trump, they signaled to him that he could be as brazen as he wants without consequences. https://t.co/MsDaRwLhR0"
1227999054447235073,2020-02-13 16:52:44,"Another endless war in the Middle East would be disastrous. 

Thank you to the Republicans who have stood up with us to say that any offensive action overseas must first be approved by Congress. https://t.co/AF1ooz4FKG"
1227985964699615233,2020-02-13 16:00:43,"Today, Rep. Meadows and I introduced another bill to modernize government agencies and save money for taxpayers. High-tech upgrades should be as prevalent in the public sector as they are in the private. 
https://t.co/McrqWGje64"
1227731608435929088,2020-02-12 23:10:00,America owes a debt of gratitude to the @NAACP for its 111 years of unrelenting campaign for equality and fair treatment for every American. No one should face discrimination based on the color of their skin.
1227699396172632064,2020-02-12 21:02:00,"Now that OMB Director Vought clarified for me that DoD officials would not be prevented from testifying about the Trump Budget, I (along with @HASCDemocrats + @JimLangevin) look forward to getting real answers. https://t.co/j9KcBu458i"
1227682190076645377,2020-02-12 19:53:38,What Americans overwhelmingly support is avoiding another war in the Middle East. https://t.co/U45BEtYDJH
1227609051141304320,2020-02-12 15:03:00,"There were 502% more incidents of global terror in 2018 than in 2001. We need diplomacy, not more foreign wars."
1227342544742207488,2020-02-11 21:24:00,"30 years ago today, Nelson Mandela was released from prison. Mandela was a pioneer in his pursuit for equality + speaking truth to the rest of the world. I was deeply moved when I went to Robben Island in 2015 to see his prison cell. He is a hero to many in Congress."
1227291709970665472,2020-02-11 18:02:00,"A deal’s a deal, @RepCleaver. Congrats on the big win. Next season is already around the corner. https://t.co/JLcygnmKS4"
1227276588938616832,2020-02-11 17:01:55,"What’s worse than only having 4 wireless carriers in the country? 

Having 3. https://t.co/thi6hTPkLL"
1227028978482892800,2020-02-11 00:38:00,"We need to get special interests out of government and focus on serving the people, not powerful CEOs."
1226963044019781632,2020-02-10 20:16:00,"Talk to your friends, talk to your family, and make sure everyone gets counted #Census2020 https://t.co/TkEzwFiaMd"
1226922627580776448,2020-02-10 17:35:24,"Polling shows Americans want a different approach, opposing the latest increases in Pentagon 💰💰 at the expense of investments in social services and infrastructure.

We must invest in communities, not endless war. 3/3"
1226921631366492160,2020-02-10 17:31:26,"Trump’s budget guts Medicaid, SNAP, Social Security and other programs working people depend on to make ends meet.

As I've said before, we must protect SNAP, and these cuts mean more mothers + fathers will skip meals to prevent their kids from going hungry. 2/3"
1226916428885962752,2020-02-10 17:10:46,"Trump’s budget slashes protections for working families while giving away billions for wars + walls and extending tax cuts for corporations and ultra-wealthy.

Congress must reject this budget. 1/3"
1226905414652088321,2020-02-10 16:27:00,"This is the wealthiest country on earth.

No one should be sleeping on a newspaper or cardboard.

We have to invest in building permanent, affordable housing for everyone."
1226632365033713665,2020-02-09 22:22:00,"Trump’s tax plan will add nearly $2 trillion to the deficit over the next decade.

That’s money going into the pockets of billionaires, instead of into our public schools, our roads, or our election infrastructure."
1226545040031305729,2020-02-09 16:35:00,"Thousands of Americans spend their life savings on medical bills. 

Health care is a human right.

We need #MedicareforAll."
1226340154937413632,2020-02-09 03:00:51,"1 in 13 children suffer from food allergies. The stress, fear and panic so many families endure is unimaginable. 

That’s why @SenDuckworth, @SenSchumer, and I are asking the FAA to include epinephrine autoinjectors on airplane emergency medical kits. https://t.co/4PcVOK5oxy"
1226257897652289537,2020-02-08 21:34:00,"California is the sixth-largest economy in the world. We can’t have mass power outages across the state because PG&amp;E decided not to invest in basic safety measures and routine updates. 
https://t.co/6wznX2gzEB"
1226197499712606209,2020-02-08 17:34:00,There are over 350+ languages in the US—a powerful reminder that linguistic diversity is an integral part of our multicultural nation. Proud to support @RepBrownley's BEST Act to recognize = students for their inspiring commitment to language-learning.
1225919432301649920,2020-02-07 23:09:03,"Congress has failed to hold the President accountable, which is why we need an independent corruption agency to investigate and prosecute officials in the Executive Branch. The Trump administration appears to be taking revenge on Lt. Col. Vindman. It's appalling. https://t.co/MnWxoXYLrD"
1225894503808106499,2020-02-07 21:30:00,"In 2018, Black Americans were 13% of the US population, but made up 42% of new HIV diagnoses in the country. 

End the stigma #NBHAAD https://t.co/LdOzjYNPCc"
1225847191413018624,2020-02-07 18:22:00,"Every parent deserves quality, affordable care for their children, regardless of income level or employment. I’m proud to cosponsor my colleague @RepDebHaaland’s bill to provide universal, low-cost access to childcare and increase financial support for child care workers."
1225841201116581899,2020-02-07 17:58:12,".@Twitter must take this misleading video about @SpeakerPelosi down now. 

Social media platforms are a place where people come for news &amp; information. 

They need to have certain standards. 

Falsity has never been part of our 1st Amendment tradition. https://t.co/dwiDeKNd3D"
1225575903826067456,2020-02-07 00:24:00,Got to sit down this morning with local IFPTE labor reps to discuss how important today’s passage of the #PROAct is to workers across this country. We have to end the so-called right to work laws that are exacerbating economic inequality. https://t.co/AAdolnJyAo
1225535594652106754,2020-02-06 21:43:49,"Today, Democrats are taking a long-overdue step to strengthen protections for every American worker who tries to form a union and speak up to big corporations #PROAct https://t.co/V8OFjIJb5U"
1225525478238363655,2020-02-06 21:03:37,"The Trump administration would rather spend a few extra billion dollars on the defense budget (that’s less than 1% of that total budget) than ensure 3.7 million Americans can put food on the table for their families. 

We must protect SNAP. https://t.co/aeJKKBXIwY"
1225171444344160257,2020-02-05 21:36:49,A fair trial involves witnesses. Dismayed to see the day the United States Senate chose the ambitions of one political party over our entire constitution. https://t.co/QduYFZRL43
1225146109263216641,2020-02-05 19:56:09,Our history isn’t up for revision. We can’t learn from the mistakes of our past if no one is stopping them from being deleted. https://t.co/gfuqUoug9V
1225130652770672640,2020-02-05 18:54:44,"13 million Americans are working 2 jobs right now. 

Nearly 1 million Americans are working 3+ jobs right now. 

No one should have to work more than one job to earn a basic living in this country. We need a $15/hr minimum wage."
1225069652331716609,2020-02-05 14:52:20,"Trump’s strike against Soleimani wasn’t “flawless,” it was unconstitutional, reckless, and led to an Iranian counter attack that left 50 US soldiers with traumatic brain injuries. 

He risked a new endless war with Iran in the same #SOTU speech as he championed ending them."
