id,created_at,text
1247234265827495937,2020-04-06 18:46:36,"At a baseline, every public school student must have reliable internet access. 

We weren’t prepared for COVID-19, but that doesn’t excuse the fact that we’ve been failing so many students for so long. 

Schools can’t be the great equalizer if we don't invest in them equally. https://t.co/poJ0lsR1Xs"
1247220761485590531,2020-04-06 17:52:56,"Iran has been one of the hardest hit by the coronavirus. US policy should be flexible and ease some sanctions at a moment like this to ensure Iranians aren’t blocked from accessing food, medicine and other humanitarian supplies.

There is always room for humanity. https://t.co/Xd1TKaKc2g"
1247206528639254539,2020-04-06 16:56:23,".@McDonalds is worth over $170 billion. 

But somehow they can’t afford to protect their own employees? 

Standing in solidarity with these workers today. No one should be risking their life, or public safety, for a paycheck right now. https://t.co/4bNGQBAYee"
1246859396103180290,2020-04-05 17:57:00,"Food insecurity is a reality for too many people in California right now. Here’s more info about the resources available to you and your loved ones right now -&gt;
https://t.co/LdtKCqsJT4"
1246648758063886336,2020-04-05 04:00:00,"People used to say we should all have at least 3 months pay set aside for a rainy day. 

This week, we saw big corporations that, apparently, didn't have enough put aside to make 3 weeks payroll. 

Thats outrageous. Shareholders shouldn’t profit at the expense of their workers. https://t.co/rLyseJ4wVK"
1246566717817585670,2020-04-04 22:34:00,"If you’re an employer, and you are not an essential business, please do the right thing and close. 

Do it for your employers, for our community, and for this country. Health and safety have to come first. #StayHome https://t.co/yD6QU4uUNJ"
1246525948968579072,2020-04-04 19:52:00,"Wondering if you qualify for cash assistance under the #CARESAct?

Not sure your small business is going to get the loan you need? 

Unclear how to apply for unemployment insurance? 


More info here:
https://t.co/Vl7RyALGVd"
1246482412118433792,2020-04-04 16:59:00,"Student loan payments + interest accrual on federal student loans is suspended until September.
 
The last thing students should have to worry about right now is making these payments. These loans should be forgiven, not just postponed.
https://t.co/dJwx34zMQC"
1246465299601391617,2020-04-04 15:51:00,"My Internet Bill of Rights would ensure we know how our data was used, to protect us from manipulation, exploitation, or discrimination.

As we go online during this pandemic data privacy + security are essential.

We can’t rely on an unregulated internet.
https://t.co/qKh3Kmqv5u"
1246437869025030144,2020-04-04 14:02:00,"The absence of American leadership abroad is strengthening dictators at the cost of human rights and human lives. 
https://t.co/bLqscCjH7S"
1246203183912935425,2020-04-03 22:29:27,"If startups don’t get these loans, it’s not the VC investors getting hurt. 

It’s the engineers, the innovators, and a lot of blue collar workers losing their jobs.
 
If we want to maintain our technology lead, we need to keep these startups afloat. https://t.co/WgnTI4LYQk"
1246183693846220806,2020-04-03 21:12:00,"Startups need access to the same SBA loans as their other small business counterparts. 
Proud to lead this effort for some of Silicon Valley’s future leaders. 
https://t.co/w9g4JcMeV7"
1246150659512193026,2020-04-03 19:00:44,"We are LIVE on Facebook right now for our weekly livestream. Tune in and ask me a question in the comments.
https://t.co/i7HNJzVNAT"
1246137348057899010,2020-04-03 18:07:50,"Health care crises are economic crises. 

If we continue to tie health care to jobs, we ⬆️ our exposure and ⬆️ our risk. COVID-19 is making that painfully clear. 

Medicare for All will protect people AND our economy. It isn’t one or the other. https://t.co/7ESrFLO00j"
1246125740518789121,2020-04-03 17:21:43,"Thank you for your heroism, Captain Crozier. History is going to remember you as one of the leaders in this crisis. https://t.co/b26fJbSBqI"
1246111216298102784,2020-04-03 16:24:00,"Tune in today at 12pm PT for our first ‘lunch break’ town hall on Facebook Live, @ RepRoKhanna. We’re going to be talking social distancing, small business support, and more. 
https://t.co/PkiiWS9moM"
1246110575295422465,2020-04-03 16:21:27,"The delay here is incomprehensible, and at this point indefensible. 

Santa Clara County was the first shelter-in-place in the country. 3 weeks later, we have a fraction of the cases compared to the rest of the country. 

I called for a national shelter in place 10 days ago. https://t.co/tBDkkQGNiX"
1245875664109985794,2020-04-03 00:48:00,"Mayor Gilmore, Liccardo, Mei, Scharf, Nagy, Klein, Tran and all the local leaders in #CA17 are doing a phenomenal job right now. Prouder than ever of our home. https://t.co/8N8AcOUhKH"
1245840431834902530,2020-04-02 22:28:00,"If you are currently experiencing homelessness, you can still be counted in the 2020 Census. The Census Bureau will be at soup kitchens, shelters, tent encampments and everywhere else this week to make sure everyone is counted. More here:
https://t.co/rZC8YpOyEJ"
1245821144114049024,2020-04-02 21:11:21,"Great to see @GOPLeader follow on Speaker Pelosi and my letter. I look forward to continuing to work with Leadership, SBA and Treasury to keep the future of the American economy afloat."
1245814896371150848,2020-04-02 20:46:32,"As @SpeakerPelosi &amp; I wrote to Treasury/@SBAgov, these loans will save 1000s of tech jobs amidst COVID-19, and secure our lead in science, tech and innovation. 

Promising to hear, but we have to ensure startups aren’t excluded from the largest economic relief bill in US history. https://t.co/8qz2ptu86P"
1245806206561607680,2020-04-02 20:12:00,"Dr. Cody in Santa Clara County is a hero.

She put the Bay Area in a shelter-in-place before any governor or other metro area.

That decision saved lives in this community. https://t.co/7aRPnnNPzc"
1245793875308011525,2020-04-02 19:23:00,"My first ‘lunch break’ town hall is tomorrow at 12pm PT // 3pm ET - leave your question in the comments section and I’ll try and get to as many as I can. 
https://t.co/PkiiWSqXNm"
1245765731217747969,2020-04-02 17:31:10,"RT @protocol: TODAY:  

At 12 p.m. PDT / 3 p.m. EDT senior reporter @issielapowsky interviews California @RepRoKhanna about what Washington…"
1245764938020392961,2020-04-02 17:28:01,"Millions of Americans are losing their jobs, along with their employer’s health insurance. This is why we need Medicare for All, at minimum, for the unemployed during this crisis. https://t.co/U2aOIOvCCE"
1245733578576707584,2020-04-02 15:23:24,"We have a war right here at home, with American lives on the line today, tonight, in every corner of this country. 

We should not be starting avoidable wars, needlessly risking human life and global stability in this pandemic."
1245732912198189059,2020-04-02 15:20:45,"Other world leaders are putting every resource available toward the fight against the coronavirus. 

Trump, undeterred by last year's failed intervention w/Bolton in Venezuela, is now talking about new military interventions.
https://t.co/VeEDQuQy4J"
1245447690953072646,2020-04-01 20:27:23,My district team is hard at work (from home!) and is filling out theirs 👏🏾 https://t.co/qQBRUGw1DT
1245440738302873601,2020-04-01 19:59:45,"This is what you should see when you are done. It’s painless. Please fill it out!
Reply with your own image of filling out the #2020Census 👇🏾 https://t.co/uC2Yvr0Kyp"
1245440471138254848,2020-04-01 19:58:42,"Fill out your census #CA17! Just sent mine in, let me know if you have any issues/questions. It literally takes 5 min. We need to all do this so our communities get the federal funding we deserve. https://t.co/7UkSAVXHWY"
1245422492954636290,2020-04-01 18:47:15,"We cannot conduct American foreign policy via tweet.

When @HASCDemocrats return and pass the next defense policy bill, my legislation to prevent the President from striking Iran without congressional approval must be included. https://t.co/Et0sEIBPDU"
1245404299930320896,2020-04-01 17:34:58,"RT @GavinNewsom: Listen to Larry David:

“You’re hurting old people like me. Well, not me...I’ll never see you.” 

#StayHomeSaveLives https…"
1245388134797455360,2020-04-01 16:30:44,"Last week, I sent a letter urging Trump to mandate a nationwide shelter-in-place. 

The Bay Area was the first metro area to do it, and three weeks later we have infection rates far, far lower than the rest of the country. 

Listen to the doctors. https://t.co/5nEMwgbxjB"
1245375086468759554,2020-04-01 15:38:53,"More than 6 million Americans have filed unemployment claims. 

Many of them, if they had insurance, lost it. 

We are only as safe as the least-insured person around us. This decision hurts us all. https://t.co/9gbVWq8MIj"
1245344665131528194,2020-04-01 13:38:00,"Today is #NationalCensusDay! 

Remember to fill out the questionnaire you received in the mail from the Census Bureau, either on paper, over the phone, or online, and get counted. https://t.co/oa8Fhi7oW2"
1245098546258481152,2020-03-31 21:20:00,"While many of us are sheltering in place and working remotely, grocery workers are doing the essential services to keep our society functioning. 

The least we can do is make sure they can do so in safe conditions. https://t.co/9Oo97ZPvEQ"
1245084526998704128,2020-03-31 20:24:18,"RT @SantaClaraCity: The County of Santa Clara @SCCgov has extended the previous Stay-at-Home order through May 3, 2020. The new order clari…"
1245073885080535040,2020-03-31 19:42:01,"This virus doesn’t have a race. The hatred and bigotry displayed by certain members of this country is wholly unacceptable, and will not be tolerated. 

We will continue to work against intolerance and get through this together. https://t.co/WGCzKEOQbI"
1245073796362645504,2020-03-31 19:41:40,"The country stands to lose hundreds of thousands of jobs at the moment we need innovation and entrepreneurial ingenuity the most.

The future of American tech, the same minds that brought us the internet + social networking, is on the line right now."
1245065073036591105,2020-03-31 19:07:00,"Startups are essential to innovation in the American economy. 

Today, @SpeakerPelosi and I sent a letter to Sec Mnuchin and SBA Administrator Carranza urging them to ensure that startups receive the same relief funding as other small businesses during this crisis. https://t.co/GIt8zTODFW"
1245038136138268673,2020-03-31 17:19:58,"Happy #TransDayOfVisibility to all who are celebrating. 

Today and every day, I am honored to support the power, pride, and resilience of trans communities across the country. https://t.co/PDvVsPm7Sl"
1245025178855317505,2020-03-31 16:28:28,"Grocery workers are the unsung heroes of this crisis - they deserve fair pay, immediate safety measures, and comprehensive paid sick leave. https://t.co/ZQWzfF0kne"
1245010970738556928,2020-03-31 15:32:01,"We need a national shelter in place, now. https://t.co/QTTwA8H4Fu"
1244994357087948802,2020-03-31 14:26:00,"Rural Americans are uniquely vulnerable to the COVID-19 outbreak. In towns that might not have a full time doctor, much less a hospital, reliable access to the internet has never been more urgent. 

We need universal access to broadband immediately. 
https://t.co/Bt5XsGceLo"
1244768116036341761,2020-03-30 23:27:00,"If you’ve been furloughed, laid off, or had your hours reduced, you may still qualify for up to 26 weeks of unemployment insurance in California.

More information here -&gt;
https://t.co/wDCVDrGASu"
1244716526676180994,2020-03-30 20:02:00,"No one should lose their home because of coronavirus. 

Science matters, listen to experts.

The government should be prioritizing the needs of working families and the poor who have been hit the hardest."
1244700988012969987,2020-03-30 19:00:15,"Thank you for your courage, your leadership, and your commitment to the health and safety of this community, Dr. Cody. 

Our entire country should follow your lead. #NationalDoctorsDay https://t.co/s9JSl5UjGr"
1244681294132305921,2020-03-30 17:42:00,"Our final #WomensHistoryMonth spotlight is Bina, a PA for 20 years. She says while the lack of test kits and other supplies make her feel helpless, she’s grateful she can continue providing patient care. Thank you to all our health care workers on the frontline of this fight. https://t.co/xJbAfj6Z2H"
1244404721709965312,2020-03-29 23:23:00,"During this crisis, I’ll be holding a weekly livestream on my official Facebook page to answer your questions, and hopefully provide a sense of community right now. 

April 3 at 12pm PT / 3pm ET
April 9 at 5pm PT / 8pm ET
April 16 at 12pm PT / 3pm ET
April 25 at 12pm PT / 3pm ET https://t.co/HvEZ9xWH4D"
1244363197949206528,2020-03-29 20:38:00,"If you are uninsured, you can now get coverage through Covered California through the end of June. With COVID-19 cases growing rapidly, it’s more important now, than ever, to get covered. https://t.co/TTk2jL1Gj9"
1244297515471601667,2020-03-29 16:17:00,"Stephanie organizes transportation for individuals with disabilities. Since those services were shut down she's trying to find solutions to continue her work and get every person what they need. 

Stephanie, along with everyone working on the ground, is a hero #WomensHistoryMonth https://t.co/MxwPqBQkAn"
1244021221869654016,2020-03-28 21:59:06,"We need at least a two week national shelter in place for all. Please listen to @BillGates and medical experts. 

My letter to you here, Mr. President: https://t.co/SjLTX2LoXl https://t.co/C8nr3tvO1K"
1244001313538613248,2020-03-28 20:40:00,"The surest way to make sure that 
a) we avoid a war, and 
b) make sure our values of liberal democracy prevail 

is for America to lead in the technologies and industries of the future."
1243930119737049090,2020-03-28 15:57:06,4/4 That’s why I’m working with House Leadership and the SBA to fix this issue and ensure startups aren’t left out of the essential support the #CARESAct provides for small businesses.
1243930048056512514,2020-03-28 15:56:49,"3/ During COVID-19,  just like other small businesses, startups may go under. 

If we want to stay the global tech + economic leader, we need to get venture-backed start-ups SBA loans. 

If not, thousands of workers could lose their jobs."
1243929897292218369,2020-03-28 15:56:13,"2/ Most start-ups have &lt;500 employees, but in many cases the SBA counts all the start-ups backed by one venture capital firm as one business. 

Each start-up with &lt;500 employees should be counted as their own small business, just like small businesses in other sectors."
1243929738613309440,2020-03-28 15:55:35,"1/ Venture-backed start-ups, including (at one point) @Google, @Twitter, @Facebook, and @Apple are America's economic engines.

While today’s relief package will help many small businesses, further action is needed to ensure start-ups can receive SBA loans.

Here’s the problem:"
1243908703461441542,2020-03-28 14:32:00,"Great initiative from Santa Clara! Supporting our seniors right now is going to take the whole community. 
https://t.co/NN7s0BrWg5"
1243870914351190017,2020-03-28 12:01:50,"I applaud the President’s decision to finally invoke the Defense Production Act. 

Americans need the masks, the ventilators, and all the PPE this decision is going to make possible. We have been calling for this for weeks. https://t.co/SI9P3oIket"
1243642244344750086,2020-03-27 20:53:11,"Be responsible in our public parks – lets all do our part, staying at least 6 feet away from anyone else, so we can keep using these open spaces in #CA17. https://t.co/2y1YDWYVpq"
1243627484031131653,2020-03-27 19:54:32,"A horrific reminder of the true cost of the American health care system. 

No one should be denied COVID-19 treatment for any reason.

Period. https://t.co/YT559SA7vS"
1243614493034328064,2020-03-27 19:02:55,"I've used Instacart, and am absolutely standing with every  employee in demanding effective safety measures, fair compensation, and sick leave https://t.co/bZkEaP8cFg"
1243607985773043712,2020-03-27 18:37:03,"Also, we need remote voting and we need it NOW. 

As Silicon Valley’s representative I am going to work with leadership to bring Congress into the 21st century. No member should risk their health and public safety to come to DC and vote like this ever again."
1243607840280973320,2020-03-27 18:36:28,"Some thoughts from DC today: 

The good?
✅ Unemployment checks for independent contractors
✅ Help for small businesses 
✅ Small cash infusion

The bad?
❗️No moratorium on rents or mortgages
❗️No restrictions to ensure taxpayers have equity in these massive bailouts https://t.co/QsTouXuAES"
1243593375745523717,2020-03-27 17:39:00,"Lori works for ConXion in San Jose, serving and supporting homeless individuals. She’s 64, but is still going to work everyday to help the people she says are the most forgotten. She’s also hosting a food bank every Wednesday open to everyone in the area #WomensHistoryMonth https://t.co/KY8Kqxy7CZ"
1243586135311425539,2020-03-27 17:10:14,"It’s wrong that Congress isn’t voting remotely today. 

Members are being forced between representing their constituents and prioritizing public health. 

Lets get into the 21st century and work remotely during emergencies. Technology isn’t the enemy to smart government. https://t.co/nOWZxE2wm4"
1243537023165759497,2020-03-27 13:55:04,"Rural America leads the world in agriculture and innovation. 

Secretary Vilsack and I are calling for a massive investment in biomanufacturing to rebuild our economy in response to the COVID-19 recession. 
https://t.co/p1FZNvHkxY"
1243518529997070336,2020-03-27 12:41:35,RT @CatieEdmondson: NEW from @SenSanders and @RepRoKhanna on the ceasefire in Yemen: “The United States must move urgently to make sure thi…
1243345476151390212,2020-03-27 01:13:56,"After 5 years of war, and 80% reliant on humanitarian aid for basic survival, Yemenis may be the planet’s most vulnerable people in the face of COVID-19. 

This ceasefire proves an end to the war is possible. 

Yemen needs peace, food, medicine, and diplomacy—not more US bombs. https://t.co/vpVjwaxFcS"
1243290625476374529,2020-03-26 21:35:58,"The toll COVID-19 will take on Yemen is already horrific.

Without U.S. aid, the world’s largest and deadliest famine will grow far worse, very quickly.

We cannot abandon the Yemeni people right now.
#YemenCantWait, and neither should the US before ending this endless war. https://t.co/7pc5rybtx1"
1243283305627295754,2020-03-26 21:06:53,"Teachers are putting forward a herculean effort to keep students on track for graduation. But it’s not enough if we can’t also provide every student with the equipment and broadband access needed for digital learning. 

Working class kids deserve every chance + opportunity https://t.co/eNXqAgElBi"
1243264703301894148,2020-03-26 19:52:58,"At my town hall someone asked for news getting overshadowed by COVID-19. 

This is news worth sharing - I hope the families and communities at the center of this horrific episode can find peace, and focus on a bit of justice in this unsettling time. 
https://t.co/8Jet89yEOQ"
1243250774307745792,2020-03-26 18:57:37,RT @SignalBoostShow: .@RepRoKhanna joined @ZerlinaMaxwell &amp; @jess_mc to talk about the federal stimulus package &amp; what would happen if revi…
1243230014184869888,2020-03-26 17:35:08,"Americans shouldn’t be losing their homes or closing their businesses because they can’t make their payments right now. 

We need a moratorium on mortgages and rent, immediately, before anyone else loses their livelihood. https://t.co/5gpGbhfiFm"
1243211454536462340,2020-03-26 16:21:23,"RT @RepJasonCrow: In this crisis, masks and ventilators will save lives. 

The President can direct factories to start producing this medic…"
1242927113725972480,2020-03-25 21:31:31,"Put Americans to work and use the Defense Production Act. We need to produce masks, ventilators and protective gear.
https://t.co/JjG2Q29Rcd"
1242904839060889600,2020-03-25 20:03:00,"This virus doesn’t have a race, a nationality, or a legal residency status. 
 
#CA17 is the sole Asian American majority district in the continental US. We are always going to stand against xenophobia and intolerance, at home and across the country. https://t.co/TijgXsym26"
1242866083234598912,2020-03-25 17:29:00,"The only way to beat this is if everyone buys in. 

Even if you don’t think you’re making a difference, even if you think your actions don’t impact others, do it. Stay inside, wash your hands, and look out for your community. https://t.co/tZZJCmXr4y"
1242847126331240448,2020-03-25 16:13:40,"Ashley is a nurse working with elderly veterans. She lives with her brother who is high risk for COVID-19 because of his disability. Despite that, she is continuing to go to work every day to give her patients the treatments they need. 

That’s what an American hero looks like. https://t.co/yJ5iVwZwwX"
1242846805223780353,2020-03-25 16:12:23,"To close out #WomensHistoryMonth, wanted to highlight a few stories of women in #CA17 who are risking their health to provide our community with essential services."
1242825514181709824,2020-03-25 14:47:47,"Yesterday, I, along with 19 of my colleagues in the House, sent a letter to President Trump calling on him to listen to the doctors, the governors, and the experts worldwide. @nytopinion. https://t.co/XmIfQRoVjs"
1242824633243631617,2020-03-25 14:44:17,"We don’t have any more time to debate. 

In order to preserve our country, we need an immediate national shelter-in-place. https://t.co/qPsQpesT0T"
1242817777876054016,2020-03-25 14:17:03,"A pandemic puts everything in perspective. 

If this lets us slow down, and reminds us of our vulnerabilities, then we’ll come out of this stronger. https://t.co/SF2GOOIx0L"
1242800148935254018,2020-03-25 13:07:00,"True patriotism right now?
Staying home.

Our health care system is collapsing before us.
 
People are separated from their loved ones. 

Many hospitals will soon be overrun.

The federal government needs to act now to shelter in place."
1242569135592296461,2020-03-24 21:49:02,"When Santa Clara County sheltered in place on March 16, we had 258 confirmed cases.

8 days later, we had 375 cases - 45% growth.

Over the same time period, total US cases have grown by more than 1000%.
https://t.co/1Wtfr6bXGP"
1242541947677335553,2020-03-24 20:01:00,"STARTING NOW

We're hosting a Tele-Town Hall on #COVID19 in Santa Clara County.

📞855-962-1194
@RepAnnaEshoo
@RepJimmyPanetta
@RepZoeLofgren
+ County of Santa Clara Public Health Department"
1242524315435876352,2020-03-24 18:50:56,"We need a national shelter in place for at least 2 weeks. 

Today, I and 19 of my colleagues are sending a letter to Trump demanding that he put this country on lockdown. https://t.co/yZvx7Yg6en"
1242481870106963968,2020-03-24 16:02:16,"We could spend $90 billion on two more years in Afghanistan. 

Or, we could spend that money on mass producing and distributing N95 masks + ventilators + protective eye gear to health care providers across the country.

Health care is national security."
1242469797214015488,2020-03-24 15:14:18,"It is utterly reckless to threaten any doctor with jail time during a public health crisis. 

Sickening to do it over performing a basic reproductive right. https://t.co/Z9AicJBbts"
1242222593425518598,2020-03-23 22:52:00,"Our town hall is TONIGHT on Facebook Live at 6:30pm PT. 

Join me as we discuss coronavirus, corruption, and more. https://t.co/VU7dpwY7Nu"
1242149020082024449,2020-03-23 17:59:39,"McConnell’s plan lacked

❗️ACA/Medicaid coverage expansion for the millions losing their jobs &amp; health insurance 

❗️Anything to lower patient costs for COVID-19 testing + treatment

❗️Safeguards on industry-wide bailouts to protect workers

Thank you for speaking up, @SenWarren. https://t.co/u2zFdwhCPH"
1242139016759312397,2020-03-23 17:19:54,"Health care workers are heroes. 

The absolute least we can do is give them the tools they need to keep our communities alive. https://t.co/iqfSu3w2H7"
1242121358185824259,2020-03-23 16:09:43,"RT @WinWithoutWar: 🎞️#1: Our values don’t stop at the water’s edge.🗺️

Thank you for your leadership and commitment to #ProgressiveFP, @Rep…"
1242098755391848451,2020-03-23 14:39:55,"We need $75 billion, not $750 million, to fund the mass production of ventilators and masks.

There’s no excuse for Trump’s delay in invoking the Defense Production Act. https://t.co/PS0DfZ4WhQ"
1242089466233266178,2020-03-23 14:03:00,Any questions I should try and cover tonight at our town hall?
1242069317090410496,2020-03-23 12:42:56,"Great Q - I have two members of my staff looking at them in real time, just like we do at our normal town halls. You’re welcome to leave a comment on one of the threads that will be up across my accounts today, or submit one through my website. https://t.co/75htnLFyMz"
1241905200845160448,2020-03-23 01:50:48,"Our nation needs an immediate shelter in place for at least two weeks. 

Who will step up and join me in this call? 

We have to act swiftly to save lives.

#COVIDActNow"
1241789163244072963,2020-03-22 18:09:42,"The unwinnable and catastrophic war has now lasted exactly 5 years today.

Famine is not an inevitability - @SenSanders and I will continue to use every Congressional tool to end this war.

It’s Congress, not the president, that decides whether to go to war. #YemenCantWait"
