id,created_at,text
1241091106336657408,2020-03-20 19:55:52,I've been in touch with @US_FDA to make sure we can get more #COVID19 tests to Colorado ASAP. I'm proud of the many companies in our state stepping up during this crisis and will keep working to make sure Coloradans get the care they need. https://t.co/IRumxqLfgu
1241085078643630086,2020-03-20 19:31:55,"The deadline for filing tax returns will be postponed, allowing Americans flexibility to file their taxes until July 15 due to #COVID19. This will help ease the financial burden and allow people to still get refunds during this ongoing pandemic.
https://t.co/vXbCfN9c0J"
1241062482078306304,2020-03-20 18:02:08,@everjed @JoeNeguse @MichaelBennet Liz - my team and I would like to look into this for you. Can you DM me your contact info?
1241061811329384451,2020-03-20 17:59:28,"RT @CDPHE: In this time of uncertainty, it can be reassuring to talk to a medical professional, but they are swamped. If you need to talk t…"
1241050659069276162,2020-03-20 17:15:09,"During the #COVID19 pandemic, it’s important that everyone is doing their part. If you are able, please consider donating blood to the @RedCross. You can schedule an appointment here: https://t.co/8bKFDDONb9 https://t.co/c62W125PGc"
1241035243043373056,2020-03-20 16:13:53,"During this pandemic it’s critical that we work together to provide relief for Americans in need. We must put partisanship aside to ensure that the American people know that we will get through this.
https://t.co/f28L4llzXn"
1240787727060254724,2020-03-19 23:50:21,"This is a call to action, Colorado. Please help. https://t.co/qS9QOignsB"
1240769741079355399,2020-03-19 22:38:53,"The #COVID19 pandemic is having an unprecedented effect on Colorado’s economy. After working with the Colorado congressional delegation and @GovofCO, I’m proud to announce that @SBAgov has approved CO’s request for a full-state disaster declaration to help our businesses recover. https://t.co/QXgCOLyIcv"
1240726946574721026,2020-03-19 19:48:50,"So why in the world are we wasting valuable tests on star athletes while veterans, senior citizens, and especially vulnerable people in Colorado and across the nation are waiting?
https://t.co/GH8TRW8pLv"
1240726945584893953,2020-03-19 19:48:50,"I’m in self-quarantine because I came into contact last week with a Coloradan who later tested positive for #COVID19, but I haven’t been tested.
 
Why? Because I’m listening to my doctor’s advice -  isolating myself and saving tests for others."
1240716347585302529,2020-03-19 19:06:43,"@peytonmgarcia @SenatorBennet @RepJoeNeguse Peyton, I’ve DM’d you directly for your contact info so my team and I can look into this. Thank you for reaching out."
1240701572885049344,2020-03-19 18:08:00,"Americans are resilient, and we are all in this together.

I’ve called my neighbors in Yuma to check in and I'm asking Coloradans across the state to do the same – because social distancing doesn’t have to mean social isolation. #COVID19 #DoingMyPartCO https://t.co/h4FGiE2I1K"
1240696633978843137,2020-03-19 17:48:23,"Thank you to everyone who participated in my telephone town hall yesterday with Dr. Richard Zane from @uchealth on what Coloradans should know about #COVID19. You can listen to the entire telephone town hall here. ⬇️
https://t.co/OgbLyP3RUx"
1240683502682734592,2020-03-19 16:56:12,Read my full letter to @USDA Secretary Perdue ⬇️ https://t.co/dEn2O0lVDQ
1240657642453905416,2020-03-19 15:13:26,"RT @CDCgov: Practice social distancing by putting space between yourself and others. Continue to practice healthy habits, like washing your…"
1240638685466501122,2020-03-19 13:58:07,I commend the Colorado companies who've signed Chairman @AjitPaiFCC’s #KeepAmericansConnected pledge to waive late fees and ensure service will not be terminated for those who can't pay their bills during the #COVID19 pandemic. https://t.co/tKzW5WNwIN
1240399725729329154,2020-03-18 22:08:34,Ski areas in Colorado and across the country are struggling with lost revenue during the #COVID19 outbreak. I’m calling on the @USDA to waive @forestservice fees that ski areas usually pay to lease public lands to help stabilize our tourism industry during this epidemic.
1240392062387867651,2020-03-18 21:38:07,I've long been a supporter of telehealth and I applaud the announcement from @CMSgov to make more telehealth available to Americans to help them follow @CDCgov’s guidance on #socialdistancing. https://t.co/TiQxbOd9ZM
1240376646793924608,2020-03-18 20:36:52,Read my statement on Senate passage of the Families First Coronavirus Response Act ⬇️ https://t.co/uLjCqFe1Ms
1240365733193887752,2020-03-18 19:53:30,Families all over the country are wondering how they will put food on the table and make ends meet. It is extremely urgent that we provide immediate relief for Americans affected by the #COVID19 outbreak. https://t.co/Ew6eKvJFaa
1240313828283305985,2020-03-18 16:27:15,"A huge part of Colorado’s economy relies on restaurants and hospitality. I’m working to help Congress recognize how these businesses make ends meet and work quickly to provide real relief to workers and business owners. 
https://t.co/DTvuZSotrM"
1240306686050566149,2020-03-18 15:58:52,.@CDPHE is working around the clock to ensure Coloradans have easy access to the most up to date information about #COVID19. https://t.co/ZhlClKf14b
1240303682777907200,2020-03-18 15:46:56,"Because of the $8.3B package Congress passed with my support, @CDCgov has provided more than $9.8M to Colorado to combat the #COVID19 outbreak. We must do more to fight the spread of this deadly virus and keep Americans safe. Find the latest updates here: https://t.co/ZGo9nGfKdU https://t.co/8OsXCAgIyS"
1240059855412637697,2020-03-17 23:38:03,"My decision to self-quarantine is out of an abundance of caution. Read my full statement ⬇️ 
https://t.co/8tTQrOOgnD"
1240033345637175296,2020-03-17 21:52:42,Counties in CO have expressed frustration over a lack of clear guidance as to what is reimbursable under the #COVID19 national emergency declaration. We're calling on @FEMA to reach out to local governments to make them aware of resources available during this emergency. https://t.co/xEUWKYJvZc
1240003851819851776,2020-03-17 19:55:31,"We need to provide real relief to American workers who have been impacted by #COVID19, and we need to do it right now. https://t.co/O7emfyuxXE"
1239985038617464832,2020-03-17 18:40:45,"We have to take every step to keep our veterans and health care providers safe. There is more the VA must be doing to stop the spread of #COVID19.
https://t.co/BO2Myqdg1P"
1239985032921591808,2020-03-17 18:40:44,The @DeptVetAffairs serves nearly 9 million veterans in the United States and it's estimated that roughly 50 percent of veterans are 65 or older. Many veterans could be more vulnerable to #COVID19 due to underlying health conditions.
1239985026567213061,2020-03-17 18:40:42,I am gravely concerned with reports of #COVID19 in VA Medical Centers. I am calling on the Administration to ensure the VA is prepared for the #coronavirus outbreak and to provide our veterans the best possible care available. https://t.co/575KT99SKB
1239937767704059905,2020-03-17 15:32:55,"We’re all in this together and it’s up to us to stop the spread of #COVID19. If we follow the @CDCgov guidelines, we can flatten the curve and prevent further spread of this virus."
1239937764809940993,2020-03-17 15:32:54,This assistance for both employees and employers needs to be made available immediately with as much flexibility and as little red tape as possible.
1239937762431840258,2020-03-17 15:32:54,"Hospitality employees need to know that hotels, bars &amp; restaurants will survive through this crisis. Which is why I support establishing a financial assistance fund that could provide grants, low-interest loans &amp; employee retention tax credits to ensure these businesses survive."
1239937760963813376,2020-03-17 15:32:53,Millions of hospitality employees across Colorado must know they will be ok which is why I support creating a special “COVID-19” employee designation that will provide immediate financial assistance to employees without punishing the small businesses that employ them.
1239937759042777091,2020-03-17 15:32:53,Congress must move heaven and earth to protect American workers by providing them with immediate financial assistance and make sure workers and businesses can get through this crisis. This is urgent and it needs to get done now.
1239658027948613634,2020-03-16 21:01:20,"It’s important that we all do our part to help contain #COVID19. There are simple steps that everyone can take to reduce and slow its spread, including knowing when to seek medical treatment.

Learn more from @CDCgov ⬇️ https://t.co/Am561VZ0Wv"
1239615519357100032,2020-03-16 18:12:25,RT @CDCgov: Everyone has a role to play to reduce and slow transmission of #COVID19. Social distancing is one way to prevent the spread of…
1239244805491884038,2020-03-15 17:39:20,"Older adults and those with underlying medical conditions may be at higher risk for severe illness from the #coronavirus. Learn more from @CDCGov about the actions you can take to prevent the spread of #COVID19.
https://t.co/yko4jxEG3L"
1238580336331755521,2020-03-13 21:38:58,"Colorado has suffered its first #COVID19 related death and Jaime and I are sending our deepest condolences to their family and loved ones.

We're facing a serious public health crisis and must listen to the experts and scientists who are working around the clock to keep us safe."
1238573549444628497,2020-03-13 21:12:00,"The President just declared a national emergency in response to the ongoing novel coronavirus outbreak.
 
Read my full statement below ⬇️
https://t.co/ZqiB8anOOJ"
1238565628182769665,2020-03-13 20:40:31,"With the President’s emergency declaration for the #COVID19 outbreak, I am immediately requesting new waivers from @HHSgov and @CMSgov to help Colorado respond. ⬇️ https://t.co/YhAlMkcRWs"
1238131848192110593,2020-03-12 15:56:50,"There are common-sense steps we can all take to help contain the spread of #COVID19. @CDPHE recommends social distancing as a tool for healthy people to avoid getting sick.
https://t.co/aRr1qaITxi"
1238131846845624320,2020-03-12 15:56:50,Last week Congress passed $8.3B for the US response to #coronavirus and CO will receive nearly $10M from @CDCGov for the state’s response. I will continue to stay in contact with state and federal officials to ensure we are taking every possible step to combat #COVID19 spread.
1237861256377151488,2020-03-11 22:01:36,"I’ve always said Colorado needs less Washington influence and more Colorado common sense. I’m grateful to @CO_Municipal for our great discussion today about workforce development, mental health needs, and supporting Colorado’s transportation priorities. #NLCCCC https://t.co/4BlBhcEugH"
1237794400723521536,2020-03-11 17:35:56,"Thank you Major General McFarlane for stopping by and sharing @USArmy_FtCarson's priorities with me, and thank you for your years of dedicated service. 🇺🇸 https://t.co/6HqsIwSjGO"
1237784412244381698,2020-03-11 16:56:15,"It’s important for everyone to take precautions as the #coronavirus continues to spread in the US. See the latest guidance from the @CDCgov on what you can do to help decrease the spread. #COVID19colorado

More information here:
https://t.co/ZGo9nGfKdU https://t.co/9WURsA0hQZ"
1237732759331840001,2020-03-11 13:31:00,RT @CO_Municipal: Our thanks to @SenCoryGardner - a great and longtime friend of CML and municipal governments - for his support of infrast…
1237532183675322368,2020-03-11 00:13:59,I had a great meeting with Colorado members of @IAFFNewsDesk discussing how we can support the brave firefighters who risk everything to protect our communities. Thank you for all that you do! https://t.co/w7jAPCvHeC
1237468629681221634,2020-03-10 20:01:27,Yesterday I introduced the Great American Outdoors Act to fully and permanently #FundLWCF. This bipartisan legislation will ensure that future generations will be able to enjoy our public lands for many years to come. https://t.co/FIFXYI2w8p
1237433300534407168,2020-03-10 17:41:03,"Since the first reports of COVID-19 in the US, I’ve been working closely with local, state and federal officials to ensure Colorado is prepared. Today @GovofCO declared a state of emergency and I stand ready to provide necessary federal support as we work to address COVID-19."
1237162810498564100,2020-03-09 23:46:14,I’m proud to introduce the bipartisan Great American Outdoors Act today to permanently and fully #FundLWCF and address the nearly $12B maintenance backlog in our national parks. This is a historic opportunity to ensure our public lands will receive the funding they deserve. https://t.co/99eVEM3Exb
1237042113818304514,2020-03-09 15:46:37,"Are you a college student or graduate interested in serving the people of Colorado and learning more about the Senate’s role in the US government? My office is now accepting summer internship applications and the deadline is March 15. Learn more here ⬇️
https://t.co/rALMTHi208"
1236728794419007488,2020-03-08 19:01:36,"We are closer than ever to full, permanent funding of the #LWCF with support from the President.
 
See what conservation leaders are saying about my bipartisan efforts to fully #FundLWCF ⬇
https://t.co/e4lE5D3CRk"
1236332020575469568,2020-03-07 16:44:58,"If you or someone you know is interested in attending a US Service Academy and want to learn more, my staff is having an information day today in Alamosa. Learn more ⬇ https://t.co/vkdsJ4fo9a"
1236034725803933697,2020-03-06 21:03:37,"At no cost to the taxpayer, the #LWCF gives Americans new access to the lands they own for hunting, fishing, camping, and other recreation opportunities. I’m proud to have secured the President’s support to permanently and fully #FundLWCF. https://t.co/VuFGhBAOiL"
1235726180348723200,2020-03-06 00:37:34,"The Senate, with my support, approved $8.3B today for efforts to contain and combat the spread of COVID-19. I will continue to work my colleagues in the CO congressional delegation and the Governor’s office to provide necessary resources as we work together to address COVID-19."
1235726178394288134,2020-03-06 00:37:34,"Since the first reports of COVID-19 in the United States, I have been in close contact with local, state, and federal officials to ensure the state of Colorado is prepared for COVID-19, with two presumptive cases confirmed today.

https://t.co/gPVNimW7R6"
1235680201289302017,2020-03-05 21:34:52,"The Senate just approved $8.3 billion, with my support, to combat the #coronavirus. 

Read my full statement below ⬇
https://t.co/54oSaMBIIp"
1235643272112070664,2020-03-05 19:08:07,I enjoyed meeting with @COcounties this week to talk about how we can work together to improve our infrastructure and broadband deployment across every corner of Colorado. I’m grateful for their dedication to improving our communities. https://t.co/vR17kilpJH
1235594403026292736,2020-03-05 15:53:56,"The #LWCF is the crown jewel of conservation programs, but has only received full funding twice in its 55-year history. I’m proud to have secured @realDonaldTrump’s support to fully #FundLWCF.

This is a historic conservation victory!
https://t.co/rz3SwBDbVe"
1235569097250922497,2020-03-05 14:13:23,"RT @AsiaReassurance: The House unanimously passed @SenCoryGardner’s TAIPEI Act, which will strengthen Taiwan’s standing around the world an…"
1235385332293459968,2020-03-05 02:03:10,The entire Colorado congressional delegation sent a letter to @CDCgov and @HHSGov in support of the State of Colorado’s grant request for funding that is critical to prepare for and fight the potential spread of #COVID19. https://t.co/HBCp371U3Z
1235341967430750213,2020-03-04 23:10:51,"Colorado is the heart of our nation’s public lands, but public lands are in the heart of every American. I’m proud to have secured @realDonaldTrump’s support to permanently and fully #FundLWCF. #LWCF
https://t.co/2yHNQb1U6U"
1235307250719301633,2020-03-04 20:52:54,"Steve Farber’s Colorado story is one of perseverance, hard work and leadership. Jaime and I are holding his family and loved ones in our prayers as our state mourns his passing."
1235290403353620480,2020-03-04 19:45:57,RT @senatemajldr: I’m grateful to @SenCoryGardner &amp; Senator @SteveDaines for their strong leadership on securing funding for conserving our…
1235290027917275136,2020-03-04 19:44:27,"📺 WATCH: I held a bipartisan press conference to announce that I've secured @realDonaldTrump's 
support to provide full and permanent funding for #LWCF. It's a great day for the future of public lands in Colorado and the country! #FundLWCF

Watch here ⬇️ https://t.co/VfJddkn9VY"
1234976818957963265,2020-03-03 22:59:53,"It's a great day for the future of public lands in Colorado and the country! I'm proud to have secured @realDonaldTrump’s support for full and permanent funding for the #LWCF. I'll continue to work with @SteveDaines and my colleagues to fully #FundLWCF.
https://t.co/wqz9BwsgFO"
1234957562413494275,2020-03-03 21:43:21,RT @realDonaldTrump: I am calling on Congress to send me a Bill that fully and permanently funds the LWCF and restores our National Parks.…
1234908389916004352,2020-03-03 18:27:58,"It was great to meet with @VFWCO to discuss how we can better support veterans and their families. Service members sacrifice everything to protect us and we must provide them with the best possible care. Learn more about my VA Readiness Initiative here. ⬇️
https://t.co/ZfNKUElzQR"
1234894350699712516,2020-03-03 17:32:11,"Recent illegal missile launches made clear that North Korea has no intention of following the path of diplomacy. I commend @USTreasury’s sanctions, pursuant to my NKSPEA, on two Chinese nationals for violating US law and supporting the Kim Jong Un regime.
https://t.co/lYFk8nwFUK"
1234680719361708041,2020-03-03 03:23:17,"The Administration must denounce the CCP for these abuses and impose sanctions on all responsible pursuant to US law, including my @AsiaReassurance Initiative Act.
https://t.co/10W4tGuymR"
1234680717814054913,2020-03-03 03:23:17,"According to a new report, China transferred more than 80,000 Uighurs and other ethnic minorities to factories known for forced labor.
https://t.co/DhaFNdonKq"
1234628977714704384,2020-03-02 23:57:41,"I’ve been proud to work with my colleagues to address train horn noise across our state, and I’m excited @USDOT is awarding $4M to the @cityoflongmont to create quiet zones and improve safety at several rail crossings.
https://t.co/Fa4098G3FJ"
1234556257505366018,2020-03-02 19:08:43,"RT @AsiaReassurance: ICYMI: @SenCoryGardner, @SenatorRisch and @SenMarkey introduced a resolution congratulating @iingwen on her reelection…"
1234504095471489027,2020-03-02 15:41:26,"WWII and the Battle of Iwo Jima changed our nation forever, and every day we must remember the sacrifices and courage of these brave Americans. I was honored to attend the #IwoJima75 wreath laying ceremony with American heroes from Colorado. Learn more about their stories ⬇ https://t.co/MSYFvyqqpr"
1234240513676627969,2020-03-01 22:14:04,Donald Stratton has become a symbol of who we aspire to be and the nation that we know we are. Yesterday in Colorado Springs we gave him the hero’s farewell he deserved. 🇺🇸 https://t.co/H1PJdxZ26l
1234176746133557249,2020-03-01 18:00:40,"The Southwest Chief is vital to communities in Southeastern Colorado. I’m pleased that @USDOT has awarded $225,000 to @ColoradoDOT to study the feasibility of extending service to Pueblo and Colorado Springs.
https://t.co/StDfTC0zUJ"
1233919508261326849,2020-03-01 00:58:30,"Find the latest updates and information from the @CDCgov about preventing and treating coronavirus here:
https://t.co/ZGo9nGfKdU"
1233919506608730112,2020-03-01 00:58:30,"With the first reported death in the US, we must keep taking action to prevent further spread of #COVID19. I'll continue to work with officials to ensure we combat this deadly virus."
1233802693770129408,2020-02-29 17:14:19,"Protecting Colorado’s public lands for future generations is one of my top priorities. I’m excited that the House passed my legislation with @RepTipton that will preserve Ancestral Pueblo sites and protect a piece of our state’s great history.
https://t.co/j3Kazih8Ma"
1233527398970339340,2020-02-28 23:00:24,Yesterday @RareAdvocates stopped by to discuss my bipartisan Newborn Screening Saves Lives Act with @SenatorHassan. Early treatment from newborn screening can help save lives and I’m honored to work with @RareAdvocates on this important goal. https://t.co/p9RwxQgveN
1233507596470046720,2020-02-28 21:41:43,Donald Stratton was the type of person who only comes around once in a generation and someone I was lucky to know and proud to work with. Yesterday the Senate passed my resolution honoring his lifetime of heroism and service to the United States. https://t.co/w35eC2jZLN
1233494404633108482,2020-02-28 20:49:17,"As #coronavirus continues to spread, it’s critical we have proactive screening measures and sustained international coordination. I wrote @CDCGov, @StateDept and @FAANews to ensure the US is prepared to take any and all steps necessary to prevent and combat a potential crisis. https://t.co/eYz16khXoI"
1233212728518508544,2020-02-28 02:10:01,"Sgt. John “Jack” Thurman from Northern Colorado was among the first to land at Iwo Jima and it was an honor to attend the #IwoJima75 wreath laying ceremony with him.

This is what an American hero looks like. 🇺🇸 https://t.co/UofZyAk9Un"
1233187745096400897,2020-02-28 00:30:44,"The Senate unanimously passed my resolution today honoring Donald Stratton’s incredible life. As we say goodbye to this hero, let us all do it with thanks for Donald Stratton and every brave man and woman who serves our country. https://t.co/GYYdruRVCO"
1233181514571100170,2020-02-28 00:05:59,"Our country has suffered a great loss. We’ve lost a hero, a veteran of World War II, and one of the last remaining survivors of the USS Arizona and the attacks on Pearl Harbor. Watch my speech honoring this American hero, Donald Stratton. ⬇️ https://t.co/TFACdLlAkf"
1233113059373338624,2020-02-27 19:33:58,"Great things are possible when we set aside partisan blinders and instead focus on the results that Coloradans care about. More from @Colo_politics ⬇️
https://t.co/PFOjbnm2Ml"
1232792218227937281,2020-02-26 22:19:03,I’m proud the entire Colorado congressional delegation is supporting this sculpture which will pay homage to the generations of women whose determination granted women the right to vote. https://t.co/P3rIyMPGlc
1232792216755752964,2020-02-26 22:19:03,Today the House passed bipartisan legislation I'm leading with @SenatorBennet to establish the first outdoor monument honoring the women’s suffrage movement and passage of the 19th Amendment. https://t.co/s42Z46QJoJ
1232772801586761728,2020-02-26 21:01:54,"I'm proud of my bipartisan record of results for Colorado. Great things are possible when we set aside partisan blinders, and I’ll continue to work across the aisle for the good of our state because it’s what the people of Colorado demand.
https://t.co/DALMEwu2pJ"
1232747098459836416,2020-02-26 19:19:46,It's time to go back to Plan A on North Korea – the successful policy of maximum pressure. https://t.co/tfuUG1ZQjc
1232734718166216709,2020-02-26 18:30:34,"Today I had a great meeting with @CPAC2 to discuss trade, labor issues, and supporting agriculture research programs. The agriculture industry is a strong driver of our economy and I’m glad we could discuss ways we can continue to support Colorado’s farmers and ranchers. https://t.co/V5LU6dJdjv"
1232479727438331904,2020-02-26 01:37:20,"During my 2019 #GardnerFarmTour, a main concern I heard from local law enforcement and community leaders was meth use. It's critical that states and local governments can use grants in the way that best serves our communities.
https://t.co/a1MaZ5X4G4"
1232464864771096577,2020-02-26 00:38:16,"I'm proud to be a cosponsor of @SenatorWicker's resolution honoring Hiram Revels, the first African American senator, who was sworn in 150 years ago today. https://t.co/RNzUkSRtUT"
1232458914811146243,2020-02-26 00:14:37,I was honored to meet with the Republic of Korea's Defense Minister Jeong Kyeong-doo @ROK_MND to reiterate congressional support for the US-ROK alliance and the shared challenge of North Korea’s continued violations of international law. #KatchiKapshida https://t.co/I9DfhVRmc2
1232421500696834048,2020-02-25 21:45:57,Today’s briefing made it clear that we must work in a global coordinated effort to contain COVID-19. I urge my colleagues to join me in working together to quickly provide adequate resources for the response effort.
1232421499207847936,2020-02-25 21:45:57,"I met with @CDCGov in Fort Collins about their domestic and international public health strategy and visited @USArmy_FtCarson to discuss the possibility of evacuees being quarantined there. Leadership on base is organized and ready if needed to assist.
https://t.co/hikKrB1qCy"
1232421496808787975,2020-02-25 21:45:56,"@HHSGov As the outbreak continued to grow, I wrote to Senate Appropriations leaders @SenShelby, @SenatorLeahy, @RoyBlunt and @PattyMurray requesting that they work with @HHSGov to ensure robust and complete funding for the outbreak response. https://t.co/j0VhTw8sIE"
