id,created_at,text
1247281806124163072,2020-04-06 21:55:30,"RT @CDCgov: Reduce spread of #COVID19. When in public, use a cloth face covering that 
✔️Reaches above nose &amp; below chin, completely coveri…"
1247265887993954304,2020-04-06 20:52:15,"I’m thankful for our farmers who are working day and night to provide for the American people. @SenatorBennet and I are urging @USDA to provide maximum support and flexibility to farmers as they ensure our shelves are stocked during #COVID19. Learn more ⬇️
https://t.co/4W4J4T4kD8"
1247240917989429248,2020-04-06 19:13:02,Today I caught up with @KDVR to discuss the latest on #COVID19 and how Coloradans are going to get through this together. Watch here ⬇️ https://t.co/7u1BHWFhBn
1247154776766365697,2020-04-06 13:30:44,"Beating #COVID19 requires a global effort, and Taiwan is leading by example. My TAIPEI Act reaffirms US support for Taiwan and demands that Taiwan be included in global organizations like @WHO. #TaiwanCanHelp
https://t.co/gOJivDJtKK"
1246921531059580933,2020-04-05 22:03:54,"Do you have questions about #COVID19 or the resources available to you during this pandemic? Check out my website for the latest information from @CDCgov, Colorado-specific information, and to learn more about the resources made available by the #CARESAct.
https://t.co/2MOb0oXunC"
1246889065313701893,2020-04-05 19:54:53,"RT @CDCgov: Stop the spread of #COVID19 while working from home. Clean &amp; then disinfect surfaces such as tables, desks, phones, tablets, &amp;…"
1246564963482771456,2020-04-04 22:27:02,"Small business owners affected by #COVID19 can now apply for assistance through the #PaycheckProtectionProgram.
 
Learn more about the program here ➡️ https://t.co/g2ARWpimXH
 
Find the application here ➡️ https://t.co/SAHvQlhLpO"
1246547727846199297,2020-04-04 21:18:32,"RT @TECO_Denver: You are most welcome, @SenCoryGardner. Taiwan is very glad to share medical supplies with our good friends in Colorado."
1246458057867038720,2020-04-04 15:22:13,"Maybe the @UN should’ve checked with the Uighur’s in prison camps for a reference.
https://t.co/YRKbhwx4cb"
1246274270063480832,2020-04-04 03:11:55,Lights on in Yuma tonight for #BeTheLightCO. We will get through this together and we will be back up to bat again. #GodBlessAmerica @CHSAA https://t.co/i8M0sbeFSy
1246159481043668993,2020-04-03 19:35:47,"RT @CDCgov: To slow the spread of #COVID19, stay at home except to get groceries, medications, or other essentials. Avoid outings you don’t…"
1246138798976708608,2020-04-03 18:13:36,You can learn more about this support for small businesses and fill out an application here ⬇️ https://t.co/V13Asu6fUE
1246138798033055744,2020-04-03 18:13:36,"Today is the first day that small business owners can apply for the Paycheck Protection Program, created by the #CARESAct to provide forgivable loans for small businesses to keep workers on payroll and eight weeks of financial assistance.

https://t.co/F3T6eBZjHx"
1246128805401505794,2020-04-03 17:33:53,I’m thankful for Taiwan’s generous donation of masks to Colorado and the US to help combat #COVID19. I will never stop fighting to ensure that Coloradans have the resources we need to get through this pandemic. https://t.co/v2wf2VaBxw
1246103394906976256,2020-04-03 15:52:55,"The health of every individual and economy around the world is threatened because of the Chinese Communist Party’s attempts to hide the truth about #COVID19.
 
Read my latest op-ed for @FoxNews ⬇️
https://t.co/nMs9WhsE7m"
1245789859215745024,2020-04-02 19:07:02,"Last month I called on @SecWilkie to ensure support for our veterans during #COVID19, including through expanded telehealth. I’m glad they're working to ensure our veterans can receive certain critical services in their home so they can follow social distancing guidelines. https://t.co/4kl7iyNfBT"
1245777868363358208,2020-04-02 18:19:23,"Colorado universities are developing personal protective equipment (PPE) to respond to #COVID19, but they need expedited review from @NIOSH and @NIOSH_NPPTL. I joined the Colorado delegation to call for action to address Colorado’s need for PPE.
https://t.co/U9NRnXTFwb"
1245755863626919937,2020-04-02 16:51:57,"#COVID19 has caused a significant strain on Colorado's small businesses, but the #CARESAct provides relief to small business owners and workers. Learn more about how you can apply and what you need to know. ⬇️
https://t.co/MCNonvRQnH"
1245725967278096385,2020-04-02 14:53:09,It’s crucial that @FEMA provides a sufficient amount of testing kits both to the state of Colorado and to our tribal communities in order to ensure that we are able to respond to #COVID19. https://t.co/E64u6B0ClX
1245704361566703616,2020-04-02 13:27:18,I continue to check in by phone on my neighbors in Yuma and I’m calling on Coloradans to do the same with their own neighbors. We are resilient and we will get through this pandemic together. #DoingMyPartCO https://t.co/bTkPfhbThN
1245505931653283841,2020-04-02 00:18:49,"This generosity is further reason that Taiwan should be immediately allowed to join @WHO as an observer so it can share its expertise in handling #COVID19. I'm proud that @SecPompeo supports Taiwan's participation in the @WHO, as required by my #TAIPEIAct.
https://t.co/3pF47sKvC4"
1245505929564602369,2020-04-02 00:18:48,"I’m grateful to President @iingwen and Taiwan for graciously donating two million surgical masks to the US to respond to #COVID19. Colorado will receive 100,000 masks, 10 percent of the masks donated to individual states.
https://t.co/b1ZXYbzx6v"
1245426096201519106,2020-04-01 19:01:34,"If this reporting is accurate, I’m calling on the Administration to immediately release an unclassified summary of the report and brief @SenateForeign and other relevant committees in Congress about the CCP’s deceit in handling of #COVID19 to help guide the US policy response."
1245426094934802432,2020-04-01 19:01:34,".@Business is reporting that US intelligence agencies have produced a report concluding the CCP lied about the origins of #COVID19 and concealed critical information from the rest of the world, compromising a global response and putting everyone at risk.
https://t.co/xCfx2KYYyH"
1245426093340884996,2020-04-01 19:01:34,"On March 23, @SenatorRomney, @SenRubioPress and I called on the @WHNSC to develop an interagency taskforce to produce a report about #COVID19 and the Chinese Communist Party’s misinformation efforts about the origins and spread of this deadly virus. https://t.co/CkcgOyCQnH"
1245345624251404289,2020-04-01 13:41:48,".@hopeonwheels and @Hyundai announced they are donating $2M for #COVID19 drive-thru testing centers at children’s hospitals across the country, including $200,000 for @ChildrensColo. These centers make it possible for children with compromised immune systems to be tested safely."
1245130655555600389,2020-03-31 23:27:36,"RT @CDCgov: While infection from #COVID19 is a concern for everyone, older adults and people with other health conditions are at a greater…"
1244984646993133570,2020-03-31 13:47:25,"While #COVID19 is a new virus, our country has overcome challenges of this magnitude before. We will conquer this too and get through to the other side stronger than ever – and we'll do it together. Read my latest op-ed in the @denverpost ⬇️
https://t.co/ibxkj4UKuZ"
1244730471654793216,2020-03-30 20:57:25,I’m grateful for our selfless doctors and other frontline healthcare professionals who are working around the clock to keep us safe through the #COVID19 pandemic. Their dedication is inspiring and I am thankful today and every day for their heroism. #NationalDoctorsDay
1244720383992967175,2020-03-30 20:17:19,"Don’t forget to call your neighbors, friends, and loved ones while #socialdistancing. We will get through this challenging time together. #DoingMyPartCO https://t.co/ZkxZ1GX8wL"
1244711827105361920,2020-03-30 19:43:19,"Americans everywhere are stepping up to help during #COVID19. @Medtronic, which has a campus in CO, has decided to publicly share their ventilator design so manufacturers around the globe will be able to assist with the critical shortage. #DoingMyPartCO
https://t.co/oxH2IOBqWn"
1244663756006793222,2020-03-30 16:32:18,"RT @CDPHE: Don't wait to get tested before you start self-isolating. Even if you have mild symptoms, you should be in isolation until:  
☑️…"
1244642640613736454,2020-03-30 15:08:24,I’m continuing my work to ensure healthcare professionals have the resources they need and I’m glad @POTUS signed the CARES Act to provide $100B to support healthcare providers and increased telehealth flexibility for Federally Qualified Health Centers and Rural Health Clinics.
1244642639191912448,2020-03-30 15:08:24,Our health care providers are on the front lines fighting #COVID19. I’m proud that @HRSAgov awarded our community health centers in CO $1.7M last week as a direct result of the $8.3B stimulus package Congress passed earlier this month.
1244365857565835267,2020-03-29 20:48:34,".@WHO needs to admit Taiwan as an observer NOW. My TAIPEI Act, signed into law on March 26, demands the @StateDept take concrete steps to support Taiwan’s participation in international organizations such as @WHO. That time is now, @SecPompeo.
https://t.co/P7cEtZCK4i"
1244365854881562629,2020-03-29 20:48:33,".@WHO sent me a response on March 5, which I am now releasing publicly. It is filled with similar misleading statements that obfuscate real issues and prevent an effective response to a shared global #COVID19 crisis. https://t.co/IHyuTzR49V"
1244365846958542848,2020-03-29 20:48:31,"On January 31, I led a letter with a group of Senators calling for @WHO to admit Taiwan as an observer to help Taiwan respond to the #COVID19 pandemic, and be able to share globally its expertise and knowledge in handling this crisis.
https://t.co/Cj5U0sCjfP"
1244365844416794624,2020-03-29 20:48:31,"The @WHO response today to this calamitous interview is wholly inadequate and full of half-truths.
https://t.co/bcns0uOLMs"
1244315862666039296,2020-03-29 17:29:54,"Our frontline healthcare professionals are protecting us from #COVID19 and we must do everything we can to ensure they have enough resources and PPE as they fight courageously to keep us all safe. When we get through this, it will be in large part thanks to them. https://t.co/cimiwt66CI"
1244282019917500419,2020-03-29 15:15:25,Telehealth can help Coloradans access health care while preventing unnecessary trips from home during the #COVID19 pandemic. Learn more from @CDPHE ⬇ https://t.co/cvQQeNelO4
1244105360258064386,2020-03-29 03:33:26,"My @AsiaReassurance Initiative Act, signed into law in December 2018, authorizes funds for counter-Chinese influence efforts like this taskforce. 
https://t.co/fc550w5YSd"
1244105358995587075,2020-03-29 03:33:26,".@SenatorRomney, @SenRubioPress and I called on @WHNSC to establish a taskforce to combat the CCP’s dangerous misinformation campaign about the origin of #COVID19 and their response. I’m proud to report that this taskforce has now been created.
https://t.co/Qi0KDjLru8"
1244105357661802498,2020-03-29 03:33:26,"If China is reporting honest and accurate information about #COVID19, why are people so desperate to leave Hubei province? https://t.co/q5VWGvs535"
1244096672654909448,2020-03-29 02:58:55,Today @POTUS granted the Major Disaster Declaration requested by @GovofCO and members of the Colorado congressional delegation. This will trigger the release of additional federal funds and assistance to help our state during the #COVID19 pandemic.
1243982672944418816,2020-03-28 19:25:55,.@POTUS let’s work together to produce these around the clock and get this available to everyone across the country. Innovations like this will make a difference to fight the #COVID19 pandemic. https://t.co/1PO5HHbxgT
1243956053294878723,2020-03-28 17:40:09,".@WHO needs to answer the question. NOW.
https://t.co/Oqs1KMILFU"
1243928451419189248,2020-03-28 15:50:28,Rest in peace Senator Tom Coburn. Tom was a conservative force unlike any other and he will be greatly missed by many. Jaime and I are praying for his loved ones and sending our condolences for their loss.
1243677289805733888,2020-03-27 23:12:26,The CARES Act isn’t the beginning or the end of Congress’ response to #COVID19 – we have a long way to go to get through this crisis – but it will greatly help Colorado families NOW. https://t.co/TG0WslRvqS
1243600061428314112,2020-03-27 18:05:34,"Read my full statement on the House passage of the CARES Act. ⬇️
https://t.co/hzJxZ4LvKZ"
1243549978364174336,2020-03-27 14:46:33,The people of Colorado need direct relief from the #COVID19 pandemic immediately. The Senate passed the CARES Act earlier this week and I’m calling on the House to pass it as soon as possible. https://t.co/GTo1fFi77u
1243318436962369536,2020-03-26 23:26:29,Great news ➡️ @CMSgov has approved Colorado’s 1135 waiver at the request of the CO delegation and @GovOfCO. This will provide Colorado’s Medicaid program more flexibility and reduce administrative burdens to provide Coloradans the best care we can during the #COVID19 pandemic. https://t.co/bXXsbZ6RPW
1243251635960324101,2020-03-26 19:01:03,"I’ve spoken to countless Coloradans who are worried about their futures and how to provide for their families because of #COVID19. The Senate passed the CARES Act to provide immediate relief and I’m calling on the House to pass it without delay.
https://t.co/sUDk5g29EC"
1243225800612200450,2020-03-26 17:18:23,Coloradans continue to go above and beyond to support each other during #COVID19. @MysticMtn delivered a 55 gallon drum of hand sanitizer to the Aurora Salvation Army and they are planning to send even more to @NaturalGrocers and @Denver_Fire. Thank you! #DoingMyPartCO
1243206141494071297,2020-03-26 16:00:16,"RT @CDCgov: Getting rid of germs like coronavirus takes a one-two punch. Make sure to clean surfaces with soap and water, and then disinfec…"
1243026605854859267,2020-03-26 04:06:51,"Coloradans and the American people need our help now more than ever and the CARES Act delivers that relief.
 
We will get through this together.

Read my full statement ⬇
https://t.co/0Ifn8c8Wf7"
1242919454692048896,2020-03-25 21:01:04,"People across the nation are worrying about how they’re going to make ends meet and how they’re going to put food on the table. They don’t care if this is a Republican bill or a Democrat bill, they want us do our jobs and pass the relief they need. https://t.co/dYWSfWvBZz"
1242919452678782979,2020-03-25 21:01:04,"Passage of today’s bill is incredibly important for the people of Colorado and the future of the US. We must begin providing immediate relief to all affected by #COVID19. We have a long road to the finish line, but we will get through this crisis together. https://t.co/IpqBq5J4F9"
1242811648156590080,2020-03-25 13:52:41,"Let’s get this done to show American families, workers, and small businesses that we will get through this crisis together."
1242811646944391168,2020-03-25 13:52:41,"As it has now been 14 days since my interaction, at 10am ET my self-quarantine officially ends, and I'm ready to vote in support of the CARES Act to provide immediate relief to Coloradans affected by the #COVID19 pandemic."
1242783922259472384,2020-03-25 12:02:31,It has already taken far too long to pass this urgently needed relief for the American people. Pass the bill now. The House must do the same. No excuses. No delays. Pass the damn bill.
1242573698319687680,2020-03-24 22:07:10,"My team and I are working around the clock to help during the #COVID19 pandemic. In the last few weeks we've helped Coloradans all over the world return home. If you know anyone struggling to return home, please encourage them to visit my website.
https://t.co/40UqRsQiO0"
1242556835485401093,2020-03-24 21:00:09,"On #NationalAgDay we are especially thankful for our agriculture community during this ongoing pandemic. Our thoughts are with our ranchers, cattlemen, and farmers who continue to work to provide for the American people – may God bless them. https://t.co/p6Fwtw3uG5"
1242510712070713344,2020-03-24 17:56:53,Social distancing isn’t just for people with underlying medical conditions or those above the age of 60. It’s up to all of us to stop the spread of #COVID19. https://t.co/aMgaDqb5aR
1242491249757749249,2020-03-24 16:39:32,"I am calling on Coloradans to join together in support of our friends, neighbors, and loved ones during this pandemic. We will get through this together – but as Coloradans continue to step up and do our part, we need more from @HHSgov and @FEMA. #DoingMyPartCO"
1242491248893665280,2020-03-24 16:39:32,".@AlpackaRaft, a Southwest CO packraft company, believes that they can easily help produce protective gear for medical professionals on the front lines."
1242491247983570946,2020-03-24 16:39:32,.@KJLCBD and PureVision Technology think their companies can produce bulk hand sanitizer and also produce medical grade cotton swabs out of hemp – a uniquely Colorado way to help out.
1242491246892982272,2020-03-24 16:39:32,".@WillowPure Systems develops a gaseous ozone chamber used primarily for agricultural decontamination, but their producers believe that it can be used to disinfect N95 masks and hospital gowns."
1242491245764792320,2020-03-24 16:39:32,Vergent Products is a contract manufacturer for medical products and they believe they can partner up and produce ventilators to help with the extreme shortage in hospitals across the state.
1242491243822747651,2020-03-24 16:39:31,"Coloradans all across our great state are stepping up and doing their part to help out during the #COVID19 pandemic and we need @HHSgov and @FEMA to help them do it. Some processes are up and running, but others need more guidance and the federal government response is too slow."
1242452155174473729,2020-03-24 14:04:12,"RT @AsiaReassurance: Today @SenCoryGardner, @SenRubioPress &amp; @SenatorRomney are calling for a new taskforce under the @WHNSC to counter the…"
1242448544998608896,2020-03-24 13:49:51,I’m working closely with @GovofCO on what CO needs for our #COVID19 response and I’m calling for stabilization funds dedicated to helping state and local governments get through this. It’s what Colorado needs and I am fighting to get it included in any next bill we pass.
1242265488098459649,2020-03-24 01:42:27,"Organizations all over Colorado are stepping up to help those in need and I couldn’t be more proud. Thank you, @ColoConcern, @projectcure, @Broncos, and others for coordinating donation drives for masks, gloves, and other PPE to support local medical providers. #DoingMyPartCO https://t.co/M2N13dsPVF"
1242186679248715784,2020-03-23 20:29:17,"Democrats are blocking a bill that would help keep their paychecks coming and gives direct checks to taxpayers.  

Obstruction and inaction is inexcusable."
1242186678212624388,2020-03-23 20:29:17,"Restaurant workers have no idea how they're going to pay for things like their electricity bill or mortgage.
 
Coloradans are being forced to choose between their financial security and their own health. https://t.co/uKhmomUDBI"
1242166611215343617,2020-03-23 19:09:33,"It is outrageous some of my colleagues in the U.S. Senate won’t agree to debate relief for Americans affected by the #COVID19 pandemic. The longer Congress waits to act, more Americans will suffer. https://t.co/E012Uipbkw"
1242142155541528576,2020-03-23 17:32:22,"We need to stand with workers who need pay, families who are losing sleep about providing for their children, and small businesses that have no idea how they can stay open. We need to provide the peace of mind that we will get through this crisis together and pass the CARES Act."
1242142154702675973,2020-03-23 17:32:22,The CARES Act will provide immediate assistance and direct checks to people hurting because of the #COVID19 pandemic and critical support for health care efforts. It’s not the beginning or the end of Congress’ response but it is inexcusable to hold this up any longer.
1242142153435906048,2020-03-23 17:32:21,"I’ve had countless conversations with medical providers, workers at small businesses, farmers, and Coloradans across every sector of our economy. Not one person has asked us delay immediate relief for American families."
1242142152076988421,2020-03-23 17:32:21,This is no time for partisan games. Working Americans have no idea how they are going to provide for their families and health care providers need our support. They need Congress to act and they need it right now.
1242142150906785793,2020-03-23 17:32:21,American families are crying out for help right now and immediate relief is being held up by politicians whose priorities are out of step with the American people. https://t.co/9e3XvySPpx
1242120109256314888,2020-03-23 16:04:46,"RT @CDCgov: Know the facts about #COVID19. Don’t share rumors &amp; unintentionally spread misinformation. Federal, state &amp; local governments a…"
1241919154074062849,2020-03-23 02:46:14,Americans across the nation are counting on Congress to put partisanship aside and deliver emergency relief during this crisis. I’ve seen our country come together in incredible ways in support of our neighbors during this challenge and I know we will persevere.
1241919152778088449,2020-03-23 02:46:14,Jobs are already being cut because Congress isn’t moving quickly enough to help employers keep their workers. We can’t ignore the impact of this crisis and what it will mean for our country if we let employers close.
1241919151402254337,2020-03-23 02:46:14,"I’ve spoken with hundreds of small business owners in Colorado over the last few days and the CARES Act will provide emergency funds so that they can pay their workers rather than fire them, but partisan politics is preventing this from happening – shameful."
1241919149108006912,2020-03-23 02:46:13,"Partisan politics is blocking the CARES Act – a relief package that will provide $350 billion for American workers, $75 billion to health care providers, and nearly $20 billion to protect veterans from #COVID19."
1241919147396792321,2020-03-23 02:46:13,"As the 165 million hardworking Americans in our labor force, their kids, and their parents suffer, partisan politics prevailed. Coloradans need relief now from #COVID19 – the health and security of all Americans are at risk and inaction is inexcusable."
1241834795304394754,2020-03-22 21:11:02,"In the midst of a global pandemic, I’m proud to see Coloradans stepping up to do their part and give back to the community. We will get through this together. #DoingMyPartCO"
1241834794465574912,2020-03-22 21:11:01,"To the local businesses who are giving back to our community, like the distillers using their resources to make hand sanitizer, thank you. I hope that your generosity and creativity inspire those around you to do the same."
1241834792909488130,2020-03-22 21:11:01,Thank you to the grocery store employees who face the threat of this virus each day but remain open to provide for the American people. Thank you for coordinating special hours for the elderly and most vulnerable to purchase necessities.
1241834790980145154,2020-03-22 21:11:01,"On behalf of Coloradans everywhere I want to say thank you to the nurses, doctors, nursing home employees and hospital staff on the front lines of this pandemic, working around the clock to keep us safe. We are so grateful and we’re holding you in our prayers."
1241808861528498176,2020-03-22 19:27:58,"RT @CDPHE: Learn about the extra risks and obstacles faced by people living with a disability during an outbreak. Take care of yourself, an…"
1241787915635654656,2020-03-22 18:04:45,"These times remind us how blessed we are to have farmers and ranchers providing the U.S. with food. I spoke with agricultural producers in Colorado yesterday to say thank you – and here is Paul Harvey’s message I want to share:  
https://t.co/5QW03l2dg6"
1241731194548629504,2020-03-22 14:19:21,"I’m proud of all the Coloradans who have stepped up during this time of need. One of the best ways you can do your part is by donating blood. Learn more about the severe blood shortage from the @RedCross and how you can save lives. ⬇️
https://t.co/LoBXH8pYAc"
1241535263676993540,2020-03-22 01:20:48,@jamee_lock @SenatorGardner @SenatorBennet Jamee - my team and I would like to look into this for you. Can you DM me your contact info?
1241432630618456065,2020-03-21 18:32:58,"During this challenging time, it’s important to check in on those you love. Social distancing can leave people feeling lonely or anxious. Remember to call your neighbors, loved ones, and friends to make sure that everyone is okay. #COVID19 #DoingMyPartCO
https://t.co/xpUiEeVibQ"
1241348655401009153,2020-03-21 12:59:17,"Great news for the Four Corners region ➡️ DISH Network and local broadcasters are bringing Denver TV to La Plata County, connecting CO satellite viewers with CO news and emergency information. 

This will be critical for updates during the state's #COVID19 response."
1241139615798644736,2020-03-20 23:08:38,"My team and I are working with Coloradans who are stranded abroad to get them home. If you know of anyone struggling to return to Colorado from overseas, please encourage them to call my office or visit my website.
https://t.co/40UqRsQiO0"
1241107430622277636,2020-03-20 21:00:44,RT @CDPHE: Early symptoms of COVID-19 may be mild and are easily mistaken as a common cold. Self-isolating and self-quarantining will help…
