id,created_at,text
1246214528590897152,2020-04-03 23:14:31,"Thank you to the thousands of Alaskans who joined @LisaMurkowski and me last night for a virtual town hall on the #COVID19 pandemic and the economic aid coming to Alaska from the CARES Act. 
https://t.co/yzzBV3KBVw"
1245838269134155776,2020-04-02 22:19:24,"RT @SBAgov: Stay updated on #COVID19 programs and resources for small businesses. Here's how:
👉 Go to: https://t.co/18P7pOPxWI
👉 Get email…"
1245823018456268800,2020-04-02 21:18:48,"@stevenmnuchin1 @USTreasury @SocialSecurity Glad to see this commonsense accommodation made for Social Security beneficiaries. If Alaskans have any questions about their eligibility to receive a payment, please reach out to my team in Anchorage at 907.271.5915."
1245822925267243014,2020-04-02 21:18:26,"Some Alaskans—seniors, #veterans &amp; others—have asked how they will receive a payment since they don’t traditionally file taxes. My colleagues and I wrote @stevenmnuchin1 (https://t.co/EGslOvLPwe) requesting @USTreasury work w/ @SocialSecurity to deliver payments automatically. https://t.co/0280JjQYHb"
1245785705533657088,2020-04-02 18:50:32,"#ICYMI, I joined @JoeSquawk on @SquawkCNBC to discuss the #CARESAct and actions I’m taking in response to Saudi Arabia’s efforts to boost oil production and dramatically lower crude oil prices, which is harming producers in Alaska and across the country. Take a look. 📺 https://t.co/s52FXv0ZX5"
1245468122657820672,2020-04-01 21:48:34,"I’m glad @realDonaldTrump agrees that a bold infrastructure bill should be the centerpiece of a Phase 4 response to the economic challenges caused by #COVID19. It’s a win all around. Our infrastructure is crumbling. Our workers need it. Now more than ever, our country needs it. https://t.co/scxFht0Vky"
1245435766920093707,2020-04-01 19:40:00,"Please join @lisamurkowski and me tomorrow, April 2, from 5:30- 6:30pm AKDT for a virtual town hall to discuss the fight against #COVID19 and the significant federal resources being made available to Alaska families, workers &amp; small business to get us through this global crisis. https://t.co/XphhesBifO"
1245044288418992134,2020-03-31 17:44:24,I'll join @LisaMurkowski on @AKpublicnews Talk of Alaska TODAY at 10:00am AKDT to discuss our work in DC to combat the #COVID19 pandemic. Ask a question at 1.800.478.8255 or talk@alaskapublic.org. Listen live at: https://t.co/eSzjaLKjzz
1244778236476903433,2020-03-31 00:07:13,"I’ll be joining @GovDunleavy, Dr. Anne Zink, @LisaMurkowski &amp; @RepDonYoung for the Governor’s daily press briefing on the #COVID19 pandemic, and our efforts to protect Alaskans and shore up small businesses &amp; sectors of the economy that have been impacted. Tune in at 5pm (AKDT). https://t.co/KwfJBDg8lt"
1244337173832359938,2020-03-29 18:54:35,".@LisaMurkowski, @RepDonYoung &amp; I penned an op-ed regarding our efforts in DC to protect the health &amp; well-being of AKns, the vitality of different sectors of the economy, and the fiscal stability of our state and country amid the #coronavirus pandemic.
https://t.co/gU0X3UGt3x"
1243349143290032130,2020-03-27 01:28:30,"To Alaskans currently trapped overseas—If you have not already, please go to my website (https://t.co/wqUzPnmdFu) and get in touch with us by phone (907.271.5915) or email so that we can track your particular situation and update you as circumstances change."
1243348988922941440,2020-03-27 01:27:53,"I know that there are a number Alaskans in foreign countries, particularly Peru, still trying to get home following #coronavirus travel lockdowns. Getting all Alaskans, particularly minors &amp; those with medical conditions, back to our country is a top priority for me and my team. https://t.co/8pk8ewBWpE"
1243257097309114373,2020-03-26 19:22:45,"We’ve seen neighbors helping neighbors, workers ensuring everybody has access to essentials, health care professionals working all hours, and volunteers serving the most vulnerable in our communities. Together, we will get through this crisis stronger and more resilient. [5/5]"
1243256069717209088,2020-03-26 19:18:40,I want to commend all Alaskans for the way they have handled this disruption to our everyday lives. Every Alaskan has a role to play in helping to stop the spread of the #coronavirus and lessening the impacts on our communities. And every Alaskan is playing a role. [4/5]
1243255899776520195,2020-03-26 19:17:59,Our next crucial task is ensuring this bill is implemented correctly and that the massive federal resources provided actually reach Alaskans struggling to make ends meet. My team and I stand ready to continue to work with state and community leaders to ensure that happens. [3/5]
1243255820218966018,2020-03-26 19:17:40,"Last night, the Senate unanimously passed the #Coronavirus Aid, Relief, and Economic Security (CARES) Act, legislation that will provide major relief to families, small businesses &amp; their employees, and help stabilize our economy and protect jobs. [2/5] https://t.co/6OR1xD2PJA"
1243255382996369410,2020-03-26 19:15:56,"The federal government has an essential role to play in helping hard-working families, keeping Alaskans employed, delivering rapid relief to small businesses, and sending a surge of resources to medical professionals as we confront the #COVID19 pandemic. [1/5]"
1242548097747685377,2020-03-24 20:25:26,@SenatorCarper @VP These two task forces would help the nation avoid making siloed efforts in addressing these critical challenges so that we do not unnecessarily prolong our overall response to the #coronavirus. [3/3]
1242547864380768257,2020-03-24 20:24:30,"Last night, I sent a letter w/ @SenatorCarper &amp; 16 of my colleagues to @VP urging the administration to establish 2 task forces to expedite development of #COVID19 treatments and coordinate innovative solutions to fix medical supply shortages. https://t.co/KKLGyXgiIK [2/3] https://t.co/AEmTwlBQgW"
1242547689121878016,2020-03-24 20:23:49,"With the #COVID19 #coronavirus pandemic spreading in our state and our country, we cannot afford any more delays due to medical supply shortages or barriers to finding safe and effective vaccines or treatments for the disease. [1/3]"
1242259102614642690,2020-03-24 01:17:04,"@lisamurkowski @repdonyoung @DHSgov @POTUS @realDonaldTrump Here’s a link to the letter I sent to President Trump and @DHS_wolf. 
https://t.co/ahnkX4lT4F"
1242258953200979969,2020-03-24 01:16:29,"Hearing from Alaskans, @lisamurkowski, @repDonYoung and I have been pressing @DHSgov &amp; the Trump administration for weeks to delay #REALID deadline, especially in light of #COVID19 pandemic. I wrote @POTUS on March 9. Today, @realDonaldTrump announced that delay is happening. https://t.co/E3qcMtVOBm"
1242252170273185793,2020-03-24 00:49:31,"Moments ago, I spoke on the Senate floor about ongoing negotiations regarding the Phase III #COVID19 #Coronavirus economic aid package.  #Covid19AK
📺https://t.co/lEe86Jn29w"
1242143524319043585,2020-03-23 17:37:48,"@CDCgov @SBAgov For Alaskans looking for more details on @SBAgov #coronavirus disaster assistance, call 1-800-659-2955, e-mail disastercustomerservice@sba.gov, or contact my team at 907.271.5915. [4/4]"
1242143329174859776,2020-03-23 17:37:02,"@CDCgov @SBAgov This assistance, in conjunction with a major economic aid package we’ll be voting on very soon, is intended to get our workers and incredible small business owners through this temporary upheaval related to the #COVID19 pandemic. [3/4]"
1242143131098910722,2020-03-23 17:36:15,"@CDCgov Thankfully, @SBAGov announced some good news this weekend - new availability of low-interest economic disaster loans for Alaska companies impacted by the coronavirus pandemic. https://t.co/8rZ5oZRAR6 [2/4]"
1242142995069140992,2020-03-23 17:35:42,"With the nationwide @CDCgov guidance to avoid large groups and practice social distancing, many Alaska small businesses have been forced, through no fault of their own, to scale back operations and, in some cases, shut down completely. #COVID19 #coronavirus [1/4]"
1241900040928538624,2020-03-23 01:30:17,Here’s a quick update on what’s going on in D.C. #coronavirus #covid19 https://t.co/hcgQbcwdbV
1241521079987900417,2020-03-22 00:24:26,Glad to join Tom Anderson on KVNT “Talk of the Valley” yesterday to give an update on our efforts to combat the #COVID-19 #coronavirus. Take a listen. https://t.co/KRwHa5DXvu
1241093800686243844,2020-03-20 20:06:35,"But Americans making trips across the borders for tourism or recreational purposes will need to suspend their plans for now. If you have questions about these new policies, please reach out to my team at 907.271.5915."
1241093673871454208,2020-03-20 20:06:04,"Senior @DHSgov officials have also stated there may be case-by-case exemptions made for communities, like those in Southeast Alaska, reliant on crossing the border to access essentials."
1241093465062113280,2020-03-20 20:05:15,"It’s important to note, for Alaska, cross-border trade and trucking will be permitted to continue as well as those who are just returning home or crossing for medical reasons, with enhanced screening."
1241093137226960898,2020-03-20 20:03:56,The United States has agreed to temporarily close our international borders with Canada and Mexico to “non-essential” travel beginning at midnight tonight in an effort to prevent the spread of the #COVID19 #coronavirus. https://t.co/EjCvXazAOi
1240796345117671424,2020-03-20 00:24:36,".@StateDept has country-specific info on local quarantine &amp; health regulations, travel restrictions, and embassy contacts for Americans overseas. If you are an Alaskan having challenges returning home (or family), contact my team at 907.271.5915. https://t.co/fFdvaJBoCv"
1240795668907724801,2020-03-20 00:21:54,"The U.S. State Department today issued a Level 4 alert advising Americans NOT to travel internationally for the foreseeable future, while also urging Americans traveling abroad to return home as soon as possible. https://t.co/SSFwhmEeor"
1240767702865674240,2020-03-19 22:30:47,RT @SBAgov: What's the process for applying for an SBA disaster loan and what documentation is required? This fact sheet breaks it down: ht…
1240741744762859534,2020-03-19 20:47:38,I voted to for this “Phase II” package to reduce some of the disruption being experienced by our families and to ensure no one encounters a financial barrier to getting tested for #COVID 19.
1240741520485089280,2020-03-19 20:46:45,"The Families First #Coronavirus Response Act, which we passed yesterday, offers support for many Alaskans who are facing uncertainty related to their pay, leave, nutrition assistance and virus testing as a result of the ongoing pandemic. https://t.co/gxmD9d6kNB"
1240713290612748288,2020-03-19 18:54:34,"Yesterday, I spoke with Stuart @Varneyco on @FoxBusiness about our efforts to help ensure the American energy sector is able weather this uncertain time. [5/5]
https://t.co/yyEFkfVKQT"
1240711614518747136,2020-03-19 18:47:54,"Additionally, I’ve called on the Dept. of @ENERGY to only use domestically-produced oil, including oil from Alaska, to fill the nation’s Strategic Petroleum Reserve. [4/5]
👉 https://t.co/ou7JhNuXpd"
1240711381713711104,2020-03-19 18:46:59,"I led a letter with @SenKevinCramer to Saudi Crown Prince bin Salman urging the Kingdom to halt its recent efforts to boost production and lower oil prices, and instead to help calm the economic anxiety taking place. [3/5]
👉 https://t.co/K8ecmk6ziY"
1240711128335790080,2020-03-19 18:45:58,"The oil market has been hit hard, both by the instability caused by the #coronavirus pandemic as well as a recent price war between Russia and Saudi Arabia. This week, I took two actions to shore up our domestic energy sector and better protect Alaska. [2/5]"
1240711003911798784,2020-03-19 18:45:29,"As #COVID19 pandemic develops my top priority is the health &amp; well-being of Alaskans. I’m also focused on our economy. The energy sector is critical, supporting thousands of jobs in AK &amp; the lion’s share of our state general fund that supports much of our social safety net. [1/5]"
1240438513247584256,2020-03-19 00:42:42,"While far from perfect, the bipartisan #coronavirus bill will ensure all Americans have access to testing, while also providing a stronger temporary social safety net for those who are sick or caring for ill loved ones. ➡️https://t.co/2Xjmbb4FNq"
1240437907376295942,2020-03-19 00:40:17,"The #COVID19 outbreak, in addition to the clear health risks, has unleashed a great deal of disruption and anxiety into all aspects of our lives. Today, the Senate unanimously passed the Families First #Coronavirus Response Act. https://t.co/ioJg8gveYj"
1240360247463641088,2020-03-18 19:31:42,RT @Pepperedstars: called @SenDanSullivan's office becoz my folks are in the lower 48 driving a camper wondering if they should be booking…
1240301183627116544,2020-03-18 15:37:00,"Congratulations to Norway’s Thomas Waerner on his #Iditarod victory this morning in 9 days, 10 hours and 37 minutes—only his second time running the Last Great Race. Wishing the rest of the pack a safe and speedy arrival in Nome! https://t.co/vUTjdvGibM"
1240069151143706624,2020-03-18 00:14:59,Here’s an update on what I’m working on in D.C. to help Alaskans through the health and economic challenges we are currently facing with the #COVID19 #coronavirus pandemic. https://t.co/rmuWl7ULjB https://t.co/kfnwgdvQMg
1239693178321674243,2020-03-16 23:21:00,I’ve heard from a number of Alaskans inquiring about family members who are overseas &amp; seeking to return home. @DHSgov has issued guidance regarding the screening process returning individuals will undergo upon re-entry to the U.S. 👉https://t.co/5lJ91nkpUp https://t.co/fgDbX5MvqX
1239672225013420036,2020-03-16 21:57:45,Good advice from Alaska’s former Chief Medical Officer Dr. Jay Butler (now at @CDCgov) for our elders and Americans with underlying medical conditions on how to prevent being exposed to #COVID19. https://t.co/OgyOk8YlJi
1238969955674132485,2020-03-14 23:27:11,RT @Climatologist49: Perhaps the only sporting event currently occurring in the U.S. is the Iditarod. An event that honors the transport of…
1238532536705392642,2020-03-13 18:29:02,"I also want to encourage Alaskans to stay safe and follow current @CDCgov #coronavirus guidance, which you can find on my website at https://t.co/QBM19uv8tv. Working together, we will get through the serious challenges facing our state and country. Stay well."
1238532359135338498,2020-03-13 18:28:19,"My staff and I will remain highly involved in these legislative efforts. We’re also in regular contact with our state health officials and elected officials, standing by to give them the assistance needed in containing and treating the #coronavirus."
1238532217053339648,2020-03-13 18:27:46,"I encouraged Senate leaders to prioritize addressing our challenges instead of taking a scheduled recess. We will stay in session next week to work on a larger economic aid &amp; relief package to mitigate the impacts of this pandemic on individuals, families &amp; businesses in Alaska."
1238532044227043331,2020-03-13 18:27:04,"In D.C., we’re working to ensure Alaska has the tools necessary for #coronavirus prevention &amp; treatment. Last week, we passed an $8.3 billion emergency funding package that allocates money to state, local &amp; tribal health providers. These funds are already coming to Alaska."
1238531920495087616,2020-03-13 18:26:35,"Much has changed in our country in the last few weeks and it’s an uncertain time for many of us. But one thing is clear: Alaskans are the most resilient people anywhere and, working together, we can limit the spread and lessen the impact of this #coronavirus."
1237822004557787136,2020-03-11 19:25:38,"@AmericanLegion I was pleasantly surprised to see a few of my bills among the Legion’s top legislative priorities this year, including my #Veterans #BurnPits Exposure Recognition Act. Thank you all for stopping by and for making the long trip to D.C! https://t.co/r0hKXQe2o7"
1237821745760960514,2020-03-11 19:24:36,A few Alaskans from the @AmericanLegion stopped by my office yesterday to give me an update about their work on behalf of their fellow #veterans. https://t.co/cr0neFNyTn
1237751930639785985,2020-03-11 14:47:11,"Really excited to see the first of fifty-four @thef35 destined for Alaska take flight from the @LockheedMartin plant in Fort Worth. Alaska cannot wait to welcome these fifth-generation fighters and the amazing airmen that will fly, maintain and support them. Aim high! #AirForce https://t.co/Dt1hiWgiGG"
1235677137883017216,2020-03-05 21:22:42,I had the pleasure of signing the bill surrounded by a few American growers—including two great Alaska small businesswomen: Rita Jo Shoultz and Betty Joslyn—before introducing it in the Senate for consideration. https://t.co/txonLOVUJa
1235676996446941194,2020-03-05 21:22:08,"To better support domestic growers, I introduced the American Grown Act 🌺, legislation requiring all federal agencies to only procure cut flowers and cut greens grown in the United States when decorating the government’s many galas, ceremonies and events. https://t.co/qJ5IxRMpGI https://t.co/MXSNTgG5d3"
1235676718125297664,2020-03-05 21:21:02,"Alaska has a burgeoning peony and flower industry that offers world-class blooms during our long, sunny summer growing season, and jobs and opportunities for Alaskans."
1235617819087249408,2020-03-05 17:26:59,"@SenateCommerce I’ve introduced the True Reciprocity Act of 2020 with Sen. @ChrisVanHollen to identify the obstacles put in place by China to obstruct the free work of U.S. diplomats, officials, journalists and businesses in that country. ➡️ https://t.co/E1dMBjSQx1"
1235617473573027841,2020-03-05 17:25:37,"Across a whole host of areas—media, investment, trade, economics—we have an incredibly imbalanced and unfair relationship with China. In @SenateCommerce, I pressed witnesses about this dangerous inequity and the need for greater parity between our two countries. https://t.co/iz4EtMH8FZ"
1235594933676978177,2020-03-05 15:56:03,"The closest strategic port that could handle a destroyer or icebreaker in the #Arctic is ~1,500 miles from the Arctic Circle. I pressed Pentagon’s top policy official on the @DeptofDefense's seeming reluctance to designate and move forward on America’s first Arctic port. https://t.co/gFqHL1FrHM"
1235269552583446528,2020-03-04 18:23:06,"Thankfully, @USDOT announced another $33.5 million grant to support the municipality &amp; boroughs’ work to reconstruct &amp; repair roads around Cook Inlet. This assistance will help Alaska restore this vital infrastructure to a safe, pre-disaster condition. 
➡️ https://t.co/dDKfR64rV7"
1235269234323836928,2020-03-04 18:21:50,"Many Alaska families, small businesses &amp; communities are still working to fully recover from the 11/18 Southcentral earthquake. Alaskans came together in an incredible way—as they always do—to support one another and ensure life goes on amid the effects of a natural disaster."
1234971618943762432,2020-03-03 22:39:13,"@EsperDoD Later in the day, Chairman of @theJointStaff Gen. Mark Milley and I met to discuss topics ranging from Afghanistan to the #Arctic. I always appreciate hearing directly from these two exceptional leaders and I look forward to seeing them both up in Alaska soon. https://t.co/kDRs2PFd22"
1234970872420556800,2020-03-03 22:36:15,"Great day meeting w/ the most senior civilian &amp; military leaders of the Pentagon. I really enjoyed my breakfast with Secretary @EsperDoD where we talked about the KC-46 tanker, missile defense &amp; the world-class training available at the Joint Pacific Alaska Range Complex (JPARC). https://t.co/nzsKgTz68A"
1234925235125792768,2020-03-03 19:34:54,RT @SASCMajority: Watch live: @SenDanSullivan is now chairing a Readiness Subcommittee hearing on U.S. policy and posture in support of Arc…
1234664672365703170,2020-03-03 02:19:31,I joined Rebecca Palsha on @Ch2KTUU recently for an extended interview about the COVID-19 #coronavirus and how the federal government is working with states and local communities to prepare. https://t.co/vBWafADneB
1234617747767734272,2020-03-02 23:13:03,"I’ve introduced legislation w/ @ChrisVanHollen to codify the principle of basic fairness across a number of sectors, to ensure Beijing understands that how it treats Americans operating in China will have real, reciprocal consequences moving forward. 
➡️ https://t.co/vsJpRLIS31"
1234617259794059265,2020-03-02 23:11:07,The principle is simple: China’s state-directed journalists should not enjoy the unfettered press freedoms America offers if those same freedoms are not afforded to American journalists in China.
1234617096354570241,2020-03-02 23:10:28,"I applaud the Trump admin. for announcing a “personnel cap” on Chinese state-run media companies operating in the U.S., reducing the workforce of Chinese nationals from 160 to 100, in response to “’a longstanding, negative trend’ in [China's] treatment of foreign journalists.” https://t.co/Zz2Twx3csO"
1234597265202962433,2020-03-02 21:51:40,.@DARPA #LaunchChallenge continues today at the Kodiak Alaska Launch Complex. Lift-off is just a few minutes away. Don’t miss it! https://t.co/O2G1fdqk1X
1233070239111356418,2020-02-27 16:43:48,"@DAVHQ This year, @DAVHQ is celebrating the centennial of its founding. Congratulations, #DAV, on 100 years of selfless service and thank you to Commander Whitehead and the millions of DAV members for this wonderful honor."
1233070032449671168,2020-02-27 16:42:59,"@DAVHQ I was especially grateful to be joined by a few Alaskans, Pam Beale and Saranna Hack, who made the 3,000 mile trip to D.C. @DAVHQ has been advocating for America’s veterans and their families for generations. #DAV"
1233069730501664773,2020-02-27 16:41:47,"This week, @DAVHQ, a more than 1 million member veterans service organization, presented me with their 2020 Outstanding Senate Legislator of the Year Award. The recognition is humbling and underscores the strong relationship we have with this great group.
https://t.co/VuRjMuAh3Z https://t.co/nFtA7j3wCy"
1232767324777779206,2020-02-26 20:40:08,@marthamaccallum @FoxNews @USMC More than 1/4 of all Medals of Honor awarded during World War II were awarded to Marines and Sailors at Iwo Jima. It was an honor to reflect on some of this incredible history and the men who sacrificed for the cause of freedom. #IwoJima75 #SemperFi
1232767070770778115,2020-02-26 20:39:08,"@marthamaccallum @FoxNews In honor of #IwoJima75, I've cosponsored a Senate resolution recognizing the valor and heroism exhibited by America’s service members, led by the @USMC, in defeating Imperial Japan on that tiny island where more than 26,000 Americans were killed or wounded."
1232766796140306435,2020-02-26 20:38:02,"Last night, I joined @MarthaMacCallum on @FoxNews to discuss the 75th anniversary of the Battle of Iwo Jima and her great new book, ""Unknown Valor: A Story of Family, Courage, and Sacrifice from Pearl Harbor to Iwo Jima."" #IwoJima75 https://t.co/CpdG5iVlTX"
1232705835115143168,2020-02-26 16:35:48,"@CDCgov @DHSgov @StateDept @lisamurkowski @FAANews Finally, to stay up-to-date with the most current information and resources available, I encourage Alaskans to visit the @CDCgov site dedicated to the #coronavirus at: 
https://t.co/RdZOZH1Ipg
[11/11]"
1232705519653183488,2020-02-26 16:34:33,"@CDCgov @DHSgov @StateDept @lisamurkowski @FAANews In a briefing I received yesterday morning, I pressed senior Trump administration officials again on closing this Chinese-based cargo air crew loophole. #coronavirus [10/11]"
1232705354527629312,2020-02-26 16:33:53,"@CDCgov @DHSgov @StateDept @lisamurkowski I sent a letter to the top officials at @DHSgov, @CDCgov and @FAAnews, to propose closing Chinese-based cargo carrier loopholes to ensure any potential risks are mitigated from transiting air crews that stop over in Alaska and other states. [9/11] ✉️👉 https://t.co/8BMJGNg1v0"
1232705056060903427,2020-02-26 16:32:42,"@CDCgov @DHSgov @StateDept @lisamurkowski We must be vigilant while ensuring vital medical supplies from abroad reach Americans in need. However, I believe that fed. efforts on foreign-based air cargo crews need to be tightened for the safety of Americans, particularly in cargo-hub states like Alaska. #coronavirus [8/11]"
1232704871545147392,2020-02-26 16:31:58,"@CDCgov @DHSgov @StateDept @lisamurkowski Second, as an international air cargo hub, Anchorage plays an important role in the global supply chain — which includes critical medical supplies to help in domestic preparedness efforts. #coronavirus [7/11]"
1232704691684958208,2020-02-26 16:31:15,"@CDCgov @DHSgov @StateDept @lisamurkowski A few additional points: First, according to @CDCgov, across the globe, many more people have died from the flu this season than from the #coronavirus. However, the coronavirus appears more contagious than the flu, likely spreading when a patient is not symptomatic. [6/11]"
1232704444988608512,2020-02-26 16:30:16,"@CDCgov @DHSgov @StateDept @lisamurkowski In this regard, I have pressed the administration for additional funds to increase prevention efforts and to ensure preparedness at the state and local levels. #coronavirus [5/11]"
1232704185285648391,2020-02-26 16:29:14,"@CDCgov @DHSgov @StateDept The efforts on containment &amp; domestic preparedness were the focus of a briefing yesterday that @LisaMurkowski &amp; I received from Alaska's former Chief Medical Officer who is now a senior official at @CDCgov, Dr. Jay Butler, and Alaska's current CMO, Dr. Anne Zink. [4/11] https://t.co/maGBOfBd7G"
