id,created_at,text
1232703455250219009,2020-02-26 16:26:20,"@CDCgov @DHSgov @StateDept The government is focused on continuing its international containment efforts, as well as significantly ramping up efforts to support state &amp; local authorities as they expand their preparedness response if and when #coronavirus hits the U.S. in larger numbers. [3/11]"
1232703229886111744,2020-02-26 16:25:27,"@CDCgov @DHSgov @StateDept Given how the virus is spreading internationally, I was advised that we will likely see the #coronavirus hit the U.S. in greater numbers over the coming weeks and months. And, while Alaska is far removed from the rest of the Lower 48, we are unlikely to remain an island. [2/11]"
1232703071609860099,2020-02-26 16:24:49,"Yesterday, I received a briefing from top @CDCgov, @DHSgov, &amp; @StateDept officials on the U.S. response to the COVID-19 #coronavirus. Up to this point, the federal government has been focused on containing the virus from entering the U.S. thru int'l quarantine efforts.
[1/11]"
1232455731976101889,2020-02-26 00:01:59,I want to extend my sincerest gratitude to the outstanding judges and their teams who worked in partnership with victim advocates to reach attorneys and let them know how their legal expertise can lift vulnerable women and children out of horrible situations.
1232452877047586818,2020-02-25 23:50:38,"When we launched the POWER Act several years ago, I envisioned an army of lawyers across the country donating their time and talent to defending survivors of violence. I believe we are on the cusp of making that vision a reality."
1232452750576738305,2020-02-25 23:50:08,"This week, I received some incredible news. In 2019, the federal judiciary held more than 100 POWER Act summits across the country, attended by more than 7,000 Americans – lawyers and victims, alike.
👉 https://t.co/NsmmpVasVb"
1232452601632870400,2020-02-25 23:49:32,"The POWER Act mandates that each year, for four years, the Chief Judge of each Judicial District across the country hold at least one event promoting pro bono legal services. We held Alaska’s first event in Anchorage in August of 2019."
1232452429276254209,2020-02-25 23:48:51,"Experts agree that securing a lawyer for victims is the best way to get them out of their situation and to get them shelter, housing and medical care. That work in Alaska grew into my Pro Bono Work to Empower and Represent (POWER) Act, which was signed into law in 2018."
1232452208366538757,2020-02-25 23:47:58,"Sexual abuse &amp; domestic violence are among our most pernicious social problems, and one of my top priorities as a Senator has been to support the needs of victims and survivors. Going back to my time as Alaska’s attorney general, I’ve fought for expanded pro bono legal services."
1232379913652645889,2020-02-25 19:00:42,"@SenWhitehouse Alex DeMarban had a great story in @adndotcom this weekend exploring this odd-couple friendship, and our work together to make progress on the global challenge of ocean debris that impacts Alaska’s vast coastline. #SaveOurSeas"
1232379730420260864,2020-02-25 18:59:58,"Given the constant negative press coverage coming out of D.C., you’d be forgiven for thinking that Republicans and Democrats never work together. Wrong. One of my closest friends in the Senate is @SenWhitehouse. https://t.co/sUrN9BTUV1"
1230252996497420288,2020-02-19 22:09:06,"@WSJ @POTUS This episode underscores why it's time to pass the True Reciprocity Act, my bill w/ Sen. @ChrisVanHollen to require a more reciprocal relationship with #China, including standing up for American press freedoms. 
➡️ https://t.co/E1dMBjSQx1"
1230252554879197187,2020-02-19 22:07:20,"While Chinese journalists operate freely in America, the #CCP enacts a heavy hand against our own, expelling 3 credentialed @WSJ reporters today. @POTUS should expel 3 Chinese reporters in response as part of Trump admin’s policy to establish more reciprocal relationship w/China. https://t.co/ShPTto0eGu"
1229851708421025792,2020-02-18 19:34:31,"@lisamurkowski @repdonyoung The Senate Democrats' letter mischaracterizes the actual, limited development that’s been proposed for no more than 2,000 federal acres of #ANWR— 1/10,000th of the 19.3-million acre refuge, and wholly disregards the preferences of the Alaskans who actually live in ANWR."
1229851323031523330,2020-02-18 19:32:59,"A number of my Senate Democrat colleagues sent a letter to the nation’s top banks, urging them not to finance energy development on the North Slope. Sen. @lisamurkowski @repdonyoung and I sent a letter to the same banks to correct the record. 
✉️ https://t.co/fjgYw3Qv89 https://t.co/Ygq9iRGUgS"
1229209202297577472,2020-02-17 01:01:26,Elizabeth’s activism and accomplishments represent a shining example for all Americans – an example that is now immortalized nationwide in a powerful way. Happy Elizabeth Peratrovich Day!
1229209016410279936,2020-02-17 01:00:41,"In so doing, she helped pass Alaska’s Anti-Discrimination Act of 1945, the 1st piece of legislation in the country ensuring equal rights for all people regardless of race. Today, we commemorate the 75th anniversary of that act, and the woman who helped make it happen."
1229208503551700992,2020-02-17 00:58:39,"Before Alaska was even a state, Elizabeth Peratrovich and her husband, Roy, along with the Alaska Native Sisterhood and Alaska Native Brotherhood, worked with Alaska’s territorial Legislature to end public facilities and local housing discrimination."
1229208371535937538,2020-02-17 00:58:08,"This week, the U.S. Mint released the long-awaited Sacagawea 1 Dollar Coin celebrating Elizabeth Peratrovich, a Tlingit woman from Petersburg and one of our nation’s greatest civil rights activists. https://t.co/CfHK44xqcX"
1227689228739530753,2020-02-12 20:21:36,"In the Senate, we’ve confirmed 188 federal judges ⚖️ since @POTUS took office. Today, it was Alaska’s turn. I was glad to vote to confirm Joshua Kindred to serve as the next U.S. District Court Judge for our state. 
➡️ https://t.co/9PVEci099w https://t.co/PRVYasBa7x"
1227642394310512642,2020-02-12 17:15:29,"I've introduced a bill w/ @ChrisVanHollen directing the administration to develop an in-depth report to Congress on the obstacles put in place by China to obstruct the free work of U.S. diplomats, officials, journalists and businesses in the country. 
➡️ https://t.co/plKadM31Ah https://t.co/CdKA9YupJS"
1227641756369510401,2020-02-12 17:12:57,This imbalance has been raised w/ the most senior Chinese officials for decades but Beijing has consistently failed to make good on its commitments to change. The US must insist on a bilateral relationship defined by something understood by every American: reciprocity &amp; fairness.
1227641546452996096,2020-02-12 17:12:07,"The imbalance in the US-China relationship has reached a tipping point. American citizens &amp; businesses operating in China face significant restriction, delay &amp; censorship. Their Chinese counterparts, however, operate freely in the U.S., largely unencumbered by our government."
1227366265733439488,2020-02-11 22:58:15,"Congratulations to Brent Sass, the reigning @theyukonquest champ from Eureka, who just took home his 3rd title, crossing the finish line in 10 days, 2 hours &amp; 53 minutes! Best of luck to the remaining mushers and dogs still making their way on the 1,000-mile trek to Whitehorse. https://t.co/cwItjIGmKf"
1227318811965165568,2020-02-11 19:49:41,"@SecElaineChao @DeptofDefense This grant will help restore the Port of Alaska’s status as a safe, cost-effective, reliable &amp; resilient piece of infrastructure. I want to thank @SecElaineChao for recognizing the dire state of the Port and heeding the call of Alaskans by approving this much-needed PIDP grant."
1227318555919683584,2020-02-11 19:48:40,"@SecElaineChao The Port of Alaska is the only @DeptofDefense strategic seaport near the #Arctic—a fact we cannot overlook as sea ice recedes, traffic accelerates and our country’s adversaries, particularly Russia, grow their maritime capabilities in the region."
1227318325744672770,2020-02-11 19:47:45,"@SecElaineChao The Port of Alaska not only serves the most basic needs of a broad swath of Alaskans – including fuel, food, construction materials, and other goods – but also America’s security interests as an #Arctic nation."
1227318121364643840,2020-02-11 19:46:57,"This morning, @SecElaineChao announced a $20 million Port Infrastructure Development Program (PIDP) grant for the Port of Alaska, in Anchorage, a grant I’ve been pressing for, along with the Municipality, for months. 
➡️ https://t.co/QqBod9kK2o"
1226974363066523648,2020-02-10 21:00:58,"I have reintroduced my bill, the “Protect Our Heroes Act,” which would enhance federal penalties, including opening up the potential for the death penalty, for criminals who ambush, lure or target law enforcement officers. ➡️ https://t.co/116FuMjrN8"
1226973983037362176,2020-02-10 20:59:28,"I’ve always believed there is something special, even sacred, about a person who goes to work every day willing to put their life on the line for their fellow citizens."
1226973713033244672,2020-02-10 20:58:23,Two police officers were shot in New York City on Sunday in an attack that the NYPD commissioner called “a premeditated assassination attempt.” The disgraceful attack underscores a troubling rise in recent years in the disrespect &amp; violence directed at America’s police force. https://t.co/wSmfw9Ogjd
1225558281730625541,2020-02-06 23:13:58,"Nothing fires me up quite like Senate Dems, who represent states that've already degraded their environments with irresponsible development, telling Alaskans how to manage our pristine environment &amp; seeking to further impoverish some of our poorest citizens. (@EPWGOP hearing) https://t.co/Vx7bNYTM35"
1225216514858549248,2020-02-06 00:35:55,"This afternoon, I voted to acquit President Trump on both charges brought against him by the House of Representatives. My full statement submitted to the congressional record 👉 https://t.co/4obEmN7UfA https://t.co/ir7okdDZof"
1225107693372874753,2020-02-05 17:23:30,"Connie, like her husband, was fearlessly optimistic about the future and put her heart and soul into bringing opportunity and development to the Interior. Our thoughts and prayers are with Bernie and their family today as we mourn the loss of this incredible woman."
1225107594815119360,2020-02-05 17:23:06,"Julie &amp; I were heartbroken to learn of the passing of Connie Karl, a friend and a great Alaskan who passed yesterday after a battle with ALS. Just over a month ago, the Interior community came together to celebrate Connie &amp; Bernie and all that they have contributed to our state. https://t.co/mstymhtINw"
1224922817826820096,2020-02-05 05:08:52,"Tonight, @POTUS @realDonaldTrump delivered a strong #StateoftheUnion, an optimistic speech—optimism that is based on real results that we're seeing in America and Alaska. #sotu #sotu2020 https://t.co/4mgxkOf1gj"
1224874235191078912,2020-02-05 01:55:49,"RT @SenateGOP: Tonight, @realdonaldtrump delivers the #SOTU

Join us LIVE starting at 8:30pmET:

 https://t.co/OwxJXXYRxe"
1224871883159560193,2020-02-05 01:46:28,Matt puts a face on an industry that provides tens of thousands of jobs in Alaska. The work he does is one of the reasons I get to brag that Alaska is the Superpower of Seafood. #SOTU
1224871786342420480,2020-02-05 01:46:05,"I look forward to bringing fellow Alaskans to D.C. to witness the President’s annual #StateoftheUnion. My guest this evening is Matt Alward, of Homer, a proud fisherman and president of the United Fishermen of Alaska. #SOTU https://t.co/Hx2OKBxZje"
1224744725825101826,2020-02-04 17:21:11,"@lisamurkowski @repdonyoung @NativeFed Thanks to the @NativeFed team &amp; Julie Kitka for bringing everyone together—tribal leaders, high-level military officials, representatives from the private sector, and senior Trump administration officials, including Alaska’s-own @ASIndianAffairs—for such a critical conversation. https://t.co/TuRBDCAZl3"
1224743991662563330,2020-02-04 17:18:16,"@lisamurkowski @repdonyoung @NativeFed We covered a number of topics, including Missing &amp; Murdered Indigenous Women initiatives and the dire need for increased public safety support in rural Alaska. My wife, Julie, offered an insightful presentation on the challenges of youth homelessness and sex trafficking. #MMIW https://t.co/nKo7J11j0j"
1224743219973541889,2020-02-04 17:15:12,"Last week, @LisaMurkowski, @repdonyoung and I joined a productive round table discussion during the @NativeFed's annual “Alaska Day” events here in D.C. https://t.co/io6RmK5Fua"
1224719002200629248,2020-02-04 15:38:58,"These patriotic individuals did their jobs admirably and, no doubt, provided a level of comfort to their fellow citizens embroiled in an unsettling situation. #coronavirus"
1224718888010690560,2020-02-04 15:38:31,"I want to commend the numerous Alaskans, including medical professions and first responders, who offered help last week for the American evacuees from Wuhan who stopped over at the Anchorage airport on their journey to the Lower 48. #coronavirus"
1224718660239085569,2020-02-04 15:37:37,To address one particular question I’ve received: All upcoming cargo flights between Wuhan and Alaska have been canceled and many commercial airlines have suspended passenger flights between the U.S. and China. #coronavirus
1224718525849272320,2020-02-04 15:37:05,"@SecAzar Last week, Secretary Azar declared a public health emergency. @WHO has classified the outbreak as a global health emergency. @StateDept has issued an alert advising Americans to not travel to China. #coronavirus"
1224717941276598276,2020-02-04 15:34:46,"As we see the number of cases of the novel coronavirus increase, I encourage Alaskans to remain calm but very vigilant. Health &amp; Human Services @SecAzar recently said, “The risk to Americans remains low, and we are working to keep it that way.” https://t.co/vk2I87socr"
1223410495216082944,2020-02-01 00:59:26,My statement on today's vote in the Senate impeachment proceedings. https://t.co/5ypGmGSBol
1223037124859088901,2020-01-31 00:15:48,"Earlier today, I posed a question during the impeachment proceedings in the Senate. https://t.co/FzFGkVa3hb"
1222913163844300802,2020-01-30 16:03:13,"@SenFeinstein @lisamurkowski Our hope is that when Americans know that this crisis exists in our communities and our neighborhoods, good citizens across the country will recognize the signs and help vulnerable adults and children escape the clutches of a trafficker. #HumanTrafficking"
1222912991559061505,2020-01-30 16:02:32,"This week, I joined @SenFeinstein and Sen. @LisaMurkowski in introducing a resolution in support of National Trafficking and Modern Slavery Prevention Month. https://t.co/uSWkT8ychR
#HumanTraffickingAwarenessMonth"
1222912544299474944,2020-01-30 16:00:45,It’s sickening to know that thousands of individuals in our own country are ensnared in what amounts to a form of slavery. We need to do all we can to stop it. One of the best weapons we have against human trafficking is exposure &amp; sunlight. #HumanTraffickingAwarenessMonth
1222893763674038273,2020-01-30 14:46:08,I was glad to serve with @SenJohnMcCain and honored to succeed him as Chairman of @IRIglobal. A unique opportunity for young leaders around the world to meet and talk to business leaders and experts about economic and political freedom and how it works in America. 👇 https://t.co/c7WtPFsO0g
1222263752210468867,2020-01-28 21:02:41,"@WSJ @GoldmanSachs “Goldman executives are simply looking to curry political favor with powerful green interests. The cost of Goldman Sachs’s hypocrisy will be paid by my people, who may soon be on a path back to the deprivation and hardship our ancestors worked so hard to leave behind.”"
1222263557619953665,2020-01-28 21:01:55,"Harry Brower Jr., mayor of Alaska’s North Slope Borough, penned a must-read op-ed in @WSJ this weekend, rebuking @GoldmanSachs for choosing to divest of all oil &amp; gas development in the #Arctic without consulting him or his constituents, the very people who will be most impacted. https://t.co/KxD4TqUfUt"
1220806677227806720,2020-01-24 20:32:47,"Many Alaskans have reached out in recent days with concerns about the reported cases in the U.S. of a new coronavirus, which are all connected back to Wuhan, China. I just attended a briefing with senior federal health officials, including from the @CDCgov, about the situation. https://t.co/ddS1h7qgWP"
1220519037039497217,2020-01-24 01:29:49,"Thanks to @EPAAWheeler, @EPA and the administration, that uncertainty has now been replaced with a reasonable and statutory interpretation of the Clean Water Act that will protect our cherished waterways without devastating Alaska’s economy. #WOTUS"
1220518829236850688,2020-01-24 01:28:59,"Under the previous rule, land owners faced the potential for thousands of dollars in litigation and months of bureaucratic back-and-forth just to fill a ditch on their own property, or build a structure. #WOTUS"
1220518689369399297,2020-01-24 01:28:26,"I join hard-working Alaskans and land owners across the country in welcoming the Trump administration’s final, clear #WOTUS Rule, which stands in stark contrast to the burdensome and overreaching definition offered by the previous administration."
1219880213833797632,2020-01-22 07:11:21,"Congressman Nadler tried to bring his House circus to the floor of the Senate tonight with his insults and accusations of U.S. Senators. Not surprisingly, he failed, and as the Chief Justice admonished—the Senate holds itself to a higher standard."
1219411910141128709,2020-01-21 00:10:29,"Reflecting on the life and legacy of the great Dr. Martin Luther King, Jr. at the memorial built in his honor here in Washington. #MLKDay #MLK https://t.co/0JWDbGq4lw"
1219004830334824451,2020-01-19 21:12:54,"Congratulation to Pete Kaiser, the reigning #Iditarod champ who just took home his FIFTH Kuskokwim 300 title, crossing the finish line in his own hometown of Bethel earlier this morning. https://t.co/7j3HJPWNNG"
1218271012283961345,2020-01-17 20:36:58,"Additionally, because of our #SaveOurSeas  Act, signed in 2018, the #USMCA also contains strong language aimed at curbing #marinedebris, including plastics and microplastics. This is the first time marine debris has been specifically addressed in a trade agreement. #USMCAwin"
1218270650747576322,2020-01-17 20:35:32,"I got a provision signed into law in 2016 mandating that fisheries be a principal negotiating objective in all future trade agreements. As a result, #USMCA features an entire chapter on fisheries, including phasing out subsidies, combatting illegal fishing and reducing tariffs."
1218269519975796737,2020-01-17 20:31:02,"#USMCA, which constitutes an updated NAFTA, is the most significant change to North American trade policy in nearly 30 years. It will strengthen our country’s farmers, manufacturers, small businesses and, importantly, Alaska fishermen. #USMCAwin"
1218269358516064258,2020-01-17 20:30:24,"On the heels of the signing of the Phase One U.S.-China trade agreement—which contained positive news for Alaska fishermen—the Senate yesterday passed another critical trade agreement, the United States-Mexico-Canada Agreement, with more positive news for Alaska. #USMCAwin #USMCA https://t.co/rAlASLrtbo"
1217919778247061506,2020-01-16 21:21:17,"#SaveOurSeas 2.0 could significantly benefit Alaska's coastal communities &amp; ecosystems. As I shared with Sarah Lapidus, the goal of the legislation is not only to clean up, but also to limit the source of #marinedebris and plastics that pollute our waters and fisheries. https://t.co/otqqW9RRrm"
1217632320200593410,2020-01-16 02:19:02,"It will be imperative that China address the “promise fatigue” that the U.S. has experienced in previous agreements, over many years, whereby China makes commitments to the United States and then does not follow through on them."
1217632159621689344,2020-01-16 02:18:24,"While I’m pleased to see a focus on addressing some of China’s most egregiously unfair trade practices, China must still commit to long-term structural changes to its trade &amp; economic policies that are necessary for a freer, fairer &amp; more reciprocal trade relationship w/ the US."
1217631803466567680,2020-01-16 02:16:59,"Because of our seafood industry, China is Alaska’s largest trading partner. I have repeatedly urged @POTUS, Ambassador Lighthizer &amp; Commerce Secretary Ross to include seafood in Phase One of these trade negotiations, and I’m glad that they did so."
1217631607768649728,2020-01-16 02:16:12,China’s commitment to purchase Alaska seafood at levels significantly exceeding the country’s historic purchases will be a welcome boon to a vital Alaska industry that has been caught in the middle of ongoing trade negotiations.
1217631399823454208,2020-01-16 02:15:22,"I commend @POTUS and his team—particularly U.S. Trade Rep Lighthizer—for successfully negotiating the Phase 1 US-China Trade Agreement, an important, serious, much-needed first step in resetting this economic relationship. Importantly, it is positive news for Alaska’s fishermen."
1217595250740465665,2020-01-15 23:51:44,"This afternoon, I spoke with @DanaPerino on the @DailyBriefing about the articles of impeachment finally being sent over to the Senate, and President Trump’s momentous Phase One Trade Agreement with China, signed today at the @WhiteHouse. https://t.co/a7OSlWal6e"
1217545282273062912,2020-01-15 20:33:10,".@SenatorWhitehouse and I spoke about the #SaveOurSeas 2.0 Act, which would explore innovative ways to recycle and manage plastic waste, and support the development of eco-friendly packaging. [Photos: David Bohrer / Consumer Brands Assoc.]
https://t.co/jk8Cb0kheL #marinedebris"
1217544755162337282,2020-01-15 20:31:05,"This morning, I joined a few colleagues for a roundtable discussion w/ Consumer Brand Association’s Recycling Leadership Council, a new organization formed by the business sector to work toward reducing waste &amp; developing sustainable consumer products and packaging. #marinedebris https://t.co/YIlMvN3svv"
1217538862270025728,2020-01-15 20:07:40,"Wild Alaska seafood on the menu! 
🐟🐟🐟🐟🐟 https://t.co/s2SSrEdMlm"
1217518068982829057,2020-01-15 18:45:02,"At the top of the hour, I’ll be speaking with @DanaPerino on @dailybriefing about the Phase 1 trade agreement signed moments ago by @POTUS in the @WhiteHouse, a first step toward establishing a freer, fairer &amp; more reciprocal trading relationship between the US &amp; China. Tune in."
1217482591147843584,2020-01-15 16:24:04,"Just got to the @WhiteHouse for the signing of the Phase One U.S.-China Trade Agreement, which marks an important reset in the trade relationship between the world's two largest economies. https://t.co/cYHq3BEIpn"
1217454772946710528,2020-01-15 14:33:31,"@NOAA SOS and the #SaveOurSeas 2.0 Act are both aimed at bolstering the @NOAADebris Program and authorizing grants, like this, so that we can better protect our fisheries and preserve our pristine marine environment. https://t.co/OkSgbbE4l8"
1217454216240861184,2020-01-15 14:31:19,"Great work being done on Kodiak and the Pribilofs to clean up trash, plastic waste &amp; derelict fishing gear washing up on Alaska’s shores. The clean-up is being done w/ grant funding from @NOAA that was reauthorized by my #SaveOurSeas Act, signed into law in 2018. #marinedebris https://t.co/tAZOwNDAVo"
1216855967289298944,2020-01-13 22:54:05,".@SenWhitehouse, @SenatorMenendez and I will be on the floor shortly to speak about the Senate’s unanimous passage of our #SaveOurSeas 2.0 Act, comprehensive legislation to combat the #marinedebris crisis. Watch live: https://t.co/AUOKhvjizm #EndOceanPlastics"
1216169406209937409,2020-01-12 01:25:56,"Our first #AlaskanoftheWeek of 2020: Doug &amp; April Moore, owners of Moores’ Hardware and Building Supply in #Talkeetna. The Moores are devoted to their employees and heavily involved in the community, including donating time &amp; equip to those impacted by wildfires last summer. https://t.co/HEqtoMFleK"
1216111549720473600,2020-01-11 21:36:02,"The #TaiwanElections are an opportunity to celebrate democratic success and reflect on sustained challenges to democracy in the region. In both #Taiwan and #HongKong, the #CCP’s meddling shows its hostility toward – and fear of – political freedom. 
https://t.co/b2YHv4hYNZ"
1216110190598160384,2020-01-11 21:30:38,"Congratulations to #Taiwan President @iingwen on her #TaiwanElections victory! The vote demonstrates a simple truth: When given the ballot, free people will always choose a democratic future. Their aspirations must have continued bipartisan support. #Taiwan2020 #TaiwanVotes"
1215810912000643072,2020-01-11 01:41:24,"Brave people like @RRequesens and her brother @JuanRequesens are leading the call for democracy in #Venezuela even as they also fight for Juan’s freedom. I pray their efforts are met soon with a free and accountable government that works for them, not to suppress them. https://t.co/d65d1EioWC"
1215778378017595392,2020-01-10 23:32:08,"For years, the people of #Venezuela have endured cruel and inhumane conditions at the hands of #Maduro, including shortages of basic food and medicine. These all stem from deprivation of what all people around the world want and deserve: Democracy and political freedom."
