id,created_at,text
1233513655276331009,2020-02-28 22:05:47,How do the drug companies get away with charging Americans the highest prices for prescription drugs on Earth? Maybe it's because there are two Big Pharma lobbyists for every member of Congress. https://t.co/LXpUBVALwQ
1233492692346265608,2020-02-28 20:42:29,"Senator McConnell: Do not play politics with our response to the coronavirus. Congress has an obligation to end unconstitutional mass surveillance.

No administration, and especially not this administration, can be allowed to have the unchecked power to spy on Americans. https://t.co/bci2xZTLwa"
1233473370047512577,2020-02-28 19:25:42,"100,000 Americans die every year from air pollution.

100 super-polluters spew one-third of America's toxic emissions, harming poor communities the most.
 
Corporate polluters must be required to foot the bill to clean up our air and save American lives. https://t.co/JkHbgQ2VD8"
1233420607397777410,2020-02-28 15:56:03,"The coronavirus reminds us that we are all in this together. We cannot allow Americans to skip doctor's visits over outrageous bills.

Everyone should get the medical care they need without opening their wallet—as a matter of justice and public health. https://t.co/c4WQMDESHU"
1233392381765902336,2020-02-28 14:03:53,"If we stay on our current track, children today will have a lower standard of living than their parents. It is the American dream in reverse.

Is it such a ""radical"" idea to say that every American has the right to a quality education, a living wage and health care?"
1233168672144838657,2020-02-27 23:14:57,"In America, 59% of our uninsured are people of color.

Black mothers are three times likelier to die in childbirth as white mothers.

My friend @RepJayapal is right: Medicare for All helps advance racial justice and provides comprehensive care to everyone. https://t.co/YbZaGLs8HD"
1233104949539721217,2020-02-27 19:01:44,"In America today, CEOs get unlimited tax breaks on billions in savings, while working people struggle to retire.

We will end this $15-billion giveaway to corporate executives to use those funds to protect the pensions of 1.7 million blue-collar workers.
https://t.co/ZaLK7ntegx"
1233069728735748096,2020-02-27 16:41:47,"Hundreds of thousands of Americans, convicted of nothing, are in jail because they can't afford cash bail—and Wall Street has been profiting from their incarceration. 

What a disgrace. Poverty is not a crime. Abolish cash bail. https://t.co/xfmuONpHmV"
1233024170788868096,2020-02-27 13:40:45,"Instead of giving tax breaks to billionaires, let us invest in education, pay every teacher at least $60,000, and create the best school system in the world.
 
I want people to proudly say: ""I'm going to do one of the most important jobs in America: teaching our next generation."""
1232825677960925185,2020-02-27 00:32:01,"Trump's plan for the coronavirus so far:

-Cut winter heating assistance for the poor
-Have VP Pence, who wanted to ""pray away"" HIV epidemic, oversee the response
-Let ex-pharma lobbyist Alex Azar refuse to guarantee affordable vaccines to all

Disgusting. https://t.co/98HVjUVY8C"
1232821876096983041,2020-02-27 00:16:54,We must raise the minimum wage to a living wage. But don't just take it from me. Take it from these Patriotic Millionaires. https://t.co/c7CYnvsj1J
1232786541518286848,2020-02-26 21:56:30,"40 years ago, more than 25% of all workers belonged to a union. Today: only 10%.

The decline of the American middle class over the past forty years is no coincidence.

We must rebuild the labor movement and make it easier, not harder, for workers to join unions."
1232697095011913729,2020-02-26 16:01:04,"Nearly 1 million refugees—nearly half of them children—are under threat as Syrian troops advance on Idlib.
 
The United States must work urgently with the UN to achieve a ceasefire and ensure full access for humanitarian assistance. https://t.co/yx5vIxRnDz"
1232680965014683648,2020-02-26 14:56:58,"I don't think you have to be a Ph.D. in infrastructure—a fancy word for roads, bridges, rail and water systems—to know our infrastructure is in quite bad shape.

Why do we spend trillions on never ending wars but can't afford to rebuild our crumbling infrastructure?"
1232651528059662337,2020-02-26 13:00:00,"In the capital of the world's richest country, Black mothers die at a higher rate than in Panama or Ecuador. That is obscene.

Medicare for All means means comprehensive prenatal care, professional child delivery, and reproductive health services for all. https://t.co/7mnLT9MlS8"
1232445671845687296,2020-02-25 23:22:00,"RT @AOC: I used to work in the food industry.

I can’t tell you how many times the people who handle your food - who are already overworked…"
1232423485848215552,2020-02-25 21:53:51,"If a bank is too big to fail, it is too big to exist. No single financial institution should be so large that its failure would cause catastrophic risk to millions of Americans, to our nation’s economic well-being, and to the global economy."
1232393688078311425,2020-02-25 19:55:26,"It is a horror beyond words that Shane Patrick Boyle died because he fell $50 short of raising the money he needed for insulin.

Insulin was discovered in 1923 and was sold for $1. No one should beg, ration, go bankrupt, or die over it.

This is why we are taking on Big Pharma. https://t.co/HI0Jp2btqY"
1232365438362845188,2020-02-25 18:03:11,"I applaud Vermont's lawmakers, grassroots organizers, working families and progressive businesses, who came together to override this outrageous veto and give 40,000 Vermonters a raise.

This is the energy we need to guarantee that every worker in America earns a living wage. https://t.co/ZMzXcedZ5q"
1232347020465016833,2020-02-25 16:50:00,"91 of America's richest corporations paid $0 in taxes on $100 billion in profits.

40% of America can't afford a $400 emergency.

What Dr. Martin Luther King Jr. said in 1968 is just as true today: This country has socialism for the rich and rugged individualism for the poor."
1232316370768936961,2020-02-25 14:48:12,"Real change never takes place from the top on down. It takes place from the bottom on up, when people stand up and fight for justice."
1232088787586600962,2020-02-24 23:43:52,"Medicare for All means businesses will not have to worry about how to provide health care for their employees. 

Workers will not be trapped in jobs to keep decent insurance. Instead, they will be able to pursue the work they love, which could be an enormous boon for the economy."
1232060578115530760,2020-02-24 21:51:47,"Instead of selling $3 billion in weapons to enrich Raytheon, Boeing and Lockheed, the United States should be partnering with India to fight climate change.

We can work together to cut air pollution, create good renewable energy jobs, and save our planet. https://t.co/nqKS2CWypT"
1232024622419398664,2020-02-24 19:28:54,"Fossil fuel CEOs want no federal regulations and billions of dollars in federal subsidies a year.

Our agenda is exactly the opposite: Kick Big Oil executives off of corporate welfare and regulate their planet-threatening carbon pollution out of existence. https://t.co/6oAK9xat5J"
1231962109384253440,2020-02-24 15:20:30,"✅ No more premiums.

✅ No more co-payments.

✅ No more deductibles.

✅ No more out-of-control prescription drug prices.

Medicare for All means significant reductions in health care costs for American families."
1231687512869003265,2020-02-23 21:09:21,"What Dr. King's extraordinary vision was all about was building a beloved community.

Our job is to bring people of all backgrounds together and create a compassionate society in which every single one of us can live with dignity."
1231663013360525312,2020-02-23 19:32:00,"Three people own more wealth than half of America.

13 million people are working two or three jobs to make ends meet.

That is going to change when we make corporate America put workers on corporate boards and have a share in their companies' profits. https://t.co/3ddimmT7UB"
1231652331147624452,2020-02-23 18:49:33,"RT @foe_us: The science is clear: Fracking poisons our water and causes climate change.

We're joining 570+ like-minded groups in endorsing…"
1231349259578093568,2020-02-22 22:45:15,"When we pass Medicare for All, we will save tens of thousands of American lives and hundreds of billions of dollars each and every year. https://t.co/aOurVc1IR5"
1231249028953886720,2020-02-22 16:06:58,"The richest 400 Americans own $2.9 trillion—the size of the entire UK economy.

These 400 billionaires pay a lower tax rate than the half of Americans living paycheck to paycheck.

The rich have waged 45 years of class war. It’s about time working people stand up and fight back."
1230997672573706241,2020-02-21 23:28:10,"A three-letter word is blocking the Senate from passing common-sense gun legislation: the NRA.

I wear the D- grade they gave me for my voting record as a badge of honor. https://t.co/C4V0eAnk4H"
1230974738035548162,2020-02-21 21:57:02,"People may say, ""Oligarchy has to do with developing countries. What does it have to do with us?""

Well, it has everything to do with the United States of America, because that is the direction in which we are moving. https://t.co/csrMPewQDT"
1230934479742603270,2020-02-21 19:17:04,"DuPont knowingly dumped poisons in our water for decades. The victims are children like Abigail Herrmann who are drinking ""forever chemicals"" across America.

Congress must pass my PFAS Act to hold corporate polluters accountable for cleaning up this mess. https://t.co/Rj7UGcUUoJ"
1230918718852665350,2020-02-21 18:14:26,"$106 billion in profits. $0 in taxes. That's 91 of America's richest corporations.

By taking on the very wealthy, the billionaire class, and large multinational corporations, we will raise the funds to provide the services that will give dignity to working families in America."
1230902834335449090,2020-02-21 17:11:19,"The wealthiest top 1% owe 70 percent of unpaid taxes. If we collected less than a third of that, we could pay for universal nutritious school meals for children.

Do not tell me kids have to go hungry at school in the richest country in the world. https://t.co/dbSTcHuNrJ"
1230870145536389120,2020-02-21 15:01:25,"There will no real social progress in this country unless we have the courage to take on Wall Street, the insurance companies, the drug companies, the military-industrial complex, the fossil fuel industry, the prison industry and all the other forces of greed."
1230603028811702303,2020-02-20 21:20:00,"It makes no sense for young people to be denied jobs because they were arrested for smoking marijuana. It is time to legalize marijuana, expunge past marijuana convictions and end the failed war on drugs."
1230570313399689216,2020-02-20 19:10:00,"Our current system has forced people to pay for:

$100,000 ambulance ride to the closest hospital
$540,000 kidney dialysis
$10,000 out-of-network doctor charge at an in-network hospital 

Medicare for All ends this insanity.

Health care is a human right. https://t.co/AFb9KQICLd"
1230545149152940036,2020-02-20 17:30:00,"Methane emissions that fuel climate change are much larger than we thought.

This is a moral issue. We must ban fracking—which harms our air, water and health. We can create millions of good jobs transforming our energy system to save our planet. https://t.co/OkXI2ukA3A"
1230510939096612864,2020-02-20 15:14:04,"Despite President Trump's constant support for big polluters, solar energy is making huge advancements.

Solar power is getting cheaper and cheaper, saving families money on utility bills and creating hundreds of thousands of American jobs. https://t.co/og5RSfHjkX"
1230510775363653632,2020-02-20 15:13:25,"The American people want to know: If we could bail out the crooks on Wall Street, how come we can't protect working class families and enable their kids to get a college education? https://t.co/8YRT7mUcDC"
1230482232835485696,2020-02-20 13:20:00,"Three people own more wealth than the bottom half of America.

Half our people live paycheck to paycheck.

500,000 people are sleeping in the streets.

We must stand up to the greed of large corporations and stand with working families. I make no apologies for that."
1230221011821395968,2020-02-19 20:02:00,"1 in 7 kids will go hungry in America today.

Under Trump, 91 of our richest companies pay $0 in corporate taxes.

If they paid their 21% tax, we'd have the funds to end childhood hunger in America.

We must take on corporate power if we want a decent society for our children."
1230195955451990019,2020-02-19 18:22:26,"Insurance companies made nearly $1 trillion in revenue last year while 87 million Americans went uninsured or underinsured.
 
The insurance industry maximizes profits by denying people care.
 
We need Medicare for All to make health care a universal human right in America. https://t.co/8XCRLEVjDh"
1230169823604244480,2020-02-19 16:38:36,"While Donald Trump says he wants ""the world's cleanest and safest air,"" he is fighting so that polluters can spew out more mercury and soot that will kill Americans.
 
Ordinary people are paying the price for Trump's lies. https://t.co/TSvFZPkj6H"
1230121606703468546,2020-02-19 13:27:00,"Ordinary workers pay into Social Security all year, but millionaires stop contributing today. That is absurd.

The ultra-wealthy should pay into Social Security at the same rate as everyone else, so that we expand—not cut—benefits. https://t.co/dZMhjKu4d7"
1229928584967376896,2020-02-19 00:40:00,"It's no secret that the billionaire class dominates our political and economic life.

To end poverty, homelessness, hunger and lead poisoning in America, the ultra-rich must pay their fair share. Even if that means buying fewer $89 million paintings and $70 million cars. https://t.co/LAZBNhYad9"
1229925111739842560,2020-02-19 00:26:12,"I congratulate the workers of Kickstarter, the first major tech company to vote for a union.
 
These workers are setting an example for the entire industry. Tech employees deserve job security, strong wages and benefits, and a voice in their companies. https://t.co/YNWYylBOAp"
1229882616335261697,2020-02-18 21:37:20,"Today, Trump granted clemency to tax cheats, Wall Street crooks, billionaires, and corrupt government officials.

Meanwhile thousands of poor and working-class kids sit in jail for nonviolent drug convictions.

This is what a broken and racist criminal justice system looks like."
1229857744880119813,2020-02-18 19:58:30,"Trump said he wanted to get America out of wars. He lied.

When we passed a bipartisan bill to end illegal support for Saudi airstrikes in Yemen, he vetoed it.

Trump ignored the Constitution to keep helping this brutal dictatorship as it bombs civilians. https://t.co/RPMINmhO3F"
1229845254301462528,2020-02-18 19:08:52,"After taking government handouts like $880 million in tax breaks in 2018, Walmart is now cutting jobs.

Here's a ""radical"" idea: The richest corporations in America laying off workers and paying them starvation wages need to get off corporate welfare. https://t.co/wp2RtNyEsu"
1229814347687452673,2020-02-18 17:06:03,"U.S. bombings are at a record high in 18 years of fighting in Afghanistan. Our service members continue to fight and die in America's longest war.

The American people do not want endless war. We must bring our troops home. https://t.co/UY9PzhJfak"
1229761190223646720,2020-02-18 13:34:50,"It was true in 1993 and it is true now: the time is long, long overdue for the United States to join the rest of the industrialized world and have a universal health care system. https://t.co/pODdFdTndw"
1229485107356078080,2020-02-17 19:17:46,"Fires threatening an entire continent are extreme—a Green New Deal to tackle the climate crisis is not.

Let us harness our skills, talents and enormous resources to protect the home we all share. https://t.co/BXnYcwOt0F"
1229439746885267456,2020-02-17 16:17:32,"Our military is larger than these countries combined:

🇨🇳 181 billion
🇸🇦 78 billion
🇷🇺 61 billion
🇮🇳 60 billion
🇬🇧 54 billion
🇫🇷 52 billion
🇯🇵 48 billion
🇩🇪 48 billion
🇰🇷 39 billion
🇧🇷 27 billion
🇮🇹 27 billion

What if we invested in human needs to care for one another instead?"
1229133399618535424,2020-02-16 20:00:13,"AR-15s have one purpose: to kill and maim human beings.

Ban assault weapons. https://t.co/c4HkCgdexd"
1229075526813351938,2020-02-16 16:10:15,"We live in a country which can provide literally hundreds of millions of dollars to CEOs, and yet we have teachers who have to take money out of their own pockets to buy school supplies.

If we believe in the future of this country, we have got to believe in our educators."
1228778506928164864,2020-02-15 20:30:00,"The world's richest 1% have over twice the wealth of 6.9 billion people.

The planet will not be secure or peaceful when so few have so much and so many have so little. https://t.co/ftf4mER9Ii"
1228744799244648450,2020-02-15 18:16:03,"Many of my colleagues believe we should throw more money into our bloated $740 billion military budget—more than the next ten nations combined. 

I say, let us invest in our youth. 

Let us protect our seniors.

Let us repair our crumbling infrastructure."
1228722183071051777,2020-02-15 16:46:11,"When General Electric outsources jobs, it raves about China.

When GE wants to pay $0 in taxes for eight straight years, or needs a $16 billion bailout, it doesn't talk about China.

GE goes to the taxpayers of the United States for its welfare checks. https://t.co/LwwhYSWJur"
1228448738529697797,2020-02-14 22:39:37,Jane and I wish everyone a Happy Valentine's Day filled with love and compassion. https://t.co/hv9YF0dihL
1228425414927953920,2020-02-14 21:06:56,"Two years ago, 17 students and faculty of Marjory Stoneman Douglas High School were brutally killed.

One year ago, the House passed HR 8 to require universal background checks for guns.

90% of Americans support this policy.

Senator McConnell: Do your damn job. Pass this bill."
1228348729788452866,2020-02-14 16:02:13,"We don't talk enough about the positive impact of Social Security. Before it was law, half of seniors lived in poverty. It cuts the racial wealth gap and has lifted millions from poverty. 

Our job is not to cut Social Security. Our job is to expand it. https://t.co/JNmw2HuFSK"
1228320135942934528,2020-02-14 14:08:36,"RT @MarkRuffalo: Having access to clean, unfracked water shouldn’t be a radical idea. I’m proud to support @sensanders, @repaoc, @senjeffme…"
1228078357562167296,2020-02-13 22:07:51,"Today the Senate voted, 55-45, to stop a war with Iran.

The Constitution made sure Congress could vote to block a president from taking our country into needless conflicts.

We cannot allow Trump to send working-class kids to fight and die in another endless war. https://t.co/ffLmiiLheN"
1228030027075325954,2020-02-13 18:55:48,"I voted YES. Unlike Trump, today's bipartisan vote made it clear that a majority of the U.S. Senate believes in our Constitution and the separation of powers. It is Congress, not the president, who has the power to take this country into war, and that's what this vote was about. https://t.co/s2s57xjFLG"
1228009835880423426,2020-02-13 17:35:34,"Our planet just experienced the hottest January in recorded history.
 
If our political system won't allow us move quickly to 100% renewable energy as the scientists say we must, I believe it is time for a political revolution. https://t.co/EEF2LBtjx3"
1227989513458372611,2020-02-13 16:14:49,"Today, I am voting for a bipartisan War Powers Resolution to stop Trump's dangerous escalation with Iran and uphold our Constitution.

Sadly, too many Republican Senators are willing to give this reckless president even more power to launch illegal war. https://t.co/W2xIzPVALV"
1227959382387941382,2020-02-13 14:15:05,"Remember: our ""crazy idea"" of universal health care is a reality in:

Australia
Austria
Belgium
Canada
Chile
Czech Rep.
Denmark
Finland
France
Germany
Greece
Hungary
Iceland
Israel
Italy
Japan
Netherlands
New Zealand
Norway
Poland
Portugal
S. Korea
Spain
Sweden
Switz.
Turkey
U.K."
1227716135682019333,2020-02-12 22:08:31,"My friend @MarkRuffalo is right. Fracking poisons our water and causes climate change.

I am proud to introduce the first nationwide fracking ban with @AOC, @SenJeffMerkley and @RepDarrenSoto.

Our job: End the greed of the fracking industry and rapidly move to renewable energy. https://t.co/e6kxK1r2qn"
1227612761737265153,2020-02-12 15:17:44,"The big banks don't want us to cancel all $1.7 trillion in student debt by taxing Wall Street speculation.

Too bad. It will be a tremendous act of economic, racial, and social justice for working people. https://t.co/tuLMPXygB3"
1227347339481899009,2020-02-11 21:43:03,"I voted against the Patriot Act in 2001, 2006, 2011 and 2015. I strongly oppose its reauthorization next month.

I believe that in a democratic and constitutional form of government, we cannot sacrifice the civil liberties that make us a free country. https://t.co/UwMuYwxAZL"
1227320902271946753,2020-02-11 19:58:00,"Many public colleges and universities were tuition-free 50 years ago.

America is now twice as rich.

I think maybe we can afford to stop punishing our young people with student debt for the ""crime"" of getting an education.

It's time to make college a right for all."
1227314682299658247,2020-02-11 19:33:17,"When I say Trump is a pathological liar, what do I mean? He promised to ""always protect"" Medicare and Social Security last week. Yesterday, he released a budget to:

⚠️Cut Social Security by over $24 billion
⚠️Cut Medicare by $500 billion 
⚠️Cut Medicaid by $900 billion

Obscene. https://t.co/Uq23Jf44q1"
1227297872196128769,2020-02-11 18:26:29,"My Prescription Drug Price Relief Act forces pharmaceutical CEOs to bring their prices down to what other rich countries pay.

If Big Pharma refuses, we end their patent monopolies and allow cheap generics to be made, saving Americans billions of dollars a year. https://t.co/hQf9E3OVxc"
1227266604846764033,2020-02-11 16:22:14,"Decades of corporate trade have devastated our manufacturing base, killing millions of blue-collar jobs.

A Green New Deal ends that. We will create millions of good, union jobs to manufacture renewable energy, increase energy efficiency, and rebuild our infrastructure."
1227013592731586560,2020-02-10 23:36:51,"RT @SenateBudget: Here's our Trump FY2021 budget thread, which we'll be updating throughout the day.

Ranking Member @SenSanders: ""I will d…"
1227008382667763713,2020-02-10 23:16:09,"Jeff Bezos is the richest man in the world and Amazon is worth more than a trillion dollars.

Workers there should not be 3 times more likely to be injured on the job. Bathroom breaks should not be considered ""time off task."" Amazon's warehouse conditions are intolerable. https://t.co/zzQjiRkT1a"
1226985283167641601,2020-02-10 21:44:22,RT @SenateBudget: @SenSanders The SNAP cuts in Trump's budget are both massive and immediate. SNAP benefits are already small - just $1.40…
1226946434605502465,2020-02-10 19:10:00,"People are being thrown in jail for being unable to pay their medical bills.

To my mind, that is outrageous and un-American.

""Medical debt"" should not exist. https://t.co/vbwBBjmzun"
1226931331864649730,2020-02-10 18:09:59,"Trump said he would “always protect your Medicare and Social Security. Always.” Today, his budget is cutting them by hundreds of billions of dollars.

I will do everything in my power to ensure that Congress rejects this budget of, for, and by the 1%. https://t.co/cbnlDttfBF"
1226895348108578817,2020-02-10 15:47:00,"Corporations have dumped toxic ""forever chemicals"" into our environment. It's now in 43 cities' water supplies.

My bill forces these companies to pay for the cleanup.

Maybe I'm ""radical,"" but I think the water in our taps must be free of toxic chemicals. https://t.co/zvMGSJ2HQG"
1226839731616411649,2020-02-10 12:06:00,"I don't hear bankers complain about ""big government"" when taxpayers hand them a trillion-dollar bailout.

I don't see drug companies grumble when ""big government"" gives them patent monopolies to charge sky-high prices.

I don't know who's more corrupt: Wall Street or Big Pharma."
1226627049810485253,2020-02-09 22:00:52,"Opioid makers flooded America with 100 billion pills from 2006-2014.

130,000 people died due to their greed.

Executives lied about opioids’ addictiveness, pocketing billions in profits.

My Opioid Crisis Accountability and Results Act helps put corporate criminals behind bars."
1226600656158330880,2020-02-09 20:16:00,"Trump could get us into never-ending, perpetual warfare in the Middle East. The Senate must pass my No War Against Iran Act. https://t.co/qAYHvGWOZm"
1226524404110131200,2020-02-09 15:13:00,"What kind of money would it take to end homelessness in America?

Making five companies—Amazon, Delta, Starbucks, Chevron and General Motors—pay the corporate tax rate that's on the books instead of paying $0. https://t.co/CKjGVJbP5W"
1226499237933875203,2020-02-09 13:33:00,"I live 50 miles away from the Canadian border. You don't take out your wallet or your credit card when you go to the doctor or the hospital there.

If Canada can provide health care to all its people at half the cost, we can join the rest of the world and pass Medicare for All."
1226279623857786880,2020-02-08 23:00:20,"Since my first day in Congress, I've been fighting to raise the minimum wage. Every worker in America should make at least $15 an hour. https://t.co/T7qRvzl3Ag"
