id,created_at,text
1241443284473581569,2020-03-21 19:15:18,"What Congress needs to do right now is guarantee 100% of the wages of every working-class American and keep them on their employer's payroll.

We do not need to be handing out more tax cuts and no-strings-attached bailouts to huge corporations and Wall Street bankers."
1241401522807885836,2020-03-21 16:29:21,"Our delivery workers are doing some of the most important jobs in the country right now.

Why the hell aren't they getting the hand sanitizer, protective gear, and paid sick leave they need?

This should not be happening in the United States of America. https://t.co/RlB1i4njTi"
1241340279237545992,2020-03-21 12:26:00,"Every country on earth is going to be affected by the coronavirus.

We are all in this together. We must work together.

If there was ever a moment to show each other unprecedented love, compassion, and solidarity, this is that moment."
1241121982311288833,2020-03-20 21:58:34,"In the richest country in world history, our medical workers do not even have the masks, gloves, ventilators and protections they need right now.

We need to fundamentally change the dysfunctionality, stupidity and irrationality of the current system. https://t.co/dTGuYKFHGb"
1241093596947918849,2020-03-20 20:05:46,"The 2008 Wall Street bailout ignored ordinary Americans.
 
Now, Senate Republicans are pushing a plan that does nothing for 22 million Americans making less than $40,000.
 
Let us learn from history. Let us focus on the working families in this country. https://t.co/I57yj1PduZ"
1241066469926014978,2020-03-20 18:17:58,"The Senate GOP's plan to send checks will ignore many of our neediest:

A couple making $150K—$2,400
A senior getting $18K from Social Security—$600
Undocumented parents with citizen children—$0
Someone living off disability payments—$0
A student in 2018 who just got laid off—$0"
1241037237598420993,2020-03-20 16:21:49,RT @PeterWelch: I have been hearing from Vermonters around the world that they are not getting the support they need to come home. This is…
1241011313532448770,2020-03-20 14:38:48,"In this crisis, we have got to pay more attention to the most vulnerable. Mothers are skipping meals to feed their kids right now. Who’s going to respond to them?

We must guarantee the health, nutrition, shelter, and economic wellbeing of all our people.  https://t.co/cgGOcMJZRN"
1240734628857688068,2020-03-19 20:19:21,"If the Federal Reserve can inject a trillion and a half dollars into the banking system, then Congress can say to the American people: ""We have got your back. If you lose your job, then you will not lose income. You will be made whole."" #saveworkers"
1240705944415137793,2020-03-19 18:25:23,"Lives are at stake. Trump must start taking this national emergency seriously.

Without delay, we need to use the Defense Production Act to mass produce and distribute urgently needed medical equipment to every state and territory in America. https://t.co/1rI1PGqBOg"
1240693733084954626,2020-03-19 17:36:51,"As people are getting laid off and families are worried about their next meal, it is truly beyond my comprehension why the Trump Administration is fighting to kick 700,000 people off nutrition assistance in the middle of this pandemic. https://t.co/gQ5MhgKsjb"
1240679066937823233,2020-03-19 16:38:34,"The majority of Amazon's 800,000 workers are working in warehouses and are worried about their safety.

We should ask Jeff Bezos, the world's richest man, if he can afford to guarantee paid sick leave, hazard pay and safe conditions to all of his workers. https://t.co/CsMk7G52pQ"
1240645668626104320,2020-03-19 14:25:52,"In the richest country on earth, our health care workers are facing shortages of the basic tools they need to fight this pandemic.

We must immediately ramp up American manufacturing to make the testing kits, ventilators, protective gear, and other lifesaving equipment we need. https://t.co/vQsC4ihJm6"
1240380118339551232,2020-03-18 20:50:40,"I voted for this coronavirus bill, a step in the right direction. As Congress drafts new legislation, we must go much further. For example, we need free health care and paid sick leave for all. Our job is to protect, at all cost, the health and economic safety of every American. https://t.co/jKXk8oOF1K"
1240322260218646529,2020-03-18 17:00:45,"Iran is facing a catastrophic toll from the coronavirus pandemic. U.S. sanctions should not be contributing to this humanitarian disaster.
 
As a caring nation, we must lift any sanctions hurting Iran’s ability to address this crisis, including financial sanctions. https://t.co/OBjff1nsxz"
1240289273443684352,2020-03-18 14:49:40,"The coronavirus crisis is on a scale of a major war. We need:

🏥Testing and health care for all
💵Direct economic aid to every worker
🏡No evictions, foreclosures or utility shutoffs
🏭U.S. production of medical supplies

Now is the time for solidarity. We are in this together."
1240075932204965888,2020-03-18 00:41:56,"Corporate America's refusal to provide paid sick leave to workers is not only inhumane—it is deadly.

Congress must guarantee paid medical leave to every worker in America as a right. https://t.co/A2LblQghq5"
1240047259300945921,2020-03-17 22:48:00,"Trump and his allies are stoking anti-Chinese bigotry in response to the coronavirus pandemic.

We cannot tolerate this kind of racism—especially at this moment.

This crisis requires our political leadership to unite our country, not divide us up. https://t.co/rgpx1epVLf"
1240031343393886209,2020-03-17 21:44:45,"Let's be clear—any rescue of the airlines must put workers first. That means:

✔️Paying all workers at least $15 an hour
✔️Ending stock buybacks
✔️No outsourcing jobs
✔️Expanding benefits
✔️Workers sitting on corporate boards

We cannot repeat the failures of the last bailout. https://t.co/OmAFOJNfXt"
1239963058891444231,2020-03-17 17:13:25,"The coronavirus reminds us that we are all in this together. These commonsense measures are critical to stopping the spread of the disease and protecting our most vulnerable people.

It is absolutely essential that we start applying these practices in our daily lives right now. https://t.co/WZJsTEM8Nd"
1239916777972420608,2020-03-17 14:09:31,"Here's a radical idea: We should prioritize the health and economic wellbeing of our people—seniors, workers and small-business owners, children, and our most vulnerable community members—over welfare checks and bailouts for corporate CEOs and bankers on Wall Street."
1239623590573740032,2020-03-16 18:44:29,"I have consistently voted against the unconstitutional surveillance of Americans under the Patriot Act.

Today's bill does not do nearly enough to rein in out-of-control spying powers.

I stand with my Senate colleagues on both sides of the aisle who demand stronger reforms. https://t.co/OGEfoYTgJc"
1239556005668835333,2020-03-16 14:15:56,"Lack of health care does not just threaten the wellbeing of the uninsured—it affects us all.

This crisis is teaching us that we are only as safe as our least-insured and most vulnerable people.

Now is the time for solidarity. Now is the time to make health care a right for all."
1238940941626605570,2020-03-14 21:31:53,"Minimum weeks of paid medical leave for workers:

🇲🇽 52
🇮🇪 52
🇹🇷 52
🇩🇪 52
🇪🇸 52
🇯🇵 52
🇬🇧 52
🇦🇺 52
🇵🇹 52
🇱🇺 52
🇨🇿 52
🇧🇪 52
🇳🇴 52
🇫🇷 52
🇸🇮 52
🇺🇸 0

We must join the rest of the industrialized world and guarantee paid sick leave to every single worker in America."
1238834399191404544,2020-03-14 14:28:31,"In the midst of a major healthcare and economic crisis, we must recognize our common humanity and guarantee healthcare to all of our people—as a human right, not a privilege."
1238638606257971200,2020-03-14 01:30:31,"Amazon paid $0 in taxes on $11 billion in annual profits. But it asks workers to “donate” their paid leave to others who are sick.

Workers and taxpayers are expected to be generous. Corporate CEOs—even during a pandemic—can be as stingy as they want. https://t.co/xsJLnxgVSa"
1238589350721531907,2020-03-13 22:14:47,"When Trump tells people to ""listen to their doctors,"" we must not forget: 1 out of every 4 Americans do not have a primary care physician.

In the midst of this crisis, we must provide everyone—regardless of income—with all of the health care they need without cost."
1238555185527603203,2020-03-13 19:59:02,"This incompetent administration’s response to the coronavirus has threatened the lives and health of many people.

Congress must immediately ensure that everyone who needs coronavirus testing and treatment gets it without ever having to open their wallet."
1238472415619022850,2020-03-13 14:30:08,"The business model of the pharmaceutical industry:

1. Use taxpayer-funded research
2. Get patent monopolies on treatment
3. Charge any price they want

This is a racket that is literally killing people, and it must end.

Now is not the time for profiteering or price gouging. https://t.co/AYwsRs7hZN"
1238223131204030466,2020-03-12 21:59:34,"When we say it's time to provide health care to all our people, we're told we can't afford it.

But if the stock market is in trouble, no problem! The government can just hand out $1.5 trillion to calm bankers on Wall Street. https://t.co/szXeqQmalq"
1238124861387661313,2020-03-12 15:29:04,"The annual Pentagon budget is $738,000,000,000.

The Centers for Disease Control and Prevention is 1.5% the size.

If we can find money on bombs and missiles to kill people, we can damn well afford to protect everyone's health and take care of each other. https://t.co/u7kmxgpwFc"
1238088173844148224,2020-03-12 13:03:17,"Millions of Americans are working for 11 or 12 bucks an hour.
 
They can't afford childcare.
They can't afford health care.
They're scared to death about their retirement.
 
They want a government that represents them, not just billionaires and large corporations."
1237866593725468676,2020-03-11 22:22:49,"We are dealing with a president who has not read or does not understand the Constitution.

Today, the House and the Senate spelled it out for him: Mr. Trump, Congress will not allow you to start an illegal, immoral, and disastrous war against Iran. https://t.co/cdhOJc7PtQ"
1237799199074369537,2020-03-11 17:55:00,"No one in America should have to go to work sick just to make ends meet.

Our coronavirus response must mean joining the rest of the industrialized world to guarantee paid sick leave for all."
1237484633572478977,2020-03-10 21:05:02,"I stand with St. Paul teachers striking for good pay, benefits, and more resources for students.

Our teachers should be the best-paid in the industrialized world, not among the worst-paid.

We must change our national priorities and invest in education. https://t.co/weL30k58Z2"
1237465322623504384,2020-03-10 19:48:18,"As millions of workers struggle without sick pay and as seniors deal with unaffordable medical bills, President Trump is working overtime to protect the real victims of the coronavirus: fossil fuel executives. https://t.co/XEyBlw4IuE"
1237397955876970496,2020-03-10 15:20:37,"Sara Fearrington works double shifts, $7.40 an hour, no vacations, $28.42 in savings, facing eviction.

53 million low-wage workers like her are struggling on $18,000 a year.

We need a $15 minimum wage and unions to guarantee a dignified life in America. https://t.co/GgxVUJnUPJ"
1237385973429764096,2020-03-10 14:33:00,"As a nation, we cannot effectively respond to the coronavirus when 30 million Americans lack health insurance.

We are all in this together. We need Medicare for All."
1237373767191375872,2020-03-10 13:44:30,"How insane is this? We tell young people to get the best education they can, and then saddle them for decades with crushing loan debt.

It is not a ""radical idea"" to tax Wall Street, make public colleges and universities tuition-free, and cancel $1.7 trillion in student debt."
1237188096984322048,2020-03-10 01:26:42,"Do we think American democracy is about a couple of wealthy billionaires putting hundreds of millions of dollars into campaigns without disclosure?

Is that the democracy Americans fought and died for in war after war?

I think not."
1237123042230317056,2020-03-09 21:08:12,"We are facing a public health crisis. We must: 

🏥 Reverse cuts to local public health agencies and Centers for Disease Control
👩🏽‍⚕️ Provide full federal funding for all testing and treatment for the coronavirus
🛌 Guarantee paid sick leave to every worker
https://t.co/w9ZsPpZEDe"
1237105879562027010,2020-03-09 20:00:00,"When Danny Crespo took his own life, he was making $10 an hour, on Medicaid, unable to afford medicine and facing insane hospital bills.

We are fighting for Medicare for All so that no one else suffers the senseless pain and indignities he did in the richest country on earth. https://t.co/WUP0glvlgc"
1237097452928466944,2020-03-09 19:26:31,"The richest 1% of America's families took in 48% of all income growth over the last 25 years.

We must reverse this obscene inequality. We need:

✅Fair trade, not corporate trade
✅$15 minimum wage
✅Strong unions and worker ownership
✅Taxes—not handouts—for huge corporations"
1237005795406929921,2020-03-09 13:22:18,"""I worry I will run out of food."" Listen to this mother describe what it's like to live on $7.65 an hour. 

I know a $15 minimum wage is radical to Republicans.

You know what’s radical? That people working 40 or 50 hours a week live in poverty. https://t.co/7ObDh94ELV"
1236834234406506497,2020-03-09 02:00:35,"We cannot just hope businesses will do the right thing.

@realDonaldTrump: Support paid sick leave legislation for every worker in America. https://t.co/HWKZmXA7ew"
1236778013489909760,2020-03-08 22:17:11,"NAFTA did not just destroy 1 million American jobs—it forced millions of Mexican family farmers off their land and fueled a migration crisis.

We need a humane immigration system. But we must also end the disastrous corporate trade deals that have devastated Latin America. https://t.co/dVRwNrxELz"
1236736807124885504,2020-03-08 19:33:26,"Women must have full control over their reproductive health. They must have equal pay for equal work: the whole damn dollar, not 79 cents on the dollar.

We will not go backward. We will go forward. Let us celebrate #InternationalWomensDay with a pledge to defend women's rights. https://t.co/d29T90u0nG"
1236652650793275394,2020-03-08 13:59:02,"At the end of the day, it is not necessarily true that building more guns, tanks, and missiles is the only way we will be safe.

We will be safer when people around the world get to know each other and understand the humanity they have in common."
1236401071217504256,2020-03-07 21:19:21,"Bloody Sunday inspired Congress to pass the Voting Rights Act.

Outrageously, this historic civil rights law has been gutted by the Supreme Court.

But this will not stand. Those who risked their lives in Selma showed when people stand together for justice, nothing is impossible. https://t.co/b5taJowZmN"
1236350204535660549,2020-03-07 17:57:13,"Alec Smith died trying to pay for a century-old drug that cost $6 to make and sold at $300.
 
This is not a policy debate. It is a fight against the incredible corporate power of the pharmaceutical industry that is literally killing our people. https://t.co/xmryYm0Enr"
1236282955271524353,2020-03-07 13:30:00,"My Republican friends tell us the only way we can ""strengthen Social Security'' is, in fact, to cut Social Security.

Nonsense!

Seniors cannot make it on $13,000 a year. When we talk about strengthening Social Security, that means increasing benefits, not cutting them."
1236043824125919233,2020-03-06 21:39:46,"The Trump administration’s response to the coronavirus is a disgrace.

Our nurses on the frontlines of this crisis must have the protective gear, the safety protocols, and testing they need to care for our people. https://t.co/deGsLtrPEm"
1235958021148336128,2020-03-06 15:58:49,"In the Cayman Islands, there is a modest five-story building that is home to 18,857 companies.

Either this is one very crowded building, or it is a phony address, used by 18,000-plus corporations for one purpose: to avoid paying taxes to the United States of America."
1235911759480774657,2020-03-06 12:55:00,"The science is clear: toxic PFAS “forever chemicals” are a danger to our health. Congress must pass my PFAS Act to:

✓ Hold corporate polluters like DuPont accountable
✓ Fund drinking water cleanup
✓ Ban PFAS in food packaging
✓ Stop PFAS air pollution
https://t.co/AlRfsQ9BgL"
1235710430808608777,2020-03-05 23:34:59,"The Walton family is America's wealthiest family. Net worth: $201 billion.

Walmart pay their workers starvation wages. Many are forced to go on Medicaid, food stamps, and public housing. Who pays for that? The middle class.

That is what corporate welfare is all about."
1235705531555352583,2020-03-05 23:15:31,RT @democracynow: Roundtable: Coronavirus Is Best Case for Medicare for All https://t.co/9AxLXhzqgt https://t.co/pZZhlFplnb
1235679706118320136,2020-03-05 21:32:54,"Mass incarceration—in which we lock up far more people than any other country on Earth—is an inhumane policy which has completely failed. 

We must invest in affordable housing, education and jobs, not more jails and incarceration. https://t.co/QgplRFQS0f"
1235597885485592577,2020-03-05 16:07:46,"Childhood poverty costs at least $500 billion annually in extra education, health and criminal justice expenses, and in lost productivity.

Just think of all of the intellectual and emotional destruction that takes place in America because we ignore the needs of our children."
1235547106632491008,2020-03-05 12:46:00,"Seniors on Medicare earn $26,200 a year but spend $5,500—20% of their income—on out-of-pocket health costs.

Medicare for All changes that. We ease the burden on our seniors by covering:

✅ Hearing
✅ Dental
✅ Vision
✅ Home care
✅ All prescription drug costs over $200 a year"
1235337270296825856,2020-03-04 22:52:11,"Why are we the only major country on earth not to guarantee paid sick leave to our workers?

We shouldn't need a global pandemic to recognize that an injustice against low-wage workers is an injustice to us all. https://t.co/n6KTuwv2pO"
1235307846335713280,2020-03-04 20:55:16,"We have a president today who not only thinks climate change is a hoax, but has officials meddling with scientific reports to argue that carbon pollution might actually be good for us.

Trump's lies are a threat to a decent life for our kids and grandkids. https://t.co/A9tioHcHpA"
1235270473187020800,2020-03-04 18:26:45,"I stand with activists today who are telling the Supreme Court: Do not side with Louisiana in its war against women.

We must keep fighting until the constitutional right to an abortion is secure. https://t.co/q3QzlPdt5A"
1235244958610788353,2020-03-04 16:45:22,"Under Trump, billionaires saw their wealth grow by $850 billion.

At the exact same time, over 114,000 more infants, toddlers and preschoolers became uninsured.

We need to be taking care of our children, not handing out corporate welfare to billionaires. https://t.co/PTovpgwJjo"
1235200639564574721,2020-03-04 13:49:16,"I remember talking to a young woman in Vermont who left medical school with $300,000 in debt. 

Her crime? She wanted to become a doctor and work with low-income people.

She shouldn’t be punished with a debt of $300,000. College indebtedness is a horror."
1234984386891673601,2020-03-03 23:29:57,"The women of this country have the right to control their own bodies, not politicians. 

Instead of defunding Planned Parenthood, we should expand it so that every woman in this country gets the health care she needs."
1234967321313206277,2020-03-03 22:22:08,"How can we possibly pay for tuition-free public colleges, universities and trade schools for every person in America?

We could do it—easily—with the more than $70 billion that Congress added to Trump's Pentagon budget this year compared to under President Obama."
1234941780828868611,2020-03-03 20:40:39,"Trump’s budget to Congress makes annual funding cuts of:

$167,000,000 to Health Preparedness
$175,000,000 to Centers for Disease Control
$3,000,000,000 to National Institutes of Health

But I’m sure the American people will be just overjoyed by this generous $100,000 donation. https://t.co/0SZs2wQfch"
1234895167049609218,2020-03-03 17:35:25,"American companies have to worry about paying thousands of dollars a year on health insurance for each employee.
 
Medicare for All covers everyone. That means more people can start new businesses, manufacturing can be more competitive, and companies can invest in their workers. https://t.co/9xhhJhtTF1"
1234875131421483009,2020-03-03 16:15:48,"Jane and I send our deepest condolences to the families of those whose lives were lost to the severe storms and tornadoes in Tennessee.

The federal government must do everything it can to help rescue those missing or harmed and rebuild these communities. https://t.co/FfkC8TnRSD"
1234859899059875844,2020-03-03 15:15:17,"The U.S. government put a family in mandatory isolation. Now they're left with a $3,900 surprise hospital bill.

Profiting during an outbreak is not only cruel—it threatens public health. All needed tests, treatment, and vaccines must be made free for all. https://t.co/4MRQwyuHlR"
1234841769013137408,2020-03-03 14:03:14,"The function of our banks must be to reinvest in America, so we can build the affordable housing we need, the factories we need, the small businesses we need, and create millions of good-paying jobs. 

We must end the greed and selfishness of the current banking system."
1234645163806527488,2020-03-03 01:02:00,"Thousands of earthquake survivors have been sleeping outdoors for months and many can't afford to repair their homes.

Trump's FEMA response is completely unacceptable. We can no longer tolerate the treatment of Puerto Ricans as second-class citizens. https://t.co/zutYFHYltI"
1234620041666142209,2020-03-02 23:22:10,RT @ChrisVanHollen: CEOs at big corporations use tax breaks to stash an average of $14 million each in executive retirement plans. @SenSand…
1234592892896923652,2020-03-02 21:34:17,"When I voted against the Gulf War in 1991, I thought I'd have a very short political career.

Today, I am proud to help lead bipartisan efforts in Congress to stop endless war.

Our job is to bring progressives and conservatives together to defeat the military industrial complex. https://t.co/EWpxcxzFvG"
1234528897582141441,2020-03-02 17:20:00,"Under our profit-driven system, the wealthy can buy vaccines. The poor or working class may get sick or even die.

Protecting the health of the American people means taking care of everyone—including our most vulnerable.

We need Medicare for All. https://t.co/TpjykxLRec"
1234507924199919618,2020-03-02 15:56:39,"In 1973, public college tuition, room and board cost $8,200 a year. Today it's $22,000.

Wages hardly grew, college costs nearly tripled.

It's time to treat higher education, like K-12 schooling, as a right. We must make public colleges tuition free and cancel all student debt."
1234488240654209024,2020-03-02 14:38:26,"RT @AMSANational: Thank you, @SenSanders , we’re proud to work towards this goal. We need more primary care docs, more docs in rural/lower-…"
1234475065242079233,2020-03-02 13:46:05,"More than 13 million American children live in poverty.

Our childhood poverty rate is among the highest of any major country on Earth.

In my view, we should feed the children first, educate the children first, and worry about the military-industrial complex later."
1234229745857875968,2020-03-01 21:31:16,"I find it amusing that Mr. Trump postures as a critic of this country's establishment. He got a $200,000 allowance as a kid, enjoys golfing with the rich and powerful, and gives billions upon billions in tax breaks to the world's largest corporations."
1234176578369667074,2020-03-01 18:00:00,"It is not a radical idea to say that in the richest country in the world, when Americans turn on their taps, their drinking water should be safe to drink. The polluters must pay to end toxic PFAS contamination of our water across the country. https://t.co/l66pkwakv1"
1234108629092954114,2020-03-01 13:30:00,"Thank you to the American Medical Student Association @AMSANational for endorsing our College for All Act to cancel student debt and make college tuition-free.

American doctors should not have mountains of debt looming over them while they work to heal the sick and injured. https://t.co/QM81FRwehS"
1233885301518426112,2020-02-29 22:42:35,"Over the last 30 years, the establishment has pushed unfettered free trade which says to American workers:

You now need to compete against somebody in China who makes $1.50/hour.

If you don’t like it, we are going to move our plant to China.

Do we think that is right? I don’t."
1233820531230728192,2020-02-29 18:25:12,"I am proud to have stood with working people to stop efforts to cut and privatize Social Security over the years.

Social Security is the most successful government program in our nation's history.

Our job is to protect it and expand it. https://t.co/yGgN9r73tx"
1233779026931511297,2020-02-29 15:40:17,"Medicare for All will save tens of thousands of lives every year. In the United States of America, when a person is sick, that person should be able to access health care and see a doctor. When a person goes to the hospital, that person should not end up in bankruptcy."
