id,created_at,text
1247263274074161152,2020-04-06 20:41:52,"During this pandemic, know your rights!

For most renters, you cannot be evicted or charged penalties for not paying rent.

For most homeowners, you can request a forbearance on your mortgage. https://t.co/Qc96viEqNG"
1247212744417382409,2020-04-06 17:21:05,"We have got to do everything we can to make sure that right now, our people are safe, get the paychecks that they need, receive medical care for free, and have a roof over their heads.

All American workers must be made whole. https://t.co/aM54KvrsfT"
1247209002607480833,2020-04-06 17:06:12,"RT @SenSchumer: Lives are at risk.

Medical workers don’t have critical supplies or hazard pay. Unemployment is soaring.

But the Trump adm…"
1247165405174607872,2020-04-06 14:12:58,"Jason Hargrove’s death is an outrage—it should've never happened. Blue-collar workers are risking their lives to keep this country running. They deserve better.

The federal government must require that all frontline workers get protective gear NOW. https://t.co/mqMriBGs54"
1246889846922039296,2020-04-05 19:58:00,"This is an economic meltdown. Millions of Americans have no food in the pantry to feed their kids. No money for rent. Can't pay their mortgage, student debt, or medical bills.

We cannot say, ""Let's wait and see."" We need to get help to our people now and protect their wellbeing."
1246870982436048899,2020-04-05 18:43:02,"It is insane that our nurses are being forced to care for the sick without masks and respirators. The Department of Labor must immediately issue emergency workplace standards to protect our health workers, their families, and their patients. https://t.co/Z8dWqtxz5X"
1246841780202541056,2020-04-05 16:47:00,"It is incomprehensible that we have governors continuing to do business as usual rather than issue stay-at-home orders.

If they're not able to do it, the federal government should. https://t.co/EowV1ebbST"
1246785157383716865,2020-04-05 13:02:00,"During this emergency, the government should cover all of the health care you need—that means no out-of-pocket expenses. https://t.co/pFFbhOMJ59"
1246495829352947713,2020-04-04 17:52:19,"While millions of Americans were waiting on unemployment benefits they were promised, Trump made time to meet with those suffering the most: Exxon and Chevron CEOs.

If you’re an oil executive who desperately needs a handout, don’t worry! The president is here to help. https://t.co/y3ifK16bh7"
1246456517341167616,2020-04-04 15:16:06,"If our farmworkers fall ill, we go hungry. Our health and wellbeing are all interconnected.

We must put an end to their cramped, impoverished conditions, and provide free health care, paid sick leave, and good wages—regardless of immigration status.
https://t.co/VqDuJaIANN"
1246183210192703489,2020-04-03 21:10:04,"The sailors cheering for Captain Crozier are right.

The Navy appears to be retaliating against him for acting out of concern for his sailors' health. His position should be restored immediately.

Amidst this horrible pandemic, we must speak the truth and protect each other. https://t.co/ShYe10Lghr"
1246164099844780032,2020-04-03 19:54:08,"10 million have already filed for unemployment.

3.5 million have already lost their health insurance.

Good-quality health care should not be tied to your job.

At a minimum, the government must ensure health care for all, without cost, for the duration of this crisis. https://t.co/CEhwRTMdBX"
1246131201531928576,2020-04-03 17:43:25,"If workers are considered essential enough to show up on the job during a pandemic, I'm pretty damn sure they're essential enough to have a $15-an-hour living wage, paid sick leave, protective equipment, and health care as a right. https://t.co/RffohjDDJG"
1246078835554242560,2020-04-03 14:15:20,"The coronavirus has infected nearly a quarter million Americans—more than in any other country on Earth.

It is absurd to keep 87 million people uninsured or underinsured during this pandemic.

Let us learn from this crisis. Let us make health care a human right in America."
1245825836021714944,2020-04-02 21:30:00,"I support the flight attendants. The Trump Administration must stop putting up road blocks to this aid.

The airline grants must be immediately released to fully fund the paychecks and benefits of 2 million workers. Workers need help and they need it now. https://t.co/xBVZqJdR9K"
1245818724822716416,2020-04-02 21:01:44,"The White House wanted to give Indian Country $0 to deal with the coronavirus. Democrats fought for and got $10 billion, but Native American communities need far more. The next coronavirus package must prioritize tribal health care and economic support. https://t.co/cylzxDSQma"
1245811009706700805,2020-04-02 20:31:05,"RT @SenSchumer: I’m standing with @SenatorCardin, @ChrisCoons, and @SenSanders to tell the Small Business Administration that they need act…"
1245805670034821130,2020-04-02 20:09:52,"Congress passed the largest unemployment benefits expansion in history, but families like the Rodriguezes are going hungry waiting for help to arrive.

The federal government must assist every state and territory in America to get support out right away. https://t.co/E6JzrG4kAQ"
1245786697427824647,2020-04-02 18:54:28,"What good is an order to shelter in place if you're homeless? This pandemic shows us that housing is in fact health care.

As a matter of public health and justice, we must end homelessness and provide shelter to 500,000 Americans sleeping on the street. https://t.co/dolktrA738"
1245735940968124417,2020-04-02 15:32:47,"Last week, 6.6 million applied for unemployment. Millions more will lose their jobs in the coming weeks. In the midst of this horrific crisis, Congress must pass a new, unprecedented emergency bill that guarantees income and health care for all Americans. Working on details now."
1245716064052432896,2020-04-02 14:13:48,"The Labor Department's job now is to make sure millions of people get unemployment benefits immediately.

We must also join the UK, France and other countries to directly fund workers' wages and stop more layoffs.

We have got to tell our working families: You will be made whole. https://t.co/3fKlliSxp9"
1245699755046506503,2020-04-02 13:09:00,"Number of people who have no health insurance:
 
🇰🇷South Korea: 0
🇨🇦Canada: 0
🇹🇼Taiwan: 0
🇯🇵Japan: 0
🇩🇪Germany: 0
🇸🇬Singapore: 0
🇺🇸United States: 30,000,000
 
Now, more than ever, we need a universal, Medicare for All, single-payer health care system."
1245514542915956737,2020-04-02 00:53:02,"Half of our seniors survive on $25,000 a year or less.

Outrageously, Trump tried to make them jump through hoops during a pandemic to get their $1,200 emergency relief payment.

Thanks to strong pressure, Trump reversed this policy. Seniors will get the help they need right now. https://t.co/l1jTCbOMAk"
1245466894540382208,2020-04-01 21:43:41,"Amazon's warehouse workers protested because people are getting sick on the job.

Their demands were not radical: a safer workplace, protective gear and paid sick leave.

Amazon’s response? Retaliate by firing a worker who helped organize the walk-out. That is absolutely immoral. https://t.co/qBfGrDx53l"
1245420628049608712,2020-04-01 18:39:51,"Hoy yo exhorto a que todos que vivan en los EE.UU completen el #Censo2020.

Es más importante que nunca que participemos en el censo para asegurar que los fondos para programas como atención médica y asistencia nutricional vayan a todos que los necesitan: https://t.co/rVbpmBljAv"
1245420626539614209,2020-04-01 18:39:50,"Today is #CensusDay, and I urge every person living in the United States to fill it out.

It is more important than ever that we participate in the Census and make sure funding for things like health care and nutrition support go to everybody who needs it: https://t.co/lj64IKkQ2z"
1245400335402795010,2020-04-01 17:19:13,"Millions are losing their jobs and need urgent help to feed their families. They cannot afford delays.

Congress passed the largest unemployment expansion in history.

Now the Labor Department must do everything in its power to ensure people have their benefits within two weeks. https://t.co/FpyQvcFtPf"
1245368663366131719,2020-04-01 15:13:21,"Regardless of Trump's absolutely reckless decision, if you lose your job, you still qualify for the special enrollment period or you may be able to enroll in Medicaid.

Go to https://t.co/ArVjlUxRZn for more information."
1245366914307821570,2020-04-01 15:06:24,"Millions are losing their jobs and health care at a rate never before seen in American history.

@realDonaldTrump’s response? Block https://t.co/ArVjlUxRZn from enrolling people who desperately need insurance during a pandemic.

That is insane. https://t.co/psXteIQGCU"
1245356460428705797,2020-04-01 14:24:52,"How can it be that we spend 18% of our GDP on health care—more than any other major country on Earth—but still lack the beds, masks, ventilators, gowns, gloves and test kits we need to adequately respond to this crisis?

We must transform our dysfunctional health care system."
1245114976072859653,2020-03-31 22:25:18,"Our postal workers already had one of the most important jobs in America.

Now they are putting themselves at risk to deliver everything our country needs.

I am asking the Postal Service to do much, much more to protect their safety and wellbeing right now. https://t.co/L4Gj9iF4p2"
1245094748286844928,2020-03-31 21:04:55,"This is an unprecedented moment in American history.

Our job is to mobilize this country to produce all the protective equipment our health workers need, ventilators for our sick, and free medical treatment for everybody. https://t.co/9T86cE302v"
1245067225171664900,2020-03-31 19:15:33,"Coronavirus has killed 2,600 in Iran, but U.S. sanctions are obstructing medicine and aid from getting in.

@SecPompeo and @stevenmnuchin1: Pandemics know no borders. Let us put aside our countries' disputes and lift sanctions to reduce human suffering. https://t.co/fRFndKSP39"
1245039219531231233,2020-03-31 17:24:16,"Too many people are risking their lives showing up to work every day.

I stand with workers as they fight for their own safety.

Every employer in America must guarantee:

🥽 Protective gear
🧼 Hand sanitizer and soap
⚠️ Hazard pay
🏭 A safe, clean workplace
🛌 Paid sick leave"
1245005490632957952,2020-03-31 15:10:14,RT @RepMcGovern: 14/ Community health centers are on the front lines of this crisis. I joined 160+ colleagues including @SenSanders to ask…
1244983129678503936,2020-03-31 13:41:23,"In my view, during this crisis, nobody in America should have to worry about a medical bill. They’ve got enough to worry about.

Right now, our goal must be to protect every single one of our people and ensure that their basic right to health care is taken care of."
1244734169072140301,2020-03-30 21:12:06,"Workers at Amazon warehouses, Whole Foods grocery stores and Instacart food delivery do some of the most important jobs in America.

These wealthy corporations must give them the paid sick leave, safe workplaces, and protective gear they are demanding. https://t.co/QA5WWgh6DI"
1244706353970634752,2020-03-30 19:21:34,"I stand with GE’s workers who are calling on the company to convert its factories to produce ventilators.
 
No more layoffs, outsourcing, and tax dodging, @generalelectric. Put Americans to work manufacturing the life-saving ventilators we need. https://t.co/wCbDrCmWZ9"
1244698403763863552,2020-03-30 18:49:59,"Today is #NationalDoctorsDay. Men and women in the medical profession are literally putting their lives on the line to protect the American people. 

We have an immense amount of gratitude. You are the heroes and heroines of our country today. Thank you."
1244692432580640769,2020-03-30 18:26:15,"Throughout history, authoritarian leaders have used moments of crisis to seize unchecked power. Hungary’s Orban is the latest example. Now more than ever we must stand up for democracy and rule of law. https://t.co/NWjKNPvGxp"
1244652974103724032,2020-03-30 15:49:28,"The American people increasingly understand that now is the time to think boldly and act decisively.

We must move rapidly to a Medicare for All, single-payer system that treats health care as a human right. https://t.co/mCe3ehQlNW"
1244630014605365261,2020-03-30 14:18:14,"This should not be happening in the United States of America.

In the richest country in the world, our physicians and nurses must have the protective equipment they need to protect their own lives so that they can continue protecting the American people. https://t.co/BmVzm2LfPp"
1244360933004066817,2020-03-29 20:29:00,We are the only major country not to guarantee paid medical leave—that is beyond pathetic. We need to provide it for every worker in America. https://t.co/6IeSREcUY5
1244338086949126150,2020-03-29 18:58:13,"Palestinians in Gaza already faced hardship under a blockade. Now they're dealing with the coronavirus.

My Senate colleagues and I call on Trump to send U.S. medical relief. And the Israeli government must also lift its restrictions on humanitarian aid. https://t.co/WeLRY72KLq"
1244316637333016576,2020-03-29 17:32:59,"Working families could face a 40% increase in their premiums as they’re dealing with this pandemic.

America's for-profit insurance industry is not compatible with health care as a human right. 

Now is not the time for greed. Now is the time for Medicare for All. https://t.co/JlxciXuSMi"
1244300786684661761,2020-03-29 16:30:00,How do the geniuses at Trump’s EPA respond to Americans dealing with a deadly respiratory disease? They allow power plants and factories to spew even more air pollution! Absolutely obscene. https://t.co/V2sUFPDtva
1244280476027813893,2020-03-29 15:09:17,"I think the American people are united on this: We need policies now which benefit the working families of this country, that benefit low-income people, that benefit the most vulnerable."
1244006998934511618,2020-03-28 21:02:35,"It is an outrage that debt collectors are garnishing wages and Social Security checks for unpaid medical bills and student loans.

We must cancel all medical and student debt—and stop all debt collection right now.

A pandemic is not a time for greed. https://t.co/vTJDnxEpvo"
1243976399519723520,2020-03-28 19:01:00,"This bill was far from perfect, and we must go much further. But Democrats did a good job standing up to Trump and McConnell to make sure this relief package got help to workers, small businesses, hospitals, and states and cities that desperately need it. https://t.co/9GsMc7GTId"
1243957979126382593,2020-03-28 17:47:48,"We will not tolerate our people going bankrupt to get treated for coronavirus or any other damn illness.

We need Medicare for All. https://t.co/n8zKK4WXVo"
1243935078058807298,2020-03-28 16:16:48,"In the midst of this economic downturn goal, the goal right now must be for the government to make whole and protect all of the working families in this country. https://t.co/ajOg0skb6E"
1243657560915410945,2020-03-27 21:54:03,"We must not forget that 27,000 young Dreamers work as doctors, nurses, paramedics, pharmacists, and other health providers as we are fighting the coronavirus pandemic.

We have got to stand with them and block Trump's insane effort to end the DACA program.
https://t.co/C5QfAnEsFF"
1243625929601167360,2020-03-27 19:48:21,"The federal government must immediately put together the necessary staffing and technology to address the unprecedented number of requests for help that are coming in.

This is a crisis. No business as usual. People need help NOW, not in several months."
1243625928787361794,2020-03-27 19:48:21,"Right now, phone lines of unemployment offices around the country are jammed and websites are crashing.

The stimulus package just passed can provide real help to millions, but it won't matter unless the federal bureaucracy is able to implement the program and get the money out."
1243598523154735104,2020-03-27 17:59:27,"Our hospitals are getting overwhelmed. Our medical workers can't get basic protective gear.
 
@realDonaldTrump: It is immoral to delay any longer. Enforce the Defense Production Act to immediately produce and distribute the masks, gloves, gowns, and ventilators we need. https://t.co/omWJQtkfLQ"
1243589557565693957,2020-03-27 17:23:49,"RT @Ilhan: Amazon is putting the lives of workers at risk by exposing them to COVID-19.
 
That's why I led a letter with @SenSanders demand…"
1243537608480825349,2020-03-27 13:57:24,"In a rational society, an extremely contagious, deadly virus would get our government to finally pass universal paid sick leave for workers.

Why hasn’t it happened yet? The power of big money over our politics. https://t.co/XNPXXUM1v3"
1243533871213424642,2020-03-27 13:42:33,"RT @RepRoKhanna: After 5 years of war, and 80% reliant on humanitarian aid for basic survival, Yemenis may be the planet’s most vulnerable…"
1243345194994610178,2020-03-27 01:12:49,"My Republican colleagues had no problem voting for a trillion dollars in tax breaks for billionaires and large corporations.

But—horrors of horrors!—poor workers might get a few bucks more in unemployment in the midst of a terrible crisis. Oh my god, the universe is collapsing! https://t.co/KQF1I5frWM"
1243281713477844993,2020-03-26 21:00:34,"If you lose your job, you shouldn't lose your health care. That is why we are fighting for Medicare for All."
1243236272535199745,2020-03-26 18:00:00,"We had a bit of a debate last night when some of my anti-worker Republican colleagues tried to prevent low-income people from getting additional unemployment support.

I was not going to allow that to happen. https://t.co/3LtR3mHFLF"
1243216059114676229,2020-03-26 16:39:40,"Who on earth could have predicted that dismantling the White House pandemic office and cutting the Centers for Disease Control might leave us unprepared for this crisis?

Pretty much everybody. https://t.co/0agS3ECfuX"
1243202512645165056,2020-03-26 15:45:51,"We are looking at an unprecedented crisis in American history.

The good news: Last night's bill expands unemployment benefits in a way that has never taken place before.

We will still need to go much further, and address working people's needs in a far more substantial way. https://t.co/MrVcMnP87I"
1242996858357600256,2020-03-26 02:08:39,"In this crisis, what the American people want is for us to use our taxpayer dollars in every way that we can to protect the working families of this country and the 50 percent of Americans who are living paycheck to paycheck, not just the billionaires and large corporations. https://t.co/U3BF9lP9UK"
1242962929579851776,2020-03-25 23:53:50,"It is enormously dangerous to ignore medical experts and try to bring people back to work who may be sick.

Our first priority must be to protect the health of the American people.

Money is just money. Life is life. https://t.co/cDggucHyVF"
1242931718903955456,2020-03-25 21:49:48,"I worry very much what the coronavirus will do, particularly in Yemen, where the U.S.-backed Saudi war has put millions on the brink of starvation.

Let us use the five-year anniversary of this horrific conflict to end our military involvement. Yemen needs peace, not U.S. bombs. https://t.co/jcPLulg3Np"
1242908670452740099,2020-03-25 20:18:13,"RT @SherylNYT: NEW: Bernie Sanders WILL vote for the coronavirus bill as written BUT ONLY if GOP senators drop their demands, he just told…"
1242896476872806402,2020-03-25 19:29:46,"Unless Republican Senators drop their objections to the coronavirus legislation, I am prepared to put a hold on this bill until stronger conditions are imposed on the $500 billion corporate welfare fund. https://t.co/7X0o9C4BoO"
1242848582639771649,2020-03-25 16:19:27,"It is beyond belief that our health workers are putting their own lives on the line—risking infection—to care for the American people.

We need the masks, gloves, gowns and workplace protections to keep health workers, their patients, and families safe. https://t.co/OmowDFWJj3"
1242820633412722690,2020-03-25 14:28:24,"When Jonas Salk developed the polio vaccine 65 years ago, he understood its tremendous benefit to all of humanity and he refused to patent it.

Today, we must put human life above corporate profit. Any coronavirus treatment must be made free for everyone. https://t.co/4FOrGF0rTW"
1242591540461088769,2020-03-24 23:18:04,RT @AyannaPressley: .@SenSanders and I know that our Community Health Centers are on the frontlines of the #COVIDー19 pandemic and serving s…
1242568922802642952,2020-03-24 21:48:11,RT @chrislhayes: This was a theme last night on our show from @JosephEStiglitz to @FlyingWithSara to @SenSanders: have the government pay c…
1242549394039324672,2020-03-24 20:30:35,"Enough with the damn lies, @realDonaldTrump. Listen to the scientists. Millions of lives are at stake. https://t.co/Epc9E3i4UR"
1242517267113480198,2020-03-24 18:22:55,"Share of workers at major corporations without paid sick leave:

Sonic: 94%
Applebee's: 89%
Pizza Hut: 88%
Burger King: 86%
Subway: 86%
Domino's: 85%
Dunkin' Donuts: 85%
Wendy's: 84%
McDonald's: 78%
Chick-fil-A: 78%
Taco Bell: 77%

We must make paid sick leave a right for all."
1242475546937896960,2020-03-24 15:37:09,"It is insane and unacceptable that the Trump Administration has given the Gilead pharmaceutical corporation a seven-year monopoly on a potential coronavirus treatment.

We will not tolerate profiteering. Any treatment or vaccine must be made free for all. https://t.co/VCdgBSZJw6"
1242425064873754624,2020-03-24 12:16:33,Congress must act in an unbelievably aggressive way to tell all workers: You will be made whole. You will get 100% of your paycheck. https://t.co/WlVK7Yt3eU
1242224722064166914,2020-03-23 23:00:27,"Absurdly, in the middle of a pandemic, Trump is fighting in the courts to end:

👨🏽‍⚕️Guaranteed coverage for preexisting conditions
🏥Emergency care
💉Free federally recommended vaccines

Today is the ten-year anniversary of the ACA, and I will be damned if we let Trump repeal it. https://t.co/tOvcnAjWZm"
1242210826699902978,2020-03-23 22:05:14,"The consequences of the coronavirus on people already suffering from war are truly unimaginable.

Humanity should end its conflicts and killing right now, and come together to save lives.

The United States can and must play a leading role in bringing about a global ceasefire. https://t.co/xpU5vXQvAF"
1242185980360228865,2020-03-23 20:26:31,"As corporate CEOs come asking the government for welfare checks, and Senate Republicans arrange for a $500 billion slush fund for them, Congress must stand firm: No stock buybacks allowed for companies seeking bailouts. https://t.co/uFo8QwNVQG"
1242126974794989568,2020-03-23 16:32:03,This is truly outrageous. Congress needs to be working urgently to protect the health of the American people—not threatening the health care of millions of low-income people. https://t.co/Fu1BH1PaYg
1242098979350949890,2020-03-23 14:40:48,"Reading the Republican coronavirus bill, you'd think the most important people in America are corporate CEOs. That is wrong.

Our essential workers include:
👩‍⚕️Health workers
🚚Delivery and warehouse workers
🥗Food workers
👷‍♀️Transit workers

We must put their needs ahead of CEOs."
1241839569970122752,2020-03-22 21:30:00,"It is a disgrace that our nurses at the frontlines of this pandemic don't have basic protective gear. If they get sick, what happens to our health system?

The Department of Labor must issue emergency protection standards for all our health care workers. https://t.co/oMx0CyVZTp"
1241804301565116418,2020-03-22 19:09:51,The job of Congress right now is to do everything we possibly can to protect Americans' lives and wellbeing—not hand out welfare checks to huge corporations.
1241792356497719298,2020-03-22 18:22:23,"Senate Republicans' partisan coronavirus package is outrageous:

❌Creates a slush fund for corporate bailouts
❌Does nothing to protect patients from huge bills
❌Denies millions of workers paid sick leave
❌Keeps state and local governments underfunded 

We must do much better. https://t.co/Erqp0uzdgu"
1241761009326608394,2020-03-22 16:17:50,"Community health centers are at the frontlines of this pandemic, providing health care to nearly 30 million low-income people.

More than 160 lawmakers and I are demanding billions in additional funding so these centers have all the supplies, staff, and equipment they need. https://t.co/7SIqmtGT3B"
1241749880151904258,2020-03-22 15:33:36,"States are competing to buy medical masks that went from $0.58 to $7 a piece.

We cannot tolerate price-gouging in the middle of this pandemic.

The president must immediately use the Defense Production Act to order companies to make the protective gear our health workers need. https://t.co/OoGVWXXvm0"
1241730264247697408,2020-03-22 14:15:39,"When workers are laid off, they lose their employer-provided health insurance.

That is why we need a universal, single-payer system that guarantees health care as a right to all our people.

That is why we need Medicare for All."
1241479517035782145,2020-03-21 21:39:17,"$34,927.43.

That is the medical bill an uninsured patient got for being tested and treated for the coronavirus.

This is not the time for obscene profits or price-gouging.

Right now we must make health care free—including for the 30 million uninsured. https://t.co/hrDw0MsZw9"
