id,created_at,text
1220055231440064513,2020-01-22 18:46:49,Strong unions are key to solving the crises facing higher education. I am delighted to join @repmarkpocan in this effort to protect graduate student workers who are organizing for their rights. https://t.co/jfyTDMfGc9
1220010584340561920,2020-01-22 15:49:24,"58 new abortion restrictions were enacted across the country in 2019.

Laws like these are dangerous, regressive, and blatantly unconstitutional.

On the 47th anniversary of Roe v. Wade, we must continue to stand up for women’s reproductive freedom and protect access to abortion. https://t.co/tcXLdGBR1d"
1219952853646823424,2020-01-22 12:00:00,"The free press is never more important than when it exposes wrongdoing by the powerful.
 
That is why President Bolsonaro is threatening Glenn Greenwald for the ""crime"" of doing journalism.
 
I call on Brazil to end its authoritarian attack on press freedom and the rule of law. https://t.co/NfcVnxT50F"
1219788223507042304,2020-01-22 01:05:49,"Senate Republicans, working directly with the White House, voted to prevent witnesses from testifying in Trump’s impeachment trial.
 
What are Republicans afraid of? Today was a bad day for our country, for our Constitution, and for the rule of law. https://t.co/NMWX25rUoH"
1219744169582907404,2020-01-21 22:10:46,RT @RepJayapal: Thrilled that the American College of Physicians has endorsed #MedicareForAll! Doctors everywhere see firsthand the impact…
1219742915720884226,2020-01-21 22:05:47,"Doctors understand they cannot do their jobs healing the sick under our dysfunctional health care system.
 
I thank physicians' group @ACPinternists and its 159,000 members, as well as @PNHP, for fighting to make health care a human right for every man, woman and child. https://t.co/u7LUgCvGK5"
1219702844963655681,2020-01-21 19:26:33,"Today is a sad day in history: the beginning of an impeachment trial for the President.

It would be absurd to have a trial at 1 o'clock in the morning without any witnesses.

I say to Senator McConnell: hold a fair trial with witnesses, in full view of the American people. https://t.co/nwbYh0IkIE"
1219629932638281729,2020-01-21 14:36:50,"Suicides are at their highest rate since World War II. 1 in 7 children lives with a parent suffering from substance abuse.

We must defeat the billionaire class and end this unraveling—this rise of despair and death—of the American middle class. https://t.co/2FdQBjKrg9"
1219349124320919552,2020-01-20 20:01:00,"What Dr. King understood is that the only way you make real change—whether it is racial justice, social justice or economic justice—is when millions of people come together, stand up and fight back. #MLKDay"
1219330881413951488,2020-01-20 18:48:30,"In 1968, Dr. King said “Now our struggle is for genuine equality, which means economic equality.”

The minimum wage then was worth $10.15. Today, it’s $7.25.

Our fight for human dignity must include making every job pay a living wage of at least $15 an hour. #MLKDay"
1219264220132454400,2020-01-20 14:23:37,"RT @SenSanders: ""This country has socialism for the rich, rugged individualism for the poor."" -Dr. Martin Luther King Jr. #MLKDay https://t…"
1219264165610696705,2020-01-20 14:23:24,"To truly honor Dr. King we must fight to carry out his radical and bold vision for racial and economic justice in America and transform our national priorities. The struggle continues to this day, and our work is far from over. #MLKDay https://t.co/2HvceuTIbV"
1219263411596537856,2020-01-20 14:20:24,"""When machines and computers, profit motives and property rights are considered more important than people, the giant triplets of racism, materialism and militarism are incapable of being conquered.” -Dr. Martin Luther King, Jr., Riverside Church, 1967 https://t.co/izRzi65ln8"
1219021716636209152,2020-01-19 22:20:00,Our job: Demilitarize police departments so they do not look like oppressing armies. https://t.co/2x1kXnr7PI
1218979012632043520,2020-01-19 19:30:18,"-In the 1980s, 40% of Taiwan's population lacked health insurance
-Despite some skepticism, Taiwan implemented a single-payer health care system 
-2020: Everyone is covered. They pay about $12 for comprehensive care.

We can and must achieve Medicare for All in the United States. https://t.co/gk5A1A38b8"
1218923136600637440,2020-01-19 15:48:16,"How can it be that millions of people live in poverty while working full time in the world’s richest country for the world’s richest companies? How can we tolerate this? 

The answer is clear: pay every worker at least $15 an hour and let them unionize. https://t.co/uySwjwXi6E"
1218644229376872448,2020-01-18 21:20:00,Marijuana must be legalized. All our people imprisoned because of it must be returned home to their families and their records expunged.
1218566613512880128,2020-01-18 16:11:35,"I’m proud of my state, Vermont, for leading the nation in considering making free school meals universal for children.

In the richest country in the history of the world, “lunch debt” for hungry kids trying to learn at school should not exist. https://t.co/pGQ8EFKH1I"
1218273751575465985,2020-01-17 20:47:51,"Unreliable electricity and water, untreated wounds, vermin. These prison conditions are intolerable.

We lock up more people—disproportionately Black and brown—than any other country on Earth.

We need comprehensive prison reform as a matter of racial and social justice. https://t.co/rQxeFnGYIH"
1218230595710607363,2020-01-17 17:56:22,"Don't you feel grateful? The world’s most expensive drug is coming out—$2-3 million a pop.

$69 billion in annual profits were just not enough for Big Pharma.

BioMarin should lose its patent monopoly for this price-gouging. Under our legislation, it will. https://t.co/bXvykhDW17"
1218199340717629446,2020-01-17 15:52:10,"250 pages.

37,500 words.

Not a single damn mention of “climate change.”

Trump’s NAFTA is a giveaway to the fossil fuel industry.

I voted NO because the future of our planet is more important than the short-term profits of Exxon Mobil and Chevron. https://t.co/YgSZcigjjX"
1218175937260462080,2020-01-17 14:19:10,"Why will our agenda—living wages, a healthy planet, peace, health care, education and housing for all—succeed?

Because that is the agenda of the working class. The majority.

And when working people come together and fight for it, big-money interests don’t stand a chance."
1217851762671079425,2020-01-16 16:51:01,"My friend Senator Schumer is right. Trump's NAFTA does not even mention the words ""climate change""—the existential threat facing not only our country but the entire planet. https://t.co/TBGTJin64r"
1217847240410238977,2020-01-16 16:33:03,RT @DarrickHamilton: The average student debt for black college graduates 3 years after graduation exceed $50K. Yes Senator Sanders cancel…
1217831012304064512,2020-01-16 15:28:34,"Student debt cancellation will be fully paid for by a tax on Wall Street speculation—similar to what exists in dozens of other countries. 

The American people bailed out Wall Street, now it's Wall Street's turn to help America's working families. https://t.co/gd3TPjxH1a"
1217829441281384451,2020-01-16 15:22:19,Cancel it. Every penny. https://t.co/3IqFKPAR0z
1217801968246304768,2020-01-16 13:33:09,"It’s time we make the richest 1% pay their damn taxes and make safe, affordable housing a human right. https://t.co/fmzkEvjlaD"
1217628481246416901,2020-01-16 02:03:47,"I stand proudly with labor unions, environmental organizations and family farmers against Trump’s NAFTA 2.0.

In my view, we must rewrite our disastrous trade agreements to end the outsourcing of American jobs, combat climate change, and stop the destructive race to the bottom. https://t.co/A9HulGS7fG"
1217590944129863680,2020-01-15 23:34:37,"Congratulations to advocates in Richmond who won this ballot measure to restrict coal exports. I stand with the communities who are fighting fossil fuel CEOs every step of the way.

Our job: Break our addiction to fossil fuels and create millions of family-sustaining clean jobs. https://t.co/VcrI16isyF"
1217514874781171712,2020-01-15 18:32:21,Trump’s deal with China won't fix a failed trade policy that has destroyed 3.7 million U.S. jobs. I am proud to have voted against the disastrous 2000 China trade agreement. We need a trade policy that stops giant corporations from shipping jobs overseas and polluting our planet. https://t.co/40ubMz4y8i
1217508141530861571,2020-01-15 18:05:35,"It is outrageous that the President’s personal lawyers appear to have directed the surveillance of a U.S. ambassador.

This must be fully investigated as the Senate conducts the impeachment trial. We have a responsibility to hold this lawless administration to account. https://t.co/nY3ykuKdiZ"
1217458384598904832,2020-01-15 14:47:52,"Weeks have passed since the House passed legislation to lower prescription drug prices, but Mr. Trump has already promised to veto it.
 
He never had the guts to stand up to his billionaire friends and Big Pharma, whose greed is killing Americans. https://t.co/Q9dyCrcoKG"
1217218533224042502,2020-01-14 22:54:47,"At a time when there are so many vulnerable seniors out there whose entire income is Social Security, we cannot tolerate any cuts.

No senior should live in poverty. We must expand Social Security so every American can retire with the dignity and the respect they deserve."
1217203430151933954,2020-01-14 21:54:46,"No successful effort to end war happened without massive grassroots pressure. If enough ordinary people get engaged in the political process, we can change the course of history. https://t.co/9TiR7eCzIE"
1217183700200366082,2020-01-14 20:36:22,"BlackRock, the largest Wall Street investment firm in the world, says today that it will focus on environmental sustainability.

It can start by ending its investments in destroying the Amazon rainforest. Funding the slashing and burning of our planet's lungs is a disgrace. https://t.co/4pnAg6pIdT"
1217171576757608448,2020-01-14 19:48:12,"I cannot, for the life of me, begin to understand the cruelty of a president who—just two years after passing a $1.5 trillion tax giveaway to the rich—is now cutting food assistance to 700,000 hungry people.

We have all the resources we need to eradicate hunger in America. https://t.co/tDFGWoTMPu"
1217147106043072512,2020-01-14 18:10:58,"As I said at the time, it was shameful to give Trump a huge Pentagon budget without putting real limits on his abuse of power.
 
Now he's unconstitutionally diverting $7 billion to build his border wall.

When will Congress finally have the guts to rein in this lawless president? https://t.co/7av8JNWPi0"
1217115341287051264,2020-01-14 16:04:44,"Don't tell me the United States cannot implement a Medicare for All system to guarantee health care to every man, woman and child.

If every other major country can do it, then surely so can we. https://t.co/mPJNvUMFV5"
1216889099296047105,2020-01-14 01:05:44,"Both @RepRoKhanna and I got involved in politics as young people because of our shared opposition to unjust war.

We cannot let this generation experience horrors akin to Vietnam or Iraq. This is how we stop a war with Iran: https://t.co/mYIDVI74y2"
1216842771824357379,2020-01-13 22:01:39,"@NydiaVelazquez @AOC El pueblo de Puerto Rico ha sufrido los golpes de huracanes y terremotos. Necesitan ayuda humanitaria ya.

@NydiaVelazquez, @AOC y yo instamos a Trump: haga su trabajo. Provea los fondos de desastre que el Congreso ya aprobó. https://t.co/mWizsoGdzg"
1216840811494555648,2020-01-13 21:53:51,"The people of Puerto Rico have been battered by hurricanes and earthquakes. They need humanitarian assistance now.
 
@NydiaVelazquez, @AOC and I say to Trump: Do your job and release the $18 billion in disaster funding that Congress already approved. https://t.co/7UFWKcY3Ih"
1216770643259203587,2020-01-13 17:15:02,"Big banks know fossil fuels cause climate change.
 
But JPMorgan Chase, Bank of America, Wells Fargo and Citibank are still trying to profit off the product that is destroying our planet.

To stop climate change, we have to stand up to Wall Street. https://t.co/CZURgVHi9D"
1216720212994805762,2020-01-13 13:54:39,"Fatal shootings by police in 2018:

🇮🇸-0
🇫🇮-3
🇸🇪-6
🇫🇷-26
🇨🇦-36
🇺🇸-992

Imagine: Walter Scott—and so many others—would be alive today if we had the major criminal justice reform we need in this country."
1216489008601161728,2020-01-12 22:35:55,"Just as we were led into Vietnam and Iraq by lies, Donald Trump is misleading us on Iran. I will do everything that I can as a United States Senator to prevent such a war. https://t.co/zRvUwQIUNZ"
1216414537206976517,2020-01-12 17:40:00,"What do I mean by a rigged economy? Here's what the past decade looked like:

Wages of the top 1%: 📈+19%
$620,000 to $740,000 a year

Median wage: 🏊🏼‍+2%
$18.40 to $18.80 an hour

Minimum wage:📉-17% 
$8.70 to $7.25 an hour

It's time to put working people first instead of last."
1216372793639567361,2020-01-12 14:54:07,"A 1.5-million-acre “megafire” is threatening Australia.

Indonesia is dealing with deadly floods.

We cannot keep avoiding the fact that climate change is our existential challenge as a global community.

Let’s get on with the work of saving our planet. https://t.co/DePHxWW4tS"
1216155282230915072,2020-01-12 00:29:49,"This House Republican voted to stop Trump from illegally taking us to war with Iran.
 
Standing up for the Constitution is not a partisan issue. Congress must always vote on whether to send our young men and women to war. https://t.co/3FGIw0ks8f"
1216034656518320133,2020-01-11 16:30:29,"I am proud to partner with Republican Senator Mike Lee to pass our No War Against Iran Act. 

Defending the Constitution is not a partisan issue.

We will do everything in our power to build bipartisan majorities in Congress to prevent this war. https://t.co/XbcENjyNHY"
1216017718547304448,2020-01-11 15:23:11,"Raising the minimum wage by $1 could’ve prevented thousands of suicides a year.

We will end the 40-year assault on the working class and the suffering it has caused for our people.

Every job in America must pay a living wage of at least $15 an hour. https://t.co/3COjgSKePY"
1215804416391090176,2020-01-11 01:15:36,"We must stand shoulder to shoulder with the Muslim community. Trump's travel ban has never been about keeping America safe—just look at the president's own word. It has always been a racist attempt to ban Muslims from entering the United States, which cannot be allowed to stand. https://t.co/gBcJEEKccT"
1215741744966512640,2020-01-10 21:06:34,"Our bipartisan effort to end unauthorized military actions in Yemen passed the House and Senate. Trump vetoed it.
 
The result? He’s carrying out illegal assassination attempts in Yemen. Congress has got to stand up to this lawless president. https://t.co/BzvxkuarEa"
1215653843645730816,2020-01-10 15:17:16,"Over the past 50 years:

⬆️ Real wages for the top 1% tripled
🔝 The top 0.1% saw wages grow 450%
📉 Pay for minimum-wage workers fell by 30%

The solution is clear: End the obscene profiteering, and make all jobs pay a living wage of at least $15."
1215421505326194688,2020-01-09 23:54:02,"My colleagues and I are tired of endless wars. That is why we introduced the No War Against Iran Act. We must learn from our mistakes, not repeat them. https://t.co/S6d7CILsMj"
1215392526322012161,2020-01-09 21:58:53,"The president is lying. He rolled back the Clean Power Plan, which will cause more deaths from air pollution.

He allowed more coal ash to contaminate our water with mercury and arsenic.

We must defeat his agenda to protect our health and environment. https://t.co/EZcGQ594Jo"
1215385978464079885,2020-01-09 21:32:52,"About 900,000 people in Puerto Rico are still without power. It is well past time to build a 100% sustainable, decentralized, resilient power grid in Puerto Rico—instead of depending on outdated fossil fuel power plants that repeatedly plunge Puerto Rico into darkness. https://t.co/hLMk9q1EkR"
1215350989995245568,2020-01-09 19:13:50,"RT @SenatorLeahy: It’s is our job – it is our responsibility – to debate and vote, especially when it involves war and peace and the lives…"
1215350879597092864,2020-01-09 19:13:24,"It is unbelievable that in the richest country on earth, community groups collect donations to pay off the lunch debt of elementary school kids.

Here's a radical idea: every child in America has the right to eat free nutritious meals at school every day. https://t.co/Da8GvOhFXz"
1215315172425916416,2020-01-09 16:51:31,Now is the time for Congress to once again come together and make certain that the president will not have one penny to spend on a war in Iran unless there is Congressional authorization. #NoWarWithIran
1215315171012501504,2020-01-09 16:51:30,Our Founding Fathers understood that it was only too easy for a president to lead the country into a disastrous military conflict. That is why they gave the exclusive power over war and peace to the people’s elected representatives.
1215315169980698624,2020-01-09 16:51:30,I will do everything that I can as a United States Senator to prevent such a war.
1215315168994963456,2020-01-09 16:51:30,"Let’s be clear: another war in the Middle East could cost countless lives and trillions more dollars and lead to even more deaths, more conflict, more displacement in that already highly volatile region of the world."
1215315168013496325,2020-01-09 16:51:30,"The Iraq war led to the deaths of 4,500 U.S. troops, and the wounding of tens of thousands. It led to the deaths of hundreds of thousands of Iraqis, and the displacement of over 5 million people.

And after all that, the Iraqi parliament voted last week to boot U.S. forces out."
1215315166604251140,2020-01-09 16:51:29,"In terms of Iraq, we were told that Saddam Hussein had weapons of mass destruction, that he was working with Al Qaeda, and that we needed to invade Iraq unless we wanted to see another 9/11, or even worse, a nuclear attack.

Those claims were lies."
1215315165090144264,2020-01-09 16:51:29,"The result: the war in Vietnam cost us 59,000 American deaths and many others who came home wounded in body and spirit. In fact, a whole generation was devastated by that war. The casualties in Vietnam, Laos, and Cambodia are almost incalculable."
1215315163169116161,2020-01-09 16:51:29,"When I look back upon American history I remember the two most significant foreign policy mistakes our country made in the modern era, and those are the war in Vietnam and the war in Iraq. And let us be clear, we were led into both of those wars by a series of lies."
1215309147169751043,2020-01-09 16:27:34,"RT @RepJayapal: Proud to join @SenSanders, @RepRoKhanna, @RepBarbaraLee &amp; other colleagues to call on Congress to pass the #NoWarWithIran A…"
1215309139104215043,2020-01-09 16:27:32,RT @RepBarbaraLee: LIVE: I’m with my colleagues @SenSanders and @RepRoKhanna to demand Congressional action to #StopTrumpsWar and say #NoWa…
1215307918637240320,2020-01-09 16:22:41,"I am proud to stand with my colleagues today to reassert our constitutional authority and introduce legislation—the No War Against Iran Act—to stop President Trump from leading this country into an illegal war against Iran.

The American people are sick and tired of endless wars. https://t.co/WS45iWjOa9"
1215286969682612225,2020-01-09 14:59:27,"RT @ChrisVanHollen: Here’s the unclassified version of what Trump sent Congress after the hit on Suleimani. 

From all we’ve seen, includin…"
1214974316971995138,2020-01-08 18:17:04,"American families are paying an $8,000 tax because of the greed of the health care industry. Don't take it from me. Take it from these economists.

Medicare for All means huge savings for working people and guaranteed health care for all. https://t.co/2DQzsBalRb"
1214940266915860482,2020-01-08 16:01:46,"The American people do not want war with Iran. They want to invest in health care, education, housing, and good jobs.
 
Congress cannot stand by. It must act now to pass our legislation to uphold the Constitution and prevent Trump from spending trillions more on endless war."
1214899487417753600,2020-01-08 13:19:44,"Trump said he wouldn’t cut Social Security. He lied. He is working to stop Americans from getting the benefits they paid for and need.

No, Mr. President: We will not let you cut Social Security. We will fight to expand it. https://t.co/3lhciX5T3E"
1214667939368099840,2020-01-07 21:59:38,"The Trump administration doesn't have a clue about what it is doing, but is creating a very dangerous world scenario. Let us never forget that the Constitution, which some of us actually believe and respect, says Congress has the responsibility for making war, not the President. https://t.co/tArdP5sICS"
1214639927381630977,2020-01-07 20:08:20,"States and cities handed out free cash to huge corporations but saw no new economic growth.
 
Trickle-down economics was a success. Congratulations to the millionaires and billionaires who made out like bandits. You guys won.
https://t.co/htjXeQbTcC"
1214612324599898113,2020-01-07 18:18:39,"Cost of having a baby with health insurance today: $4,500
Cost of having a baby under Medicare for All: $0

We can afford Medicare for All. What we can't afford is continuing to charging families in the U.S. more than any other country for giving birth. https://t.co/tERi0DUL7h"
1214580578881822720,2020-01-07 16:12:30,"La administración Trump le ha fallado al pueblo de Puerto Rico. Puerto Rico aún se está reconstruyendo a partir del huracán María, que azotó la isla hace dos años. Ahora Puerto Rico sufre apagones después de este terremoto. Debemos hacer todo lo posible para ayudar a reconstruir."
1214577996398497793,2020-01-07 16:02:14,"The Trump administration has failed the people of Puerto Rico. The island is still rebuilding from Hurricane Maria, which struck the island two years ago. Now Puerto Rico is suffering blackouts after a devastating earthquake. We must do everything we can to help rebuild. https://t.co/jnaZ6b0BXq"
1214539185270464523,2020-01-07 13:28:01,The greed of corporate executives and the billionaire class is destroying this country and whether they like it or not we are going to stop that greed. https://t.co/XY8sXa872E
1214320062984794115,2020-01-06 22:57:18,"To my mind, the mistake was invading Iraq. https://t.co/Dh1q8RUayb"
1214308530183983110,2020-01-06 22:11:29,"Amazon's workers are speaking out to say: Jeff Bezos should not be in the business of fossil fuel extraction.

The company’s response? Retaliate with threats of firing.

I stand with these employees who are fighting to protect the only home we have. https://t.co/bvgsEH7nHj"
1214288804682633218,2020-01-06 20:53:06,"Here is my question for Trump: what are you afraid of?

If you are not guilty of abuse of power, you should welcome testimony from your former national security advisor and other witnesses.

If you did nothing wrong, then join me in calling for a full and fair impeachment trial. https://t.co/geMJ1TExA1"
1214236334568681472,2020-01-06 17:24:36,"We face urgent needs to rebuild our infrastructure, build affordable housing, and address the existential crisis of climate change. 

Congress must stand up and say no: We are not giving you a nickel to wage unauthorized war on Iran. We as a nation must get our priorities right. https://t.co/4bzG7Ccrhl"
1214183813611425793,2020-01-06 13:55:54,Child care should not cost parents more than sending their kids to college. We need a revolution in child care in this country. https://t.co/Go0N7uHGgR
1213978369731244032,2020-01-06 00:19:32,"RT @SenSchumer: President Trump seems hell bent on starting another endless war in the Middle East.

He does not have the authority to do s…"
1213931574850400256,2020-01-05 21:13:35,Congress must reassert its constitutional responsibility over war. The Senate and House must vote to immediately defund unauthorized military action against Iran.
1213918330496659456,2020-01-05 20:20:58,"As GDP grew over the past ten years, the minimum wage declined in real dollars, from $8.70 to $7.25.

This is a disgrace. Working people were cheated out of billions.

We must double the minimum wage to $15 an hour and give 40 million workers a raise—as a matter of justice."
1213565126068121600,2020-01-04 20:57:27,"I voted against the Iraq War and helped lead the effort against it. As a caring nation, we must do everything we can to prevent the horrible suffering that a war will cause. War must be the last recourse in international relations—not the first. https://t.co/pnG43e4mKH"
1213496028403568646,2020-01-04 16:22:53,"Not on our watch. Abortion is a constitutional right—period. To the hypocritical Republicans who claim to love ""small government"": No, we will not let you take away women's constitutional right to control their own bodies. https://t.co/AVU8WN5hW4"
1213467958414106624,2020-01-04 14:31:21,RT @RepRoKhanna: The first thing Congress should do when we get back to Washington next week is pass Sen. Sanders and my bill to block fund…
1213257221045403648,2020-01-04 00:33:57,"I am introducing a bill with Rep. Khanna to stop Donald Trump from illegally taking us to war against Iran.

It's working-class kids who will have to fight and die in a disastrous new Middle East conflict—not the children of billionaires. https://t.co/H6ZHjijCnj"
1213184403796561920,2020-01-03 19:44:36,"Pharmaceutical corporate greed is literally killing people who cannot afford their medication. Together, we can change that. https://t.co/neX2RjhdwA"
