id,created_at,text
1247351716628045824,2020-04-07 02:33:18,These resources are going directly to our counties and to support housing programs for those in need. https://t.co/vjnrJy1sTX
1247351715566944258,2020-04-07 02:33:18,"The recent passage of the CARES Act provided critical assistance for individuals, businesses, and essential services, and we are starting to see these resources delivered to Hawai‘i."
1247038543752388611,2020-04-06 05:48:52,"On #NationalGoForBrokeDay, we remember the spirit + sacrifice of the 442nd on the day the unit’s first Medal of Honor recipient, PFC Sadao Munemori, was killed 75 years ago. We are inspired by the Aloha they embodied &amp; confront hatred &amp; bigotry with courage, love, &amp; respect."
1246531916783902727,2020-04-04 20:15:43,"There is a shortage of blood donations on O‘ahu. Residents can leave their homes to donate blood, and the Blood Bank of Hawai‘i has created a safe donation environment to collect the necessary blood to sustain our community. Learn more: https://t.co/wkginAgcjx"
1246244441045819402,2020-04-04 01:13:23,"I am working with leaders in Congress to make sure Hawai‘i’s farmers, rural communities, and homeowners are secure through this crisis, families and workers can afford to put food on the table, and that we stand against the anti-Asian bigotry surrounding this pandemic."
1246244436398481408,2020-04-04 01:13:22,The coronavirus crisis is impacting us and our communities in ways we could not imagine. https://t.co/i9Wb8jrCsz
1246151741000818688,2020-04-03 19:05:02,"As a fellow Soldier in the National Guard, I am grateful for all of my brothers and sisters in the National Guard who are mobilizing across the country to serve! I stand ready to serve should the Hawaii National Guard be activated."
1245871211713662976,2020-04-03 00:30:18,"For years, I have pushed for paper ballots to ensure our elections are secure. In this coronavirus pandemic, it’s even more important that we quickly transition to a mail-in paper ballot, which would allow more people to vote &amp; protect their health &amp; the security of their vote."
1245787775212888064,2020-04-02 18:58:45,"Thank you for tuning in to my telephone town hall with Dr. Scott Miscovich to discuss the COVID-19 coronavirus crisis yesterday. If you missed it, you can listen online or watch on Facebook: https://t.co/xsWzSSiUUr"
1245518096925962240,2020-04-02 01:07:09,"Today is Census Day! Fill out the census safely from your home by mail, phone, or online. Counting everyone is critical, as it will determine the public health funding that our community gets for the next decade - so important right now. Learn more: https://t.co/gvJlFyL07p"
1245392796737048578,2020-04-01 16:49:15,"Join me for a live telephone town hall TODAY 4–5pm HST to talk about the national and state response to the coronavirus. Looking forward to speaking with you, sharing the latest &amp; answering your questions. Call (888) 476-4187 at 4pm to participate. Aloha.
https://t.co/E4kWY8KNTH"
1244012089263271936,2020-03-28 21:22:49,"RT @StarAdvertiser: Waikiki bartender with coronavirus on life support in Kaiser Moanalua hospital https://t.co/5AbpGzCr1I 

#coronavirus #…"
1242765270764204032,2020-03-25 10:48:24,"Join me for a telephone town hall TODAY 4–5pm HST to talk about Hawaiʻi’s healthcare system + help for businesses during this crisis. Looking forward to speaking w/ you, sharing the latest + answering your Qs. Call (888) 476-4187 to participate. Aloha. https://t.co/9y7GnjgwL7"
1242279328785686528,2020-03-24 02:37:27,"Join me for a telephone town hall on Wed 3/25 4–5p HST to talk about Hawaiʻi’s healthcare system during the coronavirus crisis. Looking forward to speaking with you, sharing the latest + answering your questions. Call (888) 476-4187 to participate. Aloha. https://t.co/9y7Gnjy7CF"
1241484779809374212,2020-03-21 22:00:11,"While @GovHawaii does not have the power to suspend flights, I’m calling on the Governor to immediately institute a mandatory 14-day self-quarantine of anyone who travels to Hawaiʻi. https://t.co/CxC19QkZj4"
1240633919013154817,2020-03-19 13:39:10,"RT @Reuters: The first coronavirus case in the U.S. and South Korea was detected on the same day. By late January, Seoul had medical compan…"
1240100032881164288,2020-03-18 02:17:42,"Join me + @LtGovJoshGreen for a live telephone town hall tomorrow, 3/18 from 4–5pm HST to talk about the local + national response to the coronavirus. We look forward to speaking directly with you + sharing the latest information. Call (888) 476-4187 to participate. Aloha."
1238713168047685632,2020-03-14 06:26:48,"Tonight, I voted to pass the Families First Coronavirus Response Act. In the midst of the coronavirus pandemic, this emergency funding package will begin to provide relief to working Americans and their families across the country so they can focus on their health and well-being."
1238256428873388033,2020-03-13 00:11:52,"I’ve introduced a resolution that prioritizes people so our economic relief is placed directly into the hands of every American, rather than getting stuck in bureaucracy or ending up in the pockets of big corporations."
1238256428235788289,2020-03-13 00:11:52,"Instead, we must act swiftly to provide a temporary universal basic payment of $1,000 per month to every American adult to help them weather the storm created by this crisis. Taking care of all Americans will stimulate our economy during this downturn."
1238256427455729665,2020-03-13 00:11:52,"The coronavirus pandemic has created a threat to the health and well-being of the American people, as well as to our country’s economic stability. While some in Washington are focused on taking care of Wall Street, everyday Americans get left behind. That’s wrong."
1238256426709024770,2020-03-13 00:11:52,"Today, I introduced a resolution that provides for a universal basic payment to help Americans across the country weather the storm caused by the COVID-19 coronavirus pandemic.
https://t.co/wag9KimCND"
1238114559845687301,2020-03-12 14:48:08,The letter also urged the Administration to work with Congress to provide economic relief to all affected passengers.
1238114558709043206,2020-03-12 14:48:08,I sent a letter to Pres. Trump calling for a temporary suspension of cruise line operations nationwide until there are proper procedures available to ensure that all people can be tested for COVID-19 &amp; cleared before boarding or disembarking cruise ships. https://t.co/EVuCxPnXYJ
1237874428358217728,2020-03-11 22:53:56,"When President Trump committed an illegal and unconstitutional act of war against Iran, he undermined both our national security and our Constitution. This vote today is on behalf of the American people and the Constitution of the United States."
1237874426646917120,2020-03-11 22:53:56,Our nation’s founders endowed Congress with the grave responsibility of deciding whether or not to declare war. They recognized how dangerous it would be for one individual to be endowed with the unilateral power to start a war.
1237874424742678534,2020-03-11 22:53:56,"Today, I voted to pass legislation that demands the end of military action against Iran without Congressional authorization and reasserts the Constitutional authority of Congress to declare war.
https://t.co/OkbVIu84cj"
1237111635031887872,2020-03-09 20:22:52,Attention high school artists: the 2020 Kaha Kiʻi Congressional Art Competition is now open! The competition is open to all high school students in Hawaiʻi's 2nd Congressional District. The deadline is Fri 4/3 at 6pm. We can't wait to see your creativity! https://t.co/NfcXHQVzdz
1235379221318467589,2020-03-05 01:38:53,"While more must be done, it’s essential that we stand together as Americans to defeat the threat of this virus. The Senate must quickly act to pass this bill to ensure these resources get to those who need them to ensure the safety and well-being of the American people."
1235379220626526214,2020-03-05 01:38:53,"It will fund the ability to ensure the availability of testing wherever needed, masks &amp; hygiene tools for healthcare professionals, nursing homes, &amp; first responders as well as expanding tele-health services to prevent the spread of this virus."
1235379219808636929,2020-03-05 01:38:52,"Today, I voted for legislation that will provide emergency funds to address the coronavirus, which passed with a strong show of bipartisan support. This funding is extremely important to Hawai‘i &amp; states across the country. https://t.co/lwjOHPDnSE"
1232825228318978050,2020-02-27 00:30:13,"This left states like Hawai'i, home to over 16,000 FAS migrants, forced to try to cover the gap of this unfunded Federal mandate. The Federal Government should live up to the spirit of the Compact of Free Association and fix this mistake."
1232825227647836163,2020-02-27 00:30:13,"Nearly 40,000 FAS migrants reside across the United States.  Due to an error in the text of a 1996 law, access promised to the FAS migrants by the federal government to vital programs like Medicaid, school, and child nutrition programs were stripped."
1232825226834124800,2020-02-27 00:30:13,"Last week, I introduced H.R. 5950, the FAS School Meals Improvement Act. https://t.co/UaGQjbQ27X"
1232798120267960321,2020-02-26 22:42:30,"Unfortunately, there are still hate crimes being committed, like the shooting of peaceful parishioners at a Bible study at the Mother Emanuel African Methodist Episcopal Church in Charleston, and the violence in Charlottesville."
1232798119588454400,2020-02-26 22:42:30,"Lynching is not only about murder, but also about sowing fear and stoking the flames of hatred and bigotry."
1232798118787342336,2020-02-26 22:42:30,"I was humbled to cast my vote today, over 100 years since the first anti-lynching bill was introduced in Congress, joining nearly all Members of Congress, standing together to pass H.R.35, the Emmett Till Antilynching Act. https://t.co/02UqEumojn"
1223274588336947200,2020-01-31 15:59:23,We must look at creative solutions that will ensure our veterans get the VIP treatment they deserve. This bill will explore an innovative way to provide the experienced leadership to help improve the care of our brothers and sisters who’ve served.
1223274587271680000,2020-01-31 15:59:23,Veterans in Hawai'i and across the country are still struggling to get the benefits they’ve earned through their service and sacrifice.
1223274586072023040,2020-01-31 15:59:23,"Yesterday, I introduced a bipartisan bill with Rep. Brian Mast (FL). Our veterans deserve the best care and service that our nation can provide. Unfortunately, that’s not what we have today.
https://t.co/xOilXjEHnN"
1223124964934443009,2020-01-31 06:04:50,"Today, we honor civil rights activist Fred Korematsu, who fought against the internment of Japanese Americans during WWII. His bravery in the face of injustice – standing up to what he knew was wrong, taking his case to the Supreme Court – inspires those fighting injustice today. https://t.co/1fNZjsMZ5T"
1223023457191038976,2020-01-30 23:21:29,We also took action to repeal the 2002 AUMF against Iraq so it can no longer be perverted &amp; misused as an excuse to wage more wasteful regime change wars that do not make us any safer. We are not at war with Iraq. This outdated AUMF is a relic of the past &amp; must be repealed now.
1223023456360464386,2020-01-30 23:21:29,Our legislation today would stop President Trump from waging yet another unconstitutional and illegal war against Iran by prohibiting the use of funding for such a war without Congressional authorization.
1223023455458807809,2020-01-30 23:21:29,Our nation’s founders understood the danger of placing the decision to go to war in the hands of one individual — which is why they made sure our Constitution provided that responsibility to Congress.
1223023454540238850,2020-01-30 23:21:28,"Congress is taking back its Constitutional authority in another step towards ending Presidential wars. As a soldier and veteran of two Middle East deployments, I’ve seen the cost of war and who pays the price."
1223023453588148227,2020-01-30 23:21:28,"Today, I voted to pass legislation that would prevent the U.S. from going to war with Iran without Congressional authorization, as well as repeal the 2002 Authorization for the Use of Military Force (AUMF) in Iraq.
https://t.co/Z0xtlFWpEX"
1220111521503727622,2020-01-22 22:30:29,"Today marks the 75th anniversary of the liberation of Auschwitz. I'll #neverforget my visit there and the horrors committed at that concentration camp. We must remember the past and stand firmly against hatred, antisemitism, and religious bigotry."
1219704916115173377,2020-01-21 19:34:47,"I introduced H.R.5612, the Small Business &amp; Community Investments Expansion Act to boost the ability of local financial institutions to provide entrepreneurs, farmers and families with the resources that will help strengthen communities across the nation.
https://t.co/himdK1HQrH"
1219704915188166658,2020-01-21 19:34:47,Community financial institutions and credit unions reach underserved communities across the country. Small businesses and farmers are the backbone of our nation and vital to America’s economic well-being.
1219293724418674692,2020-01-20 16:20:51,"""Through violence you may murder a hater, but you can't murder hate through violence. Darkness cannot put out darkness; only light can do that.""
https://t.co/Ah9LpatoqH"
1219293723261132801,2020-01-20 16:20:51,"The Rev. Martin Luther King, Jr. embodied the spirit of aloha. What binds us together is greater than what tears us apart and we must overcome prejudice to do so. Among our own communities and as we engage others in the world, we must remember his words:"
1219099889025466368,2020-01-20 03:30:37,"While we all mourn the heartbreaking loss of two of Honolulu’s finest, their fellow first responders are still out there. Our prayers are with the families of the officers we lost, and with first responders still working to keep our communities safe."
1215777850629947398,2020-01-10 23:30:02,The harmful effects are felt in our veteran and military family community — many of whom were exposed to the chemicals that were used at military installations.
1215777848599949313,2020-01-10 23:30:01,"PFAS contamination sites blanket the map, affecting almost every state and PFAS chemicals have been implicated in cancer and other illnesses."
1215777847157182464,2020-01-10 23:30:01,"Every American in every community across our country deserves clean water. That is why I voted for and strongly support the passage of the PFAS Action Act today.
https://t.co/fTWNpWJ5vD"
1215532260532731904,2020-01-10 07:14:09,"RT @DemCloakroom: At 10:00 pm the House is now adjourned. 

The House will convene tomorrow, January 10th at 9:00 am for legislative busine…"
1215457656909025282,2020-01-10 02:17:42,"Number two, our troops in Iraq are no longer focusing on preventing a resurgence of ISIS and Al-Qaeda, instead all of their efforts are now focused on Iranian forces and Iranian-backed Shia militias."
1215457655998775296,2020-01-10 02:17:41,"In doing so, he has undermined our national security in two critical ways. Number one, Iran is no longer complying with the Iran Nuclear Agreement and is quickly speeding forward in developing their nuclear weapons capability, putting us and the world at greater risk."
1215457654614691842,2020-01-10 02:17:41,"President Trump has committed an illegal and unconstitutional act of war, pushing our nation headlong into a war with Iran without any authorization from Congress — a war so devastating and costly it would make our wars in Iraq and Afghanistan look like a picnic."
1215457653519978497,2020-01-10 02:17:41,"Today, I voted to pass H.Con.Res.83, a war powers resolution demanding the end of military action against Iran without Congressional authorization.
https://t.co/G0EnHmmV1A"
1213261248432934913,2020-01-04 00:49:57,"I urge Congress to pass H.Res.411, the No More Presidential Wars resolution, to restore Constitutional balance and ensure Congress fulfills its responsibility to determine whether or not to declare war.  https://t.co/2j1JKs7AUC"
1213261247107522563,2020-01-04 00:49:57,"Trump’s action will drag us deeper into war with Iran that will be far more costly and devastating than the wars in Iraq, Syria or Afghanistan. We must get our troops out of Iraq and Syria now."
1213261245790539776,2020-01-04 00:49:56,The president committed an act of war without authorization from Congress. It is a fundamental violation of the Constitution.
